id,book,book_slug,title,source_ids,source_file,source_lines,char_count,story_text
ZNRYJ001,郑南榕研究,zheng_nanrong_yanjiu,胡适不看雷震也要勇气,001#P72,001.党外·党内·性.txt,143-143,106,有一次邓维桢谈到当年雷震坐牢的时候，胡适不去看雷震，有人说胡适没有勇气。邓维桢讲了一句话很有道理，他说不去看雷震，也要勇气，因为不去看雷震，那么多朋友会不谅解，而胡适无法一一解释。这就需要忍耐这种误解、需要勇气。
ZNRYJ002,郑南榕研究,zheng_nanrong_yanjiu,甘地从律师席坐到被告席,004#P35,004.给林正杰先生的公开信.txt,69-69,171,甘地当年在南非的时候，他在印度侨民争取人权的斗争里，一开始只是“第三种人”、只是为战士们辩护的律师，但是他终于以做“第三种人”为耻、以做一名辩护人为耻，他终于亲自投入了，自“第三种人”变为“同志”。当法院开庭时候，他不在律师席上而在被告席上，看到其他律师同僚，最初有点难为情，但随即想到“做一个政治犯，远比做一个律师光荣得多”，就勇往直前了。
ZNRYJ003,郑南榕研究,zheng_nanrong_yanjiu,胡适不回叶青批判,006#P4,006.千呼万唤“屎”出来.txt,7-7,355,1958年，胡适从美国回来，约我在钱思亮家聊天，我提到任卓宣（叶青）批评他的书《胡适批判》，他说：“二十多年前叶青写完了这部书，寄了一套给我，要我答复，我本来写好了一封信答他，后来一想：叶青在书里说我不必盖棺，论就定了，在他眼中，我已是死掉的人了，死人还能说什么呢？所以我一直没有理他。”任卓宣从做共产党时候就批胡，一直批呀批的，批到他变节当了国民党，还是照批不误。可见这种人，他的目的就是要靠批你成名，为批你而批你，动机既然如此，你怎么答复，都没用的，都是白费笔墨。胡适是高杆之人，他很早就看到这一症结所在，所以他“总是不理他们”。他最喜欢的一句话是：“You can't beat something with nothing. ”他说：“只要我们有东西，不怕人家拿‘没有东西’来打我们。”这是何等大气派！
ZNRYJ004,郑南榕研究,zheng_nanrong_yanjiu,萧伯纳代赫里斯骂完自己,006#P13,006.千呼万唤“屎”出来.txt,25-25,57,我说赫里斯所写《萧伯纳传》臭萧伯纳，没写完自己就先死了，萧伯纳乃提笔代他续完，照着赫里斯的规格，代他把萧伯纳骂完。
ZNRYJ005,郑南榕研究,zheng_nanrong_yanjiu,郑南榕满屋人头备杂志,008#P9,008.你叫我的魂，我夺你的魄.txt,17-17,398,在抵抗国民党压迫言论自由的战斗中，郑南榕是在“鬼名字”上面，最深谋远虑并且准备充分的人。在《自由时代》创刊之初，他就广猎人头，一个个登记出新杂志，作为备胎，准备跟国民党大干一场，他摆下阵势，先后由林世煜登记《自由时代》、由胡慧玲登记《先锋时代》、由颜锦福登记《民主时代》、由叶菊兰登记《开拓周刊》、由周伯伦登记《发展周刊》、由张贵木登记《发扬周刊》、由王镇辉登记《民主天地》、由曾台生（心仪）登记《人权时代》、由刘会云登记《人权天地》、由颜尹谟登记《自由天地》……把“自由”“民主”“人权”“时代”等等词汇，周而复始，排列组合不绝。杂志社满屋人头之下，不但弄得敌人国民党眼花缭乱，连我这忝为“总监”的同路人，也瞠目不知所答了。可好，就在郑南榕这种“魂不附一体”的书海战术下，国民党终于知难而退，不再徒以“叫魂”为得计了，虽然也偶尔来一次“呼名落马”，但是看到马后阴魂不散，自然知道再叫也是徒然矣！
ZNRYJ006,郑南榕研究,zheng_nanrong_yanjiu,江亢虎自认洪水猛兽,009#P2,009.怀念郑南榕.txt,3-3,66,清朝末年，江亢虎起而抗暴，清朝政府骂他洪水猛兽，江亢虎说，我姓江，江者，洪水也；我名亢虎，亢虎者，猛兽也。说我洪水猛兽，我真高兴呢！
ZNRYJ007,郑南榕研究,zheng_nanrong_yanjiu,郑南榕五一九后今晚再讨论,009#P19,009.怀念郑南榕.txt,37-37,184,“五一九”过后第二天，几家报纸做大幅度报导。有的党外人士5.19当天只来晃一下，却抢尽光彩，有的根本没来，也上了报端。有人向郑南榕挖苦道：“你看，两个月来你出钱又出力，结果呢，情况不稳时，大家互相推托，情况稳定，没事了，大家又争相抢功劳，以后啊，这种傻事少干为妙。”他愣了一阵，淡淡答道：“没关系，我们还要做下一个运动。”“难道不休息一阵子？”“不，今晚就开始讨论。”
ZNRYJ008,郑南榕研究,zheng_nanrong_yanjiu,罗福星为台湾赴死,024#P5;024#P6;024#P7,024.外省人做烈士.txt,9-9;11-11;13-13,510,"这个外省人被绞死的时候，只有二十八岁，一般记录是三十一岁。他是广东镇平人，十八岁随祖父来台湾，并在苗栗公学读书。四年后回广东家乡教书，又转赴新加坡做中华学校校长、印尼巴达维亚（雅加达）做中华学校校长。这些教育性职业，其实并不使他满足，他另外起劲干的，却是一波又一波的革命大业。
他在离开台湾返回故乡时，路过厦门，就秘密加入了中国同盟会，后来又参加了三二九黄花冈之役，幸免于难。辛亥革命成功后，他认为大陆的神州虽已光复，但是海外的神州，却在日本人统治下有待光复。因此他在1912年12月中，再度来台，这时候，他并不会说台湾话，但是本领高强的他，仍旧串连出一千五百多人的秘密团体，最后被台湾人告密、东窗事发时，有名或化名可稽者，就有四百多，其中被起诉的二百五十九人、不起诉的一百五十三人、被判死刑者六人。这个外省人临死前，坦然接受访问，他说：“我并非对我的死刑判决，感到不服。事至此，尚不服罪，非男子本色。古语云‘人一世，花一春’，大丈夫不为名，徒憧于浊世，何益之有。我生于忧患，死于安乐，以笑迎死者也。”他的最后遗言是：“不死于家乡，永为子孙纪念；而死于台湾，永为台民纪念耳。”
这个“永为台民纪念”的外省人，就是罗福星。"
