id,book,book_slug,title,source_ids,source_file,source_lines,char_count,story_text
JJCS001,蒋家臭史,jiang_jia_choushi,冯玉祥把控告呈文当作结婚礼物,002#P15,002.蒋夫人未婚夫小史.txt,29-29,218,当他任南京市长的时候，措施上很多人对他不满意的，一部分的中央要人，对他感情也很不好，尤其是那位布衣将军冯玉祥，对他极不满意。故当刘氏和上海某校皇后许淑珍结婚的时候，冯将军送他一束礼物，刘氏以为什么珍贵的东西，急忙打开来看，原来是一本厚厚的人民控告他的呈文。这种大杀风景的事情，真令我们的刘市长有气无处泄！但当时的冯玉祥是无人敢惹的，除此之外，还特地在刘新住宅的对面，造几间草房子，并扬言要惩戒他，因此，他不得不带了新夫人到北平去度蜜月。
JJCS002,蒋家臭史,jiang_jia_choushi,戴传贤用照片和镜子回答生父问题,011#P2,011.拥戴杂写.txt,3-3,124,今早报上，登出蒋纬国昨天讲演，被人问及到底他爸爸是蒋介石还是戴传贤时，他答得妙，他说他当年也对这问题好奇，“我不敢问姓蒋的，可以问姓戴的”。但是，“戴先生的答复很妙，他拿出一张蒋公的照片，也拿出一面镜子”。让蒋纬国自己决定“是像这边，还是像那边？”
JJCS003,蒋家臭史,jiang_jia_choushi,戴传贤劝人别谈男女问题,011#P6,011.拥戴杂写.txt,11-11,258,丁文渊又回忆：“我同戴先生也曾谈到男女问题。当时是我对一位党国元老，年高位尊，而极渔女色；另外还有一位省主席也是如此，他们因地位的关系，追求女性，不择手段，威逼利诱，在所不惜，所以我加以批评。戴先生听了不置可否，他只说：‘你要晓得，男女问题，最好不谈！因为男女问题，是生死关头！能撞过这一关头的人，实在没有多少。我不知你在这方面有若何经验，我本人确是已经撞过这一关了！所以关于男女问题，最好不谈。’他以后又说：‘要知现在因为男女问题，发生了许多纠纷，因此造成了许多孤儿寡妇，实在是悲惨得很的事，所以我不愿意说它！’”
JJCS004,蒋家臭史,jiang_jia_choushi,蒋纬国撞翻点心后赔礼,014#P26;014#P27,014.蒋纬国是东吴大学物理系毕业的吗？.txt,51-51;53-53,172,"在苏州读书时，有一次，他乘人力车上学，车夫不小心把一位老太太提篮内的点心撞翻，纬国立刻叫停车夫，跳下车，向老妈妈道歉，并拿出两元钱，要老妈妈另买点心回去，并问是否撞伤，如觉不适，下午请到“南园”来。
街上的人都认识蒋二公子，也知道姚氏心地慈善，都劝老妈妈下午去蒋家，定能得厚赐。下午，老妈妈真的上了门，哭诉被撞，姚氏亲自出门慰问，并送了二十元。"
JJCS005,蒋家臭史,jiang_jia_choushi,周亚夫被诬为死后在地下造反,020#P7,020.论将军“私藏军火”.txt,13-13,355,这段的大意是：过了不久，周亚夫将军的儿子代他父亲向专门替天子制作禁器的工官购买用来殉葬的盔甲矛楣五百件。一方面交货的期限逼得紧，一方面又赖账。工官知道他是盗买国家的禁器，一怒之下，告他叛变。这件事连累到周亚夫。汉景帝看到告发状，就交给狱吏办理。狱吏拿着簿书，在公堂上一条一条查问周亚夫罪状，周亚夫一句话也不回答。汉景帝骂周亚夫说：“我干脆不用你对簿公堂！”就命令他直接向廷尉报到，由廷尉治罪。廷尉问周亚夫说：“你想要造反吗？”周亚夫回答说：“我所买的器具乃是殉葬用的器具啊！怎说我要造反呢？”廷尉说：“你即使生前不在地上造反，死后也将在地下造反吧！”于是把他修理得更厉害。最初，狱吏捉周亚夫的时候，周亚夫就想自杀，他太太阻止了，所以没死，因此就下了廷尉治罪。他气得五天不吃饭，最后吐血而死，死后封国就给解除了。
