id,book,book_slug,title,source_ids,source_file,source_lines,char_count,story_text
MJDYJ001,民进党研究,minjindang_yanjiu,猫头鹰用奉承把蚱蜢骗到枝头吃掉,008#P2,008.蚱蜢必读.txt,3-3,235,《伊索寓言》里有一篇《蚱蜢与猫头鹰》，故事说，一只猫头鹰昼伏夜出，晚上活动，白天睡觉。可是来了一只蚱蜢，光天化日之下，在草地里唱个不停，吵得猫头鹰不能睡。猫头鹰要蚱蜢不要叫，蚱蜢不听。猫头鹰计上心来，说，反正听了你的歌声，我也睡不着了，你的歌声美妙如阿波罗（Apollo）的七弦琴，开怀之下，不如痛饮雅典娜（Pallas Athena）送我的酒吧，你就一起来喝吧。蚱蜢正唱得口渴，又被奉承之言弄得忘其所以，于是飞上枝头，跟猫头鹰相会。猫头鹰翻爪一扑，就把蚱蜢吃到嘴里了。
MJDYJ002,民进党研究,minjindang_yanjiu,羊祜给敌将陆抗送药，陆抗相信他不会下毒,008#P3,008.蚱蜢必读.txt,5-5,80,晋朝的羊祜（叔子）与陆抗对阵，陆抗生了病，羊祜派人送药过去，左右怕药中有毒，劝陆抗不要吃，陆抗说：“羊祜岂鸩人者！”（羊祜是正大光明的敌人，岂是拿毒药毒人的！）
MJDYJ003,民进党研究,minjindang_yanjiu,唐绍仪送红包减轻责骂，张伯熙未送而被骂死,023#P3,023.“你是半个王八蛋！”.txt,5-5,114,清朝邮传部刚成立时候，张伯熙做尚书、唐绍仪做侍郎，两人不和，被皇上处分要公开挨骂。唐绍仪偷送了红包，骂就放了水；张伯熙没送红包，就被顿足大骂了好一阵，最后饬以“混账王八蛋，滚下去！”张伯熙叩头而起，面无人色，归而疾作，一命呜呼。
MJDYJ004,民进党研究,minjindang_yanjiu,大臣只送一半红包，太监便骂他“半个王八蛋”,023#P3,023.“你是半个王八蛋！”.txt,5-5,110,当时红包的价码不低，是银四百两。有一次，一个大臣没有钱，只送了一半两百两，希望过关。两百两太监也笑纳了，不过在公开叫骂时，改为“你不是一个王八蛋，你是半个王八蛋”——封建帝王奴役臣下，最后演变，竟令人哭笑不得，一至于此！
MJDYJ005,民进党研究,minjindang_yanjiu,《人鉴及新官僚的嘴脸》记谭先生答称国民党没有派系,050#P4,050.民进党没有派系了吗？.txt,7-7,345,二十四年前，段宏俊主持自由太平洋文化事业公司，出版马五先生（雷啸岑）著《人鉴及新官僚的嘴脸》一书中，有回忆如下：民国十六年夏，国民党在南京实行清党反共后，谭先生亦由武汉到了南京，仍被推戴为国府主席。那时国民党人的革命精神尚未消散，南京市党部很郑重而认真地办理首都党员总登记，除填写表格外，还要举行口试，规定任何人皆不能例外，必须亲自到市党部大礼堂应试。谭先生按时前往受考如仪，而担任口试大员的尽是年轻小伙子，忘乎其形地开口就问道：“谭同志，你是在哪年哪月哪日入党的？介绍人是谁？党证号码是怎样的？”谭先生蔼然对答后，考试员又问：“你是左派，还是右派呢？”谭扬声答曰：“本党是没有派系的！”一时这市党部组织部长段锡朋在隔室听到谭先生的声音，急忙走出请“谭主席”进房里休息，才将尴尬场面终止了。
MJDYJ006,民进党研究,minjindang_yanjiu,盗跖说小偷也要守五种行规,058#P6,058.民进党的行规问题.txt,11-11,281,《庄子·胠箧篇》中有这样一段：“……故跖之徒，问于跖曰：‘盗亦有道乎？’跖曰：‘何适而无有道邪？夫妄意室中之藏，圣也；人先，勇也；出后，义也；知可否，知也；分均，仁也。五者不备而能成大盗者，天下未之有也。’”翻成白话是：“……盗跖的徒弟问盗跖说：‘做小偷也有行规吗？’盗跖答道：‘无论什么地方，哪里会没有行规呢？做小偷的，能先评估出哪家屋里有金银财宝，这就是圣；进到人家下手的时候，自己走在前头，这就是勇；得手以后出来，自己断后，这就是义；斟酌情况决定能不能下手，这就是智；所得赃物大家平分，这就是仁。如果这五样德行都不全，而能成为小偷大王的，天下是没有的。’”
