id,book,book_slug,title,source_ids,source_file,source_lines,char_count,story_text
LAMCRJ001,李敖秘藏日记,li_ao_micang_riji,吕端劝太宗留李继迁母,LAMCRJ_001_81,001.软禁残记.txt,161-161,318,十四、临睡前，得宋时一故事，可为齐伯之言做一注脚：“李继迁扰西鄙，保安军奏获其母，太宗欲诛之。以寇准居枢密，独召与谋。准退，过相幕，吕端（此大事不糊涂者也）谓准曰：‘上戒子勿言于端乎？’准曰：‘否。’告之故。端曰：‘何以处之？’准曰：‘欲斩于保安军北门外，以戒凶逆。’端曰：‘必若此，非人之得也。’即入奏曰：‘昔项羽欲烹太公，高祖愿分一杯羹。夫举大事，不顾其亲，况继迁悖逆之人乎？陛下今日杀之，明日继迁可擒乎？若其不然，徒结怨，益坚其叛耳！’太宗曰：‘然则如何？’端曰：‘以臣之愚，宜置于延州，使善视之，以招来继迁，即不即降，终可以系其心，而母生死之命在我矣！’太宗附髀称善曰：‘微卿，几误我事。’其后，母终于延州。继迁死，子竟纳款。”
LAMCRJ002,李敖秘藏日记,li_ao_micang_riji,鲁迅劝三郎不要入党,LAMCRJ_003_5,003.杂评鲁迅和他孙子.txt,9-9,317,这本书里面几封信值得看看，特别是他写给胡风的四封信，其中有一封信就是鲁迅死之前不到一年写的，是1935年（他是1936年死的），这封信胡风问他三郎（不知是谁，大概是萧军）应该不应该加入党（共产党）？他说：“这个问题我可以毫不迟疑的答复你，不要加入！现在在文艺作家当中，凡是在党外的都还有一点自由，都还有点创作出来，一到了党里去就‘酱’在种种小问题争论里面，永远不能创作了，就‘酱’死了！”“酱”在里面去，这个字用得好极了。底下更值得读了，他说：“至于我呢，说来话长，不必说了吧。”他说：“我总感觉得我锁在一条链子上，背后有一个人拿着皮鞭打我，我的工作越努力打得越厉害。”这一段话里，打他的就是现在大陆搞文艺的周扬——那个时候的周起应。
LAMCRJ003,李敖秘藏日记,li_ao_micang_riji,奴仆爱妻儿被穿耳服事主人,LAMCRJ_003_22,003.杂评鲁迅和他孙子.txt,43-43,205,古往今来，显然有给人爱情却不给人自由的所在。《旧约》中《出埃及记》第二十一章记买希伯来人做奴仆，奴仆必须服事六年，第七年他可以自由。若来时带着老婆来，走时仍可带走；若老婆是主人给的，“妻子给他生了儿子或女儿，（则）妻子和儿子要归主人”，他只能自己走。“倘或奴仆明说：‘我爱我的主人，和我的妻子儿女，不愿意自由出去。’他的主人就要带他到审判官那里，又要带他到门前，靠着门框，用锥子穿他的耳朵，他就永远服事主人。”
LAMCRJ004,李敖秘藏日记,li_ao_micang_riji,吴祖光笑称中专毕业,LAMCRJ_008_13,008.代曹禺驳夏志清.txt,25-25,171,但祖光是严肃的。一件事情的是非曲直，经常要和人辩得清清楚楚。他经得住考验和磨炼。在十几年的考验中，不许他说话，不许他分辩，但他从来没有被“四人帮”压低了头。终于，他获得了自由，头发斑白了。我见着他，他还是那种笑嘻嘻地满不在话下的神色。他对我讲：“我已经‘中专’（指“中央专案组”）毕业了。”他的脸上没有一丝懊恼和感伤，还是有一种不服输的气概。
LAMCRJ005,李敖秘藏日记,li_ao_micang_riji,穆罕默德断袖护猫,LAMCRJ_010_145,010.2月的日记.txt,289-289,72,由波波想起穆罕默德爱猫，有一次要去祈祷时，猫正枕在他的长袖上睡觉，他不愿打扰猫的好梦，因此“断袖”而起。这一“断袖”比中国式的“断袖”精彩多矣！
LAMCRJ006,李敖秘藏日记,li_ao_micang_riji,阿登纳说智慧每天增加,LAMCRJ_011_86,011.3月的日记.txt,171-171,102,西德总理阿登纳有一次演说后，一位朋友对他说：“总理先生，你昨天讲的话和今天讲的完全不同。”阿登纳笑答之曰：“这很可能，因为我的智慧每天都在增加。”龙虾在一生中，不因年纪大了就停止成长。可以人而不如龙虾乎？
