file	paragraph	lines	score	markers	text
001.“白色恐怖”的一些特色.txt	3	5-5	9	杀|蒋介石|国民党|共产党	郑孝胥的头脑，有中国国民党师承之。此国民党非他，蒋介石也。蒋介石对付共产党，“杀”字出口而已矣，一旦把共产党杀光了，共产党不就没命、国民党不就万岁了吗？——这种妙论，可叫做“把共产党杀光论”。
001.“白色恐怖”的一些特色.txt	22	43-43	9	说|杀|死|共产党	孔夫子说公冶长，说：“虽在缧绁之中，非其罪也！”“非其罪也”就是人虽坐牢，但却是冤枉的、罪名是假的。台湾的假共产党就是如此。他们或坐穿牢底、或横尸法场，与瞿秋白的被杀比起来，全部大异其趣了。若是瞿秋白这种真共产党被抓到，不论坐穿牢底还是横尸法场，其生也悲壮、其死也雄奇，生死线上，都得其正；但假共产党则反是，其生也冤哉，其死也枉也，窝窝囊囊，误了青春或送了性命，这样子的现代公冶长，岂不太荒谬了吗？
001.“白色恐怖”的一些特色.txt	23	45-45	9	杀|求|国民党|共产党	事实上，这一荒谬，自1949年起在台湾，早已是正常的现象，国民党丢掉大陆后，在台湾大搞“白色恐怖”，“杀人如草不闻声”起来，非但得心应手，更得天时地利之便。到今天为止，经查出的政治案件，一共有两万九千四百零七件之多，事实上远不止此。恐怖中最恐怖的是假案比例太高。照大国特范子文的嗅觉，一“闻”之下，真的共产党所占百分比自然不成比例。造成这一荒谬的原因，除了国民党“宁枉毋纵”的高标准外，更要命的是在这一高标准下所硬性要求的“缴匪谍”业绩。
002.谷正文《白色恐怖》序.txt	3	5-5	9	当年|说|他说|国民党	这部书的最突出处，是处处可见谷老“好汉‘要’提当年勇”，提到他以国特大员，屡办巨案的种种往事。在书中，我们看到谷老的聪明、干练、慧黠、奇宕和狠毒——谷老告诉我，毛人凤（国民党保密局、情报局头子）对他说过：“你比我还狠！”可见此公狠毒，固无待我们历史家论定也。
003.从吕有文浑蛋看武汉大旅社冤案.txt	28	55-55	9	问|答|说|他说|求|请	开庭时被问“上诉理由”，笔者未有针对问题答辩，仅说明“案件未查证清楚，就进入审理，殊嫌草率”，他说：“现在就是调查呀！”笔者又说：“那就请调查吧，不过法院给予被告的印象极为恶劣，因为一件案子，拖了十余年，仍未结案，证明法院毫无人权法治观念。”就这样逼他说出了：“法院对你们没有存见，这不过是法律的漏洞。”但没有说“将研究改善”，笔者又再一步进逼说：漏洞如果发生在初审法院，因为独任制，由一个推事审判时，或可以谅解，但在第二审法院，是三推事合议审判，仍然有漏洞而不求弥补，实在说不过去。这是笔者第一次听说的漏洞。
007.写在李政一狱中回忆的前面.txt	58	115-115	9	问|答|说|跑	“怎么跑得那么快？”那人开口讲话了。我问他干什么。“你是鹰哥公司呃！”我回答说是。“走！到你们公司去，我要买羽毛球拍。”我们公司当时曾出口一批羽毛球拍到芬兰去，所以他这样问，我心觉讶异：为什么要买羽毛球拍，不直接到我们公司去，而要在街道上拦我，何况又是陌生人呢！如此一想，不觉骇异悚惧。“要买羽毛球拍，你自己到我们公司去。我现在有事急着要出去，不能陪你到我们公司。”说这话时，我已料到可能落入魔掌了！
007.写在李政一狱中回忆的前面.txt	106	211-211	9	最后|说|骗|死	他们将翁春霞接进保安处一牢房中，然后骗吴忠信说：“你女友翁小姐也抓来了，现在关在隔壁房间。你假如不坦白承认爆炸，连你女友也都要被你拖下水，同你一样受苦受难。我们现在给你最后的机会，让你先跟翁小姐商量商量。”于是，他们叫吴忠信和翁小姐通纸条传话。翁小姐劝诱吴忠信承认爆炸，吴忠信保持相当的理智，并未迷失于爱情，而一味顺从女人的摆布。他告诉翁小姐说：“兹事体大，事关同案五人生死，希望让我考虑一段时间再说。”
007.写在李政一狱中回忆的前面.txt	115	229-229	9	后来|问|说|求	7月20日早上8点，郭荣文、詹重雄两人分别被提调到讯问房。据他们事后告诉我说，他们一到讯问房（分别在两个密闭房间）后，办案土匪就来势汹汹的刑求，不由分说，迫令招供爆炸事件。詹、郭初则咬紧牙关，坚持到底，旋遭灌水惨刑，几次折磨揉躏之后，实在忍受不了，双双屈服，在灌水当中，屈招爆炸，在土匪的导演指教下，供述爆炸过程。并且由匪首王缵指导，居然画出所谓的“定时炸弹设计图”；由季贵成导演，煞费苦心的做出“装置定时炸弹现场表演”的录影（后来这些“定时炸弹设计图”与“装置定时炸弹现场表演”的录影相片，都拿到法庭，作为我们爆炸的有力物证。）。
007.写在李政一狱中回忆的前面.txt	163	325-325	9	最后|结果|说|骂|死|求	晚上十一点左右，夜已深沉。王缵、季贵成等退下去休息，只留下郭刑警、刘刑警与梅刑警继续办案。他们再拿出詹重雄、郭荣文与吴忠信等人的供承爆炸笔录出来，叫我仔细瞧看。我不得不再看它一眼，却发现他们三人的笔录都是一改再改，改得通篇一塌糊涂；再者笔录最后的签名，都很潦草，显然出于被迫，莫可奈何的手笔，根本不像他们原本很为工整的字体。我曾据此向郭刑警、刘刑警申说那绝对是刑求逼供的结果。刘刑警呵斥道：“你少废话！不管怎么样，那是詹重雄、郭荣文、吴忠信他们亲笔签写的字。不管怎么样，那是我们调查的结果。”梅刑警则骂道：“李政一，你到现在还不知死活，还敢跟我们找碴儿！等一下你就知道你这样做，值得不值得。”郭刑警则曰：“少跟他噜苏！再灌再说！”于是郭、刘两人动手绑住我的手脚，再度抬我到厕所去灌水。一边灌，一边粗声叫嚷：“要不要承认？ ”“不承认不放下（不停止灌水）！”
007.写在李政一狱中回忆的前面.txt	175	349-349	9	问|答|说|骂	他们拿出一个金龙牌饼干铁盒，以及四块泥土捏成的炸药模型（这种炸药俗称麻薯），问我：“这是什么东西？”我隐约知道那是什么，猜也猜得出此时此地他们拿出这些东西的用意，但是我回答说：“不知道。”因此土匪的拳头马上朝我胸部揍过来，同时骂道：“他妈的！装假装得那么像。”
008.国民党的强制悔过症.txt	5	9-9	9	说|死|求|国民党	8月中旬：南京金陵女子大学中文系主任陈钟凡（原北大学生）去监狱探望陈独秀，得知监狱被炸，便同胡适、张伯苓等商议联合保释他。国民党政府的条件是，除了人保之外，还须本人具“悔过书”。陈独秀听后大怒，说：“我宁愿炸死狱中，实无过可悔。”并且拒绝人保，说：“附有任何条件，皆非所愿。”他要求无条件出狱。因此，陈钟凡等人的保释未成。
019.先认错，再开会.txt	20	39-39	9	说|他说|骂|请	第一，我的长文发表后，台北看守所所长朱光军公开说：“李敖是写文章的人，特别喜欢幻想，他所说的一切都是想象出来的。”“李敖是出名会写文章的人，在看守所六个月时间，相安无事，没想到出所后，竟疯疯颠颠的乱写一通。”他并且认为：提供给李敖内部真相的正义人士。是看守所的“内奸”、“不肖分子”，他不思自我反省，反倒宣布要着手整顿“内奸”、整顿“不肖分子”！他说“必要时候，看守所将聘请律师告李敖诽谤”，以免“以讹传讹，对政治及司法威信受到打击，影响人民对政府的向心力”。他并且很蛮横的对记者骂李敖放屁！”“放他的狗屁！”
019.先认错，再开会.txt	25	49-49	9	笑话|问|说|笑	第六，法务部长李元簇说：“对我们的善意建议批评，我们绝对有勇气接受，并检讨改进，但是对我们恶意中伤诋毁，或无中生有的攻讦，我们却是难以接受的。”“李敖出狱后揭发台北看守所的‘内情’后，我已指示法务部监所司进行了解，将实际情形查明具报，如查出属实，将依法予以严惩，希望大家不要以讹传讹，打击狱政人员的士气。”这些话，显然公然表示李敖所说是不实的，但这种表示，在逻辑上是不通的。因为揭发黑幕，是事实问题，不是态度问题；是是非对错问题，不是善意恶意问题。关键只在李敖的证据对不对，不在李敖的态度好不好。李元簇这种谈话，在逻辑上是笑话，是会见笑大方的。
020.彻查你自己吧！.txt	42	83-83	9	说|笑|逃|杀	按照司法行政部台（66）函监字第06080号函明定：“调服杂役”应符合“入所时间一月以上行状良好”、“所犯最重本刑在五年以下者”等条件。这种本刑，是指法定刑，而非宣告刑，但朱光军不管，不得不遵守一月以上五年以下等限制，甚至五年以上的，都纷纷出笼。例如欧阳坤判七年，但透过戒护课长王文发，立刻调服杂役；又如陈廷柳判八年，但透过所长朱光军，立刻也调服杂役。台北看守所中高级主管如此玩法，下面管理员自然也就跟进，不但五年以上的一一调服，甚至判无期的、杀人的，也都照调不误。这样一来，自然就有价码出现，也有笑料出现。以王建福越狱事件为例：王建福二十二岁，诈欺案收押，他长得很高，乃私用伙房茶水桶做叠罗汉。翻墙而出，翻墙地点离岗哨不到二十公尺，可是岗哨中管理员竟在光天化日下睡觉，让他逃脱，以致被以疏忽职守罪，将三名管理员（陈清华、程台生、李新冰）起诉。王建福越狱是台北看守所四十天内的第二次越狱成功事件，毛病与其说是管理员睡觉，倒不如说是李元簇睡觉来得正确。因为司法行政部明定被告入所时间必须一个月以上，才能调服杂役，王建福从被收押到越狱，前后只十天，足见他是在不合规定下调服杂役的，若不是李元簇睡觉，怎么会有这种公然的不法情事出现？
021.为老子名言举活证.txt	19	37-37	9	原来|说|国民党|监牢	据1955年联合国颁布《囚犯处遇最低基准规则》，规定每一座监狱收容的人犯以不满五百人为限。但国民党各地的监狱容量都定得奇高，像台中监狱的核定容量是一千一百五十二人，本已超过了五百人标准的两倍多，而实际收容量在1982年间已是一千九百一十二人，等于超过联合国规定标准的四倍！台湾目前有十六所监狱、十六个看守所，再加上独立的少年观护所、少年辅育院、分监、外役监等，具有监所性质的单位一共六十多个，几乎每一个监所目前都达到“过饱和”的状态；十六所监狱原来设计的容量是一万两千四百七十五人，可是截至今年春天，却收容了两万一千三百零七人，超额录取，将近一倍！《汉书·刑法志》说“囹圄成市”，比起国民党关人来，真小巫见大巫矣！国民党光在去年一年，就把十六万六千人判决了有罪，看了国民党警察局这样抓人法，抓到一坪大的监牢要关二十多个人，这哪里是坐监狱，这简直是挤公共汽车嘛！
024.施启扬丧尽天良.txt	6	11-11	9	原来|说|自述|死|强奸|请	1981年7月31日发生了李聪明暴毙案。李聪明四十七岁，因涉嫌六次强奸同居人王黄双的十五岁女儿，被收押在台北看守所。7月31日晚上8点，突然受伤，在送板桥中兴医院急救途中就死了。李元簇赏识的朱光军宣布：李聪明收押时，看守所发现他有外伤，不很明显，所以没将他申请保外就医，但先后六次给他疗过伤，可是不晓得内伤如此严重。朱光军这一说法，是可疑的，这种可疑，一查《羁押法施行细则》第7条第1项第2款就看出来，因为上面明定被告入所时应实施健康检查。但事实上，看守所健康检查医生或护士都不管，而推给药剂生阙壮士包办。包办之下，所谓健康检查，只是查查有无纹身，和人犯自述健康情况而已。可见，台北看守所既只关人而不真正的健康检查，纵使李聪明自己病死，李元簇、朱光军等人也难辞失职之咎，何况李聪明的死，原来大有文章！
028.写在龚德柏《蒋介石黑狱亲历记》的前面.txt	5	9-9	9	说|回忆|杀|死|求|蒋介石	龚德柏出狱后，写文著书都有困难。1964、1965年间，李敖说动萧孟能，由文星书店为他出版一些书，也算对他聊表敬意。他一生著译颇多，著有《日本人谋杀张作霖》《征倭论》《中国必胜论》《日本必亡论》《中国与世界大战》《一九四二年的日本国力》《空军足以摧毁日本论》《日本之末路》《戏剧与历史》《龚德柏回忆录》《汪兆铭降敌卖国秘史》《愚人愚话》《也是愚话》《又是愚话》《还是愚话》等；译有《日本对华经济侵略之过去与将来》（胜田主计著）《蹇蹇录》（陆奥宗光著）《日本侵略中国外交秘史》《揭破日本的阴谋》《西原借款真相》等。不过，龚德柏一生最精彩的著作，乃是他晚年偷偷写的龚德柏秘录——《中日战争史》，书中批评蒋介石的错误，当然不能出版。在他死后，李敖得到此书秘本，发表在《李敖千秋评论丛书》中，陆续为他流传于世，龚老有知，必当惊知己于千古矣！龚德柏除《中日战争史》外，另有秘密回忆录一册，写其狱中见闻，从未出版，《求是报》现已独家取得，于3月10日刊出。该回忆录为了安全起见，并无标题，本报根据内容，代为拟题，特此说明。
028.写在龚德柏《蒋介石黑狱亲历记》的前面.txt	28	55-55	9	后来|说|他说|投降	第二、说到休战太迟，更使人痛心。在三十二年12月末，我已发现日皇有心投降。他的政略是以全力向这方面进行。所以由那时起，我即强调“日本一定投降”。我对于这点，愈研究愈发现我的看法是完全正确的。到了三十四年4月，我已有百分之百的信心。所以我于4月30日，向蒋委员长建议：“日本一定投降，即在5月内投降的可能性都有。中国应速派人到日本去，劝他们早日投降，我们可以为他们介绍向美国投降。我们必须由日本手中，收回东北四省，中国在战后对付共党，方能占有利地位。中国若不迅速使日本投降，俄国打完对德战争（自注：那时德国尚未投降），把兵力调到东方，对日本进攻（我并强调俄国一定进攻日本），由日本手中抢去东北，交给中国共党，中国将毫无办法。所以，这时是千钧一发之重大时机，绝不能稍微犹豫。否则，中国前途将陷于极端不利”云云。我这建议，委员长看过了，即批交熊式辉办理此事，熊式辉乃使其中央设计局组长王又庸（他后来当选立法委员而投共）与我接洽，自己尚摆官架子，不愿与我谈话。王又庸对我说：你对委员长的建议，委员长现交熊天翼办理。你的办法太简单，叫熊天翼如何办呢？我说：我对委员长说话，不能用教科书方式，故只能说原则。现在这样办好吧！你叫熊天翼接受该任务。他把我带去，他可以在中国安全地带住着，他把我送到南京也好，东京也好，我把事办妥，由他签字。富贵功名归他，危险责任归我。若把事办坏或者美国吃醋，把责任统统归到我一人身上，政府发一道通缉命令，说我投敌通敌可也。我不是官吏，不论如何，害不到国民政府，这样办你看如何？他说就这样办好了！但由此以后，熊式辉根本未办此事。不久他反与宋子文到俄国去，同俄国谈判中苏同盟条约。不久俄国参战，日本投降，完全如我所预料。俄国把东北由日本手中抢去，交给中国共党，中国失败的运命就这样决定了。
028.写在龚德柏《蒋介石黑狱亲历记》的前面.txt	91	181-181	9	后来|说|死|枪毙|台湾人|投降	张经长期的劝说无效，又送至桃园监狱，我曾与之同号数日。但张仍不屈服，又送回南所。四十三年十月一日，匪党“国庆”，张唱匪歌，乃始将其枪毙，是台湾共党至死不降者，只张志忠一人。其余二级匪党员都全部枪毙，虽欲投降，亦不接受。至莫名其妙参加匪党之台湾人，则都送至火烧岛。该岛所收容之共党分子究竟多少，无法知其确数。但据说：后来亦渐渐减少。不知是释放了，或被投入海中则不知。而四大金刚之三金刚，则为保密局所利用，而为之分析匪情。保密局对匪情之判断，较其他机关为优，都是此三金刚与赵耀斌（详见后文）之成绩云。
028.写在龚德柏《蒋介石黑狱亲历记》的前面.txt	95	189-189	9	后来|问|答|说|枪毙|求	一、陈宝苍 此人系吴石案中之牵连者。吴石被捕后，于其家中搜得很多证据。其中有关于台湾兵力配备情形一件，问系何人所供给，吴答，系陈宝苍。于是陈宝苍被捕获次日即审问。陈毫不隐瞒，将供给情形供出，他不知吴石通共。他在抗战时，曾任第七战区参谋长吴石之副参谋长。吴石到台他去访问，吴即要求陈将他所知台湾军事情形告知，陈乃根据报纸所载，作成该报告。后来迄未再为吴作报告，当时未挨打，看情形似不甚严重。但后来保密局接获大陆情报，谓匪军部获得台湾地图一张。法官问吴石，吴石说他有地图一张给陈宝苍。于是问陈，陈否认有此事，乃被毒打。不得已供称：他给匪的。陈招认后回房，不论如何不能记忆曾得吴石的地图之事，后来记出，他曾借看吴之地图，但即交还，并无给匪之事。次日再问时，陈说出此情，又被毒打。但打了不少棒，陈之供词仍不确定，法官似承认陈之冤枉，又问他，你昨日何以承认？陈说：“被打得太惨，故乱说。”法官说：“虽被打亦不得乱说，使我追地图之事延误一天。”乃将陈解下老虎凳，抬之回房。后来地图事已问出下落，确系吴石命令绘图员所制，由吴给匪的。似陈对地图事已无责任可言。但后来枪毙吴石、陈宝苍等，所宣布之罪状，有关陈之部分，仍有地图之事。是法官明知其冤枉之事，仍根据被打而得之口供，作为罪状，似陈之罪未如所宣布者之甚。不过吴案中其他三人，皆为情真罪实，我由陈之口中已知其详情了。
028.写在龚德柏《蒋介石黑狱亲历记》的前面.txt	98	195-195	9	问|说|自述|骂|求|请	三、刘明 台湾煤矿业大资本家刘明，亦为被打很惨之一人，当刘入狱未与我同号，我不悉其当时情景，经过月余，刘之伤痕已消失后，始与我同住四号。据刘自述：他于晚九时入南所，即时审问，未到五分钟，即上老虎凳，在老虎凳上被打七小时，始抬入号中。最初与吴石同住五号。他非常狼狈，自认不能再活三天，故第二天被抬出狱审问时，他大骂法官惨无人道，亦无丝毫效果。因为保密局法官本丧失人性，尤其那时候为甚。其法官又以赵公嘏、张锡林二人最为残忍，犯人都把二人比之周兴、来俊臣，被他二人打过的，都非常狼狈。刘明所遇者，当为他们二人中之一（因为法官姓名均无法获知，而赵张二人之名，则系其同志所传出。但我有机会认识赵公嘏，而审问我的是何人，我至今不能言其姓名）。刘在狱中由保密局派人向其家中取食物，每次都相当丰富，刘亦慷慨与同狱分食之。我亦吃过他的东西。刘所犯之罪，为任用共党当秘书，并资助共党以金钱。据刘自称：他实不知他们是共党，只以平日好施之故，遇大陆的人求他帮助，他不吝惜便了。并有某共党，在台开设工厂，由刘代向电力公司请其接电，亦为其罪状之一，但刘亦称：不知其是共党。而法官则不信其言，并追问资助多少？刘亦计算不出，所以被毒打。刘在南所共四个月，移送保安司令部，被处十年徒刑，财产没收。据保密局人说：某相关人员有因此发财者云。
028.写在龚德柏《蒋介石黑狱亲历记》的前面.txt	186	371-371	9	最后|问|哭|骂|杀|枪毙	三十九年春，香港有所谓李朋间谍案，除李朋被枪毙外，受其牵连者复有数人，其中有黄珏、黄正姐妹两人，各被判处十年徒刑。而帮凶之报纸杂志更宣称两姐妹为罪大恶极之人，不但一般人认为可杀，即我们身在囹圄者，闻得记者之言，亦觉其可恶。但黄氏姐妹于李朋枪毙后，并不解送军人监狱（李系以军人身份被捕），亦不送普通监狱执行徒刑，反迁至保密局南所，使同牢之人大为轰动。更奇怪者，她们是已决“人犯”，照例并不再审问，但保密局派南所一名以残酷著称的法官赵公嘏，担任此案，她们被审问数十次，一问则数小时，且每次回牢房，大都哭哭啼啼，悲不自胜。最初我们以为被打或被骂所致，经过许久，始知系述到自己被冤枉情形，不禁悲从中来。最后最残酷如赵公嘏等亦同情她们。但案已判决，无法变更，只得将她们送至桃园监狱，后又由桃园送至南所。至四十三年9月，因共匪声言将炸台湾，又由南所送至桃园。
028.写在龚德柏《蒋介石黑狱亲历记》的前面.txt	215	429-429	9	问|说|杀|死	徐水亭是浙江开化县人，简易师范毕业，家中有父母妻子。抗战胜利后应募为总统府卫士。来台后，仍充卫士。三十九年4月间，他有一函致其朋友，在信中发牢骚说：“高级官吏尽量享受，使我们受尽艰苦。”这封信被查出，即由总统府移送保密局讯问。经多次严密讯问，别无其他反动证据，当然罪不致死，或可称并不犯罪，因法律对鸣不平并无处刑条文。但若把他释放，他是卫士，当然仍归卫士队。即令开除，他获自由后，亦可与其他卫士通消息，于卫士之思想有严重影响。所以他成为既不能杀又不能放之“钦犯”，与我有同等资格。于四十年解至桃园监狱长期拘禁，最初一年未与我同一房间，一年后，始与我同房居住。
028.写在龚德柏《蒋介石黑狱亲历记》的前面.txt	229	457-457	9	后来|问|说|骂|逃|投降	赵耀斌真姓名为何？我不知道。据他自说：他不姓赵，因加入共党，遂改今名。他是保密局在大陆时，破获北平孙连仲部共党案时所捕获的。孙连仲是河北省政府主席，北平卫戍总司令。他本人不是共党，但他部下由处长起，大都是共党，共党在北平的电台就设在孙部某处长的家中。保密局在北平设有侦查电台，发现北平有共党电台，遂侦明其地点。但因该房屋系孙部某处长所住，不敢冒昧入内搜查。乃派飞贼出身之工作人员，夜间偷入该房屋搜索侦查，他侦悉发电的行动发完后，底稿存放处所，乃复出外报告。即调大批人员入内搜索。当场破获一切证据，并逮捕其全部人员。经审问供出指挥人为赵耀斌。赵乃交出其指挥下二十六个电台与全部人员。这予共党一重大打击，赵并反正，为保密局工作。凡属共党投降者，均派在赵部下服务。在大陆将撤退时，赵部共党有若干人在撤退途中逃走，赵乃被捕，解来台湾。最初监禁于南所，后移桃园监狱。我到桃园时，他还在桃园，我与他同住六号。他对我的历史特别清楚，对我的文章几乎每篇都读过，并有相当记忆。他对我说：共党对我所主张的日本必投降的看法，并非不注意，但仍疑我有日谍嫌疑，以为我为日本做反宣传，以瓦解中国军心，所以共党对日本即将投降，并无准备，后来始悔不注重我的看法之错误云云。于是证明在日本投降之前，重庆共党分子骂我是汉奸，系为日本做反间之宣传，是共党中央的看法，并非重庆共党分子之私的行动。
028.写在龚德柏《蒋介石黑狱亲历记》的前面.txt	307	613-613	9	有一个|后来|说	经过一个多月，2月14日晚，局长张炎元偕同周处长来找我，说：正在办理中，另外闲谈一些而去，我觉得“行市看好”。因为从前我被他们置之不理，没有一个小法官与我谈谈。后来科长来了，处长也随来了，现在局长又来了，大概出狱有希望了。
