file	paragraph	line_start	line_end	char_count	score	snippet
068.曾国藩论倔强.txt	2	3	3	229	3	曾国藩言：“‘倔强’二字，却不可少……否则柔靡不能成一事……存倔强以励志，则日进无疆矣。”又说：“强毅之气，绝不可无，然强毅与刚愎有别，古语云：‘自胜之谓强’，曰‘强制’、曰‘强恕’、曰‘强为善’，皆自胜之义也。如不惯早起，而强之未明即起；不惯庄敬，而强之尸坐立斋；不惯劳苦，而强之与士卒同甘苦，强之勤劳不倦，是即强也；不惯有恒，而强之贞恒，即毅也。舍此而求，...
071.铁石心肠.txt	2	3	3	467	4	考体育（推铅球，成绩奇佳，七米五）归，在路上想到成事者的气象，一言以蔽之，“孤光自照，肝胆皆冰雪。”——“铁石心肠”而已（邹元标言“学者有志于道，需要铁石心肠”）。吕坤言：“事见到无不可时，便斩截做，不要留恋。儿女子之情，不足以语办大事者也。”“断之一字，原谓义所当行，却念有牵缠，事有掣碍，不得脱然爽洁，才痛煞煞下一个断字，如刀斩斧齐一般。总然只在大头脑处成...
072.沉默寡言.txt	2	3	3	174	3	奥格登（Robert．C．Ogden）说：“青年人的不能上进，最重要的原因是由于他们有多说话的习惯。一个不很开口的人，一个多思想少说话的人，以及比较深沉的人，往往能够成功。”我总是怪我爱乘兴多说话，沉默的素养太差劲，以致对我“沉闷的努力”颇生不良的影响——旷功，疲神，破坏心绪，破坏成熟——这是不行的，我非改变这个爱说话的习惯不可！我要学学丰子恺：
072.沉默寡言.txt	4	7	7	186	3	普法战争后，甘必达曾有句话说：“尔其常思之，但不必言之于口。”这是两句很好的格言，我该在要说话以前多多想到它。还有孟德斯鸠的：“那些无事可做的人都是说话者。人想得愈少，便说得愈多。”Prior的They never taste who always drink；They always talk who never think．也都是些有效的格言。（1957年...
073.翁松燃毕业的感想.txt	2	3	3	100	3	翁松燃今日毕业，中午请他吃饭于“成都”店时想起：最平静，最有规律，最少变化的每日生活，才是对我最合适，痛苦最少的生活，这是我由经验体会到的“定律”，我要尽量依照这个定律过日子。（1957年6月16日）
076.痛苦颂.txt	2	3	3	480	7	从今天开始，我正式迎接痛苦到我的生活里，对它不再采取回避的态度。我告诉我自己说：痛苦算得了什么？迎接好了，整天整夜让它伴着你过，又算得了什么？既然它使你心情永远是阴天，就让它阴天吧，我要满不在乎的去经年累月的忍受，它就算是永远在我身边，永远推不开的小守护神、小幽灵、小捣乱鬼，甚至一个最伤脑筋的小情人吧，我要偶尔也向它打打招呼，寒暄一番，笑一笑，它长年在我心头...
077.正视善，也正视恶.txt	2	3	3	1135	6	夜与大中谈，大中述其看《化身博士》后之观感，提醒我注意人类丑恶那一面，而不要单单执迷于美好那一面，此意我觉得极是。“明察目光”（open-eyed）的态度对我这盲目自欺已久的人说来，该是极为必要的，“它尽管使人认识善，可不连带宽恕恶。”（It gives knowledge of good，it does not involve forgetfulness ...
078.论困难.txt	2	3	3	432	3	曾国藩说：“困难之时，切莫自馁，熬过此关，使可少进。再进再困、再熬再奋，自有亨通精进之日。”我现在已经清楚的知道不论怎么困难，我都必得咬牙熬过去，困难来时，咬牙跟它厮杀一阵，至多一两个小时也就过去了，我有这种“一定会熬得过去”的自信与经验。话虽如此说，虽然我不怕困难的来袭，但我仍然殷望“亨通精进之日”的快快到来，我至盼我的修养功夫能够达到第一等人的境界，像那...
078.论困难.txt	5	9	9	113	3	我体尝过贫困、挣扎、焦虑、失望的况味。我经常在超出了体力的限度下工作。当我回首前尘，恍似一个散满了死灭的梦、破裂的希望和粉碎了的幻想之残骸的战场。我打的是经常与压倒优势相对抗的仗，战争的结果是给我留下了惊怖、损伤、戕害与衰老。
080.因忘而笑.txt	2	3	3	176	3	译Christina Goergina Rossetti在A Birthday中的：“你因忘掉而微笑远比因记忆而痛苦来得好。”（Better by far you should forget and smile，than that you should remember and be sad．）我决定努力实现这两句智慧的词句。（1957年6月22日）
083.有余味.txt	2	3	3	424	3	下午考完社会学返舍时，在路上我深深体会到“有余味”的感觉与快乐，这种感觉与快乐是轻松的、宁静的、安全的、自尊的、“宠辱不惊”的、“无为而无不为”的。近来我颇觉节制自抑含蓄的态度的有味，而我也高兴我能不觉费力不觉勉强的做到这个境界，李耳说得好：“众人熙熙，如享太牢，如春登台，我独泊兮其未兆，如婴儿之未孩，傫傫兮，若无所归。众人皆有余，而我独若遗，我愚人之心也哉...
085.安而乐、闲而清.txt	2	3	3	157	3	邵康节言：“年老不歇，为一惑；安而不乐，为二惑；闲而不清，为三惑。”现在我颇能得到安闲生活的乐趣，我也逐渐深信只有这种生活才能带给我最大的愉快与进步，整天徜徉在绝对自由的气氛里，要做什么就做什么，一点也不受别人意见的限制，这该是多么轻松的生活！今天我才深深知道以无穷的操心与烦恼，去换得一种欢乐的做法是何等的不智！
086.见台静农、方豪.txt	3	5	5	83	3	夜凤翰与德毅来约去方豪处，畅谈近10时始辞出，先生对我说：“你是聪明人。”他又说：“转系简直是胡闹。”他言及鲁实先在图书馆读书十八年事甚可念。（1957年6月27日）
087.吴汉的精神.txt	2	3	3	284	3	我真是愈来愈坚强了，“些微的苦恼不再能有侵扰的力量”，它们反倒使我愈挫愈奋愈得意，在这一点上，我发现我颇有“吴汉的精神”。虽然遭遇了失败，但他却不把事变后的时间花在感慨与叹息里，而立刻专心一意聚精会神地从事新的奋斗。埃格来斯吞（Eygleston）形容得好：“坚持不屈的人从别人失败的地方开始他们的成功。”（Persistent people begin th...
089.自负.txt	2	3	3	581	3	与三姐、张忠娟谈并在师大静观这些男女青年们，内心自负之感甚炽，虽然我是当代青年中的一人，可是事实上我却孤独地站在另一边，他们之间的不同止于大同小异而已，而我与他们的悬殊却非一日之功所能拉齐的，从第一等的价值上着眼，眼前这些男孩子中有哪个能跟李敖相比呢？不客气地说，单单“气象”的不同便注定了他们永无法比的命运，他们的每日生活与一举一动太缺乏成大事者应有的气象了...
094.梁启超论堕落形态.txt	2	3	3	150	3	梁任公文：“吾比年来所见人士，夙相期许者，往往不及数稔，便尔堕落，其堕落之形态亦有两途：宦达于时，沉溺于声色货利，以此为天下之至乐而弃所学所志若敝屣者；潦倒不得志，则嗒然自丧，奄奄无复生人气，若已僵之蚕，旦夕待死者。”此两种人都是“以自养者无其具”，都不是成大事者所应有的气象。（1957年7月5日）
102.努力自造.txt	5	9	9	125	3	屈原的《九章·抽思》充分写出了这种种瓜得瓜种豆得豆的因果铁律，功力是永远不会唐捐的，写到这里，我想起克里蒙梭和他的《深夜自扪》，“老虎”毕生的成就给了我这在深夜中不停地努力着的男孩子无限的鼓励，我深信我迟早会有扬眉吐气的一天的！（1957年7月7日）
105.屠格涅夫论远离敌人.txt	2	3	3	173	4	屠格涅夫在他的回忆录里写道：“我不能和自己所憎恶的东西呼吸着同样的空气。那恐怕是由于性格还不够坚强吧。为要对敌人加以更强烈的打击，我一定要远离敌人。”“远离”在许多场合可说都是一种值得推荐的明智举动，它代表一种彻底的无为与舍弃的态度，孤高的淡漠与自爱的做法，更象征着一种自我牺牲的胸襟与不合则去的决绝，王维的《送别》多少写出了这种自动求去的情绪：
106.乱跑的青年.txt	2	3	3	199	4	看报见劳榦为文致“战斗训练”“神鹰大队”之“学术研究队”的台大历史系同学，因联想到胡适的话：“在纷乱的喊声里，能立定脚跟打定主意救出你自己，努力把你这块材料铸造成个有用的东西。”还有易卜生的：“有时候我觉得这个世界就好像大海上翻了船，最要紧的是救出我自己。”这些乱跑的青年男女是统统不行的，既不可恃又没希望，我看不起他们，也羞于与他们为伍，我和他们是愈来愈分歧...
107.鲁仲连.txt	2	3	3	290	4	《通鉴》卷六：“田单克聊城，归言鲁仲连于齐，欲爵之，仲连逃之海上，曰：‘吾与富贵而诎于人，宁贫贱而轻世肆志焉！’魏安釐王问天下之高士于子顺，子顺曰：‘世无其人也，抑可以为次，其鲁仲连乎？’王曰：‘鲁仲连强作之者，非体自然也。’子顺曰：‘人皆作之，作之不止，乃成君子，作之不变，习与体成，则自然也。’”无怪乎后人以高士称鲁仲连，因为他不是一个以世俗的态度去应付人...
112.谈话之功.txt	3	5	5	130	4	夜与大中大谈至2时40分始归，打破历来纪录矣，今夜月色甚好（阴历六月十六日），与大中谈，无所不至，同知心朋友谈话对自己是有很大的益处的，胡适尝论谈话说：“友朋问答辩论，可使吾向所模糊了解者，今皆成明彻之言论。盖谈话非明白透彻不为功也。”（1957年7月13日）
113.论狂态.txt	5	9	9	254	3	这两种态度都是缺乏严肃正派、修养不到家（尤其是第一类）的缘故，都不是第一等人的做法、成大事者的气象，吕坤说：“体懈神昏、志消气沮，天下事不是这般人干的（这种人约等于第一类）；攘臂抵掌，矢志奋心，天下事也不是这般人干的（这种人约等于第二类）。干天下之事者，智深勇沉，神闲气定，有所不言，言必当（此之谓谨言）；有所不为，为必成（此所谓慎行）。不自是而露才；不轻试以...
118.日记与祈祷.txt	2	3	3	146	3	假若有宗教意味的话，读日记可说就是我的祈祷了，起床入睡或在某些需要的时刻读几行日记，就好像在气本很足的车胎里又打进一些气，它们使我心胸开朗，更会使我发愤努力，“再多一点生命，再充实一点”（More life， and fuller），丁尼生的句子是我最好的“阿门”了。（1957年7月21日）
119.有长者风.txt	2	3	3	737	3	拜伦说：“凄惨是达到真理的第一条路。曾经经历过战争、风暴或者妇人的激情的人，不管他的暮年是十八岁或八十岁，都可算已赢得可贵的经验。”这段话给我一种暗示，就是人的“成熟、不浅薄、有长者风”是不能以他的年龄来衡量、计算或限制的。根据我观察所及，够得上“成熟、不浅薄、有长者风”的人，在中年或老年人中简直难以找到几位，更不要说是青年人了。“成熟、不浅薄、有长者风”是...
120.拒绝不爱光阴的朋友.txt	2	3	3	326	4	今天晚上接连与三位朋友消耗四个小时，极为追悔。当然我无法一律拒绝朋友的交往，但是“尽力的节制”是必要的，我未能做到“尽力的节制”的地步则是事实，有些无谓的交往的确可以缩短或避免的，以后假如遇到这种可以缩短或避免的交往时，我要练习以老实不客气的态度、圆滑的口才与笑脸，去拒绝这种不爱光阴的朋友！我太缺乏这种“无情”了，现在我决心要用这种“无情”的态度，去对付任何...
124.一天静默.txt	2	3	3	297	3	今天静默的生活做得极好，只做事，不讲话；只孤独，不交往。傍晚在池边看小孩子们钓鱼，又读英诗、看日记，天黑始归，心情极因收敛而愉快，亦极得孤独之趣，我是愈来愈喜欢沉默寡言了，我的愉快也系于沉默寡言上面，多说了可以免说的话我会非常不痛快的。《世说新语》记：“王黄门兄弟三人俱诣谢公，子猷子重多说俗事，子敬寒温而已。既出，坐客问谢公曰：‘三贤孰愈？’谢公曰：‘小者最...
125.值得说的话是多么少.txt	2	3	3	296	4	过去所写的许多关于沉默的方法今天还是很适用：“我该足足沉默十六个小时。不念书的时候也应该沉默。我需要沉默十年，现在不是我欢笑的时候，我厌倦了人群，尤其是装腔作势的女孩子。和他们在一起而不沉默，我的计划就失败了。不能沉默表示了我意志的薄弱，更表示了我的平凡。平凡是没有思想，平凡是对理想的浅尝，一切交游和欢笑都是得不偿失的盲动，那样，李敖将不是智者。”“我看到青...
127.“余独好修以为常”.txt	2	3	3	220	3	晚上吴新地与沈鸿骏说我道：“李敖现在不苟言笑，这家伙真是神秘。”真的，我真是愿意单独的神秘生活着，用“尝试、失败、再尝”（trial and error）的方法，使我大体上在各方面都选择了适合我的生活方式，我依照我所选择的每一个生活方式去生活，不再有任何矛盾与不安，失败的教训与经验的指引，使我深信只有处处依照、时时依照我所选择的生活方式去过活，才能使我获得真...
128.三句话.txt	2	3	3	107	3	我是积极的、乐天的、入世的、现实的、功效的，我完全抛弃了“情恹恹地”、“嗒然若丧若已僵之蚕”的李敖了，我已完全选定了一种新的信仰与生活方式，我每日的精神极好，从不疲惫地大踏步走向前去，我的里程碑永远是同样的三句话：
130.小段时间的把握.txt	2	3	3	730	6	荷马说：“那些敢于失去一天的人，是危险地奢侈；那些敢胡乱用它的，更可谓不顾死活。”目前的我对“大段时间绝不浪费”一点上，做得尚好，对“小段时间竭力争取”一点上，做得还是不满意，科兰谷说：“在时间的片段与小块中，原可做许多事情。这些片段的时间每日都有，大部分的人荒废了它，但最后算起来这些时间在人的生命中是一个不小的减削。”譬如说，每天我浪费了十分钟时间去谈天，...
136.比例的眼光.txt	3	5	5	102	3	人在满眼的“生平无大志”的俗人环境中，最不容易抽象培养起一种“比例的眼光”，由于缺乏这种透视，所以无法产生一种不受所惑不受传染的自觉，总不能逃出庸俗的人海而脱胎换骨，所谓“比例的眼光”，可分两方面来解释：
137.不再辱主义.txt	2	3	3	211	3	《通鉴》卷二十三：“霍光上官桀与李陵素善，遣陵故人——陇西任立政等三人俱至匈奴招之。陵曰：‘归易耳，丈夫不能再辱。’遂死于匈奴。”三省注曰：“陵意谓降匈奴已辱矣，今若归汉，汉将使刀笔吏簿责其丧师降匈奴之罪，是为再辱也，故遂不归。”三省对“再辱”之解释既窄且非。李陵此言后蜕变为王国维的绝命词，这句话对我的影响相当的重大，不智的自取辱的事是不能做第二次的，做第二...
138.“日夜切齿腐心”.txt	2	3	3	118	3	“樊於期曰：‘此臣之日夜切齿腐心也！’遂自刎”，这是何等撼人的精神！这种“日夜切齿腐心”的撼人的精神是我最向往的，肝脑涂地男儿死耳，这是何等精神！心之所善、九死无悔，这是何等精神！死生以之，诚甘乐之，这是何等精神！（1957年8月7日）
145.隔断.txt	6	11	11	87	3	他是威廉·奥斯勒爵士，那年他所读到的字句乃是托马斯·卡莱尔的话：“我们主要的事务，不是去为渺茫的未来烦心。而是去做那明明放在手边的事。”这话帮他解除了一切困恼，从此脱然无累。
145.隔断.txt	8	15	15	35	3	那么，什么是他成功的秘诀呢？他提出一句话：“生活在紧闭的一天间隔中。”
145.隔断.txt	10	19	19	130	4	把时间的前后隔舱关闭起来，准备生活在“紧闭的一天间隔中”。奥斯勒博士这话，是否叫我们毋视于明天，不做长久之计呢？绝不是的。他在那次演说中跟着说明，对于明天的最好打算，便是将你所有的才力和热心，集中起来，聚精会神来做今天的事。这才是为你未来做准备的唯一可靠途径。
145.隔断.txt	11	21	21	96	4	奥斯勒复要求耶鲁学生记住一句基督祈祷词：“给我们今天这一天的面包。”这是只求“今天”的面包，不问昨日的良窳，亦不企求来日的有无。诚然，只有今天的面包，才是你可得而食的面包！（卡耐基作，友诗译）
152.与张世民通信.txt	5	9	9	216	3	这个挫折我倒没有为它过分的难过，虽然它打破了我原有的一切计划，你临走时曾对我说过这一句话，那就是“我并不是一个研究学问的人”（这当然是根据我的性格和内在的一切），我仔细的想了一想，的确如此。这么些年来，我从没培养出一点学习的兴趣来，即使是最近这几个月来，我曾很努力的念了点书，但这也是在极度强迫自己下而做的，在这种情形下，我想也不会有什么收获成就的，当然这种兴...
152.与张世民通信.txt	22	43	43	218	3	依我看来，教书计划的失败正是一心读书计划的开始，上月31日的晚上我就颇怪你的打算太不彻底——伸缩性太大，自己的事不凭自己做主而凭环境做主。我从来不忽视环境对一个人的压力，我也深知你如此转变所做的牺牲亦不算小，因此我似乎不该特别非议你的折中办法，但在另一方面，我的经验与看法却告诉我，环境压力、经济困难、兴趣不足、能力太差等等，常与“没出息的苟安”表现出相同的症...
152.与张世民通信.txt	23	45	45	270	4	看看这些比比皆是的“没出息的苟安”的人吧，他们又何尝不想有大成就？可是他们的勇气却都是可怜的，单就六十三个法律专修科的学生而论，没有一个不为自己是专修科的学生而唉声叹气的，可是只有我一个有勇气自动退出来，我当时的处境又何尝不困难？何尝不冒大险？但是我深信人的弹性是多么大！我深信还没有到圣人境界的我们，还相当需要“置之死地而后生”的强迫手段、绝后路的手段，真正...
154.朋友的观点.txt	2	3	3	147	3	我想，我何不练习用一个朋友的观点来看我自己呢？在朋友们眼中的李敖将为何如人呢？这是一个很好的行为取舍的标准，大至对人热心的帮助，小至写一张明信片的字迹，无一不可以表现出我李敖的为人态度与人格风范，“孤坐每觉千夫指，独行犹如万人睨”，我应该有这种自重他重的心理与要求。早上接到吴新地的信，他写道：
154.朋友的观点.txt	21	41	41	483	3	看了新地的信，使我记起艾德勒的话：“要这样影响别人，要使他们不再菲薄自己。”我极端渴望我自己能够变成这样一个人——一个最能影响人的大学者。这种希望使我愿意过度重视我自己，因为对自己的过度重视，会使我不停地保持着“不肯草草放过自己”的警觉——不轻易做一件事、不胡乱说一句话、不随便表现一种举动。“我要努力去适度表现我的‘地位’，在那稳重爽朗的笑声中、和气淡漠的谈...
165.转系未成.txt	2	3	3	89	3	庄因来函论转系未成：“如你以前对我所言，‘咬着牙’念下去，不必再想其他一切，读自己的书。我说‘善为惊人之举’的人不是很多的，你以往的勇气与魄力足可担当。”（1957年9月13日）
