file	paragraph	lines	score	markers	text
001.国民党与云南起义.txt	89	222-222	10	说|骗|求|请|国民党	根据这篇文章的论证，我们可以清楚看到：“再造共和”的历史，几十年来，怎样在被国民党颠倒黑白，蚕食鲸吞。他们的御用史家血口喷人(19)，说别人“一手遮掩天下人的耳目，贪天之功，而为一己一系的标榜”，正是活生生的夫子自道！为了维护真理、为了探求真相、为了揭发国民党的真面目，我决定把这一论证公开出来，给国民党“庆祝建党九十年”迎头一棒！因为许多材料是难以看到的，所以我尽量从松录取，给大家多一点机会接近原件——练习从原件里去去伪存真，是不受国民党欺骗的重要法门，有心人务请注意。
003.国民党与“锡安山事件”.txt	8	15-15	10	问|说|国民党|外省人|台湾人	到了9月21日，许荣淑来看我，谈选举的事，我顺便问她，说你去过锡安山，并为锡安山事件在立法院仗义执言过，那些基督徒、那些“神国的乐园”，除了被国民党宗教迫害之外，给你最大的印象是什么？许荣淑说：“那边可说是一个外省人台湾人最密切合作的地方，那些外省的退役老兵、那些台湾的穷苦大众，他们为了官方以外的共同信仰去献身、去苦干、去建造他们的乐园，相互之间，没有勾心斗角，他们真令人羡慕呢！李先生你该去看看。”
006.国民党政工头子投共.txt	14	27-27	10	问|说|死|雷震|国民党	就在《自由中国》被批被斗被“总攻击”的苦难岁月，专拍国民党马屁的马璧也粉墨登场了、祭起血滴子了、当了“帽子店”的大老板了，这个马屁精，写了欲置雷震、《自由中国》于死地的打手文章不少；我们光从他在一九六〇年九月二十日出版的《关于〈自由中国〉杂志的问题》一书（此书紧咬在雷震被捕后的第十六天出版，但早已绝版了，即使不绝版，国民党在马璧投共后，为了避免他丢“反共”的脸，也会设法让它“绝版”的），就可以充分了解马璧之流整天疑神疑鬼，说人是匪谍，说这个是匪谍、那个是匪谍，其实最匪谍的，全都在他们窝里！我们现在就来看看马璧到底是如何“貌似忠贞”，如何在罗织异己人士的罪状吧！
007.国民党大使垮台秘闻.txt	2	3-3	10	最后|原来|说|死|国民党	10月9日傍晚，碰到叶公超的司机先生，因为我平日对老农老圃级的人士最有礼貌，他们最愿意同我聊天。司机先生说，叶公超死后，留下的遗嘱，他的朋友们全都不执行，人在人情在，人死什么都没有了。我说他们这些达官贵人的交情啊，看起来最热络，其实最虚情假意、最浅盘没根。所以，人活着，交情不过文酒之会；人一死，交情就是公祭上香了，任何深入一点、有意义一点的事，他们生前死后，都是做不出来的。我说这些话，是有感而发的。我以胡适为例。我说胡适生前，他的周围俨然是他的畏友、良朋、门生、干女婿，是“蟠龙大花瓶”的赠送者、是生日酒会的拜寿者、是“胡适合会”的“标会”者……可是胡适死了以后，几乎在“尸骨未寒”的当儿，他们就变成了“不认得耶稣”的“彼得”。钱思亮尤为此中翘楚，他封了跟胡家来往的后门，甚至公开装作不认识干妈胡老太了。最严重的，他居然公然违反胡适的遗嘱，把应由台大处理的《胡适全集》，皮球踢给“中央研究院”，然后王世杰再接着踢，直踢到二十年后，一事无成为止。十七年前我编《胡适选集》，遭到国民党和它同路人的捣乱、围攻。理由千奇百怪，其中之一是说《胡适选集》影响了《胡适全集》的完整性，好了，最后《胡适选集》被法院宣判没收、销毁了（事实上他们一本也没搞到，全都卖光了！），可是他妈的《胡适全集》呢？二十年了，《胡适全集》呢？胡适的亲朋好友、胡适的门生故旧、胡适的干女婿钱思亮、胡适的床头人江冬秀、胡适的大徒弟毛子水、胡适的小学生胡颂平、胡适的“监护人”徐高阮、胡适的大秘书王志维、胡适的海外传薪人杨联升……他们都做了些什么呢？他妈的《胡适全集》呢？这些达官贵人的交情啊，原来如此！
007.国民党大使垮台秘闻.txt	11	21-21	10	故事|最后|说|国民党	叶公超的故事，清楚说明了与国民党合作、想做官的知识分子，苟还残存一点性格，最后的下场是什么。
009.国民党胡秋原的时光隧道.txt	15	29-29	10	后来|说|回忆|国民党	这一透露中，所指的“办一研究班”，就是大名鼎鼎的“心庐”。据我仔细查证“心庐”最初设于台北市中山北路七条通（后来的皇后大饭店），四层楼房，一楼会议室、饭厅；二楼资料室；三楼寝室；四楼研究室及“曹教授办公室”。当时“指导教授”是郑学稼、曹敏、李廉、林一新、方东美、夏晓华，并无胡秋原其人。所以，胡秋原说“在这个研究班的第一期，我讲的课甚多，并曾介绍许多朋友讲课。”真是天方夜谭！并且，“心庐”成立于1964年，胡秋原说：“心庐” 之设，在1969年，并且是曹敏“听”了他的“话”、“实行”了他的“意思”才成立的，这完全是“教祖母吸蛋”式的倒果为因！——大政工办秘密干训班，早在五年前就自行成立了，又何劳胡秋原献策啊？事实上，胡秋原只不过是因人成事的追随国民党大政工去效命而已，他投靠王昇属实，但地位并没他回忆的那么重要。
010.国民党胡秋原冒充“文化部长”.txt	3	5-5	10	后来|说|他说	九一八事变后，1933年5月，国民政府和日本签定《塘沽协定》。一二八战争时我国第十九路军在上海击退日本军。“这一战，打起了中国人的信心，打出了一个榜样，使全中国的老百姓相信，日本人没有什么不可打！” 胡秋原说。战后十九路军调到福建。至是，十九路军通电，反对《塘沽协定》，这逐渐形成中央与十九路军之间的隔阂，终于十九路军在福建组成政府。这即是发生于1934年春的“闽变”。这时期胡秋原被任为文化部长，年仅二十四岁。徐复观后来写文章，提及“闽变”这件事，他说秋原一向以此为讳。我们觉得这是人生摸索途中、国家摸索途中很寻常的事情，不关是非荣辱。”胡秋原说，他不是以此为讳，只是不愿标榜而已。
012.国民党的特务信.txt	50	99-99	10	原来|说|回忆|死|求|请|太原	叶翔之（叶依仁的爸爸）是大特务。先后出任军事委员会调查统计局及国防部保密局情报及行动处长十多年，1960年起出任情报局局长，一干十四年。这封信是1962年3月16日写的，内容在为一个失业的老国特求职。按情报局的前身是保密局，再前身是军统局，由于国特众多，内斗激烈，很多人到了台湾，都被出局了。叶翔之介绍的这位还算是幸运的，有的人就倒霉多了。一位山西省的外围小国特宗荣禄，曾回忆他流亡到台湾后，“由保密局招待，住新北投旅社，房饭均由保密局负责”，但“上级有关单位并派人从旁监视”，人到台北，亦被跟踪。半年后，他转移到桃园员树林招待所，每天尸位素餐无事可做。要以入台证换领身份证时，局本部说：“以后还要回大陆，为免办出境手续，不要申报户口。”到了1951年政府取缔游勇散兵，招待所通知他不要外出，以防被当游勇散兵抓去，经他再三请求，局本部方出具证明，并替他伪造证件，说他与田俊、郭俊秀三人，系从监狱刑满释放，要补领身份证！有功不赏，反以囚犯相待，真气死人。宗荣禄是外围的小国特，怎么对待，固无论矣！但是田俊是军统局太原站站长，竟也比照“监狱刑满获释”方式铨叙，可就真太精彩了。——做国特的下场，原来如此！叶翔之这封信写去后，“徐主任”复信的批示极妙，原文如下：
017.国民党好人切腹记.txt	30	59-59	10	说|杀|死|求|请	到临汾后，日本人把我先拉到北城墙下刑场行刑，将捆绑解开，先照相，我振起精神，挺起胸膛，无畏无惧，让日本人看看中国人的死难精神，然后日本人对我说：“你们中国人刺啦刺啦的都死在这里！”我四顾一看，果然荆棘森严，我就向日本人说：“我要写信与家人诀别。”日本人给我纸、笔、邮票，我写了两封信，一封给家中，一封给李之仁神父，嘱他们为我献黑弥撒，多念经，公审判时，天主台前见面。我又怕日本人不转信，我要求将信转交给附近用水车浇地的老百姓，请他们代我投邮！我仰天一看，三月天气，晴朗无云，气候不冷不热，心平气和，无限轻松愉快，以为马上就与天主见面，何况又是为国而死，闭目省察自己所犯罪过，打开通功经，念临终经，发上等痛悔，想不到，竟蒙到天主降福，开启了日本人的心，居然将刺刀从我脖子收回没有杀死，至今脖子仍有刀割伤痕，原车把我带到临汾城内关押。……
017.国民党好人切腹记.txt	93	185-185	10	说|杀|求|请|共产党	我由保密局招待，住新北投旅社，房饭均由保密局负责，上级有关单位并派人从旁监视，我到台北，亦有人跟踪，半年后，我转移到桃园员树林招待所，每天尸位素餐无事可做，初要以入台证换领身份证，局本部称：“以后还要回大陆，为免办出境手续，不要申报户口。”迄四十年政府取缔游勇散兵，招待所通知我不要外出，以防被当游勇散兵抓去，经我再三请求，局本部方出具证明，并替我们伪造证件，说我与田畯、郭俊秀三人，系从监狱刑满释放，要补领身份证。如此颠倒是非，自欺欺人，将我们颁奖升级身份竟说我等是从监狱放出，有心之人孰不痛心！以堂堂锄奸机关，竟乃违犯法纪，伪造证件，真是滑天下之大稽！不向自己脸上贴金，竟往自己身上涂粪。苏洵《辨奸论》云：“凡事之不近人情者，鲜不为大奸慝！”常说日本人杀我、汉奸打我、共产党吊我，是我的光荣，证明我还有抗日反共精神意志，唯独国民政府，不仅不承认我的功劳苦劳，反而伪造证件，说我们是监狱刑满获释，狼吃了小孩，人不以为奇，妈妈吃了小孩才是真奇，我今天是被妈妈所吃。
017.国民党好人切腹记.txt	102	203-203	10	结果|问|答|说|死	白天拣废物，夜晚睡防空洞，无本取利，所以吃饭并不成问题。但因拣废物是与最穷苦人竞争，显得自己太没量，遂经在防空洞墙上写标语的陆景云与周飞介绍，到广告公司工作，该公司老板一开口就说：“做广告工作很苦！”我答：“愿意者不苦！”当天下午他就叫我用手拉车，从贵阳街淡水河边，将五千块砖拉到警察总局，第一车拉了一千七百块，很感吃力，第二车又拉了一千七百块，拉得我筋疲力尽，原因是手拉车，辕杆比人低，前面高了，砖块从车后掉下，若要前后平衡，即不能挺起腰，拉得我几乎要了命，真是活受罪，可是又想起自己曾对老板说：“愿意者不苦，再苦也要拉下去。”所以只好咬牙拼命。拉到西门町火车道旁，火车道比马路高，拉不动了，抬头一看，适值情报局同志许秉雪过来，我立即大喊：“许同志快来帮忙！”许把我看了一眼，竟扬长而去，我愤怒的用力一拉，砖块从车后全部落地，这时又怕火车汽车过来，急得我汗流如雨，幸亏路人帮忙装上才推过铁道，总算勉强拉回，三车已拉回两车，再苦也要拉完，抱定愚翁移山、耶稣背十字架之精神，死不退却，心中边走边念，自己鼓励自己，并想起老子的话：君子得其时则驾，不得其时则蓬累而行，遂对许秉雪之态度不以为然。到祖师庙口，心内灵机一动，在街上拣一草绳，量着肩膀与车高低，拴在辕杆上使车平衡。再将剩下的一千六百个砖装上，结果轻而易举的拉回，由此想起韩非子的话，做事要有方法。……
017.国民党好人切腹记.txt	144	287-287	10	问|死|请|国民党|共产党	窃宗荣禄，年五十五，原籍山西霍县，家世业农，系一天主教家庭，自幼接受教会教育，未染任何嗜好，中日战争开始，即追随雷鸣远神父及戴笠先生，参加抗日剿匪等工作有年，出生入死，历经华北各地，虽未尽歼敌匪，亦算略尽绵薄。三十八年共匪伪人民政府成立时，荣禄即在北平潜伏工作，三十九年奉命来台联系工作，终因上峰拖延不决，原留大陆同志相继归来，致使大陆工作无形消失，曾蒙团体豢养，并派保安司令部工作，终因缺乏证件，而遭摒弃，自感尸位素餐，遂请准在外自谋生活。荣禄自此痛下决心，拣废物，睡马路，节衣缩食，搭盖了现住延平南路一四三之三号之竹篷，户籍设于四十一年4月11日，店号万里程书店，营利事业登记证“北市商54字第53107号”，烟酒公卖局“零售商25498号”，月缴营业税36元，年缴所得税559.9元，尽国民应尽之义务，顷奉“520 府违一字第23795号通知，限6月10日前自行拆除，逾期市府派工拆除，希即来府洽领救济金”，遵即持函洽办，而该违建处理委员会面称，单身不配房屋，只领救济金三千元，以目前物价三千元可维持多久生活？且荣禄系合法商人，无房屋就无法营业，无职业就不能生活，无生活就无法缴税，无税收影响养兵施政，何况食衣住行为民生必需之四事，难道单身就不是人？闻政府辅导人就业，游民流氓尚且予以职业技艺训练，因单身不配房产，形成陷民废业，驱其流浪，如此情形处理事务，是否共党伪装分子潜伏在我政权内破坏政府和人民间感情，其手段之毒，无所不用其极，我执政当局亟应切实注意，发觉并铲除之。或曰碍于法令制度，察政治是保障人之善生安死，订法令制度要为社会上百分之八十以上无办法的人想办法，则法令制度才能行得通，宪法为国家根本大法，明文规定，国民政府首都为南京，总统任期为两任，能以非常时期增加临时条款，权变处理，凡为国民者亦应同沾雨露之惠。又曰妨碍交通，中山堂就是第一，察秋毫而不见舆薪。又马思聪、王朝天、刘承司等均得到政府特别优待，升官颁奖职业婚姻食住等问题应有尽有，真是忠贞不如反对，老国民党不如真共产党。胜利后裁员教训诚使亲者痛仇者快，又如联合国也如违建会一样拘于法令及众寡权势，则我中华民国之席次，岂不早已完蛋，还有什么四十几年，五十几年。忠言逆耳，良药苦口，恳祈垂察并饬所属，本先建后拆原则按需分配房屋，且荣禄曾当选过第九届好人好事代表，蒙全国各界颁奖表杨，并与各大学生出现台湾电视大同世界节目，十七年来扶持了四十多位大学生，已出国深造者七人，身虽孑然，济济多士，真是“和尚没儿同道多，野鹤无粮天地宽”。祈熟思慎行，重修法令，则国家幸甚、民族幸甚，临笔神驰，不胜迫切待援之至。
018.国民党的“家法办人”.txt	18	35-35	10	故事|说	“军统局”的后身是情报局，情报局的座右铭仍是“发扬清白家风，创造光荣历史”。为什么是“家风”？因为一切不天下为公，所以才只此一家。在只此一家的族制下，所有个人都是“家丁”“家奴”，完全失去了自己，变成了奉命唯谨的工具。但是，若说这些“家丁”“家奴”全然不能抗命，也不尽然。良雄《戴笠传》中就有这样一个抗命的故事：
023.国民党的“栽诬大宣传”.txt	12	23-23	10	杀|死|国民党	三、党外；国民党《黄河杂志》；1985年1月1日；从有关评论、分析、报导的文章上，发现“党外”作者群中，拥有大批侦探、判官，可以未探先知，不侦而判，“人才辈出”，不亦快哉。除非“党外”杀手参与了这件事，否则对江案的来龙去脉，又岂能了如指掌。更令人叹为观止的，是在美国 警方宣布凶手何人，美国国务院也表示该案与政治无涉后，若干“党外”杂志仍然“死鸭硬嘴巴”，一口咬定国民党与竹联帮挂钩，案子还是与国民党有关。（《党外随想录》）
001.国民党与云南起义.txt	48	95-95	9	说|杀|死|国民党	这篇文章的基本立意是根本否定梁启超“统筹领导”的功劳，而把它移花接木。它完全抹杀了梁启超这一方面的先知先觉、冒险犯难、四处奔波、千辛万苦，这种不公正，自是国民党窄化、小化梁启超一贯作业的延伸。左舜生在《文艺史话及批评》中曾感慨说梁启超死后数年，“国民政府曾有褒扬令之颁布，但令文专就其讲学诱掖后进立言，于民五、六两度维护民国之功，乃只字不及，不知令稿出于谁氏之手笔，果置事功不谈，而专言学术，则严又陵、王静安辈之可褒扬者，又岂在任公下乎？是知党见中人之深，虽至今犹无药可医也。”可算确评。国民党口口声声诬蔑梁启超“反对共和”，但是真正“再造共和”的，真正救了中华民国的——并且救了不止一次而是两次的（一次是云南起义；一次是马厂誓师），却不是国民党而是这位“余孽”。事实俱在、功勋俱在，又岂容国民党胡说八道吗？
001.国民党与云南起义.txt	63	170-170	9	说|他说|杀|死	这篇扭曲、窜改云南起义的文章，用心也无他，志在表明“洪宪帝制，终为本党所推倒”耳，但它通篇布局的方式，却和南京《和平日报》的手法一样，全无史学方法的论证，并且与史料不合。例如它说“护国讨袁，绝不是革命党人包办”，殊不知孙中山当时的决策，却正是“包办”的。孙中山早就说“共和之原，甚非野心妄人所得假借者也”，他说他的“始意”，是“负完全破坏之责”，也“负完全建设之责”（1916年《讨袁二次宣言》）。不但如此，孙中山甚至还不赞成暗杀袁世凯呢！他当时回信给黄兴，说：“若兄分途并进，以行暗杀，则殊碍吾事也！盖吾甚利袁之生而扑之，如兄计划成功，袁死于旦夕，则吾计划必坏。”（《黄兴集》）由此可见，这种要自己包办的心态，是不容否认的，但是想包办和能包办是两回事。薛君度《黄兴与中国革命》中论当时反袁团体，明确指出：
003.国民党与“锡安山事件”.txt	3	5-5	9	答|说|请|国民党	1983年1月29日，我写《极权中的化外之民》（《千秋评论》第十九期《脱轨·美感·屁》），大意说现代的桃花源，在台湾也不会有了。试看这一阵子的“锡安山事件”，就思过半矣！我举出国民党答复许荣淑的官样文章，明目张胆地告诉了我们在“山地管制办法”、“平地人民申请山地管制区设籍注意事项”等群法环伺下，一些为信仰而想到山上寻找“世外桃源”的人，也都丝毫没有机会了！——国民党统治下政府权力的“无微不至”，由此可见一斑了！我同时举出美联社10月22日从莫斯科的一个专电，专电上说：“一群苏俄地质学家搭乘直升机在西伯利亚偏僻的阿巴坎流域探测铁矿时，很惊奇地发现在山中的一片森林里面，有一座小村落。另令人吃惊的是，住在这个村落里的是七十九岁的李可夫以及他抚养长大的两男两女。李可夫的这四名子女是在虔诚的宗教信仰中成长的，他们与共产社会完全隔离。”这个专电，告诉了我们：在极权国家如苏联者，竟也有政府权力达不到的地方，他们政府“无微不至”的效率，比起自称民主国家的国民党政府来，还要略逊一筹呢！我的结论是回想1949年，台湾是大有为政府的“避秦之地”，但是三十三年下来，大有为政府却在自己避秦之余，不给别人“避秦之地”了。《桃花源记》作者笔下的“武陵人”，若生今之世、值此之岛，他除了找到“武陵外役监狱”，还能找到什么呢？
003.国民党与“锡安山事件”.txt	32	63-63	9	问|说|死|国民党	国民党不准他们住在锡安山，也不准他们在河床上望山兴叹，这对锡安山的先驱者说来，是“神”的问题，可是对国民党说来，却是“神经”的问题。国民党神经兮兮，它不喜欢外省的退役老兵和台湾的穷苦大众这样紧密的团结在一起，虽然他们的团结只是对神的顶礼与冀望，他们并没要造反，造反也不会在人间造，因为正如耶稣所说，他的国在天上，当然造反也该在天上。但是，国民党不管，国民党要天上人间，统统一视同仁。两千年前，刘家天下整人，把周亚夫下狱，理由之一是他儿子买了许多殉葬用的兵器，审判时御用法官问周亚夫：“你为什么造反？”周亚夫说：“我儿子买的，全是我死后埋在坟里的葬器，这叫什么造反？”可是法官说：“即使你不活着在地上造反，你死了也会在地下造反！”两千年过去了，国民党不但相信人会在地下造反，甚至会在天上造反了。——国民党挖空心思，把锡安山的先驱者给搅得鸡飞狗跳、民不聊生，目的无他，只是“替天行道”耳！国民党的闲事可管得真多！他们不但要“三民主义统一中国”，还要三民主义统一天堂呢！
005.国民党的裁缝将军之二.txt	43	85-85	9	最后|说|死|国民党	王昇外放真正可哀的，不是王昇自己，而是国民党本身。国民党革了九十年的命，最后革得要把自承“没带过一天兵”的“革命军人”外放为安、革得到处都是“东洋刀”、革得没有任何体制来新陈代谢、革得仍是宫廷政治的你死我活。……这真太可哀了。杜牧《阿房宫赋》说：“秦人不暇自哀，而后人哀之；后人哀之，而不鉴之，亦使后人而复哀后人也！”如今袁世凯不暇自哀，而国民党哀之。国民党哀之，而不鉴之。不知国民党是否还有后人可以复哀也。哀哉！
006.国民党政工头子投共.txt	13	25-25	9	问|雷震|国民党|一九四九	一九六〇年九月四日雷震被捕后，海内外舆论哗然，一时朝野关系相当紧张，草木皆兵；随之而来的，是“中国民主党”建党工作的溃散、雷震以“知匪不报”被判有期徒刑十年、《自由中国》半月刊被迫关门。……《自由中国》溯自一九四九年十一月二十八日创刊，到该刊发行人雷震被捕止，一共办了十一年之久，这十一年间，讨论的问题虽然非常广泛，但不外围绕“言论自由”、“反对党”、“军队国家化”、“自由教育”、“反共”等主题在鼓吹，谁知这一类自由主义思想的言论，当时竟招致国民党左右两派的凶狠夹击，不但夹击，王昇实际主持的国防部总政治作战部还以“极机密”的“特种指示”，炮火集中的向“毒素思想”发动“总攻击”！
006.国民党政工头子投共.txt	31	61-61	9	说|他说|雷震|国民党	马璧现在固然是一肚子“大便”，但在斗臭《自由中国》时代，他这些“大便”，却被奉为“黄金”呢！对于这种“大便”也好、“黄金”也罢，我们有必要再进一步做一点揭发，我们绝不代国民党“隐恶”！马璧在《中国宪兵》第八十七期中，曾以《防止断送民主自由的阴谋》为题，把《自由中国》拳打脚踢，打得雷震等人“满面全豆花”，他说：
006.国民党政工头子投共.txt	42	83-83	9	说|笑|雷震|国民党	马璧以上的所谓“反对党”言论，原载《政治评论》第一卷第四期，瞎扯了一大堆，无非在说明雷震等人“为了‘反对’而组‘党’”是不对的。这不是既可笑又幼稚吗？党外人士在国民党长期一党独大的统治下，不反对它的一切不合理，那要反对什么？不反对它的政治、经济……全面垄断，又要反对什么？“为了‘反对’而组‘党’”，这正是全世界的民主潮流，马璧的颠倒黑白，只是国民党制式怪论而已。
006.国民党政工头子投共.txt	57	113-113	9	问|说|求|国民党	看了上面这些马屁正反合理，谁又能想到，说这些堂皇之言的人，自己竟是最优于把这些话用行动涂黑了的人。马璧任职过的国防部总政治作战部，原是要求达成“反攻复国”的“重责大任”的，谁知道国民党政府在“复国”未成之前，他们的马屁专家就先行反攻倒算，投奔大陆去也！“察其言而观其行”，试问在台上的他们，又怎么下台呢？
