file	paragraph	score	chars	preview
097.民进党绝非佳兆也.txt	2	7	162	唐朝玄武门之变，李世民的哥哥李建成、弟弟李元吉都被杀。唐高祖问左右意见，萧瑀、陈叔达说：“建成、元吉本不预义谋，又无功于天下。”无功如此，竟想夺权，自然招祸。今天的所谓民进党新贵，大都也是“不预义谋，又无功于天下”的党外投机者，这种人篡夺党外正统，一如当年蒋介石篡夺国民党正统，对党而言，绝非佳兆也。（1986年12月9日）
099.只要前三名还算客气的呢！.txt	2	3	220	1979年6月，远景出版社沈登恩为我印《独白下的传统》。我在扉页里自我歌颂，说：“五十年来和五百年内，中国人写白话文的前三名是李敖，李敖，李敖，嘴巴上骂我吹牛的人，心里都为我供了牌位。”——这几句“复出题辞”，看过的人，震于气魄者固多，骂我吹牛者亦不少。殊不知《释常谈》中记谢灵运的话，比我还吹得凶。谢灵运说：“天下才一石，曹子建独占八斗，我独得一斗，天下共分一斗。”可见我只要前三名而已，谢灵运和曹植却要十分之九呢！（1987年2月6日）
101.“知彼知己，量敌为计”.txt	1	2	11	“知彼知己，量敌为计”
101.“知彼知己，量敌为计”.txt	2	2	34	《梦溪笔谈·权智》写韩信知兵，善于“知彼知己，量敌为计”，最为精采：
101.“知彼知己，量敌为计”.txt	3	5	498	韩信袭赵，先使万人背水阵，乃建大将旗鼓，出井陉口，与赵人大战，佯败，弃旗鼓，走水上。军背水而阵，已是危道，又弃旗鼓而趋之，此必败势也。而信用之者，陈余老将，不以必败之势邀之，不能致也。信自知才过余，乃敢用此耳。向使余小黠于信，信岂得不败？此所谓“知彼知己，量敌为计”。后之人不量敌势，袭信之迹，决败无疑。汉五年，楚、汉决势于垓下，信将三十万自当之，孔将军居左，费将军居右，高帝在其后，绛侯、柴武在高帝后。信先合不利，孔将军、费将军纵楚兵不利，信复乘之，大败楚师。此亦拔赵策也。信时威震天下，籍所惮者独信耳！信以三十万人不
102.抢夷齐与抢荷马.txt	2	2	408	伯夷、叔齐饿死在首阳山，首阳山在哪里？众说纷纭，但“后世好奇之士，争欲私之”（杨恩《首阳山辨》中语）。结果有的说首阳山在辽西、有的说在偃师、有的说在蒲坂、有的说在陇西、有的说在歧山之西，遂有五首阳之说。其实这种锦上添花式的附会，西方也一样。荷马死后，有七个城市“争欲私之”。海伍德（Thomas Heywood）说荷马生前在七城无片瓦（Seven cities warr'd for Homer, being dead，／Who， living， had no roof to shroud his head．）；苏厄德
103.警备总司令大发雷霆.txt	2	3	113	下午消息：前天晚上，“陈守山上将”在夜市私访，看到李敖著《蒋介石研究续集》一册，昨天一早开会，大发雷霆，责手下查禁不力，李敖的禁书竟有漏网！10点钟起，各路人马分批倾巢而出，约五十余人，到各书摊反复做地毯式搜查，闹到夜深方停。
104.法律延宕也别有好处.txt	2	3	183	哈姆雷特（Hamlet）把“法律的延宕”（the law’s delay）列为人生苦痛之一，但对我说来，却觉得延宕之中，也别有一种凌迟敌人的战斗风味。洋人谚语说：“Sow the wind and reap the whirlwind．”（恶有加倍恶报；恶事之报，果大于因，为恶者终食更恶之果。）看到在延宕中，敌人一个个遭到加倍恶报，不亦快哉！（1987年3月8日）
106.望风.txt	2	4	175	侯赢望风刎颈，报知己也；李陵望风怀想，念知己也。望风是一种浩瀚的心境。侯赢出了险棋给信陵君下，在信陵君奔赴前线的时候，七十岁的侯赢说我太老了，不能共患难，但是算计你们到达前线的时候，我“北乡自刭，以送公子”（面向北方，以自杀来答谢你，给你送行）。侯赢这种奇人奇事，千载之下读之，犹令人震撼不已，这种隐士，真是隐而不退的大豪杰啊！（1987年3月9日）
107.一榻内外.txt	2	3	196	胡虚一先生算是“大有为政府”肯照料的老退伍军人之一，前些日子他被恩准有终老之所，他兴致冲冲，跑去一看，原来终老之所竟是一间房中许多榻榻米中的一块榻榻米！国民党如此待遇大陆老兵，真堪令人痛恨！宋人笔记《邵氏闻见录》记宋太祖冒风雪夜访赵普，说：“吾睡不着，一榻之外，皆他人家也。”宋太祖的意思是敌国未灭、天下犹非我所有之意，如今天下非国民党所有，所以一榻之内，即他人家矣！（1987年4月13日）
108.死后走运与死后发财.txt	2	3	205	美联社伦敦3月31日电讯说：“印象派大师梵高一生穷苦潦倒，他的名画《向日葵》，生前连125美元也卖不出，结果30日在克里斯蒂（Christies）拍卖公司竟以有史以来最高的价格卖出。一位匿名买主采电话竞标，以3985万美元的高价买下，创下了画作拍卖的新纪录。”按这天拍卖之日，正是梵高134岁冥诞。此公生前潦倒，死后走运，他做梦也没想到，在他134岁生日之日，竟可这样为人大发死后财也！（1987年4月13日）
109.旅美六人电话.txt	2	3	100	下午会云、黄三、继梅、以棋、绪华、Leslie六位，从休斯顿来电。黄三说：“殷海光生前对我说：‘我不要死，我要睁着眼睛看他们如何收场。’可是殷海光死了，我们可要活着看收场啊！”（1987年4月26日）
110.掐死“伪”文星.txt	5	4	222	问我是否仍同意和解，我说同意。林建说他在星期天（26日）再去看萧孟能，敲定后，晚上给我留字，将于星期一（27日）约我一起去土城看守所当面与萧孟能大家签字，问我可方便？我说：“诸葛亮三气周瑜以后还去东吴吊周瑜丧呢，有什么不方便？我去看孟能，我还会买点水果送他呢！不过水果是在土城看守所福利社就地买的，不是从台北买了带去的，免得孟能怀疑我毒他。土城看守所福利社卖的水果，不经买方的手，就直接送到囚犯手上了，可以放心吃呢！”林建、信疆听了，都笑起来。
111.只准家祭，不准奔丧.txt	4	3	67	最近有劳工写信请教“省政信箱”，指称劳工的父母在大陆死亡，有电信证明是否可以请“丧假”，省社会处长许荣宗针对此一问题，做了以上的表示。
112.吴越潮死了.txt	2	2	94	今天《新生报》登洛杉矶4日专电：“立法委员吴越潮今天因心脏病病逝此间寓所，享年七十三岁。吴越潮毕业于北京大学，曾任黑龙江省政府财政厅长、中华民国财政学会理事长、中国租税研究会理事长等职。”
113.萧郎的无奈.txt	2	6	120	小蕾电李放，说陆啸钊去探监会萧孟能，啸钊说你跟李敖是多年老友，如今李敖坚持你道歉才不追究你诬告他的官司，我看你就道个歉吧。孟能面露无奈之色，说：“我愿意道歉，你去问问剑芬吧。”王剑芬竟有如此女权，我听了，一直忍不住笑。（1987年5月6日）
114.“没有人敢告他”.txt	1	2	8	“没有人敢告他”
114.“没有人敢告他”.txt	2	3	97	今天上午在地院十七庭开控司马文武等八人庭。司马文武说李敖写文章也有骂人的话，推事黄德贤说：“那是另一回事，别人可以告他，与本案无关啊。”司马文武说：“可是，没有人敢告他。”（1987年5月7日）
116.追加的眼泪.txt	2	3	93	小女生拔牙回来，告诉我说，她在牙医那儿，看到一个小男孩拔牙后好一阵，突然哭了，医生问他是不是疼？他说现在不疼了，可是刚才拔牙时好疼。人能把眼泪这样追加，真是有趣。（1987年8月25日）
117.“敌无分生死”.txt	1	2	7	“敌无分生死”
117.“敌无分生死”.txt	2	3	116	当年蒋介石在庐山谈话时，说“如果战端一开，那就地无分南北，人无分老幼”，都要迎战。如今我却以为，要再加上“敌无分生死”，才能更尽此义。例如我对蒋氏父子，便是如此。对死者鞭尸、对生者追击，这才是复仇者的公理啊！（1987年9月23日）
118.从“李敖死了”到“蒋经国死了”.txt	1	2	15	从“李敖死了”到“蒋经国死了”
118.从“李敖死了”到“蒋经国死了”.txt	2	2	131	在所谓党外人士、所谓民进党员印行“李敖死了”谤书的时候，在所谓无党无派独立经营的国民党同路人刊出“李敖死了”广告大为宣传的时候、我却夷然出版“蒋经国死了”（《蒋经国研究》）的书。谁的境界高、谁的胆量大、谁的枪口真正对外，明眼人一看便知矣！（1987年9月23日）
119.小偷的逻辑.txt	2	4	116	王小痴告人盗印他的文章成书，被告当庭陈述，反倒责怪王小痴说：“原告方面太不体谅人了，他不知道我们印这些书，半夜里搬来搬去多辛苦！”云云。所有小偷都是半夜不能睡觉，出门辛苦的，这样说来，他们不但没罪，还该慰劳呢！（1988年3月4日）
122.要吓一千年后的人一跳.txt	2	6	227	中国小姐选拔，由名女人崔苔菁等担任评判，其结果必选出丑女无疑，以崔苔菁等雅不欲有美人出其头地也！最后选出胡翡翠来，在环球小姐选拔会上果然不堪一竞，被各国佳丽比得大惊失色，连前十名皆未入围、连“地主国”保障名额都无可救也！最妙的，事后记者问她：“若要在地下埋一个千年后才被世人发现的物品，想埋什么？”胡翡翠说：“我的照片。”可见这位女士雄心不小——她的尊容，不但今天吓了中外人士一跳，还要吓一千年后的人一跳！人之不自知也，由此可鉴。（1988年5月25日）
124.双料伪善.txt	2	6	80	西藏佛棍口口声声不用农药、不杀生，但是却大吃牛羊肉，若问这不是杀生吗？他们却说：“不是我杀的。”他们同时还最看不起屠夫，此真双料伪善矣！（一九八八年五月三十日）
126.末.txt	2	3	225	“末”是中国传统的戏剧脚色名目，一般演中年以上男子。元曲中本以“末”与“旦”为当场正角，到了传奇至昆曲，又以“生”“旦”对立为正角，但以“末”开场。所以从字面上看，“末”像收尾，但其作用，又是开场。末代皇帝溥仪这个人，是中国帝王之“末”，但又何尝不是中国平民之“末”？此人的象征意义，真是古之所无、今之绝有。他从帝王转为囚犯、再从囚犯转为平民的过程，最富传奇性。研究这一个人，无异研究了最好的取样，他是人类浮沉对比最强烈的缩影。（1988年6月7日）
128.极权国家的言论尺度.txt	2	2	214	极权国家的言论尺度不是一个，而是两个。一个是官方允许的尺度，一个是因恐惧官方而自我设限的尺度，后者其实比前者还严。前者的尺度是“剃刀”，后者的尺度是“剃刀边缘”，为了跟剃刀保持一点安全距离，所以不能紧逼边缘，而要留点空间。这一空间，就使上限更下降了。按说言论的尺度是要愈来愈突破它的，可是国民党极权下的知识分子没胆量，却愈来愈躲开它，结果“君子自重”的自我设限，比官方允许的极限还要低，官方高枕大乐矣！（1988年11月26日）
129.孙立人种种.txt	2	4	77	昨晚王企祥电话中说：“你不能要求孙立人不愚忠，不愚忠，就不是孙立人了。他在美国念军校，效忠是基础训练之一，所以，不论蒋介石怎么对不起他，他还是不会造反。”
129.孙立人种种.txt	3	2	72	今天午后潘德辉来、陈良埙来。潘德辉说他从台中孙府来，专程转告孙老总叫他转告李先生的话：“衷心感谢李先生，将来身体好些，会到李先生府上登门拜访。”
130.从以文会友到以舞入党.txt	3	2	61	古人以文会友，今人则以舞入党，国民党入党仪式一直是庄严的、神秘的，如今却不择手段一至于此，真可悲也！（1989年1月1日）
131.如此学者教授.txt	2	3	101	陈宏正又来向我借资料。我说：“你一再找我提供资料，你到底借给谁呀？”他说：“是张忠栋托我借的。”我说：“这些学者教授们，他们自己没有本领，却老是靠我们。学者教授是这样成名的吗？”（1989年1月18日）
132.非法当选的首届国代.txt	2	8	462	本月9日，张俊宏、许荣淑请晚饭。许荣淑助理吕金霙问国大选举内幕资料，我说可查《国民大会实录》，并“指示”她哪里可以找到。十天后见报，知道张俊宏主持的台湾政治经济研究室公布报告，共计有四〇九名老国代是非法当选的。报告指出至少有三大疑点：一、当年选举时全国已有七百零二个县市（包括蒙古七盟旗在内）沦陷匪区，其选举系由设在各地的“绥靖公署”负责登记该沦陷区的难民，而由难民互选，各地“绥靖公署”登记的难民多则数百人，少则仅五六人，但也能选出代表其原籍的“中央民代”。据调查，至少有八百零六位国代属于这种“难民民代”或“旅客民代
134.日久见人心.txt	2	3	88	荣文请晚饭，谈到出版甘苦，谈到柏杨不守每月交稿一册的约定。我对席上陈宏正、苏荣泉说：“王荣文与柏杨接触得愈久，愈发现李敖多么好。”王荣文听了，为之苦笑。（1989年2月23日）
