file	paragraph	line_start	line_end	char_count	score	snippet
014.控《求是报》股东案之二.txt	26	51	51	422	5	二三、板桥市中山路2段465巷32号二楼邱南英先生7月23日来件说：“订阅贵报至今，风波屡屡，报纸不能按日送达，已成惯例，我于不耐烦再拨电话催问之下，只有写信申诉。事由如次：（一）贵报送发报系统，运作并不稳定，不问真实原因如何，我未能收到手的报纸计有：（4、5月份不列）6月22、25、26、28、30日，7月 1、2、3、4、5、10、11、18日（22日之...
015.这叫什么账！.txt	15	29	29	181	5	十二、他们报出《求是报》电脑打字及照相打字费用（2、3、4、5、6、7月）927377元，按照“合约书”第八条，乙方将其资产给予甲方百分之三十三之股份，打字费用为泰来公司收入，为何不分给李敖？且泰来公司并非专为《求是报》打字，也对外营业——在李敖提供的“白宫大厦十二楼之五房屋”中对外营业，收入为何不分给李敖？在合伙的房屋里搞“独立王国”，分文不付，这是什么账...
015.这叫什么账！.txt	16	31	31	747	12	十三、泰来公司早在跟李敖合作办报一年前，就成立了，“员工资料卡”上打字小姐孔慧英等早在“七十八年10月1日报到”（附证三）可以为证。被告与李敖合作，把打字小姐们带入，但属泰来公司，与《求是报》无关。被告在有违《民法》第686条1项、2项情况下要求拆伙时，同意以“合约书”中“写研电脑排版设备”、“不断电装置”、“大光华个人电脑设备”等所在之“厂”，折抵李敖百分...
015.这叫什么账！.txt	19	37	37	485	3	十六、本案的关键是在被告被诉背信罪及业务上侵占罪。以一例为证。《求是报》创刊后，李敖老友赖宪沧先生，开出36000元支票一张，订阅全年十份（每份全年3600元），并附十人名单地址一纸，嘱分送其本人与九位友人。不料非但不逐日分送报纸，反倒在收款以后，另有重复向受赠友人收款情事。赖宪沧先生初不知情，后有友人引以为疑，婉为相告，赖先生始向李敖垂询，经李敖向被告追查...
018.法官任鸣钜、郑景文、郭美杏怎样枉法开脱国民党大员秦孝仪？.txt	2	3	3	85	3	国民党大员秦孝仪诽谤李敖案，台北地方法院法官任鸣钜、郑景文、郭美杏竟在判决书中，以连用十五次“误认”的字眼，曲予开脱，不敢判他的罪，李敖当然不服，特以上诉理由状陈明十点：
018.法官任鸣钜、郑景文、郭美杏怎样枉法开脱国民党大员秦孝仪？.txt	7	13	13	88	3	事实上整件事是有过程的，这是过去我没说过的过程，先是李敖有张所谓宋代“周越跋王著千文”，过了二天，他们威胁说，若我不买“周越跋王著千文”，他就要公布一些事，我对他说你公布好了。
018.法官任鸣钜、郑景文、郭美杏怎样枉法开脱国民党大员秦孝仪？.txt	24	47	47	84	3	这段话有主词“李敖”，后面有三个代名词“他”字出现、一个代名词“你”字出现。一望而知他”、“你”是指“李敖”无疑。秦孝仪被告后，意图狡赖，在答辩状上和笔录上，都改口说：
018.法官任鸣钜、郑景文、郭美杏怎样枉法开脱国民党大员秦孝仪？.txt	35	69	69	68	3	秦孝仪说他因立委颜锦福质询，他基于职责，不得不答，但可怪者，在3月27日应询同一天，他即席竟能提出事先打字好的十页密件，他答复颜委员说：
018.法官任鸣钜、郑景文、郭美杏怎样枉法开脱国民党大员秦孝仪？.txt	43	85	85	146	3	另外，李敖为驳斥秦孝仪口口声声售“周越跋王著千文”不遂以致生衅的谎言，曾当庭举出十四年前所发表的《给秦孝仪先生上一课》（登在1982年5月9日《深耕》杂志第九期）一文，以证十四年前，秦孝仪还没做故宫博物院院长呢！难道十四年前批评他，就因有售字不遂的事件了么？今年12月3日笔录中，有这样问答：
018.法官任鸣钜、郑景文、郭美杏怎样枉法开脱国民党大员秦孝仪？.txt	64	127	127	255	4	奇怪的是，遍查李敖这篇论文，没有一个字提到周越墨迹的所有人所有权问题，又何来“再三自认”？李敖全文谈的都是周越墨迹的学术地位艺术史地位问题，秦孝仪何能瞪着眼睛乱读文字、胡说八道？李敖论文中谈到台大艺术史研究所所长来看周越的字，但那是陈兆基送来托李敖向学者们请益的，何能乱读文字，以此推论为李敖所有？李敖论文中提到他与陈兆基共同研究周越墨迹、共同撰文，又何能乱读...
018.法官任鸣钜、郑景文、郭美杏怎样枉法开脱国民党大员秦孝仪？.txt	71	141	141	291	3	秦孝仪又在答辩状中争执说：上述《时报周刊》等媒体报导，“从未见自诉人作任何申辩澄清”，意谓既未更正，等于默认云云。这种“秦氏罗织学”，令人发笑。新闻媒体报导错误，当事人岂有必要或闲工夫一一更正？例如李敖拍卖内容六十件，有《李敖所藏中国美术精品》专书可稽，明明没有“周越的字”，媒体误传，又何足介怀？何况媒体习性，也难于一一更正，此由李敖与《中央日报》更正纠纷可...
018.法官任鸣钜、郑景文、郭美杏怎样枉法开脱国民党大员秦孝仪？.txt	72	143	143	412	3	最可怪者，“秦氏罗织学”一再咬定“周越的字”为李敖所有，其实纵使为李敖所有，又怎样？按照《国立故宫博物院组织条例》第1条、第2条，对“中国古代文物艺术品”之“征集”、“搜购”，本为职责之一；复按《国立故宫博物院藏品征集办法》第一章、第二章，“征集”、“搜购”办法亦有专章。既有中国古代重要文物艺术品如“周越的字”在外，依照故宫法定职责，奔走争取都来不及呢，又何...
018.法官任鸣钜、郑景文、郭美杏怎样枉法开脱国民党大员秦孝仪？.txt	74	147	147	116	3	秦孝仪捏造事实，经陈兆基到庭作证后，已一切穿帮。陈兆基庭证说他“另有在八十三年7月下旬见过秦孝仪一次面”，第二天写信给杨“大使”、蒋“秘书长”及秦“院长”三人，原信俱在，全无“威胁”之事。最离奇者，今年12月3日笔录中，有这样问答：
018.法官任鸣钜、郑景文、郭美杏怎样枉法开脱国民党大员秦孝仪？.txt	75	149	149	59	3	法官问：自诉人称〔被告〕在立法院称如果我不买“周越跋王著千文”，他就要公布一些事，我对他说你只好公布，被告用何方法说？
018.法官任鸣钜、郑景文、郭美杏怎样枉法开脱国民党大员秦孝仪？.txt	77	153	153	189	5	对照起《立法院公报》中秦孝仪的原文：“过了两天，他们威胁我说，若我不买……他就要公布一些事，我对他说你公布好了。”原来“我对他说”那一情况竟是子虚乌有的！原来竟是秦孝仪“我心里想的”的“秦氏幻觉”！——堂堂故宫博物院院长，竟敢在堂堂国会庙堂之上，公然扯谎，把幻觉当事实来诽谤他人，这是什么作风呢？如此明目张胆的恶劣行径、如此胆大妄为的目无法纪，法官再不判他的罪...
019.法官戴章甫、黄腾耀、阮富枝枉法裁判举证.txt	2	3	3	145	5	李敖控告国民党大员秦孝仪两个罪：诽谤罪和使公务员登载不实罪，台湾高等法院法官戴章甫、黄腾耀、阮富枝却枉法裁判，不但判秦孝仪无罪，还写了“不得上诉”四个字，封杀李敖的上诉权、封杀了《宪法》第16条的人民诉讼权，这种封杀，简直是司法史上的一大笑话。法官戴章甫、黄腾耀、阮富枝枉法情况，分列于下：
019.法官戴章甫、黄腾耀、阮富枝枉法裁判举证.txt	4	7	7	95	3	法官戴章甫、黄腾耀、阮富枝判决“不得上诉”，乃根据《刑法》第214条使公务员登载不实罪是“三年以下有期徒刑”，而三年以下不能上诉第三审，殊不知秦孝仪是公务员身份，按《刑法》第134条，明定：
019.法官戴章甫、黄腾耀、阮富枝枉法裁判举证.txt	21	41	41	52	3	〔矛〕秦孝仪又说：“李敖……威胁说，若我不买‘周越跋王著千文’，他就要公布一些事，我对他说你公布好了。”
019.法官戴章甫、黄腾耀、阮富枝枉法裁判举证.txt	23	45	45	70	3	法官问：自诉人称〔被告〕在立法院称如果我不买“周越跋王著千文”，他就要公布一些事，我对他说你只好公布，被告用何方法说？秦孝仪答：我心里想的。
019.法官戴章甫、黄腾耀、阮富枝枉法裁判举证.txt	24	47	47	152	4	对照起“我对他说你公布好了”之言，原来“我对他说”那一情况竟是子虚乌有的！原来竟是秦孝仪“我心里想的”的“秦氏幻觉”！——堂堂故宫博物院院长，竟敢在堂堂国会庙堂之上，公然扯谎，把幻觉当事实来诽谤他人，足证根据秦孝仪自己的口供，就证明了他把“明知为不实”之事，使立法院的公务员“登载于职务上所掌之公文书”！
019.法官戴章甫、黄腾耀、阮富枝枉法裁判举证.txt	37	73	73	191	3	查《刑法》第13条明定：“对于构成犯罪之事实，明知并有意使其发生者，为故意。”本案秦孝仪明明答非所问，并且不问即答，且以不实之言作答，其故意行为，已极明显。法官戴章甫、黄腾耀、阮富枝非但舍故意不论，反倒故意曲解法文及判例以殉之，枉法裁判，亦极明显。尤可异者，是判决书中发明所谓“主动”“被动”之说，认为“秦孝仪系应立法委员之主动质询，而为被动之答复”云云，但在...
019.法官戴章甫、黄腾耀、阮富枝枉法裁判举证.txt	50	99	99	89	3	事实上整件事是有过程的，这是过去我没说过的过程，先是李敖有张所谓宋代“周越跋王著千文”……过了二天，他们威胁说，若我不买“周越跋王著千文”，他就要公布一些事，我对他说你公布好了。
019.法官戴章甫、黄腾耀、阮富枝枉法裁判举证.txt	52	103	103	141	3	综上所陈，法官戴章甫、黄腾耀、阮富枝已明显以“有审判职务之公务员”身份，“为枉法之裁判”，实已涉及《刑法》第124条之罪嫌。二九上1474号判例说得好：“《刑法》第124条所谓枉法之裁判，系指故意不依法律之规定而为裁判，质言之，即指明知法律而故为出入者而言。”本案的判决，恰恰如此。
020.控秦孝仪使公务员登载不实状.txt	7	13	13	281	3	“这件事是在大院教育委员会由某位委员所问起，若真是国父墨宝，故宫为什么不买？我回答那位委员，说这件事有疑问恐怕是假的。不过这件事我不愿意在此地多加说明，同时也不愿意向委员答复这个问题，但我又不能不答复。事实上整件事是有过程的，这是过去我没说过的过程，先是李敖有张所谓宋代‘周越跋王著千文’，原本他以二百元买下，经过多年以后，要卖四千万，当时我们考量故宫的五千万...
021.检察官李建忠怎样移花接木？.txt	2	3	3	101	3	士林地院检察官李建忠在“八十七年侦字第11398号”不起诉处分书中，公然触犯《刑法》第125条第1项第3款“明知为有罪之人，而无故不使其受追诉或处罚”的规定，开脱国民党大员秦孝仪，其渎职情况，证据如下：
021.检察官李建忠怎样移花接木？.txt	3	5	5	104	3	甲、“八十四年4月27日”出版之《立法院公报初稿》第三十四期中，192页至193页登有立法委员刘瑞生质询和故宫博物院院长秦孝仪的答询，其中秦孝仪忽然答非所问，说李敖“威胁”他，要把“周越跋王著千文”售给故宫。
021.检察官李建忠怎样移花接木？.txt	4	7	7	111	4	乙、秦孝仪所说，悉属捏造事实、滥施诽谤。因为：（一）李敖根本没有向故宫卖任何东西之事。（二）除了在法庭上见过或骂过被告秦孝仪外，根本就不认识他，跟他没有任何形式的通话，何来所谓的“他威胁我说”、“我对他说”的天方夜谭情节？
021.检察官李建忠怎样移花接木？.txt	5	9	9	158	4	丙、上一天方夜谭情节，秦孝仪被迫自己提供了真相，在“八十五年度上易字第5907号”案笔录中，他当庭供称：并没有李敖威胁之事或他对李敖说话之事，全部情节竟是——“我心里想的” ！（附证一——“1996年12月3日”该案笔录影本）这种国民党大员，他可以把他“心里想的”幻想搬到立法院，作为事实，使立法院的公务员登载不实！
021.检察官李建忠怎样移花接木？.txt	8	15	15	159	3	秦孝仪犯的罪，是典型的使公务员登载不实罪。按照《刑法》第214条，明定构成使公务员登载不实有三条件，即“①明知为不实之事项，②而使公务员登载于职务上所掌之公文书，③足以生损害于公众或他人者，处三年以下有期徒刑、拘役或五百元以下罚金”。本案秦孝仪所为，套在这条刑法上，可说丝丝入扣，其符合三条件部分，列表以明，一见便知：
021.检察官李建忠怎样移花接木？.txt	13	25	25	257	3	按《刑法》第10条第2项称：“公务员者，谓依法令从事于公务之人员。”则在立法院为秦孝仪做记录并印出公报之人属之。再按第3项：“称公文书者，谓公务员职务上制作之文书。”复按1964年台上字第2905号：“该条以文书论之文书，指在纸上或物品上之文字、符号，依习惯或特约足以为表示其用意之证明者而言。”则任职立法院之公务员从所做记录到印出《公报》之纸上文字皆属之。比...
021.检察官李建忠怎样移花接木？.txt	15	29	29	113	4	云云，其实全是比拟不伦，因为《刑法》第214条之罪，只要构成三条件即已足并自足，何来“复须一经他人之声明或申报”另一条件？何况，检察官李建忠所援引的“七十三年台上字第1710号判例”，是用移花接木的手法的，因为该判例最后明说：
021.检察官李建忠怎样移花接木？.txt	17	33	33	183	3	可见检察官李建忠明明在移花接木，因为该判例：（一）适用“声明或申报，公务员尚须为实质之审查，以判断其真实与否，始得为一定之记载”，但立法院的公务员，对秦孝仪答询并无实质之审查或判断其真实与否之权，而必须全文照刊，根本不发生检察官李建忠所说的问题。（二）该判例明明针对当事人“以伪造之杜卖证书提出法院”而来，完全不是秦孝仪的情况，检察官李建忠移花接木，显然禁不住...
022.驳王令麟等答辩状.txt	38	75	75	80	3	（三）关于带动《惊报台湾》和《夜线新闻》等节目部分，请法官调《李敖黑白讲》播出前之SRT“节目总排行表”等，一核便知。何况，据1月22日《中时晚报》（附证七）：
022.驳王令麟等答辩状.txt	55	109	109	100	3	（四）何况，70多万元也好，700多万元也罢，他都没赔，因为根据《有限电视法》第38条：“广告时间合计不得超过该节目播送时间百分之十”，即一小时六十分钟可播出六分钟广告，《李敖黑白讲》的广告年收益是：
022.驳王令麟等答辩状.txt	60	119	119	80	3	（七）《李敖黑白讲》每天9点档播出半小时，9点半后带动《惊报台湾》与《夜线新闻》证据在东视内部文件——“综合台晚间时段收视率推估”（附证九）中，有白纸黑字如下：
022.驳王令麟等答辩状.txt	66	131	131	184	4	则全属电视界笑话！电视成本计算，悉按契约，契约明订125000元，又何来什么“直接制作费用”和“间接分摊费用”。这种笑话，一如牛肉面老板开店，在每碗80元收费后，又向顾客额外加收“直接制作费用”水电、桌椅板凳多少钱；“间接分摊费用”房租、厨具碗筷多少钱，天下有这种卖面的算法吗？顾客不进门吃你80元一碗的面，你的店还是要开，房租等等还是要付啊！这些钱怎能算到顾...
022.驳王令麟等答辩状.txt	76	151	151	117	3	至于是否确定被告王令麟等说过种种诽谤之言？确定的理由是：一、媒体刊出后，并没更正；二、答辩状上并没否认；三、到庭后也没否认。可见说过属实。在4月30日笔录中，明确有被告王令麟“确实有记者访问我，我也有讲”的记录，并且，还有这样的问答：
