file	paragraph	line_start	line_end	char_count	score	snippet
001.怎样修理财阀.txt	15	29	29	332	4	土地是建厂的根本，土地问题不先解决，一切都将无法推动。这算不上是企业管理，这是常识。本公司成立在1973年5月16日，在成立以前，本该早就一一调查清楚，拟好具体计划，自无成立后才慢动作的买那块地的道理。可是辜振甫先生的办事方法很迟钝，他竟在公司成立后，拖了四个月零十一天——就是浪费了足足一百三十五天以后，才把买新竹县香山土地的申请书转到建设厅，结果以两天之差...
001.怎样修理财阀.txt	17	33	33	495	4	香山土地五甲七分的大损失以后，辜振甫先生“为防长期拖延或不能核准”，开始迁居。他的人身和念头都开始南下，他看中了苗栗头份石油化学工业区，因为这个地区的优点是：“天然气供应极为方便，所有公共设施均已建设完成，建厂时无须再为运输或补给设备另加费用。”于是他在10月底写信给中油公司，价让土地。如果这个苗栗县的地区有这种“优点”，那就反证了9月间——也就是一个月前他...
001.怎样修理财阀.txt	19	37	37	215	6	在碳烟厂创业原估中，土地部分原估只花九百零两万八千元。但因辜振甫先生的失职，整个的原估全部打破，调整后预算变成五千四百三十八万元，比较增减数上面增加了四千五百三十五万二千元，一下子增加五倍多开支，反证创业原估的编列，比算命乱猜还不准，因算命乱猜，也差不了五倍之多！高雄林园土地突然支出四千五百万，这钱不得不花，是因辜振甫先生南来“顿感”（突然感到）而起。据本公...
001.怎样修理财阀.txt	23	45	45	167	3	辜振甫先生“顿感”以后，碳烟厂改在南部林园工业区兴建。拖到1973年11月9日，就是在本公司成立半年时候，才开始写信给工业局，“价拨建厂用地十二公顷”。到了1974年3月，工业局才核拨“建设用地十公顷”，前后已消耗了九个月。这时候，辜振甫先生的无能又一次发生作用，林园建厂又出现新失误，1974年5月17日，本公司成立一年时的惨相是：
001.怎样修理财阀.txt	27	53	53	171	3	然后才开始买地的。既然是“经数次勘察研究”过，怎么如今又“经实地勘察发觉此区中间现有甚大鱼塭”了呢？“鱼塭”既云“甚大”，自然不该在“数次实地勘察研究”时看不到，连照相机上鱼眼都能看到的鱼塭，哪有人眼看不到的？像这样明显的无能，所造成以后“打桩”“改配”“填砂”“填土”以至“地价”“缴款”……种种纠纷与浪费，我们被欺蒙的股东，又怎么坐视呢？
001.怎样修理财阀.txt	31	61	61	356	3	从这报告里，我们明明看到美国大陆公司“曾派技术人员来台勘察香山地形，分析土质”等等，直接因香山梦所虚掷的金钱，自然可以想见。因为美国大陆公司于1973年11月就以香山为对象设计完成并分批寄交基本设计图了。在“中国合成橡胶公司碳烟厂创业预算”表上，我们明明看到“工程设计费”下注“系委托工程公司设计一切费用”，费用高达一千二百万！“工程公司设计一切费用”已经高出...
001.怎样修理财阀.txt	40	79	79	572	4	有点工业常识的人就知道，橡胶工业在工业中，年岁是老大哥。关于这种产品，远在两百四十年前法国科学机构就收到探险家查理·马利（Charles Marie）的研究报告。1770年，英国科学家约瑟夫·普里斯特利（Joseph Priestley）已经把橡皮造出来。1839年，美国发明家查理·固特异（Charles Goodyear）以橡胶硫化法（Vulcanizat...
001.怎样修理财阀.txt	44	87	87	152	3	当本公司成立的时候，又正是头一年“政府决定全面发展石油化学工业”的时候，“属于政府奖励之事业”，时机上确属千载难逢的好机会，所以能在1973年8月18日得投资会正式核准，正式取得在台湾独家生产的资格，但这些“优势地位”，都因为辜振甫先生主持下的总体无能，一一给浪费掉了。据“1977年度股东常会议事录”：
001.怎样修理财阀.txt	46	91	91	139	4	这样惊人的损失，我们知道已不是第一次，因为这只是1976年4月底建厂完成后的损失；在这以前，1975年的、1974年的、1973年的，都是四千三百七十六万以外的，可以想到还有多少。最妙的，竟在宣布这四千三百七十六万损失的同一天，公司总经理竟在“1976年度工作报告”里公然颂扬：
001.怎样修理财阀.txt	50	99	99	545	4	前面公然奉承辜振甫先生“正确领导”的本公司总经理，自本公司成立以来，就连任很久，他是台湾省政府秘书长下台的大官，他的专长，我们从他写的《书论选粹》一书（1962年台湾省政府同仁书法研究会编订）的跋里，和他任内的政绩里，已经领教够了。在“中华征信所”第6102671号对“中国合成橡胶股份有限公司”工商征信报告内，批评他“处事固执、保守”。以这样记录的人，能不能...
001.怎样修理财阀.txt	52	103	103	113	3	1977年9月14日，发生辜振甫先生异母兄弟辜伟甫先生被扫地出门事件，辜振甫先生以他操纵的“中国信托投资公司”，接管辜伟甫系统的全部股份，转身对本公司以大吃小。关于信托公司的劣迹，据“中央银行金融业务检查处”调查，严重的包括：
001.怎样修理财阀.txt	61	121	121	130	3	再据上述名册最后合计，“中国合成橡胶股份有限公司”总股数为3500000，上述“中国信托投资公司”所占股数竟高达1881415，超出总数50%后又多超出131415股（即近占总股数54% ）！辜振甫先生的引狼入室手法，一经统计，全部亮出真相，真教人叹为观止了！
001.怎样修理财阀.txt	63	125	125	690	3	辜振甫先生这种引入“中国信托投资公司”大吃小手法，如果是普通人的行为，尚可不令人起疑，但是出在他身上，我们就不得不注意。根据他给萧同兹先生的两封亲笔信（信在李敖手中），知道他是用心很深远的人；根据他写的《欧洲共同市场的新趋向》（1962年8月26日《中央日报》），知道他是经商有理论的人；根据他以中国合成橡胶公司等八大公司董事长身份登的向当局“欢呼！再欢呼！”...
001.怎样修理财阀.txt	64	127	127	237	4	根据“工商征信通讯社”的东京航讯：“日本合成橡胶出口锐减，我产品竞争力显著升高”（1978年9月8日《市场与行情》第3311号），同时报导其他合成橡胶公司后来居上的成绩；1977年3月4日《中央日报》报导台湾合成橡胶股份有限公司的开工情形；1978年8月8日《中央日报》又报导：“国内合成橡胶工业已能自立……年产量为六万公吨。”反观所谓国内第一家、所谓“台湾独...
001.怎样修理财阀.txt	65	129	129	265	3	1978年4月25日合众国际社电：福特汽车公司的股东，为了董事长亨利福特二世对该公司“管理不善”，已经将董事长“和其他十九名董事及职员均列为被告”，进行追查（1978年4月27日《中国时报》）。只要一个国家有法有天，没人能容忍特权阶级乱来下去。“中国合成橡胶公司”共有股东七十六人，本人排名在四十四，投资尚不是最少的，自有必要保障作为股东一分子的权利，而贵常驻...
001.怎样修理财阀.txt	75	149	149	844	4	第二、姑试以来函所谓“3月3日付邮”计算，依《民法》第120条第2项：“以日、星期、月或年定期间者，其始日不算入。”此种以翌日起算方法，为法律基本算法，故3月3日不能算入。请参看《最高法院判例要旨》1977年9月版上册。此其一。复依《民法》第122条：“于一定期日或期间内，应为意思表示或给付者，其期日或其期间之末日，为星期日、纪念日或其他休息日时，以其休息日...
001.怎样修理财阀.txt	91	181	181	129	3	二、会一开始，负责人就提到刚才10点钟收到李股东的限时挂号信，对通知开会日期异议，于是一位“王律师”出现了，他说据经济部的命令，发信日要算一天。李放说李股东根据的是法律，依法命令抵触法律者无效。但公司负责人坚持要开会，李放说此事只好等复李股东信后，依法解决。
001.怎样修理财阀.txt	108	215	215	175	3	受文者：“中国信托投资公司”董事长辜振甫先生、总经理辜濂松先生、常务董事王永庆先生、赵璋先生、吴尊贤先生、辜濂松先生、陈启清先生、赵廷箴先生，董事曹起成先生、焦廷标先生、叶山母先生、林明成先生、叶明勋先生、黄政旺先生、徐有庠先生、侯贞雄先生、N. Joel Smith先生、安田信先生，监察人王祝康先生、林挺生先生、林自西先生、何传先生、颜惠忠先生。
001.怎样修理财阀.txt	112	223	223	285	3	六十五（1976）年6月，本人得读贵公司发行《中国信托为您做些什么？》小册，宣示：“‘提供亲切的服务’是本公司一贯的营业信念，本公司的全体同仁随时准备为您效劳。”本人信以为真，乃于该年6月10日，自台北县土城乡清水村仁爱庄筹集新台币五万元，邮政划拨至贵公司，作为一年期普通信托资金。一年后满期，贵公司要求继续，并改为二年期，本人同意，当即收到信托凭证CITC ...
001.怎样修理财阀.txt	118	235	235	198	3	依最高法院上字第1432号判例，贵公司行为相当于“与该商号成立时之名称不符”，显系触犯刑法上伪造文书罪。且依最高法院二十六年上字第2731号判例：“伪造、变造私文书罪之所谓足生损害，系指他人事实上有因此受损害之虞而言，至此项文书在法律上是否有效，在所不问。”复依最高法院1958年台上字第193号判例：“刑法上伪造文书罪，所谓足以生损害于公众或他人，以有损害之...
001.怎样修理财阀.txt	119	237	237	180	3	据《刑法》第215条：“从事业务之人，明知为不实之事项而登载于其业务上作成之文书，足以生损害于公众或他人者，处三年以下有期徒刑、拘役或五百元以下罚金。”而“所谓业务上作成之文书”，依最高法院1958年台上字第515号判例：“系指从事业务之人，本于业务上作成之文书者而言。”是乃说明凡出自贵公司之不以“信托投资公司”出之而以“银行”名义出之等行为，皆属犯法行为。
001.怎样修理财阀.txt	124	247	247	193	5	本人方发现本人手中所有03930-A号信用卡，竟是与法律不合之“私生卡”。查《银行法》第22条明定：“银行不得经营未经中央主管机关核定经营之业务。”同法第六章“信托投资公司”各条规定，亦从无可发行信用卡字样。足证贵公司以“损害公众或他人宣传结果，使本人误以为贵公司有发行”银行之身份，而误为出资领用03930-A号信用卡之行为，结果与贵公司扶同违法，无异共犯，...
001.怎样修理财阀.txt	129	257	257	97	3	以使公众发生错觉，便利贵公司行诈。事实上，主管当局并无“即将核准信托投资业正式设立分支机构”之事，反是贵公司自行设立，致遭财政部无法坐视，乃采取处分行动。据1977年4月27日《中央日报》刊载：
001.怎样修理财阀.txt	139	277	277	109	3	此条文重点在贵公司以“受托人”地位，“按照特定目的，收受、经理及运用信托资金。”换言之，即必须有“特定目的”确定后，方有受托内容之可言。但贵公司自行印订之“普通信托资金约款”第2条，即有意逃避此一“特定目的”。原文为：
001.怎样修理财阀.txt	149	297	297	270	3	本人细检贵公司对客户印订之“普通信托资金约款”，全文共十三条，竟有意不将《银行法》此一重要载明列入，显属诈欺行为。总查“约款”全文，在在以单方面保障贵公司为主，左一“全权运用，受托人同意接受”，右一“受托人概不负责”，全文使人一望而有不平等条约印象，于依法“信托投资公司之责任”，却闪避唯恐不及。按民法第71条规定：“法律行为，违反强制或禁止之规定者，无效。”...
001.怎样修理财阀.txt	171	341	341	191	3	则双方关系之泾渭分明，本无疑义。唯立法者深知信托行业之惯技，故于《银行法》第101条明文预防。第101条规定信托投资公司经营之业务共十七款，但前七款与后十款严定为两截，于次条第102条预防如下：“信托投资公司自有资金之营运，除存放银行外，以经营前条第1款至第7款之业务为限。”《银行法》并预立罚则于第130条第4款之中，违反102条之规定运用资金者，“处三千元...
001.怎样修理财阀.txt	174	347	347	346	3	法律上信托之成立，须具备三要素：一、受托人，二、受益人，三、信托标的物。凡享有财产权利之一方为他方之利益而处理其财产权益者，皆应依诚实信用之原则而为之（James A. Ballentine, Law Dictionary；Blacks Law Dictionary）。此种关系，是为“信任关系”（Fiduciary Relation）。信任关系乃指一方对于他...
001.怎样修理财阀.txt	178	355	355	141	3	是证贵公司于见财起意之时，十足以受托人身份出现，伸手索取“其他费用”、“信托手续费”、“保本特别准备金”等等，斤斤计较，唯恐不及。唯此种行为，皆发生于“信托到期”之时，不外最后冀多取之于客户而已。至于自委托之日起至未到期之日前，此段时间，贵公司却俨然目无委托人，曲解全权，一切独断。
001.怎样修理财阀.txt	179	357	357	251	3	信托关系与民法上委任并无不同，具以无偿主义为原则。《银行法》第35条规定：“银行负责人及职员，不得以任何名义，向存户借款人或其他顾客收受佣金、酬金或其他不当利益。日本《信托法》第9条第22条显示信托关系中，“受托人系依设定之目的为他人之利益而管理处分信托财产，初非为自己之利益计也。故不许受托人享受信托利益，亦不许受托人以任何名义就信托财产取得权利。”（谢金汀...
001.怎样修理财阀.txt	191	381	381	132	3	1978年3月30日，《中央日报》刊载贵公司“投资于股票的金额，也超过净值的百分之三十，财金当局已责令限期改善”。4月7日，《中国时报》刊载财金当局调查，发现信托公司“在资金获得、业务经营及资金运用三方面，均已严重违反法律规定”。关于业务经营及资金运用之违法方面：
001.怎样修理财阀.txt	197	393	393	220	3	查《银行法》第101条、第102条等既规定贵公司自有资金之运用范围，则贵公司超过净值百分之三十以外之资金运用，自悉属客户之信托资金无疑。如此运用客户信托资金炒股票，理论上，其得利应为客户而非贵公司，得利应为委托人而非受托人。但贵公司隐瞒账目与作业，在信托资金未到期前，一切悍然以“全权”遮尽耳目，援为护符，巧取豪夺“狮子之份”（the lion's share...
001.怎样修理财阀.txt	201	401	401	125	4	同月30日《中央日报》刊载贵公司等“因投资于不动产的金额超过净值的百分之三十，分别受到新台币一万五千元以下的罚缓”。4月5日，《中国时报》登出“信托公司玩票炒地皮，议员促请政府多注意”消息。7日，又登载财金当局调查结果，其中关于贵公司炒地皮部分如下：
001.怎样修理财阀.txt	204	407	407	126	3	经中央银行检查的结果，有的信托投资公司以其自有资金投资于股票，比率竟高达96.9%。换句话说，有些信托投资公司几乎把它所有的“自有资金”完全投资于股票，而这些信托投资公司的其他各项资产，诸如房屋、国库券、政府公债以及放款等，都是以“非自有资金”来营运。
001.怎样修理财阀.txt	211	421	421	163	3	何谓“非自有资金”？说穿了，还不就是信托资金。信托资金有两种：一种是指定用途的，另一种是由信托投资公司代为决定用途的。就指定用途的信托资金而言，我不相信客户会把资金信托给公司，而指定公司将此资金用来盖一所信托投资公司办公用的大厦！由此可见，信托投资公司用来盖房子、买政府债券以及用来放款的资金，都是未经客户指定用途的信托资金。
001.怎样修理财阀.txt	212	423	423	150	3	用客户的资金购置的财产，是所谓“信托财产”。《银行法》第111条规定：信托投资公司“应将公司自有财产与受托财产分别记账，不得流用”。可见信托投资公司如把它自有资金全部投资于股票，那么它的“自有财产”亦仅限于股票；其他如房屋、国库券、政府公债及放款等，都应该是“受托财产”，不是属于信托投资公司的财产。
001.怎样修理财阀.txt	213	425	425	194	3	也许有人会说，“受托财产”只是指委托当时的财产形态而言，不应包括用信托资金变置之资产。殊不知这种说法，正是完全误解了“信托”的意义。请看《银行法》第10条赋予信托资金的定义：“本法称信托资金，谓银行以受托人地位，依照信托契约约定之条件，为信托人指定之受益人之利益经营之资金。”试想，信托资金既然要被“经营”，那怎么能说“受托财产”不包括用信托资金购置的资产呢？...
001.怎样修理财阀.txt	221	441	441	324	3	查信托投资公司管理规则中，于投资公司股票之数额，早有硬性规定：由公司代为确定用途之信托资金投资同一公司股票总额，不得超过该公司股票发行总额百分之二十；由公司代为确定用途信托资金及信托投资公司自有资金，投资于同一公司股票总额，不得超过该公司股票发行总额百分之四十。足见法律早对信托公司运用此等资金投资于同一公司予以设限，以做行政上预防措施。今贵公司非但以自有资金...
001.怎样修理财阀.txt	238	475	475	253	3	再据上述名册最后合计，中国合成橡胶股份有限公司总股数为3500000，上述中国信托投资公司所占股数竟高达1881415，超出总股数50%后又多超出131415股（即近占总股数54%）！辜振甫先生引狼入室手法，一经统计，全部亮相。因本人为贵公司信托资金委托人；又为中国合成橡胶公司股东，故辜振甫先生操奇计赢之所为，无异以本人在贵公司之钱，用以颠覆本人在中国合成橡...
001.怎样修理财阀.txt	240	479	479	326	3	信托目的，与法律行为之目的同，其违反公序良俗者无效（《民法》第72条），且必本于诚信原则。行使权利，履行义务，应循依诚实及信用，远在罗马已认此原则。其后法德两国民法均就契约或债务之履行，本此原则设为规定。瑞士《民法》且加以推广，定为：无论何人，行使权利或履行义务，均应依诚实及信用为之。权利之滥用不受保护，将诚信原则之适用，由债权债务关系扩张至一般之权利义务。...
002.党报的狂妄.txt	2	3	3	95	3	罗家伦先生主编《国父批牍墨迹》收有孙中山先生这样的批示：“著中央执行委员，严颁纪律，禁止本党各报之狂妄。”谁想得到这段批示四十年后，“本党各报”的“狂妄”竟于今为烈！下面两篇文献，可见一斑。
002.党报的狂妄.txt	5	9	9	127	4	本与小左约好，由他替我出印书费，不期枕客事，使他担心起来，我当然识相而退。我仔细考虑了一阵，无计可施、无款可借，只好采取猜忌、风险与麻烦最多而我最不愿采取的“预约法”来还债，并筹卖牛肉面本钱等。昨晚我找刘绍唐，借到一千五百元，今天跑了一天，登报情形如下：
002.党报的狂妄.txt	8	15	15	354	6	《中央日报》我直找广告组主任商钟，他说要“请示”曹圣芬，下午4点给我回话。4点我再去，他说：“先生说你李先生过去老是写文章骂政府、骂本党，你这十本书中，要有这些文章，怎么办？曹先生说他希望你改变作风，不必卖牛肉面，只要改变作风，他的《中央日报》甚至都欢迎你投稿。”我说：“曹先生的好意我早领教，我们不必谈这些。我只告诉你们我这些书并没有使你们担心的文字，难道你...
002.党报的狂妄.txt	13	25	25	279	6	今天我这份广告，没有一行是触犯你们的刊例的，你们却不登。而违背你们刊例第二条‘涉嫌诽谤’的，你们却大登特登。现在请看这份东西（我拿出已经写好的并签盖好的控曹圣芬诽谤的状子），你仔细考虑考虑看，并可告诉曹先生，如果你们不给我起码的公平机会，我们就去法院见。当然曹圣芬有权有势，他不在乎；可是打了七个官司的我，若再加一个官司，也不在乎！”商钟听了我的话，看了状子，...
003.财阀有辜.txt	29	57	57	147	4	贵公司对我这两点要求，全部避而不答，这是不行的。你们对李敖的敌人来信，不问也答；对李敖的来信，有问不答，这是什么态度？请收此信后，切实见复（复文中务必包括支持你们论点的“李敖本人签字、签发、签收的全部第一手证据影本”）。如再不得贵公司满意答复，我只有依法采取一切行动，包括在舆论上声讨你们在内。
004.胡茵梦是夹心饼干吗？.txt	14	27	27	122	3	第一、这篇文章三次代她强调她是“就事论事”的，但我不明白：胡茵梦签字承认“他们之间的财产我不了解”，就出发整丈夫，这是“就事论事，对事不对人”吗？根本不把“他们之间的财产”这种“事”弄清楚，这是“就事论事”的态度吗？这是哪一种“做人的原则”呢？
004.胡茵梦是夹心饼干吗？.txt	15	29	29	88	3	第二、这篇文章五次代她强调“房子既然是萧孟能的”就该还，但我不明白：胡茵梦签字承认“他们之间的财产我不了解”，她又凭什么这样一说再说三说四说五说呢？这是哪一种“做人的原则”呢？
004.胡茵梦是夹心饼干吗？.txt	16	31	31	137	3	第三、这篇文章四次代她强调她是“问心无愧”，但我不明白：胡茵梦居心伪造了内容不实的具结书，胡茵梦居心签盖了虚伪买卖的契约书，胡茵梦居心一路瞒住丈夫在婚姻里，胡茵梦居心一路瞒住李敖在离婚后，胡茵梦居心绝口不提在作证时，胡茵梦居心扯谎在法庭上……这样子的“心”，又怎么“问”呢？
004.胡茵梦是夹心饼干吗？.txt	17	33	33	210	3	第四、这篇文章两次代她强调她“道德上”的立场，三次代她强调她“不懂法律”的地位，但我不明白：翻遍了道德哲学、中国道德史、西方道德史，我都看不到有这种“胡茵梦式的道德”，或类似这种“胡茵梦式的道德”。法律只是六十分的道德，“不懂法律”纵使真的，也不严重，严重的是“不懂道德”——不懂那自人类历史以来，千千万万道德家所维护的合乎情理法方面的婚姻道德；不懂那自伏羲女...
004.胡茵梦是夹心饼干吗？.txt	19	37	37	241	3	回想半年前，胡茵梦哀怨时候，我给她漂亮离婚；胡茵梦伪证时候，我给她巧妙遮盖；胡茵梦公开扯谎诽谤我的时候，我给她无言沉默……胡茵梦骂李敖是“大男人主义”，她不知道，只有“大男人主义”的大丈夫，才能容忍她这一串的“大女人主义”，悻悻然小丈夫的话，早就气得在她家门口放火了！可惜的是，半年来，胡茵梦完全没有觉察到她早在“大男人主义”包容之中，她的美色，使她的头脑失色...
005.给黄少谷先生的公开信.txt	3	5	5	144	4	十六年前那次晚饭，你谈到我那篇《没有窗，哪有“窗外”？》，我很佩服你心思的细密。前年在太平洋俱乐部，余纪忠先生特别把我介绍给你，你笑着说：“李先生我们早就相识。”我忽然想到一位历史家对你的评论：“能任怨任劳、忍耐、慎言，尤其是他有举轻若重、不忽小节的美德。”（吴相湘：《黄少谷山谷风范》）
005.给黄少谷先生的公开信.txt	5	9	9	231	3	但是，这么多的改革消息、这么多的注意事项，我真怀疑：它们到底有多少效果？因为“不能断章取义”、不能“以推测之词入人于罪”等等，完全不是新的东西，早就一一规定在《民事诉讼法》《民事诉讼法施行法》《办理民事诉讼案件应行注意事项》《高等法院以下各级法院办案期限规则》《刑事诉讼法》《刑事诉讼法施行法》《办理刑事诉讼案件应行注意事项》等等法令里面了，这些法令，最早远在...
