file	paragraph	line_start	line_end	char_count	score	snippet
009.张温鹰的怪例.txt	14	27	27	193	3	在法律上，既然这样明显的不构成，为什么还要这么判呢？原因无他，有政治原因介入了，自然一切都变得离奇。其实离奇的，倒也不是把并非不名誉的硬当不名誉的来判，这还不算严重，最严重的，是把根本没有结婚的政治犯，硬用判离婚的方法来斗臭。张温鹰就是这样斗臭政策下的牺牲者。我第二次做政治犯出狱后第十三天（2月23日），在林世煜家里吃饭，见到张温鹰，才知道全部的内情。根据张...
009.张温鹰的怪例.txt	16	31	31	370	4	黄某是我高雄医学院的校友，在美丽岛事件发生前，常到家中借阅党外杂志以传送友人，12月8日，施明德夫妇到屏东聚会，黄国庆前往参加时热情地与施明德握手，悄悄地说：“我是你的Secret admirer（仰慕者）。”黄国庆的家庭背景颇为复杂，他的父亲黄道宜曾经担任过国民党台东县和屏东县党部主委，他的母亲蔡李鸯当过屏东县三届的省议员。在五十八年立委选举中违纪竞选，因...
009.张温鹰的怪例.txt	17	33	33	160	5	六十八年4月中旬，黄父忽到我家提亲，至9月22日我们同意第二天到法院公证结婚，但是第二天黄某于法院前告诉我，他父亲曾于六十八年中至警总调阅资料，发现我曾任美丽岛社务委员，所以要求我立书保证绝不与党外人士交往，否则他母亲是会被捕入狱！当时我为他感到悲哀，而生气地将他手中已打完字的两份结婚证书撕毁丢弃！这桩婚事也就此打消！
009.张温鹰的怪例.txt	39	77	77	342	5	依《深耕》第六期第29页载，张温鹰与黄国庆于1979年9月23日到法院办理公证结婚前，即因意见不合而当场已将打完字的两份结婚证书撕毁丢弃，这桩婚事便就此打消了。可见其婚姻并未完全有效成立，既非夫妻，何能提起“离婚之诉”？假若双方系于办毕公证结婚后，始因意见不合而撕毁结婚证书，固不影响其完全有效的婚姻，但依户籍法第57条第2项之规定，申请结婚登记，必须亲自到场...
010.他们为什么有去无回？.txt	5	9	9	172	5	这次土地银行抢案，刑事警察局误把出租车司机王迎先请去，结果人“直着进去，横着出来”，闹得满城风雨。警方说王迎先是“气愤而死”的，又说王迎先是“跳水自杀”的，不论怎么说，他们都脱不了责任。刑事警察局长林永鸿说：“活生生的人从人家家里请出来，结果却死硬硬的把尸体交还家属，怎么讲都交代不过去。”这话说得真其言也善，可惜的是，人之已死的毕竟不是他们。
010.他们为什么有去无回？.txt	7	13	13	80	3	林洋港和林永鸿的谈话，引起我追踪的兴趣，他们的谈话，反证有过“规避”、“护短”、“过去若干成例”的种种疑团。为了给这些疑团进一解，我愿就我调查所得，举一些抽样：
010.他们为什么有去无回？.txt	8	15	15	230	4	一、邱云房自死案——1965年1月26日。邱云房，中坜市人。因饮酒滋事，于1月25日被平镇派出所请去，十六个小时后，就是第二天清早6点，被发现伏尸在派出所后门。中午12点，就以无主尸体理由，掩埋了事。但是邱云房有太太徐月英，怎么能成无主尸体？徐月英认为丈夫死得可疑，乃在1966年4月9日到监察院请愿，台北市警察局第五分局说她妨碍交通，派出十多位警察，冲进监察...
010.他们为什么有去无回？.txt	13	25	25	346	3	六、王寿山服毒案——1967年9月16日。王寿山，62岁，山东人，住台北县三重市同安街125之1号。因涉嫌窃盗，被台北市警察局信义路派出所请去，不到一小时就死了。警方说侦讯时他突然口吐白沫，是“服毒自杀”。为什么身上有毒药呢？因为王寿山是个惯窃，带毒药是毒狗的！台北市地检处首席检察官焦沛澍说：“由于死者是以窃盗为犯罪常业的人，警方人员在言语态度上，自对其无法...
010.他们为什么有去无回？.txt	17	33	33	100	3	十、林肇棠自死案——1976年5月31日。林肇棠，25岁，苗栗人。台北市警察局刑警大队为了百万元窃盗案，把他请去，突然死了。警方说他的死，乃是“势将再次入狱服刑心情不佳，而导致羊癫疯病复发不治死亡”。
010.他们为什么有去无回？.txt	18	35	35	203	5	十一、杨清村自死案——1980年3月4日。杨清村，44岁。2月21日向邻居讨两百元旧债，邻居没钱，杨清村取了两只土鸡抵偿。他走后，邻居到台中市警察局告他窃盗，他被请去，后来却在地检处后门卧地呕吐，内有血丝，当场死去。经法医相验，死亡原因是头部外伤引起颅内出血。警方说：“目前治安人员在逮捕人犯后，从未有刑打逼供的情事，况且该窃案发生后，杨清村被捕就坦承犯行，警...
011.“法律遁”和“法律顿”.txt	7	13	13	692	4	国民党革别人的命，定了三阶段，所谓军政、训政、宪政。国民党北伐过后，结束军政，自1929年3月27日宣布开始训政，同年6月15日又宣布：“训政时期规定为六年，至1935年完成。”换句话说，就是1935年3月27日结束训政。但是，到了1935年3月27日以后，国民党却训上瘾来了，不肯结束一党专政。于是，“党外无党”的度量又延续下来，一直延到十二年后，才在194...
011.“法律遁”和“法律顿”.txt	10	19	19	516	3	以“侦查中被告或涉嫌人得选任辩护人”的立法为例，这个陈年老案，国民党因为不喜欢它造成限制，一直拖拖拖，直到王迎先惨死的情势下，才说为“显示本党察纳舆情保障人权胸怀”，由“常会通过刑诉法修正原则”。但是，在立法过程中，国民党绝不甘心的毛病，登时发作，一方面把立法院审查会修正的第245条予以翻案，限制辩护人只能于侦查时在场“观察”，另一方面由国民党的林洋港的内政...
011.“法律遁”和“法律顿”.txt	11	21	21	48	3	最后的教训是：不了解国民党的“法律遁”，是不了解国民党的；不了解国民党，你就会被耍得不亦乐乎的！
011.“法律遁”和“法律顿”.txt	13	25	25	89	3	在国民党这次修改《刑事诉讼法》的“法律遁”中，最令人惊心动魄的谈话，是国民党的内政部长林洋港的一段，林洋港说：司法警察的紧急逮捕和约谈，二三十年来都在做，现在只是使其合法化而已！
011.“法律遁”和“法律顿”.txt	14	27	27	68	3	看了这种话，我们真忍不住说：“国民党的林洋港悍然如此、爽快如此、坦白如此、一马当先如此，真不愧是第一号的政治打手，真难怪他如此走红了！”
011.“法律遁”和“法律顿”.txt	15	29	29	295	4	比起林洋港来，另一个国民党的政治打手余纪忠，就显得低段了。余纪忠的《中国时报》，在7月16日《评立法院的意气之争》社论里，奇怪“既然二三十年的不合法，那么为什么不在二三十年前即提案修正呢？”余纪忠不知道：今天提出修正，正因为要抵消并凌驾“侦查中被告或涉嫌人得选任辩护人”的立法，正因为要行“法律遁”，不然的话，自然就一任二三十年来，也二三十年去了，自然就没有今...
011.“法律遁”和“法律顿”.txt	17	33	33	193	3	再翻字典，查“顿”字，解释是：“顿，停也。”顿是暂停，暂行中止的意思。“法律顿”就是法律暂停，暂行中止的意思。国民党大官人为了国际观瞻、为了作威作福，常常喜欢立法，在法律上咬文嚼字、在法律上张脉偾兴、在法律上照顾国民党治安人员，其实，事实上，国民党的治安人员并不领情，也不感兴趣，因为国民党的治安人员最喜欢的是他们自己的“法律顿”，——他们总是把法律撇在他妈的...
011.“法律遁”和“法律顿”.txt	18	35	35	428	3	比如约谈吧，约谈当然是非法侵犯人身自由的一种，人身自由是人身不可侵犯权（inviolability of the person），约谈显然依法无据。按照国民党的《宪法》，明定“人民身体之自由应予保障，除现行犯之逮捕，由法律另定外，非经司法或警察机关依法定程序，不得逮捕、拘禁；非由法院依法定程序，不得审问、处罚；非依法定程序之逮捕、拘禁、审问、处罚，得拒绝之”...
011.“法律遁”和“法律顿”.txt	20	39	39	363	7	又比如搜索吧，照国民党的《刑事诉讼法》，明定搜索要有法院发给的搜索票，但是国民党的治安人员，办事从不这样没有效率。再以我为例，我印“李敖告别文坛十书”的时候，先找我弟弟帮忙，突然国民党的台中、台北两地团管区，都争着给我弟弟入伍令，闹出两地当兵的笑剧；我弟弟被征走后，我又找一个朋友帮忙，突然一天清早，治安人员出现在这朋友家，要求搜索，我朋友问：“搜索可以，可是...
011.“法律遁”和“法律顿”.txt	21	41	41	225	4	又比如紧急逮捕吧，我第一次做政治犯时候，夜里11点，彪形大汉敲门，带人。因为彪形大汉跟踪我十四个月，跟我跟熟了，偷偷告诉我：“今天可不是约谈，要有个准备。”于是我被请进楼下的大黑轿车，运到治安机关密封室，浑身搜索、打指模、办收押。我笑着说：“这回总该给看看押票吧！”他们说：“人都给逮进来了，还看什么押票？”我说：“我从没见过这种东西，看看也好啊！”他们说：“...
011.“法律遁”和“法律顿”.txt	22	43	43	350	6	又比如拘禁吧，照国民党的《宪法》，明定：“人民因犯罪嫌疑被逮捕拘禁时，其逮捕拘禁机关……至迟于二十四小时内，移送该管法院审问。”如逮捕拘禁的机关，未于二十四小时内，移送该管法院审问时，“本人或他人，亦得申请该管法院，于二十四小时内，向逮捕拘禁之机关提审。”法院对于此项申请，“不得拒绝，并不得先令逮捕拘禁之机关查复。逮捕拘禁之机关，对于法院之提审，不得拒绝或迟...
012.“狗咬狗”的法定境界.txt	4	7	7	186	3	讯据被告彭振刚、郑贞铭固坦承上开《黄河杂志》第十五卷第四期刊登有“李敖的验尸单”为子题之文章，唯被告等均坚决否认有诽谤自诉人之犯行，所辩略称：……作善意之评述，进而殷望党外提升其素质，早日茁壮为在野政党，作者未存侮辱自诉人之意思，而文中“比特犬”、“狗咬狗”系举例比喻，非在诽谤自诉人。……上开文章作者以善意发表言论，而为适当评论，不能因所使用之词句稍嫌粗俗，...
012.“狗咬狗”的法定境界.txt	6	11	11	507	3	本案上诉后，碰到的是台湾高等法院刑庭第十庭的法官，不过第十庭审判长推事杨力行、推事许增男、推事胡森田，在审理1987年度上易字第2559号吴三连、吴丰山、颜文闩的诽谤李敖案时，违反证据法则、经验法则，及现代文明国家新闻媒体应为登出广告文字内容负责的法理，判决国民党同路人《自立晚报》发行人吴三连无罪、社长吴丰山无罪、总编辑颜文闩无罪，曾引起李敖严重不满，为表示...
012.“狗咬狗”的法定境界.txt	7	13	13	143	3	为了防止三位法官的偏颇，李敖特于1987年11月10日申请回避。同月28日，同一高院第十九庭裁定下来，说：“个案案情有异，事实有别，自难就其等已往办案之经过，而推断其等将有偏颇，从而申请人据此申请推事回避，为无理由，应予驳回。”因此，李敖又要面对三位法官的中文解释了，想来不胜荣幸之至！
013.从事先检查到不检即查.txt	4	7	7	114	3	《不知肉味和不知水味》是写给《太白》的，登出来时，后半篇都不见了，我看这是“中央宣传部书报检查委员会”的政绩。那时有人看了《太白》上的这一篇，当面问我道：“你在说什么呀？”现仍补足，并用黑点为记，使读者可以知道我其实是在说什么。
013.从事先检查到不检即查.txt	12	23	23	167	3	《集外集》预备出版时，其中编者引言，来信，启事，老调子已经唱完，上海所感，今春的两种感想，帮忙文学与帮闲文学，不走正路的安得伦小引，英译本短篇小说集自序，译本高尔基1月9日小引等共十篇，那时被抽去了，先生特另纸抄载书目，虽则原稿已落于检官之手，幸而如今《春的两种感想》等篇，承友好之助，得以重行补全，俾符先生特意收入“拾遗”中的原意。
013.从事先检查到不检即查.txt	17	33	33	118	3	我在最后写“‘抢劫’与‘查禁’”，请注意先后次序。今天国民党的干法，是蛮横得不凭查禁命令，就先下手抢书的。抢书以后几天，才能收到由无知妄作的政工人员填好的查禁命令。这一现象，更具体说明了他们现在根本书都不必看、不必“检查”，就先动手了。
014.致监察院书状.txt	5	9	9	82	3	去年6月16日，在朱高正为发行人兼总编辑、吴祥辉为总企划的《自由台湾周刊》第一期中，由吴祥辉署名，发表《街头运动的时代到了》，文中“诅咒别人死”一节内，诽谤李敖说：
014.致监察院书状.txt	7	13	13	295	3	李敖在自诉中已先指出：本自诉重点，不在辨正“企图游说”之事，而在纵有此事，怎么就是“事成有分，事败无干”？怎么就是“诅咒别人死”？查自来思想家的职责，就在鼓舞后进，自己并不实际介入，因为思想家自有思想的活动范围，思想家并不要做政治家。在台湾，胡适、殷海光等思想家都鼓舞过别人做政治家，成立新党，但这是“事成有分，事败无干”吗？这是“诅咒别人死”吗？古书中说：“...
014.致监察院书状.txt	11	21	21	398	4	七十年前，司法界就有一条判例说：“侮辱人之罪成立与否，应以对于个人在社会上所保持之人格及地位，因加害者之举动达于足以毁损其名誉之程度与否以定标准。”（七年上字第187号）这一判例，是很细致的。在本案中，这些诽谤文字的“全部文义”，明明在加害李敖“在社会上所保持的人格与地位”，事实上，李敖明明是为争人权争自由而备受迫害、入狱多年的勇者，如今诬为“事成有分，事败...
014.致监察院书状.txt	15	29	29	311	3	李敖在自诉状中已先指出：本自诉重点，不在辨正所谓“经过众多前辈的牺牲造就党外声势后，他才露脸”之事，（因为前辈李敖在露脸牺牲时，今天的党外后辈，尚不知人在哪儿！）和所谓“《美丽岛》、《八十年代》都约不到他的稿”之事（因为《美丽岛》等刊物出版时，一些党外后辈早已数典忘祖，从未向李敖约过稿），而在所谓“暖流出版社”出资约李敖出版《中国历史演义》李敖拒用真名云云，...
014.致监察院书状.txt	17	33	33	193	3	讯据被告康文雄矢口否认诽谤自诉人，并辩称：被告当天乃应邀参加，基于礼貌，所以讲几句话，当天被告是用方言发言，事后也未看到稿本，现在看到文章内容，与原意相差甚远，被告相当尊重自诉人，绝未发言诽谤自诉人云云。……“避免使用真名以免于和党外结合”……按此等文字，词句虽然稍嫌粗俗，唯就全部文义来看，仅在批评自诉人只在幕后鼓动别人组党，和执政党抗衡，自己胆子小，一直躲...
014.致监察院书状.txt	18	35	35	222	3	事实上，康文雄既然承认登出来的文章内容“与原意相差甚远”，却不请求更正，防止本件诽谤行为的发生，显属《刑法》第15条的不作为犯，其有“不确定故意”——结果不确定之故意，已经非常显然。纵令康文雄于茶会上发言时，无诽谤李敖名誉的意图，但是朱高正、吴祥辉共同将上开发言内容擅加变造、扭曲事实，并以文字散布于众，其有共同诽谤李敖名誉的意图，就彰彰明甚了。台北地院推事郑...
014.致监察院书状.txt	21	41	41	139	3	查诽谤李敖“睁眼说瞎话”，则明指李敖是说谎者。在这一重要关口上，黄纪男的说话真相，实有确实调查的必要。本案关键在《自由台湾周刊》所登黄纪男谈话，内容既非事实，又为黄纪男本人证明所登非实，这由去年7月13日黄纪男对李敖的电话否认录音带可证，兹将黄纪男真假谈话列表对照，便一目了然：
014.致监察院书状.txt	23	45	45	106	3	《自由台湾周刊》所登黄纪男谈话：一、（1986年）5月29日苏秋镇请吃饭，向我提起筹组 台湾民主党，李敖与郑南榕要找十个发起人，推我与刘明为老年代表……李敖一再从边鼓吹：“你老先生一定要出面，无论如何不可推辞。”
014.致监察院书状.txt	24	47	47	278	3	电话录音带中黄纪男对李敖谈话：一、首先李敖念到这一段：“5月29日时苏秋镇请吃饭，向我提起筹组台湾民主党，李敖与郑南榕要找十个发起人，推我与刘明为老年代表。……”李敖说：“老大哥，你晓得，没有这个事情，有人找发起人，也许是苏秋镇和郑南榕，并不是李敖，并且，我也没有推。刘明，坦白讲，是什么人，我现在还不知道，是不是记录错误？”李敖又念这样一段：“李敖一再从旁鼓...
014.致监察院书状.txt	26	51	51	163	3	电话录音带中黄纪男对李敖谈话：二、李敖又念这一段：“他们直嚷：‘不行，6月1日一定要组党。’”李敖说：“我想我没有这样嚷过，我没有讲过这种话。”黄纪男说：“6月1日组党是苏秋镇讲的。”李敖说：“我不是替苏秋镇澄清，我是说我没有讲过。”黄纪男说：“对，对。”——足见上栏所谓李敖向黄纪男大嚷不行6月1日一定要组党之说，全是造谣！
014.致监察院书状.txt	28	55	55	226	3	电话录音带中黄纪男对李敖谈话：三、李敖又念这一段：“他们却敢保证：‘不会、不会，组党绝不会抓人你放心！’”李敖说：“这话，我没有讲过。”黄纪男说：“你没有讲嘛！我看啊，他们大概有成见，他们写这文章有成见。”李敖说：“他们有成见我不怪他们，可是他们有成见，就把这有成见的话假托在你老大哥，我们的难友、好朋友口里，这可不好。”黄纪男立刻谴责他们：“挑拨离间嘛！挑拨...
014.致监察院书状.txt	29	57	57	132	3	《自由台湾周刊》所登黄纪男谈话：四、我说：“李敖先生，你既然这么热心，何不参加呢？”他忙道：“这不行、这不行，我是写文章的人，政治运动我不适合。”我说：“过去胡适也是学者，还比你大牌呢！殷海光也是学者啊！他们也插手政治啊！为什么你就‘幕后！幕后！’只叫别人去死。”
014.致监察院书状.txt	30	59	59	775	5	电话录音带中黄纪男对李敖谈话：四、李敖又念一段：“我说：‘李敖先生，你既然这么热心，何不参加呢？’他忙道：‘这不行、这不行，我是写文章的人，政治运动我不适合。’”我说：“过去胡适也是学者，还比你大牌呢！殷海光也是学者啊！他们也插手政治啊！为什么你就‘幕后！幕后！只叫别人去死。’”李敖说：“老大哥，当时我说过，我说我不参加，这话我讲过。我说过我是写文章的人，我...
014.致监察院书状.txt	31	61	61	75	3	《自由台湾周刊》所登黄纪男谈话：五、李敖平素也很敬重我，在看守所时还送蹄膀给我， 不过好也要看时候啊！叫我去送死坐牢，你却“幕后！幕后！”这不对劲啊！
014.致监察院书状.txt	32	63	63	157	5	电话录音带中黄纪男对李敖谈话：五、李敖又念这一段：“李敖平素也很敬重我，在看守所时还送蹄膀给我，不过好也要看时候啊！叫我去送死坐牢，你却‘幕后！幕后！’这不对劲啊！”黄纪男说：“讲这话太严重了！太重了！”李敖问：“你没有这样讲？”黄纪男说：“没有，没有。”——足见上栏所谓黄纪男说李敖叫我去送死坐牢之说，全是造谣！
014.致监察院书状.txt	34	67	67	169	3	电话录音带中黄纪男对李敖谈话：六、李敖又念这一段：“由他们号召组党，公政会是否会加入？他们满口承诺公政会一定加入。”李敖说：“他们如果包括我的话，我也没有讲过。因为我哪能控制公政会呢？”黄纪男说：“你没有讲。”李敖说：“不但我没有讲，苏秋镇他们也没有讲过，因为他们不是会员。”——足见所谓李敖向黄纪男满口承诺公政会一定加入之说，全是造谣！
014.致监察院书状.txt	37	73	73	150	3	电话录音带中黄纪男对李敖谈话：一、黄纪男对李敖说：“我们都是被他们利用的啦！我们这些受难人出来，他们叫你去捧场讲话，是利用的啦！现在我们的存在，他们不放在眼中啦！这个事情是事实啦！《自由台湾》现在我还没有看到，这个事情我能够替你澄清我愿意做，因为你的形象太好啦！他们的成见，歪曲的报导，这是不对的。”
014.致监察院书状.txt	39	77	77	90	3	电话录音带中黄纪男对李敖谈话：二、黄纪男又指摘他们说，他们在“分化，完全是分化”。又说：“我怎么会在公开场合来批评你，来讲你的坏话呢？没有这个事实。我个人可以向天发誓，不可能啦！”
014.致监察院书状.txt	43	85	85	54	3	电话录音带中黄纪男对李敖谈话：四、黄纪男最后说他们“是利用我，完全是利用我来攻击你，利用我的嘴巴来攻击你”。
014.致监察院书状.txt	47	93	93	99	3	丁邦新的事，李敖都很清楚。为了怕李敖把他的诸般丑事给抖了出来，遂百般奉承李敖，还在选院士前提报李敖当史语所的编审，相当于研究员的职务。结果被中研院打回，但丁邦新为了拉拢李敖，现仍在替李敖努力找位子。
014.致监察院书状.txt	48	95	95	252	4	查李敖与丁邦新，自从预官八期同队受训后，二十六年来，毫无往还，从何“都很清楚”丁邦新的事？又从何被丁邦新“百般奉承”？所谓丁邦新提报李敖任史语所“编审”之说，更是天方夜谭。（一、史语所从无“编审”编制，又从何提出？二、纵有，丁邦新岂敢提出？三、纵提出，李敖岂屑为之哉？）朱高正、吴祥辉这段文字，用意在含沙射影指李敖因得丁邦新好处，故不抖出丁邦新的“诸般丑事”，...
014.致监察院书状.txt	50	99	99	437	3	查“丑事”就是见不得人之事，其为事之丑者，在字面意义上已自足，又何须备述细节，“说出丁邦新有何丑事”，方能构成？这种诽谤文字“就全部文义来看”，除非中文程度太差，否则无不一望而知在丑化李敖。以“为了怕李敖把他的诸般丑事给抖了出来，遂百般奉承李敖”为例，不啻在指摘李敖以抖出他人丑事为手段，达到胁迫他人行无义务之事，为李敖找职业、得好处之目的。这还不明显吗？至于...
015.新回避说.txt	3	5	5	464	6	关于周弃子所说的例子，事实上是审理而不买当道者的账、是审理却不肯做政治审判。这种有风骨的法官，在岳飞案中共出现过两批。第一批的法官是何铸与周三畏。岳飞被捕，关在临安大理寺狱时，由御史中丞何铸以中执法与大理卿周三畏共同审理，审理结果，何铸、周三畏都认为是冤案。可是宋高宗执意要害岳飞，于是把何铸换下，找来另一批法官——大理丞李若朴、何彦猷。李若朴、何彦猷大事化小...
015.新回避说.txt	4	7	7	599	3	今天在国民党统治下的法官，形式上，基于审判独立，自不发生把何铸换下的情况，并且何铸身为法官，他自己除非合于回避条款，也无从拒绝审理或对案子有选择权。所谓回避条款，依《刑事诉讼法》第17条，推事于该管案件有下列情形之一者，应自行回避，不得执行职务：一、推事为被害人者。二、推事现为或曾为被告或被害人之配偶、八亲等内之血亲、五亲等内之姻亲或家长、家属者。三、推事与...
016.张镜湖启事的启示.txt	3	5	5	930	4	张镜湖说：国民党前中常委余纪忠所经营的《时报周刊》，在去年刊出记者于模珉《最高学府不胜寒》一文，指控本人六点伪造文书及不法行为：一、伪造先父张其昀先生遗嘱。二、设法推荐其妻接任文化大学校长。三、要将文大卖给铭传商专。四、要把学校资产移至国外。五、文大负债二十亿。六、片面不法解聘七位教授。事实上，一、遗嘱经法院检验，无一字之窜改。二、内子从未在文大担任任何职位...
