file	paragraph	line_start	line_end	char_count	score	snippet
021.论两面人.txt	25	49	49	148	3	又：殷海光死后，他的门人全在徐复观术中而不自知，被徐复观统战得七荤八素，真丢死人，福增亦不能例外。可见“学术与政治之间”的奸雄，一旦混入学界，就好像美洲土狼（coyote）进了羊群，效果非凡之至。我实在看不惯以思想方法、以“怎样判别是非”的殷门弟子，竟不堪如此、糊涂如此，所以我非说他们几句不可！
021.论两面人.txt	26	51	51	146	4	至于殷门弟子，被胡秋原统战的，更不可原谅了。殷海光衰病侵寻之时，落井下石，逼台大解聘他的，是由胡秋原带头的。我在《我的殷海光》中说：“我真不知道，欣赏胡秋原的知识分子，对这种落井下石如何解释，你们的良知究竟何在？”如今他们开口闭口“胡秋公”如何如何，还打着殷门旗号，真有“以德报怨”的遗风啦！
021.论两面人.txt	30	59	59	123	3	还有，你9月3日的信上说：“我觉得我对党外的贡献，可以用写文章、发表评论来表现，不一定自己要一本杂志。一个月写三千字，应该不成问题。我要努力，不管有多少杂事烦我，一定要完成！”言犹在耳，你却连番“请假”，该当何罪？我这话问得很严厉，望你切实答我！
022.论红色变节者.txt	5	9	9	392	4	我在二十一年前，由于穷得当了裤子，胡适特别写了一封限时信给我，并送了我一千元来赎当，我很感动，就写了一封长信给他，说出很多我个人的历史。胡适对我的信很欣赏，拿给一些人看，最后他拿给徐高阮看，徐高阮扣住不还。不久胡适死了，徐高阮遂在1966年11月7日，在台北妇女之家举行声讨李敖大会，“邀约了国青民三党人士和若干文化界的朋友三十人”（有陈启天、胡秋原等等），开...
022.论红色变节者.txt	7	13	13	632	9	先说胡秋原。胡秋原早年参加共产党CY，又参加闽变叛国，抗战时加入国民党做中央委员并办党报，大陆丢掉时“打算做共党百姓”，不肯出来，后来才到台湾。有一次被派出去，竟“在英国与共党有过接触”，而遭国民党党纪处分。他是一个反复多变的人，由于反复多变，政治上，自然也就不能被一再信任。因而在心理上，他有了一种幻想的被迫害症，他的自高自大自我膨胀，过分重视自己，使他老觉...
022.论红色变节者.txt	14	27	27	279	4	徐高阮做了这件事后，据我所知，为他的许多朋友所不谅，有的认为他“卖友求荣”；有的认为“难道胡适把这信给你看是叫你告密的？”；有的认为“信在你手中一年后，你才告密，证明你就是‘叛逆分子’！”；有的认为“知识分子如此借刀杀人，太卑鄙了！”……不一而足。而我自己，却毫无愤懑之情，因为我深深了解：徐高阮等是变节的共产党，变节的共产党是全世界最可怕的人类，不是吗？变节...
022.论红色变节者.txt	15	29	29	172	4	从另一角度来看，在乱世中，公布信件若对人构成伤害的，也不能不小心。胡适在1954年3月5日演说《从“到奴役之路”说起》，就公布了一封信，但他把这封信的写信人名字给挖掉了，他说：“这位朋友是公务员；为了不愿意替他闯祸，所以把他信上的名字挖掉了。”这种体贴，有时也是必要的。虽然对我的信说来，全无此必要——大丈夫敢做敢当，凡是下笔的，就不怕人发表。
