file	paragraph	lines	score	markers	text
001.1999年12月1日.txt	4	7-7	19	故事|笑话|漫画|有一个|问	漫画以外，还有一个笑话。一位乡下孕妇，到妇产科去检查。医生说：“请你先把裤子脱下来。”说完就转身去做别的事了，不料再转回来的时候，看到这孕妇裤子还是没脱。医生问她为什么，孕妇脸红了，低下头来，小声说：“你先脱嘛！”这个故事的妙处，就在这位孕妇会错了意，却先表了情。
025.2000年1月4日.txt	25	49-49	17	例子|后来|答|他说|骂|艾森豪	上一次《自由时报》和《自立晚报》登出“台湾人要生气了”大广告，意思是说李敖、李涛这些外省人在欺负我们台湾人，我们台湾人要生气了；我曾在电视节目中答复登广告的这位先生，“你可以说人生气了，不可以说台湾人生气了”，广告里面提了六次外省人，为什么说我是外省人，你是台湾人？这是挑拨嘛。二次大战时，美国统帅艾森豪将军，后来做了总统，他说真的本领并不是在打仗一定打赢，因为所有将军都会发生错误，错误最少的人会打赢，真的本领不在打仗，而是美国和英国、不同国家的军队要融合，可以共同合作作战，这是我艾森豪的本领。他举个例子，一个美国兵和一个英国兵吵架，结果美国兵骂英国兵是“英国猪”，艾森豪将军把美国兵叫来，要他回美国，他不适合在这里作战了，艾森豪说“你可以骂他是猪，你不能骂他是英国猪，骂英国猪就是挑拨感情了”。
028.2000年1月7日.txt	24	47-47	17	故事|笑话|有一个|问|他说|死|林肯|农夫	我们先插播一个故事，林肯总统在处置国家大事的时候，常常在开会以前先讲笑话。他就讲过一个笑话，他说有一个农夫有两匹马，他很喜欢那两匹马。有一天，他的朋友来看他，报告不幸的消息（跟刚才一样又来了）。朋友说：“告诉你一个不幸的消息，你家的一匹马死掉了。”农夫一听痛哭失声，因为他喜欢那匹马。哭完后，眼泪擦干了。他的朋友又告诉他，另外一匹也死掉了。农夫又哭了。哭完以后农夫问他的朋友，既然两匹马都死了，为什么不一次告诉我呢？他的朋友说怕你一次哭得太难过了。
032.2000年1月13日.txt	9	17-17	17	举例|有一个|有一次|最后|问|死	今天我们被骗了，在过程中是外面的原因骗了我们，可是最后是我们的感觉骗了自己，所以我们要有觉悟。举例来说，我们与敌人打起来时有一种情况是“同归于尽”，在1948年大陆流传一首《冀东兄弟行》的诗，是指两兄弟分别在国民党、共产党内当兵，结果两人在战场上见面时，不得不向对方开枪，结果造成“兄弹弟腹穿，弟弹兄脑裂”，人间的惨剧就是在战场发生敌我关系时同归于尽；第二种情况就是“你死我活”，我们和大陆作战时可能就会发生此现象，因为大陆一年生的人口数几乎等于台湾人口，我们和大陆的人口比例是一比六十，换句话说，大陆六十人打台湾一人，请问我们还有“你死我活”的机会吗？若讲武器，他们有最高的军事科技，我们打得过吗？我们要清楚判断死活的会是谁；第三种情形是“我跪你活”，就是我对你屈服求得生存，何应钦将军有一次到比利时参观，听到当地国防部简报，国家遇到战争侵略的应变计划中，最后有一个投降计划，就是万一打不过对方时，在仔细评估后会有计划的投降，目的是为了保留元气，将来有机会时可以复国。
033.2000年1月14日.txt	6	11-11	17	故事|后来|最后|问|答|死	在之前文天祥的故事中，文天祥在朋友们回答“一团血”时讲了个故事，就是有位叫刘玉川的人和妓女谈恋爱，后来在两人觉得没前途时，拿出了二杯毒酒要殉情，结果先喝毒酒的妓女死了，刘玉川没喝就跑掉了，文天祥以此故事挖苦朋友说，你们会不会有一天就像嫖客刘玉川一样，就是指他们并没有要殉国，流的一团血是假的，果然不出文天祥所料，后来这些人都跑掉了，只剩下他被元朝抓了在监狱中写下《正气歌》，如果文天祥真是求仁得仁，死掉就算了，可是他很痛苦，在他的《正气歌》中有一段“悠悠我心悲，苍天曷有极，哲人日已远，典型在夙昔”，其实他悲的是想到以前有小歌星唱歌给他听，他想他的姨太太，不想坐牢和死，他内心的痛苦在天人交战，最后他成功的在四十七岁时死了，所以英雄是慢慢培养而非突然的，圣女贞德也曾在牢内写悔过书，后来被出卖后才又变成烈士，他们都是经过内心的挣扎才成为英雄。在白色恐怖时代，有人问我和国民党打拼时怕不怕，我说我心理怕死了，可是愈害怕愈打拼，这才合乎人性，若说根本不怕是骗人的。
026.2000年1月5日.txt	18	35-35	16	故事|有一个|有一次|最后|他说|和尚|袁了凡	我个人是不信佛的，我建议各位对外不要信佛，对内不要信命，命是我们中国一个很传统重要的观念，外国人也有这样的观念，可是不像中国人这样的明确；中国人对命有四大类，第一个是宿命论，就是我一切听天由命，我告诉各位这种人很少，为什么很少呢？因为有一类他是造命论，有一个人叫袁了凡，他年轻时算命说作官只能做到五品官，并且一辈子没有儿子，对古代一位知识分子而言，做官做不大，又没有儿子，是非常痛苦的事情，所以他年轻时就看破红尘，有一次，他在庙里听和尚念经，有位老和尚一面念经，一面看他，经念完后，老和尚走过来对他说，我一辈子看的人很多，从来没有看过像你一样的年轻人，能安静坐在那儿，一点杂念都不起，这是什么原因？袁了凡说因为我信命，算命的说我官做不大，又没有儿子，我的一生已没有指望了，万法皆空，我什么都看透了，所以在庙里听你念经，就觉得一切没什么好想的，和尚对他说，“你错了，命是可以制造的，你从此去修桥、造路、施粥、关心穷人，做一些好事，就能改变你的命运，不妨试试看”，袁了凡回去后就照老和尚的说法到处做善事，最后果然官做大了，儿子也生出来了。这是古代一个相信命运，也相信命运可以改变的故事。
028.2000年1月7日.txt	8	15-15	16	漫画|有一个|过去|问|杀	CoCo有一幅漫画，画了一辆坦克车，坦克车四面都有炮口，有的要打许信良，有的要打宋楚瑜，有的要打阿扁，有的要打连战，还有一个炮口是对准新党。CoCo的漫画我看了觉得有趣。昨天我在新党的聚会，新党的公职人员问我：“你怎么解释这一幅漫画，你要用炮口打我们吗？”我说：“我要打你们的时候我会先告诉你们，小兔崽子！还有，如果你们举起了投降的手势，我就不打你们了。”然后他们就说：“你不就造成我们的关系恶化，将来杀来杀去？”我说：“这一点不会发生，因为只有杀来，没有杀去，我一杀过来你们就杀不过去了。”
029.2000年1月10日.txt	41	81-81	16	笑话|有一个|问|答|他说|死|皇帝	有一个笑话，有一个人要被皇帝判死刑，他跟皇帝说，给我一年的时间，我可以让皇帝所喜欢的马飞起来。皇帝答应了。别人偷偷问他，你怎么可能使马飞起来呢？他说，这你就不知道了，我争取了一年的时间，这一年的时间有很多状况会发生：第一个状况，皇帝死了，我就不必砍头了。第二个状况，我死了，我死了还砍什么头？第三个情况，就是马可能真的飞起来了。我们有五十年的机会，怕什么？
026.2000年1月5日.txt	6	11-11	15	举一个|例子|有一个|过去|后来|死	所以我跟大家讲一句扫兴的话，尤其花莲是在证严法师的笼罩之下，比较起原始的释迦牟尼创办佛教的精神，今天花莲地区，包括整个台湾地区，大家对佛教的了解，跟释迦牟尼所创办的佛教不一样。换句话说，我们已经背离了释迦牟尼创办佛教的原始精神。因为释迦牟尼创办佛教是反对婆罗门教的有神，并且是多神。今天本来是无神的佛教，变成有神了，本来是一神的佛教，变成很多神了。为什么会变成一个神的佛教？那是因为释迦牟尼死后，大家很怀念他，认为他应该是一个神，所以本来无神的佛教，在释迦牟尼死后变成了有一个神，那一个神就是释迦牟尼。后来神愈变愈多，我举一个例子，后来有了菩萨，尤其是观世音菩萨，观世音菩萨是佛教里一个重要的神，其它像弥勒佛、如来佛，都是跟我们很近的佛，过去大家在庙里面最器重的佛就是释迦牟尼，现在多了很多，那是因为佛教不但变成了有神教，而且是多神教。可是大家在多神之中会特别亲近一些跟我们很近的小神，我举一个例子，中国汉朝时大家相信的神就是五帝，叫太一。可是汉武帝虽然尊重大家相信的五帝，但是他骨子里特别喜欢一个叫神君的小神，神君是汉武帝的外婆所相信的神，汉武帝骨子里只相信神君这个小神。
028.2000年1月7日.txt	13	25-25	15	有一个|有一次|过去|死	过去我们在部队里面，有一个口号，就是“国父精神不死”。一个集会开始时，会喊“三民主义万岁！国父精神不死！”有一次在我们师里面，师长是个大老粗，应该喊“国父精神不死”，他喊错了，他喊“国父不死”。这时候，后面的政战人员赶紧拍拍他的肩膀说“还有精神”。他就再喊“还有精神”。
028.2000年1月7日.txt	21	41-41	15	例子|问|他说|死	三个例子证明目前人们的思想被污染的严重程度。第一个例子证明我们头壳坏去，叫做“有逻辑无章法”。什么叫做“有逻辑无章法”，看看民进党立法委员沈富雄讲话。讲话逻辑程度很好，可是没有章法。我举个例子，什么叫做“有逻辑无章法”。一个人出差，有一天他的邻居来了，找到他，他问：“你来干什么？”邻居说：“我报告你一个不幸的消息。”“什么消息呀？”“你所喜欢的那条狗死掉了。”“怎么死的呢？”“是吃了你家马房的、被烧死的马的马肉，中了毒死掉的。”他问：“为什么我家的马房会烧掉呢？”邻居说：“因为你家的马房里面放了一个棺材，棺材上放了蜡烛，蜡烛倒了，引起了火灾，所以着火了。”他再问：“为什么我家有个棺材呢？”邻居说：“因为你的丈母娘死掉了。”他又问：“那我丈母娘为什么会死呢？”邻居说：“因为你太太做了一件事情，你丈母娘觉得对不起你，所以气死了，急死了。”他说：“我太太做了什么事情？”邻居说：“你太太跟野男人跑掉了。”
001.1999年12月1日.txt	20	39-39	14	有一个|问|他说	一位日本朋友问我，你们为什么还有一个“五十年”，即1997年后还要保持香港现行的资本主义制度五十年不变？你们根据的是什么，是否有个什么想法？我对他说，有。这也是从中国的实际出发的。中国现在制定了一个宏伟的目标，就是国民生产总值在两个十年内，即到本世纪末翻两番，达到小康水平。就是达到了这个目标，中国也不算富，还不是一个发达国家。所以这只能算是我们雄心壮志的第一个目标。中国要真正发达起来，接近而不是说超过发达国家，那还需要三十年到五十年的时间。如果说在本世纪内我们需要实行开放政策，那么在下个世纪的前五十年内中国要接近发达国家的水平，也不能离开这个政策，离开了这个政策不行。保持香港的繁荣稳定是符合中国的切身利益的。所以我们讲“五十年”，不是随随便便、感情冲动而讲的，是考虑到中国的现实和发展的需要。同样地，到本世纪末和下一世纪前五十年也需要一个稳定的台湾。台湾是中国的一部分，中国可以在一个国家的前提下实行两种制度，这就是制定我们国家政策的一个想法。如果懂得了这点，知道我们的基本观点，知道我们从什么出发提出这个口号、制定这个政策，就会相信我们不会变。我还对日本朋友说，如果开放政策在下一世纪前五十年不变，那么到了后五十年，我们同国际上的经济交往更加频繁，更加相互依赖，更不可分，开放政策就更不会变了。
009.1999年12月13日.txt	11	21-21	14	例子|问|杀	一九七五年，美国国家教育协会(NEA, National Education Association)就提出“教育专业伦理守则”(Code of Ethics of the Education Profession)，其中以近乎冗赘的文字，反覆提醒不得无故限制学生独立追求学问的行动。广义的说，反过来说，施教本身，一旦对学生独立追求学问的可能予以限制时，这种教育，就出了问题。而在根本上，任何无趣的教育，都是限制学生独立追求的基因。今天教育的最大问题是教科书内容的无趣，启发不出来独立追求的果实，填鸭式考试更是扼杀的杀手，因此造成教育的失败。补救之道，必须先推开不切实际的教育部式、李远哲式的教改计划，锁定“教育不能无趣”的重点，予以重点著力。一个例子值得我们深思：台湾出了一位天文学的天才陈培堃，他从小到大，就是要发展独立追求学问的行动，他摆脱了正统的教育与学校，自己依照个人兴趣，走向天文学的研究。他连续三年得到李国鼎科技基金会通俗科学写作奖，写了十多本有关天文学的读物，并与日本《天文指南杂志》(Tenmon Guide)、美国《天空与望远镜杂志》(Sky & Telescope)合作，“让美丽的天际银河和凡间尘世的俗人能更亲近！”陈培堃这个成功例子，充分显示了发展个人兴趣的重要，也反讽了学校教育的无能。陈培堃的书，包括《PK天文游记》、《和星星做朋友——小飞侠星座专辑》、《星空下的彼得潘》等等，试想教科书如果这样陈培堃式的趣味化起来，学生的求知兴趣，还愁培养不起来吗？那些汗牛充栋的教育部式、李远哲式的教改计划，岂不多是隔靴搔痒吗？(1999/12/13)
026.2000年1月5日.txt	11	21-21	14	有一个|答|他说|杀|和尚	到了明末清初，流寇李自成、张献忠的手下叫李定国，他把一个城都包围住了，包围住的意思就是要屠城；这时候城里面有一个有名的老和尚叫破山，就走出来向李定国请命，请他饶了全城的人。李定国开出了一个很有趣的条件，他说你破山和尚很有名，答应我一个条件我就不杀人，条件就是你给我吃肉。破山和尚说，为了救百万生灵，何惜如来一戒，结果破山和尚当着李定国的面吃肉，然后全城的人都获救了。
026.2000年1月5日.txt	27	53-53	14	例子|有一个|死	我举这个例子证明我们对女孩子充满了细心的保护，而不是歧视女性。中国古代有一个重要的观念，那就是“七出”，就是做太太的，丈夫有七个理由可以把你赶走，第一个理由就是无子，这就可以构成离婚的条件，还有一个口舌，喜欢讲是非，所以现代的女孩都构成被休妻的条件，还有好比说得了恶疾，得了恶疾后就把你赶走，有七个条款把你无条件的赶走。那中国的伦理道德中，难道也像佛经里面这样子歧视女性吗？也不然，有三个防止的条款，叫“三不去”，就是你有七个理由把我赶走，我有三个条款可以保护我，这三个条款符合的时候你就赶不走我了，第一个不去，就是说有所娶无所归，就是你讨我的时候，我有娘家，我娘家的人死光了，你再把我赶回去就不行了，因为我没有娘家可以回去。第二个理由是先贫后富，我嫁给你的时候你是一个穷小子，我跟你白手起家，你发了财，你把我赶走，这不行，这是第二个保护条款。第三个呢，为舅姑叔三年之丧，我丈夫的父亲死了，我的婆婆死了，我为他们穿了三年的孝，对不起，我为你爸爸妈妈穿了三年的孝，你不能赶我走，所以古代虽然有七出条款可以赶走女人，可是有三不去的条款来保障女人，所以呢也没有那么多的离婚事件。有一点大家可以知道，常常不用“七出”，也不用“三不去”，就私下和解了，因为女人允许男人讨小老婆，一讨小老婆，我大老婆也不走，老老实实的待着，相安无事。所以我告诉各位，中国古代家庭能够和谐的原因，是因为丈夫可以公开讨细姨，这是很重要的一个观点。
026.2000年1月5日.txt	30	59-59	14	有一个|问|答|梁启超|康有为	我说了那么多，是因为从古到今是可以帮我们修正某一些观念的。可是有一个重点，就是我们要有好的头脑，才能够修正我们的观念。有好的头脑才能够活在台湾做你自己，有好的头脑才能够一路走来始终如一。今天我到花莲来是希望大家能够出污泥而不染，在花莲里面做莲花，我的意思就是这样，如果你的问题不能够用你的智慧来解决，那我告诉你一个方法，请你们看《李敖大全集》，我一辈子读书的精华全在里面，很多人生的问题、答案都在里面。你们不要以为我今天在台上在乱讲话，常常一个人一个偶然的机会，一场讲演会改变他的一生。清朝末年有一个神童，他中了举人后很神气，结果碰到一个老先生，跟他讲了一天的话，他听了以后非常感动，结果师徒两人做了一件惊天动地的事，就是“戊戌政变”，这两个人就是梁启超和康有为，康有为和他讲了一席话之后，影响梁启超的一生，我希望今天我以一个六十四岁的老头子，在这里跟大家讲的一番话，使大家可以从今天中午后有所改变，谢谢各位。（2000/1/5）
028.2000年1月7日.txt	10	19-19	14	有一个|过去|他说	我跟新党过去的渊源，我跟各位报告：没有渊源。唯一的渊源就是新党里面有我的被告，像郁慕明，像朱高正，都是我的被告。当然也有不少好的朋友。我隔壁的邻居张牙医，他有一个解释。他说，说“引狼入室”是不好的，应该说是“新党上了贼船”。现在新党不是“上了贼船”，而是“贼上了船”（群众大笑、掌声不断）。
037.2000年1月20日.txt	13	25-25	14	有一个|问|他说	第二、我们该清楚想通：台湾今天的乱局，省政、市政等问题其实都是枝节问题、不是顶重要的，要先解决根本问题，根本问题先解决了才能解决枝节问题。根本问题只有一个，就是如何把目前的假民主改成真民主。由于目前乱局已到了鱼烂河决的地步，我认为立竿见影的速成方法，只有一个，就是快走“多党制”的路。——在龟儿子和王八蛋之外，大家推出兔儿子、兔崽子来，制造他们党与党之间的矛盾，取得互相制衡，这样不利于他们，却有利于我们广大人民。推出兔儿子、兔崽子的党，就是支持第三党、乃至第四党、第五党。……只要不是“泡沫政党”，都可以一个个投他们的票。我相信只有“多党制”，才能在腐化的一大党两大党中，注入防腐剂。“多党制”虽然有它的流弊，但对我们还早得很哩，不必先操心。前法国总统、救国英雄戴高乐说得有趣，他说一个有两百种乳酪做法的法国，怎么可能只有一个党？其实台湾也是如此。台湾比起法国的“文化水平”来，台湾是土蛋，台湾没有两百种乳酪，但有两百种牛鬼蛇神。把各路牛鬼蛇神各从其所好，化泡沫为小党、化小党为联合阵线、化联合阵线为联合政府，为议会中制衡龟儿子和王八蛋的大力量，则在“龟兔赛跑”之下，王八即使赢了，也得规规矩矩辛辛苦苦去赢，再腐化，是赢不了的。
043.2000年1月28日.txt	3	5-5	14	寓言|有一个|死	今天（1月21日）我应邀演讲的题目是主办单位先设定的，叫“热爱乡土，共同打拼”。我认为热爱乡土、共同打拼有一个重要前提，就是要正确地热爱乡土、正确地共同打拼，如果方法错误，不但不能爱乡土，反而害了乡土。庄子有一个有名的寓言，“混沌”之神长得像鸡蛋，可是很友善，人们都喜欢他又可怜他，想说他没有眼睛、鼻子，就硬在他身上挖几个洞，结果这个神七窍流血死了，因为他不适应，你爱之适足以害之。
002.1999年12月2日.txt	21	41-41	13	有一个|问	到了第二年，1985年4月18日，《人民日报》又刊出邓小平会见英国前首相希思（奚斯）的谈话，以“将按解决香港问题的方式解决台湾问题”为主题，直接指出“中美之间的障碍就是一个台湾问题，这一问题的解决会使中美之间的关系更加密切。”而“香港问题的解决对解决台湾问题是个推动。我们将按解决香港问题的方式解决台湾问题。对解决台湾问题的条件更宽，就是台湾可以保留自己的军队。”“我们提出国共第三次合作解决台湾问题，就是因为我们双方有共同语言，我们都认为只有一个中国。”
015.1999年12月21日.txt	13	25-25	13	有一个|过去|问|骂	还有一个问题必须说明：切不要以为香港的事情全由香港人来管，中央一点都不管，就万事大吉了。这是不行的，这种想法不实际。中央确实是不干预特别行政区的具体事务的，也不需要干预。但是，特别行政区是不是也会发生危害国家根本利益的事情呢？难道就不会出现吗？那个时候，北京过问不过问？难道香港就不会出现损害香港根本利益的事情？能够设想香港就没有干扰，没有破坏力量吗？我看没有这种自我安慰的根据。如果中央把什么权力都放弃了，就可能会出现一些混乱，损害香港的利益。所以，保持中央的某些权力，对香港有利无害。大家可以冷静地想想，香港有时候会不会出现非北京出头就不能解决的问题呢？过去香港遇到问题总还有个英国出头嘛！总有一些事情没有中央出头你们是难以解决的。中央的政策是不损害香港的利益，也希望香港不会出现损害国家利益和香港利益的事情。要是有呢？所以请诸位考虑，基本法要照顾到这些方面。有些事情，比如1997年后香港有人骂中国共产党，骂中国，我们还是允许他骂，但是如果变成行动，要把香港变成一个在“民主”的幌子下反对大陆的基地，怎么办？那就非干预不行。干预首先是香港行政机构要干预，并不一定要大陆的驻军出动。只有发生动乱、大动乱，驻军才会出动。但是总得干预嘛！
018.1999年12月24日.txt	10	19-19	13	有一个|问	我有一个好友叫陈立是浙江大学心理系的名教授，极有学问又多才多艺，当过外科医生，做过国际球赛的裁判，也当过制片（陈凯歌的《霸王别姬》）……与他初识不久时，有一天他突然对我说：我觉得你不是人，是鬼！我下一跳连忙追问，他徐徐道来说：若这世界是由人鬼神所组成的。最假的是人，因为人总戴着各式各样的面具，扮演不真实的自己，再来是神，被人粉饰、诠释、利用……种种之后，也跟人一样“假假的”。最真的是鬼（可不是吗？鬼的出场白总是：我是鬼！“绝不说谎”）。况且中国最美的字都是鬼字旁的例如：魅、魂、魄……
025.2000年1月4日.txt	21	41-41	13	有一个|问	彭明敏先生谈到英国和美国两个同文同种的国家，然后英国承认美国独立，变成兄弟之邦；今天陈水扁的大陆政策还在谈这种特殊的国与国关系，也是兄弟之邦，好不好？“好的”，可是我要问，英国和美国成为兄弟之邦，有一个前提，就是打了一仗，美国打赢独立了；我们要不要和中国大陆打一仗？今天关键就在这里，如果要打，我们就准备打仗，如果不能打，准备好好跟他谈。可是有人不这样谈，好不容易汪道涵要到台湾来了，“七块论”、“两国论”、“夹击论”之后，现在还不够，又加石原慎太郎出来，制造两岸紧张气氛，我认为真的是有些人拿我们整个台湾的人、爱台湾的人来做筹码，在做豪赌，来害我们。所以这时候，我才对小马哥说他不可以见这个日本人，说什么台北市政，什么台北、东京的联合，这些都是小问题，真正在大问题、大方向上面，小马哥迷失了。
