file	paragraph	score	chars	preview
047.谁看“三民主义”？.txt	4	3	100	多好笑啊！国民党整天宣传“三民主义”、考试“三民主义”，并号召以“三民主义统一中国”，可是大家却没看过“三民主义”！没看过正本足本“三民主义”。孙中山死而有知，不知做何感想也！（1985年7月11日）
048.给全民上了专制的一课.txt	2	3	35	今天《民生报》登有“民生论坛”——《宣布中秋补假是民主一课》，其中说：
048.给全民上了专制的一课.txt	3	3	71	连日来议论纷纷的中秋节补假问题，终因总统的密切关注而得一最合情合理的解决。人事行政局中秋补假一天的宣布，有如雨过天晴，云破月出，令人不胜快慰。
048.给全民上了专制的一课.txt	4	2	87	中秋节补假虽是一件小事，但可以喻大。舆论的沸腾、总统的关切，以及人事行政局之收回成命。这三者虽都围绕着补不补假而发，但所关系者不仅是一天假期，而是无形间给全民上了民主的一课。
049.拒见林希翎.txt	2	3	130	登恩4号请晚饭，说林希翎想约席中一谈，如不能去，林希翎饭后想来拜访。我都谢绝了。我告诉登恩，可转告林希翎：“李敖说，你来台湾干吗？你不该来台湾的，来台湾多少会被国民党利用。”今天登恩转告：“林希翎回话说：我来台湾干吗？我来看李敖啊！”（1985年10月13日）
050.国民党的自大狂.txt	2	3	276	国民党党营的正中书局出版国民党教授李定一译《世界史纲》，不识原文中“Megalomania led them at last to the prossession of Egypt．”中Megalomania（自大狂）一字，竟翻译成“最后麦格隆满尼（Megalomania）王竟征服埃及”（应该译为“最后自大狂使他们占有埃及”）闹出了大笑话。不过话说回来，国民党的“麦格隆满尼王”其实未尝不是“自大狂”的同义字。看到这种人失国之际，犹以立国元勋的身份发言；做了亡国之君，犹以开国之君的气派发言，除了自大狂以外，真无法别做
051.在天使一边.txt	2	6	260	迪斯累里1864年演说，有名言曰：“The question is this：Is man an ape or an angel？ I， my lord， am on the side of the angels．”（问题是：人是猴子呢？还是天使？我主啊！我是在天使一边的。）其言甚辩，但也颇为自许。其实自己在天使一边，并非就不成问题。撒旦（Satan）就是被谴下凡了的天使，广义的说，猪八戒也未尝不是，只不过面目差了些。问题不在你在天使一边，而在你选的是哪一种天使。选错了天使，你不会好看的。（1985年12月10日）
052.只证明你们更残忍而已.txt	2	4	92	中华民国总统袁世凯，通过情报首长、特务头子赵秉钧，找黑社会头子应桂馨暗杀宋教仁。事成后，又越过赵秉钧，直接派人杀应桂馨灭口。赵秉钧气不过，打电话给总统说：“如此，以后谁肯为总统做事！”
052.只证明你们更残忍而已.txt	3	2	105	国民党在暗杀江南以后，一方面“一清专案”出卖了黑社会头子，一方面一再证明江南是国民党的情报员。但，是了又怎样？揭了这个底，除了证明你们连自己人都杀、证明你们更残忍以外，还能证明些什么？（1985年12月24日）
053.又是露奶头问题.txt	2	4	662	去年1月19日我写信给国民党新闻局长张京育，说：“在贵局迭次‘扫黄’行动中，揭橥的标准是‘三点不露’，就是刊出的图片上，不得露出女人的两个奶头和阴部，凡露奶头和阴部者，皆在取缔之列、法办之列。虽然如此，藐视贵局规定而大露特露者，贵党主持之报纸固优为之。即以1984年2月21日到22日短短两日间为例，2月21日，《中国时报》刊出裸女图、同一天《新生报》刊出裸女图、同一天《大华晚报》刊出裸女图，奶头和阴部无一不露；2月22日，《联合报》又刊出裸女图，奶头和阴部又无一不露……凡此密集安露，贵局及有关单位皆睁一只眼闭一只眼
054.你的小留学生呢？.txt	2	3	308	国民党驻美黑代表钱复，1月7日报告，谈到“小留学生”的问题。他指出：我们在美国的小留学生，人数一万以上，他们虽是中国人，但中国语文教育基础不足，又因护照过期，要升大学也成了问题，最严重的是隔离父母，缺乏家庭教育，影响人格的发展，个人又无法照顾自己生活，滋生了许多问题。将孩子过早送到外国的父母，实在对不起孩子云云。但是，1983年1月4日，钱复上任登机前，却明明看到他念高三的儿子、念初三的女儿，和他一道儿去美国了，这一子一女，难道不是小留学生吗？不同的是：别人只是没有钱复这种可以举家赴美的特权而已。正因别人无此公然由
055.不想见翁松燃了.txt	2	3	79	宏正转告翁松燃问候之意，我说松燃老是跟莫名其妙的人（指官方与通官方的党外分子）来往，对过去的他，实在是一种退步与失格，我不想见他了。（1985年12月27日）
056.黄石城的马屁经.txt	3	9	292	首先，就蒋总统经国先生的人格事功而言，他是一位卫道者，古人说：“一言以为天下法，一行以为天下则。”经国先生的确做到了；在思想上，他手著的《荒漠甘泉》中那种悲天悯人，先天下之忧而忧，后天下之乐而乐的胸襟怀抱可以看出；在行为上，他在大陆时期担任专员“江西剿共”，以及“上海打虎”，名噪一时；来台后担任行政院长期间为国筹谋十大建设，剑及履及亲临深山旷野慰问工作人员，亲民爱民遍及乡村田野的表现可作佐证。尤其先总统蒋公逝世时，他那《守灵百日记》所表现的孝思与至情笃孝之情，真可以感天地而泣鬼神，足为国人所法勉。他是一个以身作则，
056.黄石城的马屁经.txt	4	3	170	我看了，直起鸡皮疙瘩，并且大笑不止。查《荒漠甘泉》乃洋教棍著的书，怎能说成蒋经国的“手著”？“江西剿共”乃蒋介石干的事，怎能算在蒋经国的头上。《守灵百日记》并无此文，有的只是《守父灵一月记》，黄石城显然硬把孝子蒋经国按在“慈湖”，多住了七十天也！蒋经国真要哭笑不得了也！寄语黄石城：多看点书，拍马屁也得有点章法吧？（1985年12月19日）
057.匡复起点搬家了，重建基地动摇了.txt	2	5	610	今天《新生报》登：为了配合台北市区铁路地下化施工，位于东隧道上方的“国父史迹纪念馆”，订明（1986）年1月起拆移，由于该馆为国父在台有关史迹唯一保存完整之房舍，施工单位在原馆北端，将依原形状、建材予以复建。全部迁建复原工作，预定1986年12月完成。国父史迹馆位于台北市北平西路与中山北路交会处，与救国团青年服务社房舍比邻相接，原系日本旅舍“梅屋敷”旧址，国父于1913年二次革命失败后，赴日时道经台湾即下榻于此。“梅屋敷”约建于民国前十年间，为日据时代台北市第一流日本酒家，遍植梅花，摇曳生姿，日人达官巨贾，多在此聚
058.李敖的鸡巴有远见.txt	2	3	316	当年（1964）小文在美国出生的时候，陈鼓应跟人说：“李敖这个女儿在美国出生，就是美国人了，李敖的目的，是二十多年后，可以以‘美国人的爸爸’身分去美国。”这话传到我耳里，我开玩笑说：“李敖这么有远见吗？有本领把计划定到二十年后吗？二十年太长了吧？变化太多了吧？我靠小文去美国，还不如靠老蒋回大陆也！”如今，“岁月如矢，革命未成”，二十多年一晃就过去了，靠老蒋回大陆固是笑谈，靠小文去美国却逼人成真了！如今许多家长大做“小留学生”之梦，他们的“大头”，其实还不如李敖的“小头”有远见呢！又何止他们，连我李敖自己，恐怕也都我
059.尤清明于责人、昧于知己.txt	2	5	298	邱连辉竞选屏东县长失败，不甘寂寞之余，高速投靠国民党，竟出任省政府顾问兼诉愿委员会主任委员。1月17日《八十年代》登出尤清谈话，尤清说，事先他劝阻邱连辉，理由有二：“第一点，选举的失败不值得灰心，因为以他一人的力量与国民党对抗自然是处于劣势。第二点，依他的身分、地位‘管’邱创焕是绰绰有余，何必屈就邱创焕之下呢？”尤清的话，都言之成理、都没有错。但是，令人不解的是：你尤清这次抢破头来竞选台北县长，幸亏你落选了；如果你没落选，当上台北县长，试问以那时候的县太爷“身份、地位”，是受谁“管”呢？国民党省主席邱创焕岂不正是你
060.辜振甫出丑记.txt	3	2	457	舒尔兹的“中堂脾气”台北也领略过。今春台北工商界巨子辜振甫专程来华府，为争取美国支持中华民国加入太平洋社区组织奔走，事后，舒尔兹曾在国务院设宴，款待一些热心推动这一组织的各国知名之士，辜振甫与舒尔兹同席。宴会进行中，舒尔兹特请外国客人们即席致词。轮到辜氏讲话时，辜氏本于爱国热忱、做点国民外交的心理，希望美国供应高性能战机给台湾，岂知舒尔兹一听此话勃然大怒，立即愤然离席而去，使得宾客相顾愕然。亚太事务助理国务卿伍夫维兹、国务院负责亚太社区事务的费朋克大使尾随舒尔兹退席，被舒尔兹狠狠的训斥了一顿，责备他们怎么能让辜振甫
060.辜振甫出丑记.txt	4	3	219	辜振甫也、钱复也，他们真可恨、可耻、又可怜！其实话说回来，老美国务卿实在是错怪了这位国民党中常委。舒尔兹不知道，辜振甫的即席致词，根本不是说给华府的舒尔兹听的，乃是说给台北的蒋经国听的。这个情况，一如当年国民党外交部长魏道明在联大演说，当时大会主席赶魏道明下台，魏道明仍不肯下台，还是要说个没完，原因无他，要说给在台北的蒋介石听耳！——洋人的智能毕竟比国民党正式外交官和“国民外交官”差一大截，舒尔兹太不可怜人啦！（1986年1月29日）
061.橘皮何辜？.txt	2	5	199	初一午间华视新闻，国民党竟利用独占的传播媒体，提倡迷信，访问起当代“妖僧”林云来！林云说，“中华民国”国运已经否极泰来，“中华民国”的气非常兴旺，现在走泰来的运，大陆则是乌云蔽日。大家接祥气、除晦气的方法，初一、十五晚上子时（11至1点）以十五分钟时间，用九片新鲜橘子皮，剪成圈形，扔到每个主要房间去。……接着他以指上手势为蒋经国祈福。——一派迷信的妖妄之行，看了真令人厌恶。（1986年2月9日）
063.打官司的成与败.txt	2	2	123	我在国民党统治之下，一直是以“成固欣然，败亦可喜”的心态打官司的。我反正站在正义的一边，法官苟有异数，同我一边，是谓“欣然”；法官同流合污，不同我一边，但他们的判决书可以被我遗臭万年，留为历史活证，这也不错，是谓“可喜”。（1986年2月12日）
065.呜呼胡适专家！.txt	2	9	739	台大历史系教授张忠栋，《在动乱中坚持民主的胡适》讲稿（1986年2月25-27日）中，用的是“蒋委员长与汪精卫于民国二十三年11月27日发表一则通电”的次序，这是与史法不合的。汪精卫当时排名明明在前，如今崇蒋抑汪，当然不对。又说“胡适写信给周鲠生，公开发表于《独立评论》”云云，更是大错。《独立评论》创刊于1932年5月22日，停刊于1937年7月25日，共出二四四期，是抗战前的重要刊物。《独立时论》则是抗战后的产物，创于1947年。1948年4月，曾有《独立时论集第一集》出版（发行者独立时论社、发行所北京大学出版部
066.借死人骗活人.txt	2	8	373	四月六日《中国时报》登共产党那边的消息，说：“昨天，中共主动在北平召开了‘天安门事件’十周年的纪念大会，……今年是文化大革命发起的二十周年，也是周恩来死亡、‘天安门事件’、‘唐山大地震’、毛泽东死亡、‘四人帮’被逮、华国锋政变‘登基’、文化大革命结束十周年，在这一连串的大日子中，难免激发人们的沉思，尤其是中共既没有回答去年学生提出的问题，又没有解决物价飞涨造成的经济衰退。此时此刻，人们郁积在心头的‘闷气’，很可能就会借‘天安门事件’十周年寻求发泄，导致历史重演。鉴于此，中共才主动搞了这次‘纸船明烛照天烧’（意即‘借
067.戒严四十年？.txt	2	8	237	1949年5月19日，国民党在这一天起在台湾实施戒严。最近，郑南榕发起“五一九绿色行动”，来纪念这个“台湾戒严日”。在菲律宾“黄色运动”成功的今日，这一行动，当然别有意义。回想1982年10月15日，孙运璿在立法院答复许荣淑，居然说：“戒严令不是实行多久的问题，而是该不该实行的问题，该实行，三十年要实行，四十年也要实行！”这种悍然无耻的心态，真是千古所无。不过，国民党要想戒严一戒四十年，恐怕也时不我与了，至少孙运璿看不到，他的主子蒋经国也看不到了。（1986年4月8日）
068.收音机何辜？电视机何辜？.txt	2	5	208	3月28日国民党《中央日报》载：三十九岁的工厂职工接瑞华，酒后观看电视连续剧，不知何故突然捣毁电视机，凌晨被家人发现上吊自杀断气命绝，其妻抚尸恸哭，悲伤逾恒云云。使我联想到蒋介石当年从广播中听到李宗仁当选副总统时，曾捣毁收音机；徐复观从电视中看到梁容若著书得奖时，曾捣毁电视机。可见“自天子以至庶人”，虽口诵圣人“不迁怒”之训，但动起手脚，却都性好此道也。只是收音机何辜、电视何辜，令人不解耳！（1986年4月8日）
069.“视弃天下，犹弃敝屣也！”.txt	1	2	13	“视弃天下，犹弃敝屣也！”
069.“视弃天下，犹弃敝屣也！”.txt	2	7	207	菲律宾祸国者马科斯夫人，3月5日在美国接受访问，答复她遗留在菲律宾三千双鞋子的事。她说：“我不相信那里有三千双鞋子。那是我财产的全部，我从不丢弃任何东西，即使是坏掉的拖鞋和高跟鞋，我不是浪费的人，这些鞋子是过去近二十一年中留下的。”真是奇论也！从不丢弃任何东西，就可大量买进任何东西而不构成浪费么？孟子说：“视弃天下，犹弃敝屣也！”如今马夫人总算“天下”与“敝屣”被迫两弃了，孟子真是预言家！（1986年4月8日）
070.黄炎培记蒋介石暗杀事.txt	3	6	328	辛亥革命写完了吗？还有一件事，我不能不附录在这里。辛亥11月25日夜，革命大领袖之一陶成章号焕卿在上海广慈医院被刺死，刺客为谁？怎样刺杀？很有人说是陈其美命蒋介石刺死的。各种记载，大都推给他人，脱卸自己。无论如何，从整个革命说来，总是一件很大不幸的事。我是认真写日记的。根据我的日记：1927年6月3日，上海澄衷中学校校长浙江人曹慕管和我漫谈。曹说：“我民元，病卧广慈医院，1日傍晚，蒋介石来谈，临行说：‘我们今晚将做一件大事。’夜半，忽闻枪声，别室陶焕卿中枪死了。”有深知此中秘密的告我：“陈其美嘱蒋介石行刺陶焕卿，蒋
070.黄炎培记蒋介石暗杀事.txt	4	3	116	黄炎培感慨说：“爱国主义、民主主义、人道主义、反封建主义，许多同志为了实现这些理想，不惜牺牲生命，是大大可敬的。太可惜的是发现了若干人枪口不对外而对内。这些从革命全局说来，到底是很大很大的损失。”真是沉痛之言。（1986年4月8日）
071.三中全会的怪老子.txt	2	2	149	国民党三中全会，秘书长江苏人马树礼，把“三中全会的闭幕”发音成“三中全会的屄毛”；中常委贵州人谷正纲，把“国父遗嘱”都背不完，在宣读之际，忽然忘了下文。我笑猜这是死鬼汪精卫作怪之故。谷正纲以前跟汪精卫，而汪精卫是“国父遗嘱”的执笔人，如今在六十年后，开老谷一玩笑，大有可能也！（1986年4月8日）
073.扫把星看扫把星.txt	2	3	160	报载观测哈雷彗星不仅在民间造成一股热潮，更引起国军将领们的浓厚兴趣，据悉，3月19日，就有多位国军将领加起来共有“五十二颗星”群集联勤鹅銮鼻活动中心，专程赶去一睹哈雷彗星景象，场面甚为壮观。可惜的是，当活动中心主任正为将领们简报哈雷彗星时，屋外却下了一场大雨，浓云密布，遮盖了哈雷彗星，以致将领们乘兴而来却败兴而归云云。
074.计程车司机与李敖.txt	2	4	97	坐计程车，司机一声不响。下车后拒收车资，只说：“支持你，不收车资。”我强把车资留在座位上。这位司机先生真可记，他看出乘客是李某人，可是不说一句好奇的话，真是木讷近仁者矣。（1986年4月27日）
075.外交部次长关镛的丑陋.txt	9	2	57	这一文件，一来可以看到国民党外交部高层人员的腐败，一来可以看到“敢怒不敢挺身的职员”的不平。（1986年5月1日）
076.国民党的外交.txt	2	3	409	西方俗话说：“外交是用最好的方法，做出并说出最脏的事。”（Diplomacy is to do and say the nastiest thing in the nicest way．）这种俗话，乃是洞彻外交通则而来。这种外交通则，传统的中国人并不太懂。传统的中国人，只懂得“万国衣冠拜冕流”、只懂得“夷狄进入中国则中国之”。但是中国人不懂得万一万国不肯拜冕旒或夷狄不肯进入中国则怎么办？光凭军队去打固不是办法；“怀柔”、“和亲”、“人质”、“驭夷”、“赏赐”。“片板不许入海”等等手段，有效的程度也不乐观。于是，中国
077.先烈家属下场.txt	2	3	153	午与王小痴谈。小痴说：“黄花岗七十二烈士，福建省十九人。最出名的是林觉民，他的孙子和我小学同学。意映我也见过。只知道抗战时全家饿死。在方声涛做福建省长时，这些烈士家属定下由省府供养的例子，后来国民党就不太履行，经常欠付，到了抗战，就中断了。”由此可见，同志无情如此，革命先烈尚可为哉？（1986年7月2日）
078.党外助选下场.txt	2	4	26	8月9日，台北县党外苏克福寄来质问尤清的信，其中说：
078.党外助选下场.txt	5	2	333	讵知，在台端虽败犹荣的县长选战结束后，台端在三重市成立的北县服务处里，竟不时传出本人曾侵吞台端“老师太捐款拾万元”的不实言论（上事有多位人士在台端服务处亲耳听闻可为证），恶意中伤本人，使不明就里者误信为真实，令本人蒙冤不清。现今党外伦理道义之沦落已极，为免相互攻讦争执，予人笑柄而削减内部实力，本人原思养晦于自宅，背黑锅不思澄清，牺牲自我以成全台端之一世英名；但继思，有被误会而不乘机解释清楚，若致使他人以本人为实例，作为替台端助选将落得如此下场的“楷模”，误认为台端深藏不露具有汉高洪武杀功臣“狡兔死，走狗烹”之高明手
079.我就是神、吾就是高人.txt	4	3	78	这段话甚逗。我写文章，真希望“冥冥中似有神助或高人指点”，问题是何方神圣能助我呢？哪来高人来指点我呢？事实上，我就是神、吾就是高人也！（1986年9月9日）
080.五十年前的批语.txt	3	3	141	某路局一员司，因承办某项公事，颇难着手，须增加经费方可集事，乃上签呈于上官，历述此事之困难，及应增加费用之理由。签上，上官批曰：“核阅所呈，一则曰畏难，再则曰要钱，远之不如岳武穆，近之不如拿破仑，所请不准。”盖以武穆有“文官不爱钱”，及拿翁有“吾之字典中无难字”之语，遂如此引用也。
081.日历在我眼中全是黑字.txt	3	3	62	工作——我这行的工作——对我从来就是快乐，因此，我实在不懂人家问我“近来作何消遣？”我根本不觉得有什么好消遣的、需要消遣的。
083.杨传广与一记耳光.txt	2	6	416	今天报上说：“亚洲铁人杨传广，今天决定‘以行动证明一切’，提前于明天返回台北，以澄清有关他的谣传。杨传广目前正以中华民国亚运考察团团员的身分，在韩国访问，原定10月6日随团返国。因为谣传他有意前往中国大陆，担任中共‘中国体委会副主任’。他决定提前返国，以行动澄清谣言。中华民国驻韩国大使邹坚，对杨传广以行动证明爱国的做法，表示赞扬与钦佩。邹坚今天下午曾与杨传广晤谈后告诉中央社记者，杨传广表示‘很不会讲话，不晓得要如何澄清’无谓的谣言。但对邹大使对他的信任，表示安慰。”这段消息，使我想起：杨传广这种提前返台的表态与急促
084.“贤”就“贤”吧！.txt	2	4	147	今天报载坐落在济南路上的立法院新盖大楼落成后，取名“群贤楼”，一年多来有关名称问题，时有争论。因为有的立委认为，自喻“贤”人，实有未妥。依我看来，这些立委毋乃太谦了。因为“中华民国”明明是蒋家天下的“中华帝国”，却自喻“民”国不误，立委老兄们“贤”它一下，又何必脸红哟！（1986年9月26日）
085.捣乱七要件.txt	2	2	144	1936年2月27日，王正廷在厦门演说，题目是：“要如何去破坏一个团体？”方法有七：一、开会不到；二、每到必迟；三、到会不发言；四、散会后发不负责的批评；五、选举必争；六、争到手了又不负责；七、争不到手便宣告退会。这七点高招，前四点国民党最拿手；后四点党外最行家。（1986年10月7日）
089.来回带物法.txt	2	3	211	我是天下第一忙人。忙的情形，有“来回带物法”可见一斑。“来回带物法”是我自己摸索出来的方法，就是在家里，只要一走动身体，不论从书桌到餐桌，或是从这间房到那间房，来去之间，绝不空手，总要顺便带件资料，把相关的一切顺手归位。甚至小便时也此尿不白洒，一边小便，一边看马桶盖上的零星资料，顺手带回，即予分类入档。虽然这样勤勉，一天下来，总还觉得时间不够用，恨不能延寿半世纪，把永远做不完的事，再多做一些。（1986年10月12日）
091.工专长寿·台大短命.txt	2	2	178	台北工专今日庆祝建校七十五周年，显然是从日治时代创校起算的。但是台湾大学的建校算法却邪门得很。它明明建校在1928年（若从医学部起算，且可追溯到民国前十二年之台湾总督府医学校），却被拦腰剪断，硬从1945年抗战胜利接收台北帝国大学算起，真是太没道理了。比较起来，台北工专是小学校，反倒可以不被注意，得保前史。此所谓“校失求诸小”也。（1986年11月1日）
094.“泪阑干”与“倚阑干”.txt	2	3	291	阑干在古典文学里有两个用法，一个是“泪阑干”的用法，一个是“倚阑干”的用法。前者的阑干是“纵横”的意思，所以蔡琰《胡笳十八拍》中说“岂知重得兮入长安，叹息欲绝兮泪阑干”，就是指泪流满面；后者的阑干是“栏杆”的意思，所以李白《清平调》中说“解释春风无限恨，沉香亭北倚阑干”，就是指倚栏寄怀。这两个用法本是分开的，如果有美人焉，要一边泪流满面一边倚栏寄怀，那就阑干又阑干，二合一矣。不过，这并不是什么好现象，虽然很诗意。但我看到一张裸女图，一洋美人也是倚栏，但却一派勾魂巧笑，全无泪痕，看后不由觉得“倚阑干”派实比“泪阑干”
096.广告成问题吗？.txt	2	3	385	这次国民党政府和它“美国爸爸”订中美烟酒协议，五次谈判下来，丧权辱己，丢人之至。今天国民党《中央日报》登：“经济部高级官员指出，我国在中美烟酒谈判的计价方面让步，是换取美国烟酒进口商的广告数量，这显示政府宁可收入减少，也不放弃保障国民健康的原则。”“这位官员承认：最初美方同意的公卖利益比现在协议的数字高；但是要求不能有广告方面的限制，我方担心在强力促销下，会使青少年吸烟人口大增，因此坚持不能大作广告，经反复磋商，双方各让一步。”云云，听来不胜好笑。查国民党禁刊李敖和党外书刊的广告，一声令下，各报纷纷拒登，既然行政命
