file	paragraph	line_start	line_end	char_count	score	snippet
009.过早的答案.txt	24	47	47	243	3	许多神经过敏者少见多怪的人看了我的文字，便认为我穷凶极恶，有阴谋有野心，真是见他妈的鬼。他不晓得我本人实在是一个好好先生，至情至性，像个娃娃；淡漠官禄富贵，又像个哲学家。我常常自嘲说：“青年人若有才智如我、有个性如我、有人品如我者，决不肯再像我这样‘老实’，他们早就闹事了，早就不‘安分’了！他们决不像我这样，闭户不出，谢绝交游，独自一个孤单的在书堆里终老的。...
009.过早的答案.txt	25	49	49	407	3	去年12月5号的晚上，台大的融融社举办了一个三十多人的讨论会，讨论的题目是李敖其人其文，这类现象，岂不值得关心世道人心者的参考吗？我要不谦虚的说，今日在自由中国，三十岁以下的男人，有潜在的影响力的，无人比我更大，台湾的《新闻报》、香港的《新闻天地》上，都有记录和报导关于我的著作畅销的情况。凡是肯正视现实的人，都该承认“李敖对青年人的影响力”的这一现实。但是承...
009.过早的答案.txt	26	51	51	173	3	但我的目的本不在讨好，我的目的就在鼓吹和平而渐进的转移或改革，并且我深信：这种转移或改革的基本动力是孙中山所说的“思想之变化”。但我觉得：孙中山这种清楚的提示，并没有得到他的同胞们广泛而深入的认识，许多人总是过度迷信许多“思想”以外的力量，例如“政治”的力量、“军事”的力量、“党团”的力量、“警察”的力量、“金钱”的力量等等，这是很可悲哀的事。
009.过早的答案.txt	28	55	55	85	3	所以，每当我接到一些没头没脑的怪信，我便暗想写怪信者一定是一个不了解我的人，我试举一封去年12月25日来自“台湾省合作金库”的“一位三十五岁年轻人”的匿名信为例，信中说：
009.过早的答案.txt	32	63	63	187	4	我现在要答复这位“三十五岁“的急进者，”隐者“李敖不同意你的意见，但他谢谢你对他谬相期许的好意。我的基本论题根本就和你不一样，我不承认你所说的“政治是领导一切”的话，所以我认为千言万语的谈政治，结果群相咨嗟，徒乱人意耳，言之谆谆，听者藐藐，有何用处？《自由中国》杂志是一本谈政治的刊物了吧？结果谈得有用吗？《自由中国》事件的受害人，难道我们不明白是雷震等人和当...
009.过早的答案.txt	33	65	65	269	4	当然，我承认知识分子谈政治，甚至涉身政治，只要配合得好，不做无聊的合作，也不做无谓的牺牲，也自有他们的道理。不过我李敖不走这条路，也不鼓励这些，我要鼓吹“思想之变化”，并且深信只要思想能变化，一切问题也就慢慢迎刃而解，到那时候，可以使小百姓少吃些苦，可是少毁掉一些人才，少流点血。流血总是不好的，流血跟管训、监狱、看守所等等是兄弟，它告诉我们：你使你的同胞流出...
009.过早的答案.txt	34	67	67	159	4	知识分子玩政治，跟流氓（行动者）合作打天下，是一个古老的公式，也是一个腐败的公式，它的结局往往是“生灵涂炭，奸雄窃喜”，往往是“一将功成万骨枯”，最受害的，往往是他们用来做“吊民伐罪”口实的小民，用来做拯救对象的小民。结果呢，小民没被他们所“吊”，却被他们所“吊”，人间的奇剧与谑画，没有比这个公式下的产品更逼真的了！
009.过早的答案.txt	38	75	75	322	3	新时代的知识分子要彻底认清他目前所处的是一个什么环境下的什么地位，然后承认不合作、不降志辱身是对付腐败政治的“无为”方法；而这种“无为”，又是另一种方式的“有为”：他要“有为”的促进“思想之变化”，“有为”的去反对以暴易暴，“有为”的改造社会，“有为”的关切三轮车夫和农人工人的血汗，“有为”的改善养女妓女的生活，“有为”的督促恶法的修正，“有为”的检举法官的...
009.过早的答案.txt	39	77	77	227	3	这些在政治剃刀边缘的活动，这些非政治的合法的光明正大的救国爱国活动，真正对国家百姓的好处，绝不在向当权者上条陈、写万言书之下。而这些政治以外的活动生根发叶开花结果之日，就是“当政者”必须“吾从众”之时。那个时候，他们也许跟“愚昧”“顽固”一齐入土了，也许被淘汰了、也许改过迁善了。至少那时候，他们必然清楚的认清“民情”和“民智”是什么了，他们即使不垮台不退休，...
009.过早的答案.txt	40	79	79	222	3	这种“思想之变化”的力量，这种“社会改造”的力量，它的基本重点是民情的洞开和民智的普遍。在民情洞开、民智普遍的国家里，一切极权专政的思想与势力都不能侵入或持久的，试看共产主义和共产党为什么在英国美国闹不起来？却在苏联本土发动，在中国大陆发疯？究结原因，英美的“民情”与“民智”实在比闭锁的苏联和愚昧的中国来得洞开而普遍，而英美的知识分子却又崇尚人权、法律与非暴...
009.过早的答案.txt	41	81	81	109	3	所以我说，“思想之变化”、“社会改造”等等，是一切政治清明的基础，舍弃这些大路而妄谈政治改革，认为“政治是领导一切”，是舍本逐末，是中了误信“政治是领导一切”者的宣传。至于引起个人方面的杀身之祸或坐牢之祸，犹其余事也！
009.过早的答案.txt	50	99	99	189	3	这篇一万字的自白书，可说是我在自由时候的供状。主要的意思在对当代知识分子的去向提供一个答案：——不但给在野的有所作为的知识分子提答案；同时也给当权的想害人的知识分子提答案。在这个答案里头，我指出文人想借刀（尤其是借武人之刀）杀人的悲剧，也指出“政治是领导一切”的不通，以及非政治的救国爱国行动的可能性跟实效性。许多地方我用我个人的遭遇做例子，为了我的遭遇多少可...
009.过早的答案.txt	75	149	149	247	3	《三国演义》第二十三回，曹操欲选一有文名之士，往说刘表投降，先找孔融，孔融推荐他的朋友祢衡，融自称：“祢衡之才十倍于我，此人不但可任使者，且宜在帝之左右。”上表给献帝，其中盛赞祢衡的才华，略谓：“……窃见处士平原祢衡，年二十四，字正平，淑质贞亮，英才卓荦，初涉艺文，升堂睹奥。目所一见，辄诵之口；耳所暂闻，不忘于心。性与道合，思若有神，弘羊潛计，安世默识，以衡...
009.过早的答案.txt	76	151	151	296	3	帝览表，以付曹操。操遂使人召衡至。礼毕，操不命坐。衡仰天叹曰：“天地虽宽，何无一人也。”操曰：“吾手下有数十人，皆当世英雄，何谓无人？”衡曰：“愿闻！”曹操列举了帐下的文武干部，衡笑曰：“荀彧可使吊丧问疾，荀攸可使看坟守墓，程昱可使关门闭户，郭嘉可使白词念赋。张辽可使击鼓鸣金，许褚可使牧牛放马，乐进可使取状读诏，李典可使传书送檄，吕虔可使磨刀铸剑，满宠可使饮...
009.过早的答案.txt	78	155	155	115	3	当时，有张辽在侧，掣剑欲斩之。操曰：“吾正少一鼓吏，早晚朝贺宴享，可令祢衡充其职。”衡不推辞，应声而去。辽曰：“此人出言不逊，何不杀之！”操曰：“此人素有虚名，远近所闻。今日杀之，天下必谓我不能容物。彼自以为能，故令鼓吏以辱之。”
009.过早的答案.txt	79	157	157	275	3	来日操于省厅上大宴宾客，令鼓吏挝鼓，旧吏云：“挝鼓必换新衣。”衡穿旧衣而入，遂击鼓为《渔阳三挝》，音节殊妙。左右喝曰：“何不更衣？”衡当面脱下破旧衣服，裸体而入，浑身尽露，坐客皆掩面，操叱曰：“庙堂之上，何太无礼？”衡曰：“欺君罔上，乃谓无礼，吾露父母之形，以显清白之体耳！”操曰：“汝为清白，为污浊？”衡曰：“汝不识贤愚是眼浊也，不读诗书是口浊也，不纳忠言是...
009.过早的答案.txt	80	159	159	230	3	在同一时代的诸葛亮也曾自比管仲、乐毅，但是徐庶把他推荐给刘备时，刘备说：“君与俱来！”徐庶曰：“此人不可屈，致宜枉驾求之。”刘备三顾茅庐以后，他才肯出山，照孔融所说以及祢衡自况，他的才能比诸葛亮要高明多了，但为什么一召而至，而且目空一切，连推荐他的孔融几乎都不算是人才。可能如曹操所说的“素有虚名”，而且他的言行充分表现其心理变态，当众裸体，有所谓“暴露狂”，...
009.过早的答案.txt	81	161	161	145	3	祢衡第一次“自杀”未遂，又做第二次，《三国演义》中如此写着：衡至荆州，见刘表毕，虽颂德，实讥讽。表不喜，令去江夏见黄祖。或问表曰：“祢衡戏谑主公，何不杀之？”表曰：“祢衡数辱曹操，操不杀者，恐失人望，故令作使于我，欲借我手杀之，使我受害贤之名也。吾今遣去见黄祖，使曹操知我有识。”众皆称善。
009.过早的答案.txt	82	163	163	131	3	于是祢衡又做第三次“自杀”。祢衡到了黄祖处，与黄祖共饮，皆醉。祖问衡曰：“君在许都，有何人物？”衡曰：“大儿孔文举（融），小儿杨德祖，除此二人，别无人物。”祖曰：“似我如何？”衡曰：“汝似庙中之神，虽受祭祀，恨无灵验。”祖大怒曰：“汝以我为土木偶人耶！”遂斩之。
009.过早的答案.txt	86	171	171	297	4	有一次遇到一位朋友，他告诉我《文星》杂志提到《谈古论今》，当时我有点“受宠若惊”，查看之后原来是“今之祢衡”在痛骂他的老师们——沈刚伯、李济、钱思亮等人，引用了我的两句话，后来他又在《关于高等教育怪现状的讨论》一文中说：“乔龄的《人才之叹》一文，也值得我们一看……”接着把那篇全文转载，而且编入他的《教育与脸谱》这一本册子内，我原先只知道本市某日报海外版转载我...
009.过早的答案.txt	87	173	173	262	3	近日看到一篇文字，要求将“今之祢衡”绳之以法，我看大可不必。孟子在《离娄篇》曾说过：“有人于此，其待我以横逆，则君子必自反也：‘我必不仁也，必无礼也；此物奚宜至哉！’其自反而仁矣，自反而有礼矣，其横逆犹是也，君子必自反曰：‘我必不忠。’自反而忠矣，其横逆犹是也，君子曰：‘此亦妄人也已矣。……’”何况曹操与刘表虽然祢衡一再辱骂讥讽也不动肝火，让黄祖去杀他，主张...
009.过早的答案.txt	97	193	193	212	3	《胡适评传》是何人所作，对胡氏“轻薄”、“鄙笑”、“讽刺”到如此程度，我因未读过，无从知道，这不是我所要讨论的。但对中央日报主笔所主张的“盖棺论定”，则绝对不敢苟同。因为在一个人死的时候，有一次盛大的追悼会，即认为“士林一致悼念他、尊重他”，以少数人视为全体，未免太武断。若以这种方法判断人的贤愚，则在台湾死去的人，开过追悼会，有数千人，甚至万人出席，就认其是...
011.论没有“流血的自由”.txt	6	11	11	355	3	这是我改写的四句诗。原诗引号里头的文字，大家都知道是汪精卫谋刺摄政王不成，在清朝牢里做的。当时汪精卫所处的是一个旧时代，在旧时代中“造反”也好、“起义”也罢、“革命”也行，不管你干什么，只要你不成功被逮到，大概都难逃一死。在挨刀以前，抗节不屈的人，往往可以得到英雄式的招待和烈士式的满足，他在“从容坐楚囚”以后，“绑赴法场”，还可以意气扬扬，“慷慨歌燕市”一番...
011.论没有“流血的自由”.txt	7	13	13	364	3	旧时代的好汉们为理想奋斗，他们深刻了解“千古艰难唯一死”的哲学。奋斗失败了，他们甚至甘愿用“一死”来代替逃亡，代替徐图再起或卷土重来。戊戌政变时候的谭嗣同，就是具有这种信仰的典型。当时日本志士们劝他离开北京，他却不肯，他竟说：“各国变法无不从流血而成，今日中国未闻有因变法而流血者，此国之所以不昌也！有之，请自嗣同始！”——可怜的谭嗣同，他竟认为午门溅血，是变...
011.论没有“流血的自由”.txt	8	15	15	291	4	清朝的当政者中，第一个感到不该给好汉们“流血的自由”的，该首推靖州牧金蓉镜这个人。当时革命志士禹之谟，曾被检举以“率众塞署罪”而被下令搜捕，长沙基督教圣公会的牧师黄吉亭听到这个消息，立刻劝他快逃，可是禹之谟不肯，他又感染了谭嗣同的气派。他竟说：“吾辈为国家为社会死，义也！各国改革，孰不流血？吾当为前驱！”可是禹之谟却没想到，他所碰到的“赴死的运气”，却比谭嗣...
011.论没有“流血的自由”.txt	9	17	17	321	5	所谓“流血的自由”，广义的说，是脖子挨刀的人们，最后表白一下真我的自由，他们以命偿名，临终以死明志，消极说来，也不失为一种抗议——一种悲壮的抗议，一种看似无用却影响深远的抗议。旧式的大权在握者，基于“示众”、“阴德”等复杂心理，对“待死之囚”，总还给他一个“慷慨过市”的机会。换句话说，“待死之囚”最后想得到一个英雄式的烈士结局，他可以被允许得到。从另一个角度...
011.论没有“流血的自由”.txt	13	25	25	365	4	斯大林最“精采”的杀人表演，是一九三六年开始的三幕“大公审”活剧。在活剧演出时，被告的态度，使全世界的心理学家和法律专家都感到大惑不解。原来名列被告的被整肃的老革命党们，他们在法庭上，竟纷纷“直认罪状不讳”，他们不但不为自己做无辜的辩护，反倒帮忙检察官找最恶毒、最丢脸的形容词朝自己脸上贴；同时他们的律师，也不替他们做无辜的辩护，也一反律师之道，纷纷帮助检察官...
011.论没有“流血的自由”.txt	14	27	27	230	5	一九三六年开始的三次大公审，因为场面太离奇了，所以引起世界人士的进一步研究。研究的结论大抵是：这些老革命党在法庭上“纷纷自毁”的反常言行，似乎不是刑求、催眠，乃至诱骗的结果，他们之所以自知必死而又甘心受诬，真正缘故乃是受了“人质”的胁迫。被整肃的老革命党们，他们也有妻儿、朋友和信徒，为了换得妻儿、朋友和信徒的存在，他们不得不答应斯大林来演这场苦戏。被枪决的老...
011.论没有“流血的自由”.txt	15	29	29	120	3	我想对我的孩子说几句话，——我没有别的法子跟他们通话。我有两个孩子：一个是空军驾驶员，一个是少年先锋队队员，也许我现在的一只脚已经踩在坟里了，但我要对他们说：“不管我怎样被判决，判决总是公正的。不要向后看，只向前进，和人民一起追随斯大林！”
011.论没有“流血的自由”.txt	17	33	33	171	3	“骂贼而死”的英雄也好、“引刀成一快”的烈士也罢，在现代新式统治者的巧妙统治技术下，这些英雄与烈士都已变成历史的陈迹。现代想做英雄与烈士的人，已经失掉“死得悲壮”的自由，他们要死得卑微、死得丑恶、死得有话不能讲，有血流不出。“辜负我满腔心事矣！”这就是他们最后的结局。他们求仁而不能得仁，反倒死于不义，他们要背着恶名而死，要死得活像一个懦夫！
011.论没有“流血的自由”.txt	18	35	35	265	3	新式统治者已不允许有英雄式的烈士存在，他要在“烈士”生前，就先涂上卑微丑恶的脸谱，他要先用秘密而卑鄙的方法，毁掉“烈士”的历史、毁掉“烈士”的信用、毁掉“烈士”演说的自由、毁掉“烈士”出书的自由、毁掉“烈士”通信的自由、毁掉“烈士”登报的自由、毁掉“烈士”这个、毁掉“烈士”那个，使愚昧的小百姓们觉得：原来“烈士”并不烈！原来“烈士”历史不清白！原来“烈士”没...
012.牛肉面老板的七封信.txt	18	35	35	171	3	我在旧书摊上买到一本宣纸的小折页册，正好可做签名之用。我盼你能在这本小册的前面，写它一两页，题目无非“知识人赞助李敖卖牛肉面启”之类，然后由我找一些为数不多的我佩服的或至少不算讨厌的人士纷纷签它一名，最后挂于牛肉面锅之上，聊示“招徕”。此“启”只负责“赞助”，不负责牛肉面好吃与否或有毒与否，大家尽可安心签署，不必回家抱着老婆吓得睡不着觉也！
012.牛肉面老板的七封信.txt	34	67	67	89	3	我看到你从澎湖讲美寄来的信，我就想起我在那边当兵的一段日子，很辛苦，也很令人怀念。在许多方面，军人生活更接近男子汉的生活，因为只有男子汉，才能过那种需要靠“坚忍”来挺下去的生活。
012.牛肉面老板的七封信.txt	35	69	69	119	3	你说你要在“五十岁解甲为民后”，把我的书“再以冷静头脑去细读无余”，我很高兴，也很感动。我盼望那时候如你所说的：“时不为迟吧！”但我更盼望那时候我的书已是落了伍的断烂朝报，我盼望时代跑在我前面，而我只是澎湖的那棵大榕树，“老而不死”而已。
012.牛肉面老板的七封信.txt	36	71	71	139	3	你要求我以每册十元的价钱“私准”，“念老读者之友谊，成我宏愿。”我完全同意。我这批书的定价，对一般读者说来，的确贵了。我有许多苦衷。最主要的是：我已经丧失了一个从事写作者应享的权利与方便，出书的困难与成本，要比别人高出许多。内情在此也无法细表，只好等待他年立碑，勒石于榕树下吧！
012.牛肉面老板的七封信.txt	41	81	81	132	4	你要我打消卖面念头，“继续煮字下去”，你可知道当今之世，“字”岂易“煮”哉？煮好了面，别人不吃，老夫自己吃，吃它个浑身牛皮味；可是煮好了字，能够达到“画饼充饥”的奇效吗？你只知道我五年来写文章，“让大家解解闷”；你可知道我五年来没有一个正式职业，而最后负债满身吗？
012.牛肉面老板的七封信.txt	49	97	97	208	4	你太抬举我了！我要告诉你，“电流”是“中断”不了的，一定该有更强的电流出来，该有更“声慑文坛”的朋友出来。以文字为业的人，都该有一种信念，那就是“江山代有才人出”的信念，成事不必在我，而我之播种，必不白费。胡适之先生有一次向我说：“无心插柳，尚且成荫；有意栽花，当然要发！”难道老年人不退休，我这个三十一岁的人先“退休”，就没有新的电流了吗？我不相信。如果没有...
012.牛肉面老板的七封信.txt	58	115	115	178	5	谢谢你邀我到南投喝酒，并谢谢你那些“酒林道友”们。南投我没去过，颇想一游。我在台湾住了一十有七年，去的地方极少，此乃王婆所谓“邓、“闲”两条件不足之故。三十八年（1949）我念初二时，班上郊游，我提议去日月潭，结果通过。不料我回家向老子伸手，老子却凑不出钱来，最后本提议人，只好眼巴巴的看着别人上了游览之车，回想起来，至今犹以为憾（日月潭到现在还没去过）。
012.牛肉面老板的七封信.txt	59	117	117	93	3	昔年陶朱公改行经商，泛游五湖。今日李敖公改行卖牛肉面，或可落得清闲，往名山大川一游。明末志士顾炎武有言：“有体国经野之心，然后可以登山临水。”我游名山大川之时，一定还带着这句漂亮的老话。
012.牛肉面老板的七封信.txt	66	131	131	115	3	你前番一次大醉，闹了僧堂，便是误犯；今次又大醉，打坏金刚，摊了亭子，卷堂闹了选佛场，你这罪孽非轻，又把众禅客打伤了。我这里出家，是个清静去处。你这等做作，甚是不好。看你赵檀越面皮，与你这封书，投一个去处安身，我这里决然安你不得了！
012.牛肉面老板的七封信.txt	69	137	137	91	3	所以，总归一句，“和尚”也不好做。也许你去暂时老实的做一个沿门托钵的化缘客，可是说不定哪一天，一顶大帽子又戴在你头上，说你是“妖僧”。那时候，甚至连看潘巧云屁股的机会，也要被剥夺了！
013.刻薄的批评与正直的建议.txt	4	7	7	204	4	你劝我“改刻薄的批评为正直的建议”，很谢谢你。我只是告诉你，在我眼中，我分不出这两者有什么分际。你这种劝告，是中了传统中“泛敦厚主义”的毒。所谓“泛敦厚主义”，是一些庸言庸德的人，把一切表达法都虚礼化、平庸化。虚礼与平庸的表达结果，使一切意见都丧失了活力和生机，甚至搅得在是非边缘打转转，使面对他的表达法的人，竟闹不清他在尖锐地反对什么，或是大力地赞成什么，而...
013.刻薄的批评与正直的建议.txt	7	13	13	253	3	还有，关于你对我和徐复观打官司的“批评”（“正直的建议”），我也要说你仍然是中了传统中“戒讼观念”的毒。你该知道一个进步的社会，必须有赖于法治、有赖于大家对法律的信任。中国过去太偏重人治和礼治，所以搅得乱七八糟，毫无客观可循的是非与体统，也毫不实际。你信中所谓的“文人竟不知自爱，不能宽大为怀，多具容忍的气度”三点，在一个有现代法治观念的人面前，都是“碰不到头...
014.眼看黑暗到来，又目送黑暗归去.txt	5	9	9	83	3	吴相湘老师推荐你们参观我的书，我现在来个“反推荐”，就是你们该参观参观他的书。我做了他十年的学生，还没进过他的书房！这原因有二，二者必居其一：我不好学；他太“小气”。
014.眼看黑暗到来，又目送黑暗归去.txt	9	17	17	248	4	至于对我，对Pride Lee说来，我的小天地我常常叫它是我的“豪华监狱”。真的，它真是我的“豪华监狱”。它有一切监狱所没有的实际设备，但置身其中，我却觉得我是一名“囚犯”。在自由中国中，似乎没有人在一天二十四小时内，比我更能独处。没有人像我这样每天看到人或动物的时间只不过四五个小时，其他的时间完全“顾影自雄”或“自己跟自己说话”。我常常说我是一个“眼看黑暗...
014.眼看黑暗到来，又目送黑暗归去.txt	10	19	19	93	3	如果我今天以三十一之年，还可冒充“青年人”的话，那我必须说：这是为了补偿我过去的“非青年生活”。一个人在中学时代，前后看过的电影不会超过两场，这种“道性”，大概非今日青年朋友所能堪的吧？
014.眼看黑暗到来，又目送黑暗归去.txt	11	21	21	134	4	也许你们笑我吹牛，当我告诉你们我不太在乎牢狱。牢狱最可怕的地方不在third-degree，而在一种难受的寂寞生涯。李敖今日所过的生活，跟古代人所谓的“画地为牢”又有多少不同？我好像是一个做“坐牢准备动作”、“坐牢预习”的倒霉鬼，并不够资格心安理得的做一个他妈的寓公！
015.办杂志的一些意愿.txt	2	3	3	172	4	每个像样的杂志创刊之初，主持人都难免摩拳擦掌，准备大搞特搞一番。他们常常摊开许多计划，摆出不少篇幅，用来“大展鸿图”、“一施抱负”。这种作风，对读者而言，当然是一件喜事，不过好景往往不长。主观的编法和客观的环境，常常使一片雷声大，沦为几丝雨点小；或是因为雷声太大而惹得天公震怒，不准再打雷。最后的结局则不外鸿图未展，抱负难开，心灰意冷一阵了事。
