file	paragraph	line_start	line_end	char_count	score	snippet
004.中国小姐新论.txt	13	25	25	306	3	错在提议者所根据的理由。亚里士多德说美是上帝的礼物，人类发明选美，不过摆出礼物而已，赏心悦目，快然自足，没有别的，也无须有别的。美本身就有“原始的完整性”（primitive integrity），选美本身就有它自己的意义，不必被也不该被“政治挂帅”。想用中国小姐搞“统战”、表示“进步”的学人，应该问问自己：这种动不动就“一切为政治”、“政治领导一切”的毛病...
004.中国小姐新论.txt	18	35	35	33	3	附录（wjm_tcy注：这是“天花乱坠”打字，我收录到这里做附录）
004.中国小姐新论.txt	20	39	39	172	3	在这一标题下，共收四篇文字：一、中国小姐论，二、从《秀嫚信箱》到《上下古今谈》，三、给刘秀嫚，四、中国小姐新论。四篇文字，最早是一九六一年写的，最晚是一九七九年写的，前后连续十八年，可见中国小姐和我“长相前后”的密切！十八年是何等长的岁月！十八年，可以造成一个王宝钏，也可以生出一个王宝钏。十八年过去了，美人迟暮，我也将老，想来不胜薛平贵之至！
004.中国小姐新论.txt	25	49	49	86	4	这个问题对我说来，不是新问题，我被读者来信问过许多次，有的劝我“认真的‘进攻’一下”，有的说“刘秀嫚太浅薄，不值得你去爱”，有的索性下结论：“你跟刘秀嫚，已经陷入恋爱了！”
004.中国小姐新论.txt	27	53	53	164	3	我生平见过不少可爱的女孩，也恋过不少次爱，并且直到现在为止，还“尘缘未了”“艳事频传”，大概你也听说过。对可爱的女孩子，我“追求”过，但是我不“追求”得太吃力。一般情形是，我会主动date或“布下蜘蛛网”，不过都是以一次为限。再漂亮动人的女人，我也没有耐心（或脸皮）去“进攻”第二次，——在爱情沙场上，我像是一个只会打冲锋的人。
004.中国小姐新论.txt	28	55	55	229	4	所以，该自责的说，我该“佩服”那些对女人“穷追不舍”的“雄性的动物”，他们是那样有耐心（或脸皮），那样不怕一约再约三约，那样像狗。从统计上说，他们是最后的“成功”者。这也难怪，因为在落后地区的中国，不开化的女孩子们总有一种错觉，认为“穷追”就是“真情”的表示。往往在最后，在马拉松的终点站上，可爱的女孩子选择了她的“男人”，那时候，她已经被谄媚得失去了本来已很...
004.中国小姐新论.txt	29	57	57	114	3	这种现象，也就是我常说的：十足的女人并没找到十足的男人，她只是错把“奴才”当成“英雄”而已。小孩子玩玩具汽车的时候，他并不知道那是假的汽车，他很会陶醉，甚至拒绝真的汽车，——他无法“适应”它，他宁愿要那个“由他摆布的”汽车模型！
004.中国小姐新论.txt	30	59	59	149	3	有多少次，我曾尝试对有这种观念的可爱女人加以“劝告”和“教育”，有时候我用嘴巴书信，有时候用文章。但是我知道中国女孩子的小家局面性格不是一天造成来的，所以我也不可能一下子除去。有多少次，我曾冷漠看着一个个我喜欢的女人朝坑里跳，我不再“晓以大义”，恰像那不闻不问的老僧，我是默诵“阿弥陀佛罪过”的人！
004.中国小姐新论.txt	32	63	63	184	3	去年五月二十四号，我写了一封信给你，可是写完以后，我又把它扣住，我有点觉得那封信是多余的。又一年以后的今天晚上，我决定还是写下这封信，——一封好像是最后的信，我只希望它不再多余。在我此后的生命中，我将永远不会忘记我们在两年前今天的三小时的聚会，我甚至还能记得你在录音室中捡铅笔那一个动作。“刘秀嫚真是可爱的女人！”也许五十年后，我变成八十岁的老头子的时候，还会...
005.罗斯福路该改名罗斯祸路.txt	4	7	7	133	3	如果你挨了揍，却在口舌上占了别人的便宜，也算不白挨，糟糕的是，你可能没占到便宜，反大吃其亏。当年王照讨论注音符号，在会议上跟吴敬恒冲突，大骂吴敬恒“王八蛋”，吴敬恒嬉皮笑脸，回敬一句：“小弟不姓王。”可见，用王八蛋骂人，虽然用的是名词，还是易滋流弊，至少姓王的不行。
005.罗斯福路该改名罗斯祸路.txt	5	9	9	114	5	最后，聪明人到底想出好方法来了。好方法是：要想确定被骂的人非李敖莫属，非得在“李敖”这个专有名词上打主意不可，要把骂的字眼嵌进这小子的名字里去，才能坚固、才能如君所愿。这种好方法，叫做“改名学”，就是“老子改你小子名字的学问”。
006.重要不重要与不重要重要.txt	2	3	3	373	12	宋太祖赵匡胤，不会打高尔夫，只会打高飞尔鸟之夫。那时候没有鸟枪，只有弹弓。有一天，他正弹得高兴，下面报告说，有大臣急事求见。宋太祖叫传进来报告，报告了半天，只是普通事情。宋太祖气了，他问：“为什么这样不重要的事，现在来报告？”那大臣说：“我认为这事并非不重要，至少比打鸟还重要！”宋太祖抓起家伙就朝大臣打去，打下两颗门牙，那大臣一言不发，弯下腰来，捡牙装进口袋...
006.重要不重要与不重要重要.txt	3	5	5	116	4	在宋太祖眼中，用弹弓打鸟叫重要；但在下班时间还办公的大臣说来，他手上的公事才叫重要。上面认为重要的，他认为不重要；上面认为不重要的，他认为重要。尤其重要的是：他敢明目张胆表示出“我的重要，你的不重要”。这种明目张胆，倒比什么都重要！
006.重要不重要与不重要重要.txt	5	9	9	239	3	美国哲学家兼心理学家威廉詹姆斯，在他《心理学原理》（The Principles of Psychology）名著中指出：“一件事情，任何人认为它重要，它就重要。”（A thing is important if anyone think it important）这种说法，足见“重要”已重要得成为哲学问题。但是，问题一由哲学家来答，就七嘴八舌。狄阿杰尼斯认...
006.重要不重要与不重要重要.txt	9	17	17	218	3	上面这些话，都是指当事人在正常处境下的看法。如果处境一旦剧变，他的主观，也可以量变加质变。一个人正常处境下认为黄金重要，但在荒年时候，他可以“千金易谷”，在战乱时候，他可以“黄金如粪土”。看了莎士比亚《理查三世》剧本的，看到第五幕第四场，国王高喊：“一匹马！一匹马！我以江山换一匹马！”（ A horse! a horse! my kingdom for a ...
006.重要不重要与不重要重要.txt	10	19	19	85	4	王尔德站在文学家立场，认为凡是实际发生的，就没有什么是最不重要的；并且认为：预知这种重要，有时并不简单。他说他年轻时候就常以为钱最重要，但是年华老去，才“知道”钱多重要。
006.重要不重要与不重要重要.txt	12	23	23	356	3	当科学家巴斯德从事微菌等研究的时候，又有谁认为那种研究重要呢？甚至巴斯德自己，又能清楚知道有多重要呢？但他最后功德圆满，使法国的酒业、丝业、畜业有了革命性的改善，带给法国的好处，是把对德国的战败赔款五十亿法郎，由他一个人给还清了。巴斯德这种大功德，穷本溯源，就在他要做“不重要”的傻事。又如发明电话的贝尔，他发明了电话，可是一直被人认为不重要，人人把电话当成玩...
006.重要不重要与不重要重要.txt	13	25	25	198	4	巴斯德的例子和贝尔的例子，进一步说明了：许多事，它的重要性，有时局内人或局外人，都不一定深知。既然不能深知，所以不但做它，还得检讨它，检讨它的利弊得失。这种检讨，最好的就是舆论。巴斯德在做羊体试验的时候，《佛特瑞内报》（Veterinary Press，《兽医报》）就负责检讨，由怀疑到支持，最后有利于整体；贝尔在做纽约与波士顿通话试验的时候，两地的报纸就负责...
006.重要不重要与不重要重要.txt	15	29	29	436	3	第三种意见事实上是反对意见的一种，不过诉诸的理由是另一层次。这种意见，似乎有待商量。第一、什么是重要的，什么是不重要的，极不简单，看了我前面的讨论，就不难明白；第二、社会问题其实每个都重要，而解决的方法，必须是“一个萝卜一个坑”式的个别解决，解决一个算一个，希望来个更重要的，一了百了式的一次全部解决，是跟社会进化原理不符的；第三、表面上看似小问题，其实问题背...
006.重要不重要与不重要重要.txt	16	31	31	116	3	中国古话说：“为政不在多言。”为政的职业是力行，力行“多言”者的意见，舆论的职业就是多言，多言就是人权、民主与求真，只有透过舆论的检讨，为政才能落实生根。为政不必高高在上指导舆论，而该与舆论认同，跟低低在下者顺流而下，这才是第一流。
007.张小兰冤在哪儿？.txt	4	7	7	83	3	承审推事刘浩昨日开庭时，并出示一个牛皮封套说：“这里面都是信，是民众写来的；其中有骂你（指张小兰）的，也有骂你（指郑其正）的。有些则是写给我的，希望我不准你们和解。”
007.张小兰冤在哪儿？.txt	7	13	13	80	3	有人认为：张小兰活该；有人认为：双方都不是好东西；甚至法官也认为：“希望‘你们’以后不要再发生这种事。”当事人方面，郑其正认为倒霉；张小兰认为和解了，还是有冤。
007.张小兰冤在哪儿？.txt	11	21	21	739	4	第一道“糊涂情绪”是乱用“道德判断”。“道德判断”（moral judgement）是伦理学上的一个主题，它包括两部分：第一部分是能判断的主体，第二部分是被判断的客体。就第一部分说，主体必须是人，不是阿猫阿狗。阿猫偷鱼，阿狗咬吕洞宾，就猫小姐狗少爷本身来说，它们并不以为有何不妥，它们绝不承认自己是贼猫恶狗，贼猫恶狗等不雅名字，是卖鱼的和吕洞宾加的，这种贼呀恶...
007.张小兰冤在哪儿？.txt	12	23	23	515	4	由于乱加道德判断，紧跟着就产生第二道“糊涂情绪”，就是乱用“动机观点”。“动机观点”在伦理学上属于“动机派”（motivism），这派走火入魔，判断一件事，不看事的本身，反倒追踪虚无缥缈的动机，用动机来决定一切。孟轲说：“乃若其情，则可以为善矣，乃所谓善也。”俞正燮直指孟轲说的“情”，就是“事之实也”，无异指动机就是事实，一切要看你存心如何：存心好，哪怕是为...
007.张小兰冤在哪儿？.txt	13	25	25	188	3	西方哲人这种警觉，中国人显然跟不上。中国的老底子是“诛意”或“诛心”，是春秋笔法的“君子诛意不诛事”，是追究心意，不追究事实。结果呢，中国“日存万善念、日诵千善言”的好人最多，但好事最少。原来好人只要正心诚意就已足、只要问心无愧就已足、只要诵经念佛就已足，好人无须在事实上做多少好事，好事只在念头上做，就大功告成！——这种把动机当成事实的“动机观点”，就是第二...
007.张小兰冤在哪儿？.txt	14	27	27	682	4	在张小兰的案子上，我们清楚看到乱用“道德判断”和“动机观点”的轨迹，这两道“糊涂情绪”，双杀了本案的法律性质。本案的法律性质，不过是刑法第221条第1项“普通强奸罪”的是否成立，是纯粹法律问题，不是伦理学上“道德判断”和“动机观点”问题。在法律上，普通强奸罪，并没有限定说只有良家妇女被强奸才算强奸，不是良家妇女被强奸就不算。所以，被强奸了，从圣女到妓女，谁都...
007.张小兰冤在哪儿？.txt	15	29	29	244	3	因为乱用“道德判断”和“动机观点”，伪善和冤屈也就大量出笼，这时候，有人道主义者出来，稍加修正，他们在民间发表微弱的谚语，叫做——“孝字论心不论事，论事万年无孝子；淫字论事不论心，论心千古无完人。”意思是说：孝要有孝心才算，否则养口腹而已，孝是假的；淫要有事实才算，若论不起绮念不动凡心，贞节烈女都在所难能，悬格这样高，谁也做不到。比起耶稣所说人动淫念的便犯奸...
008.“舒而脱脱兮！”.txt	3	5	5	44	3	《诗经》中“国风”里有首“野有死麕”，写一个“有女怀春，吉士诱之”的故事。里头有两句是：
008.“舒而脱脱兮！”.txt	9	17	17	82	3	脱衣舞的正式名称叫“拨来撕克”（burlesque），简称burlesk，它的原始意义是“讽刺性或滑稽性的诗文图画”，引申而为“滑稽表演”。跟这个字演变出来的字如：
008.“舒而脱脱兮！”.txt	14	27	27	249	3	等等都可算同一大类。比burlesque更通用的专名是“撕揣普替丝”（strip tease或striptease）。新版《韦氏大辞典》说这个字的意思是“女演员在观众面前一点一点脱衣服的一种burlesque”（a burlesque act in which a female performer removes her clothing piece by ...
008.“舒而脱脱兮！”.txt	23	45	45	367	3	拨来撕克滑稽表演，到公元17世纪，就在法国流行；18世纪，又在英国流行；19世纪，美国开始推陈出新。首先这种表演只放在节目中的穿插（interlude）地位，由穿紧身衣服的女人出场，进而演变到所谓“小埃及人”（Little Egypt）式的肚皮舞，深受各界欢迎。到了20世纪初年（1909），百老汇出现哥伦比亚戏院，是为第一所拨来撕克戏场（the first ...
008.“舒而脱脱兮！”.txt	26	51	51	67	3	波士顿市长的作风，其实并不稀奇，美国的知名之士，常常都是脱衣舞的同好。拨来撕克插科打诨的节目中，也以此为题，有“婉而谑兮”的讽刺，如：
008.“舒而脱脱兮！”.txt	31	61	61	141	3	美国的达官贵人虽然喜欢看脱衣舞，但是保守势力究竟也不容忽视，一些达官贵人们也支持过大规模的阻遏运动。1937年、1942年，都有过形式上的“扫荡”，可是结果总归是禁者自禁、脱者自脱。尤其是纽约第五十二街的夜总会，它们已形成一个堡垒，任你卫道之士大声疾呼，百老汇的脱风却依旧相沿不替。
008.“舒而脱脱兮！”.txt	33	65	65	245	3	无可否认的，这种相沿不替，日子久了，显然已定形成美国近代文明的一支——不管你承不承认。到美国去的人，若说不看看脱衣舞，就等于说到电影院不看电影一般，如何说得过去？中国人历来留美的，代有其人，看脱衣舞的，也不计其数，但看过而又有文记其盛的，则首推高克毅（乔治高）先生。高先生现做“美国之音”中文部副主任，三十年前，曾在《西风杂志》发表过一篇《大腿戏》，那是193...
008.“舒而脱脱兮！”.txt	34	67	67	243	3	……Striptease，无以译之，译之曰“剥引”。剥者“剥猪猡”之剥，引者“引人入胜”之引。……剥引二者不过是基本动作，只能算是“大腿”而不成其为“戏”。实际上你花了三毛五至一元的门票，所得绝不止此，起码也要看满一个历时二时的节目。这节目包含还有什么呢？虽说有突梯滑稽的丑角出来插科打诨；有红男绿女的歌者登台引吭高歌；有成班舞姬现身乱跳乱扭；有些大腿戏院，甚...
008.“舒而脱脱兮！”.txt	37	73	73	312	4	一阵掌声紫光一闪，出来一位浓妆艳抹的尤物。观众屏气敛息。全神贯注。我们的巴黎菲菲（道地美国土产犹太种，原籍纽约城布鲁克林区，白金发乃是peroxide化学作用）先没精打采地唱两段歌曲，唱的是什么？孙子知道！一曲甫罢，乐班声音加紧，菲菲开始绕场巡回，有时一步一趋，算是舞蹈，有时念念有词，算是唱歌。观众性急，坐在椅子边，头向前伸。三五位卷起衬衫袖子的音乐师，大吹...
008.“舒而脱脱兮！”.txt	39	77	77	158	3	音乐重起，菲菲不负众望，再度出场，于是舞蹈、念唱、剥引，一切从半裸做起，继续前进。可是到了紧要关头，又闪入幕后，告一段落。像小说的技巧：“欲知后事如何，且听下回分解。”像文章的描写：“山穷水尽疑无路，柳暗花明又一村。”观众的掌声又把羞答答（？）的菲菲叫出来，层层演出、片片剥下——剥到菲菲的芳名不叫菲菲而叫夏娃为止。
008.“舒而脱脱兮！”.txt	45	89	89	157	3	娜妲丽华（Natalie Wood）曾把李玫瑰的身世带上银幕，演得惟妙惟肖，脱衣动作，徐中有疾，此疾可起寡人之疾，令人颠倒。就便是李玫瑰本人，都不得不惊叹：“那正像回到了1934年，看到了我自己。”（It's just like going back to 1934 and seeing myself.）正是——
008.“舒而脱脱兮！”.txt	49	97	97	502	3	因为脱衣舞本身是跟警察老爷不断捉迷藏的玩艺，所以它的发展，也就因警察老爷的胃口而不同。例如就一般的明盘而论，美国迈阿密地方，脱衣可脱到三点为止；而在缅因州，标准却是只到浴衣状态；在纽约，也有因夜总会老板背景大小而与脱光多少成正比的。其他成文、不成文的规定或约束，也常常因人而异、因地而异、因警察老爷的胃口松紧而异或眼开眼闭的程度而异。例如美国许多地方，规定脱衣...
008.“舒而脱脱兮！”.txt	50	99	99	354	3	美国以外，世界各地当然也不乏有脱衣舞的习尚。最精彩的当然是法国。法国以世界第一流夜总会称雄，如巴黎的“丽都”（Lido），大小虽然跟台湾的中央酒店差不了好多，可是节目的精彩、格调的清新，则是上天下地之别。法国的脱衣舞界，许多仍是吉普赛女孩儿的天下，吉普赛脱衣舞，伴同情节，引人想入非非。例如一个十九岁的吉普赛女郎，表演象征女性苦闷的舞剧，描写一个丑陋的法国女孩...
008.“舒而脱脱兮！”.txt	55	109	109	209	3	脱衣舞这门行业，由于“衣服人人会脱，巧妙各有不同”，从事此道者，积八十余年之经验，也的确琢磨出不少秘诀。大体上说，脱衣舞虽包括不外“脱”（strip）和“舞”（dance）两部分，但是其中内节，却大有文章。如：“逗”（tease）的动作、“冲顶”（bump）的动作、“颤磨”（grind）的动作，以及其他种种举手投足眉来眼去的动作，都不是外行人一脱一舞所能蹴几...
008.“舒而脱脱兮！”.txt	60	119	119	282	3	正因为脱衣舞这一行愈来愈专精化、学术化，所以以其难能，人们渐觉其可贵，从事此道的女郎，大家也不敢再轻视她。美国的大学女生，客串或专业做脱衣舞女的，大有其人，甚至脱衣舞竞选总统者有之，整天闹抗议者亦有之。1964年莱丝丽卡侬（Leslie Caron）主演的一部电影《随伊所欲》（Promise Her Anything），片中因雇用普通女孩客串脱衣舞女，就曾遭...
009.过早的答案.txt	3	5	5	80	3	偶尔碰到一两个人，他们居然惊异我还在外面“散淡”，还没送往外岛去“管训”，不免为我称庆。其中之一在称庆之余，指着我预言道：“你这小子，再不老实，早晚给抓起来！”
009.过早的答案.txt	4	7	7	352	3	有一个人问我：“你怎么还没被抓起来？”我回答说：“我凭什么被抓起来？谁抓我，谁是傻瓜。我是一只烫番薯，吃我很容易，可是要被烫一下，未免划不来。任何陷害我的人或集团，若想陷害成功，他们必须付代价，并且要背‘害贤’之名，这却何苦来？在他们眼中，我李敖一人不足惜，一穷小子耳、一臭皮囊耳，可是因陷害我而使他们背上恶名（或加重恶名），他们是不干的。要干，就是傻瓜。现在...
009.过早的答案.txt	5	9	9	232	3	我举一个“玩的漂亮”的例子。在《文星》第八十一期中，我把苏雪林（化名碧屏）的《评<胡适评传>》登出来，让她把我骂得狗血喷头，并且不予即时反驳，以示雅量。苏雪林化名而来，是一把暗刀，这把暗刀，玩的漂亮之至。可是还有更漂亮的，在去年9月6号，在国民党党报《中央日报》上，来了一段名叫《谤书》的短评，利用苏雪林的暗刀，来“杀”李敖，说我的《胡适评传》是“谤书”，说：...
009.过早的答案.txt	12	23	23	177	5	《中央日报》短评的执笔者必然没有想到，他们想借台大之刀以“杀”李敖的手法是完全失败了的。他们以为这下子把李敖送给了黄祖，其实他们都判断错了。台大的钱思亮、沈刚伯诸公都是跟刘表打一壶酒喝的卓越人物，而绝非傻不登登的黄祖者流，他们虽然问过法律顾问，可是终于悬崖勒马，放弃控告李敖的打算。钱思亮一定蓦地惊觉，拍案而起，恍然大悟道：“好险啊！差点儿为楚人所误！”
009.过早的答案.txt	13	25	25	183	3	《中央日报》的短评，在某些头脑开明、心地宽宏的国民党党员看来，纵然不很失体，也是很不妥的。因为在一个“崇尚礼义”的国度里，在一个主张相忍为国、同舟共济的现状下，以国民党党报的地位，不主张息事宁人而公然主张打官司，公然主张所谓“李敖的老师”去告“李敖”，这究竟不算是什么可圈可点的事吧？究竟不算是什么“自由中国”光彩体面的事吧？究竟不算是什么团结一致、协力对外的...
009.过早的答案.txt	14	27	27	108	3	虽然，《中央日报》短评中的高见也许只是一二代表立言者的高见，但我忍不住要怀疑：执笔写这种短评的人是否在正当运用它们所被赋予的代表立言的权利？究竟谁在“姑息”他或他们在运用如刀之笔来发表这种纵不失体也属不妥的“高见”？
009.过早的答案.txt	15	29	29	341	3	但我该承认在《中央日报》的带头的人中，他们有一种进步的趋向，即以该报的社长（曹圣芬）而论，这位社长七年前做《中华日报》社长的时候，曾主张不必诉诸法律，而干脆用民众捣毁的方式，去砸掉“某杂志”（《自由中国》杂志）。如今他的职位进步了，他的头脑自然也进步了，他带领下的《中央日报》，很理性的主张台大对“某杂志”（《文星》杂志）的“某毕业生”（李敖）“应该依法起诉”...
009.过早的答案.txt	16	31	31	275	4	《中央日报》两篇短评的失策还不止此。它们更大的损失是，两篇短评带给了人们一种“缺乏宽忍异己的雅量“的印象，这是很不漂亮的做法，也是我前面指出的：陷害李敖不足惜，可是因陷害李敖而背恶名、付代价，未免太划不来、太笨。即以这两篇短评而论，短评登出后，我接到读者的来信，“很为您报不平”；同时在《大华晚报》的专栏上，很快的就有了报不平的反应。《大华晚报》10月3至6号...
009.过早的答案.txt	17	33	33	128	4	在曹操眼中，祢衡是“素有虚名，远近所闻”的人物。曹操所以不肯杀他，理由即在此。因此他说：“今日杀之，天下必谓我不能容物。”《中央日报》短评对我的中伤，势必予人“不能容物”的感觉，使人有“台湾竟连一青年人李敖皆不能容”的感觉。这是何等划不来！何等于自己不利！
009.过早的答案.txt	20	39	39	225	3	无论如何，我要告诉“赵孟”，把我送上十字架，并非“赵孟”之福。十字架上的人物，不论是被钉的、被烧的、还是被关进牢里的，都经常以借烈士之尸、还勇者之魂的姿态出现，这是很抱歉的事。有小聪明的“赵孟”，他的小聪明当然会告诉他：一个人肉体的不自由或消灭掉，并不等于他精神的不自由或消灭掉，如果一个人的影响会因他肉体的不自由或被消灭而丧失掉，这个世界也早就太平了！而加害...
009.过早的答案.txt	21	41	41	380	4	有时候，我忍不住要天真的想：究竟是什么缘故要造成有智慧的人不能为国家做点事？为什么许多有才智、有个性、有人品的人要被摒弃在野、不能生活，并且受到“忠贞”上面的怀疑？即以被称为“不肖的学生”本李敖而论，论才智、论个性、论人品，凡稍知我者，似乎可证明我绝非小人们所中伤的那样“坏”。就我个人来说，我自知我乃一“卧龙岗散淡的人”，生性疏懒，放浪形骸，自谓不合于党、政...
