file	paragraph	line_start	line_end	char_count	score	snippet
016.张镜湖启事的启示.txt	4	7	7	206	5	张镜湖最后说：“近年来诽谤案件，如许历农、李敖、冯沪祥、关中诸案，被告俱判刑。本案诽谤项目之多、伤害之大远超过其他诸案。被告罪证确切，……而推事竟颠倒是非。”事实上，我虽因锲而不舍，逼得法官不得不酌量轻刑，但在控告新闻媒体案件上，我从来没打败过报阀。——台湾的法官是最怕报阀的，每遇报阀被控，法官就写出千古妙文来曲法纵庇。张镜湖这一亲历，使我们又一次领教了法官...
017.林洋港的失态.txt	2	3	3	114	3	今早看报，看到林洋港1月5日一天的行径，更印证了我三个月前所说“国民党无大臣之风”的结论。不同的是，林洋港身为司法首长，失“大臣之体”、无“大臣之风”，情况就更为严重。他所伤害的，已不止“大臣”的颜面，而根本动摇到司法的尊严了。
017.林洋港的失态.txt	3	5	5	660	3	林洋港在1月5日上午，得知国民党已就五大法案，划出底线，将在立法院以表决方式通过后，感到事态严重，就在下午亲去中央党部见秘书长，透露给李焕说：两大法案还在大法官会议解释中，尚无结论。不过由一些大法官的私下谈话里，他们倾向于主张立法院无权审议。为了避免国民党做出错误的决定，以表决方式通过违宪案，他只好赶来中央党部，请中央党部不要预估或期望大法官会议的解释。林洋...
017.林洋港的失态.txt	4	7	7	421	3	林洋港在1月5日干下这一票失态之举后，意犹未尽，居然又跑到立法院，拜访了代理院长刘阔才。今天《中央日报》登：林洋港“曾向刘代院长表示，代为规劝朱高正立委出庭应讯。林洋港说，台北士林分院已五次传讯朱高正，借以了解案发当时情形，但朱高正均未出庭。朱高正昨天下午知道这个消息后，立即拨电话给林洋港院长，并于下午4时30分许，接获林洋港回复的电话。朱高正说，林洋港在电...
017.林洋港的失态.txt	5	9	9	89	4	结论是：大法官如何解释，法有明文；朱高正应否出庭，律有专条，都不是司法院长所能介入的，但林洋港不但公然介入，还不知失态，一天连干两票，这样子的国民党“大臣”，真太教我们看不起了！
018.林贤顺案的笔迹对比.txt	5	9	9	896	11	当年萧孟能诬告李敖时候，说李敖侵占了他的一具“7085128”号的电话。事实上，电话乃李敖所有，借给萧孟能在水晶大厦十二楼用而已，根本不是萧孟能的。但萧孟能却胡搅蛮缠，在诉状中硬说这具电话的申请书，是他“亲笔填写”的，只要法院向电信局查卷，便可证明云云。不料，法院从其所请，调来了原始申请书，却证明并非萧孟能亲笔填写，乃李敖弟弟李放所填写，全部申请书上，赫然竟...
019.方、马两案的两难式.txt	4	7	7	647	5	本月二十到二十一日，王老师在《工商时报》发表了一篇《从方励之赴宴风波谈到马赫俊遣送出境》，全文义正辞严，是一篇第一流思想家的好文章，我非常喜欢。文章的重点是：方励之受邀参加布什总统宴会被拒与马赫俊被强制遣送出境，两件事都有“洋人”介入，而且是主角。两件事都充分表现了洋人的优越感与中国人的自卑感，都使中华民族蒙羞。布什邀请主客所不愿见到的反政府人士来做陪客，即...
019.方、马两案的两难式.txt	5	9	9	470	3	对王老师的国格至上论，我敢说，我个人是身体力行的。我的大架子，对洋人的大架子，我在《我中华尚有人耶？》一文中早有举证，此不多赘。我虽然力持国格，但我未尝不有一个两难式。就是：统治中国的政府，它们统治力量的来源，很少不是靠洋人起家的，国民党从联日、联英、联德、联俄、联美，可说无一不联，联到后来，从外国坦克飞机，到外国镇暴车瓦斯枪，都无一不洋。共产党对外媚骨虽不...
019.方、马两案的两难式.txt	10	19	19	315	4	先说方励之事件。美国总统布什先生到中国大陆访问，设国宴答谢地主国，被邀请者都是政府领袖级人物，这该是何等庄严、何等慎重的事，但是忽然穿插一些什么人权主义，邀请一些中共领袖所不愿见到的反政府人士陪席。要谈人权，何处何时不可谈；要邀宴反政府人士，何处何时不可以邀请。为什么要在这么一个场合，邀请主客所不愿见到的反政府人士来做陪客，即使你我请客也不会如此做，何况是国...
019.方、马两案的两难式.txt	18	35	35	588	4	马赫俊被遣送后，与其有关联的劳工组织及天主教会固然反应激烈，连新闻界也跟着起哄，不是说国内反应如何严重，便是说中梵外交及国际形象如何受到打击，再不就说遣送方式如何不对，警方如何缺乏技术，态度如何恶劣，甚至不合法。总之，所有过错都在中国人及中国政府身上。反应愈强，我就愈难过，为什么不去深入的检讨一下，为什么要有这么深的民族自卑感，一碰到洋人，法律也不要了，国格...
020.高新武还有待正心诚意.txt	2	3	3	483	5	3月14日，我的老师王作荣先生写了一篇《高新武检察官的作风不值得鼓励》，登在《工商时报》。文章的重点是：一、地检处检察官既然要受行政节制，则越区拘提最高司法机关一级主管理应层报，不此之途，这是蔑视层峰的权威与尊严。高新武硬要打破司法伦理，这是凌上。二、案件进入审判程序，检察官没有任何身份与权力在法庭之外单方面宣布吴天惠如何有罪，如何罪证确实。竟然如此做，这是...
020.高新武还有待正心诚意.txt	3	5	5	276	4	文章发表后，3月25日，我的朋友尤英夫律师写了一篇《评〈高新武检察官的作风不值得鼓励〉》一文，登在《自由时报》。尤律师就王老师的六点指摘有所议论，但是论点绕在王作荣没同时指摘别人却“独对高君‘厚爱’”上，王作荣是国民党的大宗师，他此类毛病，我也批评过，但在就事论事上，这不是重点，如果高新武的确有错，他和别人都该受指摘，并不因为没同时指摘别人就可以不指摘他。不...
020.高新武还有待正心诚意.txt	4	7	7	489	3	依我看来，高新武和多数人一样，对司法采取正义与是非的看法，所诉求的不在单纯的案件，而在司法官道德形象的提升，这种用心，是很值得鼓励的。不过，人间正义与是非的追求，有它先决的条件，那就是目的与手段的一致性。你不能以歪七扭八为手段，去追求正义的目的；不能以混淆是非为手段，去追求是非的目的。不幸的，高新武在吴天惠案上，表现的却正是目的与手段的自讽。王老师所举的论点...
021.“只想静静的离开”？.txt	2	3	3	785	4	我的老师王作荣先生，今早在《中国时报》发表一篇长文——《评四推事辞职事件兼谈整顿司法的途径》，其中提到四推事辞职事件，从司法观点上看，审判独立，且有救济程序，“这个法官判案，那个法官辞职抗议”，显得“十分滑稽而不成体统，同时是对同僚法官及法庭的极端不信任与不尊敬”。另一方面，“这几位以辞职抗议并连续对新闻界发表谈话，造成舆论压力，已经严重侵犯了吴天惠的权益，...
021.“只想静静的离开”？.txt	3	5	5	539	3	王老师上面这些分析，大体都站得住，不过他在司法观点和社会观点外，还遗漏了一个重要观点，就是心理观点。所谓心理观点，就是“出风头心理”，这一心理，其实是这些司法人员最近动态的一大原动力。试看他们口口声声司法不公，但这一不公，他们又何尝不是共犯？何尝不是“扶同为恶”的帮凶？司法界中的官僚体制也、司法首长制也、上下僚属关系也、人事考绩也、升迁调派也、行政权力干扰也...
022.王作荣真的不懂法律？.txt	5	9	9	87	4	新竹检推小弟妹们口口声声“以牺牲自己去撞破司法积弊沉疴”，但我反复看来，却发现他们有否牺牲自己姑且不论，先牺牲了法律，却是真的，这种最高原则的被“撞破”，他们全体，都是罪人！
022.王作荣真的不懂法律？.txt	6	11	11	189	5	宋朝时候有一个坏蛋，大家皆曰可杀，可是没有杀他的法律根据。但是大家还是要杀。当时范仲淹看不过去了，他说：“你们‘法外杀人’，会杀得‘手滑’！”什么是“手滑”？“手滑”是杀得开心，杀得痛快，迟早杀出毛病，乱杀一气，最后连无辜的好人或不该杀的人也跟着宰了，闹得人人自危，法统全无，社会不像个社会。所以，范仲淹坚决反对用破坏法律的方法来杀坏人，宁肯让坏人跑掉，也不肯...
022.王作荣真的不懂法律？.txt	7	13	13	164	3	北洋政府时候国会的正副议长，诬赖财政总长罗文干与老外签约时不干净，两人乃半夜亲访总统黎元洪，请下手谕抓罗文干。黎元洪照办了。那时梁启超正在南京讲学，有人问他：“政府抓罗文干，用的是非法手续，可是时机太迫切了，若等合法手续，手续办好，犯人早逃掉了。那怎么办？”梁启超说：“宁肯让犯人逃掉。不然的话，犯人抓到了，可是法律却逃掉了！”
023.有名归己、有罪归人.txt	4	7	7	128	3	我在“少年十五二十时”的时候，看到我家大妹妹和小妹妹吵架。大妹妹是天主教徒，小妹妹不是。一次吵架过后，大妹妹跪下来祈祷，请圣母赦免她的罪，小妹妹在旁边看到，气起来了，说：“这怎么行？你吵完架，一祈祷，就没罪了！而我没有圣母，这下子罪都跑到我一个人身上了！”
023.有名归己、有罪归人.txt	5	9	9	669	7	我家大妹妹小妹妹这个故事，其实推而广之，人间大事玄理，也作如是观。以陶百川为例。九一八事变，东北人张学良要抗日的时候，南方人蒋介石下密令不准他抵抗。当时全国大哗，学生民众尤不满意，纷纷示威、请愿，要求政府抗日。不料北方学生南下请愿团的北京大学代表，到上海后，国民党竟用绑票手段对付他们，主持绑票作业的，不是别人，就是后来做了杀人不眨眼的军法处长的今天“国之大佬...
024.有种就去革命.txt	2	3	3	213	4	4月3日的《新新闻周刊》上，登有一篇社论——《不要爱司法而害了司法》，主题在“评析王作荣先生的司法改革建议”，最后说：“我们反对动辄向总统上书或上条陈。中国读书人喜欢上条陈，期待圣君贤相出现，而圣君贤相乃是偶然，靠自己进行改革才是必然。基于此，我们对王教授向李总统及有关官员建议之事更不以为然，我们为何不寄信赖于司法人员自己，而要上书并静默的等待呢？”“我们敢...
024.有种就去革命.txt	3	5	5	565	3	这一社论，前面所说别上条陈的部分，是正确的，王作荣老师文章的副标题“敬向李总统及有关官员建议”，的确不当。事实上，《新新闻》这种反对上条陈的思路，还是由李敖开先河的。我早在五年前（1984年5月30日），就发表《别为盗贼上条陈》，强烈反对这种思路。我指出：“如果这种当局根本是不可与言的，那么同它说话，就统统是废话。国民党是一个不可与言的集团，我们对它的警告也...
024.有种就去革命.txt	4	7	7	361	3	不过，《新新闻》社论提到王老师“爱司法却做出害司法之事”，却是对王老师的蓄意诬蔑。事实上，王老师的立场非常明确，他要求执法者“按正常司法程序进行”，又害了司法什么？王老师说得好：“审理吴苏案应按正常司法程序进行，执法者不得任意渲染、扩张、干扰，这是法治社会及司法独立的基本要求。至于匡正司法风纪，则执法者可以在案结后循正常管道进言，也可在案结后‘愤’而辞职，采...
024.有种就去革命.txt	12	23	23	317	3	但是现在却走到歧路上了，变成了一个近于野蛮的非理性的社会。对于维持一个和谐、稳定的社会和可以运作的政治环境所必需的道德、伦理、正义、法律、体制、纪律，都尽情的破坏，肆意的蹂躏，使这个社会充满了抢夺、砍杀、诈骗、说谎、歪曲、耍赖，人与人之间互不尊重，互相猜忌，互相仇恨，政治运作逐渐失控，经济发展逐渐受到阻碍。与吕坤形容明朝将亡时的社会状况完全符合：“今也在朝，...
024.有种就去革命.txt	13	25	25	318	3	（一）吴苏案。执法者对于任何讼案都只能“就案断案，依法执法”。一加渲染扩张，就失公平。吴苏案自开始至现在，始终在匡正司法风纪的大帽子之下予以渲染扩张，其实这完全是两回事。审理吴苏案应按正常司法程序进行，执法者不宜任意渲染、扩张、干扰，这是法治社会及司法独立的基本要求。至于匡正司法风纪，则执法者可以在案结后循正常管道进言，也可在案结后“愤”而辞职，采取法所能容...
024.有种就去革命.txt	14	27	27	196	3	（二）马赫俊案。约自1840年鸦片战争至政府建都南京为止，少数外籍传教士的传教方式是一方面以小惠在传教地招募一批“吃教的”做爪牙，另一方面则以其帝国主义的祖国为后盾，在地方作威作福，狂妄自大，蔑视地方官员，侵压善良人民，干预中国内政。等到官民不堪凌辱，杀教士、焚教堂，遂酿成教案。其结果千篇一律，由中国政府轻则惩罚自己官民，赔钱道歉；重则兵戎相见，丧权辱国。我...
025.司法现形记.txt	2	3	3	87	4	袁世凯时代的司法总长许世英，在老死台湾前有一段感慨，他说：“袁世凯是大总统，我们做官的，都难免要伺候他。但是我们只是拿我们个人来伺候大总统，我们绝不拿国家法律来伺候大总统。”
025.司法现形记.txt	5	9	9	201	3	司法秀本来是从检察官高新武大作拘提秀开始的，高新武丢下手上几百件待办案件、几十名被押人犯不管，却伪称一视同仁、伪称以“平常心”去先办吴天惠案，并且公然违反侦查不公开的规定，大事张扬，其为作秀心态，已昭然若揭。接着是推事谢启大等四人大作辞职秀，口口声声为林洋港“清君侧”，最后，在林洋港一阵马杀鸡之下，个个又乖乖做小鸡鸡，不辞职了，还群相赞誉林院长是司法改革的最...
025.司法现形记.txt	7	13	13	122	3	果然在4月28日，新竹地院主任检察官林朝荣，为了“引起新闻界的注意”，竟言行不检的对待女检察官陈金宝，对内也秀起来了。在引起注意之下，他揭发高新武曾以吴天惠案向首席检察官刘学魁邀功，说这案子可以打击林院长而见喜于李总统，可以帮助刘首席升官云云。
025.司法现形记.txt	9	17	17	381	4	岂止拿法律来伺候大总统，我看在大总统以下，被伺候的各级官吏，总而言之、统而言之，也不在少。例如谢启大等四推事表演辞职秀，但查查八年来他们四个人的考绩：林敏泽去年办民事案，上诉维持率是百分之百；孙天麒办民事案，上诉维持率是93% ；谢启大办民事执行案，上诉维持率是百分之百；袁从桢办刑事案，上诉维持率是81.69%。他们均为“优秀”司法官，为司法院所公开承认，试...
026.李光耀又告诽谤赞.txt	2	3	3	355	3	9月25日合众国际社新加坡电：新加坡总理李光耀控告《远东经济评论》（Far Eastern Economic Review）杂志诽谤案今天开庭，其律师告诉庭上，李光耀是该刊一篇报导的受害人，这篇报导“极尽侮蔑之能事”，把李写成一个容不下天主教会的人。该文还形容李光耀在着手迫害天主教教士，妨害信仰自由。由于庭讯将进行十五天，预料李光耀本周会出庭作证，距他上次作...
027.用重典的相对条件.txt	3	5	5	215	3	《周礼》卷九《秋官司寇》中，有这样一段：“大司寇之职，掌建邦之三典，以佐王刑邦国、诘四方。一曰：刑新国，用轻典；二曰：刑平国，用中典；三曰：刑乱国，用重典。”翻成今天的意思是说：司法大臣或法务大臣，掌理建立国家的三大法制，辅助皇帝对各邦国的司法统治并督察四方。第一是对新建的邦国用轻刑；第二是对承平的邦国用适度的刑；第三是对混乱的邦国用重刑。要大刑伺候，才能拨...
027.用重典的相对条件.txt	4	7	7	387	3	不幸的是，中国两千年来，从“乱国”到“乱世”，一波又一波，所以重典也就一波接一波。但是，用重典也有它的相对条件。中国历史上论重典之尤者，莫过明太祖，但是用的下场，却是《明史·刑法志》所说的：“始，太祖惩元纵弛之后，刑用重典，然特取决一时，非以为则。后屡诏厘正，至三十年始申划一之制，所以斟酌损益之者，至纤至悉，令子孙守之。群臣有稍议更改，即坐以变乱祖制之罪。而...
027.用重典的相对条件.txt	5	9	9	153	3	到了明朝皇太孙接班，就看出问题来了。《明史·刑法志》说：“建文帝即位，谕刑官曰：‘大明律，皇祖所亲定，命朕细阅，较前代往往加重。盖刑乱国之典，非百世通行之道也！朕前所改定，皇祖已命施行。然罪可矜疑者，尚不止此。夫律设大法，礼顺人情，齐民以刑，不若以礼。其谕天下有司，务崇礼教，赦疑狱，称朕嘉与万方之意。’”
027.用重典的相对条件.txt	7	13	13	236	3	蒋经国在上海“打虎”的时候，也用重典，抓“奸商”枪毙，想要解决经济的恶化。可是，正如当时美国驻华大使司徒雷登（John Leighton Stuart）所说的，蒋经国是在“以警察国家的方法来压制经济定律”（an attempt to repress economic laws by police state methods）。经济定律岂是用重典所能压制得了的...
028.所谓《台湾地区戒严时期出版物管制办法》.txt	5	9	9	163	3	该命令第一条就说：“为管制出版物特依戒严法第11条第1款之规定订定本办法。”可见它以《戒严法》的“子法”自居，《戒严法》是它的“母法”。不过，《戒严法》第11条第1款明定“戒严地域内，最高司令官”有“停止集会、结社及游行请愿。并取缔言论、讲学、新闻杂志、图画、告白、标语暨其他出版物之认为与军事有妨害者”之权，现在，问题来了：
029.黑牛案案里案外.txt	2	3	3	509	4	《水浒传》第四十二回“假李逵翦径劫单身，黑旋风沂岭杀四虎”中，记外号“黑旋风”的李逵归乡探母，路过丛林，遇到强盗：“李逵看那人时，戴一顶红绢抓髯角头巾，穿一领粗布衲袄，手里拿着两把板斧，把黑墨搽在脸上。李逵见了，大喝一声：‘你这厮是什么鸟人，敢在这里翦径！’那汉道：‘若问我名字，吓碎你的心胆！老爷叫做黑旋风！你留下买路钱并包裹，便饶了你性命，容你过去。’李逵...
029.黑牛案案里案外.txt	3	5	5	255	3	9月8日，“十大枪击要犯”外号“黑牛”的黄鸿寓落网。记者跟他的问答如下：问：“彰化县籍立法委员陈湧源被枪伤案是不是你做的？”答：“是我朋友做的，当时我没有去。”问：“你总共做多少件恐吓勒索案，向被害人拿了多少钱？”答：“已经记不清楚了。但数目并不多。”问：“大概多少钱？有没有三千万？”答：“没有那么多。”问：“那应该有两千多万？”答：“差不多两千多万。其实有...
029.黑牛案案里案外.txt	4	7	7	122	4	这段问答使我们了解到：黑牛自己，并没有做那么多的案，“是别人冒用我的名字干的”。这是很有趣味的一个现象。人在江湖，有了名气，就会发生银行上“同业堆花”式的现象，结果黄狗偷食，黑狗当灾；李鬼作案，李逵背黑锅，不该算在他头上的，也天下之罪皆归之了。
029.黑牛案案里案外.txt	7	13	13	529	4	黑牛案发生的两三天前，发生了丐童案。有基隆叶姓少年，被郭正雄绑到台北去行乞。查获后，叶姓少年大摆乌龙，说他手上的伤，是郭正雄割的。9月6日报上登，叶姓少年“回校后，学校人员立即向他查询被带到街头行乞的经过。叶姓少年告诉学校老师说，他手掌的伤，是在上月26日晚上替父亲去买酒，不小心摔倒被玻璃割伤，并由父亲带到基隆长庚医院包扎治疗。叶姓少年告诉老师，前天上午他从...
029.黑牛案案里案外.txt	9	17	17	396	5	其实，对警察办案习惯略有所知的人，就知道见怪不怪。警察手里，没破获的案子总有一大把，抓到一个嫌犯，做警察的，就习惯性的把手中悬案一个个往嫌犯头上套，以刑求逼嫌犯一并承认。当然有时不靠刑求，而靠谈判的。例如游荣佳案，就发生这种妙事。1983年9月24日，苏秋镇曾在立法院质询说：“游荣佳‘自首’抢劫世华银行，制作笔录时，被讯问人与讯问人取得一致‘共识’，既然自首...
030.《求是报》社致新闻局长邵玉铭函.txt	3	5	5	258	4	在贵局迭次“扫黄”行动中，揭橥的标准是“三点不露”，就是刊出的图片上，不得露出女人的两个奶头和阴部，凡露奶头和阴部者，皆在取缔之列，法办之例，虽然如此，藐视贵局规定而大露特露者，贵党主持之报纸固优为之。即以1984年2月21日到22日短短两日间为例，2月21日，《中国时报》刊出裸女图，同一天《新生报》刊出裸女图，同一天《大华晚报》刊出裸女图，奶头和阴部无一不...
031.国民党如何跑了犯人也跑了法律.txt	3	5	5	205	3	当年军阀时代有“罗文干案”，国会的正副议长吴景濂、张伯烈，诬赖财政总长签订“奥国借款展期合同”时不干净，两人乃私用国会大印，办了公函，半夜亲访总统黎元洪，要黎元洪下“手谕”，抓罗文干。黎元洪照办了。那时梁启超正在南京东南大学讲学，有人问他：“政府抓罗文干，用的是非法手续，可是时机太迫切了，若等合法手续，手续办好，犯人早逃掉了。那怎么办？”梁启超说：“宁肯让犯...
031.国民党如何跑了犯人也跑了法律.txt	4	7	7	603	5	犯人逃掉了，为国民党的，一定通缉，但是妙就妙在有些通缉犯真回来投案的时候，国民党却拒而不纳。例如国民党通缉许信良，许信良你通缉、我报到，买了飞机票，就要来台湾。可是国民党却千方百计不让他入境，包括给航空公司压力，拒绝搭载他。许信良北起日本，南到菲律宾，在台湾头顶上绕着飞，一意要空降；国民党却全力来防他，上穷碧落下黄泉，一律堵得凶。国民党堵许信良不稀奇，稀奇的...
031.国民党如何跑了犯人也跑了法律.txt	6	11	11	179	3	国民党在许信良案中的表现，或可归咎于“外患”，情非得已。但是，“内乱”方面也等而下之，就怎么说也无法谅解了。这次华隆案，就是显例。华隆案中，不管是张建邦一方，或是翁大铭一方，太明显太明显双方都不是好东西，但国民党为了内斗，居然只起诉翁家一方而开脱张家一方，结果不但宁肯让犯人逃掉，并且宁肯也让法律逃掉了。——一个政府竟为党派内斗，沦落至此，国民党真气数尽矣！
032.只起诉了一半，“恰似你的温柔！”.txt	2	3	3	256	3	有人问我为什么在大家炒作一件新闻时，《求是报》往往按兵不动。我的答复是，有些可疑的新闻，是不能随便跟着炒的，因为我根本不相信。例如华隆案的检察官许阿桂，在新闻炒作下，把她捧得公正无私、不涉政争，但常识告诉我，在国民党的司法与法务体制下、在地检处首席刘景义这种国民党中央委员带头下，根本不可能出现公正无私、不涉政争的检察官，更别提一脸窝囊、五音不全的许阿桂了。果...
032.只起诉了一半，“恰似你的温柔！”.txt	16	31	31	95	3	但许阿桂有一种本事，就是她以“纯洁”的形象，使大家误以为她是公正无私、不涉政争的，她自己当然也未尝不这样以为。但是，结果却是她只能把坏蛋们起诉了一半。——一半的公正无私啊，“恰似你的温柔！”
