file	paragraph	lines	score	markers	text
015.1999年12月21日.txt	21	41-41	7	问|死	收集在上面的邓小平谈话，是我细读《邓小平文选》等相关文献后的总整理，我有意少加剪裁，宁失之冗赘，也要人们能从字里行间，掌握住邓小平一连几年中的真意所在。昨天澳门回归中国了，江泽民发表谈话说：“邓小平提出的‘一国两制’，是解决香港、澳门和台湾问题，实现中国完全统一的唯一正确方针。”他表示：“遵循一个中国原则，实现中国的完全统一，是包括台湾同胞在内全中国人民的愿望，是历史发展的必然，任何人、任何势力都无法阻挡，希望台湾当局不要违逆历史潮流，不要再为两岸关系发展设置障碍，不要再做损害台湾同胞和整个中华民族根本利益的事。”足见他们以邓小平“一国两制”的发明为无限上纲，至今一以贯之，所以，忧虑邓小平死后“一国两制”路线松动或改变的人，显然是多虑了。（1999/12/21）
023.1999年12月31日.txt	7	13-13	7	最后|杀	李敖二十六岁起，用“文星杂志”和“文星书店”，兴风作浪了四年，最后被国民党封杀。自此他陷入十四年的“牛棚”生涯，包括以叛乱罪名，被乱判八年半在内，家也一再被抄。而他自己，则长年身陷黑狱，日与狱吏为伍，夜与蟑螂、白蚁、蜈蚣、老鼠为伴，其处境，从在狱被刑求逼供等角度看，实比在大陆文革期间的高级知识分子更为凄惨。
025.2000年1月4日.txt	5	9-9	7	过去|问|他说|死	今天早晨，看到陈水扁在报上抱怨的谈话，他说民进党和他这位总统候选人没有被媒体公正的对待：报上说，阿扁表示“有人说了‘我是台湾人，更是中国人’，大家听了就高兴得要死，认为他和我们一样，但是重点是后面那句‘我是中国人’，都没有人注意，大家都不去想一下其中的玄机何在，就以为这个人过去和我们不一样，现在已经一样。”当然他是特别暗指宋楚瑜这些外省人的想法，可是我手上立刻拿出以前李登辉对纽约时报的谈话证据，记者问李总统如何看待自己，李登辉毫不犹豫的说“第一我是台湾人，第二我是中国人，所有的台湾人从中国大陆来到台湾已经是很久以前了，我们在这里生活，也爱这个地方，但是当然我们也都是中国人。”请注意，这些话不是新党也不是宋楚瑜说的，而是陈水扁要追随的对象李登辉说的。李登辉对《纽约时报》记者两次说他是台湾人也是中国人，所以陈水扁把“我是台湾人，也是中国人”这个陈述，当作“帽子”戴在任何人头上，我们必须向阿扁抗议，这句话是李登辉说的。
025.2000年1月4日.txt	16	31-31	7	问|骂	你们爱台湾，每个人都爱台湾，因为方法不一样，你就开始恨我们，就丑化我们，这里面被丑化最厉害的就是新党；新党这些朋友，既没有“黑”，也没有“金”，辛辛苦苦组这个党，谈了一个在我李敖看起来一点都不激烈的大陆政策，立刻被戴帽子，请问可不可以给人家这种罪名？今天我一开始就讲出这点来，李登辉说“我是台湾人，也是中国人”，对不起，这话再也不要骂我们了。
026.2000年1月5日.txt	20	39-39	7	死|孔子	除了上述宿命、造命外，还有一种正命，就是孔子、孟子相信的命，他们是一半相信命，一半不相信命，例如“死生有命，富贵在天”这是儒家的思想，这是相信命，但有一点，儒家不相信的命是，你可以把自己变成圣人，变成了不起的人，“舜何人也，予何人也，有为者亦若是”，我只要做就可变成圣人，所以孔孟之道，在富贵、死生方面相信命，在鼓励人的方向与志气方面，就不相信命，他们也不相信宿命，所谓“君子不立于岩墙之下”，君子不站在要倒的墙下，孔子、孟子认为我们不相信命，只要有预防，就可以闪躲灾难。
029.2000年1月10日.txt	18	35-35	7	当年|问	我就说没有“一国两制”。没有“一国两制”，那一国两制哪去了？被挡在台湾外了，谁都不能讨论这个问题，连讨论都不可以，一谈就戴帽子。我告诉各位，我在台湾连续住了五十年，什么都变了，就只有一点没变，就是帽子没变。当年我谈这个问题，一谈蒋介石政府就给我戴帽子，隔海唱和。你跟共产党隔海唱和。今天帽子改变了，叫“卖台集团”、“出卖台湾”、“中共代言人”！
034.2000年1月17日.txt	9	17-17	7	问|拒绝	六、或谓中共打压中华民国（或台湾）的国际生存空间。但是，世界上比台湾人口少，比台湾面积小的国家多得是，中共为什么不打压，而专门打压台湾呢？这些问题在在都涉及中华民国和中华人民共和国关系的问题。其实中华民国和中华人民共和国的关系，是一种经由革命内战的政府继承与被继承的关系，就有如大清帝国被中华民国继承一般。中华民国拒绝被中共革命继承，而有镇压中共革命继承的“动员戡乱”，这是一个主权国家的主权行使，而不是对他国的主权侵犯；同理，中共继续对退居台湾的中华民国不放弃继承权，而有“解放台湾”。所以，“反攻大陆”也好，“解放台湾”也罢，谁也不认为这是对另一主权国家的侵犯。
037.2000年1月20日.txt	6	11-11	7	答|死	自1949年我十四岁来台湾起，直到今天，我从没离开过台湾一步，但我却以自己坐牢的代价，帮助别人偷渡离开台湾。那个人，就是彭明敏。彭明敏与我患难之交，返台后请我吃饭，对我说：“我二十二年没回来了！”我答道：“这有什么稀奇，我四十四年还没走呢！”——四十四年还没走，先是拜国民党政府不让我出境之赐；后是怪我爱台湾爱得着了魔、大有“去此一步，即无死所”之故。这样跟台湾纠缠几十年，难怪“外来政权”要以台独罪名刑求我、陷我于狱，乃至查禁我九十六种著作。因为在“外来政权”眼中，你李敖是大陆人，居然多年义助台湾人，并且居心叵测，一路跟政府捣蛋，把你以台独罪名一关多年，还冤枉吗？
043.2000年1月28日.txt	8	15-15	7	他说|死	“爱不爱台湾”这口号过分扩张时，我们会害了台湾，这情况是非常危险的；曾子临死时躺在席子上，儿子徒弟们都围在旁边，这时外边有个小孩子说好漂亮的、贵族的席子，曾子听到后说给我换席子，因为按当时礼节，曾子是平民，不能睡在贵族的席子，席子是贵族送的，可是你死时要睡在平民的席上。他的儿子徒弟们说等一下再换好不好，曾子不肯，他说你们爱我不要不如这小孩子，“君子爱人以德，小人爱人以姑息”，小孩是以高的道德标准来爱、要求我，你们这些人是敷衍我的，这是有名的“曾子易席”，曾子临死以前还保持一个重要的原则，就是我们要用德为标准来爱一个人。今天我们在台湾，应该以怎样对台湾有利为标准来爱台湾。
043.2000年1月28日.txt	14	27-27	7	过去|问	今天早上我接受台北之音叶树珊访问时，她二次提到我“批连打扁暗挺宋”，我是有批连打扁，可是说我暗挺宋，我就向她提出抗议，大家可看12月3日《台湾时报》第四版中，陈水扁有一段话说“李敖是世界第一流的搜集资料高手，李敖搜集到宋楚瑜打压言论自由时代的秘密谈话纪录”，他赞美我公布了宋楚瑜过去的黑资料，我若是暗挺宋会做这种事吗？阿扁还会赞美我吗？有人说我为何不赞美阿扁，除非他宣布废除民进党的台独党纲，承认他在台北成立的二二八纪念公园、二二八纪念馆是制造族群的冲突，宣布取消台独条款后和两岸和平相处，我就会支持他。今天看到陈水扁提出的中国问题白皮书中，第一页就二次提及我们和大陆的关系是“特殊的国与国关系”，这是阿扁抄李登辉的，而且还抄了两次，大家想这种主张，共产党会和你谈判吗？根本是无可行性的。
001.1999年12月1日.txt	8	15-15	6	死	我可以告诉张先生，我根本不接受这种“人死为大”的前提，因此我不认为人“才刚去逝（世）”就不能批评他而只能歌颂他。还有我只是就人论人、就事论事，只是因人论事的客观陈述，又何来“较不敬的言论”？至于“留给历史去评论”，你说的对，但别忘了我李敖就是历史家啊！至于功过皆论，论功已滔滔皆是，又何须我来论功呢？
001.1999年12月1日.txt	18	35-35	6	问	如果“一国两制”的构想是一个对国际上有意义的想法的话，那要归功于马克思主义的辩证唯物主义和历史唯物主义，用毛泽东主席的话来讲就是实事求是。这个构想是在中国的实际情况下提出来的。中国面临的实际问题就是用什么方式才能解决香港问题，用什么方式才能解决台湾问题。只能有两种方式，一种是和平方式，一种是非和平方式。而采用和平方式解决香港问题，就必须既考虑到香港的实际情况，也考虑到中国的实际情况和英国的实际情况，就是说，我们解决问题的办法要使三方面都能接受。如果用社会主义来统一，就做不到三方面都接受。勉强接受了，也会造成混乱局面。即使不发生武力冲突，香港也将成为一个萧条的香港，后遗症很多的香港，不是我们所希望的香港。所以，就香港问题而言，三方面都能接受的是“一国两制”，允许香港继续实行资本主义，保留自由港和金融中心的地位，除此以外没有其它办法。“一国两制”构想的提出还不是从香港问题开始的，是从台湾问题开始的。1981年国庆前夕叶剑英委员长就台湾问题发表的九条声明，虽然没有概括为“一国两制”，但实际上就是这个意思。两年前香港问题提出来了，我们就提出“一国两制”。
002.1999年12月2日.txt	20	39-39	6	问	1984年12月20日，《人民日报》刊出邓小平会见香港环球航运集团主席包玉刚时的谈话，以“解决香港问题的经验也能用于台湾”为主题，指出“解决香港问题的经验如果用于台湾，将对大家都有利，对美国也有利。”因为“中美之间的问题还是一个台湾问题。中英关于香港问题的联合声明，消除了中英之间的阴影。解决了台湾问题，中美之间的阴影也将消除。”
003.1999年12月3日.txt	7	13-13	6	问	在“一国两制”就是接受一国中华人民共和国将中华民国消灭或并吞，从此我们的宗主国就是在北京的中华人民共和国政府及宪法，“一国两制”只不过是“一个特别法”，中国政府只要“朝令夕改”，我们就“朝不保夕”，就算请美国人背书也没有用的，因为从此台湾就是中国的内政问题了。
003.1999年12月3日.txt	18	35-35	6	问	一九八七年四月十三日，邓小平会见葡萄牙总理席瓦时，又发表谈话，收在一九八七年四月十三日的《人民日报》，主题是“‘一国两制’的构想是成功的”，他提到：“我们提出的‘一国两制’的构想看来是成功的。用这种方式解决澳门这样的问题可以说为解决国际争端和消除国际热点提供了一点经验。”他又说：“中国的改革开放政策不会变，没有理由变，要变会引起人民的反对。这个政策至少七十年不会变。中国越发达，与国际上千丝万缕的关系越断不了。国际上需要中国的市场，中国需要国际市场，怎么变得了？”在这段话里，邓小平露骨的表示出，“国际上千丝万缕的关系”必然稳定住中国的改革开放政策，中国进入了国际社会，不是自己说怎么变就怎么变了。
003.1999年12月3日.txt	19	37-37	6	他说	今天怀疑中国不稳定的人儿，实在该从中国与“国际上千丝万缕的关系”上著眼，取得信心。邓小平在上一谈话后五十天，他特就五十年不变详加阐述。一九八七年六月四日“人民日报”登出他会见参加“九十年代的中国和世界”国际会议的中外代表时的谈话，他说：
004.1999年12月6日.txt	24	47-47	6	答	答：连美国国务卿的外交专家都搞不清楚李登辉的“两国论”，何况台湾人民？李登辉企图用“脱胎法”——修宪，把“中华民国”变成“中华民国第二共和”（即“中华民国在台湾”），然后再用“换骨法”——把国会全部改选，总统直选，建立“台湾法统”，再宣布“两岸两国一边一国”。这是“大盗移国”式的“总统叛乱”——总统违反宪法及《国家安全法》，公然分裂国土。
004.1999年12月6日.txt	28	55-55	6	答	答：这里要弄清楚“国家”与“政府”两个层次的概念。中国的领土包括大陆与台湾，1912年这个国家的国号叫做“中华民国”，它的代表政府叫做“中华民国政府”（简称“国民政府”）。1949年中共革命成功，改国号为“中华人民共和国”，成立“中华人民共和国政府”（简称“人民政府”）。
005.1999年12月7日.txt	19	37-37	6	答	答：不管叫什么国号，“台湾”、“台湾共和国”、“中华台湾国”、“中华民国在台湾”，甚至叫“蒋经国”、“蒋纬国”等，“台湾独立”的法律意涵就在宣布台湾（或中华民国）的主权不及于大陆以及中国（或中华人民共和国）的主权不及于台湾。李登辉在1992年的修宪宣告中华民国“治权”不及于大陆，希望宪法不承认一个主权国家有两个主权代表政府，所以李登辉事实上在搞“一族两国”，或“两个中国”或“顶着中华民国招牌的台湾独立”。
005.1999年12月7日.txt	26	51-51	6	答	答：可信，中共在与国内外政治对手谈判时，守信的纪录良好。所谓“不变”指：1.不必变，“因为深圳已经变成香港，内地已经变成深圳。”2.不变坏，而非不变好，“如果是变好，那我不变，你们也不同意。”3.不由外力变，“若是自力要变，那我们无权干涉。”
008.1999年12月10日.txt	3	5-5	6	问	我在台湾五十年，传有“三多”：钱多、书多、敌人多。“三多”中钱多是假，但是否认也没用。当人人都说你有几亿台币的时候，何不乐得承认也好？充阔总比装穷省事，并且人人看到你还会“啊呀”呢！至于书多、敌人多，则全属实。我的私人藏书，不但台湾第一，也全中国第一。但书不是钱，至少银行抵押时就不承认，在缺乏文化的台湾，唯一承认它的，就是收购“酒矸倘卖无”的小贩，一斤五块下来，书又值几个钱？至于敌人多，倒是日进斗敌。我的敌人按年月日累进，四面树之，日久成荫矣！我生平打击敌人，不遗余力，但都是据实打击，绝不像敌人那样以造谣手法诽谤我。我不但看不惯他们的手法，并且也反对别人以其道还其身。人人不该被诬蔑，敌人也一样，这才叫公道。所以，为了真理，我不但为人辨诬，甚至也为敌人辨诬。以前国民党的郁慕明是我的敌人、民进党的朱高正是我的敌人。不过，当我看到他们的敌人，以他们反对台独而诬蔑他们，我却不服。郁慕明既非汉贼、朱高正也非台奸，他们反对台独，都有大义存焉。你可以不喜欢这些人，可以不选他们，但不可以诬蔑他们。在台独问题上，谁忠谁奸，未易言也，岂可乱予罪名哉？真正的汉贼台奸，说不定正是你自己呢！岂可以血口喷人？如今我的宿敌宋楚瑜又被诬为台奸了、卖台了，我就是看不惯，就要为他辩冤白谤，说点公道话。（1999/12/10）
009.1999年12月13日.txt	14	27-27	6	死	照道理说，徐渊涛本应和李登辉这帮人是“共生共荣”的“生命共同体”，徐先生应该可以从这个“生命共同体”的“黑金共和国”里边，共分一杯羹，甚至和李政权相濡以沫的，但是，令人觉得不可思议的，徐先生非但和李家班分道扬镳，而且还跳出来掀李登辉最见不得人的底牌，成为李登辉亲友中第一位站出来讲清楚、说明白的人，这究竟是为哪桩？徐先生告诉他的朋友，他有重病在身，生死早已置之度外，岂会在乎和盘托出的后遗症？自然也更不怕秋后算帐，反正他好汉做事好汉当，愿意一个人和李登辉周旋到底，让台湾人民彻底认清李登辉的本来面目，并矢志要以有限的时间、精力写一本书亲笔见证他所知道的李登辉。
012.1999年12月16日.txt	11	21-21	6	答	本周四，广电处电视“审查委员会”举行例会，有鉴于上周新闻局曾遭立委质询：将如何处理“环球股权风波”，弟允以“将表示关切，并俟机劝和”，广电处乃邀请当事人到会说明，（弟曾询以为何不邀环球多媒体负责人同时到场？答曰：环球多媒体并未曾向新闻局申请为“卫星电视台”，故非本局管辖对象云云）（至此，弟才恍然：原来子嘉兄受托代理环球多媒体董事长后，适逢卫星电视法通过，竟以“环视”瓜代“环球多媒体”向本局申请而为正式卫星电视台！）
012.1999年12月16日.txt	33	66-66	6	答	（二）本周四，广电处电视“审查委员会”举行例会，有鉴于上周新闻局曾遭立委质询：将如何处理“环球股权风波”，弟允以“将表示关切，并俟机劝和”，广电处乃邀请当事人到会说明，（弟曾询以为何不邀环球多媒体负责人同时到场？答曰：环球多媒体并未曾向新闻局申请为“卫星电视台”，故非本局管辖对象云云）（至此，弟才恍然：原来子嘉兄受托代理环球多媒体董事长后，适逢卫星电视法通过，竟以“环视”瓜代“环球多媒体”向本局申请而为正式卫星电视台！）
015.1999年12月21日.txt	8	15-15	6	问	我们坚持社会主义制度，坚持四项基本原则，是老早就确定了的，写在宪法上的。我们对香港、澳门、台湾的政策，也是在国家主体坚持四项基本原则的基础上制定的，没有中国共产党，没有中国的社会主义，谁能够制定这样的政策？没有哪个人有这个胆识，哪一个党派都不行。你们看我这个讲法对不对？没有一点胆略是不行的。这个胆略是要有基础的，这就是社会主义制度，是共产党领导下的社会主义中国。我们搞的是有中国特色的社会主义，所以才制定“一国两制”的政策，才可以允许两种制度存在。没有点勇气是不行的，这个勇气来自人民的拥护，人民拥护我们国家的社会主义制度，拥护党的领导。忽略了四项基本原则，这也是带有片面性嘛！看中国的政策变不变，也要看这方面变不变。老实说，如果这方面变了，也就没有香港的繁荣和稳定。要保持香港五十年繁荣和稳定，五十年以后也繁荣和稳定，就要保持中国共产党领导下的社会主义制度。我们的社会主义制度是有中国特色的社会主义制度，这个特色，很重要的一个内容就是对香港、澳门、台湾问题的处理，就是“一国两制”。这是个新事物。这个新事物不是美国提出来的，不是日本提出来的，不是欧洲提出来的，也不是苏联提出来的，而是中国提出来的，这就叫做中国特色。讲不变，应该考虑整个政策的总体、各方面都不变，其中一个方面变了，都要影响其它方面。所以请各位向香港的朋友解释这个道理。试想，中国要是改变了社会主义制度，改变了中国共产党领导下的具有中国特色的社会主义制度，香港会是怎样？香港的繁荣和稳定也会吹的。要真正能做到五十年不变，五十年以后也不变，就要大陆这个社会主义制度不变。我们反对资产阶级自由化，就是要保证中国的社会主义制度不变，保证整个政策不变，对内开放、对外开放的政策不变。如果这些都变了，我们要在本世纪末达到小康水平、在下世纪中叶达到中等发达国家水平的目标就没有希望了。现在国际垄断资本控制着全世界的经济，市场被他们占了，要奋斗出来很不容易。像我们这样穷的国家要奋斗出来更不容易，没有开放政策、改革政策，竞争不过。这个你们比我们更清楚，确是很不容易。这个“不变”的问题，是人们议论纷纷的问题，而且我相信，到本世纪末、到下个世纪还要议论。我们要用事实证明这个“不变”。
015.1999年12月21日.txt	10	19-19	6	问	“一国两制”也要讲两个方面。一方面，社会主义国家里允许一些特殊地区搞资本主义，不是搞一段时间，而是搞几十年、成百年。另一方面，也要确定整个国家的主体是社会主义。否则怎么能说是“两制”呢？那就变成“一制”了。有资产阶级自由化思想的人希望中国大陆变成资本主义，叫做“全盘西化”。在这个问题上，思想不能片面。不讲两个方面，“一国两制”几十年不变就行不通了。
015.1999年12月21日.txt	20	39-39	6	问	以上谈话，登在1987年5月17日《人民日报》上。到了第二年，1988年12月3日，《人民日报》又登出他以“‘一国两制’的方针是不会改变的”为主题，对日本以樱内义雄为团长的日本国际贸易促进协会访华团的谈话，指出：“‘一国两制’是我们的一个新发明，中国存在香港和台湾这样的问题，‘一国两制’是唯一可行的解决办法。‘一国两制’的方针是不会改变的。”又过了一年，1990年4月7日，他以“振兴中华民族”为主题，对泰国正大集团董事长谢国民等谈话，指出：“中国的形象如何还是要看大陆，中国的发展趋势和前途也在大陆。台湾跟大陆争正统，不自量力。大家都应该想开点。我们已经想开了，提出‘一国两制’。我们相信，最终将靠‘一国两制’把我们国家统一起来。”同年9月15日，他复以“共同努力，实现祖国统一”为主题，对马来西亚郭氏兄弟集团董事长郭鹤年谈话，指出：“台湾方面最近开始有些松动。但是现在台湾有人想搞‘一国两府’，连联合国的局面都想改变，实际上还是搞‘两个中国’。现在联合国只承认中华人民共和国政府是中国唯一的合法政府，台湾是中国的一部分。怎么能把台湾当局称为中国政府呢？这不行。再没有比‘一国两制’的办法更合理的了。‘一国两制’对台湾来说有什么损失呢？现在对台湾是个机会，对整个民族是个机会，需要大家努力，推动台湾走向统一。”以上两次谈话，分别收在《邓小平文选》第3卷第358、362页里。
022.1999年12月30日.txt	25	49-49	6	问|答|骂	李登辉昨天上午破口大骂宋楚瑜，报上说李登辉步入中央党部前，面对记者问到“相不相信宋楚瑜昨晚的说法”时，以调侃的语气回答说“不相信，你们要听中常会后的调查报告就更清楚了”。他直指宋楚瑜是“做贼仔的变头家，哪有这种事情”。国民党中常会听取兴票案调查报告，李登辉在裁示时强调，这个案件是司法问题，绝对不是政治问题，某某人是“做贼兼白贼”，企图用政治来模糊司法与是非，这种人用台湾话讲是“不要脸”，用国语讲叫“无耻”。李登辉说，这种无耻之人如何能做公众人物，如何能做一个候选人，台湾社会是有是非，有正义的社会，有民主，也有法治，应透过司法来处理云。我看了，忍不住要以下面的表来对照一下李登辉。这个表的部分内容，我昨天晚上在交通大学演讲时初次透露，现在全文发表在《李敖电子报》里。
025.2000年1月4日.txt	13	25-25	6	答	我告诉小马哥，东京和北京是姐妹市，北京会答应吗？“石原牌”是李登辉又新打的一张牌，从“七块论”、“两国论”、“夹击论”，到邀请石原访台，这是李登辉摆明要制造两岸不愉快、紧张气氛的时候，你何苦以自己的清望替李登辉背书，来蹚这混水？
027.2000年1月6日.txt	9	17-17	6	问	四、国民党把自有的党产，以“信托”的方式处理，又牵涉到一个问题：“信托契约”的订立，是何种类型的信托契约？是否可以随时解约，将本金取回运用？若是如此，则国民党随时可以将大笔资金运用于选举与政治操作，那么，“党产信托”也不过是个幌子罢了！换言之，仍然无法断绝政商勾结、黑金政治。
