file	paragraph	line_start	line_end	char_count	score	snippet
009.揭发黑幕以后.txt	3	5	5	202	5	出来后一直想写封长信给你，不料一出狱门即被记者们缠住、被党外人士缠住、被黑狱风云缠住，最后被“龙体违和”缠住，又人事甚繁（以昨天为例，早起写完“每日一文”，然后秉钦来、祥柯来。午周渝、治芬请吃越南菜。下午散步于台大，晤梁荣茂、晤黄武雄夫妇。傍晚起造时来、小痴来、清玄、彩銮来、信疆、元馨来、维贤、锡福来），所以长信一拖再拖，虽知道你不见怪，但总是自己怪自己。如...
009.揭发黑幕以后.txt	15	29	29	82	3	在他首次出狱，再进台北看守所服刑以前，共计出了一本新书，结了一次婚，也离了一次婚，此外又打了一场官司，写了几首打油诗，上过无数次报纸，风头之健为全台湾区文人的冠军。
009.揭发黑幕以后.txt	27	53	53	104	4	2月21日贵报第三版以极大篇幅刊载甫行出狱，就以“要人”的模样，举行记者会的李敖，发表所谓《狱中见闻及狱政措施的看法》，其结论是：“我准备第三次坐牢。”这个结论，也即是他所说今后的“新计划”，也就是政治路线！
009.揭发黑幕以后.txt	28	55	55	103	3	我一口气读完全文之后，觉得这个“文化太保”倒不失其童心，他首先招认：“这个牢把我关火了！”他要重做冯妇，写文章“搞鬼”。他继续说：“天下没有白坐的黑狱，关我，我就写。”他始终认为他被判刑六月，是件“冤狱”。
009.揭发黑幕以后.txt	31	61	61	134	3	无可讳言：监狱中服刑的人犯，都是来自三山五岳的“好汉”，又都有闯虎穴、探龙潭的“雄心”，连号称“很守规矩，监所特别礼遇”的李敖都是文化太保的化身，这边才对所长说“多谢照顾”之情，那边就哗众取宠对记者揭发所谓监狱“黑幕”。这种双重的气质，正具体的表现了他的“双重人格”！
009.揭发黑幕以后.txt	32	63	63	166	4	如所周知：服刑是一种改过迁善的教育。狱政措施，在法令上容或有解析不同，因而发生执行上的某些偏差，但其役官立法的意旨，则是公正无私的。李敖输了官司，迁怒到执法的狱政部门，以偏概全，实在不值一笑！更笑话的是：他嫌监房容纳的人数超越规定的数目，就一口咬定那是“凌虐”人犯，好像他们不是改过迁善来的优游岁月，而是养尊处优来的。天下岂有此理！
009.揭发黑幕以后.txt	34	67	67	115	3	李敖无法向明镜高悬的法曹报复，便采迂回方式，从《狱中见闻》着手，他的所谓见闻，除了朱光军所长、万宗池副所长，以及法务部施启扬政务次长等人做正面驳斥之外，请容我以坐牢的“老前辈”“现身说法”，以“就正”于李敖所谓“凌虐人犯的问题”。
009.揭发黑幕以后.txt	35	69	69	250	10	话说二十五年前，我也曾因案坐牢（可惜我不会喊冤）。一天夜半，狱中两个同伴忽然由相骂而至相打起来，拳来脚往，目貲欲裂，咬牙切齿之状，只有仇深似海，不共戴天，庶几可以形容。龙头干涉不了，管理员驾到，也无可如何之际，却有一位睡在他们旁边的难友说：“你们不要脸！闹同性恋爱，夜夜‘那个’不算，还要打情骂俏；打情骂俏不算，还要认真比武——弄得大家神鬼不安！”管理员追问“...
009.揭发黑幕以后.txt	36	71	71	121	3	又：他对记者先生赞扬“党外”林正杰，却又抨击所谓“党外主流派”不应围剿苏洪月娇。据我了解：“党外主流派”自黄信介而后，就成了康宁祥、尤清的专利品；李敖耍文化太保，已经力不从心，再妄想耍政治太保，未免目无“党外法庭”，不怕被封为“党外烈士”了！
009.揭发黑幕以后.txt	56	111	111	148	4	面对“文化太保”这一击，真是打得法务部门的相关各级主管头昏眼花，几乎是招架为难。首当其冲的看守所所长朱光军，一方面怪罪李敖不够意思，狱中对他百般优待，讵料甫告出狱即行反咬一口，另方面也只好情急“智”生的一口咬定李敖疯癫成性，所言纯属幻想，最后希望大家不要轻信谣言，以免影响司法威信及对政府的向心。
009.揭发黑幕以后.txt	67	133	133	93	3	李敖有“文化太保”之称，在文艺界里的作风，褒贬参半，许多人常敬而远之。这次因萧孟能官司吃败仗，被判六个月牢。坐牢是很晦气的事，但李敖却是在记者闪光灯下走进台北看守所，又在闪光灯下走出来。
009.揭发黑幕以后.txt	72	143	143	55	4	岂知不然。李敖透露说，看守所的管理员竟然得意洋洋地说：“法律规定我们不能打人，我们不用手打，用脚踢总可以吧！”
009.揭发黑幕以后.txt	73	145	145	93	4	最令人意外的是，台湾的富裕冠全中国，但看守所的医药器材竟然奇缺无比。一个注射针头要对付所有的病患，造成看病打针“只换屁股不换针”的笑话。三千多犯人只配备一名医师，也是僧多粥少到不成比例。
009.揭发黑幕以后.txt	79	157	157	145	3	再度服刑期满出狱的李敖老弟，发表第一篇狱中记事的文字，列举出许多狱中黑暗而残酷的事实，引起老爷界吃惊了——先是法务部李元簇大人下条子给狱政司查报；继之，台北“土城看守所”所长朱光军大人向报纸坚决否认李敖的投书所述是实，指称：“李敖是写文章的人，特别喜欢幻想，他所说的一切，都是想象出来的。”
009.揭发黑幕以后.txt	80	159	159	509	7	此乃中国几千年来一直存在的一个大问题也。①吾邦吾民及吾老爷们，功夫用在整人狠毒的手段上，必居世界冠军无疑，这有历史诸多文字可证，俄国老毛子的“古拉格群岛”和希特勒魔王的屠杀大手笔都差一截，仅第二、三名而已。但请别把罪责完全推给老爷界。老爷是从民间出来的，其恶念恶智、凶心凶手，莫不由居民间时打下的基础、扎的根，可知吾民吾邦灵感智慧之高、方法之毒，乃是首要条件，...
009.揭发黑幕以后.txt	83	165	165	436	8	我很重视且欣赏看守所长朱光军大人的“断语”，他说写文章的人特别喜欢幻想，这话真是发人猛省。猛省什么？老爷每向受训学子强调曰：“你们要四肢发达，头脑简单。”不幸的是，知识分子恰恰相反，头脑发达，四肢较弱。写文章的人，多是耗心血、淌热汗，为增长国力而损耗自己的体力，付出智慧以求有助于社会人群的福祉，所以很多历史伟人（如孙逸仙博士）往往因写文章演讲甚多，寿未高就谢...
009.揭发黑幕以后.txt	84	167	167	154	3	不过，敝叟却绝对不相信李敖的头脑有毛病，他没病没疯，怎么竟会凭空就“幻想”出来“土城二号”有那么多的“黑狱情景”？朱大人说李敖“幻想”，倒令人怀疑他朱大人可能是有点精神疾患，否则怎么一口咬定了“写文章的人都特别喜欢幻想”呢？他说这话的根据是什么？恐怕就是他“幻想”出来的吧。（《人间世》，1982年3月1日）
009.揭发黑幕以后.txt	129	257	257	75	3	在林林总总的狱政问题中，一直成为大家话题的不外是：“修理”受刑人、贩卖烟酒及槟榔、向受刑人索贿等，而这些问题中的问题，最严重的还是“动手殴打受刑人”。
009.揭发黑幕以后.txt	130	259	259	99	3	就以昨日发生的新竹少年监狱人犯滋事来说，据了解内情的人士透露，新竹少年监狱今天之所以造成如此严重的后果，是因为该监所管理人员平时有“修理”人的习惯，动不动就出手打人，平日怨气积多了，一发而不可收拾。
010.论看看也好.txt	3	5	5	153	5	于右任八十几岁时候，要请三桌客，请的都是达官贵人，并且清一色都是男士，但他特别点名请了一位女士，就是当时大名鼎鼎的女明星焦鸿英。名单开出来，监察院秘书长对他说：“院长，请的都是政界人士，并且都是男士，中间请这么一位焦鸿英，恐怕不妥吧？”殊不知于右任掀髯大笑，说：“为什么不能请焦鸿英？我老了，但看看也好！”
010.论看看也好.txt	5	9	9	120	3	“看看也好”，是多么有趣味的境界！又是多么潇洒的境界、纯真的境界、婉而虐兮的境界！七十多岁的左舜生，有一次对我说他喜欢看美女，人虽老了，但“亦知美之为美”。此老为国民党跑了一辈子龙套，为我所批评，但他如此老而能“老不修”，倒颇令人觉得有趣。
010.论看看也好.txt	6	11	11	218	6	我在军法处做政治犯的时候，有一次同一个小偷住在一起，小偷长得奇黑，我用台湾话给他起外号叫“欧卡曾”（白话是“黑屁股”，文言是“黑臀”，古人真有人叫“黑臀”）。因我对他不错，他说很感谢我，他出狱后，一定找个脱衣舞女用摩托车载来，在我窗下大跳一次，在警卫赶到前，再用不熄火的摩托车载运逃走。他说：“龙头啊！不要太用功了！那时候该休息一下，看看脱衣舞，看看死脱瑞普，...
011.介绍《我爱李敖》.txt	4	7	7	177	3	有好大一阵子，台湾传出来的李敖新闻，总好像画上了花边，往往在报纸的社会版和影剧版之间徘徊，而且情节离奇、变幻莫测，简直就是限半小时演出的现代肥皂剧，不但要随时插入广告，还必须噱头十足，高潮迭起，唯恐好热闹的闲人们转移目标、半途而退。于是我们看见60年代初期以冲破思想“禁区”而崭露头角，70年代终于成为良心囚犯的李敖，忽然好像摇身一变，成了个闹剧中人……
011.介绍《我爱李敖》.txt	5	9	9	125	3	接着指出事实好像又不如此单纯，李敖这六个月的牢狱之灾，乃“另有隐情”。李敖真正犯忌的，绝不是法律的或道德范畴里的问题，而是他的政治行为，因为政治的原因，他才遭到法律上的被整，他的所谓诈欺入狱，“事实上，据熟悉内情的人说，这不过是个〔国民党的〕幌子。”
011.介绍《我爱李敖》.txt	8	15	15	477	3	李敖的“天下”是什么？从社会学的眼光看，李敖的“社会角色”，就是琼瑶式“少女眼泪梦”以外的这个世界的“意见领袖”。在美国，没有第二个拳手能像阿里那样，把大众传播媒介逗得团团转。在台湾，没有第二个文人像李敖那么深深摸透大众社会心理。李敖是台湾文化界的一颗“星”、一个“现象”、一个“奇观”。很难想象，这二十年的台湾文化圈，如果没有李敖，是个何等单调、寂寞的场面。...
011.介绍《我爱李敖》.txt	12	23	23	150	3	这篇文章又说：“李敖是台湾文化界的一颗‘星’、一个‘现象’、一个‘奇观’。很难想象，这二十年的台湾文化圈，如果没有李敖，是个何等单调、寂寞的场面。”我想，单调、寂寞不止于文化圈吧？想想看，这一段浮海偏安的小局面，在历史上将怎么写？我看历史上写起来，会像写一切浮海偏安的小局面一样，只不过是几行字而已。
011.介绍《我爱李敖》.txt	14	27	27	99	3	十五年了，除了延续“中华民国”这一线香火以外，历史家会追问，我们还为后世留下些什么？我们不能回答说：我们为你们留下了《梁山伯与祝英台》、留下了武侠小说、留下了孔庙中的偶像、留下了一百三十六张麻将军。
013.为什么活一百岁？.txt	4	7	7	115	3	你记得我写的那篇《要清白，请长寿！》吗？（收在《李敖千秋评论丛书》第一期《千秋·冤狱·党》。）我说：“没有当时反击能力的人，他必须设法长寿，练得比他的‘敌人’活得更长久。”我认为“长寿”也是一种武器，想想马寅初，你就不能说不是了。
013.为什么活一百岁？.txt	5	9	9	579	4	马寅初5月10日死在大陆，活了101岁（1882-1982）。他是中国第一经济学家，因为说真话，批评了国民党的经济政策和贪污腐化，在1940年，被国民党逮捕，先关在贵州息烽，再转江西上饶集中营，后来罗斯福的特使威尔基来中国，因为跟他是同学，点名要见他，国民党不承认自己是“媚外”的，但却把马寅初放出来，见过威尔基后，改为软禁。1949年，马寅初看到他的敌人垮了...
014.给周清玉的一封信.txt	5	9	9	160	3	许委员和我本拟应“世台会”的邀请，参加其第九届年会，当然也很乐意能参加贵会的活动，无奈一直无法获得政府的批准。虽然沈君山教授曾多方努力，还是徒劳无功。而行政院的答询，已引起众多人的困惑和议论。我们怀疑，即再以贵会的邀请函，再次提出申请，恐怕到最后还是政策问题，人的问题，仍然过不了关。因此，为整体着想，我们未便强求成行！
014.给周清玉的一封信.txt	10	19	19	437	3	第二，你们这次受官方迫害，不能成行。官方以离奇的手段，使康宁祥他们四人能去于先，使高育仁、纪政、沈君山他们三人能去于后，却单单把你们两位小女生留中不发，此中内幕，你们应该无保留的揭发出来。我始终怀疑，康宁祥擅自决定的名单，是事先与官方有所协商、默契或过目了的。这由他们临走前联袂拜访孙运璿等国民党大员可以看出端倪。7号你离我家后不久，黄玉娇和小魏、小文到我家，...
014.给周清玉的一封信.txt	11	21	21	496	5	第三，你对沈君山的“肯定和感谢”，显然是太“与人为善”了，这当然是你做人过分善良有以致之。沈君山是国民党“四大公子”之一，是道地的国民党世家中的“文学侍从之臣”，是天字第一号的帮闲混子，是最喜欢出风头的学术交际花，是单线而又客串的国民党文化特务。别人不能旁听“美丽岛”大审，他可以入座；别人不能参与陈文成“验尸”，他可以审视；别人不能对政治犯探监，他可以拍照；...
015.给梁肃戎先生的公开信.txt	6	11	11	136	3	据说当晚脸色非常难看，最后他终于开口，批评这条条文规定太宽。他说，林部长一再强调这两条条文引自日本《刑事诉讼法》，据他对日本《刑诉法》的了解，虽然他们警察有紧急逮捕、搜索的权力，但他们的检察官却配置在分局，警察把人紧急逮捕后，带回警察局就交给检察官接办，警察权力不致滥用。
015.给梁肃戎先生的公开信.txt	10	19	19	231	3	第二、33年来，先生为建立侦查中选任辩护人而发言、为维护雷震的法律权利而发言、为维护彭明敏的法律权利而发言、为抨击司法行政部长郑彦棻玩法弄权而发言……种种声音，无一不使我这个同乡晚辈钦佩。十多年前，齐世英乡长的午餐席上，先生对我说：“我没有你李先生这种勇气，很多话我不敢讲。”我当时就表示先生也是很有勇气的人，只是不讲而已。以先生当时发表在齐世英乡长办的《时与...
015.给梁肃戎先生的公开信.txt	18	35	35	577	3	第三、先生加入国民党的时候，我们家乡已经沦陷在日本手里，先生任长春市党部书记长，追随石坚乡长，发展组织与学运，从事地下工作。1944年被捕后，先生和石坚乡长饱受刑求，先生夫人饱受日本宪兵凌辱，石坚夫人被日本宪兵用香烟烧奶头等等，先生对侵犯人身自由的肤尝身受，感情上自然认识最清；对侵犯人身自由的任何可能，感情上自然反应最烈；对侵犯人身自由的任何政党与政权，感情...
016.保证相互毁灭.txt	4	7	7	155	3	虽然我们的判决书中有你的大名，可是同你至今缘悭一面。不过有政治犯前科的人，一般说来，出狱后最该力行不来往，所以“相见争如不见”。这也正如你信中说的：“此刻在此地，欲拜访一个人，务必考虑许多问题。”一考虑之下，虽然“相濡以沫”，也要“相忘于江湖”了。当然不信邪的，自然想怎么还是就他妈的怎么，谁又管得了那么多呢？
016.保证相互毁灭.txt	5	9	9	209	3	你说：“您的‘千秋评论丛书’得以顺利发行至现在——十二期，实在令人惊异，是不是老K开始对您礼遇有加，抑或对您这‘文化流氓’——外界称呼——疲于对付？”我可以告诉你，其实《千秋评论》并没“得以顺利发行”，第一期《千秋·冤狱·党》被查禁；第十期《文星·围剿·卖》，其中《为老兵李师科喊话》一文，被撕掉才能继续发售；第十一期《放火·放水·逃》被查禁。这一期的查禁命令...
016.保证相互毁灭.txt	6	11	11	89	3	主旨：由四季出版公司出版、发行李敖著作之《放火·放水·逃》（“千秋评论丛书”第十一号）一书，内容挑拨政府与人民情感、淆乱视听、危害社会治安秩序，特依法取缔（查禁）并扣押其出版物。
016.保证相互毁灭.txt	13	25	25	330	3	至于老K对我的态度，当然不是“礼遇有加”，老K是不懂什么叫礼贤下士的，真正的士，也绝不受他们的礼——老K是绝无诚意的。在这一点上，在这岛上，没有人比我认识更清了（因为这种认识，要对老K历史有深入了解为基础）。所以我一直提倡“不合作主义”对付老K，我这种先知式的观点，当然不是一般座谈会专家和小政客们所能了解的，一般党外人士和小百姓了解的程度，也有待加强。这是因...
016.保证相互毁灭.txt	14	27	27	389	4	老K对我虽然没有“礼遇有加”之可言，但是我的知名度与打击率，他们显然已逐渐心里有数，不敢低估，显然逼得他们不得不调整他们对我的暗算。在核子战略术语上，有一种MAD （Mutually Assured Destruction，保证互相毁灭），就是作战的一方，不怕另一方的一举毁灭性的攻击，因为不论你怎么毁灭我，我在被毁灭同时，都有毁灭你的能力，使你清楚知道：你惹...
016.保证相互毁灭.txt	22	43	43	83	3	弟因有二次政治犯坐牢的记录，所以对您的言行特别关心，倘不是顾虑到您工作的忙碌，不便打扰，在您这次还没复出前早就踵门拜访矣。此刻在此地，欲拜访一个人，务必考虑许多问题。
016.保证相互毁灭.txt	27	53	53	561	4	七十年度（1981）台北市议员选举前夕，弟有鉴于第五选区（双园、古亭、木栅、景美），党外在景美、木栅可以建立一个据点，而分往立法院，拜访张德铭以及康宁祥等二位党外新秀，由于廷朝兄之再度入狱，无从介绍，而康某对弟总该有几分面熟，及至提到景美区林良平有意以党外身份参与竞选之际，他们都表示无能为力。我解释说，林良平虽然在党外活动中，从未涉足，但其个人却有永不加入国...
017.抱谁大腿？.txt	14	27	27	66	3	在苏联投奔自由的情报人员的著作里，写派赴美国的前夜，上司最后一句嘱咐是：“当心美国女人的大腿！”可见美国女人的大腿功深，足可敌国矣！
018.李敖冤狱平反·尤清冤狱在望.txt	5	9	9	173	4	国民党垄断的报纸，对我去年被判坐牢，大登特登，如今被平反而胜诉，却只字不提。这种作风，十足证明了他们居心斗臭我，这样的政党实在卑鄙可恶。报上登监察委员张一中骂尤清，说少数人在把持报纸，逼记者写丑化国民党的稿子，你尤清臭国民党，你良心过得去吗？我看了真好笑：国民党垄断报纸，整天臭我、丑化我，他们好像全忘了，最后还抬出良心来，他们原来还是有良心的！
018.李敖冤狱平反·尤清冤狱在望.txt	8	15	15	285	4	总之，这些1949年前，一起把大陆丢掉逃到台湾的失败者们，他们的心态，尤其是三十三年来垂垂老矣的心态，实在值得专题研究。清朝全祖望写《节愍赵先生传纠谬》，写那明末志士赵先生，以垂垂老矣之年，整天靠幻想敌人失败而活。他被学生藏在深山里，每次听到胜利的假消息，才肯吃饭。拖了半年，谎话光了，最后得知真相，他无法适应了，“大恸，踣地，更不进食……奄忽而逝！”如今咱们...
019.漫谈“大姑娘洗澡心理”.txt	5	9	9	106	5	一个笑话说：一位老处女家住海滨，一天跑到警察局，请警察干涉一些小男孩，说他们在海滩游泳，竟不穿游泳衣，有伤风化。警察跑到老处女家里，现场观看，说：“我看不见啊！”老处女说：“用肉眼是看不见，但我是用望远镜看的。”
019.漫谈“大姑娘洗澡心理”.txt	7	13	13	59	3	回想十六年前（1966年11月12日），中山楼启用那天，国民党《中央日报》以社论《中华文化复兴之新机运》为题，最后说：
019.漫谈“大姑娘洗澡心理”.txt	9	17	17	174	3	但是，事实上，除了当天上午9时至下午4时，允许“不得携带六岁以下小孩”的民众参观一次外，十六年来，这一“中华文化复兴新机运的新象征”，就变成了国民党一家的禁脔和禁苑，进口的路上有禁军挡路，民众是什么都沾不上边的。沾不上边还不要紧，却把中山楼的一切开支，由台北市市民负担，以至今天成为正杰在市议会“打击魔鬼”的主题之一，来龙去脉，信手写来，真写不完。
019.漫谈“大姑娘洗澡心理”.txt	13	25	25	344	4	这次送礼，因为怕你们“将亲友的送礼转移作‘选民服务基金’”，所以绝不送钱。你们党外的基金，管理上实在太大而化之，由陈文成基金事可证，你们全体都该“自打手心十下”。陈老爸有丧子之痛，可以免打。你们在财务上如此粗枝大叶，又何能责备苏大炮他们？为今之计，盼祖珺在婚后，努力向会替丈夫理财的K夫人们讨教，这样才能在不动声色之间，化党外捐款为己有，化党外杂志收入为己有，...
020.致小金.txt	4	7	7	107	3	你提到的书呆子刘福增的事，我认为刘福增本人不足论，他不会求证事实，他已中了错误的治学方法的毒，只会做“拟似演绎”（pseudo-deductive）而已。我举个例：他在《政治家》第二十五期《李敖需要净化》一文中说：
020.致小金.txt	7	13	13	112	3	正因为刘福增不会求证事实，所以他会以“进出”代“侵略”、以“我想”“猜的”代南京大屠杀死人三十万……这些笑话，刘福增是不会改的，我们要做的，是承认这种书呆子无可救药，但却要批评他给别人看，劝别人别再走上他这种学而不化的错路。
020.致小金.txt	16	31	31	110	3	李敖说：“请问刘福增，五十年来，你和……日本人，‘拿什么有力的新证据’来推翻‘公认’的历史事实来了吗？”我前面说过，日本政府这次并没有要推翻什么历史事实。刘福增更没有。而李敖又硬指有而加以攻击。李敖又在犯稻草人的谬误了。
020.致小金.txt	21	41	41	284	4	回想刘福增他们创办水牛出版社之初，我为他们编《罗素选集》。他们却不挂我的名字，而改挂“刘福增主编”字样，其实这部书只有传记部分是他们自己做的，只占全书十分之一，这种作风，就是这些当代学人的诚实！当时我不同他们计较，目的无他：只是换得他们的稿费以救助殷海光等人而已，如因主编《罗素选集》而使刘福增增加知名度，也为我所乐见。如今，刘福增好像知名度大得连他自己都不知...
020.致小金.txt	22	43	43	191	3	阳明山自从我仙登以后，行情看涨，周令飞来，住山上；索尔仁尼琴来，住山上。郦道元《水经注》说江水有灵将惊知己于千古，阳明山有灵，亦当同感。只是好好一座“草山”，硬被国民党污染改名“阳明山”，真不知“草山”何辜了！中医有所谓“阳明病”，看到国民党如此阳明得紧，此病真该别做新解了。王阳明坐牢时候，写诗说“夜深黠鼠忽登床”，如今台湾的王阳明信徒关人，不给床睡，目的无...
021.论两面人.txt	13	25	25	211	3	孔夫子说：“乡愿，德之贼也。”乡愿就是没有是非，也不追究是非。就是一一弥缝，事事伪善。并且，更严重的是，乡愿还会故意搅局，故意弄浑正宗的颜色。孔夫子讨厌紫颜色，因为紫的颜色，对正宗的红色是一种搅局、一种似是而非。丘吉尔说他不喜欢委靡的棕褐色，他“不能假装对颜色不偏不倚”（I cannot pretend to feel impartial about col...
021.论两面人.txt	22	43	43	102	3	福增的用心是好的，但是毕竟是书生之见。他不知道：我“斤斤计较”的，绝非“一些个人”过去或现在的“小毛病”，而是认为他们这些“大毛病”，的确有害于“人民和‘大局’ ”——我才真是“为人民和‘大局’着想的”。
