file	paragraph	lines	score	markers	text
001.1999年12月1日.txt	9	17-17	10	过去|骂|死|胡适|徐复观	记得胡适死的那天晚上（1962年2月24日），我正在文星书店，忽见胡秋原匆匆赶上楼来，慌忙告知他要修改已交给文星的批评胡适的文章，因为“人死为大”，不修改怕人骂，同时徐复观也来快件，也要修改，原来一个人活着或死了，对他要有不同的骂法！我当时就深感这些人太虚伪了。如今三十七年过去了，我愈老愈坚定，认为“人死为大”不能批评他的前提是根本错误的，相反的，人一死就批评他，反倒更引起我们对死者的认识与了解，从而看到死者的真面目，才更真实啊。（1999/12/1）
002.1999年12月2日.txt	11	21-21	10	举例|例子	台湾富大陆穷，台湾好大陆差，这是两岸的差异，对待这种差异，台湾人可以同情大陆，体谅大陆在同帝国主义斗争中的坎坷旅程；但台湾人也可以看不起大陆，鄙视大陆。不幸的是几十年来台湾政治运动，却把台湾人民导向后者发展，时至今日，上从李登辉的言论下至一般市井小民的街谈巷论，可以看出到处充满着对大陆的不屑与鄙视，甚至敌视的心态。这种心态，就如同前面所举例子中的长工一样，说“我不是中国人，我是台湾人”，“我们不是一国，而是两国”。
027.2000年1月6日.txt	30	59-59	10	漫画|最后	1963年9月号的“骑士”（Cavalier）杂志有一幅漫画，画中一对情侣在汽车中幽会，女的说：“我是个处女，可是对它并不‘执迷’。”（I'm a virgin, but I'm not fanatic about it.）寇乃馨正好相反，她对处女非常“执迷”，她自台大外文系毕业后，徜徉演艺圈四年，被称为“台湾演艺圈最后一个处女”，自属“异类”，因为别人落红成阵之时，当然怪她何以自处。乃馨说：“坦白说，我才不是无聊地为了做处女才是处女，只是因为基督徒的信仰，让我更珍惜、更尊重自己的身体。”
029.2000年1月10日.txt	10	19-19	10	笑话|神父	我告诉各位一个笑话，这个笑话解释了我跟新党的关系。一个教会很穷，就请美国资本家来捐款，这个神父就跟资本家在前面讨价还价，主教急得跟在后面偷听他们讲话，发现资本家捐一百万美金，神父摇手，资本家捐五百万美金，神父又摇手，资本家说我捐一千万美金，肯不肯，神父还是摇手，资本家说不捐了，就走了。走了之后，主教一把抓起神父说，什么事呀？人家捐了一千万美金你还摇手，还不干，什么原因呀？神父说我干不下去呀！什么事情呀？他要求我每次祈祷完毕，不要再喊“阿门”，要喊“可口可乐”。
029.2000年1月10日.txt	44	87-87	10	最后|问|骂|死|老子	保住的原因，因为有中央政府支持。有人说那香港居留权的问题。那不证明了共产党不懂香港的法治。居留权的问题，是由中央政府作黑脸，为什么呢？如果这个法案香港政府通过的话，内地那些一百万杂七杂八的人会去把香港拖垮，所以中央政府说法案无效。所以，我说我们可以在美国人的背书下，坐下来谈判，换取五十年和平，五十年和平竞争。把他们拖垮，让我们这匹马飞起来。所以今天《联合晚报》登出我那句动人的吓人的口号：“出卖台湾，买回大陆”。当然出卖两个字显出特别意义，你们老是说我们卖台，老子就出卖给你看，台湾卖个好价钱还不错呢！为什么？我们的好机会被李登辉压住了。大家想想看，十年以前，当那个可恶老贼、那个反共老手陈立夫提出来我们用两百亿买大陆时，那个时候我们可以占多少便宜，他们必须跟我们合作。由于蒋介石的反共教育成功，我们今天吃了亏，来不及了。我们的筹码越来越少，可是大家不要怕，我们还有最后一个筹码，就是……（群众大呼李敖），如果信得过，我带着陈文茜之流代表台湾到大陆谈判。现在我们和他们谈判一定可以占便宜。我们有占便宜的机会，他们有个弱点，“死爱面子”。共产党“明的不能搞，暗地可以摸”。共产党可以吃亏。如果共产党说你们台湾这样逼我，我也不打你们，台商都回来，赚的钱全部回来。有何后果，台湾人口有十分之一失业。我们每年赚大陆两百亿美金，因为他们把我们当兄弟，我们吃人家的还骂人家，这是什么道德，什么政治（群众大笑、掌声）。所以，我要告诉大家，新党的梦一定会成功，那就是“中华民国万岁！”
004.1999年12月6日.txt	32	63-63	9	有一个	同理，对承认“中华民国”及“中华民国政府”的友邦，在“一个中国”的原则下，法律效果同上，即“只有一个中国，台湾是中华民国的一部分，中华民国政府是代表中国的唯一合法主权政府。”
010.1999年12月14日.txt	13	25-25	9	过去|后来|问|他说|死|写信	6.在1988年我回台湾想翻案时蒋经国已死，美国总统布什刚当选。一位美国教授要同我谈这件事，我把Freeman给沈君山的信给他看，他说这是一封假信，没有日期，沈君山的名字是贴上去的，除非是白痴，皆可断定此信是假信，他说我可找一个我可信任而又有名声的科学家写信问Freeman，他一定会否认，则此事可解，我问他是否CIA，他说是。1989年我再到Caltech见Schomaker，他只说这是Szymanski做的，当时他失业。他讲这两句话不再提了。我回台湾后，在1972到1976年的Chemical Abstract中找到Szymanski曾与刘兆玄合作的论文，又在清大教授著作集内，刘兆玄（时兼理学院院长）也有与Szymanski合作论文之记录（附件六），所以这封假信是刘兆玄用钱（当然是公款）由Szymanski处得到。只是不知Freeman是写给何人，后来把沈君山的名字贴上去，再把日期涂去，就是现在的样子（附件七），此信由美国法院转给我。刘兆玄在我解聘之后，任化学系主任，把李卓皓的第二封毁谤信件印了数百份，在化学系办公室门外散发给来往学生，当时何世延教授看不过去，把还没有发完的文件收了回来，并告诉李曾遹教授，他告诉我才知道。
014.1999年12月20日.txt	12	23-23	9	有一个	英文有一个形容词叫pubic，是“阴部的”“阴毛的”的意思，例如 the pubic region，就是“阴部”的意思。英文又有一个形容词叫 public，是“大众的”“公开的”“为人民的”的意思，例如 a public man，就是“政府官员”的意思。把 pubic与 public两相比较，只为一个L字母的有无，完全有了不同的含义。
024.2000年1月3日.txt	18	35-35	9	有一个	我觉得很奇怪，中国大陆有一个马蜂窝几乎没有人去捅。那就是中共的“四个坚持”（我记得不是很清楚，像“社会主义路线”、“毛泽东思想”、“无产阶级专政”，这些都无关痛痒），最重要的就是“共产党领导”。这就是虎头蜂窝，为什么共产党要坚持“共产党领导”呢？那有人可以“坚持用朋驰”、“坚持吃鱼翅”、“坚持住花园洋房”、“坚持睡电影明星”的呢？特权怎么可以坚持呢？底下就不用我多说了。
026.2000年1月5日.txt	5	9-9	9	故事|后来|皇帝	今天的题目比较温和，适合花莲的人文气候，题目就是“从莲花中看花莲”。为什么提到莲花？因为莲花在中国的经典和佛教的佛经里面有重要的意义，它代表佛教的创办人释迦牟尼的故事，释迦牟尼出生时，他的母亲在花园中看见一朵莲花开了，这莲花大的像皇帝所乘车的车盖，后来母亲回到宫中，梦见一头象，生下了释迦牟尼。释迦牟尼在传统的说法本身就是菩萨，他长大后，面对印度的婆罗门教，婆罗门教的特色就是相信神，而且是很多神，释迦牟尼在树下经过深思长考，在研究和判断后，他决定创办佛教。
028.2000年1月7日.txt	9	17-17	9	我讲	然后大家谈话很愉快，有人向我抗议说你为什么说新党是“烂香瓜”。我说当时的情况你们不了解，他们说李敖是投机分子。如果我要投机，台湾流行的是“西瓜靠大边”，那我应该去靠“西瓜”去，怎么会靠新党一个“香瓜”呢？新党是“小的、烂的香瓜”。他们说那烂的呢？我说“烂的”是因为我讲话较夸大，所以加个“烂”字。我愿意把“烂”字收回。
029.2000年1月10日.txt	17	33-33	9	例子	我举这个例子呀！证明我们太天真了，我们这种反共的方法，躲避危难的方法，保护台湾的方法都太天真了。所以我们进一步要研究怎样才是不天真的方法呢？今天我们又苦恼，什么苦恼呢？我今天一开始就谈出来：“一国两制”，结果闯了大祸。我的好朋友李庆华知道我闯了祸，就跟我解释，一国两制，这个“国”就是“中华民国”，我公开否认我这个国不是中华民国。是什么呢？
032.2000年1月13日.txt	8	15-15	9	故事|过去|当年	进入到今天的主题，在我住处楼下有一位管理员，他在开放探亲后回到大陆家乡，见到了前妻和女儿，还拿出身份证告诉前妻他的配偶栏还是空的，意思是离开大陆后他一直未结婚，虽然前妻已在大陆结婚了，但他不怪她，还感谢她把女儿带大，并送二百五十万台币给她们，自己只留五十万养老。回到台湾后，这位老士官长精神变坏了，生病住进了荣总，他四十年来追求团圆的梦，在去一趟大陆后，梦碎了，他被过去的梦骗了自己，他应该知道四十年后，物是人都非了。1948年我们全家离开北京到上海，来到了台湾，父亲去世了，姐妹弟弟们移民到国外，几十年后母亲回到北京老家中，只有她一人回去，又见到当年老家现在成为十户人家同住的大杂院，里面又脏乱又臭，母亲伤感觉得怎么会这样。上面讲的故事中，是谁骗了他们？是他们一厢情愿对时间、空间错误的感觉骗了他们。
033.2000年1月14日.txt	10	19-19	9	故事|过去|最后	真正的爱情一定要限时拆伙，讲好了两人恋爱三个月，时间到了就一定要分开，大家会认为太机械了，但只有这种方式，你才会觉得快乐是指日可数的，就会珍惜每一天的爱情，就像我常讲我所喜欢《甜蜜的十一月》这本书的故事，书中女主角最后仍选择了面对现实，才能永远保持甜蜜的回忆。大家常觉得找到另一半是件不容易的事，所以就会相互纠缠，最后造成一些悲剧的发生。我认为当你失掉女朋友或男朋友时，只要一去想就不会停止的，因此任何内省的修炼方式（包括写日记）都应该要排除，懂得爱情的人，在失去另一半时，可以把他视为是一个离开你的苹果，光老想苹果是没用的，唯一的方法是找出香蕉来取代这个苹果，而不是靠个人的意志力来抑制这个苹果，所以我赞成一个人有另一半时，不妨考虑设定谁是你的下一位的男朋友或女朋友，讲起来好象不是很真诚，但错了，真正的男欢女爱的确有很多不诚实的一面，有时不诚实对本身没有妨碍，诚实反倒是种错误，很多人会把过去一笔帐全说出来，这不一定正确。男女间有很多隐含的技巧是很重要的，可是有许多人不知道，最后反而把爱情搞得一蹋糊涂，最主要的一个原因是，我过去写的一些书被查禁了，所以年轻朋友看不到我的一些绝学、想法和智慧，看到的都是琼瑶、三毛类的书，给了你们错误的爱情观，把快乐的男欢女爱搞成一把眼泪、一把鼻涕的痛苦，输入给你们的都是连续剧式爱情观，会害了你们，希望大家今夜听了我的讲演后要修正。
033.2000年1月14日.txt	16	31-31	9	过去|当年|问|答	我在1949年5月间到台湾，五十年都没离开这里，我亲眼看到台湾五十年来的每个变化，台湾所谓言论自由的成长，经过了漫长的一条路。过去和我一同坐牢叫傅积宽（阳明山中山楼设计师修泽兰的先生）的人，只因在元旦时，和他站在总统府前的朋友，问他敢不敢在喊口号时喊自己的名字万岁，结果被太阳晒昏的傅积宽，真的喊出“傅积宽万岁”，而在当晚被抓入狱判了五年。在当年狱中放封时，新来的囚犯都会向班长抱怨自己的冤枉，班长问一个人被判了几年，他回答十年，班长就说“一点都没罪的判五年，你判了十年多少都有罪，你一点都不冤枉”。各位想想，我们是在那个时代一路走来的，所以今天可清楚看到什么叫言论自由。
033.2000年1月14日.txt	24	47-47	9	例子	表达的原则是要用具体表达抽象，若能表达成功就是好的文字表达者，如用红颜、白发表达女孩子和老头子就是例子。当初修泽兰在盖花园新城时，要我送给她一个广告词，当时我就送了“不是花园在你家里，是你家在花园里”，这种表达方式，除了李敖，谁能写得出来呢？你们会笑我倚老卖老，我的第一本书《传统下的独白》被查禁了，在我出狱后将书名改为《独白下的传统》，原因是书名翻身了，我还未翻身，当时我还为这本书写了一句“五十年来和五百年内，中国人写白话文的前三名是李敖、李敖、李敖”的广告词，一般人会说“我最好”，但我是用这种排名方式，用三次李敖来突显我的最好。“春风又绿江南岸”“莫等闲白了少年头”这个绿字、白字用得好的原因是用了形容词来当动词，好的中文一定要千锤百炼，文字技巧一定要训练，我文章好的原因，是写完后自己要大声念出，念得顺、念得铿锵有力，使它变成讲演稿，这种文章才是好文章。
034.2000年1月17日.txt	6	11-11	9	有一个	三、或谓“台湾已是一个主权独立的国家”。但是，“台湾”只是一个地名，历史上虽有过几个月以唐景崧为总统的“台湾民主国”，不过今天世上并没有一个以台湾为名的国家，也没有一个以台湾为疆域的宪法所成立的政府。当然在国际上就不会有承认这样一个以台湾为国家的国家和国际组织了。这样主张“台湾已是一个主权独立的国家”，连倡议台湾独立的建国党都不承认，又能得到谁的承认呢？“台湾已是一个主权独立的国家”，只不过是意图台湾独立 ，又独立不了的一些分离主义政客的自慰之辞罢了。
036.2000年1月19日.txt	5	9-9	9	有一个|当年|施性忠	施性忠当年是为新竹打拼的优秀市长，可是他却以贪污一千零三元的罪名被关起来，当时他的顶头上司是省主席李登辉，眼睁睁让他冤枉关起来，幸好施夫人庄姬美女士代夫出征，当上省议员讨回了很多公道，而在施要出狱时，民进党弟兄就决议防止他加入民进党，他们深怕施会把民进党的资源抢走，事实上民进党当时根本没有资源，而原有的资源本来就是施性忠的，全世界没有一个党不欢迎特定人士加入，我们看到施在突破国民党白色恐怖时建造的资源，到今天全部被民进党接收了，在施做商业活动时还被打压，造成了今日施性忠要告民进党市长蔡仁坚的原因。
036.2000年1月19日.txt	9	17-17	9	后来|问|拒绝|骂	阿扁最近写了一本《台湾之子》的书，我也想写一本《台湾之父》的书（语毕全场大笑），这本《台湾之子》一开始就是谎话，因为在王永庆糊里糊涂写的序中有一段话：“……陈水扁因此成为政治犯坐过牢”，在此我必须向大家澄清，当我们坐十年、八年牢时，陈水扁是坐了八个月的牢，可是他不是政治犯，是因诽谤和司法案件（蓬莱案件）坐的牢。阿扁最早的客户是长荣集团的张荣发，他骂人无数但从来就不骂张荣发，以前别人当立委时，请一、两位助理就已吃不消，可是阿扁那时请了十七位助理，因为他有财团的秘密支持，也形成之后的福尔摩沙基金会，他利用此基金会Ａ了别人好多钱，做了许多别人不知道的事。阿扁的书中还说：“1985年1月28日，我宣布拒绝上诉，以抗议司法不公，并随时准备入狱”，而他是在1986年6月10日入狱的，书中竟写出“我判了有期徒刑一年，1987年2月10日出狱”，请问在86年6月入狱，若判一年的话，怎么可能在87年2月就出狱，少了四个月刑期，原来是他妻子吴淑珍后来帮他秘密上诉，法院才改判成八个月。在刑事诉讼法中妻子是可以代表先生上诉的，可是按照立法的原意，是不能违背当事人公然明确表示的意愿，当阿扁宣布不上诉后就跑去美国，由妻子出面帮他上诉，这种人是里子面子都要，又要做英雄又怕坐牢，现在又要写书来骗大家，大家或许会觉得这本书很好看，可是我觉得是一本谎话大全。说粗糙的谎话来把别人当成傻瓜是不可以的，英国巴克洛说：“我不恨你对我说谎话，可是我恨你对我说粗糙的谎话”，所以你们可以说谎话，可是说粗糙的谎话是过不了李敖这一关的，我认为陈水扁这本书要好好检讨，把这些牛头不对马嘴的捏造部分彻底澄清，这样才配做“台湾之子”，否则就是一位“台湾说谎者”。
036.2000年1月19日.txt	12	23-23	9	问|她说|杀|死	日本时代台湾妇女被迫做慰安妇，受到的屈辱和不公平待遇，在今天的日本教科书中都提到这段历史如何的不人道，台湾的教科书（李登辉的认识台湾教科书）却提都不提。我们可以看到今天将历史真相抹杀的这些人都在台面上，他们都怕我怕得要死，记得几年前我走在台北市东丰街和大安路路口，忽然身边停了一辆轿车，车门一开陈菊出现了，她说：“李大哥，我们好久不见了。”我问她“你现在作官作的好吗？”她说完“还好，还好”后就上车跑掉了。今天台湾有些人所谓的“有情有义”，他们的情和义却像盘子一样那么浅，是“浅盘”的，今天台湾的情义，尤其是对我所接触的一些民进党政治人物而言，他们的情义是非常浅盘的。
039.2000年1月24日.txt	21	41-41	9	过去|最后|杀|死	这一次我们充分看到国民党心态的遗传，台独的基本教义派说“我们打到底”，王建煊说“共存亡”，可是我认为像李登辉这种讲出狠话的人，在兵临城下的时候，最后终会跑掉的，王建煊可能会留下来共存亡。但是古代的标准真的是共存亡，陈后主在最后守不了南京的时候留下来殉国，明思宗也是可以跑而没有跑，自己在煤山自杀。台湾这些人哪一个会死，我一点都看不出来，最后都会跑掉的。像彭明敏这种人都要选总统了，外国国籍还不肯丢，这是什么心态？绝对不可以的。过去流亡时有外国护照我们可以理解，可是现在要回国选总统了，还闷不吭声，真不知道是什么意思？
044.2000年1月31日.txt	31	61-61	9	有一个|过去|当年	过去在国民党一党独大之下，我们受尽迫害，全台湾的共同希望是真正民主政治，要有一个健全的反对党；所以当反对党出现时，我们希望它是民主国家的反对党，而不是独裁国家的形式反对党，民进党党纲应该跟美国政党学，可是民进党一成立的时候，就学国民党，变成一个具体而微小型的国民党。看看谢长廷，当年所写的书“党外党”，就是我们所宣传的要做柔性政党，而不是刚性政党，他追随我李敖，写这本书来支持这种民主政党的理论；可是当他们一有机会组织民进党时，立刻把这书的内容全忘掉了，组成一个小型的国民党。
003.1999年12月3日.txt	3	5-5	8	问|答|他说	“日本经济新闻社”编集局委员山本勋昨天下午到我书房来访问我，他说：“你李先生主张‘一国两制’的五十年不变理论，可曾想到一旦与中华人民共和国签了字，五十年下来，你们台湾会被拖垮了？”我答他道：“一八九五年马关条约中国和你们日本也签了字，可是五十年下来，你们日本被台湾拖垮了，你想得到吗？五十年太长了，有许多意想不到的变化和机会，为什么一定要从吃亏方面低估自己呢？”
004.1999年12月6日.txt	5	9-9	8	当年|问|杀	这种抬高自己、斗臭宋楚瑜的不正确手段，积极表现在两个“总归户”的现象上，第一，台湾的政治犯案件中，官方承认的至少有两万九千四百零七件，但是今天却总归户到“美丽岛案”单一案子上，而置其它两万九千四百零六件政治案于不问。并且，尤其不正确的是，“美丽岛案”的总归户，竟不归户到被告身上，反倒归户到律师头上，这太荒谬了，所以我们每天看到的，竟是“美丽岛案”律师们的作秀招摇（如陈水扁、苏贞昌、谢长廷、张俊雄、尤清、郭吉仁等等），反倒忽略了真正受苦受难打拼坐牢的被告，这是不对的。第二、当年打压言论自由的，陈水扁既认定宋楚瑜是“共谋”和“从犯”，如今却由包括他自己在内的“美丽岛律师团”，联合“炮轰杀手宋”，而把一切罪状“总归户”到宋楚瑜一个人的头上，这种干法，也是不对的。中国历史有“天下之恶皆归之”的干法，这回“美丽岛律师团”可真得到大中国斗臭文化的真传了。但这样搞法，是搞选举，不是发掘真相，不但宋楚瑜会不服气，连阿扁口中“资料搜集功夫世界一流”的李敖也会不以为然也。我李敖赞成打击敌人，但歪曲真相的方法打击敌人是不可以的。（1999/12/6）
005.1999年12月7日.txt	21	41-41	8	当年|问|答	答：做为中国的一省或一部分，台湾根本没有退出过联合国，也就不存在“加入”的问题了。至于联合国的中国代表团内，台湾地区想要有人参与，这个可与中共谈判。换句话说，想要参与联合国，必须先参与中国。根据民国初年南北洋政府共组国联代表团的先例，两岸也可共组联合国的中国代表团——这对“中华民国”并不吃亏，因为联大中国的国号还叫“Republic of China”，就是中华民国的英译名称。其次，与中共有邦交的160个国家都可以在台北设立总领事（这也比照当年承认北洋政府的国家可在广州设立总领事馆的先例），台湾不但参与联合国，还立即有双边外交关系。
008.1999年12月10日.txt	7	13-13	8	问|拒绝|骂	被国民党政府冠以“台独分子”，为台湾人坐牢多年的外省人李敖，十多年前，曾为追求二二八真相，编著了《二二八研究》、《二二八研究续集》、《二二八研究三集》三部书。出版以后，台湾人中的偏执狂分子打电话到出版社，大骂“干你娘”；而外省籍的老兵型的书摊老板也拒绝销售，理由是李敖替台湾人讲话，“二二八的书我们不要卖！”有人问我，说你不接生人电话，怎么会干到你的娘？我说我娘八十岁了，有什么好干？但干接电话的职员的娘，我也感同身受。这些没水准没格调的台湾人中的褊狭分子，这样没有是非，又与下三滥的外省人国民党何异？他们青出于蓝，国民党比他们恐怕还文明一点呢！
009.1999年12月13日.txt	7	13-13	8	最后|问|皇帝	李登辉有一句口号，谈到三个境界，就是“立足台湾，胸怀大陆，放眼世界”，这三个境界，第一境界“立足”是两脚的问题，第二、第三境界“胸怀”和“放眼”是两眼的问题。“立足”是现实的问题，“胸怀”和“放眼”是视野的问题。李登辉对他这句口号，执政十一年来，却反其道而行，他干的事，却是使台湾人的“胸怀”和“放眼”都向“立足”方向看齐，也就是把“胸怀大陆”和“放眼世界”都向“立足台湾”看齐，结果第二、第三境界的发展惨不忍睹，第一境界倒是欣欣向台，最后台湾的发展是“关门做皇帝式”的、“本土至上的”、内聚式的，而不是有“胸怀”、能“放眼”的外散式的，格局越来越小，只能“闭门放大”而不能“开门扩大”，小格局表现在教育上面，种瓜得瓜、种豆得豆，自然使下一代又瓜又豆，也小格局或更小格局了，教育出来的是一批批没有“胸怀”不能“放眼”小器八拉的下一代，这当然是教育的失败。今天大家眼里只有台湾，对外面的大陆和外面的世界看法偏差兴趣有限，就是小格局教育的必然结果。
