file	paragraph	line_start	line_end	char_count	score	snippet
005.给黄少谷先生的公开信.txt	8	15	15	149	3	为了避免重新陷入这种抽象错误，我建议少谷先生：你愿不愿意举一些实例来给法官“机会教育”，从一些实例的活证向法官显示不能“断”的是什么“章”、不能“取”的是什么“义”、不能“推测”的是什么“词”，这样的具体展示，聪明如少谷先生，必然知道它的效果，当远在空洞的“订颁注意事项”之上，因为它有“可读性”。
005.给黄少谷先生的公开信.txt	11	21	21	162	3	台湾高等法院林晃、黄剑青、顾锦才三推事，于1981年6月17日，撤销台北地方法院庭长陈联欢对李敖无罪的判决，改判李敖“有期徒刑陆月”，“有罪部分”理由共五点，不但“足生影响于判决之重要证据漏未审酌”，而且显有违法失职之处，除移请监察院调查并依《监察法》第14条“急速救济”外，林晃、黄剑青、顾锦才三推事的错误判决，分列如下：
005.给黄少谷先生的公开信.txt	24	47	47	674	3	何况这一估计，萧孟能自己就有六文件把它否定：第一、萧孟能亲笔“损益表”中，明列“中国合成橡胶股份有限公司”股金“原值”二十五万，“预估现值”仍是五十万（附证六）！第二、萧孟能“陈明事实状”和“上诉理由状”中，明说：“股金共计二十五万元，自诉人于民国六十七年（1978）间因经济拮据，拟以五十万元转让，讵该公司仅愿出三十万元。”纵萧孟能所说该公司愿出的数额属实，...
005.给黄少谷先生的公开信.txt	27	53	53	263	3	高院三推事判决既说周其新支票李敖“于原审辩称是自诉人向其贴现，并以书明贴现之旨之字据一张为证（上第四十七号证）”，则知李敖所说贴现与字据为同时提出，字据上明写给李放收执，李敖与李放是兄弟，李敖不会错认李放二字，李敖提出此一文件，又何须如高院三推事所说“李敖乃于本院改称是先向李放贴现”？既在原审说贴现与提出字据为同时，李敖又何能同时向原审提出错认李放的字据？又...
005.给黄少谷先生的公开信.txt	29	57	57	389	3	高院三推事据不起诉处分书说李放说支票是“欠装潢费而给付”，再说：“且依李敖所记载自诉人之账册上已有李放装潢费之支出却无收入一百三十万元之账项。”高院三推事却没弄清：李敖所记载账册上的支出，根本不是“李放装潢费之支出”！甚至根本不是“装潢费之支出”！账册上明明记载着“清理工程款”“工程款”“水配管”“电路恢复及新设”“阳台清理”“瓦斯管工程”，这些是粗工程，与...
005.给黄少谷先生的公开信.txt	36	71	71	357	3	高院三推事说：“自诉人复因委任被告处理一切事务而于备忘录中列入该支票款（上52号证第2页）。是贴现或给付装潢费之说固非实在。”这是又一次代萧孟能造证据！因为所谓“委任被告处理一切事务”，必须以双方认同的委任项目为根据，不能捏造没有的委任。萧孟能与李敖之间的委任，共十六件，计授权书十五件、协议书一件，全部信托二十三项，为萧孟能书面提出，为李敖所是认，但其中并无...
005.给黄少谷先生的公开信.txt	51	101	101	272	3	高院三推事提出背书问题与李放贴现能力问题，经李放庭证并提出“李放证词”附卷（附证十五），高院三推事漏未审酌。“李放证词”中提出二文件，证明萧孟能“先后所辩，已有不符”，但高院三推事对萧孟能却不用同一标准，反而认为李放太穷，没有贴现能力。经李放提出证人沈素芬，是宁诚企业有限公司（成衣纺织进口车）专员、福特六和汽车经销商、大耀汽车股份有限公司专员，她父亲也是商场...
005.给黄少谷先生的公开信.txt	62	123	123	401	4	高院三推事说：“李敖既受托处理该事，本应依约俟出卖人魏锦水涂销抵押权登记后再行付款。”也不能成立，理由原审判李敖无罪，已说得明白：“被告嗣接魏锦水致王剑芬之存证信函，限五日内将尾款直接偿还银行，领取权状办理移转手续，否则该屋如经银行申请拍卖，其一切损失概不负责。处此情境，被告为保全王剑芬之权益，乃于1979年12月28日先行垫付五十五万元。”足见这种先行垫付...
005.给黄少谷先生的公开信.txt	65	129	129	146	3	可见真相所在。魏锦水存证信最后明示“本件副本送达贷款银行”，魏锦水欠银行债务，并非五十五万，而是八十万（附证二十二），若如高院三推事所说“无受拍卖之虞”，或如萧孟能所说“倘遭银行拍卖，一切损失应由魏锦水负责”，是不了解实际情况与善良管理人之注意。以上证据高院三推事都“漏未审酌”，这叫公正吗？
005.给黄少谷先生的公开信.txt	67	133	133	237	4	高院三推事说：“原不发生移转所有权以保产权之问题。”但魏锦水来信如此，他和银行关系如彼，他在庭证中又说明“必须还了银行的钱，才可以办过户”，因为权状在银行手中，不“移转所有权”，试问如何解决问题？不解决吗？那李敖是否有背信之虞？因为萧孟能已授权李敖卖掉这房子，但不“移转所有权”（即所有权仍在魏錦水名下），能够卖吗？设定在银行手中，房子在魏锦水手中，土地在王剑...
005.给黄少谷先生的公开信.txt	69	137	137	228	3	地院判决书只说“胡因子”，是对的，高院三推事却说“将其移转登记与其配偶胡因子”，是大错特错的：“移转登记”是1980年1月10日，胡因子成为“配偶”是1980年5月6日，李敖实在不明白为什么高院三推事硬使她提前近四个月结婚！高院三推事这种判决书上的措词，未免太不负责任！不但与事实不符，并且造成“李敖把房子给了老婆”的印象，这种伏笔，才引伸出采信胡因子致王剑芬...
005.给黄少谷先生的公开信.txt	81	161	161	333	3	原来高院三推事抛开了萧孟能亲签亲笔的授权书协议书（这些都是经过李敖认同的文件），另外采信了萧孟能提出所谓“证物五十二：自诉人于出国前交付被告之亲笔‘备忘录’”，这一“备忘录”，其实并没给李敖。所谓“备忘录”，是他捏造的证据。既然没给李敖，李敖自不认同，但对萧孟能说来，他却必得对“备忘录”的内容负责。所以可据“备忘录”要求写它的人，而不能据“备忘录”要求根本没...
005.给黄少谷先生的公开信.txt	82	163	163	252	4	高院三推事为什么不查查，其实栽证还不止于“备忘录”呢！还不止于“一百二十万之指示”呢！还有个一百三十万呢！萧孟能在“言词辩论意旨状”中说：“自诉人于备忘录中曾向被告交代天母静庐房屋之售价，不得低于一百二十万元，复于六十八年（1979）12月18日以信函一纸，向被告表示售价不得低于一百三十万元。”这封南美寄的信，同样是他捏造的证据，并没寄给李敖。这封捏造的信，...
005.给黄少谷先生的公开信.txt	98	195	195	361	3	查银行作业，设定的清偿期都不妨长，华南银行与魏锦水就长达三十年，但这绝非说三十年内，因“尚未到清偿期”，就“无受拍卖之虞”！那样的话，银行岂不赔光？所以，银行作业，一定在设定时间内，另订单项清偿日期，叫借方开立票据或借据，以票据或借据上日期为清偿日期，届时追回或转期。华南银行与魏锦水的作业，也不例外。设定虽为三十年，魏锦水的另立借据上清偿日却是1979年6月...
005.给黄少谷先生的公开信.txt	100	199	199	331	3	总结所谓“天母一路房屋”侵占案，李敖并不构成“意图为自己或第三人不法之所有，而侵占自己持有他人之物”的要件。李敖要侵占，为什么给王剑芬存证信请她选（附证三十二）？地院判决说得好：“自诉人既不表示对其有利之选择，何能责被告违背处理事务之行为。”正是指此。高院三推事明明看到“天母一路房屋”至今尚在萧孟能王剑芬名下、使用下、占有下、支配下……却反过头来，不顾念李敖...
005.给黄少谷先生的公开信.txt	104	207	207	279	3	高院三推事这种推理是错误的。李敖提出的“抵债之账单”是萧孟能亲迹（附证三十三），上有亲笔“债权人”名单，包括潘有光、张桂贞、陈子和、陈万枝、罗老传、钱翊平、沈善庆、张陈秋子、徐敬业、叶北泉、李敖、黄盛桐、高家齐、黄觉、朱婉馨、许家骥、陈锡敏、袁应环、胡汝森、其他等二十一人，其中有建筑家、艺术家、出版家等知名之士，有的也没借据，是否也都要如高院三推事所说：“应...
005.给黄少谷先生的公开信.txt	105	209	209	120	3	高院三推事说“应有借据证明其有债权”，但是萧孟能既然最后以字画、古玩、书籍抵债，原来的借据自然就已返还债务人，高院三推事责怪李敖提不出，试问李敖若提得出，岂不变成了一债两还了？难道高院三推事要李敖同意字画等抵债、又要扣留债务凭证吗？此其二。
005.给黄少谷先生的公开信.txt	108	215	215	120	5	文星时期李敖为萧孟能卖命，萧孟能欠李敖实多，最后同意送李敖水晶大厦八楼房子，不料房未落成李敖就入狱，萧孟能遂食言，不送了，说“便宜”卖给李敖，作价壹佰贰拾万伍仟，有公证书可按（附证三十五）。事后查出售价表，一块钱也没“便宜”（附证三十六）。
005.给黄少谷先生的公开信.txt	109	217	217	130	3	李敖出狱后，萧孟能因经营水晶大厦不善，向李敖借钱不还，为表示补偿李敖因文星而蒙的损失，重践萧孟能送水晶大厦房子的宿诺，弥补李敖坐牢时萧孟能的无情无信，偿还萧孟能对李敖的钱债义债，乃同意以水晶大厦房子作为部分抵偿，遂有萧孟能亲笔书明以房抵债文件（见附证三十三）：
005.给黄少谷先生的公开信.txt	113	225	225	94	3	不料萧孟能以1-128、1-129为空屋，易于别作处理，反悔以1-108、1-109代替，1-108、1-109用郑锡华名义置产，由叶公超租赁使用，萧孟能乃有亲笔文件如下（见附证三十七）：
005.给黄少谷先生的公开信.txt	117	233	233	103	3	不料萧孟能又节外生枝，反悔以1-124、1-125、1-126代替，1-124、1-125、1-126用叶肇模名义置产，尚未装修，李敖只好接受“孟能三迁”，此事有台北市税捐稽征处通知书为证（见附证三十七）。
005.给黄少谷先生的公开信.txt	122	243	243	219	4	不料萧孟能告李敖，竟说“于被告坐牢期间，自诉人亦常惦念，并赠送水晶大厦八楼之房子，供被告收益”（上诉理由状），公然抹杀公证书的“买卖”行为！高院三推事公然也连公证书都“漏未审酌”，连上述“区公所监证申报书”“同意书”“税捐稽征处通知书”等都“漏未审酌”，竟说“李敖之债权业经清偿”，有“账册影本可凭”！高院三推事究竟根据什么，硬定萧孟能对李敖的债务，只有“账册...
005.给黄少谷先生的公开信.txt	124	247	247	235	3	高院三推事又说张桂贞的庭证“已难置信”，因为张桂贞“或谓借自诉人之款系伊所有，或谓系其子李敖之钱以其名义借与自诉人故其不知等语”。但查笔录，张桂贞并没有“款系伊所有”的话，而是说“钱是我女儿给我的”“钱是李敖的”。张桂贞有子女八人，受子女奉养，钱的来源不自一处，自属事理之常，有何“已难置信”？张桂贞古稀之年，生平怕法院，当庭高院推事要李敖出庭，要隔离问，并违...
005.给黄少谷先生的公开信.txt	126	251	251	99	4	萧先生亲笔欠债表欠本人一百八十万，并非直接欠本人，但为欠李敖的“张桂贞”名下，自然不能说不是欠。萧先生欠李敖，本人在李敖为文星坐牢前，就听说萧先生答应送水晶大厦七十五坪房子，李敖入狱后，萧先生失信。
005.给黄少谷先生的公开信.txt	127	253	253	81	3	据本人所知，萧先生并未做上项赠送。当李敖坐牢期间，萧先生并未对本人及李敖的女儿有任何资助，萧先生说他并非“无情无信”，但有情有信的人，似乎不该这样（附证三十九）。
005.给黄少谷先生的公开信.txt	130	259	259	190	3	高院三推事说：“尤以被告主张抵偿之字画中，有自诉人之亡父萧同兹做寿时他人所送之条幅等如附表所列，依之情理，殊无用以抵债者，可证其所辩抵债之不实。”高院三推事这段判决冠以“尤以”二字，自然强调这一判决在经验法则上与论理法则上的完美，但是高院三推事为什么不查查卷？在卷中，就有李敖“第四次答辩——所谓‘字画、书籍、古董及家具’疑义部分”，其中说“萧孟能有‘以画抵债...
005.给黄少谷先生的公开信.txt	135	269	269	205	3	笔录俱在，可见“拿去抵债”属实。试问齐白石的画，画上有黄少谷题字“萧同兹吾兄主持中央社十五周年纪念”字样的，不叫纪念性条幅吗？怎么对林紫耀可以抵偿，对李敖就不可以了呢？高院三推事说：“依之情理，殊无用以抵债者”，殊不知“依之情理”，世界上并无“纪念性书画不可抵债说”；依之事实，“孝子萧孟能”也早已将“亡父萧同兹”的纪念条幅抵了又抵了。事证明确如此，高院三推事...
005.给黄少谷先生的公开信.txt	138	275	275	458	8	电话乃李敖所有，借给萧孟能在水晶大厦十二楼用，萧孟能竟说是他的。在“上诉理由状”中，又一再强调这具电话的申请书，是他“亲笔填写”，要求向电信局查卷。但法院向电信局调来原始申请书，却证明并非萧孟能亲笔填写，乃李敖弟弟李放所填写。萧孟能理屈，再主张李放是为他办事，电话是代他申请的，当时曾一次申请几个电话，又请法院向电信局调次一号电话即7085129号的申请书，如...
005.给黄少谷先生的公开信.txt	151	301	301	189	3	高院三推事说：“复据叶肇模于本院结证伊名义之电话属于自诉人属实。”所谓“伊名义”，自是“叶肇模”的名义。试问叶肇模说他名下的电话“属于自诉人”，这又证明了什么？这跟判李敖有罪有什么相干？高院三推事根据什么逻辑，就可把“李敖”代换成“叶肇模”？代换之后，就说李敖的电话也属于自诉人？高院三推事为什么不查查叶肇模与萧孟能的关系，是否相当于李敖与萧孟能的关系，就如此...
005.给黄少谷先生的公开信.txt	155	309	309	217	3	记得去年12月27日，报上登出周守男先生给你的公开信，信中指出“现行的司法制度不行”，“现在的司法官的能力学识与品德都不足”，甚至认为：“探讨那一股反政府势力存在的原因为何？吾人敢断言，这股潜在的势力，实在是大半被迫出来的。”你在周守男先生这封信后批示：“言之痛心，宜予重视，将该函印发参阅。”足见你是有雅量容纳批评的。我个人因为早已是“被迫出来的”“反政府势...
005.给黄少谷先生的公开信.txt	157	313	313	215	3	少谷先生：你一生亲历在新闻界、司法界的重责大任，见多识广，海内无出其右，看了上面的案子，比对一下你的前半生后半生，你又作何感想？四十三年前，你曾辞职以谢地方，表现了人所难能的风范；如今四十三年过去了，我盼你明定辞职的条件：如再不能解决“司法官的能力学识与品德都不足”的问题，你当再一次辞职以谢地方，再一次表现人所难能的风范。我是你们司法院的受害人，但我不愿做“...
006.殷海光·呆·鸟.txt	8	15	15	184	4	殷海光爱书成癖。有一次他看一本Aristotle的著作，他女儿殷文丽过来，他就教文丽念Aristotle这个字，没想到文丽正在换牙，没有门牙，念到totle, 口水应声而出，喷到书上，殷海光大叫：“哎哟！哎哟！”急忙掏手帕擦口水。你说多好笑呀！Aristotle是希腊的“荒谬”哲学家，他硬说女人的牙比男人少，殷海光至少这次该相信Aristotle，殷文丽也是...
006.殷海光·呆·鸟.txt	10	19	19	122	5	再谈书呆子殷海光。他一辈子只打过四次电话（至多四次），有一次他太太教他如何打，把他带到公用电话旁，替他把号码拨好，对方说话，才递给他。殷海光紧握听筒，满头大汗，打完了，要昏倒的样子。他太太赶忙抓住他，发现两手冰冷，两眼发直，好一阵子才恢复正常。
006.殷海光·呆·鸟.txt	11	21	21	365	8	再谈他的鲜事。有一天，他和政大的另一书呆夏道平教授，忽然要开洋荤，跑进观光饭店喝咖啡，咖啡厅在十二楼，他们就进入电梯，可是很久很久还不到，空气闷得难过。殷海光说：“这么久了，即使一百二十层也该到了。”于是紧张起来，还是夏道平聪明，他看电梯墙上有许多阿拉伯数字，就乱按了一个，门突然开了，原来还在一楼！两人得庆重生，吓得不敢再坐电梯，决定走楼梯上去。走到二楼，就...
006.殷海光·呆·鸟.txt	12	23	23	234	5	殷海光死后，我和王晓波、王小明、孟绝子一起去看解剖，出来老孟对我说：“你看到老殷那个鸟了吗？那么小！”我想，殷海光可能在这方面不行，他的婚姻情况，他的教棍太太，都该从这一不行上来观察。他服膺罗素，但罗素写的Marriage and Morals他绝口不提，这可真怪。写到这里，我忽然收到一封托我转给你的信，我把它贴在上面。圆环大流氓张武修，绰号梧州，因杀人被判...
007.环游·还原·抢.txt	4	7	7	85	3	早上在篮球场运动的时候，这边的“制服”跑来，说：“所长紧急通知，法务部次长到所里来了，想见见李先生。”我说：“可是，我不想见他啊！”我拒绝见这些讨厌鬼。我的架子大得要死。
007.环游·还原·抢.txt	5	9	9	257	12	收到你19号的平信，我一直窃笑——有一点恶作剧那样的笑。你说：“还以为你记忆力惊人呢！”难道不是吗？把明明记得住的故意装记不住，这种记忆力，难道不惊人吗？世间喜欢frame别人的，一旦被别人frame一下，就气起来了，就怪人家的记忆力了。我记得你不但哭过，并且还非常爱哭，是台湾话的爱哭妹（爱哭面），看到这里，你又怪我记错了吧？你看，说不哭也不行，说爱哭也不行...
007.环游·还原·抢.txt	6	11	11	176	3	我现在还做一些环游世界的准备工作，前几天Washington Catheddral的浮雕Ex Nihilo大大的吸引了我，秦始皇陵也一直使我兴致奇高。将来我要和女秘书天南地北，仔仔细细周游列国，“审视”木乃伊或秦始皇（但如宋局长不在，我可能“验尸”一下）。当然，如果有孟姜女在旁边哭的话，就另当别论，那就到长城去，完成丝路之旅，在焉支山脚，采小黄花……
007.环游·还原·抢.txt	7	13	13	306	3	希腊天文家说：世界经过一万六千年后必还原一次。所以，在环游世界一万六千年后，我们虽已归入尘土，仍可卷土重来，旧地重游。不过，这一定得先井然有序，搞不好的话，我们变成了Tutankhamen或秦始皇，而他们却变成了我们，如果那样，我们就该把图坦卡蒙关入土城看守所、把秦始皇关入秦城监狱，使他们不能进入时光隧道，这样的话，自然就是我们“审视”他们，而不是他们“审视...
007.环游·还原·抢.txt	9	17	17	400	4	云贵高原的狼，夜里在山路上吃行人方法是：从后面用它前脚搭在行人肩上，行人一回头，他就乘机从后面咬住脖子，所以行人都相告以在那种场合，不要回头，要先用匕首向后刺去。一般说来，一个人的双肩，如在背后被人按住，这时抵抗力最弱，台湾一个文人周弃子，专门向人借钱，方法就是先到你家，绝口不提钱，可是你一到厨房给他倒茶，他就乘机从后按你双肩，然后开口借钱，如此高段，人人无...
007.环游·还原·抢.txt	10	19	19	143	3	世界各地强盗抢钱，都抢钱就完了，不嗜杀人，但云贵地区，强盗却是先杀后抢。原因是这地区人太穷（“天无三日晴，地无三里平，人无三两银”），你抢他钱，他就跟你拼命，所以强盗都相告以干脆先杀了再说，免得麻烦。如果将来我们去做雌雄大盗，最好不要去云贵地区。结论是：不要在云贵地区作案，也不要做狼。
008.“既联合，又斗争”？.txt	4	7	7	109	3	关于台北看守所的黑幕，今天贵报登出我昨天出狱谈话的一部分，也登出看守所所长朱光军反驳我的谈话，说：“李敖是写文章的人，特别喜欢幻想，他所说的一切都是想象出来的。”既然朱光军这样精于心理分析，我只好公布我掌握的证据如下：
008.“既联合，又斗争”？.txt	6	11	11	318	10	二、其他凌虐人犯问题。朱光军说李聪明被打死“只是一个个案”，但事发之日，朱光军曾发表谈话坚决否认有被打死的可能，直到检察官收押了行凶的管理员，朱光军才哑口无言。如今他又说“一个个案”，但我试举一两天的打人记录，来证明朱光军的谈话又一次不可靠：去年10月1日一天内，他们就打了和二舍十一名人犯，名字是廖明胤、周扬传、郭进坪、苏照男、洪茂阳、刘耀雄、吴进清、萧阿成...
008.“既联合，又斗争”？.txt	7	13	13	301	6	三、病舍与医疗问题。朱光军说病舍并非只给有来头的人住，“住在病房中的受刑人，都有慢性病历可查。”但是李聪明暴毙后，去年9月28日死了毛松枫，今年1月14日死了张权，19日死了林志新。这些人都不住在病舍内，都在几小时内突然死了，这又怎样说呢？若说“有慢性病历可查”就能住病舍，林志新的肝病病历赫然在卷，这又怎样说呢？他六十一岁了，却不给住病舍而要他在福利社煎蛋，...
008.“既联合，又斗争”？.txt	17	33	33	248	10	（二）关于被打人犯的名单，朱光军也不争执，因为名单中都确有其人，不是“幻想”“想象”的，但他要我提出“他们是被哪一个管理员打的，他一定依法办理”。这是他明知故问。因为我明明举出日期与舍房编号，按照值勤表一查便知。为了帮他查证，我可举出10月1日打人事件发生，是课员黄铭强引起的。黄铭强在10月8日又引起打人事件，被打人犯是林荣宗，因为正值中午出庭回来，以致引起...
008.“既联合，又斗争”？.txt	18	35	35	352	3	（三）关于“绑担架”酷刑，我提出名单后，被绑人犯李文荣、古永城、杨英龙部分，朱光军也都默认，这是他聪明的地方，他没逼我指出他们是被谁绑的，因为我一指，被指的不是别人，就是朱光军——朱光军还没依法办人就得先依法办了自己！李文荣是朱光军开了三枪催泪瓦斯后，亲自拿把椅子，把李文荣抵在墙上，然后“绑担架”的。朱光军对我开的名单，四分之三都不争执，却争执四分之一——黄...
008.“既联合，又斗争”？.txt	19	37	37	438	5	（四）关于病舍与医疗，朱光军对我举出的许多人犯“突然死了”，不再争执，只说人犯“不说他自己有病，看守所就无法送他们到病舍就医”。这叫什么话？《羁押法施行细则》第7条明定入所时应实施健康检查，但该所医生金亚平从不检查，而是叫药剂生阙壮士和医务行政管理员尤大时负责，只是要人犯自报有无纹身和病历而已。但是自报病历后，若要住入病舍，没有来头，是很难的。这就说明了为什...
008.“既联合，又斗争”？.txt	20	39	39	111	3	（五）关于朱光军否认他公馆有高尔夫球试杆场设备，他说不会有，“这是一个常识问题”，但我请问，你朱光军月入两万元，你可以一小时两百元为子女请钢琴老师，你可以在一年以内，在景美、土城买两栋房子，这都是“常识问题”，你又怎么说？
008.“既联合，又斗争”？.txt	21	41	41	143	3	（六）关于拆二、三楼地板，朱光军说是为了修地板，但明明拆除后，改铺和水泥地一样凉的塑胶地砖了，难道铺上塑胶砖后，再加做地板吗？天下有这样的地板施工法吗？朱光军说：“希望李敖易地而处，多为他人设想。”他的指教，我很感谢，虽然我已领教了他的“易地而处”是什么了——原来是易地板而处水泥地啊！
