file	paragraph	line_start	line_end	char_count	score	snippet
005.人间何处有青天.txt	110	219	219	224	5	四天以后他们声请再审的状子，终于送进了法院。他们把“台湾高等法院收状证”送给了我，我手拿收状证，笑着对自己说：“这些可怜的、善良的中国百姓啊！十九年来，他们不断在人间找青天，可是人间何处有青天？最后，他们找上了我，把李敖看成青天，看成‘文化包青天’，也好，我就算青天吧！可惜我这青天是地下的、黑市的，也许有朝一日，我会从地下冒到天上、从黑市化成合法，但那一天到...
005.人间何处有青天.txt	137	273	273	140	3	四十五年五月一日，合营关系开始，但不久后武汉旅社即因其前身汀江旅社的债务问题，家具被查封，影响到旅社的信誉及营业。当姚嘉荐依约（合营契约第十一款有谓：“……汀江旅社……未完之权利义务……如累及本合约共同营业利益时，甲方应负损失赔偿之责。”）要求黄学文履行契约义务时，双方龃龉日甚。
005.人间何处有青天.txt	139	277	277	181	6	实际上，因为姚嘉荐在武汉旅社投下最后的一笔储蓄，他那时的焦虑心情是可想而知的。在命案发生前，姚嘉荐接受市警局督察员邵中毅查询时，曾说：“据黄学文自称：‘台北市警察与我均熟，你去告也没办法。’我曾去警务处刑警大队告黄学文，跑了两三次，到现在也没有结果，我实在没办法了。法院和警察都办不了，我只有到中山北路拦总统座车或自杀了。”那天是七月十六日，也就是他死前的两天...
005.人间何处有青天.txt	149	297	297	100	3	菲律宾有一家中文报纸刊载了姚嘉荐命案后，老总统看了立刻下条子，上面写着八个大字：“查明事实，从严侦办。”《五十四年第四次更审，陈思永审判长开庭时谈话）姚案被告听了，才知道他们的命运是冥冥中被安排好了。
005.人间何处有青天.txt	150	299	299	99	3	“我想调查局是误会了老总统的意思了，”何祚歆律师补充道，“他的意思是：先查明、后严办。而这个案子，就像我在出庭时常常强调的，根本是有严办而无查明，并且是不先查明就已经严办了！”（见前引，何祚歆谈话）
005.人间何处有青天.txt	156	311	311	227	4	那是民国四十八年十二月八日，大约十点钟左右，我已经快要睡觉了，突然有两个人跑进来，问说：你是什么人？叫什么名字？身分证拿出我看看！给他看了以后，他说，好，你到楼下来，那时武汉旅社门口已经摆了好几部车子，我一上车，眼睛就被蒙起来了，开、开，开了大约个把钟头，到了一个地方，我下车还是他们抱我下车的，进了屋子，蒙的布才拿开，调查局的专员王琪就问我，刚才在旅馆，你叫...
005.人间何处有青天.txt	157	313	313	150	5	我说你怎么打人呢？王琪说，我怎么不打人？你知道这是什么地方？这是司法行政部调查局。我说，这是调查局？我又不是共产党，我是恨共产党才到台湾来的。王琪说，你是杀人犯。我说我杀了谁了？他说姚嘉荐。我说，你们治安单位不是办了案，说是自杀的吗？他说不是，是你们杀的。我说，是我们杀的，凭你们说的就是我们杀的吗？
005.人间何处有青天.txt	159	317	317	144	6	那天晚上就有四个人，两人是打手，一人问，一人笔录。他问我姓名后，又问我有没有成家立业，我说，没有，我是阿兵哥来的。他问我，你们为什么参与杀人呢？我说，我怎么会参与杀人？姚嘉荐？姚嘉荐他不是自杀的吗？他说，不是你们谋杀的？我说，我们谋杀他干什么？好，从那时就开始用刑，打啦，开始都是用打的。
005.人间何处有青天.txt	164	327	327	109	4	我从八号被打到二十四号，为什么我知道是二十四号，那天他们休假，其中一人说，妈的个屄，游全球，就是为了你们，害得我们不能过Christmas。八号那天起，我几乎就没有睡过，他们四个人一组，六小时换一班，把我整得惨兮兮的。
005.人间何处有青天.txt	165	329	329	177	3	二十四号那天，他们突然说，你既然没杀人，可以交保，就叫来几个菜在里面吃，我因为十几天没睡，加上喝了点酒，被关在警卫室中，半躺半睡，感觉身体好像飘着一样，迷迷糊糊的，到了夜里一两点，又忽地把我摇醒，然后带我去看姚嘉荐尸体的幻灯片，跟我说姚嘉荐找我，我说，我又没做亏心事，为什么他要找我？他们要我跪下，我说，我为什么要跪他，他又不是我杀的，但他们还是逼我跪。
005.人间何处有青天.txt	168	335	335	135	3	移到看守所后，唐检察官来侦讯，我又说，报告检察官，我冤枉，调查局的王琪马上当着检察官揍我，而且破口大骂：他妈的王八蛋，叫你不要翻供你偏要翻供。我说我冤枉怎么不讲。王琪就跟唐检察官说，一切照以前写就是了，写完，他要我盖章，我不盖，他又打，说，你非盖不可。不得已，我只好盖。
005.人间何处有青天.txt	177	353	353	188	5	杨薰春是被告中唯一的女性，当年三十二岁，也逃不过打的份儿，打完就疲劳讯问，“我昏过去的时候，他们才让我休息，”她说，“他们告诉我，不写自白书就不能回去，我因为有六个孩子没人照顾，就答应写，可是我受日本教育，根本不大会中文，他们就答应写好给我抄，我前后抄了好几遍，都是他们拿回去开会，大概觉得不太对，又把旧的拿回来撕掉，给我新的抄。”（七十三年一月二十八日口头访...
005.人间何处有青天.txt	178	355	355	142	5	现年六十五岁的林祖簪，广东蕉岭人，也曾提到这么一段：“我一进去，他们就问我，林祖簪，姚嘉荐是怎么死的？我说，是自杀死的。王琪马上就对我拳打脚踢，骂我胡说八道。你想想，一进去，也没有案子，也没有问什么详细的东西，就动手打人，像江洋大盗一样。”（七十三年一月三十一日录音访问，林祖簪谈话）
005.人间何处有青天.txt	179	357	357	197	3	在刑讯黄学文时，更是“……将衣服脱光，逼跪碎石砖上，用劲不断鞭打，或将四肢绑于藤椅上，在手脚之十指叉中，插入笔杆竹根，紧扣手脚，痛彻肺腑，犹不释手，以致失却知觉，俨若死人者几次，在此几次中，均由调查局法医萧道应注射药剂，始复苏醒，后又继续其惨无人道之摧残，似此不断刑求之下，达二十天之久，再将全身绑于椅上，用强烈灯光对眼猛射……无所不用其极。”（四十九年六月十...
005.人间何处有青天.txt	182	363	363	125	5	如此痛苦，我想起在调查局被刑伤的事，有一杀千刀的打手，高痩个子，穿件海军夹克，操浙江口音，逼我在预先拟妥口供上加盖指纹，我不从，被殴，在一气之下，将口供撕掉。这时那打手过来，一手推我靠在墙上，照我胸部猛击数拳，并说：“你有种挨得下，数年后你就知道！”
005.人间何处有青天.txt	203	405	405	145	3	⑶调查局对姚尸鉴定书内曾谓：“先将姚尸仅有四十八CC之胃及十二指肠液合并作毒物之系统化验”，是则该四十八CC之胃及十二指肠液如确已合并作毒物系统化验后，当已无余液，而该鉴定书内检查巴拉松项内，又谓“姚尸之胃及十二指肠液内，并未发现有何巴拉松反应”，不知此项检验所需之胃液从何而来？不无疑窦。
005.人间何处有青天.txt	213	425	425	116	3	两位鉴定姚嘉荐死于巴拉松中毒的所谓“专家”，陈玉麟根本没有医学经验，且在法庭公然有“对于法医学我是外行”的自承；而萧道应虽是台北帝国大学医学部毕业，也担任过广东省陆军总医院医官，却有长时间在从事党工活动，没有受过一天正式的法医训练。
005.人间何处有青天.txt	218	435	435	138	3	陈华洲和黄学文同乡，是福建长汀人，当时五十四岁，任教于台大，是化工系系主任。陈华洲在庭上承认曾以农药巴拉松十余西西及橡胶手套两副，交给黄学文使用，黄学文说要拿去杀虫。陈华洲又说，黄学文离去时，还摇了摇药瓶说：“这个姚老头太可恶，一定要干掉他！”（四十九年三月四日，联合报三版）
005.人间何处有青天.txt	220	439	439	85	3	“陈华洲死的前一天，我去看他，”何祚歆律师说，“他还说，我这一辈子没看过巴拉松，没研究过巴拉松，没想到却被巴拉松害得那么苦！”（七十三年一月三十一日口头访问，何祚歆谈话）
005.人间何处有青天.txt	222	443	443	86	3	在调查局移送的黄学文口供中，有一段说：“陈华洲供给巴拉松农药时，曾嘱此农药有剧毒，使用时应戴手套，以免触及皮肤。”而事实上，巴拉松的原液根本不会刺激皮肤。（同前引，呼冤书）
005.人间何处有青天.txt	223	445	445	131	3	而且，萧道应法医对巴拉松有无反应所做的三种试验中（1.一般反应2.敏感反应3.迟钝反应），只有迟钝反应有“疑阳”（-+）反应。“法院以此为最后的审判证据，我认为太草率，”何祚歆律师表示，“从此以后，我再也不接任何刑事案子了，我对中国的法官失去了信心。”（同前引）
005.人间何处有青天.txt	256	511	511	108	4	关于五十一年的判决，还有一段插曲：有一天，姚案的整个案卷失踪了，法院找不到，等找到时，台湾卫生试验所的一份复核报告不见了。这份报告是有利于被告的，也是当年两份复核报告（另一份是台大农学院陈玉麟不利于被告的报告）之一。
005.人间何处有青天.txt	257	513	513	198	4	接着的两次更审都维持第一次更审的判决。在这期间，发生过一个小故事：八里乡血案（五十一年五月二十三日案发）的凶手李文修，在临刑前说：“报告检察官，姚嘉荐命案的被告是冤枉的，请你主持正义！”这段话成为李文修的遗言，他曾和游全球共囚一室，了解姚案的大部分案情，而听到这话的刘馨德，后来果真为七名被告提出自起诉以来第一次，也是唯一一次的有利上诉。（七十三年一月二十七日...
005.人间何处有青天.txt	260	519	519	134	4	在更五审判时，有一次开庭，王蔼云很生气，他对推事刘鸿儒说：“在我们这案中，检察官只是调查局的狗。”刘推事问：“你怎么骂人呢？”王蔼云反问：“为什么不可以？为什么只准冤枉人，不准骂人？”被告对冤狱的愤怒之情，已溢于言表。（七十三年一月二十七日、一月二十八日，王蔼云谈话）
005.人间何处有青天.txt	263	525	525	131	6	王蔼云曾向吕有文推事抱怨道：“我们在调查局时，就好像跟姚嘉荐打官司，在地方法院时，就好像跟调查局打官司，在高等法院时，就好像跟地方法院打官司。依据法律，侦查审判机关应该就对被告有利不利部分都加以调查，但我们一直受不利侦查和前审不利判决理由的影响，始终翻不了身。”
005.人间何处有青天.txt	264	527	527	109	3	吕有文推事回答道：“这是法律的漏洞，不是法院对你们有成见。”王蔼云反问说：“一审采独议制，如果法官疏忽，还说得过去。二审以后采合议制，三、四个法官，如果还疏忽，说法律有漏洞，我们的冤枉又怎么办？”（同前引，王蔼云谈话）
005.人间何处有青天.txt	269	537	537	143	5	黄学文得“反应性精神病”被保外就医前，曾在姚案的公开庭上，哭着向推事说：“请求庭上将没有传讯的证人再传，没有结果的鉴定再为鉴定，我实在以十二万分迫切期待的心情，诚恳的要求送往国外鉴定。为本案我含冤在押十载，诚天下之大不幸者，如今生不如死，请钧长审慎处理，以免含冤九泉。”（当庭泣不成声）
005.人间何处有青天.txt	270	539	539	149	4	以上是法院的正式纪录（五十九年三月二十日），这时黄学文几乎已达精神崩溃的边缘。结果呢？“由于中日断绝邦交，我大使馆将上项文件失落，致未能鉴定。”然后，判决书上又补了一句更荒谬的话：“现原鉴定书已遗失，中日又无邦交，而本案经再详查，事实已甚明了，自无再送国外鉴定之必要。”（同前引，五十九年更㈦判决）
005.人间何处有青天.txt	274	547	547	148	4	在这次审判期间，被告们曾恳求庭上，说他们被冤枉了十六年，希望庭上能勘酌证据，还他们清白。不料董国铨劈头就骂：“十几年有什么了不起，关三十年的还大有人在。”（七十三年一月二十六日，王蔼云谈话）而杨力行也说：“你们的口供已经把你们咬得死死的，你们还想怎么样？”（七十三年二月六日口头访问，王蔼云谈话）
005.人间何处有青天.txt	282	563	563	126	3	何祚歆律师也说：“我们当年几个义务律师如石美瑜、莫屏藩聚在一起，常感叹律师办这个案子，就好像和尚帮人念经超渡，经是念完了，但被告们能不能‘超渡’，完全看他们的运气了。”（七十三年一月三十一日口头访问，何祚歆谈话）由此话可看出律师面对司法不正义的无力感。
005.人间何处有青天.txt	283	565	565	125	3	事实上，姚嘉荐命案的民诉官司一直打到七十一年七月才完全终了。姚嘉荐的儿子姚志国在这件官司中，要求赔偿的金额包括殡仪费、奔丧交通费、精神抚慰金，共一百零五万二千八百八十四元二角二分，结果缠讼二十二年，因原告、被告屡传不到庭，承办推事依职权裁定撤回起诉。
005.人间何处有青天.txt	285	569	569	172	3	游全球虽然头发也已花白，但仍身材适中，精神矍铄，讲起话来，中气十足。七、八年来，他推销过报纸、开过餐厅，一直很坚强地活着。“你知道，我活着一天，叫我承认这罪，我很痛苦啊！我一度想自杀，却鼓不起勇气自杀，后来我只好鼓起勇气着，希望平反。可是平反哪里有那么容易呢？我不得不相信，中华民国司法，就是这样黑暗到底！”（七十三年一月二十七日，游全球谈话）
005.人间何处有青天.txt	286	571	571	113	7	五十六岁的杨熏春，老境甚佳，现在儿孙成群，不愁吃穿，但是她讲到这案子，也仍然唏嘘。她说：“我一辈子在跑法院、打官司，我真是怕了，唉，可是如果有平反的机会，我再怎样也得打官司打下去。”（七十三年一月二十八日口头访问，杨熏春谈话）
005.人间何处有青天.txt	287	573	573	98	4	在整个审判过程中表现得最冷静的王蔼云，出狱后做了一点生意，目前家境小康，他说：“我真正的感觉是，自从司马迁写《酷吏列传》以来，中国的司法好像没进步过。”（七十三年一月二十八日录音访问，王蔼云谈话）
005.人间何处有青天.txt	290	579	579	178	3	台北变了，台湾变了，这二十五年的经济成长、社会变迁、政治进步（或退步），一律和这些长期羁押的被告无关。他们只是“被告”罢了，由于不是在监执行，他们甚至不能下工厂工作；他们不事生产，每天“消费”看守所中的糟粕囚粮；他们接触不到什么人，时时打交道的，就是牢监、检察官、推事、律师……他们做些什么？写状子、写状子、写状子……；他们想些什么？上诉、上诉、上诉……。
005.人间何处有青天.txt	295	589	589	87	3	韩非子说：“法者，宪令著于官府，刑罚必于民心，赏存乎慎法，而罚加乎奸令者也。”三十年前轰动全台的大冤狱也许为人所淡忘，但是我们不会忘记，因为三十年间我们正生活在冤屈和苦痛中。
005.人间何处有青天.txt	303	605	605	465	6	姚嘉荐系于四十八年七月十八日凌晨四时许，旅客要求住旅馆时，旅客与服务生发现姚自缢身死在他房门框上，工友吴亮即来叫我说：老板，姚老先生自杀了。我立即穿上衣服下二楼，见姚吊死在门框上，即通知了派出所。派出所巡官任瑞迅速率领数警员到达维持现场，五分局刑警亦随即到达，我对巡警官说，我去通知姚股东庄立铭，吴亮去通知陈宗仁。我到庄家对庄说：前几天接到菲律宾法院判决，姚和...
005.人间何处有青天.txt	304	607	607	271	4	没想到陈在拿去信件等物之后，随即姚方向记者发表言论，大肆渲染说，姚经理嘉荐系归国投资华侨，被店主黄学文逼迫自杀。然后将旅社一部分房间贴上封条，在旅社客厅摆灵堂，并纠集数十流氓在旅社叫打连天，殴打三楼汀江公寓管理员游全球，深夜又唆使流氓鼓捣旅社门说，要找姚嘉荐。旅社服务生说姚老先生自杀了，接着说找黄学文，服务生没开门，流氓就丢石头，闹得鸡犬不宁，整个旅社被闹得...
005.人间何处有青天.txt	306	611	611	496	7	因陈监察委员我系在福建省主席戴仲玉家认识，所以我前往拜访他。他说，姚志国来我家拜访，根本没说后援会事，就将我名字登出来。刘戈青系在警务处我认识他，刘说：“姚志国以前我不认识，他来我家拜访没说什么；我曾任刑事警察总队长，政府依法鉴定自杀案件，我怎会同意出名悬赏缉拿凶手呢？我要登广告否认。”有的朋友替我出主意，请刘戈青登广告否认，广告费你出，将报纸剪下，向法院告...
005.人间何处有青天.txt	307	613	613	319	7	时经四个月又二十天，姚尸早经蔡炳福检察官签发收埋证交姚家属收埋，尸体亦早已腐烂，调查局却派员住进武汉旅社，深夜闹鬼，说姚嘉荐灵魂出现。那是我被捕之前一天。翌日晚十二时许，我夫妻与孩子正在熟睡中，调查局王琪率领数十便衣，包围汀江公寓，敲开我房门，数大汉冲进我卧房，如强盗般，将尚在吃奶的幼儿推开，将我夫妻蒙上青布绑架，孩子惊醒哭叫着。两汉挟一人，我们即被推上事先...
005.人间何处有青天.txt	309	617	617	85	3	我被蒙上青布挟上囚车，约一点钟，被推进刑房。一会儿，一点声音都没有，我被迫站了数个钟头，脚实在酸得厉害，就想坐地。膝盖正要弯下时，旁边打手上前就是一掌，嚷道：不要想坐下。
005.人间何处有青天.txt	310	619	619	145	7	一直站了八、九个小时，此时天已大亮，才将蒙在我头上的布拿开，随即你一拳他一脚一顿毒打，我拼命叫：这是什么机关，乱打人啦，救命啊！有一打手一边打一边说：小子昨夜我在武汉旅社住宿时，你上三楼在楼梯口边走边叫，不做亏心事怕什么，现在看你怕不怕。他们见我被打得无法站立快要倒地时才松手，接着问口供。
005.人间何处有青天.txt	312	623	623	672	9	问：你是共产党吗？答不是。问：共产党以前在你家乡（福建长汀）做匪窝，你的乡人许多在匪区做大官。答：我不知道。问：你知道在台湾长汀人哪几个是匪谍？答：不知道。问：你可以保证在台湾长汀人没有一个是匪谍吗？答：不能保证。问：那你就知道许多人是匪谍不愿讲，讲有功可抵罪啦！答：不知道，我没有罪，抵什么罪呢？问：长汀人匪谍傅美玉你认识吗？答：我认识。问：怎么认识的？答：...
005.人间何处有青天.txt	314	627	627	173	3	王琪率领数刑手来问了。首先进来的大汉面上有点小麻斑，穷凶极恶。一进刑房，王琪劈头就问：你以前在北提住过吗？答：我在七星警所所长任内住过北提。你叫黄舒文吗？答：不，我叫黄学文。王琪说：黄舒文和黄学文不是一样吗？通缉匪谍黄舒文住过北提，你也住过北提，你就是通缉匪谍。我不理睬他，如果和他这种违背人道办案的人抗辩，只有挨打。问毕，王琪及刑手一甩手走了。
005.人间何处有青天.txt	318	635	635	169	4	因我们无辜七人被打惨叫之声，会影响其他在押之人，且我们本没有杀人，当然不肯承认所以调查局没有打到迫供，就将我们押出原来关押的台北市三张犁调查局刑房，将我等再蒙上眼布，押到淡水河边一栋刑房拷打，此地邻居系锯木厂，有锯木声及河水动声。在此刑讯，惨叫之声外面根本听不到，所以刑手更是肆无忌惮，在这里所受刑求，现在想来亦毛发直竖，感觉到惊心动魄！
005.人间何处有青天.txt	322	643	643	113	3	地上排了许多碎石砖块，他们令我跪在石砖上，我光着双膝，不准一动，一动就一拳打来，打翻在地。数小时下来，皮破血流，两眼昏花，全身来回摇摆像不倒翁，快要倒地时，才令我站起，但无法立足，只得扶我坐在椅上，稍微休息一下。似此反复折磨。
005.人间何处有青天.txt	328	655	655	371	8	这时已被刑求得半昏迷状态，不知被刑求几天了，没穿衣服，没食饭，只喝菜汤度日，有时口干求开水喝，他给盐水喝。有一天，忽然抬进一台机器，他们令我坐在机器上，这机器布置得非常恐怖，灯光一熄，有个化装成鬼状的大声叫道：我是姚嘉荐显灵，黄学文你赶快承认杀我。我即说：姚老先生，你自杀在我旅馆，我的名誉、事业已惨受损失。你自杀前数天，不是对服务生说过，到底黄先生是儿女众多...
005.人间何处有青天.txt	332	663	663	287	4	昏过去什么都不知道，这个时候是最快乐的时候。醒来后，见三人在我身边，有一位很和气地对我说：要不要叫你岳母来看你，我摇头。又问：要不要请你同乡来接见你，我亦摇头。那你要求怎样？答：我是无辜的，请你们赶快放我回家。接着我要小便，他们给我一个面盆，小便出半面盆以上尿水，我觉得很奇怪，哪来这么多尿水呢？渐渐醒回来，这班数人溜走了，进来一个年轻客家人，他说他是医务人员...
005.人间何处有青天.txt	334	667	667	868	16	我们七个无辜被捕，被日夜轮流刑求，四个人一组，六个小时换一班，其中二个打手，一个问供，一个笔录，这就需要大量人员；调查局办案人虽被吴雪尘勾串导演了这场冤狱，又作贼心虚，怕被调查局内部正直人员知悉，所以一时间竟找不出这许多人员来做打手，只得到外面临时雇请了一部分，其中有所谓“线民”的，这种打手根本没有一点问案知识，有时候东拉西扯，连他自己亦不知问的是什么。我被...
005.人间何处有青天.txt	336	671	671	214	3	这一夜听到外面有报佳音唱诗声音，这时我才知道被他们刑讯半月有余了。王琪夜晚进刑房就说：今天是圣诞夜，本来要去教堂的，因为你的案子，我不去了，特地来诚恳劝告你，如果你不承认杀姚嘉荐，只好送军法，到了军法，大门一关，押进去，死路一条，那时你要承认，送司法，不可能，没用了。我说：我没有杀姚怎能随便承认呢？王说：承认了杀姚嘉荐，到了法院，真的没杀姚，可以请律师辩护啦...
005.人间何处有青天.txt	337	673	673	217	3	人系血肉之躯，在这长期折磨中，身心几近崩溃。回想孙中山先生开国之初，发表了《饬内务司法两部严令所属禁止刑讯令》，说“不论行政、司法官署及何种案件，一概不准刑讯”，并声明：“如有不肖官司，日久故态复萌、重煽亡清遗毒者，除褫夺官职外，付所司治以应得之罪。”未想到中山先生发令有近半个世纪，刑求竟仍在继续，真是出乎中山先生意料，他在天之灵亦会深感不安。我觉得在这人间...
005.人间何处有青天.txt	341	681	681	349	6	这天，王琪拿着迫得的会计林祖簪编供给我，说：你看他们都承认了，你还不赶快承认。我稍看了一下说：你们这么长久日子拷打，是没办法才承认的。王说：你也承认，不要受苦啦！我说：没有杀姚，你们假的亦要我承认吗？王说：只要你承认杀姚，其余我不管，你去法院申辩好。王琪即提笔边骂边问：你杀姚吗？答：是。问：用什么毒药杀？答：你说好。他说：我不知道。我说，是你们特务用的，装在...
005.人间何处有青天.txt	344	687	687	555	5	王琪迫签第一张编供后，果然不来了，由另一班来迫供。问：针筒哪里买？我想三楼汀江公寓房客洪玉树去香港，不受与吴雪尘等胁迫，说向洪玉树买将来好由他出证。接着又问毒药哪里来。我答：王琪说，特务用很毒的药，只有向药店买。刑手说不对。有一组审问人，很有道德，他问：你妹夫是医生吗？我答是。他问：毒药是不是他拿的？我答：根本没有杀人事，我的妹夫哪有给我什么毒药呢？他说：今...
