file	paragraph	line_start	line_end	char_count	score	snippet
001.为司法黑暗发榜.txt	4	7	7	142	4	中国国民党口口声声说他们推翻满清、打倒军阀，其实他们在许多方面，还不如满清、不如军阀，其中之一，就是他们对司法的祸害。满清、军阀虽然千不是万不是，但在司法上，却相当尊重制度、尊重习惯，而国民党却双杀之，结果司法黑暗至今。——“天不生‘李敖’，万古如长夜。”生了李敖，黑暗总算被揭发了。
001.为司法黑暗发榜.txt	5	9	9	341	5	我从三十二年前被国民党大员告到国民党法院开始，便一路“过堂”、“听审”、“惊奇”、“拍案”，高潮迭起，几无宁年。个人也由“被告”而“原告”、由“小民”而“刁民”、由“自卫”而“卫人”，由“卫人”而好管闲事、为弱者打抱不平。于是跟国民党司法黑暗的前卫人士起了冲突，不论是法官污吏、不论是禁子牢头、不论是司法长官法务部长，一干人等，都在我“点名批判”之列。三十二年...
001.为司法黑暗发榜.txt	6	11	11	775	7	第一组——“一、迟来的澄清”是就我被萧孟能诬告而遭冤狱的怪案看司法黑暗。这只是简要说明，详细驳正我都发表在《李敖千秋评论丛书》里了。冤狱发生于一九八〇年，地院法官陈联欢本依法判我无罪，但高院法官林晃、黄剑青、顾锦才却枉法以“不承认亲笔字据”、“不承认科学鉴定”、“窜改笔录”、“代栽证据”、“捏造配偶”、“歪曲情理”等荒谬手法，陷我于狱。后来得知，冤狱之成，与...
001.为司法黑暗发榜.txt	10	19	19	180	3	告诉人李敖虽称：“15日我不在台北，14日上午我陪胡因子（胡茵梦）在万里海边拍电影亦不在台北”等语，而其所举证人孟祥林（柯字之误）亦称：“7月15日上午8时许李敖到我家，下午天黑晚饭前回去”（见同上侦查卷第40、66页），但纵使上午陪胡茵梦在万里拍片下午即可返台北，白天在孟祥林（柯字之误）处，晚上亦可返台北，均无法证明告诉人李敖并无接听被告萧孟能电话之事实。
001.为司法黑暗发榜.txt	14	27	27	111	4	此文别题“第二次政治犯坐牢记：‘天下没有白坐的黑牢’”，是我对国民党法官判我冤狱最得意的报复。——看你还敢关老子！其中亲历的狱政黑暗，小官僚小白脸马英九不知也，所以狱政至今搞不好。这都是这个小官僚小白脸不细读李敖文章之过。
001.为司法黑暗发榜.txt	16	31	31	555	6	第三组——“三、钟曜唐——这样的法官配做院长吗？”是就一件我坐牢时过手的冤狱资料看司法黑暗。在这些文字里，我们看到法官钟曜唐的酷吏面孔，看到这种酷吏如何草率审案、做案。在他做手脚的吕安仁案中，他把进餐厅的时间定为“六十八年一月二十六日下午十时许”。这种判决，在最基本的时间认定上，就先犯了两个大错：第一，那天是一月“25日”而非“26日”，早由原告被告双方所认...
001.为司法黑暗发榜.txt	17	33	33	483	4	第四组——“四、为翁媳命案抱不平”“五、从华定国冤狱到吕德冤狱”是就另两件我坐牢时过手的冤狱资料看司法黑暗。在翁媳命案对被告张国杰的判决中，我们看到前后汪家声、林晃、刘士元、梁仰芝、王瑶等八十九个法官如何在共同制造了冤狱。这种人命关天的大案子，在法官林晃之流的手中，竟一如儿戏。例如凶器，林晃的判决书所谓“顺手捡取一刀”，当然是说“刀”为王家所有。但苦主王明雄...
001.为司法黑暗发榜.txt	18	35	35	271	3	林晃的判决书说：“凶器亦无查获，不过杀害被害人之凶器为刀类可以确定。”事实上，真是这样吗？光以凶器而论，从法官们的丰富想象力中就各说各话：凶器先是“钝器”，再转为“刀器”，再转为“刀类”，再转为“刀”，再转为“一不明钝器物体”，这算什么判决呢？“钝器”的伤和“刀类”的伤根本是两种不同的伤痕，如验尸报告是“钝器”的伤痕，则“刀类”即为不真；如验尸报告是“刀类”...
001.为司法黑暗发榜.txt	19	37	37	194	3	再以所谓杀人动机为例，林晃神来之笔，说凶手“当时支票退票，成日奔跑，张罗调借，狼狈之情，可以概见”。这又是凭空猜想！因为凶案是一月十日发生的，退票日期在三月二十一日，前后相差两个月零二十一天！林晃凭什么说人家“支票退票”？又凭什么“可以想见”“狼狈之情”？这不是故入人罪又是什么？为支票轧头寸，滔滔者天下皆是也，试问有谁轧头寸不遂杀了人了？林晃以这种理由做为犯...
001.为司法黑暗发榜.txt	20	39	39	509	4	另一件从华定国冤狱到吕德冤狱中，我提出了在法官做案之前，刑警先期做案的原始文件，吕德冤狱就是显例。华定国冤狱也是我一路关心的案子，我特别做了一张过手推事表。在这表中，我们看到从法官张剑男判决华定国死刑起，历经杨力行、林晃、林锡湖、梁仰芝、廖茂荣、毕庶寅、钟曜唐等一共八十九个法官，都一路判华定国死刑。直到一九八一年九月十一日——即七年死囚牢中后，才由更审第十一...
001.为司法黑暗发榜.txt	21	41	41	890	5	第五组——“六、人间何处有青天”是就“武汉大旅社命案”看司法黑暗。武汉大旅社姚嘉荐命案是三十七年前轰动台湾的第一大案，发生在一九五九年七月十八日。因蒋中正下手令“查明事实，从严侦办”，遂由调查局改办。在第二年一月二十六日，调查局改变了姚嘉荐原系自杀的官方纪录，平了官方的反，改说是谋杀，把全案移送台北地检处，旋即提起公诉。三月二十四日，地院宣判，七名被告，均处...
001.为司法黑暗发榜.txt	22	43	43	313	3	我从一九八三年接到游全球的信，请我主持正义，到一九九五年接到黄学文的信，请我援之以手，十三年来，一直关心这一冤狱，对法官们全无正义感的作风，也一直关切、声讨。这个案子，除了更七的法官刘日安、吕一鸣、王兴仁把游全球他们的无期改为十五年外，（并且也只是减刑，并未平反，在法官眼中，十五年已经是优待了，不要再啰嗦了！）衮衮诸法官，在三十七年间，竟无一人敢为人权表达出...
001.为司法黑暗发榜.txt	24	47	47	628	5	第六组——“七、法官谢俊峰、王德云、张剑男公然破坏假扣押制度！”“八、台湾的法官最怕报阀”是就伪无党无派者吴三连《自立晚报》诽谤李敖案看司法黑暗。先是该报登出“李敖死了”的书刊广告，在诽谤法理上，说人健康出问题或说人精神有缺陷，都构成诽谤罪，因为这样说，会造成一般人逃避他或排斥他的结果。连说人健康出问题或精神有缺陷都如此构成诽谤，说人“死了”，——尤其是恶意...
001.为司法黑暗发榜.txt	25	49	49	138	3	《自立晚报》在民事上如此被法官逍遥法外，刑事上也同样被法官法外逍遥。为了登出“李敖死了”的广告，我控告吴三连、吴丰山、颜文闩于法院，地院法官杨丰卿、高院法官杨力行、许增男、胡森田都判无罪。我乃顺势印了一本书——《蒋经国研究》，那时蒋经国还没死，我在封面上印上四行横批，全文是：
001.为司法黑暗发榜.txt	28	55	55	173	3	用来回敬，不久蒋经国真他妈的死了。这一有趣的双杀，是我生平以身试法后的杰作之一，至今虽败犹荣，并引为快事。（附告一件妙事是：当同一个“李敖死了”的广告，刊登在《亚洲人杂志》，而被我照告不误的时候，同一个台北地院、同一个台湾高院，却为发行人等应为广告负责，而判被告有罪了。——同一犯罪事实、同一法院却有不同的判决，原因无他：台湾的法官最怕报阀耳！）
001.为司法黑暗发榜.txt	29	57	57	264	3	第七组——“九、法官陈贻男的错误判决”是就比《中央日报》还《中央日报》的《自由时报》诽谤李敖案看司法黑暗。先是一九八九年十月二十八日，国民党财阀支持的《自由时报》刊出《李揆“鸭子划水”，高！》一文，造谣说在某婚礼上“李敖突然出现，并和李焕亲切拥抱”新闻，被我认系诽谤，告到法院。理由是三十年来，李敖一直以孤傲高蹈，戏公卿、弄王侯，“说大人，则藐之”为天下显、为...
001.为司法黑暗发榜.txt	30	59	59	577	5	《自由时报》不但犯了诽谤罪，并且还杠上开花，又来了伪造文书罪。原来在我向《自由时报》提出质问后，十一月十五日，颜文闩来信，附以所谓更正二份。但细查其所谓更正，全违出版法第十五条应有之形式与程序，内容与实质亦了无诚意、敷衍搪塞，何况我既寄达辩驳书在先，又何能以此种所谓更正代之？更耐人寻味的是，在我从市面上买到的和订阅的十一月一日《自由时报》中，第二版上，都没有...
001.为司法黑暗发榜.txt	31	61	61	695	5	第八组——“一〇、评法官陈重瑜眼中的法律和正义”“一一、‘李登辉诱奸女生’不犯法”是就国民党第一党报头子石永贵的广告纰漏案子看司法黑暗。先是王小痴为李敖出版社作者、为李敖好友，因三军总医院医德发生问题，以致把小病医成大病，近乎植物人。经王太太宣中仪检附证据，写成向三军总医院公开要求答复之文稿，以广告形式，投诸《中央日报》。该报同意刊出，并索价七万八千六百二十...
001.为司法黑暗发榜.txt	32	63	63	289	4	另一件国民党党棍石永贵的广告纰漏案件是他刊出了胡秋原诽谤李敖的广告。被李敖告到法院后，石永贵蠢辩称：“被告担任发行人之中央日报，仅以广告方式刊登杂志之目次，全无涉及任何具体事件之内容，自无构成诽谤罪之余地。”这种蠢辩，居然地院法官魏大喨、高院法官李恔、洪政雄、林堭仪予以接受并枉法开脱之，判他无罪！如此一来，则任何一个人，在报纸上登广告只登文章题目，不论该题目...
001.为司法黑暗发榜.txt	33	65	65	808	6	第九组、“一二、驳台中高分院翁其荣、徐元庆、陈成泉三推事”“一三、驳台中高分院法官林松虎”“一四、最高法院的判决笑话”“一五、最高法院竟比警总还警总！”“一六、最高法院法官岂可有最低视野？”“一七、法官陈瑞甫、陈满贤、梁松雄不知维护人民权利”是就国民党政府非法没收禁书案看司法黑暗。此案起于台中市政府非法捜查我的母亲张桂贞老太太的住宅，经我出面控告，台中地院法...
001.为司法黑暗发榜.txt	34	67	67	423	5	第十组——“一六、法官萧仰归真太荒唐了！”是就我与《求是报》合伙人的讼案看司法黑暗。在这案子中，我们看到地院法官萧仰归不是不明法律，就是偷懒想推开这一案子，因而乱以“不经言词辩论，径为谕知不受理之判决”。他说李敖不是直接被害人，他却不知道，报社发行人永远是站在第一线的直接对外者，他偷懒不经调查，擅引“最高法院八十年六月三十日刑事庭会议决议”以为“参照”，是完...
001.为司法黑暗发榜.txt	36	71	71	707	7	第十二组——“二〇、法官谷凤岐、陈世淙、蔡清游的自扰扰人”“二一、法官施俊尧的荒谬判决”“二二、法官施俊尧的捏造证据”“二三、法官陈国梁、刘景星、张连财的枉法裁判”“二四、法官陈国梁、刘景星、张连财的判决笑话”“二五、监察院岂容法官陈国梁、刘景星、张连财的枉法裁判！”是就胡秋原控告我的案子看司法黑暗。这个案子的重点是：胡秋原当年迫害殷海光于先，今日却要法院为...
001.为司法黑暗发榜.txt	37	73	73	519	4	至于法官又应胡秋原之请向台大查询，也是荒唐。台大表面上官样文件所说的“未有‘未续聘’之记载”，并不就是殷海光没有被迫害的证明。这正是附卷中殷海光亲笔《我被迫离开台湾大学的经过》一文中所说的：“这一现象也可以使我们明白，今日台湾真正的内情很不容易从表面看清楚。”——表面是未“未续聘”，实际却早就不能教书了。今日台大只会回信写“未续聘”，却不敢写“未禁教（未禁止...
001.为司法黑暗发榜.txt	38	75	75	537	5	法官陈国梁、刘景星、张连财又说：“至证人胡基峻、林正弘、韦政通、赵天仪等四人，于原审虽分别证称殷海光的课程表有贴出，但不能修其课及门口有人监视云云。核与上述前警总之函内容不符”云云，更是枉法之言。依法，“公文书所载之事实另有来源，而就其来源调查之结果不能认为确实时，亦未便因其为公文书之故，遽谓事实审法院未予采取为违法。”（三二上二七〇）台大与警总官衙回信，正...
001.为司法黑暗发榜.txt	42	83	83	660	3	第十三组——“二六、欲减之罪，何患无辞”是就我控告胡秋原的案子被法官大事化小看司法黑暗。先是胡秋原在《中华杂志》写文章，以连载形式，时间前后长达九个月、内容丰富长达十七万字，其中诽谤李敖，被李敖告到法院。结果，胡秋原刑事上被判罪定谳、民事上也初赔了李敖三十五万属实。本来这个案子是非常明显的加重诽谤罪，但胡秋原行文最高检察署，要求提起非常上诉。最高检察署检察总...
001.为司法黑暗发榜.txt	44	87	87	392	3	第十五组——“二九、法官房阿生、蔡光治、黄赛月的枉法判决”是就高院法官枉法开脱胡秋原看司法黑暗。先是胡秋原在《中华杂志》中诽谤我，我本不看那种烂杂志的，因追查他诽谤事实，乃买来合订本查阅，一查之下，有了新发现，控之于地方法院，也判了他的刑。不料他上诉后，高院法官房阿生、蔡光治、黄赛月竟枉法裁判，把有罪判决改判为无罪判决。理由是过期的《中华杂志》“市面未予出售...
001.为司法黑暗发榜.txt	46	91	91	85	3	法官房阿生、蔡光治、黄赛月口口声声咬定是“捜购”，但不买，又凭何得悉书中有诽谤之言？又从何附证而向法院提出？难道只能去图书馆去读该杂志，不许买，才能成立吗？这不是笑话吗？
001.为司法黑暗发榜.txt	48	95	95	255	3	“临海计划”桃僵后十六年，官方来了“九期计划”硬说“九期计划”即“临海计划”’以“李代桃僵法”硬说两计划同一。但是桃是桃、李是李，要僵尸复活，得复活出桃僵尸才行，怎么能“指李为桃”呢？固然古代宦官有“指鹿为马”的笑话，不过宦官只是自己出丑，法官并不为宦官背书。但是，在巧宦施启扬带领下的台湾法官，从高雄地院的法官李炫德到高雄高院的法官黄清江、王锦村、庄秋桃，却...
001.为司法黑暗发榜.txt	72	144	144	284	3	以上人数，以案件计算，不问重复，共四百五十人，还都是“从严录取”的，若放宽尺度，“黑暗”以外，“灰暗”也算，则可非议的法官，人数将近五百了。这是我李敖三十多年来与国民党法院周旋的大成绩，我坚决相信：只有“点名批判”、“公布姓名”的办法，才能使法官知所警惕、无所遁形，进而形成外压力，促成司法的改革。否则法官失职，人不知鬼不觉，判决下来，只知道是“地院判决”、“...
002.钟曜唐——这样的法官配做院长吗？.txt	6	11	11	299	3	梁金木的死，显然是他没能及时诊治耽误的，他没想到因伤致命，他的朋友林东雄没想到，吕安仁、林金生、杨国镇、黄灵书四个人也没想到。所以四个人被捕的时候，还在一起逛街，若想到是“杀人”而非“伤害”，按诸常理，他们该分途逃亡，而不该一起逛街。所以这个案子，不论动刀的主观意思和当时的客观行为，都不能以“杀人致死”论拟，因为这是非常明显的“伤害致死”②。吕安仁、林金生、...
002.钟曜唐——这样的法官配做院长吗？.txt	7	13	13	831	5	法官钟曜唐说：“吕安仁与林金生气愤难忍，遂萌共同杀人之意念。……吕安仁刺中梁金木右季肋部一刀，深达肝脏，虽经人扶送医院急救，终因胸腔内出血，延至十一时许不治死亡。”法官钟曜唐并且把进餐厅的时间定为“六十八年一月二十六日下午十时许”。这种判决，在最基本的时间认定上，就先犯了两个大错：第一、那天是一月“二十五日”而非“二十六日”，早由原告被告双方所认同。第二、进...
002.钟曜唐——这样的法官配做院长吗？.txt	8	15	15	663	8	吕安仁、林金生、杨国镇、黄灵书四个人被捕后，林金生㈠在派出所供称：“我就拔起扁钻手中握住，先往梁某脸部揍一拳，反过揍林某，连续再用扁钻往梁某身上刺杀一刀。”“是从梁某右腰部位杀了一刀。”“其他三位同伴都没出手。”⑥㈡对检察官供称：“我生气就打他们，并用扁钻撞他们一刀。”“当时动手的只有我一人。”⑦㈢在中山分局复讯，也如此说。㈣在台北宪兵队询问中，也如此说。㈤...
002.钟曜唐——这样的法官配做院长吗？.txt	9	17	17	312	6	除林金生的五次初供外，当时在场的杨国镇在警察局供称：“我亲眼看见林金生杀伤对方。”“林金生拿出扁钻向对方腹部杀了一刀。”“我们三人没有打对方，……是我朋友林金生杀人及打人。”⑨黄灵书也供称：“我看到动刀子的是林金生。”⑩这些有利于吕安仁的证言，法官钟曜唐都一笔带过，竟说：“证人杨国镇、黄灵书事后冀图回护被告而附和林金生当初不实之自白所为游移不定之供述，仍难资...
002.钟曜唐——这样的法官配做院长吗？.txt	10	19	19	454	3	当时在场的另一证人是金寿芳餐厅经理李素月，李素月因为不属双方任何一方的朋友，，证词最为客观。李素月一月二十六日供称：“我只看凶手用刀刺了死者一刀，死者就抱着肚子弯下身去，另外一个也被刺了一下。”(12)证言内所指凶手，显然同为一人，而非分为两人。又在二月二十二日供称：“我没有看到他（吕安仁）杀他（梁金木），但是他手上拿一只扁钻的。”当时吕安仁拿扁钻没错，可是...
002.钟曜唐——这样的法官配做院长吗？.txt	11	21	22	470	6	本案起因在吕安仁退伍聚餐，吕安仁没杀梁金木，但梁金木因他而死，令人不无遗憾。 最后决定由吕安仁父亲送梁金木母亲十万元，聊示慰问；并于“六十八年三月二十二日”订立和解书，吕家表示“应负道义上之责任”；梁家表示“吕安仁并未行凶”。不料这一和解书，竟也被法官钟曜唐认定为判吕安仁罪的证据！理由是：“倘若被告不曾刺杀梁金木，焉肯无端赔偿被害人家属新台币拾万元成立和解。...
003.为翁媳命案抱不平.txt	3	5	5	322	4	命案发生后一年又十一个月，台北市警察局景美分局忽然移送出一个六十六岁的老头子，说凶案是这个老头子干的。说这老头子是黄秋丽的父亲的老朋友，那天身怀凶器，“偕同一不知名者”，跑到王家去借钱，借钱不遂，就将翁媳二人双双杀了。就这样的，不知道“不知名”的共犯是谁，不知道凶器是何形状，在没有任何“积极证据”的情况下，这老头子被收押、起诉、判死刑。他的案子，经地院判决、...
003.为翁媳命案抱不平.txt	5	9	9	136	3	八年是一个漫长的日子，他记得在抗战八年间，他在浙东做游击司令，八年时间，曾打垮了日本鬼子，可是，当第二个八年来的时候，他竟被自己同胞打垮。他年复一年，斗室独坐，战乱使他丢了家庭、丢了妻子、丢了儿女，他把青春奉献给国家，可是，垂老投荒，却只能靠做密医维生，——国家把他忘了。
003.为翁媳命案抱不平.txt	7	13	13	123	3	看守所方面的纪录是：“张国杰，男，七十四岁（民前三年一月十八日生），浙江省永嘉县人，身分证北县峡（〇八）字第八三六号，住台北县永和镇中正路七十八号（在押）。杀人，处死刑，褫夺公权终身；又杀人，处死刑，褫夺公权终身。”——这就是这老头子的全部履历。
003.为翁媳命案抱不平.txt	8	15	15	231	5	八年来，他的案子表面上打得劳师动众，骨子里却无动于“中”，因为他人微望轻，“一朝入公门，九牛拉不出”。过手的法官虽多达八十五人，但大都是虚应故事，这种结论，从前后二十三份判决书中，不难比对出来。结果不外是抄来猜去，不是换汤不换药，就是连汤都不换，对张国杰的案情，并无实质上的深入审酌和根本改变。例如高院更一以前都判有共犯，判一个死刑；更二判没有共犯，也是一个死...
003.为翁媳命案抱不平.txt	22	43	43	107	3	二、如果张国杰在“大义”以后后了悔，不再继续“和盘托出”，那么他在侦讯笔录上就不会签名了，因为最后签名前，他有的时间不止一分钟，不“和盘托出”的后悔，当然在最后签名以前，他既后悔于先，自然就不会签名于后。这是常识。
003.为翁媳命案抱不平.txt	23	45	45	269	10	三、所谓六月二十四日的自白，一看内容，便是可疑的，原文是：“我去黄秋丽家，替黄秋丽公公王新政看脚痛，未久黄秋丽即自他卧室走出来，手里拿着不知何物，连续打我的头，此时王新政亦赶来，也不知拿何物帮助黄秋丽打我，没想到他二人共同打我一个人，我在气愤之下，就将他们的打人东西抢过来，也同样的回打黄秋丽及王新政，当时糊糊涂涂的就将他们二人打死了。”总看全文，再覆按相验报...
003.为翁媳命案抱不平.txt	35	69	69	133	3	对照之下，可见法官先生的想象力是何等丰富！林晃说“深意所在”乃是张国杰遇见了二位太太，二位太太可作证他去过的事实，所以承认遇见二位太太！王瑶却说不是这样，“应系”张国杰从“门上透视镜”“得知郑、蔡二人上楼”，所以承认遇见二位太太。这两种判决，显然是互相矛盾的，因为：
003.为翁媳命案抱不平.txt	50	99	99	424	4	这里所谓“指纹、足印无法分析”之说，是完全避重就轻属，因为现场明明由警方采列“血足印”和衣橱门英文字典所留的“血指纹”，经调查结果，不是张国杰的，可见凶手别有其人。所以地院的判决想象说：“血指印与被告及死者，现场工作人员之指纹均不符，核系与被告共同行凶之共犯所留。”高院的判决照抄这一想象，更一的判决又照抄，但到了更二的判决，说没有共犯了，但指纹“虽均与上诉人...
003.为翁媳命案抱不平.txt	90	179	179	89	3	林晃的判决书所谓“顺手检取一刀”，当然是说“刀”为王家所有。但苦主王明雄却到庭证实：他们家里并没有钝器或刀类被人拾取应用或遗失，一九七八年（六十七年）六月二日王明雄有以下的证词：
003.为翁媳命案抱不平.txt	93	185	185	276	3	这样看来，林晃所谓“顺手检取一刀”，这把刀，竟从何处飞来？这不是“老张飞刀”式的奇事吗？何况，第一审时传承办刑警周竞，问周竞：“凶器呢？”周竞答：“一铁锤，现仍在我们处。”试问如为“刀器”，这把“铁锤”，又怎么交代呢？事情就这么怪，这个刑警周竞口中，也是第一审卷第九十五页中的“铁锤”，竟在法官的判决书里大睡其觉！——法官们都开脱了它！林晃说“凶器为刀类可以确...
003.为翁媳命案抱不平.txt	98	195	195	88	3	王瑶的判决书说：“要求黄女贷款济急，为黄女所拒，双方言语冲突，张国杰极为愤怒，顿萌杀机，……适王新政自外归来坐于客厅，张国杰为免形迹败露，另起杀意。”以上所说，我们忍不住要问：
003.为翁媳命案抱不平.txt	122	243	243	142	4	可见所谓共犯，自高院更二以后，就突然不见了。究其原因，是最高法院在一九七六年（六十五年）四月二十二日判决发回时，曾提醒说连警局侦查报告都说“有无共犯，仍待继续侦查”，怎么高院竟判出个共犯来？于是共犯之说停止，凶手总归户，变成张国杰一个人了。但是回看一下共犯时代的判决书，却也实足警世：
