file	paragraph	line_start	line_end	char_count	score	snippet
011.最高法院的判决笑话.txt	4	7	7	473	7	第二、法官李锦丰、范秉阁、郭柏成、葛浩坡、洪根树又引“证人鞠金蕾在原审证称：‘当时大门关着，对面的邻居跑出来，他说他有钥匙，就将大门打开，但是里面的门关着，就请锁匠将门打开，进去后，在一楼发现一箱一箱的纸箱，堆得有一人多高，室内有发霉的气味’”。又引“证人杨三共证称：‘因为这是空屋，就去叫里长来会同’”。这些引证，就先自己推翻了所谓“由一年约五十余岁之男性老...
011.最高法院的判决笑话.txt	5	9	9	289	4	第三、法官李锦丰、范秉阁、郭柏成、葛浩坡、洪根树又引“证人陈松碧证称：‘里内的张桂贞我从来没有看过’”。这更奇了。陈松碧是台中县乌日乡三和村中山路六七七之二号一力预拌混凝土股份有限公司的董事长、力山企业股份有限公司的董事长、新万兴交通股份有限公司的董事长、万全砂石采取行的行东、三力建设股份有限公司的常务董事。……他是一个七十多岁行动不便的老文盲，整天周旋官商...
011.最高法院的判决笑话.txt	6	11	11	325	4	第四、法官李锦丰、范秉阁、郭柏成、葛浩坡、洪根树又在判决书说：“而事后自里长陈松碧接受上开查扣三联单者，并非被上诉人本人，而系其子即该出版发行人李敖，据其在原法院前审审理时到庭陈称：‘我接到朋友通知后，于六月二十四日由台北赶到台中找到杨三共先生，请他带我去找到里长。’”试问这又能证明了什么？母亲出国去探亲看姐妹，母亲台中的家里突被搜查，儿子在台北接到邻居的快...
011.最高法院的判决笑话.txt	7	13	13	183	4	第五、法官李锦丰、范秉阁、郭柏成、葛浩坡、洪根树根据以上四证，结论说，因上址藏书太多，每一种书又为数甚多，“由此观之，被上诉人是否确实住居于上址？查扣之书籍是否为其收藏，藉以为乐之物，已非无疑。”并引证台中市政府之言：“被查扣之讼争书籍均为李敖所著作，别无他家著作。”“依吾人之一般生活经验法则，如以收藏书籍为乐，断无仅收藏一作家著作”以为佐证，这也都是笑话。...
011.最高法院的判决笑话.txt	11	21	21	359	4	㈣纵使书为李敖所有，但收藏于张桂贞老太太家里，并未出售或散布，即无被查扣的理由。史载三国时刘备在四川厉行酒禁，发现民间有酒具者即目为嗜酒制酒之罪犯而处罚之。丞相诸葛亮不以为然，乃陪刘备巡视于街，当街任意抓一男子，指为强奸罪犯。刘备问为什么？诸葛亮答道：“彼有淫具！”意思是说，见酒具即目为罪犯，则与有男性性器官者即目为罪犯者，又何以异？今之台中市长大人，竟目藏...
012.最高法院竟比警总还警总！.txt	3	5	5	288	3	第一、法官李锦丰、范秉阁、郭柏成、葛浩坡、洪根树口口声声说：“除依管制办法第八条规定予以查扣外，复本于出版法第三十九条之规定，为其查扣之依据”，并以括号提醒：见卷中“查扣三联单之记载”。三联单上后面虽有“右列出版品依出版法第三十九、台湾戒严时期出版物管制办法第八、广播电视法四十五条之二条规定予以扣押”记载，但所列三种法令是平行排列的、是让填单者自选一种适用的...
012.最高法院竟比警总还警总！.txt	12	23	23	127	3	方能适用。查张桂贞老太太家里的“禁书”，没有一本是按以上各项查禁的，法官李锦丰、范秉阁、郭柏成、葛浩坡、洪根树又凭什么把依出版法没禁的书予以查禁？最高法院岂可轻予连警总都不肯轻予的罪名？这叫什么保障人权的法官？——在罪名上用了依法无据的法律，此其笑话二。
012.最高法院竟比警总还警总！.txt	15	29	29	244	3	足证纵使扣押，也另有对书刊发行人保障及救济条款。若按法官李锦丰、范秉阁、郭柏成、葛浩坡、洪根树的法理，则此一保障与救济，对于非出版人之读者或藏书家反不适用，出书卖书的，书可以返还；买书藏书的，书反倒充公，通乎？不通乎？可见出版法第三十九条所指的扣押，乃专责“发行人”而言。如今最高法院的法官将专责“发行人”之出版法第三十九条移花接木，用来适用于寻常百姓如本案原...
012.最高法院竟比警总还警总！.txt	16	31	31	482	4	第四、纵按法官李锦丰、范秉阁、郭柏成、葛浩坡、洪根树所说，有出版法第三十九条之适用，但搜索民宅时，搜索票纵然带了，也只能限于搜索；要扣押，还得另有查禁命令才成。按照台中市政府口口声声的《台湾地区省市县（市）文化工作处理要点事项》规定：依据《出版法》等有关法令取缔，有关法令中，《出版法施行细则》即为其一。按照该细则第30条，明定“出版法所规定之行政处分，应以书...
012.最高法院竟比警总还警总！.txt	20	39	39	336	3	第六、何况，张桂贞老太太既非禁书发行人、亦非禁书著作人；既非禁书流传人、亦非禁书销售人，她只是一位在家里喜欢藏书的老太太，人并没犯罪，所藏书籍更非犯罪之物。依法执行捜索者，要犯罪者才适用之、要为犯罪之物才适用之。张桂贞老太太本人既非出版者、著作人、流传人、销售人，只是一名读者，要搜索她，全无出版法以下任何法令之适用，只能照刑事诉讼法条款执行，但按刑事诉讼法，...
012.最高法院竟比警总还警总！.txt	21	41	41	357	5	以上六大笑话，无不证实了法官李锦丰、范秉阁、郭柏成、葛浩坡、洪根树的莫名其妙。他们在下级法院法官黄奠华、袁再兴、林富村做出正确判决后，滥施发回，谬以一翻两瞪眼的明确证据，硬要说“有斟酌余地”、硬要说“原审未注意及此，并说明其法律上意见，亦有判决不备理由之违法”。其实真正违法的，不是别人，就是法官李锦丰、范秉阁、郭柏成、葛浩坡、洪根树他们自己！他们身膺司法重寄...
013.最高法院法官岂可有最低视野？.txt	3	5	5	121	3	历来最高法院判决，见仁见智，胜败之分，还有个谱儿，但这回法官李锦丰、范秉阁、郭柏成、葛浩坡、洪根树的判决，却大大离了谱！——连戒严时期军事机关警备总部都没查禁的书刊，解严时期司法机关最高法院却要查禁了！这种荒腔走板，真是中国司法史上的大笑话！
013.最高法院法官岂可有最低视野？.txt	4	7	7	37	4	大笑话并不止于这一案件本身，大笑话在令人根本怀疑起最高法院法官的视野何在。
013.最高法院法官岂可有最低视野？.txt	5	9	9	461	3	这一案子分到法官李锦丰、范秉阁、郭柏成、葛浩坡、洪根树手里前，前后历时三年四个月，张桂贞老太太锲而不舍、努力不懈，所争者，除民事责任、司法公正以外，更着眼于宪法中人民基本自由之保障。戒严四十年以还，警备总司令部执《戒严法》以限制人民基本自由，“恶法亦法”，尚勉强自成一说，但逾越《戒严法》本身规定之限度而滥肆扩张，则就无以自圆。试看《戒严法》第十一条第一款明定...
013.最高法院法官岂可有最低视野？.txt	9	17	17	132	3	这个所谓《台湾地区戒严时期出版物管制办法》，既未经立法院，自非法律，而不过一纸命令。按照《中央法规标准法》第三条：“各机关发布之命令，得依其性质，称规程、规则、细则、办法、纲要、标准或准则。”既以“办法”称之，自属命令。这一命令，自谓来自《戒严法》第十一条，但是：
013.最高法院法官岂可有最低视野？.txt	20	39	39	370	4	试看文明国家的最高法院法官，他们在人民基本权利的维护上，是何等开明行事！以美国为例，美国最高法院法官，从约翰·马歇尔（John Marshall）起，在职三十五年间，对维护宪法，不遗余力，也不留余法。该院自一八六九年至今，都以区区九人为编制，掌管了全美国的人权最后保障。由于他们的执着与不畏政治压力，全国司法正义都赖这“九个老头子”（Nine Old Men）...
014.法官陈瑞甫、陈满贤、梁松雄不知维护人民权利.txt	4	7	7	354	6	四年四个月前，台中市政府非法捜查张桂贞老太太住宅的案子，经台中地院法官黄秀得，不畏上级压力，判决台中市政府败诉后，复经台湾高等法院台中分院法官黄奠华、袁再兴、林富村不畏压力，又判决台中市政府败诉。本来这个案子，已经逐步上垒，象征了解严以后，司法界开明力量的觉醒，按说最高法院应该接力开明下去的才对，不料案分到法官李锦丰、范秉阁、郭柏成、葛浩坡、洪根树手里，居然...
014.法官陈瑞甫、陈满贤、梁松雄不知维护人民权利.txt	8	15	15	333	4	退一步说，且承认张桂贞有“伊人在美国，仍可转托国内亲友代为收购，或以赠与方式取得”之言。但是，按照常识、按照经验法则，一个人置财产、买东西，难道一出国就办不到了吗？她托亲友代办，又有什么不可以呢？还要举什么证呢？设想法官陈瑞甫、陈满贤、梁松雄出了国，托亲友买了电视机，电视机放在家里，被强盗抢了，打起官司，竟要“举证以实电视机何来之说”，非得交出亲友姓甚名谁、...
014.法官陈瑞甫、陈满贤、梁松雄不知维护人民权利.txt	9	17	17	319	4	法官陈瑞甫、陈满贤、梁松雄违背法令，竟轶出常识（无庸举证）或法律（依职权调查证据）之外，真令人浩叹！依同法第四百六十八条：“判决不适用法规或适用不当者，为违背法令。”明明有“无庸举证”之法规，而责张桂贞以举证、且捏造张桂贞“未能举证以实其说”，又不“依职权调查证据”，揆诸证据法则，何能出此？同法第二百九十四条明定：“受诉法院于言词辩论前调查证据，或由受命推事...
014.法官陈瑞甫、陈满贤、梁松雄不知维护人民权利.txt	12	23	23	214	3	既然查扣地点承认是张桂贞“设籍”的家，依照民法第三编物权第十章“占有”诸法条，家中财产（包括系争书籍），根本为张桂贞所有，这是常识、是经验法则、也是清清楚楚的法律。——对在一个人家中的财产，居然查证起如何“取得”的问题，此之谓玩法！此之谓节外生枝！民事诉讼法第四百六十八条明定：“判决不适用法规或适用不当者，为违背法令。”法官陈瑞甫、陈满贤、梁松雄放着民法第三...
014.法官陈瑞甫、陈满贤、梁松雄不知维护人民权利.txt	14	27	27	585	4	按照民法第九百四十四条明定：“占有人，推定其为以所有之意思，善意、和平及公然占有者。”民事诉讼法第二百八十二条明定：“法院得依已明了之事实，推定应证事实之真伪。”可叹的是，法官陈瑞甫、陈满贤、梁松雄竟不照民法去“推定”书是张桂贞的，反倒违背法令，非法推定书不是张桂贞的。滥施不当之推定，不凭证据，硬推定张桂贞家中的书非张桂贞的，但又推定不出是属于谁的。这种判决...
014.法官陈瑞甫、陈满贤、梁松雄不知维护人民权利.txt	16	31	31	306	4	对众所周知属于张桂贞的家中物，要举证也可以，但依法，举证责任根本不在张桂贞这一边。民事诉讼法第二百七十七条明定举证责任分配之原则，明说：“当事人主张有利于己之事实者，就其事实有举证之责任。”——说张桂贞家里的财产不是张桂贞的，举证责任根本在台中市政府，而不在张桂贞。设想强盗抢了法官陈瑞甫、陈满贤、梁松雄家里的电视机，打起官司，强盗反过头来要他们提出电视机怎么...
014.法官陈瑞甫、陈满贤、梁松雄不知维护人民权利.txt	18	35	35	931	3	举证责任既明明在台中市政府一边，但查全卷，台中市政府毫无根据与证据，只是反反覆覆陈说张桂贞“为李敖之生母，谊属至亲，被查扣之讼争书籍均为李敖所著作，别无他家著作，……，依吾人之一般生活经验法则，……足见讼争书籍系案外人李敖所有”。殊不知被查扣的作者除李敖外，还有三十四位之多！这样子抹杀其他三十四位案外人，公道吗？又置其他三十四人于何地？按照“吾人之一般生活经...
014.法官陈瑞甫、陈满贤、梁松雄不知维护人民权利.txt	20	39	39	107	3	法官陈瑞甫、陈满贤、梁松雄做出了书非张桂贞所有、也不提“讼争书籍系案外人李敖所有”的判决，自以为得计，殊不知引发出大问题。大问题是：判决书中如不能证明书为李敖所有，则就无异推翻了整个搜索张桂贞住宅并查扣书籍的依据！
014.法官陈瑞甫、陈满贤、梁松雄不知维护人民权利.txt	22	43	43	479	3	被查扣书籍系收集于张桂贞之住宅内，依最高法院三十一年上字第一九〇四号判例，自属张桂贞所有。纵认为有违反台湾地区戒严时期出版物管制办法第八条情事，应予处分对象亦仅能以“出版发行人”为限。张桂贞既非“出版发行人”、住所处亦非“出版发行人”住所，有提出之版权页影本二十三件及户口簿影本三件附卷可证，是书籍非“出版发行人”所持有，凿凿有据。张桂贞既非禁书发行人、亦非禁...
014.法官陈瑞甫、陈满贤、梁松雄不知维护人民权利.txt	33	65	65	98	3	法官陈瑞甫、陈满贤、梁松雄在判决书里，又承认张桂贞“应认当事人适格”，明指：“是上诉人（台中市政府）主张被上诉人（张桂贞）就本件诉讼当事人不适格一节，亦不足采。”——这肯定了张桂贞确有起诉的资格。
015.法官萧仰归真太荒唐了！.txt	35	69	69	219	5	总之，法官萧仰归不是不明法律，就是偷懒想推开这一案子，因而乱以“不经言词辩论，径为谕知不受理之判决”。他说李敖不是直接被害人，他却不知道，报社发行人永远是站在第一线的直接对外者，他偷懒不经调查，擅引“最高法院八十年六月三十日刑事庭会议决议”以为“参照”，是完全不通的。该会议决议是以“法院调查之结果”为准，而法官萧仰归身居法院，却全未“调查”，又何来“结果”？...
016.法官邱美育的荒唐大判决.txt	4	7	7	83	4	刑事诉讼法第五十条明定：“裁判应由推事制作裁判书。”所以裁判书的内容，法官本人责无旁贷。法官邱美育在本案判决书中，标题明明是“台北地方法院刑事判决”，但在最后，却出现
016.法官邱美育的荒唐大判决.txt	6	11	11	217	5	一行字，令人又吃惊又好笑。查刑事诉讼法第四百零三条明定：“当事人对于法院之裁定有不服者”得抗告；复按同法第四百零六条：“抗告期间，除有特别规定外，为五日，自送达裁定后起算。”但本案乃是判决书，并非裁定书，如何能出现“不服本裁定”字样？按同法第三百四十九条明定：“上诉期间为十日，自送达判决后起算。”法官邱美育又凭什么剥夺当事人五天的法定期间？这不是大笑话吗？—...
016.法官邱美育的荒唐大判决.txt	8	15	15	150	3	法官邱美育说：“立法院公报第八十卷第五十五期第二一七页至第二二一页所载，系胡委员秋原于立法院第八十七会期第四十六次会议提出之书面质询，属于宪法第七十三条所指在院内所为之言论，自应刊载于立法院公报，有立法院秘书处八十一年四月十日(81)台处速字第一〇〇二号函在卷可稽”。——这段所谓无罪理由，大有问题。
016.法官邱美育的荒唐大判决.txt	11	21	21	210	3	⑴陈新民教授《宪法基本权利之基本理论》下册收有《议员的言论免责权》论文，指出：“将该言论散布‘到会（院）外’，自应受到法律拘束。”并在注文中指出：“依德人Munzel之见，在威玛时代，即不准‘会外传播’，见NJW, 1961, S 126.德国联邦法院在一九七九年十二月十八日的判决（BGHZ, 75, 384），DOV 1981, S. 300，也同样的认为...
016.法官邱美育的荒唐大判决.txt	12	23	23	124	3	⑵傅昆成教授等《美国宪法逐条释义》在《议员的豁免权》（Immunities of Members）项下指出：“一九七九年最高法院限制了与立法无关的特权，如演讲、新闻发布及简讯（nesletters）等均不在豁免权范围内。”（附证二）国会公报亦属之。
016.法官邱美育的荒唐大判决.txt	18	35	35	114	3	⑴林纪东教授《中华民国宪法释论》指出：“人人固有言论之自由，然如涉及他人之名誉，仍应负侮辱与诽谤之罪责。……民意代表……不能不顾他人名誉，放言高论，任意所之而不负任何责任，致失言论自由之真义，尤负人民选举代表之本意。”（附证三）
016.法官邱美育的荒唐大判决.txt	19	37	37	112	3	⑵正因在国会中言论不可诽谤私人，故进步之宪法如西德宪法第四十六条第一项明定：“无论何时，联邦议会议员，不得因其在联邦议会或其委员会所为之表决或发言，而受司法上或惩戒上之诉追，或在联邦议会外，被追究任何责任，但诽谤不在此限。”
017.法官谷凤岐、陈世淙、蔡清游的自扰扰人.txt	4	7	7	92	3	台湾高等法院法官谷凤岐、陈世淙、蔡清游在“八十年度上易字第二九六九号”刑事判决里，确定了自诉人李敖控告被告胡秋原的诽谤罪成立，判“胡秋原缓刑贰年”。但在反诉部分上，却发回更审，理由是：
017.法官谷凤岐、陈世淙、蔡清游的自扰扰人.txt	9	17	17	117	3	至于远流出版社、文星书店与李敖的关系，乃出版商与作者之间的关系，分别有出版契约为证（附证一、附证二）。在契约所订有效授权出版期间，对外发行事宜，权责均在出版社，又与作者何干？地院法官魏大喨在“七十九年度自字第九八六号”判决书中说得好：
017.法官谷凤岐、陈世淙、蔡清游的自扰扰人.txt	33	65	65	206	3	事实上，李敖出版社是仰慕李敖之读者王自义独资开的出版社，早于四年前即向主管署申请核准登记。据“中华民国七十七年五月七日”核发下来的北市建一商号(76)字第一七〇六七八号“台北市政府营利事业登记证”，明列“负责人姓名：王自义”；“组织：独资”。该出版社依法行使登记证上“营业项目：各类书籍之出版及买卖业务”，乃正常商业行为而为“负责人：王自义”所负责，又与李敖何...
017.法官谷凤岐、陈世淙、蔡清游的自扰扰人.txt	39	77	77	226	3	台湾高等法院法官谷凤岐、陈世淙、蔡清游发回更审的判决书中说：“惟上诉人即被告已指称反诉被告现仍在其所经营之书店内继续销售前述书籍，其犯罪行为尚继续中，究竟反诉被告是否仍继续销售前述书籍，其加重诽谤行为是否尚继续中，上诉人即被告提起反诉，有无逾告诉期间，即不无研求之余地。”——从上面的答辩中，一一证实了本案其实并无“研究之余地”，只是法官谷凤岐、陈世淙、蔡清游...
017.法官谷凤岐、陈世淙、蔡清游的自扰扰人.txt	43	85	85	169	3	殷海光的夫人夏君璐在给殷门弟子林悦恒、罗业宏的秘密信中，曾透露了一个事实：——“李敖曾救老师（殷海光）一命。”（附证一）这一事实，是指当年李敖借债送殷海光到医院的事。当年殷海光对齐世英说：“李敖是最够义气的人。”（附证二）李敖凭这一义气，延长了殷海光的寿命，并在日后为殷海光之死，做了春秋笔法的记录。——写了《我的殷海光》等文，以存信史。
017.法官谷凤岐、陈世淙、蔡清游的自扰扰人.txt	52	103	103	83	3	殷海光在《自由中国》杂志时代（一九四九—一九六〇），十一年间发挥“笔墨之权威”，风光八面。一九六〇年九月雷震被捕，《自由中国》停刊，殷海光失掉地盘，成为“落井”情况。
017.法官谷凤岐、陈世淙、蔡清游的自扰扰人.txt	63	125	125	158	3	②胡欣平在《忆殷海光兄》中说：“从那时候开始，他的处境也就越来越坏，常有人跟踪他，终致连在台大教书的机会，也被剥夺了。他是一位意志刚烈和单纯的人，压迫对于他只能造成更坚强的反抗，更剧烈的痛苦。加上了生活的孤困，我认为这是他患上癌症的原因。人生自古皆有死，但是死得不自然，在被压迫之下而死，就特别的使人悲痛”（附证五）
017.法官谷凤岐、陈世淙、蔡清游的自扰扰人.txt	65	129	129	108	3	④轩辕辙在《从说真话、讲理到拿人当人》中说：“为说真话讲理而惹来政治迫害的殷海光，为鼓吹拿人当人之理念，本身竟然遭受不太像人的待遇，以致折磨出胃癌，在刚‘知天命’之年，便于一九六九年九月十六日，与世长辞。”（附证七）
017.法官谷凤岐、陈世淙、蔡清游的自扰扰人.txt	66	131	131	267	5	殷海光饱受迫害、忧郁成疾，此疾即是胃癌，这一病状，是李敖借债送他去宏恩医院后，由主治名医李承泌大夫证实的。殷海光之死，用通俗的说法，是被气死的。夏君璐在《记忆的苍穹》中说：“一九七一年，九月里的有一天，我去看才出狱不久的雷震，他一见面就对我大声的说：‘殷太太，你看，殷海光爱生气，就被国民党气死了！’”（附证八）就正是如此。胡秋原想把他迫害殷海光的责任赖得一干...
017.法官谷凤岐、陈世淙、蔡清游的自扰扰人.txt	68	135	135	186	3	根据《我被迫离开台湾大学的经过》一文的自叙，从一九六四年之初起，遭到文化界一些闻人的诬蔑、毒骂及构陷；六六年六月，“国家长期发展科学补助金”被迫停止申请；七月，拒签抗议“美国的共匪姑息分子”的宣言：同月，出版不久的《中国文化的展望》遭警总查禁；八月，当局以调教育部任职掩人耳目的手法，达成“变相解聘”的目的。在这一步进逼一步的陷害过程中，几乎使海光先生的精神濒...
017.法官谷凤岐、陈世淙、蔡清游的自扰扰人.txt	72	143	143	89	3	写信给卢鸿材：“我在这里，只能像一个寂寞的蜘蛛，躲在一个小角落里，结一个小网把自己封起来。然而，即令如此，耳根并不清静，窗前充满了轰隆之声，他们要摔死这只蜘蛛才舒畅”！（附证九）
017.法官谷凤岐、陈世淙、蔡清游的自扰扰人.txt	81	161	161	81	3	①胡秋原在“答辩及反诉状”中说：“近几年来，自诉人李敖……略谓：殷海光，早年在台大解聘及呕气而死，系由答辩人致函当时台大校长钱思亮之故。”并附上“证一”以证其说。
017.法官谷凤岐、陈世淙、蔡清游的自扰扰人.txt	83	165	165	101	3	《自由中国》停刊后，殷海光顿失地盘，所幸台大教授的职务尚在。后来我主持《文星》，对他的处境，有以援手。不料由于中西文化论战时胡秋原战败，迁怒殷海光，对他加以迫害，最后连台大教职皆不能保了，终于呕气而死。
017.法官谷凤岐、陈世淙、蔡清游的自扰扰人.txt	84	167	167	127	3	就在这种压力下，台湾大学校长钱思亮屈服了，他先是把胡秋原的逼问信发交台大哲学系主任洪耀勋转查殷海光，接着又派毛子水转告殷海光，要他撤销申请“国家长期发展科学补助金”，逼殷海光“放弃了最低生活费用的一半”。在胡秋原等为官方做好酝酿工作以后，最后官方出马了。
017.法官谷凤岐、陈世淙、蔡清游的自扰扰人.txt	87	173	173	71	3	胡秋原迫害殷海光的故事，是一个典型的落井下石的故事。知识分子配合官方，对“本是同根生”的同道如此栽诬、如此构陷、如此歇斯底里，胡秋原真是冠军。
017.法官谷凤岐、陈世淙、蔡清游的自扰扰人.txt	91	181	181	370	5	同钱校长作了上述协议以后，我以为这件事可告一段落了。哪里知道九月初的某一天（确定的日子忘记了）上午十点多，某党工作人员二名来舍。年岁较大的一位说：“我们是来给殷先生帮助的。”我心里想，你们这些人指使秘密警察把我逼出台湾大学，现在又来拍一下，未免太阴险了。我同你们有什么好谈呢？因此，我只淡淡的说：“我不需要什么帮助。”他又提到那张聘书：“殷先生为什么那么坚持不...
