file	paragraph	line_start	line_end	char_count	score	snippet
001.2011年5月.txt	4	7	7	137	3	古人“误落尘网中”，仿佛预见了网中有尘。我认识一位可爱的女人叫“徐开尘”，她的名字真好。尘是可以开的。现在天下大乱了，阿猫阿狗都会舞文弄墨了，康熙都低级趣味了。好吧，如凯撒所说：Veni, vidi, vici.我来了、我看见了、我征服了。不是写140个字吗？拿牛刀的来了。
001.2011年5月.txt	14	27	27	125	3	140字是那么好写的！当你没有知识、没有想像、没有才气、没有中文水准，你的140啊，狗屎而已。你写的全是鸡毛蒜皮，你暴殄了文字，仓颉都要哭起来。仓颉造字，因破天机而鬼神下泪，如今天上掉下狗屎来，轮到仓颉下泪了。欧阳修说“君才自与鬼神斗”，但狗屎除外。
001.2011年5月.txt	16	31	31	119	3	每条140字，像什么？像狭巷短兵。明朝人的诗：“狭巷短兵相接处，杀人如草不闻声。”我被逼入狭巷，只好短兵相接。140字，高人写来，是庆功宴；俗人写来，是暴露狂。中文何辜，竟被人糟蹋，我短兵而至，也算功德一件，袞袞诸公变诸公滚滚，不亦快哉！
001.2011年5月.txt	18	35	35	135	3	暴露狂（exhibitionism）的地方有三：小巷里、舞台上、网站内。上网本该自我表现些真格的、深度的、明辨是非的、有人道关怀与正义标准的议题，而不是浅薄的打屁。不幸的是，以演艺人员为主的男女，他们盘踞了网站，整天自我表现暴露狂，像猢猻撅起红屁股，太讨厌了！太讨厌了！
001.2011年5月.txt	24	47	47	131	5	四十年前，在厕所里，刘家昌一边小便，一边低头念念有词。他说：“鸡巴呀！老子一切辛苦，他妈的都是为了你！”我听了大笑。我说：“鸡巴其实是一条大丈夫。能屈能伸、能软能硬、能软硬兼施、能软中带硬。我生平最崇拜的，就是我这条大鸡巴。虽然给自己惹来许多苦恼，但都值得啊！”
001.2011年5月.txt	34	67	67	140	3	如果一九三一年，康斯坦希诺（Mario Constasino）的车子撞死了邱吉尔；如果一九三三年，桑格诺（Giuseppe Zangara）的子弹打死了罗斯福，后来的历史会一样吗？当然有造时势的英雄。美中不足的是，英雄造了时势，但那时势，却大材小用了英雄。评价英雄，请别忘了空间。
001.2011年5月.txt	42	83	83	134	3	对日本的道歉声明说：“制作单位表演这段内容的本意，是想以温馨幽默的方式呈现天皇与皇后善良亲民的一面”，但却事与愿违、马屁拍错，“造成部分日本朋友之误解及不舒服”，“伤害了日本朋友的情感，我们深刻反省也郑重道歉。”看到了吧？歉是这样低声下气的道的，多么有骨气的台湾人呀！
001.2011年5月.txt	44	87	87	128	3	新闻报导：“中天得知后，第一时间请‘最大党’大家长王伟忠发函给日本，并将日文、中文两个版本的道歉信贴在两国各大网站致意。”妙的是，王伟忠之流说：本“是以幽默手法传达天皇皇后亲民一面”的，本“要传达的是温馨与慰问”的，但是马屁却惹来马脚，于是，台湾人屈服了。
001.2011年5月.txt	46	91	91	128	3	令人不解的是，台湾岛上的电视节目，怎么会沦落到被日本人干涉？这跟当年日本人对杜重远和媒体《新生周刊》的干涉有何不同？《广播电视法》第21条明定：不得“损害国家利益或民族尊严”，王伟忠之流既然志在“传达天皇皇后亲民一面”，却以向日本人道歉自侮自贱，是何道理？
001.2011年5月.txt	52	103	103	133	3	谁能想到，76年前的“侮辱天皇”事件，却在76年后重演于台湾。唯一不同的是：当年大陆的杜重远和媒体，是多么保护国家利益和民主尊严；而今日台湾呢，王伟忠之流及其媒体，却保护日本让日本人“舒服”，而让这岛上的人变成全民不要脸，难道台湾人“舒服”吗？难道主管单位瞎了眼吗？
001.2011年5月.txt	54	107	107	136	4	陈文茜当年选立法委员，请我代她主持节目。我坐在主持台上，请来来宾蔡康永，三言两语，就使他招了、“出柜”了。蔡康永承认是GAY，是一种解脱。我问他过去为什么吞吞吐吐，他说他怕父亲知道会难过，足证小蔡不无孝心，他不愿使父亲发现蔡家绝后了。我说你可以AC/DC（交直流两用）呀。
001.2011年5月.txt	60	119	119	121	3	吾弟李放（放屁的放）聪明无比、中文一流，只是流年不利，有点白虎星（jinx），每见吾人看不到的镜头。有一次他在路上看到黑狗爬到黄狗背上，大肆性交，这本司空见惯；不料黑狗喘息方定，该黄狗又爬到黑狗背上，也狗屌回敬。李放大惊，走告于我，我笑毙了。
001.2011年5月.txt	65	129	129	134	4	苏东坡一生坎坷，原因之一是“与朝廷争胜”（跟政府抢风头），以致关到牢里。但他实际服刑只不过四个月零十二天，还赶不上我的零头。我也一生坎坷，但争胜范围，早逾大苏。迩来又“与年轻人争胜”，忽然心血来潮，写起140字的网路文学来。我多会写啊，一定把小鬼们一一打败，特此通告。
001.2011年5月.txt	76	151	151	110	7	我不会电脑打字，人人皆知，这次“哈囉李敖”上网，有人质疑是否李敖真身。答案是：文章是真的，因为别人写不出李敖这手奇文；打字是假的，第一批近30篇是我找杨宗儒律师告小S时，顺便请他助理们代打的。我只会揍人、不会打字，真糗。
001.2011年5月.txt	78	155	155	128	3	人可以做行脚僧，但不能搞行脚网站，总不能手拿底稿，到处求人打字。摄影家赖岳忠提议，我既在山上，不如请个文化大学女生，坐在咖啡店，就近打字。我说还是请个漂亮男生吧，使人以为我是GAY，屁精们就不会骂我了。（戡戡判断，网上骂你老爸的，9/10是同性恋。哈哈！）
001.2011年5月.txt	80	159	159	148	4	既然开了网站，看来总得自己学会打字，方能不受制于别的男女。几年前我试学一次，打了两行，累得满头大汗。现在决心重买一部电脑，学会打字，以湔前耻，并且赶走那个GAY。除非那个GAY，漂亮得像Morte a Venezia（魂断威尼斯）中那小男生，小男生15岁，瑞典人，漂亮得足可改变你性向。Yeah!
001.2011年5月.txt	88	175	175	118	3	一定有人不懂什么是“虚牝”，韩愈诗：“可怜无益费精神，有似黄金掷虚牝。”在阴为牝、在阳为牡，有所谓“牝鸡同晨”，意味母鸡报晓，抢了公鸡的歌喉。韩愈的诗，显然性别歧视，因他忘了“虚牡”，有伤男权。曾国藩诗中有“李生”之恋，老曾是GAY吧？
001.2011年5月.txt	90	179	179	115	4	目前的“哈囉李敖”班子如下：李敖手写、太太小屯打字、好友赖岳忠制作后PO。其中会惹来杀身之祸的文章，由岳忠斟酌，只在岛上发给Facebook。写成1000则后，有140000字了，会在岛上出书，这一没删的完整版，将来随我魂归祖国。
001.2011年5月.txt	95	189	189	155	5	美帝打我主意，由国会图书馆（ LIBRARY OF CONGRESS）成立“李敖特藏”（Li Ao Collection），也许有一天，我把骂北京的，藏在台北；骂台北的，藏在北京；骂北京台北的，藏在华盛顿；骂华盛顿的，藏在枕头底下。我最恨美帝，我的《阳痿美国》，将在美国出版，多反讽啊！此书在大陆反倒被查禁了。
001.2011年5月.txt	97	193	193	128	4	美帝的国会图书馆是世界第一图书馆，看中李敖，他们真有眼光、也有度量。但中央情报局（CIA）未必有度量，他们会学俄国，用居里夫人发现的“钋”（PO）毒死我，但“钋”太贵了，毒死一人，要花两亿，我打算写信给CIA，说：“妈的，别麻烦了，给我一亿，我自杀算了。”
001.2011年5月.txt	106	211	211	117	9	旧笑话书载：一人犯法，县官下令打他板子，不料裤子脱下，此人大叫道：“这屁股可是皇上玩过的，你敢打它，就犯了欺君之罪！”县官吓到了、不敢打了，还朝这屁股磕了三个响头。这笑话彰显了屁股的地位。请相信同性恋者的屁股，一经钦点，它可使你自由。
001.2011年5月.txt	108	215	215	113	3	南北朝时北齐大臣许散愁说：“散愁自少以来，不登娈童之床、不入季女之室。”原来不搞男生屁股，竟变成自己的美德项目之一。由此反证，当时社会风气，“登娈童之床”，多么普遍。是同性恋吗？非也。只是一种假同性恋，只是将男作女搞一下而已。
001.2011年5月.txt	110	219	219	120	3	当年我做预备军官时，有邻排班长鸡奸阿兵哥，经连长调查，原来此班长为了省钱，不找妓女，而就地取材，专搞男的。他的理论是：“三扁不如一圆，肏屁股等于过年。”原来他有同性恋的行为，却非同性恋的同志。由此可证，同性恋者实际可能没那么多，虚有其表耳。
001.2011年5月.txt	113	225	225	147	3	《论语》记子贡说：“夫子之文章，可得而闻也；夫子之言性与天道，不可得而闻也。”《史记》记子贡说： “夫子之文章，可得闻也；夫子言天道与性命，弗可得而闻也已。”如今我不但文章可得而闻，并且性命天道也可得而闻。孔子有知，必当说：“敖之，好勇过我，有所取材。”但我的取材，不涉荒淫与迷信，古人不及也。
001.2011年5月.txt	115	229	229	124	3	我写过《中国性研究》、《中国命研究》专书，日本鬼子且有日译本行世。日本鬼子写的书，曾有“禁汉译”者，我的书，本来是“禁日译”的，不料疏于防范，竟形漏网。日本鬼子识货，知道“支那人”如李敖者不简单，而“支那台湾人”却“近庙欺神”，不尽知也，其器小哉！
001.2011年5月.txt	119	237	237	106	3	一位女士对我说：“微博只不过是社交网站，你却把它当成战场，你是76岁的唐吉柯德啊？你混进来，把人家年轻人的婆婆妈妈鸡毛蒜皮给搅乱了。”我说：“说的对，我是一头误入后花园的老虎，但既然来了，总得叼他几个才松口呀。”
001.2011年5月.txt	122	243	243	136	3	2011年5月22日，星期日，午后买了水货的iPad II,晚上就打岀4篇，很有成就感。虽然打得有点歪七扭八。我是用手写法输入的，虽然我会汉语拼音，也会注音符号，但是运用起来，还是手写法得心应手。一字一音的方块字，竟大神附体在现代科技上，化落伍为神奇，真时来运转也，快哉！
001.2011年5月.txt	131	261	261	132	3	道学家朱子有首道学诗：“昨夜江边春水生，蒙冲巨舰一毛轻。向来枉费推移力，此日中流自在行。”意思是说：时机比努力推移重要，时机对了，一切水到船开。这种哲学，殉道者和革命家等“有为主义者”是不相信的，他们要在黑夜里闪出星光。于是，世界有了文天祥，我们啊，总要推移一下！
001.2011年5月.txt	133	265	265	136	4	《楚辞》中渔父对屈原说：“圣人不凝滞于物、而能与世推移。”“与世推移”的方法是：“沧浪之水清兮，可以濯吾缨；沧浪之水浊兮，可以濯吾足。”“推移”不是随波逐流，而是借力使力、是灵活的操纵、是化祸为福、是转败为功。“推移”不是被浊水打败，而是用浊水洗脚。“与世推移”是积极的。
001.2011年5月.txt	135	269	269	135	3	多年前，我写过一首诗：“不爱那么多 ，只爱一点点，别人的爱情像海深，我的爱情浅；不爱那么多，只爱一点点，别人的爱情像天长，我的爱情短；不爱那么多，只爱一点点，别人眉来又眼去，我只偷看你一眼。”24日上侯佩岑节目，她特别引进这首诗，并加认同，视为情之至境，小侯真是解人也。
001.2011年5月.txt	149	297	297	133	4	“惜竹不锄当路笋，伐薪教謢带巢枝。”为了珍惜弱小，人们有时要约束强大。反过来说，人们为了走向强大，却会无奈的牺牲弱小。宋代仁者范仲淹在“一路哭”的难局下，他宁肯选择“一家哭”、宁肯因全体而牺牲部分。在刻板的伦理学里，他会被质疑。但是，范仲淹绝不妇人之仁，他照干不误。
001.2011年5月.txt	151	301	301	131	3	一个精神病，总以为自己是一粒米，怕鸡吃他。经医生治疗，病好了。一天中午，他满头大汗、两眼发直，又找上医生，医生一看就知道病又发了，说：你知道吗， 你是人，不是米。病人答道：我知道我是人不是米，可是鸡不知道。先知李敖一生，要告诉许多人：别紧张了，我已经让鸡知道了。
001.2011年5月.txt	159	317	317	144	6	富兰克林讲过一个故事：清教徒坐船去美洲，遇到海盗，吓得逃到船舱里，却对他们的仆人大叫：我们是清教徒、我们是爱好和平的、不打仗的，可是你们不是啊，你们上去打海盗保护我们呀！富兰克林时代的清教徒，300年后都会电脑了。海盗仍旧是独眼龙，并且是“独眼魔”（one-eyed monster）了。
001.2011年5月.txt	161	321	321	133	4	秃子是很过敏的，有权的秃子更过敏，他不但不准你骂秃子，甚至不准你骂和尚，因为“指着和尚骂贼秃”，显然意在秃公。不过，千百年过去了、时代变了、生发剂也起秃回生了，秃子也变宽大了。他终于同意骂和尚不等于骂他。于是，秃子头戴假发，给了我们影射的自由。有一天他还会骂和尚呢。
001.2011年5月.txt	164	327	327	132	3	“吾见其进也，未见其止也。”要看75岁的李敖多进步吗？请看他在中国台湾出版的《阳痿美国》。这部大书652页，择精语详、妙趣横生，是反对美帝的经典之作。可惜有大官人不喜欢美国阳痿。虽然阳痿二字是学术名词。几经疏通，最后蒙准改名出版。阳痿美国岂易事哉！你得先阉了自己。
001.2011年5月.txt	168	335	335	133	3	同样一本书，却有两个名字：在海峡左边，叫《审判美国》；在海峡右边，叫《阳痿美国》。多妙啊！还没“审判”到美国，却先“审判”到“阳痿”！当年我做排长时候，手下的郑班长禁止他手下的小兵看一本名叫《青春花朵》的书，理由是书中有“月经”两个字！郑班长啊，做班长，真委曲了你。
001.2011年5月.txt	170	339	339	135	3	我虽然喜欢和孟夫子一样骂人，但我只是骂人，从不争权夺利，所以尚未引来杀身之祸。我一生争的是道理与是非，世俗的权与利，我不放在眼里。看到他们争权夺利，活像一群秃子在抢一把梳子，我为之大笑或窃笑（闽南话用“偷”笑，别有俗韵）。小时候在北京，看到漫画《秃秃大王》，于今为烈矣！
002.2011年6月.txt	11	21	21	135	3	蒋介石伪政权中有一个怪国防部长，叫俞大维。他看不起伪国会，每次由副部长代他出席。国会议员问副部长为什么部长不来？副部长答道：“为什么不来，我不知道；如果大家不欢迎我，我也可以不来。”万一副部长不来了，就轮到次长来了。国会议员怕老三来，就只好接受副部长了。老二总比老三好。
002.2011年6月.txt	13	25	25	133	5	伪国防部长俞大维到金门前线，问伪司令官说：对岸匪军有多少？答：30万。再问：他们打过来，怕不怕？答：不怕。再问：他们不打过来，却投降过来呢？伪司令官答道：投降过来，要供应30万人吃住、要管30万个囚犯，我们怕死了。这故事给了我们启示：投降的敌人，有时比作战的更可怕。
002.2011年6月.txt	16	31	31	167	3	二次世界大战时，英国向日本宣战，首相邱吉尔下笔声讨，人以舞文弄墨讥之。邱吉尔答道：When you have to kill a man it costs nothing to be polite.既白刃加之，施软语何伤？此奸雄之雅度也。中国文化有“诛杀”之论，“诛”就是宣布罪状。小日本其罪当诛，杀小日本前，舞文弄墨一下，也不错呀！
002.2011年6月.txt	20	39	39	181	4	二战日本投降，却还有飞机逼近美国军舰。海军上将赫尔赛（Halsey）下令：Investigate and shoot down all snoopers-not vindictively, but in a friendly sort of way.（查清楚、打下来。不是仇人相见，而是友谊式的打下来。）人生如战场，敌友之间、生死线上，你可以笑脸，但还是要开枪...
002.2011年6月.txt	23	45	45	139	4	坐在计程车里看书，司机突然问我几岁了？我漫应之曰：“69。”随即查觉，我明明76了，怎么说出69来？神经质的心理学家会感兴趣，从脱口而出的奇妙数字上，可以窥见李敖潜在的一面。69是什么？是颠倒的那个姿势？还是“人生七十古来稀”前的惜别？真相可能都是，7字当前，该惜别的岂只姿势？
002.2011年6月.txt	32	63	63	143	4	有人向福克纳（William Faulkner）抱怨：你的小说看了三遍都看不懂。福克纳说：看第四遍。这个美国文人没搞清楚：如果病在你晦涩，看第四遍也没用。有人看不懂我李敖的文字，倒不是第几遍的问题，而是中文程度的问题。你不能老是在很浅的中文里打转，要加强一下，你不能老是“人民文学”啊。
002.2011年6月.txt	37	73	73	151	4	孟子引齐景公的话说：“既不能令，又不受命，是绝物也。”什么是“绝物”？“绝物”就是自绝于人。这种人其实是鸵鸟，头埋沙中，不能正视现实。但他比“打不过他们，就加入他们”（If you can't lick'em, join'em.）的西方现实哲学，看来不无原则。鸵鸟拒绝同流合污，精神可嘉，至少不是风派。
002.2011年6月.txt	46	91	91	134	3	亲爱的，请告诉我：你有更高明的方法对付秦始皇。至少我敢用真名发表意见；至少我在网站把关的极限下、偷关私渡；至少我在出版社的设限下、逆向前行；至少我在“道旁儿”的说三道四下、累死了我的马（“杀君马者道旁儿”的典故。）我不奢求鼓励，但我要求行得通的方法。亲爱的，请告诉我。
002.2011年6月.txt	49	97	97	140	3	2011年6月8日，在台北故宫博物院，我终于有幸看到了361年后的重聚。重聚的是《富春山居图》，一张名画，在361年前身首异处，历经乱世、人祸、火焚、剪接，最后段落在海峡两岸博物院的一角，但是，终得千古知己使它重聚。名画有知，当“惊知己于千古”。庄子说“聚散以成”，我们终于懂了。
002.2011年6月.txt	51	101	101	135	3	重逢有三种：人与人的重逢、人与物的重逢、物与物的重逢。人与人的重逢，你会失落；人与物的重逢，你会惊喜；物与物的重逢，你会感叹，但感叹中有“物中无人”的客观，你会“专以物喜，不以己悲”，唐太宗坟前的“昭陵六骏”石马，被美国偷走两匹。有朝一日，原马归国，重逢之理，你就懂了。
002.2011年6月.txt	59	117	117	135	3	从国民党对言论控制的一把抓，到一手放，我亲历了他们“鹰犬聚”后“鸟兽散”的一次历程。他们不可一世的时候，查禁了我96本书；他们大澈大悟的时候，到我家来，摇身一变，化为我的朋友。我跟北京的小额说：我没有青春再等一次了。小额笑着说：今年不准的，也许明年就准了。她真是乐观派！
002.2011年6月.txt	61	121	121	132	5	国民党伪政府查禁书刊，大官人只决定禁禁禁，至于细节，却在中官人手里。中官人约我一见，递出名片，上有“张烈”二字。他说他是缪纶少将特别从政工干校请来的老师，是公事公办的。过了一阵子，他忽然来电话说：“我跟缪纶那小子吵架了，我不干了，你的书，不论写什么，我全通过了。”
002.2011年6月.txt	66	131	131	135	5	臧英年在台中一中时，高我三班。至今行年79，健康无比。我屈居76，年龄后人，健康绝不后人。两人一见面就开玩笑：“总有一天，到你坟上去小便。”前一阵子，他的同班林云死了，林云在台中一中时叫“林石”，那时还好好一个人，尚非妖僧。做妖僧后，可恶无比。真该到他坟上先来两泡尿啦！
002.2011年6月.txt	73	145	145	142	5	谈情说爱的最高境界，不在谈出来说出来，而在写岀来，写岀“纸上罗曼斯”、就是情书。现代人的最大无趣是：打字进入他们的感情世界，摧毁了他们的handwriting（手写体），呈现出来的是handwringing （绝望的扭绞双手），他们不会写字了。我真看不顺眼：打字的情书是哪门子情书啊？
002.2011年6月.txt	76	151	151	130	3	现代人的无趣可多了，其中之一是远离了钢笔。人类只有两种写字工具，笔尖可以表达出个性，就是毛笔和钢笔，其他种类的笔都不行。毛笔无复当年了，今人的毛笔字，写的不是毛笔字，而是“用带毛的笔写字”；至于钢笔字，不是不会写就是越写越丑。让我们用钢笔写4个字吧：钢笔万岁！
002.2011年6月.txt	78	155	155	142	3	联合国追查日本鬼子蹂躪慰安妇，鬼子为脱罪，愿每人送50万，“收买”被害人和解。我拿出收藏品100件义卖，得美金100万，每人分得50万，拒绝了鬼子钱。100件收藏品中，有我父亲年轻时用过的雪佛笔、我坐牢时用过的雪佛笔，两代家藏，悉作义举了。14年后的今天，我仍未忘情它们，真有欠洒脱。
002.2011年6月.txt	81	161	161	134	6	政商作业，难免要打字，其中函牍往还，打字也属常态，一信之末，加上鬼画符式的签名，便到对方手里了。不过，收到的是资讯，不是感情，更不是私情。为什么？因为只见到一小块亲笔签名，太单薄了。英国首相邱吉尔就发现了，他往往亲笔加上一行手写的问候，“点睛”了全信，就在最后那一行。
002.2011年6月.txt	83	165	165	133	3	党大员的毛病有三：一、说话时候，常常没幽默感；二、不说话时候，常常有“喉头异物感”；三、笑起来时候，常常皮笑肉不笑。“喉头异物感”是耳鼻喉科医生专用名词，指喉头老是感觉有东西卡在那儿，事实上，却一无所有。明明你自己神经兮兮，却“骨骾在喉”、煞有介事。党大员太累了吧？
002.2011年6月.txt	86	171	171	134	3	我母亲活了91岁。她在50以后，就预设防线，以玄言妙语，闪烁年龄。每遇不识相者问她几岁，她的统一答案是：“你看像几岁，就几岁。”原来老太太的高寿是“浮动汇率”式的，老而弥诈、高下随之。如今我也老不堪言，每思老太太的统一答案，深感学问渊深。我的客观系于你的主观，多妙啊！
002.2011年6月.txt	93	185	185	142	3	1946年转入美籍的英国诗人奥登（W. H. Auden）观察说：耳朵喜欢听熟悉的，听到意外的就不顺；眼睛喜欢看新奇的，看到重复的就厌烦。奥登的话，在唱歌的和写字的身上，我们会充分理解。歌手“一歌唱千回”，没人异议；写手一稿重出、一节反覆，就被追谴，这是不对的。想想“学而时习之”吧。
002.2011年6月.txt	96	191	191	136	3	菜市场后有陋巷，有我的理发师。每次理发300元，我另给小费100元，既平民又大方。过年时给1000元，更形慷慨。十多年前选伪总统，理发后我给了1000元。我太太奇怪，我答道：“选伪总统，安全局派了这么多黑衣保镖，站在店门口，把别的客人都吓跑了，还不该多给一点，压压惊吗？”
002.2011年6月.txt	98	195	195	137	3	元旦，马英九约金溥聪去政大山坡晨跑，又吃早餐。饭后要小店开120元发票，以利报帐。老板事后抱怨说：“他们吃早餐，门口站满了安全人员保护，别的客人进不来，害得我们忙了一阵，只赚到120元。”记得三年前，金溥聪上山请我吃饭，并无小气情事，足见以120元折腾小民，马氏一人杰作也。
002.2011年6月.txt	103	205	205	133	4	当年国民党扣我红帽子，但我年纪只是红卫兵，逗不上，就改扣我是台独，打入大牢。出狱前几个月，派大员我的老师吴俊才与我见面。吴俊才坦承国民党诬赖了我，但请我原谅国民党。我用日本话说：我“阿他马”（脑袋）可以原谅国民党，但“钦他马”（睾丸）很难原谅。原因无他，此身虚度耳。
002.2011年6月.txt	105	209	209	132	4	好友高信疆死后，他的太太柯元馨，在她们基督教墓园订了一块地。我对元馨和高士轩、高英轩说：“信疆在白色恐怖时代支持李敖，如今他走了，让我送他一个坟吧。”隔了一天，我就送上60万元。我向来不参加婚丧喜庆，自然也没参加高信疆的追悼会。几个月后，在阴雨中，我去坟上看了他。
