file	paragraph	line_start	line_end	char_count	score	snippet
036.2015年6月.txt	57	113	113	135	4	心理学家说人有奇怪的恐怖感。毛主席有“旷野恐怖”：整天在团体中打滚，反倒不习惯孤独，怕一个人在旷野。多年前我清早5点独行纱帽山脚，忽觉得眼前这山头压得我很不安，乃掉头而归。我不服气，第2天再走，终于穿山成功。“旷野恐怖”是可以克服的，我想起千山独行的徐霞客、忘掉毛泽东。
036.2015年6月.txt	60	119	119	143	3	1951.11.30起，毛泽东发电报：“来一次全党的大清理，彻底揭露一切大、中、小贪污事件”，“直至枪毙一批最严重的贪污犯，才能解决问题。”要把贪污1000万以上的共产党枪毙。64年过去了，那时的1000万相当今天的100万，用100的视野大开杀戒，“你知道的”那些人该枪毙100回啦。
036.2015年6月.txt	72	143	143	132	3	以色列没有鸽派，只有“鹰派和超级鹰派”。用同样句式，你这傻瓜听好：“台湾没有台独，只有假台独和超级假台独。”（胆小鬼台湾人一路玩假的，从来不敢台独；外省人紧抱“中华民国”臭招牌，所谓统一只是掩护超级假台独。）台湾唯一的真正统派是李敖，他目光如炬，点醒北京一群傻瓜。
036.2015年6月.txt	75	149	149	134	3	李戡《国民党员毛泽东》这本书里，提供我们一个线索：共产党在反国民党斗争中，用尽苦心和血泪，真刀真枪，玩真的以取天下。这一背景，引发错觉，以为别人也是玩真的，其实不然。台独从来都是一场牛屄和假戏。共产党很神经：战略上高估台独、战术上又错估台独，结果一再上当，吃了臭狗屎。
036.2015年6月.txt	90	179	179	133	3	孟子说干医生那行的盼人活；干卖棺材那行的盼人死，职业决定了心术。孟子不知道，有些职业更邪胡了：男模特儿太娘娘腔、演艺人员太虚情假意、广告从业者太有奶就是娘、新闻记者太因人成事唯恐天下不乱。梁启超说“莠民”是共产党，不幸教育出来的“莠民”这行更严重，他们的心术太坏了。
037.2015年7月.txt	7	13	13	133	4	我常常自豪说“我很土，我从没出过国。”我来台湾，在日本人屁滚以后；我去香港，在英国人尿流以后。有糊涂人问我：没出过国？你不是去过“中国”吗？我答道：中国不是外国，中国是我的国家、也是你的，虽然现在更是共产党的。糊涂人听了一愣。我打趣说：快加入共产党吧，立刻就是你的。
037.2015年7月.txt	13	25	25	135	5	瑰丽的抽象名词，动听而不切实际，“平等”就是其中之一。事实上，要靠别的：长寿靠妈、有钱靠爸、升官靠表哥表弟大小舅子、逞强靠打架。干明星靠脱裤子、演A片靠屌大。整同志靠秦城、搞革命靠变卦。反革命靠折腾、不革命靠打岔。早革命靠心狠、晚革命靠手辣。靠人进了八宝山，咱们才廖化。
037.2015年7月.txt	16	31	31	133	4	子曰“沽之哉！沽之哉！我待贾者也！”孔夫子周游列国，就是要找到识货的、把自己卖掉。网上说党中央以年薪500万收买他，夫子欣然就道、晋京请款。不料党中央说：我们只花小钱豢养走狗造谣说收买你，不是真花钱，只是斗臭你，你老人家怎么当真起来？孔夫子长叹一声：日你娘呀真小气！
037.2015年7月.txt	22	43	43	139	3	世界上主义有两种：一种“能做不能说”，说了会骗局拆穿、天下大乱；一种“能说不能做”，做了也会骗局拆穿、天下大乱。两种主义都有投机客穿插其中，扰人清梦、欺尽苍生。唯一两全其美的是“虚无主义”nihilism，说了做了都是空包弹，却使别的主义血肉横飞。好歹信个虚无主义吧，聊胜于无。
037.2015年7月.txt	28	55	55	141	3	这一阵子，发现4篇文章，都不是我写的，我未曾授权、未曾追认、也未曾默认：1.《李敖十评毛泽东》2.《台湾李敖谈中日，令国人汗颜！》3.《李敖谈钓鱼岛争端，一句话令13亿中国人汗颜！》4.《李敖：习近平伟大到哪里了？》中国本有“借你人头一用”的传统，如今只借大名不要人头了，宽大多了！
037.2015年7月.txt	34	67	67	143	4	李普曼（W. Lippmann）提到一个故事：1914年，一个远洋小岛对外联络只靠一条邮轮，而邮轮60天才路过一次，带来的新闻都是明日黄花。60天算什么！真是小意思。我第一次坐牢时，有4年8个月时间不准看报，知道的新闻更明日更黄花。出狱后常常好几天不看报，不看花开只看花落，也别有心得。
037.2015年7月.txt	37	73	73	139	3	夕阳之美，以其将尽；枫叶之美，以其枯黄；寿星之美，以其策杖；广陵散之美，以其绝响；“反之亦然”之美，以其在音韵上比拉丁文vice versa更动听。姓毛的之美，以其有姓蒋的比他更丑，如你不服气，当然你可以“反之亦然”。但别忘了，同为暴君，也有高下之分：一个称霸世界、一个是闭十。
037.2015年7月.txt	40	79	79	140	3	“中华民国”1912成立，1927国民党干下一票，抢走了它。但逆取不能顺守，1949招牌带到台湾，私下自承亡国，表面上窃国号以自娱。不料强盗碰到小偷，1999民进党干下一票，偷走了它。小偷以《台湾前途决议文》宣布接受“称为中华民国”。如今有人还信“中华民国”，强盗小偷都要笑你啦！
037.2015年7月.txt	43	85	85	134	3	混蛋有两类，个体混蛋与群体混蛋。个体混蛋因人而异，不论是阿Q式或梁漱溟式，都混得各有特色；群体混蛋则众口一声，蔚为焦点：台湾混蛋焦点是去中国化，喊海峡对岸是“中国”，不承认自己是中国人；大陆混蛋焦点是台湾民主化。其实两岸都不可能民主化：双方都是列宁式政党，怎能民主化？
037.2015年7月.txt	49	97	97	136	5	40年前在蒋介石黑狱，最后一年洗脑，缴报告才能过关。负责把关的上校端坐办公厅，等我写违心之论。不料我狡猾无比，我找来蒋介石全集，翻出一篇，照抄一通。上校不明真相，还改了几个字，打了80分。我心里窃笑不已：他妈的你老蒋整天把臭狗屎给我吃，这回你和你的上校吃你自己的臭狗屎吧！
037.2015年7月.txt	58	115	115	178	4	格兰特（Ulysses S. Grant）将军打赢美国南北战争。或问将军顾曲否？他答道：我仅知其二：一首是扬基歌，一首不是。I know only two tunes： One of them is "Yankee Doodle" and the other isn't. 乍听之下粗鲁不文，仔细一想倒也干脆。我爱国，我只欣赏宗国之音。其他小调，吾不屑也。
037.2015年7月.txt	64	127	127	174	3	“上帝在细节中”God is in the details.本是欧洲谚语，传到美国后，1992年量变，变成“上帝在细节中。魔鬼也在”God is in the details. But so is the Devil.这谚语提醒人们：谨小慎微多么重要。不过，我更喜欢定论重于细节：当我给一个人定论成王八蛋，我应放弃细节，我应后悔写了《蒋介石评传》！
037.2015年7月.txt	67	133	133	134	6	国民党失守济南时，被共产党打得屁滚尿流。军头王耀武化装逃出，屁滚以后，又要大便。他命副官递卫生纸给他，被共产党抓住，断定此马来头大，仗打败了还有人帮忙擦屁股，太可恶了。今天看到共产党在为蒋介石擦屁股，我掩鼻大笑：“一个伟大的党，本来以抓人擦屁股为专长的，怎么退步了？”
037.2015年7月.txt	70	139	139	138	3	万里99岁死了。6年前，他请万伯翱从北京带来一方砚台，送给了我。我以一本我的书，回赠了他。扉页写着“万里老先生清赏：先有万钧，方有雷霆；先有万里，方有鹏程。李敖2009年5月11日，中国台湾”。如今老辈凋零渐尽，我却常常想到他们。他们醇度最高，比较像共产党。现代的掺水太多了！
037.2015年7月.txt	73	145	145	134	3	共产党员、99岁的万里死了。他的了不起，不在一年之内在北京完成“起高楼”，而在行万里路后读一卷书。他敢抛弃教条，在肥西县“包产到户”、在凤阳县“包干到户”，发现农民比马克思更在行。《论语》记孔子坦承“吾不如老农”，万里认同了孔子：胶柱鼓瑟不是共产党，老农办事我才放心。
037.2015年7月.txt	76	151	151	132	3	古书给各行各业立传，不忘带上《隐逸传》。隐派遁入山林，本该自我埋没。郑板桥讥笑“孔明枉做那英雄汉，早知道茅庐高卧，省多少六出祁山”，所憾在此。隐派凭活得比敌人久，“眼看他起高楼、眼看他宴宾客、眼看他楼塌了。”最后有眼福“把兴亡看饱”。如今隐派已杳，连诸葛都不亮了。
037.2015年7月.txt	85	169	169	137	3	1620年英国清教徒到美洲时候，他们心怀故国，以英国文明为典范。两三百年下来，却形成美国风：从嚼口香糖，到翘二郎腿、到手抓汉堡、到倒灌可乐、到美式足球的粗野、到十字街头翻滚的“街舞”，全无盎格鲁撒克逊的绅士教养，且与遍地的欧式建筑风格全不相称。软件与硬件两不搭调，USA哟！
037.2015年7月.txt	88	175	175	135	3	我戏谑性的描写80后的我，用了8个大字：“恶贯满盈，百病丛生。”现代科技太可恶了，在它的检验下，我们无所遁形，任何健康的人，都可照出你有心病和毛病。古人“如见其肺肝焉”只是牛皮，现代人才真正做到这一点。更高明的是：在科技以外，我更看到病理现象以外的狼心狗肺，我呀超科技。
037.2015年7月.txt	94	187	187	138	3	陆判换心手法是聊斋神话，魏峥换心手术却是世界级的先行者。看了我的MRI，他劝我做次心导管，用“侵入性的检查方式”，使我了然于心。7月29日早上，杨茂勋、殷伟贤两大名医对我下手，侵入我的心臓。对我真是神奇的经验！事后魏峥告诉我：李登辉装了13个支架，你一个都不必装。李大师赢了！
038.2015年8月.txt	4	7	7	134	4	唐朝诗人王驾《社日》诗，最后两句是：“桑柘影斜春社散，家家扶得醉人归。”多年后，我发现这一名句，改成“家家扶得罪人归”，才更写实。白色恐怖时被害人名单是我一次次找到的、公布的，发现株连之广，十分惊人。大陆平反了冤假错案，但台湾一件也没平反。以为台湾有人权的，吃错了药。
038.2015年8月.txt	10	19	19	134	3	古人的插秧诗，第三句不好，我把全诗改写如下：“手把青秧插满田，低头便见水中天。其正若反方为道，退步原来是向前。”插秧时的农夫是倒着走的，所以形式上的退步，正彰显了他的前进。最近的学生运动正好相反：国家认同上，大学开倒车于先、中学入歧途于后，向前原来是退步！娃娃们疯了！
038.2015年8月.txt	16	31	31	133	3	“知言”不够、“解语”不够、洞察“言外之意”也不够，我们要直指本心，道破一些人的“潜台词”。“潜台词”是一种政治语言把戏，运用语言技巧、语言暗示，要你闻一知十。李登辉宣称“钓鱼岛是日本领土”，他的“潜台词”乃是：“台湾是日本领土”。只有这样理解，我们才能恍然大悟也！
038.2015年8月.txt	19	37	37	180	3	培根（Francis Bacon）论文里，收入回教教主的话：“山不朝默罕穆德，默罕穆德就朝山。”If the mountain won't come to Mohammed, Mohammed must go to the mountain. 这句话是英国人捏造的，把回回当成机会主义者。其实真正的回回坚定如山。现今世界的True-Believer只剩他们了。
038.2015年8月.txt	31	61	61	146	3	共产党饱经忧患，终于知道了：1.穷不是共产主义。2.马克思主义不够，中国特色的马克思才够。3.汉字拉丁化不可行。4.国家领导人不宜抽烟。5.小蜜和军队都靠打扮。6.伟哥可信。7.东洋人不可信、西洋人也不可信。8.台湾人不识好歹。9.台湾研究所不能知台。10.国民党抓李敖、关李敖，是有道理的。
038.2015年8月.txt	34	67	67	133	5	凡受过共产党教育的，共产党是他永远的江湖。这种人，即使有一天，自以为已经洗面、已经革心、已经反叛、已经脱身、已经飘洋过海、已经遁迹空门，都没用。在午夜梦回、在天人交战、在利害关头、在醉后露尾，他会原形毕露。他残存了共产党的小动作，却失掉了大理想：“江湖寥落尔安归？”
038.2015年8月.txt	40	79	79	135	3	末代皇帝溥仪君临满洲国，实际控制他的日本大员叫岸信介。二战后，岸信介以甲级战犯下狱，但美国人放出他，还支持他做了日本首相。他88岁生日，国民党满朝文武，一齐为这侵略中国的元凶祝寿。溥仪笑歪了：原来你们“自蒋总统以下”，比我更汉奸呢！（岸信介阴魂不散，外孙就是安倍首相。）
038.2015年8月.txt	46	91	91	133	4	孙中山是爱国者又怎样？爱国爱得“非我不可”，结果以零售方式卖了国；蒋介石是爱国者又怎样，爱国爱得“非他不可”，结果以批发方式卖了国。毛泽东当然是爱国者，爱国爱得“非你不可”，他把所有的你都给折腾出来了，你太累了。中国强了，可是你堕落了。你宁被孙蒋骗，也要对毛摇手了。
038.2015年8月.txt	55	109	109	149	3	西方摔跤有二：“古典式摔跤”（Graeco-Roman）只能攻击对方上半身；相对的，“自由式摔跤”（catch-as-catch-can）就不在此限，是不择手段的。看到电视上这种野蛮节目，我想到共产党。共产党是不择手段的。苦恼是对方也不择手段，唯一破解之道是更加不择手段：我捏到对方睾丸啦，我赢啦！
038.2015年8月.txt	58	115	115	154	3	改写了18世纪的英国名言：革命是恶棍的尾闾（the last refuge of a scoundrel）。一个恶棍，他牺牲别人，在所不惜；牺牲自己，在所不惜，最后革命成功，国家变强、好人变坏、坏人变贪、群众望洋兴叹。其实洋道德也在崩盘，川普（Trump）竞选美国总统，公然弃穷人不顾，看来还是中国恶棍厚道。
038.2015年8月.txt	67	133	133	134	3	苏轼与佛印和尚开玩笑。苏轼问你看我像什么？佛印说“你像一尊佛。”佛印问苏轼你看我像什么？苏轼说“你像一坨狗屎。”取快一时后，苏轼得意的告诉苏小妹。苏小妹说哥啊你输了，他的世界人呈佛相、你的世界视野低级。苏小妹世无其人，但我欣赏这个故事。先目中有佛吧，你才可以立地成佛。
038.2015年8月.txt	76	151	151	134	3	中国民族是颠沛流离的、民权是颠三倒四的、民生是颠簸困苦的。孙中山诪张为幻，以三民主义为天下倡，不但空话，并且文不对题：他倡言民权主义，但牛屄中没有一句人权，这是哪门子民权主义？国民党倡言“三民主义统一中国”，更是牛屄插花。共产主义的神通在用牛屄挡住牛屄 ，功不可没哟！
038.2015年8月.txt	91	181	181	137	3	国共两党争抗战之功，就像两个秃子在争一把梳子。其实日本在打下南京后“本可尽力追击，一直攻下武汉！”这是蒋介石秘密谈话中吐出的真言。日本溯江直上，重庆早在1937就丢了，还抗个屁啊？日本没韩信取三秦、李靖擒颉利的气魄，致留抗战美名给败将蒋光头，老共也要有屄大家分，秃秃大战呀！
039.2015年9月.txt	10	19	19	136	6	抗战是长期的、深入的、保留元气的，但蒋介石在抗战后36天就领导出大祸：他声称消灭日本上海陆战队，结果牛屄吹破。不料军事会议上宋美龄出现了，反对撤军，说再撑十几天就有白人相救。最后白人黄牛，中国总军力损失70%！好一个领导抗战！光第1年，70万军人、80个步兵师就全打垮了！
039.2015年9月.txt	13	25	25	133	4	“将帅无能，累死三军。”为什么抗战要给无能的人领导？因为他是“军事委员会委员长”，而军事委员会又是极权政党的畸形衙门，称不上是正规政府的合法单位。也就是说：“蒋委员长”的出现是不合法也不合格的。领导无方是他特色。看他剿共时被打得落花流水，能相信他抗日时不章法大乱吗？
039.2015年9月.txt	16	31	31	134	3	刘少奇以中华人民共和国主席之尊，被斗倒斗臭，甚至火葬时都不能用真名，革命一生，下场凄凉。死前说了一句名言：“好在历史是人民写的。”我觉得他老兄至死不悟。事实上，统治人民高高在上的党棍固不能写出真历史，他们统治下低低在下的人民也写不出真历史。真历史是独来独往的专家写的。
039.2015年9月.txt	19	37	37	134	3	出版《蒋介石评传》时，我对汪荣祖说：评传以后，会有许多文献冒出来，但这些文献只能更加证明我们的正确。如今蒋介石日记曝光了，他在813孤注一掷式领导，使中国元气大伤，所谓抗战8年，都是瞎猫碰死耗子！蒋介石日记中信心崩溃，哀叹道：“一生事业尽于此乎！”看到了吧？你还信他！
039.2015年9月.txt	31	61	61	135	3	中东难民问题祸首有二：一为英法帝国主义者硬划国界，祸起萧墙；一为美国帝国主义者硬塞进以色列，祸起哭墙。本来难民还在中东本土苟延残喘，但美国又从以色列东进，破坏生态平衡，于是引发了IS、引发了难民潮。如今我们看到两岁小男孩伏尸海滨，别忘了祸首是谁。祸首不是海水，是USA!
039.2015年9月.txt	40	79	79	134	3	《左传》记伯宗上朝前，老婆对他警告：“盗憎主人”“子好直言，必及于难”。果然伯宗难逃一死。伯宗之死，在他置身强盗窝中，主客不分。李敖和强盗却分得很清楚：李敖狡猾，以客自居；强盗也狡猾，以客相待。李敖知道未来的中国才是他的，盗憎客人，他无所谓：梦里自知身是客，中国梦呀！
039.2015年9月.txt	43	85	85	134	4	它真有趣！它不喜欢你哭、也不喜欢你笑，它喜欢你啼笑皆非、哭笑不得。你自己写的真文章，它查禁；别人捏造你的假文章，它放行。你自己出版的书，它查禁；别人捏造你的书，它放行。它没有神经病，也没有精神病，但有神经精神病：它以假作真，盯着你的神经或精神，盼你以真作假。它真有趣！
039.2015年9月.txt	46	91	91	134	3	国民党被共产党打到台湾后，谈共色变、闻共变色。除了给人大戴红帽外，又杠上开花，捏造新罪名。“隔海唱和”便是其一。几十年后，“隔海唱和”居然成真了。台湾这边高唱“中国”是对岸，对岸也独吞“中国”，相和而不疑。双方都忘了“我中有你、你中有我”的关系，海峡两岸都头脑不清了。
039.2015年9月.txt	49	97	97	133	3	共产党为了革命，不择手段，真话也说，谎话也说。革命成功后出了麻烦，谎话固没人信，真话也令人起疑。最难为情的是历史教育，竟教育出太多“史盲”的人。今天一位大学教授居然说：“收回东三省”是蒋介石干的。我忍不住要反问：当年丢掉东三省的，不姓蒋吗？共产党呀历史教育太失败了!
039.2015年9月.txt	52	103	103	136	3	一些混人口口声声台湾有民主，事实上，台湾有的是假民主。最新证据是施明德声明。他说“中华民国政府”要他在45天内缴出30万人联署书，他凑不到。翻开所谓《中华民国宪法》，从没规定参选总统要缴联署书，可是政府一动手脚，宪法就瘸了。一些混人相信宪法，不知两岸宪法一家亲，民主个屁。
039.2015年9月.txt	55	109	109	160	4	古人的一个梦：“天下乌乎定？定于一。”谁能一之？从秦皇汉武到西太后训政、国民党训政、共产党小红书人手一册乱政，都失败了，但科技成功了，人手一机，一网打尽了少男少女。卡莱尔（Carlyle）说不相信“个别无知的集体智慧”（the collective wisdom of individual ignorance）先知呀！
039.2015年9月.txt	58	115	115	135	3	汤武革命，宣传顺天应人的，但周武王亲手凌虐商纣和皇后的尸体，革命家原来是这样残暴的！革命家打到天下后，不愁人民高不高兴、满不满意、答不答应，就统治起来了。国民党大员曾夸口：周朝统治800年，国民党至少统治1000年！幸亏上帝数学不好，禁止国民党再玩了。上帝溺爱共产党哟。
039.2015年9月.txt	61	121	121	135	3	50年前，我就窃笑：国民党消灭李敖，“主流”消灭了，却换来了“乱流”，因为国民党的“中央宣传部”根本没本领制造“主流”。50年过去了，“乱流”淹没了国民党，李敖又碰到共产党了。共产党焦头烂额中，又来了“新乱流”网络。还想用制造“主流”来力挽狂澜吗？李敖老矣，尚能窃笑否？
039.2015年9月.txt	64	127	127	134	3	他们打天下时候，一方面“思想统一”、一方面“思想专断”。“思想统一”是革命、“思想专断”是反革命，正反双杀，人民透不过气来了。现在可好了，革命与反革命都免了，换成网络双杀。网络“思想统一”，他们众口一声；网络“思想专断”，你们众矢之的。网络原来是最会掐的，人民窒息了。
039.2015年9月.txt	67	133	133	133	3	如有上帝，一定是个始乱终弃的家伙。创造了万物，但创造后就不管了，也许厌倦了、也许忙疯了、也许开溜了、也许睡着了。总之，他不行了。所以要我们替天行道。上帝只管生与死、只管两头，中间全靠我们。我们好像“二锅头”，除去最先的和最后的，烈酒全是我们。别自卑了，我们也是上帝！
039.2015年9月.txt	70	139	139	132	3	北京故宫博物院90周年院庆，史无前例的展出镇院之宝，包括东晋王珣写的《伯远帖》。《伯远帖》当年流入市场时，台湾舍不得掏钱，周恩来却特批抢购。明朝董其昌曾题豪语：“既幸予得见王珣，又幸珣书不尽湮没，得见吾也。”如今不尽湮没的，又得见中国人了，共产党总算做了一件好事。
039.2015年9月.txt	73	145	145	139	3	小孩对玩具熊说话。小孩不以为玩具熊是玩具熊，也不以为自己是小孩。只以为玩具熊是另一个自己：一情相悦就是两情相悦、一厢情愿就是两小无猜。小孩与玩具熊一起长大，玩具熊像彼得潘（Peter Pan），拒绝长大、长捐箱底。直到一天被发现、被抱在怀里，没有迷茫、没有悲怆，只有成人的叹息。
039.2015年9月.txt	76	151	151	171	3	1946.6.19美国重量级拳王乔·路易斯（Joe Louis）奚落对手比利寇恩（Billy Conn），声言寇恩这小子不堪一击：“他有路可逃，却无地可避。”（He can run. But he can't hide.）70年后，美国面临了新挑战：美国以人权为名，窝藏了多少贪污份子，现在轮到中国的质疑了。想到乔·路易斯，让他们无地可避吧。
039.2015年9月.txt	88	175	175	148	4	1942年生的阿里（Muhammad Ali），38岁打完他世界拳王最后一仗，被新一代的对手“技术击倒”（TKO）了。他已老去，但他要用战败画下句点，而非惧战。35年后，同一个1942年生的宋楚瑜闪了出来，73岁了，并没老去，“闻鼓鼙而思良将”，令人鼓舞。但新一代的对手击倒了技术，战场空闻鼓鼙。
040.2015年10月.txt	4	7	7	133	3	《中国好声音》响彻云霄，从大同小异的即时催情比赛中，中国人目击了也耳闻了催情歌声，台上台下声泪俱下。台湾这边也不遑多让，一位歌星做巡回演唱，以中国方言做哀怨调，也声泪俱下，每场连哭7-8次，台上台下也哭成一团。响彻云霄是好的，但是催情太多太快，其为情也，未免太滥了！
040.2015年10月.txt	7	13	13	134	3	大明星王羽有一癖好：爱在情人身上问问题。他逼问：“我的鸡巴大不大？”直到情人哀呼“大大大！”他才罢休。使情人“大从口出”，此王羽也！共产党当然比王羽还王羽，听到的“大大大！”当然更传神。共产党会逼问：“高不高兴？满不满意？答不答应？”人民会哀呼：“大大大！大强奸呀！”
040.2015年10月.txt	10	19	19	136	3	那年小蕾收到礼物，一只胖胖的博美犬，叫嘟嘟。小蕾上学时，嘟嘟在家缠着鲁妈妈，跟进跟出，形影不离。一天夜里，嘟嘟弹跳起来，满地打滚。它挖出墙角的老鼠药误食了。鲁妈妈抱着嘟嘟，冲进出租车找兽医。半路上，嘟嘟伸出小舌头，舔向鲁妈妈的脸，就走了。人的生离叫号咷，狗的死别叫美丽 。
040.2015年10月.txt	13	25	25	133	3	古典中文里有一些颇有味道的词汇，被现代人忘记了。李大师行文之便，有时候神来一笔，将这些词汇翻个身，也算发思古之幽情。文章中我讽刺李登辉“匪夷所思”，同时做出平头修辞法，顺手拈出共产党“匪朝伊夕”， 以匪匪相对。“匪朝伊夕”是不止一天的意思。就让现代中国人古典一次吧。
