file	paragraph	line_start	line_end	char_count	score	snippet
024.2014年6月.txt	64	127	127	136	3	满清有两个世纪的吏治规模，国民党取而代之后，穷人乍富，虽没吃过猪肉，但见过猪走路；国民党有两个十年的吏治规模，共产党取而代之后，穷人翻身，未见过老汉骑驴，只见过驴打滚。从吏治规模看，一代不如一代。先用“官僚政治”取代“党僚政治”吧，猪比驴好。香港就猪了150年，官僚好哦。
024.2014年6月.txt	67	133	133	132	3	清官是好官，但做2件坏事：第一，清官胆气粗，整人绝不手软，会出现《老残游记》的可怕画面；第二，清官拖死狗，没有金钱诱因，会出现喝茶、看报、上厕所、剪指甲等怠工症状，从长远看，对建造又长又远的全国铁路有损。能做事的“非清官”不全是坏事，让我们邪视现实，痛苦的想一想。
024.2014年6月.txt	70	139	139	132	4	孔子被神化，但“万世师表”的老底子，依稀长在，不料降至台湾，却被功利成文昌神，管起升学考试来了，孔庙出现“高中登科，考生祈福”活动，斯文扫地极了。孔子以外，关公又被盯上，“忠肝义胆”的关云长，竟被功利成财神，管起发财来了。世俗真气人！孔夫子真要抱着关老爷大哭一场。
024.2014年6月.txt	73	145	145	134	3	北京大学老校长蔡元培指出：要有“一介不取”的清廉，方能言共产。不幸理想主义者变成了当权派，当权派本人，很难挡住老婆、女婿、姐夫、和有小蜜的秘书不清亷了，于是，共产党只留给圣人做了。台湾电视播出地方角头的秘密录音，角头说选举不搞钱的，只有李敖。这角头真识货，可做共产党。
024.2014年6月.txt	79	157	157	134	4	我半开玩笑说过：老共最对不起我们的是：它跟老蒋折腾25年，把老蒋赶到台湾后，坐视老蒋折腾我们26年！虽然统治强度不如老共，统治密度绝对凌驾老共：台湾只占世界土地万分之二，没什么人甩它，老蒋可以从容“阴天打孩子”，躬亲细务。如今档案俱在，又鸡毛又龟毛，万古云霄二毛毛啦！
024.2014年6月.txt	85	169	169	135	3	从来没有一首歌能禁得起那么折腾，最后它还赢了！就是《何日君再来》。最早周璇唱红了它，接着李香兰唱疯了它。日本兵喜欢，上级禁唱，但禁不住。国军也喜欢，上级禁唱，也禁不住。最后被邓丽君唱到大陆，红军也喜欢，更禁不住。70年折腾后，它自己君再来了，禁它的日本人中国人都死光了。
025.2014年7月.txt	7	13	13	156	3	饱经世故的牧师，同两个教友，到乡下布道。归途已晚，找了半天，只有一家低级小酒馆开着。饭菜上桌后，教友请牧师带头祷告。牧师说：“我想还是不祷告比较好。我不想让上帝知道我在这儿。”（I'd rather not. I don't want Him to know I'm here.）不要什么都告诉上帝，这牧师真好！
025.2014年7月.txt	16	31	31	145	3	统计上搬弄的“大数法则”（law of large numbers），在政治上可没那么啰嗦，毛大王懒得懂什么统计学，却铁口直断“人多好办事”。但毛大王不知道，人多到党员8千万，也赶不上13亿人民多。人民是最后的残存者，因为他们是中国的等号。官一代、党二代、富三代又怎样，中国人民永远一万代！
025.2014年7月.txt	28	55	55	134	4	奉劝同胞两个不要：第一，不要因为恨一个党，就以为另一个党是好东西；第二，不要因为恨一个党，就连带对中国失望。戴传贤说“周朝统治八百年，我们国民党至少统治一千年。”一千年又怎样？自秦始皇以下，有2132年你就没统治到！戴传贤最后自杀了，中国依然健在，欢迎统治，我收你尸。
025.2014年7月.txt	34	67	67	136	4	林青霞60岁，富商老倌的丈夫，为她打造了豪宅，港币11亿。我忍不住想：林青霞当年如不嫁给这么一身铜臭的丈夫，而能“霞光映照”在自己一脸的青灵之气上，该多么好！当年的林青霞有她独特的美丽，琼瑶的俗情戏埋没不了她、二秦的脂粉气埋没不了她，但她却为港仔的铜臭风华落尽，真可惜啊！
025.2014年7月.txt	40	79	79	132	3	庄子“不如相忘于江湖”，用于后代，意境不同。王国维自杀前“江湖寥落尔安归”，感于国民党共产党的双杀下，遁迹江湖，并非易事：你忘了他们，他们并没忘了你。我呢，正好相反，我迎上前去。杀声如草，巷战于江湖。司马迁虽被去势，但没放过汉武帝。司马迁都会漏网，何况李敖大鸡鸡？
025.2014年7月.txt	43	85	85	133	3	孟子说了一段相对论：“君之视臣如土芥，则臣视君如寇雠。”翻成今天的话：“你统治者不把我看在眼里，在我眼里你就是敌人。”也就是说：“你不以人民内部矛盾重视我，我就弄个敌我矛盾送给你！”为什么人民总是气呼呼的？因为是你们统治我们呀！为什么要受你们的气？只有敌视才是正义！
025.2014年7月.txt	46	91	91	137	3	英国文学家王尔德（Wilde）感叹读者2变：由文人写书俗人读、到俗人写书无人读，斯文在兹。在中国，有3变：由李敖写书蔡康永读、到蔡康永写书小S读、到小S写书她扫地的女佣读，斯文扫地。斯文在兹也好、斯文扫地也罢，都显示了“著书立说”这一高雅，已被“著书立马”取代。马子当道了！
025.2014年7月.txt	52	103	103	131	3	除了天堂、上帝、博爱、平等这些美丽的抽象名词外，民主该是最令我们着迷的了。真相却是：它是人类自欺自欺又自欺的一个代数！自从人类发明麦克风后，直接民主已被大嗓门的间接民主取代，人民得到的，只是选“A群坏人”取代“B群坏人”的果实，汤都没换，只换个被压迫的肩膀而已。
025.2014年7月.txt	58	115	115	132	4	名导演李翰祥写回忆，提到李敖的一些小故事。如今我也提他一件：李翰祥自台湾回归大陆，在北京拍片，备受官方礼遇，拍清宫戏，出入紫禁城，尤蒙光宠。但他偷偷写日记，却引李后主的词解嘲：“梦里不知身是客！”他发觉共产党拿他当客人！原来客人的中国梦不是主人的！抱歉把你见外了！
025.2014年7月.txt	67	133	133	139	3	我不是拳王，30岁被人打倒，必须退休；我不是明星，40岁被人取代，必须退休；我不是夫子，50岁而知天命，必须退休；我是姜太公，80岁没遇文王，反被武王、成王关起来，不退休也得退休。80岁了，终于老去，我用煞车煞我自己，提醒自己要懒散起来：救命比革命重要，活100岁的，不是他们。
025.2014年7月.txt	70	139	139	138	3	在香港第三天，行程只安排了一件：去红毛坟场看座坟。坟上的碑没有名字，因为114年前，墓中人死于暗杀，政治顾忌使他变成无名英雄。其实有名也白有，他不幸做了孙中山的先行者，以致必被打压。他是兴中会的真正会长，他的存在，证明了孙中山创建檀香山兴中会是谎言。他叫杨衢云，死于1900。
025.2014年7月.txt	76	151	151	139	4	120年前的7月25日，日本打沉了“高升号”，950名中国士兵牺牲了，开始了甲午战争。120年过去了，30多年的自强大梦梦碎、50多年的变法好梦、立宪怪梦、新华春梦、金陵迷梦梦碎，但是，最后中国站起来了、飞起来了。作恶多端的共产党功不可没。我梦碎，所以我梦醒。共产党呀使我梦醒。
025.2014年7月.txt	79	157	157	132	3	抗战胜利后，国民党抓到北洋军阀齐夑元，说他是汉奸。被枪毙前，齐燮元气势不挠，大骂说：“蒋介石是汉奸，他亲美；汪精卫是汉奸，他亲日；毛泽东是汉奸，他亲苏。我不是汉奸！”这一汉奸鉴定论，发人深省。齐燮元实非汉奸。但要做汉奸也得够资格呢，李登辉就不是汉奸，他是日本人呀！
025.2014年7月.txt	82	163	163	136	3	汉朝人“抱恨而入地”、唐朝人“恨不相逢未嫁时”，恨不是仇恨，而是终身遗憾。凡人所恨，不外生不逢时、死不逢地、铁不成钢、鲜花插在牛粪上之类，但大人物所恨，就别出一格：伟大的毛主席恨什么？恨只活了83？83已是高寿，不应有恨，恨的该是活了83年还没等到伟哥，哥儿们太反革命了！
026.2014年8月.txt	10	19	19	168	3	前美国驻联合国大使阿尔布莱特（Albright），在回忆录第275页提到斯塔儿（Stahl）问她：美国整伊拉克，50万小孩无辜而死，代价太大了吧。她回答说“代价是值得的。”（but the price, we think , the price is worth it.）精彩啊！911我死3千是无辜者，你死50万就不是，我的数学真好！
026.2014年8月.txt	13	25	25	132	3	苏轼有两句诗：“长生未暇学，请学长不死。”长生指学仙，是道教路线；长不死指不灭，是佛教路线。有人野心很大，他不能长生流芳百世，但能长不死遗臭万年。至少他的“遗教”和“遗著”还在死后盯人不放。乾隆皇帝聪明，他查禁了雍正老子的书；共产党更聪明，连毛选集第五卷也查禁啦。
026.2014年8月.txt	16	31	31	137	4	当年刘家昌一心想成导演，兜到一点钱，分我1万，央我装成制片人，因我有汽车，可冒充大阔佬。有次小便时，他低头对着小鸡鸡，长叹说：“浑身上下长7000根鸡巴，也肏不完天下美女！”我听了大笑。7000根鸡巴长在身上，活像一只刺猬啊！后来他投降国民党了，他已不复家昌，他真是刺猬了。
026.2014年8月.txt	22	43	43	135	3	蒋经国做伪国防部总政治部主任时，下部队视察，发现老兵有性病。问为什么不用卫生套（保险套）？老兵反问：“报告主任，你穿袜子洗脚吗？”老兵没有明天，他懂得及时行乐！我如写章回小说，第一回题目都敲定了：“蒋经国脱裤子放屁；老爷兵穿袜子洗脚。”卫生套是违反心理卫生的，太扫兴啦。
026.2014年8月.txt	25	49	49	135	3	中文“那”有4种发音。富兰克林说“哪里”自由“哪里”就是我祖国，采第3声。我在祖国演讲时，故意反转富兰克林的话，并将“哪”字改成第4声，我提高音调、把手一指说：“那里”是我祖国，我要使它自由。如今9年了，任重道远、舍近求远，一个人在好高骛远。自由是一种示众，我先斩首吧。
026.2014年8月.txt	28	55	55	135	3	好友胡基峻气冲冲的说：“国民党共产党是两个王八蛋政权。”我笑说“共产党至少对你做了一件好事。什么事？他们替你养了50年的妈！你家老太太活到今天还健在，这不是你们逃到美国的功劳！这可是王八蛋政权的功劳！”49以后，中国人的平均寿命增加了30岁，这是恶贯满盈的共产党的功劳。
026.2014年8月.txt	34	67	67	135	4	陶晶莹小两口跨海主持电视，季薪人民币千万，做了两集，就累倒了。广东某杂志联合四川某电视异想天开，要开“中国好文辞”节目，大家比赛，请李敖裁判。不料报上去，广电单位立予封杀。但该单位一定受到处分：“挡李敖财路，应予嘉奖；救李敖老命，法所难容。错失累死他的机会，后患无穷！”
026.2014年8月.txt	40	79	79	134	3	道德情操使共产党有所不为，革命需要使共产党无所不为。不料革命需要越解释越宽，贪财好色都变成革命需要，于是，理直气壮变成了屌直气壮，共产党堕落了！救赎之道有很多种，我认为同性恋是最根本的，同性恋使人回归到“肛门期”，不再对女主播有兴趣，不失为一个好起点。中国共产党万岁！
026.2014年8月.txt	43	85	85	131	3	“横眉冷对千夫指”是一种病态、一种小气、一种绍兴师爷的官僚嘴脸、一种不见开朗笑容的阴沉，令人讨厌。男人要有男人性格，并非胸前长毛的才是男人，张良胸前就没长毛，并且看来像“妇人好女”，但他打败秦始皇的秦二代，在指顾之间。他从不横眉，他有敌人，却无敌意。他是大丈夫。
026.2014年8月.txt	46	91	91	132	6	台湾一家商号，老被小偷光顾，店主人火了，贴出大字报，正告小偷8个大字：“抓到先打，再送警局！”我看了大笑。这不是党中央吗？你犯了案，我先“党纪处分”，再“法律处分”，前者不是“抓到先打”吗？后者不是“再送警局”吗？乍看“双开”，实际三开，因为法律靠边站，也给开了。
026.2014年8月.txt	49	97	97	136	3	在《汉书》《后汉书》里，都看到对“豺狼横道”“豺狼当路”的痛恨。但古人淳朴，分不清这是两种情况：1.是“当道”，豺狼为所欲为；2.是“挡道”，豺狼为所欲为，却又挡住不让你有做为。它们的可恶是今天不给机会，明天也不留机会。他们官二代富三代，你却永远划时代。你这笨蛋，你懂的。
026.2014年8月.txt	61	121	121	135	3	孙中山闭门造出行政、立法、司法、监察、考试5个院，有个人做过3个院长，就是大汉奸梁鸿志。被枪决前，他觉悟说：“人间最脏的两个东西，男人最喜欢搞，一个是政治，一个是屄。”其实此公只觉悟了一半，他不知道一个是可以洗的；一个是藏在主义之下，洗不掉的。搞政治脏不了屄，但脏了屌。
026.2014年8月.txt	64	127	127	136	3	水浒李逵大喝一声：“你这厮是什么鸟人，敢在这里翦径！”翦径就是拦路抢劫。1000年后，强盗变成了执政者，抢劫了国家资源，对你只拦路了：拦你的出书、拦你的言论、拦你的微博、拦你的粉丝数量。他们并不重视你，但重视他们拦路的业绩。他们不是你的仇人，他们下班后是党外、梦里是李逵。
026.2014年8月.txt	67	133	133	144	3	大学时看过一场电影，法兰克辛那屈（Frank Sinatra）演的。演一位歌手，被黑社会割断声带，他从后台走出，望着银幕背面的投影，夷然自语说：“我才是真的人，他们只是影子。”60年过去了，这句台词常常出现在我记忆里。60年来我阅人无数，但看到太多的假货和他影子。假货的唯一真实是他影子。
026.2014年8月.txt	79	157	157	137	4	一位牙医白手起家，白手是4只手，内含太太2只。小两口辛苦40年，变成老俩口，发生财务纠纷。牙医说钱是他的、太太说钱不是你的，一起找女儿评理。不料女儿英国留学，女强人也，两腿朝办公桌一翘，裁判说：“钱也不是爸的、钱也不是妈的，钱早晚是我的！”My God！这女强人是共产党吧？
026.2014年8月.txt	91	181	181	133	4	柯震东痛哭流涕记者会上，出来一种声音：“柯震东三个字，不属他个人，属于爱他的粉丝全体。”谁还会不原谅小柯呢？毛泽东以三七开盖棺论定：“毛泽东背叛了毛泽东思想，毛泽东思想不属他个人，属于集思广益群策群力的同志全体。”谁还会不原谅老毛呢？你这笨蛋！以为骗倒你的只姓毛吗？
027.2014年9月.txt	16	31	31	133	11	明星最拿手的是说哭就哭，你看柯震东道歉，哭得多么壮观！不过，非哭不可，倒可换个诉求：他该哭诉：“一罪不两罚”是法律大原则，我在大陆已被打过屁股，为什么回台湾又被打屁股？这不是两个中国吗？两个中国，你们不承认，但我屁股承认。我要哭给你们看！不为两个中国，为了一个屁股！
027.2014年9月.txt	25	49	49	155	3	动物知死也会死。它们会自行了断、They treat themselves. 它们知道怎样戛然而去、不告而别，不像人类那样拖泥带水。动物中老象之死是最迷人的：看来蹓跶，实系出走；看来脱队，实系离群。传说中有“象之墓园”（elephant graveyard），说老象会自行报到，并无根据。对老象，墓园何其小哉！
027.2014年9月.txt	46	91	91	134	4	美国在一战、二战时，都不是首开其端的开战者，都是事后加入的参战者，开战不如参战，参战才能占便宜。二战以后，美国耍老大，敢为天下先，在朝鲜、在越南，吃尽苦头；在中东，也占不到便宜，最后打悚了、怕死人，宣布撤军了。于是，丢人现眼到全世界了：你陆军不敢登陆，再也没人怕你了！
027.2014年9月.txt	49	97	97	148	3	说老共教育成功，你骂我媚共。但它教育出个混蛋的你，你竟变成它的证人！英文偷了一句西斑牙谚语：To gave the devil his due.正是中国“憎而知其善”的古训。老共的教育是武断的，武断到后来，它做的一些好事也被抹杀了，弄得没人“知其善”说公道话了。你以为你反共吗？你一脑门子共产党！
027.2014年9月.txt	52	103	103	133	3	实践是检验真理的唯一标准，标准因情况而定：情况是买手机，要轻薄短小；情况是看A片，要用其所长；情况是玩公平，要截长补短；情况是搞共产，要从长计议。长长短短都是实践、说长道短也是实践，要多长要多短不能靠马克思，马克思长于“资本论”却短于“共产论”，他的真理先瘸了一半。
027.2014年9月.txt	55	109	109	136	3	为了抗战，左派右派学生，在80年前的北大礼堂，发生了激烈冲突，互骂汉奸。在台上，胡适教授大声提醒：“这屋里，没有汉奸！”今天香港普选，官方提出“爱国爱港”标准，这不是博大的心怀。凭什么我爱不爱国由你决定？凭什么你以为你比我更爱国？为什么不有点气魄：“这屋里，没人不爱国！”
027.2014年9月.txt	58	115	115	140	3	1984.10.3邓小平对港澳同胞国庆观礼团说：有些人担心我们老头子不在了，政策会变。其实下一代也不会变。大陆发展起来了，对港澳，“那时还会小里小气地处理这些问题吗？所以不要担心变，变不了。”如今有些人果然担心北京小里小气了，北京应该想想老头子的远见，不要小里小气怀疑港仔不爱国。
027.2014年9月.txt	61	121	121	133	3	五方杂处中，要练习块然独处。要独具慧眼，从“云深不知处”的迷离中，看到“云深却知处”：看真理，要看出处；看黑暗，要看明处；看疾苦，要看痛处；看故弄玄虚的数学，要看难处。对昆虫，看它害处；对资本家，看它短处。但看共产党啊，请快乐一点，如看黑人那根大茄子，千万看它长处。
027.2014年9月.txt	85	169	169	136	3	49以来，海峡东边，公开而勇敢指出“中华民国”亡国了，只有一个人，就是李敖。在伪政府全岛庆祝“中华民国100年”的关口，我还出版了《第73烈士》，封面印着：“烈士永生，民国已死。建国百年，一派胡言！”今天凡认为“中华民国”没亡的，不论蓝绿，其实都是台独。国民党者，台独也！
027.2014年9月.txt	91	181	181	138	3	人类有个不要脸的“国家”，本是国共合作的孽种，拿苏联钱，在广东成立叛乱团体。1927年，它偷走正统的“中华民国”招牌，鹊巢鸠占。这头鸠很歹命，最后首都丢了2次、领土丢了千分之977、人口丢了13亿、统治时间丢了65年。但鸠还要勾践复国！鸠啊鸠，勾践的鸡巴毛都白了，你有完没完？
028.2014年10月.txt	7	13	13	134	4	2003年，前列腺手术后，要漏尿好一阵子。阴错阳差，发现卫生棉大可借用，不久我就变成专家，并开玩笑说本大师可做卫生棉广告，实践是检验卫生棉的唯一标准。卫生棉的奥妙是它明明存在，却使你自欺它并不存在，全世界的昏君都会有“卫生棉现象”。直到有一天，自欺失效，皇上尿裤子了！
028.2014年10月.txt	10	19	19	133	3	谚语会自我修饰，越修越细腻。吕氏春秋的“掩耳盗钟”，红楼梦修饰成“掩耳盗铃”，用具体写抽象，以为我听不到、你就没吭声了。不过，要自欺，悉听尊便；要欺人，就没那么简单。现代科技最滑头的趋向是：它给了统治者道高一尺，却又给了被统治者魔高一丈。你的高墙，挡不住我的翻墙了。
028.2014年10月.txt	16	31	31	133	3	中国人写英文，自辜鸿铭以下，偶有高手，钱钟书自是其中之一。此公跟汪荣祖聊天，私下亦有憾意，他说他的英文虽好，但少了“三分随便”。我认为文章要出神入化、要“功夫深处却平夷”。入化是功夫深处，出神是平夷。平夷就是三分随便。李敖的火候不但三分随便，还能随地小便呢。高手呀！
028.2014年10月.txt	34	67	67	144	4	傻瓜眼里，敌人只有1种；聪明人眼中，敌人有6种：1.敌人，2.朋友，3.同志，4.领袖，5.公安人员，6.啦啦队。公安人员本来不算敌人，但你摸不透他什么时候忽然公事公办，所以要敌视之。啦啦队看来拥护你，实际是叫你玩命。“杀君马者道旁儿”，路边为赛马叫好的，其实就是累死你马的。都是敌人呀！
028.2014年10月.txt	37	73	73	131	3	李戡新书《国民党员毛泽东》重描了一段史实：“国共合作”本是共产党的惯技与宿命，共产党也因合作而占了便宜。从此一直“养寇自重”，以国民党为对象，对付台湾。殊不知这个构想错了，导致今天的进退失据。为了全民觉悟、为了老共断念、为了白毛僵尸不再还阳搞怪，国民党必须消灭！
028.2014年10月.txt	40	79	79	138	4	共产党敢承认冤假错案，国民党不敢承认，把29407件一件都不平反，但愿对每件补偿了事。方法是坐穿牢底也好、横尸法场也罢，每件都以600万为上限，从上限递减，我这坐牢没超过10年的只分到280万。我拿280万给小屯，小屯白眼一翻，问：“枪毙可有600万哪！现在枪毙还来得及吗？”
028.2014年10月.txt	46	91	91	133	3	海峡两岸都有骂李敖的：台湾偏重“猪眼看人”，猪眼豕视，看人比较持平，认为李敖好骂人，但独来独往；大陆偏重“狗眼看人”，狗眼势利，不能没主子去靠，靠马靠列靠恩靠斯靠毛，乃至靠老蒋靠小蒋，狗眼势利眼、狗眼看人低，以为李敖也跟你一样。其实李敖哪个党都没饶，党都是狗娘养的！
028.2014年10月.txt	64	127	127	137	4	在台湾住了65年。头脑不清的人问我：你不承认“中华民国”那你住在哪里？我答道：“我住在中国。”我的答案，又准确又吊诡。我承认的中国是万年的，但国号是有阶段性的，我反对伪国号，所谓“中华民国”已亡国在1949，再打这招牌就是伪国号。我承认死尸，但不承认僵尸。我他妈就这么干脆！
028.2014年10月.txt	70	139	139	156	3	姓毛的说“千里来寻故地，旧貌变新颜”，65年来，我信手寻出10项：1.富国强兵，2.接班有序，3.全民爱钱，4.集体媚美，5.男装崇洋，6.女装露肉，7.唱歌不红，8.准养猫狗，9.怨气冲天，10.不毛之地。所谓不毛之地，是指连《毛泽东选集》第五卷都给变相查禁了，连姓毛的书都禁，何况姓李的？依然旧貌，不见新颜。
028.2014年10月.txt	76	151	151	137	4	旧观念很笨：喝牛奶要养母牛。新观念就想通了：养母牛干嘛？母牛你养，牛奶我喝，不更划得来吗？新式帝国主义就如此。美国养了菲律宾48年，最后只留美军基地，牛奶照喝、麻烦全免，多爽啊！有人搞“51俱乐部”，想把台湾成为美国第51州。美帝连菲菲都不要呢，会要你吗？做狗都少两条腿呢！
028.2014年10月.txt	82	163	163	139	3	我有2点是农业社会的：第一，友情观念是“够朋友的”，我不喜欢现代人；第二，金钱观念是“反纸币的”，我收藏“中华民国1921年造”的袁大头。这种壹圆银币在袁世凯死后仍不贬值。而1921那一年，正值共产党诞生。我老袁一生没见过什么共产党、也没领教过。但老袁永不凋零，因为我信银本位！
028.2014年10月.txt	85	169	169	162	3	终于查清楚了：文抄公林肯抄了神学家派克（Theodore Parker）之言！追踪当年文献，孙中山译成民有、民治、民享是错误的，因在文献中，of the people是宾语，与by the people , for the people并不平行。伪君子林肯信的是“民主基础上的集中和集中指导下的民主”，正是今天党中央干的呀！
028.2014年10月.txt	91	181	181	134	3	对台湾政策，有三顶大错误：1.顶“蓝顶余孽”拉马串连也；2.顶“绿顶新贵”与虎谋皮也；3.顶“红顶商人”引狼入室也。“红顶商人”中，姓尹的在西安言而无信、姓魏的用馊油欺尽苍生，党中大员且包庇之，人民做何感想？真正共产党员做何感想？灭顶吧！老兄，他们不灭顶，就轮到你啦！
028.2014年10月.txt	94	187	187	132	3	奴才思维有2种。海峡东边是“国民党太宽大了：怎么把李敖给放出来了？”海峡西边是“蒋介石没枪毙李敖，李敖应感谢蒋介石。”2种思维都是奴才思维。为何不问国民党有何权力抓人关人？为何不问蒋介石无杀人之权李敖也无可杀之罪？不知追究人权的凌夷，反倒讴歌主子的宏恩，皆奴才也！
