file	paragraph	line_start	line_end	char_count	score	snippet
001.介绍我的《为中国思想趋向求答案》.txt	10	19	19	150	3	所以，一个活人，灌着一脑袋“僵尸思想”，在我们这个社会里毫不稀奇。所谓僵尸思想，种类是很多的：例如“孔老二思想”、“西门庆思想”、“魏忠贤思想”、“袁大头思想”……到处都可以在中国人的行尸走肉上借尸还魂。所以，在许多时候，我简直怀疑：我们到底是活在现代呢还是生在古代？是死人重生呢还是根本就是活死人？
001.介绍我的《为中国思想趋向求答案》.txt	20	39	39	157	5	真正肯为中国文化思想趋向求答案的人，他们必定愿意做一个战士，去打几场漂亮的仗，乃至准备打一场勃朗宁（Robert Browning）所谓的“最好的又最后的”（The best and the last）一场仗。他们可能被暂时封住嘴、锁住腿，可是他们永远不会失败或死亡——这样的战士不会失败，十字架上的人物不会死亡。
002.给谈中西文化的人看看病.txt	21	41	41	229	3	我们试看这三人所用的句法：“非西人所能及者”、“非西洋人识量所及”、“非任何歧出者之所能企及”，完全是如出一辙的抹杀主义。他们的句式都是“非……所及”的格局，都有着目空一切的狂妄，但是他们三位只是九牛一毛而已，这种妙人今天还多着呢！试看有多少人摒西医不用，而迷恋着五运六气“寸关尺”的中医，有多少人摒正规音乐不学，而迷恋着七音六吕“笙萧缘”的国乐？……这种中胜...
002.给谈中西文化的人看看病.txt	25	49	49	301	3	这种“原在吾儒覆载之中”的大言，在我们国民心中流传很广：阮元就拿过后汉的四分法来比西洋数学（《畴人传》）；印光任就拿过周髀来包括“浑盖通宪之器，寒热五带之理”（《澳门纪略》）；陈启天就拿过孟子的话来比近代民主政治的观念（《中国政治哲学概论》）；毛子水就拿过《大戴礼记》“四角之不掩”的话来比西方的地圆说（《中国科学思想》）。现在某些人做一些事，动辄以古人“先得...
002.给谈中西文化的人看看病.txt	27	53	53	86	3	犯这种病的人比前一派更有夸大狂。前一派只是“本来我们就有”，这一派则是“本来是我们的”，“西洋近代文明是我们传过去的。”在清人允禄的《数理精蕴》里，竟说西洋教士的天算格致：
002.给谈中西文化的人看看病.txt	31	61	61	309	3	这真是毫无历史根据的谎言！本来在中西文化交流的过程中，“声教四讫”的情形不是没有。例如：养蚕、造纸、瓷器、柠檬、大黄等的西传，都是斑斑可考的史实。但若不根据史乘，认为一切都是“吾家旧物”，一切都是西人“阴图以去”的，这就未免有点无赖了。而耍这种无赖的，纪晓岚和他老师刘文正最为拿手，在《滦阳续录》卷一中，我们可以拜读他们的高论。这种“中土流传”病本是“礼失求诸...
002.给谈中西文化的人看看病.txt	33	65	65	249	5	近三百年前，杨光先和比利时的南怀仁斗历法失败，遣戍归来，写成了《不得已》。他呼吁“宁可使中国无好历法，不可使中国有西洋人”，躲在这种态度背后的动机，说穿了疱，不过是怕洋人“收吾天下之人心”罢了。这帮子人一方面想要人家的文明，一方面又觉得要了危险，想来想去，决定还是不要好。这种畏葸的小心眼儿，投鼠忌器的谨慎，真是怪可怜的：他们怕这一变，连腐朽的老本也没有了。梁...
002.给谈中西文化的人看看病.txt	37	73	73	113	3	“更不沾恋”，“真不得而用之”，这是何等不得已的调调儿！现在很多人因为赚不到钱转而歌颂“抱布贸丝”的农业社会，因为讨不到老婆转而留恋“父母之命，媒妁之言”的婚姻，最后诋毁工业文明、攻击自由恋爱，究其微意，不过“不得已”三字耳！
002.给谈中西文化的人看看病.txt	39	77	77	82	3	这种病患者对西洋把戏的口号是：“没有什么稀罕！”“又有什么了不起！”明末许大受的《圣朝佐辟》最能发挥这种高论。他认为洋鬼子的东西“纵巧亦何益于身心？”他举的例子是：
002.给谈中西文化的人看看病.txt	43	85	85	176	3	这就是许大受的“体”与福大人的“用”！犯这种病的人比患“不得已”病的还低级：后者起码还承认外国好，可是我们不要他的好；犯这种病的人就不同了：他内心深处觉得外国好，可是在外表上，他一定要表现“张脉偾兴”，一定要理由化（rationalization），好使他心安一些。这种善为巧饰的心理，三百年下来，还是完美的遗传着，世风是日下了，可是人心并没有不古呀！
002.给谈中西文化的人看看病.txt	46	91	91	133	3	这是中国人文字魔术最蛊惑人的一次表演，也是最不通的一次表演。张之洞高叫的“旧学为体，西学为用”，在表面上，至少承认西学可供“采补”，至少想“择西学之所以补吾阙者用之，西政之可以起吾病者取之”。但是用尽管用，必得“西学先由中学”，孙家鼐的两句话把这种理论的核心点破了：
002.给谈中西文化的人看看病.txt	48	95	95	420	5	这就是他们骨子里的真精神！这种精神，事实上只是奕訢、文祥、曾、李、左等人洋务理论的“建构化”。当然张之洞之流把它建构得很别致、很迷人，既维新又卫道，最适合焦灼状态下的国人的口味。顺着这种思路滑下来，在1935年出了一件怪事，就是盛极一时的《中国本位的文化建设宣言》，俗称“十教授宣言”。这十教授是：王新命、何炳松、武堉干、孙寒冰、黄文山、陶希圣、章益、陈高傭、...
002.给谈中西文化的人看看病.txt	50	99	99	271	4	这一派的头脑构造跟前一派是大哥二哥的，都是二分法的构造。前一派是体用二分法，这一派是精神物质二分法。在体用二分法上，若只把西学局限在科学工艺的“用”上，便很容易转形为这一派了。所以老实说，这一派比体用二分法还浅薄。这一派的理论本是清季“中学治身心，西学应世事”的蜕变，到了《欧游心影录》（1920年）时代的梁启超和《东西文化及其哲学》（1922年）时代的梁漱溟...
002.给谈中西文化的人看看病.txt	55	109	109	205	3	妄自尊大是自己来肯定自己，挟外自重是拉别人来肯定自己。二者肯定的方式不一样，肯定的目标则无二致。三百六十年前，利玛窦所以能大行其道，主要乃在他宣言他那一套“与中国古法吻合”。梁章钜《退庵随笔》中就说天主教义“与儒书，又何所异焉？”（卷八）这显然是一种不正确的比附。这就好像名不副实的广告一样，一时虽能得售，久了就会露马脚。教皇格勒门得十一的七条禁约带来了中西冲...
002.给谈中西文化的人看看病.txt	57	113	113	511	3	这是公开否定洋鬼子的比附了。就事论事，康熙皇帝此言也未必过当，想洋鬼子对东方能够有所“通”，实在是太乐观的事。他们偶尔有“倾慕”色彩的，也无非是用看“海上奇方”的眼光比附一阵，用来推销他们的主义和满足他们的偏锋感觉而已。莱布尼兹用他的《单子论》（Monadologie）来比附中国儒释道三家学说就是一个显例。此外弗朗克（A. H. Francke）、沃尔夫（C...
002.给谈中西文化的人看看病.txt	58	115	115	116	3	以上三派都可说是利用西方的。他们比前面六派开化多了，也斯文多了。他们既宣扬中土的“道”、“体”真传，又承认洋人的“器”、“用”价值。他们的算盘是如意的，方法是两全的：繁复的中西文化被他们往简单整齐的公式里一装，手一拍，大功就告成了！
002.给谈中西文化的人看看病.txt	60	119	119	132	3	大团圆病是比以上三种更会梦呓的狂病。犯这种狂病的人，大脑大概休息了，小脑却正在反射，反射了半天，反射出一个天人合一的大理想，觉得天下顺眼的东西都可以融会协调和凝为一。这种反射从董仲舒开始，射到今天还未打住。钱穆接过来，一口咬定“这是中国文化精神最主要的一个特性”。
002.给谈中西文化的人看看病.txt	66	131	131	95	3	这种大团圆的好梦做来好像对中西文化至公至正，毫无偏袒，其实钱穆的内心深处是“项伯式”的，虽然拔剑起舞，本意却在“以身翼蔽沛公”。“沛公”者，中国文化是也；中国文化者，孔子教义是也。孔子教义：
002.给谈中西文化的人看看病.txt	68	135	135	152	4	如此“决然”、如此“唯一”，真不愧是标准的“唯我论”（egotism）！读了这些新预言，我才知道所谓“世界文化新生”，原来竟是向孔子教义看齐；而西方文化新生的结果，竟是让中国圣人来当家。这就是钱穆的“文化客观真理”。我写到这里，真忍不住要叹气说：所谓中国今日的“史学家”，毕竟还是“近乎卜巫之间”的人儿！
002.给谈中西文化的人看看病.txt	70	139	139	238	4	犯这种病的人大概头脑中有点“八十米低栏”的幻象，因为“超越”云云不正是跳栏吗？“前进”云云不正是赛跑吗？这些文化选手们，一方面对中国文化假惺惺的不满意，一方面对西洋文化热烘烘的掘根子。这一派的大法师就是胡秋原。胡秋原在《超越传统派西化派俄化派而前进》里，口口声声劝人“由门户之争解放出来”，却没想到他自己正是门户之中的健将！他并不是什么“独立而向前”的“两不属...
002.给谈中西文化的人看看病.txt	72	143	143	325	3	看这些话，我实在看不出胡秋原和中体西用派诸公有任何不同之处，也看不出他“拒绝”了哪一点、“超越”了哪一点？他的语调是“况中国所固有者乎？”“况非中国者乎？”处处不脱那点传统的自信，“中国之为中国自若也！”可见他在本质上明明是中国本位的，所以他才会主张“发展中国人之聪明才智，创造新中国的新文化，以求超胜古人、西人。”这种浮夸的调儿实与三百三十年前徐光启的“超胜...
002.给谈中西文化的人看看病.txt	78	155	155	241	3	上面十一种病名，是我用“代表取样法”（representative sampling）定出来的。我这样分类，可以避免枝节、笼统和混淆的毛病。我把他们分门别类，同时一一请出他们思想上的开山老祖。不论他们怎么否认、不论他们怎么化装、不论他们怎样不自觉、不论他们施放哪一种烟幕，我都要抱歉的说：“你们的思想是师承有自的！你们思想的来龙去脉逃不掉‘后设历史学’（met...
002.给谈中西文化的人看看病.txt	81	161	161	232	4	这样说来，他们实在可以联欢一次：群贤毕至，少长咸集，古人复起，腐儒重生，保守与顽固齐飞，大官与学者一色。酒酣耳热之余，大家不妨拔剑击筑，争争谁是正统？其实他们都迟了，真正的正统早被一匹“黑马”盗之以去了，这匹黑马就是大谈新儒家的徐复观！他说：“不谈文化则已，一谈文化便应该谈‘统’。我并且希望有些人出来断然以道统自任。”（《儒家精神之基本性格及其限定与新生》）...
002.给谈中西文化的人看看病.txt	84	167	167	317	5	第一个原因是“泛祖宗主义”。俗话说“穷极呼天，痛极喊娘”。无知的人们遇到困难，左冲右撞，还是解决不了，只好求助于“逆退”（regression）心理，退到穿开裆裤的时代，拿出吃奶的力气，喊几声妈。因为在孩童时期每一叫妈，问题就有人代为解决了，所以总觉得叫妈很灵，所以总想叫妈。但叫妈是个人的事，对一个民族而言，人人叫妈成何体统？于是聪明人想出一个好办法——叫孔...
002.给谈中西文化的人看看病.txt	85	169	169	457	3	没有疑问的，我们今天已经陷于一种文化的僵化（petrifaction）。僵化的原因之一是要想抱祖宗的大腿。我们民族是最重视祖宗意见的民族。祖宗的意见并非不能解决问题，至少在祖宗的时代里，在“蛮夷率服”的时代里，那是行得通的；但是到了今天，我们已进入一个“蛮夷不服”的时代，于是问题就来了：在蛮夷刚来闹事的时候，我们的反应经常是传统主义（traditionali...
002.给谈中西文化的人看看病.txt	86	171	171	357	3	他们的通病在于不明了返老还童绝不能用老药，使中国现代化也绝不能借助古法。如同你治一种病，绝不能西药中药全吃，专心吃西药足够了，中西合壁反倒糟。现代化的国家和现代化的步骤早摆在那里，我们直接去学就行了，何必麻烦祖宗呢？日本没有孔子，可是何碍于他们的维新？韩国很少国粹，可是何碍于他们的新政？我们当年的藩属都跑到我们前面去了。如果祖宗能救我们，早就把我们救了，不会...
002.给谈中西文化的人看看病.txt	98	195	195	118	4	一个英国探险家在某次探险中碰到一个有吃人肉风俗的蛮人，等到他发现这蛮人竟是一个英国大学里出身的，他大为惊奇，他问这个蛮人道：“你难道还吃人肉吗？”这个蛮人的答话可妙了，他说：“我现在用西餐叉子来吃了。”（I use fork now.）
002.给谈中西文化的人看看病.txt	99	197	197	202	4	这虽然是个笑话，却是个令人哭笑不得的笑话。试看我们社会中有多少人坐着1961年的汽车却装着1691年的旧脑袋？有多少人用着新式印刷机制造着冥纸锡箔？有多少人用着新式塑胶工厂出品麻将牌？有多少人用电气冰箱装祭孔祭祖时的冷猪肉？有多少人用着麦克风弘扬圣教佛法？……孔夫子的后人穿着新式西装，抽着名贵烟草，坐在先师奉祀官府里写毛笔字；张天师的后人也同样在天师府中服气...
002.给谈中西文化的人看看病.txt	120	239	239	293	4	可是很多老年人硬是这样子，明明搭不成，却偏想搭。他们以媒婆的心肠，做救世的事业，例如他们总爱说：“在孝的一方面，的确是今不如古了！”我也同意他们的看法。可是原因何在？原因就在我们正从农业社会往下脱，脱出了家族本位、脱出了五世同堂，钻进了工业社会、钻进了小家庭。在这种经济形态下，谁也不能为了“防老”就一窝一窝的“养儿”，谁也没工夫守那“寝苫枕块”的三年之丧，“...
002.给谈中西文化的人看看病.txt	121	241	241	130	4	第四个原因是“不了解文化移植的本质”。不肯彻底接受西洋现代文化的人，他们派生出来的理由五花八门，不过都不太时髦。最时髦的一种理由是——中国“国情”不同，中国有“空间时间的特殊性”（十教授语），其实这种“特殊性”的论调，早在民国十六年就被常乃德发挥尽致了。他说：
002.给谈中西文化的人看看病.txt	123	245	245	126	3	既然决定创造新文化，于是聪明人的高见又来了，他们想出一个好办法，这个办法可叫做“王二娘法”。王二娘去衡阳街办货，充分发挥了自由采买的精神，好东西就买，坏东西就不买；回到家里，收拾房间，好东西就保留，坏东西就往外一丢——王二娘的精神正是十教授等人的精神：
002.给谈中西文化的人看看病.txt	129	257	257	218	3	不客气的说，他们对西洋文化，统统打着一个“买椟还珠”的算盘，他们不知道这种好梦是根本做不成的。在文化移植上，要椟就得要珠，不愿要珠也休想要椟，椟中没珠也不成其为椟，要要就得全要，不要也得全要——因为全世界的“时间空间”有“特殊性”了，在南宋时，我们老大帝国可以行“铜不下海”的禁令，可以跟洋鬼子老死不相往来；到了清初，闭关政策就吃力多了；到了现在，除了死心塌地...
002.给谈中西文化的人看看病.txt	130	259	259	170	3	我们面对西方现代文化，就好像面对一个美人，你若想占有她，她的优点和“缺点”就得一块儿占有，这个美人是任性的、不可塑的，她根本不理你这一套农村文化的“忠告”，她即使有“缺点”，即使想在人老珠黄时有所改正，也绝不会用你这一套发了霉的东西。可是有些死命追她的人却不要脸，他们硬说这美人当前就要改正“缺点”，而改正之道，则非东方文明不为功，他们说：
002.给谈中西文化的人看看病.txt	137	273	273	166	3	也许西化的结果会带来不可避免的“流弊”，可是我们总该认清我们的“大目标”是什么，为了怕肚痛，难道就不养孩子吗？为了怕噎着，难道就不吃饭吗？我们的“大目标”是建设现代化的强国，在这个“大目标”下，我们该有“衣沾不足惜，但使愿无违”的决绝与胸襟。“大目标”是安慰我们补偿我们最好的代价。在这个百年大计中如果真有“损失”，也是值得一干的。
002.给谈中西文化的人看看病.txt	138	275	275	515	5	今天最可恶的，莫过于保守者背后的“历史主义”（historism），他们不相信西方玩意是批发的，但却相信有些“人”有资格来选购，所谓“统治文化”云者，此之谓也！坦白说吧，亿万中国人中，谁也没有资格来订这个取舍“标准”，任何聪明才智之士都不配“制礼作乐”来“规范”这个聪明才智的民族，死去的黄帝周公固然不配，今天的内政部也不配，唯一配做的只是我们小百姓在西方文明...
002.给谈中西文化的人看看病.txt	142	283	283	114	3	如果我们肯睁开眼睛，看看我们的“平均公民”——用“大量观察”（mass－observation）的法子看看他们：年轻一辈的明星狂和爵士乐，中年一辈的奖券迷和轿车梦，年老一辈的麻将风和强力睾丸片……哪里还有一丝一毫经典中的真精神？
002.给谈中西文化的人看看病.txt	147	293	293	90	3	固有文化本身不但成事不足，并且败事有余。传统派认为西方文明不能完全行于中国，并且视为“逾淮之枳”，转而大骂西化派。殊不知橘之所以变成枳，正是固有文化捣的鬼！至少钱穆就是这么招供的：
002.给谈中西文化的人看看病.txt	149	297	297	261	4	固有文化的“暗中操纵”，竟使中国“神州陆沉”，“转向苏联”，这不正是它的大罪状吗？这样说来，谈固有文化的人实在在某点上和共党的思路是很近的：他们在“先断”（prejudgement）、诉诸权威、诉诸教条、诉诸感情、以自我为中心论断（ego-centrie predicament）、统一和矮化（dwarf）思想、好谈道统和正统、对历史做先知式的预言（histo...
002.给谈中西文化的人看看病.txt	150	299	299	142	3	共产党的得势并非“孔家店”倒台的逻辑结果。造成共产党今日的状况原因很多，在思想方面如若说是由于儒化思想的破坏，不如说是由于数千年儒化思想的成功，因而使得我们大多数的中国人，缺乏科学的批评精神和逻辑的论证能力所致。西洋并无“孔家店”，然而今日反共最大的实力是美国。（《论思想统一问题》）
002.给谈中西文化的人看看病.txt	151	301	301	168	3	迷恋固有文化的人，正是“缺乏科学的批评精神和逻辑的论证能力”的一群，“数千年儒化思想”的训练，使我们的防疫本领可怜透顶，所以共党的细菌一来，立刻与传统的训练一拍即合。共党把“毛家店”撑起来以后，表面上当然反对孔家，但是骨子里却一定感谢“儒化思想”给他们所做的铺路工作。因为他们的型模是一样的，正所谓：“此非吾家招牌也！何其声之似我也！”
002.给谈中西文化的人看看病.txt	153	305	305	158	4	民国二十八年，钱穆写《国史大纲》引论，他说：“未有民族文化已衰息断绝，而其国家之生命犹得长存者。”可是隔了两年，这位新时代的朱子把他所说的话全忘了，他写《中国文化史导论》，却说若不解决“吸收融合西方文化而使中国传统文化更光大与更充实”这一问题，那么“中国国家民族虽得存在，而中国传统文化则仍将失其存在”。（页162）
002.给谈中西文化的人看看病.txt	154	307	307	187	4	两年前，他说民族文化不存在国家就完蛋了；两年后，他说民族文化不存在国家还可以不完蛋。民族文化与国家兴亡在钱穆手里竟变成了这么好笑的一对宝，一会儿生死攸关，一会儿并不相干。这种推理，怎么能教我们适从呢？钱穆为了强调民族文化的重要，竟不惜拿“国家之生命”来开玩笑、来吓人，这种作风，气是满壮的，可惜理不太直。夫子这样乱变，“虽欲从之，末由也已！”“夫子圣者欤？何其...
002.给谈中西文化的人看看病.txt	156	311	311	349	3	我们的难弟——“近东病夫”是个好例子。土耳其盛衰的历史跟我们太像了。他们的祖宗也有过类似汉唐的雄风；他们签的丧权辱国的条约在量上虽不如我们，可是在质上却更精采！但是凯末尔当政以后，他不惜抛弃“固有文化”来大力西化：固有的国教不要了、固有的法典不要了、固有的服装不要了、固有的历法不要了，固有的姨太太也不要了。他们太笨了，不会耍“‘土’学为体，西学为用”的花枪来...
002.给谈中西文化的人看看病.txt	157	313	313	430	3	话说破了，无非为了“使土耳其现代化”一个大目标而已。在这唯一的大目标之下，他们不但知道爱国，并且知道“爱国必以其道”！他们知道要想使自己国家现代化，最快的办法莫过于干脆向那些现代化国家来学，直接的学、亦步亦趋的学、惟妙惟肖的学。他们不推诿什么“国情”不同，他们有勇气，不同也要学同！他们没有工夫去挖掘固有文化的“精华”，列强足够他们学了，足可以使他们变成现代化...
003.我要继续给人看看病.txt	6	11	11	34	3	徐道邻先生看了这段话很不服气，他责备我“完全弄拧”了他的原意。他说：
003.我要继续给人看看病.txt	15	29	29	149	3	从“品级”（ranks）来解析，益发可以看出徐先生对选词运句的周密与缠绵：一个“动摇”的动词，前面加上“千万不可以轻易的”限制，在整段文字中又告诉我们要“尊重”、要“维持”，若“轻易的动摇”，不但是“第一个禁忌”，并且还“没有多大益处的”，同时“从文化学、人类学上看来，都是极富有价值的悲惨教训”。
003.我要继续给人看看病.txt	17	33	33	172	3	徐先生对我的批评分明是指我百分之百的误会了他的“原意”（“完全弄拧”），并且误会到相反的地方去了（“＋”变“－”）。如果我的误差这么大，我宁愿以认错来换取徐先生做同道，即主张“接受科学知识和工艺技术”而可以动摇“基本的价值系统”。无奈事实上，我并没把徐先生的“＋”号那一竖抹掉，我只不过把那一竖重涂一次罢了！我这样说，有徐先生的白纸黑字做根据：
003.我要继续给人看看病.txt	41	81	81	17	3	我们试看这位“馆长”的意见，他说：
003.我要继续给人看看病.txt	49	97	97	187	3	传统派的主力根本是一群毫无新头脑的土“学人”，他们根本不了解西方文化，更不了解西方现代的新学问。徐先生比起这些人士当然高明。但他那点高明，却又正巧用在为传统派张目的工作上。徐先生的战术是抬出西洋“许多有地位的人类学者”来做盾牌，以便在必要时可用“不敢当”来脱身。在洋书后面做好防御工事后，他便开始用“近年来”“西洋学者”的看法，向传统派助战。我们看他从旁而来的...
003.我要继续给人看看病.txt	56	111	111	131	3	他所用的“高度”和“成就”是些什么？以什么为指涉点（point of reference）？简直令人莫测高深！对学问思想的评价和说应酬话，总须有个分际吧！况且，在连用“高度”揶扬之后，他又提醒“宣扬中国固有文化的先生们”，还有一种“活的中国文化”也是可以宣扬的：
003.我要继续给人看看病.txt	64	127	127	53	4	徐先生既为传统派做嫁衣裳，看到抨击传统派的文字，自然不顺眼。于是他转过头来，决定打趣“李先生”一下，他说：
