file	paragraph	line_start	line_end	char_count	score	snippet
006.论“处女膜整形”.txt	31	61	61	82	3	“处女膜主义”既然大行特行，自然就形成了重视处女膜的观念。相对的，同时也形成了鄙视失去处女膜的女人。结果呢，是不近人情的“处女膜主义”一进而蔓延成为“泛处女主义”。
006.论“处女膜整形”.txt	33	65	65	112	3	“泛处女主义”，是我造的一专有名词，顺便造个英文字，那该是pan－virgin－hood。“泛处女主义”可说是“处女膜主义”的抽象扩大与建构化。换句话说，它是由“处女膜主义”繁衍出来的一套新的意识形态。它的类型可归纳为五种：
006.论“处女膜整形”.txt	35	69	69	150	3	殉情的特点是女人“从一而终”，不论许配或已嫁，一女人只要跟一男人订婚或结婚（甚至未婚私通），在这男的死后，她不愿再活，又不能恰巧“一恸而绝”，所以只好自杀明志。最有名的例子莫过于吴敬梓《儒林外史》第四十八回的那场“徽州府烈女殉夫”。王三姑娘死了丈夫，她决心要殉节，她那中礼教毒的父亲王玉辉高兴了，说：
006.论“处女膜整形”.txt	43	85	85	20	3	于是王玉辉“仰天大笑”，兴高采烈的欢呼：
006.论“处女膜整形”.txt	45	89	89	22	3	最后王三姑娘被报上官厅，结果“送烈女入祠”。
006.论“处女膜整形”.txt	47	93	93	154	3	还有一种有意不死的，最好的例子是唐朝的歌姬关盼盼。盼盼是张建封的姨太太，建封死后，她在燕子楼中独居守志，凡十余年。莫名其妙的白居易讽刺她“一朝身去不相随”，不肯殉情。她解释道：“妾非不能死，恐千载之下，以我公重色，有从死之妾，是玷我公清范也！”既然白乐天先生说了风凉话，那就死好了！于是她绝食十天，死翘翘了！
006.论“处女膜整形”.txt	50	99	99	192	4	自动殉情是许配或已嫁的女人为她所接受的观念殉身；强迫殉情是女人被迫为别人的观念做实行者。所以她所“殉”的，可以说并不是什么“情”，说破了，这实在类似一种“殉夫习尚”（sutteeism）。因为是”习尚“，所以当事人的自由意志便不在考虑之列。《新青年》中的一篇《一个贞烈的女孩子》，描写这种强迫殉情的惨状最为刻骨：一个十四岁的望门寡，被她父亲关在房里，强迫自杀，...
006.论“处女膜整形”.txt	56	111	111	106	3	这一派纯粹是精神上的处女派，是属于望门寡而未殉死的一种。其实望门寡殉死倒也来得痛快，否则像这派一样的矢志不嫁，最后老处女以死，这段漫长的岁月也不是好过的。举一个例，在吴德功《彰化节孝册》里，曾记《贞妇吴石氏传》：
006.论“处女膜整形”.txt	60	119	119	212	3	贡氏某处人，嫁郡诸生某，某某地中名士。贡助之方成学，顾婴疾且死，执贡手曰：“吾不能偕子以室矣！欲待子以穴，得乎？”贡泣曰：“幸而更举案以从，妾之愿也，即不讳，妾有把巾握帚，为君除棺中埃耳！不待我以穴，将何为？”某遂瞑。贡则抚其所遗孤女以居，未几，女亦死。母怜之，则来相觇慰曰：“一婴鬟不能有，而欲孑以终身，可乎？”贡则复泣曰：“良人谷而不后，天也；若守节则人耳...
006.论“处女膜整形”.txt	64	127	127	154	3	由于“处女膜主义”到“泛处女主义”的作祟，一个把“处女膜”给了男人的女人，再想凭无膜之身，博有膜之报，自然就难难难了。所以寡妇再嫁也好、离婚改嫁也罢，都得不到正常的待遇，得到的反倒是嘲笑与讥讽。像元朝李有《古杭杂记》中所挖苦的：“挂起招牌，一声喝采，旧店新开。”宋人秦观《淮海集》中《蔡氏夫人行状》里记蔡氏：
006.论“处女膜整形”.txt	65	129	129	252	3	年十四适同郡环生，生故疾病，成礼十六日而卒，夫人虽幼，居丧事舅姑孝谨如成人。已而其舅又卒，为之斩衰、蔬食、诵佛经，无复更嫁意。于是其母与诸昆弟率亲族数十人即环馆，夺之，曰：“若十四而适人，十六日而夫死，为夫之丧三年，舅之丧又三年，若为人妇，亦至矣！又不欲更嫁，无迺过乎？且环父子俱止嗣，若虽欲守志，将谁与居？”夫人悲哀，迫不得已，遂去环氏。一年而归徐君……俄而...
006.论“处女膜整形”.txt	68	135	135	106	3	例如十个月前，招商局海张轮失事，三副殉职了，他的太太却服毒自杀。报上立刻冒出了旧道德的词汇，说是“痛夫遇难，贞妇殉节”，接着就来了读者投书，1962年11月8日的台北《征信新闻》上，居然发布了这样的“读者之声”：
006.论“处女膜整形”.txt	75	149	149	100	3	在第二卷第三期（五十九号）《文星》里，有十三幅“路克丽斯之被辱”（The Rape of Lucrece）的画页，介绍莎士比亚那首一千八百五十五行的叙事诗，讲到路克丽斯被强奸后，她在丈夫面前用刀自杀：
006.论“处女膜整形”.txt	104	207	207	173	3	四、1956年，在大陆上的“人民银行青岛分行”里，一个姿色秀丽的女会计员孔爱玉（据说是孔夫子的后代），一天晚上，被这“银行”的“经理”困住，她本想跳窗坠楼，可是没来得及，结果在“经理室”被强奸三次，她乃在12月21日跳海自杀，并留遗书给她的情人，表示不幸失贞，不能再嫁给他了（这段消息，据1957年2月15日的台北《联合新闻》革新号第三十一期）。
006.论“处女膜整形”.txt	105	209	209	160	3	五、1957年，台北一个以前北平名女人的养女李幼冬，才二十二岁，被仆人持刀逼奸，结果这个混账仆人居然在法庭上说是和奸，混账的法官居然把这种案件公然审理，而混账的新闻记者居然也就在报章杂志上绘影绘声。李幼冬冤郁难伸，最后服毒自杀。1957年3月12日台北《新生报》上说她“清白被污，令名受损”，“自感无颜见人，顿萌短见。”
006.论“处女膜整形”.txt	106	211	211	236	5	上面随手举出的例子，都是所谓“羞忿自尽”的遗风。尤其最后一个例子，在李幼冬自杀后，我正在大学里读书，一连好几天睡不好，我深深觉得：传统的观念真是害死人！这完完全全是被观念害死的！在她死后，我遍读报纸杂志中的评论文字，竟找不到一篇观念清楚的文字来大声疾呼：李幼冬丝毫没有自杀的必要！大家都相信那件暴行可以使她“蒙受不洁”，使她“清白被污”，使她值得“羞”、值得“...
006.论“处女膜整形”.txt	115	229	229	90	3	七、最后一招是“不甘受辱”，诉诸法律。结果呢，最占便宜的是“舆论喉舌”的报纸，而这女的本身此后若想嫁人，因“已非完壁”，所以受了很大的影响；若已经结婚，那就要看她丈夫大脑的构造了。
006.论“处女膜整形”.txt	118	235	235	97	4	我的答案是，这些众生相，统统都是“泛处女主义”泛滥的结果，“泛处女主义”之所以能够泛滥，它的源头活水又是“处女膜主义”。中国人对“处女膜主义”的信仰，已经到了石破天惊的地步，我说这话，有例为证：
006.论“处女膜整形”.txt	119	237	237	157	4	第一个例子是：清朝慵纳居士《咫闻录》中一则“贞烈妇”里，记河北一个姓郑的女孩子，许配给一个姓刘的不良少年，还没过门，未婚夫就淹死了。她说她“已受刘聘，即刘门女也！从一而已！岂可复有二心！”于是开始守望门寡，到了四十九岁才死。临死前，“满室馨香，殓时，易其下衣，犹然处子！”请看这是何等泛滥的处女癖——临死还要检查！
006.论“处女膜整形”.txt	120	239	239	122	3	另一个例子是：1950年的1月，台北发生陈素卿殉情事件。当时认为她“守贞而殉情”，太伟大了，人人都同情。台大校长兼山东好汉傅斯年，合同沈刚伯等、一行四人，联名写公开信给《中央日报》，认为应该捐钱把她葬起来，甚至葬到台大校园来。信里说陈素卿之死：
006.论“处女膜整形”.txt	124	247	247	339	4	可是后来听说陈素卿在死前有过性关系，于是傅斯年又大呼上当了！再也不提“葬陈女士于山水清幽之所、尘嚣不染之间”了！其实，依我李大炮看来，傅大炮们大可不必如此，他们做对了，并未上当。因为陈素卿的“感人之深”，绝不以是否“处女”为要件。一个人能为情死，不管有无必要，就“伟大”言之，已经够了。换句话说：“处女”而死，固然“殉赤子之灵心”，但“非处女”而死，又何尝不是...
006.论“处女膜整形”.txt	125	249	249	95	3	就理论而言，处女是好的，可是不是处女也没有什么不好，这是不必大惊小怪的事。糟糕的是，中国传统中，总觉得处女比非处女（包括已婚妇人）好，我实在看不出这有什么理论根据。《不可录》中有一条小故事：
006.论“处女膜整形”.txt	126	251	251	123	3	〔明宣宗〕宣德中，曹文忠公鼐，以岁贡授学正，改泰和典史。因捕盗，获一女于驿亭。甚美。意欲就公。公奋然曰：“处子可犯乎！”取片纸，书“曹鼐不可”四字焚之。天明，召其母家领回。后大廷对策，忽飘一纸堕几前，有“曹鼐不可”四字，于是文思沛然，以状元及第。
006.论“处女膜整形”.txt	127	253	253	88	4	这个故事说明了处女的重要性和“犯”处女的严重性——哪怕是她送上门来，甘心情愿，也不行。所以可推知柳下惠“坐怀不乱”，大概不外有两个原因：一是他阳痿，二是他怕“文思”不“沛然”。
006.论“处女膜整形”.txt	135	269	269	308	3	上面六个例子，无一不证明了“泛处女主义”已经在中国泛滥成什么样子，其不近情理的程度，甚至对非处女的已婚妇人，也完全波及。在已婚妇女中，有的为一言之“辱”而自杀（如秋胡妻）；有的为被劝改嫁而割鼻子（如梁高行）；有的割手指（如廖伯妻），有的朝脸上涂大便（如崔绘妻）；有的为证明不怀二心而割耳朵（如刘长卿妻）；有的被人偷看洗澡而上吊（如王凝妻）；有的被人拉了一下手腕...
006.论“处女膜整形”.txt	136	271	271	261	3	所以我说，这些统统都是“泛处女主义”的泛滥结果，这种“主义”的过度泛滥，自然就会把任何抽象的、实际的或偶然的无妄之灾，都当成了“断臂自矢”或“痛不欲生”的条件，都认定有伤她的尊严，都咬定那是“羞”、是“辱”、是“耻”、是“无面见人”，因而非诉诸激烈的行动就无以白其贞烈，这不是可怜复可叹吗？在“泛处女主义”的笼罩下，每个女人不但有肉体上的“处女膜主义”从一而终...
006.论“处女膜整形”.txt	139	277	277	117	4	玛格达琳看起来不过二十多岁，一天忽然跑到妓院来，想下海接客。老鸨要看她身材，她说脱就脱，毫无窘态。老鸨浑身细看了一阵，非常满意。她在妓院中，有学问，脾气好，爱排难解纷，又慷慨，所以人人喜欢她，人人在她那高贵而特殊的气质下，都会乖乖的。
006.论“处女膜整形”.txt	140	279	279	18	3	有一天，玛格达琳问另一个妓女黛玛拉：
006.论“处女膜整形”.txt	154	307	307	207	3	读者不要以为玛格达琳不过是小说中的人物。我个人的一个朋友就曾在台湾南部的一个军中乐园里，碰到过有着玛格达琳类似观念的小神女，她是客家人，那时候二十七岁了。为了每月送五百块钱给她的未婚夫，特地跑来卖身。她不觉得这样会影响她的婚后幸福，她也不在乎别人骂她，你可说她“廉耻道丧”、说她“气节荡然”，说她什么都可以，她反正说她自己是处女！——她和玛格达琳不同的是：她是...
006.论“处女膜整形”.txt	155	309	309	122	3	以东方精神文明自豪的中国人：请看这是何等的精神文明！这种不考虑肉体条件，纯粹在精神上解脱开展的人生观，正是“酒色财气不碍菩提路”的精神文明，这种精神文明，比起被拉一下腕就要砍掉一只手的文明，更来得“形而上”。所以，套一句孔夫子的话，这才正是——
006.论“处女膜整形”.txt	162	323	323	156	3	既然这样，我们来重看“处女膜整形”的现象，就发现很可笑了：以“处女膜整形”为号召的密医们，他们妄想“修补”处女膜，使它“童贞回复”，目的在用一点表皮的连接手术，使被修补者能重新“落红殷褥”或“流丹浃席”，从而满足对方的“处女癖”，使对方在欢畅之后，浩然有“守礼谨严之处子也”之叹，诸君试想，这是多可笑的作伪举动！
006.论“处女膜整形”.txt	164	327	327	179	3	以前我读六百多年前的一本老书——周达观的《真腊风土记》，里面记柬埔寨的“阵毯”风俗，由僧道来把女孩子“去其童身”；现在我环顾六百多年后报纸上这些“复其童身”的各种广告，我真要惊讶这个世界无奇不有，更惊讶在现代化的中国，竟还有这种丑恶的现象！但是当我把这种丑恶现象的来龙去脉做一番探源的工作以后，我就不再惊讶。我只是在心头抑止不住一种叫喊，要我向这个社会呼吁：
006.论“处女膜整形”.txt	166	331	331	111	3	①参看陶宗仪《辍耕录》卷二十八《如梦令》：“一人娶妻无元，袁可潜赠之《如梦令》云：‘今夜盛排筵宴，准拟寻芳一遍。春去已多时，问甚红深红浅？不见不见，还你一方白绢。’”白绢就是用来沾“元红”的，没有“元红”，就要被词客嘲笑。
006.论“处女膜整形”.txt	167	333	333	165	4	②参看《金史》卷八十二《萧仲恭传》。萧仲恭的儿子萧珙，是礼部侍郎，一女孩子名耶律弥勒，是萧珙的小姨子，金朝的海陵帝要把她纳为妃，“使珙自汴取之，还过燕，是时仲恭为燕京留守，见弥勒身形不类处子，窃忧之曰：‘上多猜疑，珙其祸及矣！’”弥勒入宫，海陵帝一试，果然大发雷霆，半夜三更就把萧珙找来，大骂一顿，并且立刻撤职，最后还是把他杀了。
006.论“处女膜整形”.txt	171	341	341	214	3	一、“人若娶妻，与她同房之后恨恶她，信口说她，将丑名加在她身上，说：‘我娶了这女子与她同房，见她没有贞节的凭据。’女子的父母就要把女子贞节的凭据拿出来，带到本城门长老那里……把那布铺在本城的长老面前，本城的长老要拿住那人惩治他，并要罚他一百舍客勒银子给女子的父亲，因为他将丑名加在以色列的一个处女身上。女子仍作他的妻，终身不可休她；但这事若是真的——女子没有贞...
006.论“处女膜整形”.txt	177	353	353	101	3	万吨级轮船“海张”号在澎海失事，船与人全无踪影，是近年来最意外的大海难事件。而其尾声的摇曳亦极尽哀伤：那是该轮三副祁英之妻陈云利于招商局发放抚恤金之日，本月15日早晨服安眠药自尽殉夫。曾有遗书述其志节。
006.论“处女膜整形”.txt	179	357	357	203	3	自杀是愚蠢的行为。因而颇有人持此以论祁夫人，说是：与其殉身于丈夫，何如献身于社会？如再能运用恤金从事慈善事业，岂不懿哉！今乃计不及此，遽抛宝贵的生命，未免“愚”得可叹可惜。这自是一篇道理。可是这道理以这劝勉众人，自无不可；如以之责于死者，那就不近人情了。试思：鸳鸯失侣，月黯星沉，当之者肝摧肠断，尚有何心以自谋？为其所爱，忠于所志，不顾生命，无视财富繁华，慨然...
006.论“处女膜整形”.txt	180	359	359	210	3	我们当然不赞同“自杀”作为解脱人生愁苦的手段，亦无意鼓励妇人殉节，更非有憾于夫死而不守志者，但却深深认为像祁夫人的这种志行，应足千秋，诚宜共致褒颂，断不可以“愚”视之。应知：古今中外多少仁人志士，其取义成仁，皆发端于这一“愚”字。此所谓“愚”，实便是“至情至性”。至于自以为聪明之辈，节与品、守与为，固都不萦于怀；生死义利的关头，更难期其无违于道了。此亦所以人...
007.中国思想趋向的一个答案.txt	5	9	9	134	3	两千五百年来，中国思想界的烂摊子，从来没有彻底的打扫过。层层累积这个烂摊子上的文献典籍，至少有二十五万三千种。对这个浩如烟海的重担，我们一定要问：这些遗产，对新时代的我们说来，究竟有些什么积极的意义？换一种问法是：这些遗产，能不能帮助我们，使我们在这新世界里得到好处？
007.中国思想趋向的一个答案.txt	8	15	15	158	5	首先他们从“万国衣冠拜冕旈”的陶醉中惊醒。然后，他们用好奇的眼光接受了“奇技淫巧”：戴起了眼镜，挂上了闹钟；进一步，他们很不愿意的说出了“中学为体，西学为用”；最后，在义和团的热血凝固以后，在洋鬼子的“文化侵略”生根发芽以后，我们的上一代退守到最后的马奇诺，在这条防线的壕沟里，他们用美援做营养，高谈民族文化的精英。
007.中国思想趋向的一个答案.txt	9	17	17	194	5	这种演变，是开始跟洋鬼子打交道的人绝没想到的。当年的封疆大吏（胡林翼）第一次看到外国的轮船，对西方文化突然感到恐惧，恐惧得“勒马回营，中途呕血”。可是今天呢？今天的封疆大吏不恐惧了，他们若要做固有文化的孝子，只消“勒‘汽车’回家”就够了。他们在祀孔回来，即使“中途呕血”，也有留美医师赶来急诊，急诊以后，他们仰在沙发上，衔着吕宋烟，放心地说着风凉话：“何必找西...
007.中国思想趋向的一个答案.txt	10	19	19	98	3	任何曾为文化奋斗而做了烈士的人，他们在九泉之下或九重天上，都会死不瞑目的质问：“难道这就是中国文化的矛盾结局么？中国文化难道就是用来点缀或用来串假戏的么？中国文化难道真的不能适应新时代的潮流么？”
007.中国思想趋向的一个答案.txt	12	23	23	241	3	几年来，我以一个关心中国思想趋势的人的身份，很想给这个新的答案求得解答。在白天、在深夜，在活着的中国人的嘴上、在死去的中国人的书里，我练习呼吸中国人所呼吸的空气——一种令人窒息的空气。呼吸的结果，我发现这种空气里的“二氧化碳”，已经超出了百分之四的比例。换句话说，空气中所以有这么多的害人的“二氧化碳”，因为它们不是新鲜的，是被两千五百年来的人呼了又吸、吸了又...
007.中国思想趋向的一个答案.txt	13	25	25	110	3	我这里写“孔子时代的空气”，我的心情是不痛快的。因为在我看来，中国的文献典籍，不要说有二十五万三千种，就便是有五十万六千种，它的主流，也不过是以孔子的呼吸为呼吸的。如果一定要分出些大同小异，我认为有三个系统足可以囊括了：
007.中国思想趋向的一个答案.txt	21	41	41	329	5	虽然孔子之言遍天下，但是孔子之言见诸行事却是困难的，即使孔子本人，他奔波一辈子，又被困又挨饿，最后还是不能得君行道。至于他的人生箴言方面，合乎人情而能行得通的，也不算多。它们许多都是空洞的、拿来说说的，并不能真的去实行。例如“三年之丧”，孔子的几个学生以外，据我所知，只有清初的颜习斋彻底实行了，彻底实行的结果是大病一场。又如“温、良、恭、俭、让”，甚至孔子本...
007.中国思想趋向的一个答案.txt	26	51	51	222	5	写到这里，有一点错觉必须澄清。即有些不明白历史趋向的人，他们认为共产主义在中国的得势，是由五四前后“打倒孔家店”的结果。其实这真是冤枉“反孔”的好人。我的看法正好相反：即共党思想能够在中国蔓延为害，恰恰是因为孔家思想替它做了先驱的工作、开路的工作。我在《给谈中西文化的人看看病》（《文星》52期），已指出孔家思想和共党的思路是很近的，在“诉诸权威”、“诉诸教条...
007.中国思想趋向的一个答案.txt	27	53	53	168	3	迷恋固有文化的人，正是“缺乏科学的批评精神和逻辑的论证能力”的一群，“数千年儒化思想”的训练，使我们的防疫本领可怜透顶，所以共党的细菌一来，立刻与传统的训练一拍即合。共党把“毛家店”撑起来以后，表面上当然反对孔家，但是骨子里却一定感谢“儒化思想”给他们所做的铺路工作。因为他们的型模是一样的，正所谓：“此非吾家招牌也！何其声之似我也！”
007.中国思想趋向的一个答案.txt	29	57	57	163	3	我这种看法和11点思想基型的比较，国内的陈康先生、国外的泰勒（George E. Taylor）先生、佩恩（Robert Payne）先生、顾理雅（H. G. Greel）先生，都有类似的观点。所以我们可以说：共产党根本不配是“反孔”的。孔家思想的传统趋势是反自由民主的；共党思想也是反自由民主的，它们都是旧时代的渣滓与逆流。
008.文化论战的尾巴.txt	3	5	5	95	3	做为一个现代知识分子的小角色，我自知自己只不过是一个热心的小人物，一颗满天星斗的小星。能力与际遇的安排也许只能使我做一个吵吵闹闹打打前锋的小战士，在愤怒的青年人中，我深信会有大批的主将到来。
008.文化论战的尾巴.txt	5	9	9	87	3	居浩然先生这次去澳洲前，我们在一起吃饭，他感慨地对我说：“台湾的学阀们不让我活，我只好‘乘桴浮于海’了，你的朋友，我的朋友，我们一个个都走了，留下了你一个人去做‘姜维’吧！”
