file	paragraph	line_start	line_end	char_count	score	snippet
019.“道统”梦碎.txt	19	37	37	138	3	马林居桂林三日，两次晋谒先生。并建议改组国民党与中国共产党合作。先生未予具体答覆。马林问先生曰：“先生革命之基础为何？”先生答曰：“中国有一道统，尧、舜、禹、汤、文、武、周公、孔子相继不绝。余之思想基础，即承此道统，而发扬光大耳。”马林不解其意，再询先生，先生所答者依然如此。
020.“学统”梦碎.txt	2	3	3	130	4	自来搞政治的人和搞学术的人，是两种人。搞政治的人不碰学术，有的是没工夫；有的是刘邦式的“安事诗书”（翻成白话：“谁他妈的要看书呢！”），看不起学术；有的是心存敬意，敬而远之；有的却是附庸风雅。最后一种最要命，因为一附庸风雅，就会对学术亲自去碰，一碰学术就完了。
020.“学统”梦碎.txt	3	5	5	204	3	中国传统中“政统”和“学统”大体成双轨演化着，搞政治的人不太附庸风雅，国民党在打天下的时候，也是如此。国民党至多只是控制学术机构，但不敢控制学术，也无此妄想。但到台湾以后，地小人稠，闲来无事，居然殃及学术，研究院、研究所、研究中心、大学等等，纷纷渗入了党团与党棍，他们也要写论文了、也要办学报了、也要召开或参加学术会议了，但天知道这是什么“学术”！几十年来，学...
020.“学统”梦碎.txt	4	7	7	240	4	几十年来，国民党出马抢“学统”，是以徐复观开先河的。几十年下来，他以“当代文、史学家”（中央日报）、“当代思想史大师”、“国学大师”（《新生报》）等“学者”身分出现，这是他和国民党的成功，却是学术的失败。现代中国的“学统”，本来一直掌握在胡适系的手里，胡适系的学术，我早在当年就批评了，而引起胡适对我的不快。但胡适的“新朴学集团”，虽然不怎么学术，却还谨守乾嘉...
020.“学统”梦碎.txt	9	17	17	208	3	钱穆拿了国民党的钱，第一次是2000港币，就感激涕零，到台湾来。徐复观为达成湖北人“牵骆驼”的妙用，把钱穆安排住在徐府（台中市向上路20号），侍奉得唯恐不周。两人交恶后，据徐复观说，钱穆面也不见了、信也不回了、文章也不写了，其过在钱穆。其实，据我探讨，另有隐情。那就是暗中的“道统”争夺战。徐复观只把钱穆过渡而已，真的“道统”继承人，他自己是想抢的。我在《文星...
020.“学统”梦碎.txt	10	19	19	232	4	这样说来，他们实在可以联欢一次：群贤毕至，少长咸集。古人复起，腐儒重生；保守与顽固齐飞，大官与学者一色。酒酣耳热之余，大家不妨拔剑击柱，争争谁是正统？其实他们都迟了，真正的正统早被一匹“黑马”盗之以去了，这匹黑马就是大谈新儒家的徐复观！他说：“不谈文化则已，一谈文化便应该谈‘统’。我并且希望有些人出来断然以道统自任。”（《儒家精神之基本性格及其限定与新生》）...
020.“学统”梦碎.txt	11	21	21	358	4	徐复观本来帮国民党收买“道统”人物的，但买到最后竟有“何必买别人呢？我们国民党也有这种人物呀！”的微妙发展，这种发展，非国民党所乐见，因为究竟钱穆人望较足，所以国民党用公款为钱穆在外双溪置了花园洋房，把“活道统”养起来。表示“道统”可以抢，但你徐复观应稍安毋躁。但徐复观是何等厉害的人，他从1949年4月起，向国民党拿到办《民主评论》的钱以后，就一路这样发展下...
021.《宪法》梦碎.txt	32	63	63	133	3	从临时条款的四次修订中，我们可以看到，它的主线是使“国民党当局”越修权力越大，所以修一次，就坐大一次。最后，修到了蒋介石由总统变成皇帝，蒋介石犬子当上接班人。《宪法》变成保护一家一党的工具，一切《宪法》戏，都由临时条款代位演出。《宪法》条文虽然俱在，但都成了具文了。
021.《宪法》梦碎.txt	34	67	67	237	3	（夏天注：《中华民国宪法》由中国国民党与中国民主社会党、中国青年党合力召开制宪国民大会，于民国三十五年（1946年）12月25日通过《中华民国宪法》，民国三十六年（1947年）1月1日公布，同年12月25日实施。民国五十二年（1963年）由台湾地区行政院正式确立每年12月25日为“行宪纪念日”，此为“行宪纪念日”的由来。但实际上自1947年12月25日宪法实...
023.“遗教”梦碎.txt	2	3	3	760	5	《中华民国宪法》劈头就说“依据孙中山先生创立中华民国之遗教”，“制定本宪法”，但是搬出“本宪法”与遗教一对照，便发现抵触丛生。乍看起来，定章分节，全是遗教的外壳，从第3章国民大会，到第11章地方制度，无一不《五权宪法》也；但实际上，从第3章国民大会起，就大干一票，只师遗教之词、而不师其意了。第25条先打了国民大会职权的折扣、第27条又剥夺了国民大会一大部分政...
023.“遗教”梦碎.txt	4	7	7	275	3	雷震1967年1月3日日记：“行政院完全变为执行机关，立法院变为告朔之饩羊，一切大权集中于总统而名实独裁了。过去蒋中正实际上是独裁，名义上还保留宪法体制，现在完全离开了宪法。”2月2日日记：“国家安全会议组织纲要（不称法，亦不称条例，因为不经过立法院）条文公布，这就是一权政府，其决定完全以命令行之，今后立法院成了聋子的耳朵。其职权非常广泛，可谓政务全部包括，...
024.“政体”梦碎.txt	2	3	3	81	3	1991年7月29日，《自立晚报》在“我们要怎么选总统”系列专访中有大标题说：“邱义仁：总统直选后政府体制应采内阁制”。这个缩着脖子、造型讨厌的政客，说了两段话：
025.“民主”梦碎.txt	2	3	3	203	3	胡适当年写《两种根本不同的政党》，指出：英美的政党叫甲式政党，苏联的政党叫乙式政党，甲式政党的特色是党员没有确定人数、党籍没有纪录可查，人人可以自由登记为某党党员，没有党的纪律可以约束投票等；乙式政党的特色正相反，它有严密的组织、有确定的人数、有详细精密的党籍、入党必须经过调查，成为党员后必须服从党的纪律，否则将受惩戒等。乙式政党虽然也用“政党”的名称，但性...
025.“民主”梦碎.txt	4	7	7	535	4	民进党在政党属性上，我们看来看去，看不出它的“反革命”反在哪里。党章也、党旗也、党徽也、中央党部也、县市党部也、乡镇市区党部也、特种党部也、中央执委会也、党主席也、中央执行委员也、中央常务执行委员也、中央评委会也、中央评议委员也、中央常务评议委员也、入党介绍人也、填表也、宣誓也、缴纳党费也、颁发党证也、全国党员代表大会也、县市党员大会也、乡镇市区党员大会也、...
026.“党争”梦碎.txt	2	3	3	172	3	国民党整天要我们读《国父遗教》，《国父遗教》里明明说：“一国之政治，必须有党争，始能进步。”“互相更迭、互相监督……乃争公道，可见党争实不可少。”但是，国民党几十年来，用各种漂亮的和丑陋的理由违反《国父遗教》，不准有反对党、不准人们争公道，按说民进党抢先卡位了，有了“党争”，“互相更迭、互相监督”，应该可以“争公道”了。事实发展，却大大不然。
026.“党争”梦碎.txt	4	7	7	281	4	但是，宪政一宪，就宪到台湾来，并且，临时条款和戒严法等等直扑宪法，把宪法活活压住。宪法第14条明定人民可以组党，可是国民党硬是不准，说按照戒严法第11条第1项规定，戒严时期得停止结社。但在法理上，宪法明明和戒严法相冲突，行宪就不要戒严，戒严就不要行宪，两样全来，两样就都不伦不类，并且互相抵触。照宪法第171条第1项规定：“法律与宪法抵触者无效。”戒严法的无效...
026.“党争”梦碎.txt	5	9	9	190	3	照国民党答应的组党自由，辛亥革命前答应的不算、1912年答应的不算、 1913年答应的不算、1929年答应的不算、1947年答应的不算，人们眼巴巴的等了七八十年、等了五六十年、等了三四十年，等的结果竟永远是“非常时期”、永远是“大敌当前”、永远是“环境特殊”、永远是“国情不同”、永远是“将革命事业从头做起”，这样的等来等去，这样的等呀等的，难道还相信他们吗？...
026.“党争”梦碎.txt	12	23	23	195	3	民进党占了大便宜。原来国民党大员戴传贤，早在1944年就说过：“周朝的天下是800年，国民党至少要掌握政权1000年！”人们虽已等了七八十年、五六十年、三四十年，可是用1000年一减，即使寿比800岁的彭祖、寿比930岁的亚当（Adam）、寿比950岁的拉麦（Lamech）、寿比969岁的玛士撒拉（Methuselah），也还是空等一场，到头来还是要听《秋水...
027.民进党为国民党护航的一个例子.txt	2	3	3	144	3	我认定民进党其实是另一个国民党，只是理论上铁口直断，还没实际上躬逢其盛。我总要实际操作一下。机会来了。2005年11月17日，在立法院第6届第2会期审查九十五年度中央政府总预算案第4组第5次会议，国防、预算及决算两委员会联席会议上，我亲身领教了。那天会议是民进党李文忠主席。摘抄纪录如下：
027.民进党为国民党护航的一个例子.txt	3	5	5	119	3	李委员敖：主席、各位列席官员、各位同仁。之前本席质问谢长廷院长，他告诉本席国防预算里的军购部分是“购”和“租”并存；但至今天为止，预算书中仍然没有说明何种武器可以租，不必买，所以，这样的预算书太粗糙了！本席认为应该全部搁置，没有细节可讲！
027.民进党为国民党护航的一个例子.txt	4	7	7	142	3	主席：今天主要的目的是审查预算，委员可以有自己的主张，所以李委员可以逐项逐目地要求搁置，如果李委员要达成你的目标，就按照议事规则逐项逐目的搁置。现在我们决议逐目审查，因为预算数非常庞大，所以只要有争议的部分就搁置到最后一并处理。请问各位，有无异议？（无）无异议，通过。现在休息5分钟。
027.民进党为国民党护航的一个例子.txt	8	15	15	154	3	李委员敖：主席、各位列席官员、各位同仁。本席要先向主席表达我的基本立场。中国有一句古话：“豺狼当道，安问狐狸？”真正的大问题没有解决，解决小问题是没有意义的。我讲过，为什么卖房子、卖地，基本上就是为了军购。因为钱不够，要把钱给美国人。基本问题在这个地方。基本问题不解决，预算统统冻结。我要逐条反对，统统反对！
027.民进党为国民党护航的一个例子.txt	12	23	23	164	6	李委员敖（在席位上）：我必须打断你的话，本席认为这是空谈。为什么本席不信任颜清标？本席认为今天我们都上了李文忠的当，他作了表决请我们来，结果刚才有媒体告诉我，说颜清标来了案子就过不了，如果有李敖要通过的法案就政党协商来反对，结果闹了半天都是空谈，最后的政党协商会被你们搞掉，大家都是在演戏，这种情况下，我让给你们这些老年人去玩。
027.民进党为国民党护航的一个例子.txt	15	29	29	185	3	李委员敖：主席、各位列席官员、各位同仁。本席忍不住要插播一句，什么是总政治部？我们当兵的时候在外面打靶操练，他们在后面检查我们的信。总政治部还干了什么事情？办一个《青年日报》，什么烂报纸；今天搞什么保防业务，又违反军人中立，整个部都要删掉，当然这牵涉到立法的问题，可是删预算权在我们手里，总政治部的预算统统都要删掉，这是非常可恶的一个政工的部，军中的特务，预算...
027.民进党为国民党护航的一个例子.txt	17	33	33	571	4	李委员敖：主席、各位列席官员、各位同仁。本席认为必须厘清基本形态，孟子曾经说过医生喜欢把人看活，而卖棺材者总是喜欢人家死亡，职业绝对会影响人的想法和性格，本席认为，今天问题并不在于总政治作战局这位将军要记小过或记大过，这位职业军人目前在国防部总政治作战局服务，请问全世界有哪个民主国家的国防部设立总政治作战部或总政治作战局？都没有，只有共产国家才设立类似的单位...
027.民进党为国民党护航的一个例子.txt	20	39	39	258	4	李委员敖：主席、各位列席官员、各位同仁。其实本席本来要提案全部删除总政战局的预算，经过丁委员守中、苏委员起共同协商，希望给你们一些缓冲的时间，所以最后是删除二分之一的预算。为什么本席要删除二分之一的预算？台湾口口声声说要本土化，但中央政府有两个衙门是最不本土的，第一，蒙藏委员会，到底蒙藏跟台湾有什么关系？这是不本土的衙门，应该要删掉！第二，国防部总政战部，也...
028.“脱党”梦碎.txt	3	5	5	97	3	齐世英之开除党籍，是遵照该党总裁蒋中正的条示，而经由国民党临时中常会开会决定，只不过是一个形式。据说：齐世英之所以被开除党籍者，因为他是立法院“革新俱乐部”首领之一，电力加价案，不过是借口罢了！
028.“脱党”梦碎.txt	8	15	15	519	5	唐纵仍劝我归队！临行时又重复的加上一句。但我一直不肯填表，不料唐纵叫人找到中日文化经济协会干事刘子英，暗中替我填表送去了……刘子英填表我并不知道，迨接到党部通知谓我之归队已奉总裁核准，嘱我去领新党证，我相应不理，未去领党证。不料，《自由中国》半月刊于四十三年12月16日出版的一期上，登载了余燕人等一篇《抢救教育危机》的读者投书，指责今日中学生负担太重，因为读...
029.“书呆子”梦碎.txt	2	3	3	127	3	国民党喜欢吃豆腐，明明是“联共”却美其名曰“容共”，全名“联俄容共”。在国民党“联俄容共”的3年里（1924至1927），他们一起建立了一党独大，也建立了一党独大的党化军队。当时的密切情形，我引1950年10月19日国民党《中央日报》自己招承的译文为例：
029.“书呆子”梦碎.txt	7	13	13	343	3	润之先生：顷见报载傅孟真兄转达吾兄问候胡适之之语，感念旧好，不胜驰念。前夜与董必武兄深谈，弟恳切陈述鄙见，以为中共领袖诸公今日宜审察世界形势，爱惜中国前途，努力忘却过去，瞻望将来，痛下决心，放弃武力，准备为中国建立一个不靠武装的第二大政党。公等若能有此决心，则国内18年纠纷一朝解决，而公等20余年之努力皆可不致因内战而完全消灭。试看美国开国之初，节福生10余...
029.“书呆子”梦碎.txt	8	15	15	252	6	胡适的“为中国建立一个不靠武装的第二大政党”的劝告，共产党是听不进去也不相信的，他们说他们若没有“这几条烂枪”，他们早就被国民党打得稀巴烂了，国民党是不允许他们“和平奋斗”的。说的确是实情。胡适后来回忆这封电报，自嘲的说：“在理想主义澎湃的那些日子里，我跟国内政治和国际政治的生手们同样的天真……竟天真到打了一封长的电报到重庆，以便转交给我从前的学生毛泽东！”...
030.“大儒”也梦碎.txt	2	3	3	148	7	有一次，雷震愤愤不平的向胡适说：“胡先生啊，我们《自由中国》讲了真话，我们指出‘反攻大陆’是不可能的事，为什么我们讲了真话，反倒被围剿？这公道吗？”胡适答道：“问题不在你们说了真话，问题在你们打破了别人的梦，打破了千千万万人共同的一个梦，即使那是个迷梦。你们打破了别人的梦，别人自然就恨你们了。”
030.“大儒”也梦碎.txt	4	7	7	397	3	回想《自由中国》杂志驰骋十年的特色，正在它单纯的讲了真话，它的主轴是提倡自由民主，千言万语在“与朝廷争胜”（这是当年苏东坡的“毛病”），真了不起。但我常常想，当《自由中国》被封杀后，影响一时的掌声歇后，平心而论，究竟这个杂志影响了谁？除了我李敖能够延续这一“与朝廷争胜”的风骨与干法外，它又影响了谁？我找来找去，实在找不出一个响当当的名字。其杂志存则义举，其杂...
030.“大儒”也梦碎.txt	5	9	9	160	3	马君武诗说“文字收功日，千秋革命潮”，但在《自由中国》杂志上，我看不到。在《自由中国》后，我也办过杂志，但究竟影响了谁？看来看去，原来答案是我自己。我深切感到“文字收功”的局限，“反革命”（这里不遵守国共的狭义用法）的势力太大了，最后最突出的，只是“与朝廷争胜”的那股精神而已。是精神胜利，其他的赢面，毕竟又迟缓又可怜。
030.“大儒”也梦碎.txt	6	11	11	195	4	胡适在《自由中国》茶话会上致词说：我们不要妄自菲薄，我们也是有权有势的人，只是那种权势不是世俗的武力与财力。他的观点令人心神一畅。但是，毕竟时代已变得越来越不“匹夫而为百世师、一言而为天下法”了。蒋廷黻预告说：他们那一代的知识分子是中国有影响力的最后一代知识分子。从许多面上观察，蒋廷黻说得也是。知识分子的确越来越小化、越专家化了。这个世界已经罕见“大儒”了、...
030.“大儒”也梦碎.txt	7	13	13	74	3	打拳的阿里（Muhammad Ali）说了一句别人玩笑视之的话：“我是最伟大的。”（I am the greatest.）有一位“大儒”倒玩真的呢。
031.“小党”梦碎.txt	2	3	3	320	3	民国成立时，政党有300多个，可是国民党一党独大，在参议院、众议院人数近400人，其他3个也算大的大党共和党、民主党、统一党加在一起，也赶不上它的三分之一，更别提其他小党了。这种一党独大，当时是被“北洋军阀”容忍的，可见“北洋军阀”的度量，的确非后来的国民党所能企及。但这种容忍，最后终于爆发，主要原因是“北洋军阀”感到国民党不守信，因为明明是把总统制的总统，...
031.“小党”梦碎.txt	5	9	9	231	3	“训政”是清朝西太后用的名词，国民党用这种字眼，真是好有一比。国民党在1928年10月3日通过了《国民政府组织法》，同时通过了六条《训政纲领》，以为这个组织法的依据。陈茹玄在《增订中国宪法史》里，曾说这个《国民政府组织法》下“国民政府之组织，非合议制，实大近独裁制”，是“合议其形式而独裁其精神”的。陈茹玄是国民党大员，他这种说法，悍然表示了国民党是独裁的。既...
031.“小党”梦碎.txt	6	11	11	174	3	试看对青年党这怪胎，国民党的手法是连“厕所里的花瓶”都不要的，青年党遂遭到被迫杀的命运。青年党领导人曾琦，在1927年8月30日被捕，幸亏他运气好，有国民党中央监察委员王宠惠力保，才得脱身，避往日本。其他的青年党员杀的杀、关的关，全无宁日。青年党的中央党部，设在上海英租界西摩路静安寺路口一座弄堂房子里，只剩两个秘书看家，在外国人的庇护下苟延残喘。
031.“小党”梦碎.txt	7	13	13	143	3	1931年九一八事变后，曾琦发表《一致对外与一党专政》，公开指出：“在一党专政之下，唯国民党始有公开活动之权，其他政党之分子则等于褫夺公权之罪犯”。其实褫夺公权还算是客气的呢！照国民党特务头子之一陈立夫后来告诉李璜的话，许许多多青年党员根本就给丢到黄浦江里头了！国民党的威风，由此可见！
031.“小党”梦碎.txt	8	15	15	228	5	直到1937年抗战以后，国民党才与青年党交换了合作信函，青年党说“愿与国民党共患难”，国民党却根本不提青年党，只是承认这批人而已。当时青年党的“中央同志多不悦”，曾琦说：“今国难严重，国家主义者当以国事为先，不必拘此小节！”于是青年党就做起花瓶来。因为瓶功不小，甚至一度分到农林部长、经济部长干。最后花瓶带到台湾，整天给国民党赏心悦目起来，小节固然不拘，大节也...
031.“小党”梦碎.txt	9	17	17	188	4	大陆丢掉后，青年党唯一的清流领袖左舜生，宁愿在香港开个小杂货店，也不要来台湾被豢养，但是作客一下则不妨为之。他到台湾，约我吃早饭，私下劝我别写东写西了，他说：“你李敖走的是到烈士之路。”我听了，为之动容。多年以后，青年党的另一领袖李璜被买回台湾，要求蒋经国同意他办一张小报都不可得，委琐而死。李宁小姐访问他后，笑着对我说：“李璜怕死了，谈话提到李敖名字时，都要...
032.“小党”又梦碎.txt	6	11	11	143	4	国民党到台湾后，民社党和青年党一样，也更花瓶化。张君劢厉行不合作主义，不肯来台；梁实秋被诬偷美国新闻处打字机，家里被搜……最后远引的远引、投降的投降，民社党遂被国民党直抵花心，瓶颈在和平东路的小巷之内，最后斗到党中央多胞案以至夺印案，丑态百出，变成了像青年党一样的宝，令人又好气又好笑。
033.“暴政必亡”梦碎.txt	2	3	3	427	8	1951年11月6日，国民党台湾省第1届全省代表大会的第2天，陈诚应邀做了两个小时讲话。他慨乎言之一个故事：“当大陆全部沦陷的那一年，有一个外国记者来台访问我的时候，曾经向我说过一件事：他在北平曾访问毛泽东说：国民党有50年的悠久历史，何以在短短的一两年，一败涂地？毛泽东当时很坦白的答覆云：‘国民党的失败，确非共产党兵力打败它，而是它们自己打败自己。’我很承...
033.“暴政必亡”梦碎.txt	3	5	5	159	3	陈诚死前一年，邀我做了一次谈话，他坦白说：“共产党的失败，并不就是国民党的胜利。”当然言外之意，国民党要搞下去，得改头换面才成。陈诚痛斥派系，但他自己，未尝不是搞派系的能手，他到台湾后，究竟改头换面到什么程度，也至为可疑。不过那次谈话给我的印象，是他深深忧虑国民党的前途，他能有那种觉悟，也算“人之将死，其言也善”吧！
034.“黑猫”梦碎，“白猫”也梦碎.txt	5	9	9	374	4	问题是以老三自居，自居久了，容易真有点老三的懦相。清朝的封疆大吏还在无奈之余，提出“中学为体，西学为用”。老三是“西学为用”的高手，但在“中学为体”上，却一路苍白与空白。最后“作戏无法、搬出菩萨”，全世界到处设立起“孔菩萨学院”，其实，在美帝“软实力”的排山倒海下，这种学院只是撒钱而已，变成了具体而不微的、放大了几千倍的“蒋经国基金会”，讨好洋鬼子和假洋鬼子...
034.“黑猫”梦碎，“白猫”也梦碎.txt	7	13	13	534	7	跟着美国跑，“师夷之长以制夷”的初衷是好的，但是你必须师到“软实力”，否则的话，你会被夷牵着鼻子走，并且伊于胡底、反被夷所“制”。不错，你有外汇存底、你有刀有枪，但你没了“体”和信心。一穷二白时的毛主席不是这样的，他要大言打出两个太阳。毛的苦恼是他打掉了那个姓蒋的太阳，但是打中国以外的太阳，不释放出生产力是不行的。邓小平发现“穷不是共产主义”，因此派出黑猫白...
035.“罢免”梦碎.txt	4	7	7	127	3	第一次：2006年6月27日。我参加了，并审查毁宪违法的主题。《立法院公报》纪录：“6月23日上午审查主题为毁宪违法，发言委员计有：李敖、孙大千、张显耀、赵良燕、李永萍、李庆安、吕学樟、林鸿池、高思博等，并由吴志扬、张显耀进行结辩。”投票后主席结论如下：
035.“罢免”梦碎.txt	8	15	15	205	4	第二次：2006年10月13日。我参加了。《立法院公报》纪录：吕学樟发言，他说：“再过几分钟，我们即将进行罢免案表决，在这历史的关键时刻，本席要再一次呼吁陈水扁，你那只黑手不要伸进立法院，胁迫民进党立法委员的投票意愿。同时，也恳请民进党朋友们，拿出自己的良知，顺应民意，勇敢地进入国会殿堂，投下赞成票，把台湾的民主价值找回来，把人民的权利还给台湾2300万人，...
