file	paragraph	line_start	line_end	char_count	score	snippet
010.“汉奸”梦碎.txt	4	7	7	275	4	蒋介石自从1928年济南事变、1931年九一八事变闪躲日本人起，骨子里就是真正的主和派。自此以后，1933年塘沽协定，出卖华北，是蒋介石的杰作；同年摧残察绥抗日活动，打击抗日分子，是蒋介石的杰作；1935年何梅协定，使华北特殊化，也是蒋介石的杰作……这些蒋介石的杰作，站在幕前背黑锅的，其实都是汪精卫。事实上，汪精卫本人，对日本原是主战派，1931年的九一八事...
010.“汉奸”梦碎.txt	5	9	9	93	3	上海的淞沪协定为“汪先生”所知的，而塘沽协定是事后才知道的，汪先生也应该分辩一下。汪先生说：“绝不分辩，谁教我当行政院长？行政院长是要负一切责任的。”汪先生这一句话可以表明他当日的心境。
010.“汉奸”梦碎.txt	12	23	23	285	5	关于这一疑案，朱子家（金雄白）在《汪政权的开场与收场》中，提到褚民谊在狱中说：“早有人处心积虑，想把一只臭马桶套在汪先生头上。这次是千载一时的机会，既经动了手，就绝不会轻易放过了。”朱子家补充道：“本来约定是做假戏，但一出场，就变成做真戏了”，倒是很可能的。以殷汝耕为旁证，就可明白。殷汝耕在1935年成立冀东政府，抗战胜利后被捕，在狱中，他终日念佛，了无嗔意...
010.“汉奸”梦碎.txt	13	25	25	395	3	朱子家说汪精卫和蒋介石“对战力的看法是一致的”，但对谋和的看法，其实蒋介石尤有过之。试看德国驻华大使陶德曼（Oskar Tautmann）“所述日方条件”蒋介石“曾毅然许诺”，就可以想像。先是日本在1937年11月2日开出和议七条件，由德国转达。七条件重点是：一、内蒙自治。二、华北设非武装区，委派亲日首长，并圆满解决日本开发矿产事。三、上海非武装区要扩大，由...
010.“汉奸”梦碎.txt	14	27	27	784	7	可是，九国公约并没帮上忙，日本也干脆拒绝参加。同时，战场局势却发生了大变化。蒋介石见陶德曼这天，日本就在杭州湾登陆，同时安阳失守。11月8日，太原失守、任县失守。9日，松江失守。11日，上海失守、大名失守。13日，济阳失守。14日，嘉善失守。16日，昆山失守。18日，嘉兴失守、烟台失守。20日，苏州失守。21日，吴兴失守。25日，无锡失守、长兴失守。29日，...
010.“汉奸”梦碎.txt	15	29	29	378	4	陶德曼得到蒋介石的“毅然许诺”后，转报回国。德国外交部认定“日本的建议差不多在所有的要点上，都已得到了满意的反应”，遂在12月7日，转告日本。可是，日本因为在军事上已把蒋介石打得落花流水，开始拿乔了。12月13日，南京失守。12月22日，日本开出了四条件，重点是：一、中、日、满（满洲国，即中国东北）共同防共。二、设立非武装区，并在必要区域内成立特殊政权。三、...
011.“抗战”梦碎.txt	17	33	33	128	6	蒋介石通敌日本，多次密谈，多因日本方面的叫价太高而谈不拢，所以最后“八年一觉重庆梦，赢得人说抗战名”。虽然谈不拢，但勾结日本，还是比他打倒日本更内行。因为抗战中漂亮的仗，大都是蒋介石排挤的“杂牌部队”打的，蒋介石自己的嫡系部队，干别的可以，打日本却不内行。
011.“抗战”梦碎.txt	20	39	39	428	6	先是蒋介石不对日宣战。在抗战以前，是一路亲日、媚日，并阻止爱国者抗日的。这种作风，1933年4月5日，曾被马相伯、章太炎、沈信卿等指为“阳示抵抗以息人言，阴做妥协以受敌饵”。抗战开始于1937年7月7日，其实7月7日只是北方将士在卢沟桥抗日，是北方将士用流血造成事实上的一个明确起点。有人以为国民党政府从这时候向日本宣战，是完全不了解内情的。国民党政府向日本宣...
012.“受降”梦碎.txt	4	7	7	551	3	冈村宁次大将所遵派之乞降代表总参谋副长今井武夫少将，偕同参谋桥岛芳雄、前川冈雄及译员木村辰勇等一行8人，于21日上午11时20分飞抵芷江，下机检验身分证后，即分乘插有白旗的吉甫车二辆，前往指定帐棚休息。今井所乘飞机，系一日造中型运输机，机身绘制绿色花纹，机翼和机尾都遵照规定系有红色布带。下午3时40分，先由中国陆军总部萧参谋长毅肃于会议厅召晤，厅内布置简洁，...
012.“受降”梦碎.txt	14	27	27	121	3	其一：“目前在马尼拉与美军协商中的日本军代表曾声称：‘中国由于国共两党分歧，治安情况不佳，从而威胁日本人的生命安全’等语。这是对中国国家的重大侮辱，以后不得再有此类言论。”我的答覆是：这样的报告，究竟在马尼拉有无此事，“支那派遣军”未有所闻。
012.“受降”梦碎.txt	15	29	29	100	3	其二：“日本军队之中，尚有不肯投降，向中国军队挑衅的情事，应立即制止这类行动，同时调查后详报。”我说：“如果日本军队今日还有向中国军队挑战的意志，那我们在蒋委员长未有指示以前，就不会自动的来联络了。”
012.“受降”梦碎.txt	23	45	45	165	3	看到了吧！国民党以少将化装成少校，来招待日本人呢！以圆桌武士的圆桌，来优礼日本人呢！最后，竟还以泪眼奉陪泪眼，和这些拥抱过中国妇女的侵略元凶“互相拥抱而泣”呢！好精采的国民党啊！当然，这些精采，在国民党冷欣的回忆里，都给遮盖掉了。在他的回忆里，我们看到的，当然是一片不假辞色的浩然之气！谁想得到文字背后，竟是这样的“以德报怨”啊！
012.“受降”梦碎.txt	30	59	59	284	4	我对日本人性格相当了解，一种自大狂的心理，此时并未因战败而降低或消除，以往对我国交涉任何事件，均喜用一种试探手腕来观察你，即俗话说：“先秤秤你的分量”，如果你对他敷衍、迁就，他就认定你软弱低能，用尽方法来摆布你、作弄你，使你啼笑皆非，达到他的目的为止；倘使能义正词严的交涉，他反而敬佩你，不敢无理要求。在抗战前，中日两国的若干交涉，不乏先例，最后我乃指示陈倬对...
012.“受降”梦碎.txt	34	67	67	195	3	照国民党冷欣的回忆，我们看到的是：在他和冈村宁次见面以前，没有国民党大员“和冈村在私宅相见”的，所谓“怎能和冈村在私宅相见，未便同意”的。并且他的“各位参议先生”（顾毓琇、刁作谦、邵毓麟、龚德柏）也“一致向我建议反对”的。但是，只要我们细心查看一下，国民党冷欣这种民族正气，很快就穿了帮。因为“参议先生”之一的国民党邵毓麟（后来的驻韩大使、驻土大使），在《胜利...
012.“受降”梦碎.txt	35	69	69	558	7	我们飞抵南京机场之时，今井率领参谋人员在场迎迓。我和今井在芷江初次见面，仅交谈数语，但当时日本驻南京伪组织大使馆的大使谷正之、公使堀内干城、参事太田一郎、清水董三等，均系战前旧识，大约今井已和他们交换过情报，所以我们在机场晤面时，他就悄悄地告我说冈村总司令官有随时切腹自尽之虞。我听了内心既紧张又怀疑，但在表面上只好镇静地告诉今井说：“这不是切腹的时候，请你转...
012.“受降”梦碎.txt	36	71	71	198	3	可见日本人早就摆下圈套，要你前去“聆教”了。国民党冷欣书中说他当时宣布成立前进指挥所后，“并即转达何总司令的命令：所有人员均不得私自外出，如有必要，必须事前请假。并告诫绝对不许有人‘接收’任何东西，亦不得使用封条，违者军法从事！”可见在这种规定之下，前进指挥所的一员——国民党邵毓麟，是不会私人行动的，他要先去见冈村宁次，必出自国民党冷欣的授意，所以国民党冷欣...
012.“受降”梦碎.txt	37	73	73	60	3	就这样的，国民党邵毓麟在头天晚上，先去了南京中央路冈村宁次公馆，拜访了“不失大将风度”的冈村大将！国民党邵毓麟最后写道：
012.“受降”梦碎.txt	38	75	75	86	3	我们相对无语的沉默了片刻后，我看时间已过半夜，随即告辞。临别我说：“冈村大将决心以后，我们下次再约进一步谈话。”这是我在胜利以后第一次到达南京当夜和日军总司令的第一次谈话。
012.“受降”梦碎.txt	46	91	91	57	3	就在国民党邵毓麟飞返芷江的同一天，“怎能和冈村在私宅相见”的国民党冷欣，亲自去这日本战犯的私宅了。国民党冷欣回忆：
012.“受降”梦碎.txt	52	103	103	395	3	依无条件投降规定，一切由战胜国安排，战败国无条件服从，所以对于签字仪式、降书内容、投降代表应准备事项，均由我战胜国方面迳行决定，不须征询投降代表签字人意见。当冈村宁次接获我总部中字第19号备忘录，规定何总司令接受日军投降地点、日期、时间及日军投降代表签字人与出席人后，一再请求我提示签字时出示证明文件应载明事项，并盼事先能了解降书的内容。我嘱交涉人员转致他证明...
012.“受降”梦碎.txt	55	109	109	573	4	刚才追记当年投降签字情形，提及日军投降代表7人，一律军装，均未佩带军刀；其实，关于敌人军刀的处置，事先交涉是颇费周章的。因为日本军官的威仪，平日就表现在这把代表武士道精神的军刀上，今天日本虽然战败宣告无条件投降，而敌人多少还希望保留一点尊严；如果硬性规定在签字之日不得佩带军刀入场，日方也只好俯首听命，不过好像太不给他们面子，假使因此老羞成怒，使出武士道切腹自...
012.“受降”梦碎.txt	71	142	142	202	3	在上面这种对比里，按照陆军总部颁布的《中国战区中国陆军总司令何应钦上将受降仪式程序》，是“上午9时正，何总司令将日军降书（中文本两份）交付冈村宁次大将阅读，并签字盖章（此时各中外摄影记者一律准予照相），冈村宁次于签字盖章后，送呈何总司令”。但在事实上，我们了解的情形却是：冈村宁次与国民党何应钦是“授受不亲”的。这种“授受不亲”，我们从国民党冷欣偷抄9月10日...
012.“受降”梦碎.txt	72	144	144	1444	3	签字仪式，依照预定程序准时开始：8时30分，中外来宾如江苏省政府主席王懋功、第三方面军司令官汤恩伯、接收计划委员贺衷寒、盟军军官麦克鲁中将、海恩中将、柏德诺少将、保义上校暨中外记者数百人陆续签名入场。8时45分，日军投降代表冈村宁次大将等，分乘汽车三辆，由中国王武上校引到中国陆军总部，在广场下车时，中外摄影记者纷纷摄取镜头。王上校接引他们入休息室，这时应邀观...
012.“受降”梦碎.txt	73	146	146	188	3	从这段回忆里，我们清楚看到是“冈村转命小林总参谋长呈递何总司令”、是“萧参谋长转交冈村宁次大将”、是“命小林总参谋长把降书递呈何总司令”、是“小林总参谋长……双手呈递何总司令”、是“萧参谋长交付冈村宁次大将”。全部过程中，冈村宁次并没向何应钦亲递过降书，所以国民党发布的照片上的日本将军，是小林浅三郎，而非冈村宁次。国民党官方党方所做的照片说明，至此证明全部是...
012.“受降”梦碎.txt	85	170	170	109	3	冈村：是的。其次，使我不能忘怀的，也是您的宽容敦厚，本来预先排定我们进场的时候应向全体敬礼，何先生等不必还礼。可是，最后我在投降文件上盖章而由小林参谋总长呈献您的时候，您却站起来给他回礼。后来，外国顾问团有没有抗议呢？
012.“受降”梦碎.txt	89	178	178	145	4	这一对话又透露了：关于军刀问题，国民党何应钦竟在9月7日派了参谋去打派司（PASS）的！带也可以，不带也可以，全由敌将选择的！并且，按规定是“何先生不必还礼”的，可是国民党何应钦宁肯腾笑国际，也要向日本人弯腰，并且把腰弯得比小林浅三郎还深30度——这种贱骨头、这种软骨病，真他妈的太可恶了！
013.“钓鱼台”梦碎.txt	8	15	15	180	3	根据美国外交关系文书，证实罗斯福（FDR）一再要把琉球还给中国，但被蒋介石一再误国了。结果，“将来再说”的演变，美国竟片面独断，出卖了中国、出卖了联合国托管原则，还搭配上钓鱼台。钓鱼台在日据台湾时，日本把它归纳为台湾的岛屿，台湾归还中国了，钓鱼台怎能脱离了台湾；纵使硬说钓鱼台不属台湾，而属琉球，照联合国托管法律，被托管的地区终究是要它独立，也非还给侵略者啊。
013.“钓鱼台”梦碎.txt	12	23	23	258	3	保钓运动那些成员呢？从美国回来的、像马英九之流，都是些投机分子，这些货色不敢玩真的，只能浪得虚名而占实缺，钓鱼台问题既然已被耽搁得这么复杂了，解决它，可得等到中国更强大才会顺手。邓小平说把钓鱼台“挂起来”，等比我们更聪明的下一代来解决，语含深意哟。共产党是能屈能伸的。想想列宁签下《布雷斯特─立陶夫斯克（Brest-Litovsk）条约》的故事吧。1918年3...
014.“外蒙古”梦碎.txt	5	9	9	175	3	同时，蒋介石更明确的归属了责任所在。他说签约是“我个人的决策”、“是我的责任，亦是我的罪愆”、要“负其全责”。自承当年签约放弃外蒙古，“实在是一个幼稚的幻想，绝非谋国之道”，“对总理、对革命、对国家和人民应该引咎自责”。这种“自责”，终于使我们对“民族救星”的“高瞻远瞩”，有了更进一步的认识。并且，连蒋介石自己都认了错了，捧他的混人们又吹捧什么呢？
014.“外蒙古”梦碎.txt	9	17	17	83	3	在这一电文前两天，7月7日，就有了宋子文的两件来电。其中指出：在美国得知“经过情形”后，曾对外蒙“保持现状”有明文解释。“保持现状”即“中国在法律上仍保持其宗主权”。
014.“外蒙古”梦碎.txt	13	25	25	268	8	……宋（子文）则在7月底以前带了一大批人员去莫斯科参加会议。我当然急于知道会议的进展情况，因此，不时去看怀南特和艾登，因为我觉得他们会经常得到这方面的消息。我发现艾登确实比怀南特消息灵通。8月里的一天，艾登看出我对会议结果的焦急心情，他说，他理解中国不得不参加这个会议，不过我们并无必要放弃比罗斯福与斯大林协议之外更多的东西。我听了大惑不解。我问他这话是什么意...
014.“外蒙古”梦碎.txt	14	27	27	124	3	从杜鲁门回信到顾维钧回忆，我们都看到在外蒙问题上，蒋介石及其手下做了不该做出的让步——美国主子要你蒋介石卖国，没有错，但没要你卖那么多！事实上，可以不卖那么多！可以不卖那么多却要卖那么多，“要五毛，给一块”，此蒋介石及其手下之莫名其妙也！太混蛋了！
014.“外蒙古”梦碎.txt	26	51	51	420	3	令我们不解的是，纵有以上问题迫需解决，又何能用“急需与苏联订约”的方法？订了约，苏联不守又怎么办？何况，苏联对中国，早就有过不守约的纪录。1937年七七事变后，国民党政府已同苏联订过一个《中苏互不侵犯协定》，第二条中明说：“倘两缔约国之一方，受一个或数个第三国侵略时，彼缔约国约定在冲突全部期间内，对于该第三国，不得直接或间接予以任何协助，并不得为任何行动或签...
014.“外蒙古”梦碎.txt	34	67	67	174	3	毛主席对总理说：“我们还要搞一个声明。中华人民共和国成立时，我们已经宣布过旧中国与外国签定的一切国际协定、条约一概不予承认。但外蒙古独立是一个例外。外蒙古独立是国民党政府办理的，但是我们尊重蒙古人民1945年的公民投票，他们一致拥护独立。现在双方政府经过谈判确认蒙古人民共和国的独立地位。苏联也表示支持中国这一立场，同时也希望蒙古发表声明表个态。”
014.“外蒙古”梦碎.txt	37	73	73	210	3	蒋介石是卖国贼。王世杰是卖国贼。当然我们也别忘了，卖国贼中还有蒋经国。据《国家建设丛刊》第三册《外交与侨务》透露：“我方主持谈判代表，前一阶段为行政院院长兼外交部部长宋子文，参加谈判主要人员有外交部次长胡世泽、驻苏大使傅秉常，及蒋经国、沈鸿烈、卜道明、刘泽荣诸人；后一阶段主持谈判代表则为宋院长子文及新任外交部部长王世杰，参加谈判人员除增加熊式辉一人外，其余仍...
015.“建国百年”的殭尸花费.txt	5	9	105	4298	3	活动项目/主办部会/100年度预算案/合计/公务预算/基金预算/备注 总计(A+B+C+D)//3,198,203/3,198,203/0/ 总统府主管（A)//68,900/68,900// 1.办理接待各国元首、特使团、侨胞等活动/总统府/18,900/18,900// 2.补助中华民国建国一百年基金会营运经费/总统府/50,000/50,000// 文...
015.“建国百年”的殭尸花费.txt	10	115	115	146	4	尚不包括“财团法人中华民国建国100年基金会”的体制外敛财与开支。这个财团法人，是一个怪胎，它归属在“政府各部门投资或经营之其他事业及政府捐助之财团法人”项下，根据它“最近年度营运及资金运用计划”，主管机关是“行政院文化建设委员会”，光在“基金余额”上就有新台币3000万元，打秋风的对象是：
015.“建国百年”的殭尸花费.txt	17	129	129	65	3	这一浩大的“建国百年”烧钱活动，是由马英九担纲的，结果怪事连连，被民进党告到地检署。光在演出两场歌剧一项，《联合报》就有报导如下：
015.“建国百年”的殭尸花费.txt	23	141	141	87	3	民进党立委林淑芬更指出，听奥期间，赖声川的太太丁乃竺当时担任艺文主任负责筹划活动，但最后发包得标却是自己的老公赖声川。她痛批，从听奥到梦想家，“这已不是单元剧，而是连续剧”。
017.“法统”梦碎.txt	2	3	3	158	3	今年2011年，这个岛上大闹“中华民国第13任总统选举”，正好又赶上所谓“建国百年”，更给了所谓“第12任总统”马英九的张本。不过口口声声今年是“中华民国”100年，则100年间，“总统”绝不止10任，早在民国元年到民国十七年间，就有10任可循，现开1928年前“中华民国”历任元首（总统、执政、大元帅）姓名表如下：
017.“法统”梦碎.txt	17	33	33	112	3	结论出来了：你要坚持“中华民国”国祚百年，你就得承认袁世凯诸公是“中华民国”总统；你要坚持第1任总统是蒋介石、第12任是马英九，你就得承认“中华民国”寿命该从1948起算，就没有百年可言。你的“法统”，怎么都抛弃不了袁世凯。
018.“正统”梦碎.txt	2	3	3	158	3	我喜欢收集好的漫画，我收有早年《花花公子》（PLAYBOY）杂志刊出的一张，画面上小两口儿上床做爱，为了变花样，男方手拿性交之书以为指南，但因一时弄不清姿势，以致两人扭在一起，不知如何是好。男的一边查书一边说：“一定在什么地方弄错了。”（We must have made a mistake somewhere…）
018.“正统”梦碎.txt	3	5	5	452	6	最近我一边看这张漫画，一边想到马英九。马英九今天的手足无措，“一定在什么地方弄错了”。当年他竞选市长时，有一天秘密来拜访我，问我秘笈；当选后，未曾再来，很久不见了，顺手翻到他选举时的一本小册子，题为《二十一世纪台北》，其中有一段是：“去年，北一女校庆，班联会邀我去演讲，演讲对我本是家常便饭，但是那场讲得患得患失，因为我的女儿提醒我，北一女学生对不精采的演讲是...
018.“正统”梦碎.txt	5	9	9	110	3	2011年10月3日《联合晚报》登：“今年是建国百年，同时也是辛亥革命100周年，总统马英九今天出席‘辛亥革命百年回顾’国际学术研讨会，再三强调中华民国自由台湾承袭着国父孙中山的思想，才是从辛亥革命一路延续下来的正统。”
019.“道统”梦碎.txt	5	9	9	93	3	原来“国父”1925年3月死在北京后，5月国民党就在广州开了一届三中全会，发生内斗与外斗，会后戴传贤从广州回到上海，在6月写出了《孙文主义之哲学的基础》一书，把“国父”道统化。戴传贤说：
019.“道统”梦碎.txt	6	11	11	291	4	中山先生的思想，完全是中国的正统思想。就是继承尧舜以至孔孟而中绝的仁义道德的思想。在这一点，我们可以承认中山先生是二千年以来中绝的中国道德文化的复活。去年有一个俄国的革命家，去广东问先生：“你的革命思想基础是什么？”先生答覆他说：“中国有一个正统的道德思想，自尧、舜、禹、汤、文、武、周公至孔子而绝。我的思想，就是继承这一个正统思想来发扬光大的。”那人不明白，...
019.“道统”梦碎.txt	8	15	15	257	3	再讲一句话，我们要晓得总理的思想，即是继承尧、舜、禹、汤、文、武、周公、孔子以来的仁义道德思想，将之发扬光大，三民主义就是从仁义道德中发生出来。总理讲这句话是在广西桂林，我当时也在桂林，那个俄国共产党问总理的时候，我也在那里。共产党当时只是宣传，头一次越飞还没有来，那个俄国共产党并不是俄国人，而是瑞士人，也是第三国际派来的。孙先生头一句话答覆他的就是：“中国...
019.“道统”梦碎.txt	9	17	17	93	3	蒋介石这些话最引起我们注意的，是他在引戴传贤所述“国父”的话以后，并且透露：“我当时也在桂林，那个俄国共产党问总理的时候，我也在那里。”这就是说，他给戴传贤的话做了人证，表示这话是真的。
019.“道统”梦碎.txt	11	21	21	645	4	现在国家到了这样危急的情况，我们用什么方法可以把它挽救过来，完成我们的革命，使中华民族复兴起来呢？我很简单忠实的说，只有大家相信三民主义，而且要实行三民主义，就可挽救危亡。因此，我们要问：三民主义是怎样发生出来的？它的思想之渊源以及它的根本精神是在什么地方？简单的讲一句，它的思想渊源，就是继承中国从古以来——尧、舜、禹、汤、文、武、周公、孔子一脉相承所流传下...
019.“道统”梦碎.txt	12	23	23	86	3	两年以后蒋介石这段话，出现了两个最令我们注意的不同：第一、原来没有道统的字眼，现在出现了；第二、原来说“自尧、舜、禹、汤、文、武、周公、孔子而绝”，但是现在不提“而绝”了。
019.“道统”梦碎.txt	14	27	27	597	3	但是我们还要知道，总理绝不是凭空创造出来的，这个三民主义是有所本的，其渊源所自，早在总理以前，与我中华民族之历史的生命同流发展，不过到了总理手里，才拿这个东西重新整理，构成一部完善的思想体系，就叫三民主义。这个主义虽是最新的，而其本质和基本精神之所在，却完全是由我们历史文化的正统，历数千年一直传下来的。这个意思，总理在生时已经自己说明过的，我们只要将总理对苏...
019.“道统”梦碎.txt	16	31	31	704	5	我们更要知道，总理的基本思想，渊源于中国正统的政治思想和伦理思想。总理既认定了“民生”为历史的中心，便根据这个思想，指出我国固有的“天下为公”的思想，为改造社会的基本法则，与实行革命的最高理想。因为人类的生存最大保障，是在全体的生存，不在部分的或个人的发展。总理继承了中国固有的正统思想，认定利他是革命的本务，仁爱是救世的基本，利他和仁爱的极则，无过于天下为公...
019.“道统”梦碎.txt	17	33	33	81	3	这段话跟蒋介石最早的引文，最令我们注意的不同是：原引“国父”说的“尧、舜、禹、汤、文、武、周公、孔子而绝”，现在不但不提“而绝”了，并且出现了“相继不绝”的字样！
019.“道统”梦碎.txt	18	35	35	93	3	排比了上面这些文件后，我们不难会心的了解，前后所引“国父”的话，原来是经过这么微妙的演变的！正因为演变如此微妙，所以在钦定《国父年谱》1921年12月23日条下，我们可以看到这样的文字：
