file	paragraph	line_start	line_end	char_count	score	snippet
001.我最难忘的一件木雕.txt	4	7	7	304	5	所谓一夜，其实是半夜。因为清早一点就起来了，起来做工。我的做工，就是读书写作。杜甫诗说“读书破万卷，下笔如有神”，“读书”的真目的，乃在于“下笔”，“下笔”就是写写写。光读书而不写作，只为消遣或进学而读书，我是不来的。我从不为消遣读书，有人问阎锡山每天做何消遣，阎老西回答说，我不觉得人生有什么好消遣的。这话真逗，热爱工作的人，工作时间还不够呢，又消什么遣？至...
001.我最难忘的一件木雕.txt	6	11	11	247	3	当然，高山族的活生生，也付出了他们的代价。他们不读书，缺乏洋书中所谓“知识的力量”。—旦世外桃源侵入了挟有“知识的力量”的外来人出现，他们的命运，便被注定。——从大陆渡海而来的中国人登陆台湾，对九族巧取豪夺，整天搞各种尺寸的“二二八”、各种号码的“清乡”，最后，九族被逼到高山上去。这些中国人，霸占了台湾。其中有数典忘祖、也忘了高山族之祖的人，居然自称起台湾人...
002.我最难忘的一场演讲.txt	5	9	9	214	3	12月4日晚上，出版社转来一封快信，是交通大学学生活动中心学术部长陈碧君写给我的，信中说：“11月份您之未能莅校演讲，同学们均深表遗憾，一致要求再度邀约。……您的拨冗光临，将令我们的活动更形生色。”我拿着信，深感自己不对，上次约得好好的，竟不去讲，这次一定要补过。于是我亲自挂电话到新竹。在电话中，陈碧君声音轻微而平静，她细腻地向我说明了演讲活动的细节，真像一...
002.我最难忘的一场演讲.txt	6	11	11	150	4	陈碧君再来快信，对我表示感谢，并寄来我要的校方资料，“如有不详尽处，我们可以再补寄进一步的资料。”并告诉我：“12月21日（四）下午约四点半，本校同学吴彰明会至您处接您至交大。”后来又打电话到出版社，改为四点，以便可以有较多的时间请我吃饭，并参观校园。我对这位小朋友办事的周到、细心，有了很好的印象。
002.我最难忘的一场演讲.txt	9	17	17	128	4	从书架上，我取下我印的《汪政权的开场与收场》给她看，我说：“汪精卫的太太也叫陈璧君，不过璧字和你不一样。”不料她却说：“我的名字，原来也是那个璧字。”她的话，使我感到她对跟她同名的前辈女士并不陌生。我猜想：这一由“璧”转“碧”的过程，也许是一种有意的回避。
002.我最难忘的一场演讲.txt	12	23	23	87	3	演讲前，在细雨和夜幕中，她陪我走在校园的路上，对我说：“李先生，这条路有一样特色，就是它是循环的。你走下去，会又走回原点。”我回答她：“这样也好，你永远循环，永远不会迷路。”
002.我最难忘的一场演讲.txt	14	27	27	579	3	回到台北，已近子夜时分，我站在书架旁，又回到了原始的“陈璧君”。那位陈璧君生在一百年前，死在1959，她死后十年，这位陈碧君才出生，她们两位除了同名、除了同乡、除了同是优异的女性，萧条异代，其实无一相同。但在我的思绪里，却从下午四点以后，一直把她们联想在一起。在书房里、在汽车里、在餐厅里、在贵宾室里、在演讲时的思绪起伏里，这种联想，都间歇未断。把她们联想在一...
003.我最难忘的一片小湖.txt	8	15	15	325	3	从中国的鹅湖到外国的天鹅湖，湖滨的美丽总要有白鹅来陪衬。中兴湖的景色，不能跟世上许许多多名湖相比，但是白鹅在兹，却又使一切改观。从白鹅身上，人们看到了美丽、优游、安稳、认真而原始。这些特色，岂不正是古今哲人所向往的境界？这种境界的动物，长守湖边，恰为中兴生出无穷颜色。你以为白鹅何知，但白鹅又何须有知？白鹅本身与宇宙合为一体，合得比“天人合一”还来得斧凿无痕，...
004.我最难忘的一套条例.txt	8	15	15	382	5	国民党文工会头子同一天宣布：“为配合动员戡乱时期的终止，党政部门对不合时宜的法规均在全盘积极检讨之中，《惩治叛乱条例》的废止亦为检讨法规的其中一项，且早已展开有关废止的作业，并非因‘独台会’一案件及受外界压力而让步。”我看了，笑了，淡淡的笑了。任何人都相信他在说阿Q式的谎，我却笑着相信他说的，又何尝不真？这条例，的确已因“不合时宜”而变得大而无当了。——国民...
004.我最难忘的一套条例.txt	10	19	19	208	3	天真的人又赞美废止这条例得力于教授与学生的抗争，其实，教授是作秀的、学生是娇嫩的，看看过去五四的中国大学生、看看眼前五四的朝鲜大学生，就知道人家是玩真的，台湾大学生玩的却是家家酒。坐在校园里、坐在车站里，一切功夫，只是坐而已。学生运动要靠坐功，这是《肉蒲团》的和尚功夫、这是“坐坛子”的妓女功夫，不是大丈夫干的事。但是，这些小表哥小表妹既然出来了，还是该肯定他...
004.我最难忘的一套条例.txt	16	31	31	83	3	作为水来火去的人，我高兴我走到现在、走过从前。这条例像是一条枷锁，但是，最后赢的，是他死我活。没有了蒋家王朝，枷锁已是不真。“真空”“真人”又笑了，他笑他们都是假的。
005.我最难忘的一个组织.txt	4	7	7	632	3	为这个组织播种的人，是英国的彼得·班纳森（Peter Benenson）。彼得·班纳森是一位人权律师、犹太裔的天主教徒，夙有“梦想家”和“圣人”之称。1961年，他目睹一群葡萄牙学生歌颂自由被捕，判七年徒刑，他深受感动，这一次他不再沉默，兴起呼吁全世界都来关切政治犯的念头，如同当年美国释放黑奴、苏俄释放农奴的运动一样。于是他跟好友马丁·恩纳尔斯（Martin...
005.我最难忘的一个组织.txt	11	21	21	113	3	马丁骄傲地说：“施暴者再也不能虐待良心犯，而自以为牢墙外的世人不会晓得他们的罪行。”至于AI近期内的工作目标，马丁表示，他希望印度能让该组织调查旁遮普省及克什米尔的人权情况，也希望血腥镇压天安门民主运动的中共能和AI展开对话。
005.我最难忘的一个组织.txt	12	23	23	360	6	路透社这一报导，引起我一点回忆。在我第一次政治犯坐牢前，先被国民党情治人员“跟监”十四个月。在被“跟监”的日子里，马丁到了台湾。魏胖（魏廷朝）、老谢（谢聪敏）到我家，约我一起去看马丁。我说我李敖架子很大，对洋鬼子尤其大，马丁如果真来帮助我们，就请他到我家来看我吧，我不会去看他的。听了我的话，魏胖、老谢都认为有理，就转告马丁。马丁倒有服善之勇，他同意到我家来，...
005.我最难忘的一个组织.txt	13	25	25	134	3	马丁到台湾，国民党对他又恨又怕，于是派三个人跟踪他。那时跟踪我的是三个人，跟踪魏胖、老谢的各两人。马丁他们上楼后，大家自四楼窗前朝下望，只见下面各路跟踪人马大集合，有趣之至！我指给他们说：“你们看，我家对门变成警察局了！”大家俯视一笑，深感国民党治安良好，真名不虚传。
005.我最难忘的一个组织.txt	14	27	27	102	3	就在这次“行客拜坐客”里，我把一些被“跟监”的照片和孟绝子交给我的泰源监狱名单，交给了马丁。我没交代他怎么处理，他也没说怎么处理。一切都好象心照不宣似的。后来名单登在海外的《台湾青年》上，不久我就被捕了。
006.我最难忘的一家书店.txt	5	9	9	415	3	不过，这股朝气还没感染了多久，国民党伪政府就撤退到台湾来。这个伪政府既跟大陆断掉了锁链，在它狭窄的视野下，凡是大陆书店在台湾的分店，都要被迫剪断了连锁。商务印书馆改名叫“台湾商务印书馆”、中华书局改名叫“台湾中华书局”，开明书店也未能幸免，它改名叫“台湾开明书店”。比别人更惨的是，由于它是左派书店，它的出版品，大量的被查禁了。纵使内容不涉及政治的书，也因作者...
006.我最难忘的一家书店.txt	8	15	15	197	4	这几年来，因为意兴阑珊，没有再去开明书店。去年的一天，我忽然心血来潮，要去看看它了。我到了中山北路、到了一段77号，却连那家极不景气的店面都找不到了。门牌一段77号的，却分明是一家气派堂皇的“马可孛罗面包公司”，营业项目包括“西点面包／葡萄美酒／香醇咖啡／西式冷食自助餐”等，全然一片口腹之欲，没有丝毫精神食粮。我呆了。开明书店呢？开明书店哪里去了？难道连那么...
006.我最难忘的一家书店.txt	9	17	17	480	7	我不死心，向面包店的柜台小姐打听打听。小姐头都没抬，把手向上一指，又向后一指，声音平直的说：“搬到三楼去了！它没有门，你就从后面上楼梯。”我顿觉起死回生，谢谢她，遵命做了。走到后面，满屋满地都是面包工厂狼藉，满楼梯也是。我左闪右躲、九转十绕，总算上了三楼。迎面的是一间小房，左边有一点铁柜式书架，右边就是四张办公桌。要找的书，寥寥可数，就在书架上。办事的是一位...
007.我最难忘的一个官僚同学.txt	5	9	9	325	5	施启扬小时候长得就高高的，人颇斯文，但斯文得近乎讨厌，不知什么缘故，惹毛了外省同学陈士宽等人，结果被揍了一顿。那时我跟他不熟，直到进了高中，同分在高一上甲班，座位比邻，才熟起来。他请我去他家玩，也来我家。他为人少年老成，像个小大人，脾气虽好，但也喜欢争辩。我那时知识成长已经极为快速，在班上喜放厥词，颇为张狂。当时班上同学很吃我不消，王文振甚至写匿名信丢在我书...
007.我最难忘的一个官僚同学.txt	9	17	17	288	5	在我在家养气的时候，一天施启扬跑来找我，他央我向王孟仁讲人情。王孟仁是我父亲老友，北京师范大学化学系毕业，为人鹰隼精明，讲了一口好日本话，也在一中教书，他最不喜施启扬，不晓得什么事，施启扬开罪了他，求我去说人情。王老师住在一中宿舍，日式房子，讨了台湾寡妇。他又深沉又喜欢写打油诗，与许文葵老师互骂，人颇有趣，我偶尔登门同他聊天。这次为了施启扬，乃亲去王府。不料...
007.我最难忘的一个官僚同学.txt	11	21	21	555	4	我的好朋友孟大中在物理系，他的父亲孟昭常和他母亲早在印度离婚，离婚后他和弟弟孟大强都随父亲到台湾读书，母亲仍在印度。有一次聊天，我忽然想起，如果离婚时，离婚证书上兄弟跟了母亲，那么兄弟两人即可视同侨生，不必当国民党的鬼兵了。孟大中听了，为之心动，希望我帮他假造一张离婚证书。我说可以，可是其中法律问题得找施启扬。于是找到施启扬，告以原委，遂由施启扬起草，捏造了...
007.我最难忘的一个官僚同学.txt	27	53	53	282	3	1958年8月2日，我大学毕业返回台中，有日记如下：“四时十分与弘、祝公、庭生、鼓应、克斌同车赴车站，华俊与又亮已先赴车站办好行李。至车站时，已人群一片，今日送行者：1周弘；2景新汉；3马宏祥；4白绍康；5华昌平；6李华俊；7陈又亮；8陈鼓应；9祝庭生；10张克斌；11袁祝泰；12朱广诚；13黄锡昌；14施启扬；15佟耀勋；16阙至正；17孙英善；18林淑美...
007.我最难忘的一个官僚同学.txt	37	73	73	203	3	前日往第九宿舍，访萧先生未果，因第九宿舍并无萧先生之名（宿籍），想萧先生是住他人床位吧！归途在校总区见到王文振，他是梁仰芝先生最得意的学生，但现在学的却是化学。他领我参观他的研究室，仪器书籍满室，使我惭愧不堪，您知道高一我数学在“戊组”，而且经常在及格边缘，高二、高三时对理化等更无兴趣，在那段日子学理科的课真是受罪，您是高三的逃兵，并未吃过苦头，我现在看了理...
007.我最难忘的一个官僚同学.txt	46	91	91	237	3	这信中所说玩牌的事，是施启扬一大特色，施启扬在1958年毕业于台大法律系法学组，并以第一名考入台大法律研究所，同年10月又考上高考状元。论者以为施启扬一定非常用功，其实不然。事实上，他是一个考试匠。他所知不多，但有本领在考场一小时内，用他清楚端秀的写字，把所知发挥得淋漓尽致。因此在“考工记”上，占了大便宜。他平时在宿舍不是最用功的，玩牌时间很多。他的天资也不...
007.我最难忘的一个官僚同学.txt	58	115	115	268	3	1984年5月22日《政治家》周刊第十五期登说：“早在台大念书的时候，施启扬即相当活跃，他和丘宏达、陈继盛、陈隆志等人，被认为是法律系最杰出的学生。在《大学杂志》全盛时期，他和陈少廷、关中、陈鼓应、丘宏达、李钟桂、许信良、张俊宏等人，都是国内一时的菁英，为文批评时政，广受瞩目。他也曾在《文星》杂志帮过一些忙。”说到施启扬和《文星》的关系，这是不确实的。施启扬...
007.我最难忘的一个官僚同学.txt	64	127	127	297	4	最近因涉及泄漏国家机密罪被捕之Der Spiegel（《镜报》杂志）发行人及编辑等已有公开审判之消息。Der Spiegel系德国的《自由中国》，专摘发政府劣行，发行遍全国及国外，去年10月间因再攻击国防部长Strauss，被指为泄漏国家机密，由司法部羁押在监，结果Adenauer内阁几因之垮台（全国大学、学术机关、学生团体均举行示威，我也跑去凑热闹），结果...
007.我最难忘的一个官僚同学.txt	67	133	133	211	4	施启扬的文章，我把它登在1963年2月的《文星》第六十四期，全文六千五百字，稿费三百二十五元。这封信中提到德国学生为争言论自由举行示威，他“也跑去凑热闹”之事，可以看出施启扬的热情一面。在他留学期间，1964年，台北发生了彭明敏、谢聪敏、魏廷朝被捕案。这案当事人是他的老师和同班同学，听说他曾写信回来向台湾当局抗议。这一抗议，害得他在1967年回台后，被当局冷...
007.我最难忘的一个官僚同学.txt	73	145	145	210	3	根据我旧日记，收信后半个月，11月6日，我跟施启扬见了面，五年阔别，相谈甚欢，中午连家立请于李园，有空中小姐王芳华、施启扬在座。十八天后，11月24日，汪中磊请于美而廉，施启扬、张、陈二小姐在座。12月3日，施启扬请我于李园，陈正澄、陈小姐、施敏雄夫妇、小蕾在座。十一天后，12月14日，与施启扬去中德文化协会看材料，请他于美而廉。……这段时间，是我和施启扬交...
007.我最难忘的一个官僚同学.txt	81	161	161	225	3	到了第二年，1968年，他跟国民党当局的情况开始变化，他做了国际关系研究所副研究员，兼任国民党中央设计考核委员会委员。这年5月13日，他打电话告诉我，说看到4月23日的香港《大公报》，有张其义写的专栏文字，标题是《台湾的“文星集团”事件》，可看出中共方面如何看文星被封，请我注意。这时他日渐“归正”，我则因《文星》已垮，处境日恶。这年10月28日，他和李钟桂在...
007.我最难忘的一个官僚同学.txt	82	163	163	290	3	施启扬结婚后，夫妻两人，相激相荡，求仕之心越浓，物欲也越强。有一次我卖了一套《古今图书集成》给国际关系研究所，他居然从中要了我的红包！那是1969年1月26日，红包是当时价值新台币两千八百元的《社会科学国际百科全书》（The International Encyclopedia of the Social Sciences），虹桥书店翻印的，原版要当时美金五...
007.我最难忘的一个官僚同学.txt	89	177	177	183	6	为了使他安心，我机警的当场照他的译稿抄了一份，不带他的笔迹出门。不料到了门口，他忽然冒出了一句话，他说：“李敖兄啊，也该为政府留点余地啊！”我听了，大吃一惊。我所认识的施启扬怎么说出这种话！我心里想，这位老兄大概跟国民党搭线搭得有眉目了。我很不高兴，义形于色，说：“启扬啊，这样的政府，它给我这种人留了什么余地呢？”从此以后，我就没再见过施启扬了，如今转眼二十...
007.我最难忘的一个官僚同学.txt	96	191	191	192	3	弗罗斯特（Robert Frost）说他选了更少人走的路，所以结果就大不相同。（Two roads diverged in a wood, and I/I took the one less traveled by, /And that has made all the difference.）二十年前同聚一堂的老同学，如今竟“幽明异路”（这四个字没用错）如...
007.我最难忘的一个官僚同学.txt	100	199	199	287	6	这封信写后三个半月，1971年3月19日，我就被捕了，这是我第一次政治犯入狱，前后坐了五年八个月的牢，在坐牢最后一年时，被送到土城“仁爱教育实验所”，开始被“实验”，也就是“洗脑”。为了优待也为了隔离，国民党把我和谢聪敏、魏廷朝、李政一四人开了专班。前后请来的国民党来“上课”的，有陶涤亚、毛树清、项乃光、周道济、王洸、屠炳春、林钟雄、任卓宣、柴松林等等，其中...
007.我最难忘的一个官僚同学.txt	102	203	203	110	4	1981年8月10日，我第二次政治犯入狱半年，这案子表面上是萧孟能告我，骨子里却是王昇等政治力量介入整我（此案几年后已平反，萧孟能已因诬告被法院判刑，现正通缉中）。在入狱前六天，8月4日，我写了一封信给施启扬，内容如下：
007.我最难忘的一个官僚同学.txt	105	209	209	234	4	关于我又遭到冤狱的情况，我有《给黄少谷先生的一封公开信》发表，这里不详谈了，我要谈的是：在我这六个月的刑期中，你所掌管的监狱，究竟是以什么样的方式对待我？监狱内部的情况，为你所深知，为我所略知，你是我三十二年的老同学，你我立场不同，但是交情应在，我以项羽最后“吾为若德”对老朋友马童的心情对你，告诉你：——我不愿在你任内写公开信给你，或写《台湾古拉格群岛》（t...
007.我最难忘的一个官僚同学.txt	109	217	217	914	6	施启扬收信后，打电话给刘会云，详谈他跟我的多年交情，表示在他的权责范围内，一定对我照顾，请她转告我，事实上，他为了避嫌，我看不出他对我有何照顾，就一如魏廷朝后来坐牢，施启扬在立法院公开宣扬他同魏廷朝的交情，但实际上却对魏廷朝没有任何照顾一样。1981年11月23日早上，我在土城看守所篮球场运动的时候，狱吏跑来，说：“所长紧急通知，法务部次长到所里来了，想见见...
007.我最难忘的一个官僚同学.txt	111	221	221	202	3	施启扬的升任部长，基本原因，是他深知为官之道，为人全无锋芒与野心，又具有“崔苔菁”（吹牛，台湾人、青年人）的条件，且是外省人的女婿、德国的博士，自是国民党提拔的最佳样板。事实上。他的本质是十足的官僚，胆小怕事，但求做官，其他推托。他在法务部长任内，我写过几封信指责司法与狱政黑暗，不但寄给他，并且一一公开发表。他除了请老同学程国强回我一次电话外，一直龟缩不理。...
007.我最难忘的一个官僚同学.txt	114	227	227	253	3	我这篇文章是应周清玉主持的“监牢暴行与监狱人权”座谈会而作，因我概不参加任何集会，故以书面代之。在我文章后面有座谈会摘要，中有刘峰松的谈话，刘峰松说：（中略）启扬老兄，你看了上面刘峰松这些谈话，你到底做何感想？如果是做官，当然你可以一切视而不见、一切掩耳盗铃、一切说我们是“幻想”；但是，如果是做人，做有良知有血性的知识分子，你恐怕就无法这样拖下去，你怎能把所...
007.我最难忘的一个官僚同学.txt	119	237	237	141	5	多年以前，有一次施启扬跟我聊天，谈到老学弟朱石炎。他说：“朱石炎是司法界一个很正直的人，是不肯同流合污的，但是如果你把为了国家等大帽子来说动他，他也会糊里糊涂一起做同流合污的事。”如今施启扬变了，但他的本质又不是什么坏人，难道这种变化，是被国民党套上为了国家等大帽子吗？我但愿如此。
007.我最难忘的一个官僚同学.txt	120	239	239	134	3	杜甫《秋兴八首》有句是：“同学少年多不贱，五陵裘马自轻肥。”施启扬与我同岁，出生晚我十天，同学少年，而今“自贱”如此，想来不无怅惘，台湾是小地方，施启扬卖身投靠国民党，“五陵裘马”亦不可得，至多只是讨个姨太太终老而已，何苦来啊！这是“自轻肥”吗？非也！“人焉瘦哉”耳！
007.我最难忘的一个官僚同学.txt	128	255	255	140	3	四十三年，胡先生第二次返国。三月二十六日国立台湾大学暨中央研究院历史语言研究所为纪念傅斯年先生冥诞，特在台大法学院举行纪念会，请胡先生讲演。胡先生的讲题为：“美国大学教育的革新者——吉尔曼”。胡先生推崇吉尔曼（O. C. Gilman 1831-1908）对大学教育之贡献，认为：
007.我最难忘的一个官僚同学.txt	132	263	263	179	3	宪法第十一条规定：“人民有言论、讲学、著作及出版之自由。”但事实上形同具文，学生出版之刊物、稿件须经学校训导机构严密审查，认为“言论正确”而后始得出版。其审查标准全以骑在学校上面的政治团体所颁的条令为依据；此外，再夹杂审查人员之好恶，甚至个人主观成见。经此审查手续后准予刊行之文章，当然非歌功颂德，即是反共八股，此类文章乏人问津，徒然枉费学生精力与纸张而已。
007.我最难忘的一个官僚同学.txt	133	265	265	351	5	前年台大思潮社撰写《隔江犹唱后庭花》一文，以批评当时所谓“服装义演”的问题。此文由该社八位社员联合执笔，慎重斟酌，结果审查人员以“失去时效”及“避免刺激国际友人感情”为理由不予同意。后虽经训导长审阅修改，然后签名盖章准予刊载，但审查人员仍不同意，径自印刷厂取回稿件，致使该刊激于义愤，自动停刊。在停刊词中表示：“为维持本刊独立风格的完整，为维护本社法人地位应有...
007.我最难忘的一个官僚同学.txt	134	267	267	271	3	由于缺乏充分的言论、著作及出版之自由，由于不能畅所欲言，大学生主持出版之刊物，已仅有其形式而无其实质，死气沉沉，青年激昂慷慨之气、热烈爱国之心，殆已销声匿迹。学生出版之刊物若充展览装饰，则琳琅满目，种类繁多，尚可淆乱外人视听：若言做为传达知识的工具，则实言之无物、阅之无味。诸此现象上自《大学杂志》、《台大新闻》、《敦励》、《新思潮》、《台大商学》……，下至各...
007.我最难忘的一个官僚同学.txt	136	271	271	103	3	自教授教学情绪言之：因教授无充分“免于恐惧之自由”，不轻易言其所见、述其所思，偶或论及世局国事，言至自由民主、学术独立处，无不再三叮嘱勿为外人道。足见虽身为大学教授，仍缺乏充分正当而合法之言论、讲学的自由。
007.我最难忘的一个官僚同学.txt	137	273	273	285	3	美国大学联合会曾谓：“用命令方法使大学教授之思想整齐划一，不啻闭塞知识之源。审查教授个人之思想将堵截知识之路。”（"To enjoin uniformity of outlook upon a university faculty would put a stop to learning at the source. To censor individual...
007.我最难忘的一个官僚同学.txt	138	275	275	122	3	设无充分“免于恐惧之自由”，教授学生势将无法维持充分之思想、教学与研究之自由；追求知识、探讨真理的热忱与勇气亦将消失；学术文化亦将枯萎，无法发扬光大。有一位西方哲人尝云：“当国家企图将国民铸成同种格式时，文化即已停滞矣！”此言值得我们警惕反省。
007.我最难忘的一个官僚同学.txt	139	277	277	472	4	我们所期望者是“学术独立”与“追求知识之自由”（三月十一日《青年战士报》社论《论政治与教育》一文，认为教育独立就是教育孤立，应纠正教育独立思想，甚至认为这种主张与胜利前后共匪及其尾巴党所提出之主张不谋而合），我们不愿见学校以强迫方式令学生研究某种主义（这在民主国家是不争自明之理，当然我们赞同以鼓励奖助之方式，使学生自由自动研究），我们更不愿见教育当局藉权威、...
