file	paragraph	line_start	line_end	char_count	score	snippet
016.我最难忘的一个国特.txt	97	193	193	145	3	乔家才将军出狱后，前后写了两百多万字的书，包括《关山烟尘记》、《铁血精忠传》、《戴笠和他的同志》、《海隅丛谈》、《为历史作证》等书，对他传奇的身世与交游，做了不少透露。可是，唯独这九年的黑狱内幕，却写而不印、不愿发表。理由是：“怕落到敌人手里，用做攻击我政府不民主的具体例证，则罪过大矣！”
016.我最难忘的一个国特.txt	98	195	195	290	4	古诗说：“落红不是无情物，化作春泥更护花”，乔家才将军宁愿自己委屈，也不要家丑外扬的心态，是可以理解的。但我总觉得，“化作春泥”的精神固好，不过也要看所护何花，如果所护不是自由之花而是“大毒草”，则委屈自己，也未免太不值得。去年乔家才将军写信给我说：“我在牢里想，不会活着出牢，这样不明不白死在牢里，实不甘心，决定把八年抗战的所作所为，撰写成《关山烟尘记》，死...
016.我最难忘的一个国特.txt	99	197	197	147	4	看了《乔家才入狱记》，我们才感到这一冤狱，真正的制片不是毛人凤，而是毛人凤背后的蒋介石。蒋介石以九字御批“乔家才无期徒刑可也！”定此现代风波亭，其草菅人命、其蹂躏人权、其无情无义于自己学生同志功臣，草草九字，已跃然纸上。读《乔家才入狱记》，只有把握住这一脉络，才能体会到这四万八千字的真正血泪。
016.我最难忘的一个国特.txt	100	199	199	156	4	《乔家才入狱记》毕竟“落到敌人手里”，如今给发表出来，也算一段佳话。我相信发表的结果，绝非“罪过大矣”，反倒“善莫大焉”。——鉴往而知来、温故而知新、发黑暗而曝光明，都是这一发表带给我们的新意义，乔家才将军字字看来皆是血，九年辛苦不寻常，留给人间这样不寻常的文献证据，真令我们有“正义在兹”之感，我们真要佩服他。
016.我最难忘的一个国特.txt	105	209	209	163	5	入狱记撰好，不打算公开发表，怕落到敌人手里，用做攻击我政府不民主的具体例证，则罪过大矣！后来看到刘仲康著作：“保密局长毛人凤先生，三十七年7月间，从北平到济南。此行任务，是处理北平市政府民政局长、也是军统局开山的老同志马汉三背离团体的案子。马被扣，奉当局核准判处死刑。同案几位与马有相同历史，又同一政治企图的人，都分别处刑。”
016.我最难忘的一个国特.txt	106	211	211	80	3	又叙述毛人凤先生所说的话：“讵料戴先生尸骨未寒，竟有若干年的老同志企图背叛团体，离开领袖领导的革命大道。为整饬纪律，不得不忍痛制裁，非主谋分子，一概不咎云云。”
016.我最难忘的一个国特.txt	117	233	233	284	3	回忆1926年夏天，决心从事国民革命，从太原跑到广东，投入黄埔，本来就没有打算活着回家。想不到北伐迅速成功，不到三年，统一全国。而日本军阀又发动九一八事变，二十一年参加戴雨农先生领导的工作，生活在惊涛骇浪中。二十四年在太原被山西宪兵逮捕，钉上脚镣，关了九天，家也被抄了，幸而没有抄到甚么证据，几乎丧命。二十八年10月24日，北平的家又被日本宪兵队抄了，我妻郭同...
016.我最难忘的一个国特.txt	120	239	239	153	3	谁也不愿意做惨痛的回忆，谁也不愿意做无益的叙述，但是为使沦陷在大陆的子女，或者他们的子孙，将来遇有机会可以了解我的这一段悲惨经过，需要写出来。好些朋友同情我，为我抱不平，知道我冤枉，但冤到甚么程度，却少有人知道，也应把真实经过，前因后果告诉他们。最后为表明我对得起国家，也没有辱及祖宗父母，因撰《入狱记》。
016.我最难忘的一个国特.txt	123	245	245	136	3	潘其武和毛人凤的关系不同凡俗，可从刘培初兄所著《浮生掠影集》62页看出来。刘培初兄说：“二十九年春，潘其武兄发起处长以上的人签名，向戴先生保他（毛人凤）为局本部书记长（主任秘书之误），那时我任督察室主任之职，但我并未签名。我说用人是戴先生的权力，向他保荐，本局向无此例。”
016.我最难忘的一个国特.txt	124	247	247	226	3	刘培初兄不但得罪了潘其武，更得罪了毛人凤先生。刘培初虽没有签名，而毛人凤先生终于做了主任秘书，他为酬谢潘其武拥戴之功，签报他为副主任秘书，戴先生也批准了。那时安徽刘启瑞先生已任秘书多年，对他们一拥一签，很不服气。他是北京大学毕业，无论学历、经历，都比他们两人强些。当我继刘培初兄为督察室主任时，他大发牢骚，对我说：“潘其武从缅甸带回假宝石，让毛太太卖出去。买的...
016.我最难忘的一个国特.txt	127	253	253	87	3	潘其武是中美合作所的主任秘书，不论从业务上讲，还是礼貌上讲，对于一位从外面回来的训练班副主任，总应该详细谈谈。可是第二天毛人凤先生告诉我：“潘先生说没有甚么事，不必见面了。”
016.我最难忘的一个国特.txt	139	277	277	111	4	“家才！你看！你的脾气还是这样不好。你在陕坝，同傅宜生没有搞好，同美国人也没有搞好。”戴先生最后一次来北平，第一次午餐汇报，吃完午饭，不谈工作，先来数说我。这一次，他是从重庆来，很显然，潘其武打了我的小报告，说了我的坏话。
016.我最难忘的一个国特.txt	144	287	287	82	3	“潘其武是官僚，戴先生不相信，问问大家。”我一面说，一面用手指着在座的同志，那天参加午餐汇报的，有二十六七人。戴先生并没有问大家，因为他知道我说话负责，不会说假话。
016.我最难忘的一个国特.txt	146	291	291	97	3	“请问戴先生！”我紧接着说：“一个人是不是可以不睡觉？如果一个人不能不睡觉，那么他夜里不睡觉，就得白天来睡。戴先生认为半夜三更给你写一个报告，就是工作努力，我还可以夜里四点钟给戴先生写报告呢！”
016.我最难忘的一个国特.txt	153	305	305	122	3	二十八年我在兰州，春天戴先生来了，只带了一位副官，所有电报必须在兰州的同志们翻译，王孔安兄主持其事，我专译戴先生的亲译电报。有一份介民先生给戴先生的亲译电报，报告领袖召见的经过。领袖告诉他汪精卫和敌人勾结情形，要他去越南，进行阻止。电报最后说：
016.我最难忘的一个国特.txt	159	317	317	85	3	第二件事情：戴先生殉职不到一个月，徐为彬兄来到北平，汉三兄要我问问他，是不是负有什么任务。我请为彬兄在中山公园古柏树下吃茶，只有我们两个人，没有第三者。下面是我们的谈话：
016.我最难忘的一个国特.txt	165	329	329	64	3	我最后一次去南京，毛局长把我当做亲信，对我说：“郑介民岂有此理，他想出卖团体，向领袖建议，把交警改编为一个军，由吉章简任军长。”
016.我最难忘的一个国特.txt	166	331	331	157	3	交警总局有交警十八个总队，每一个总队的兵力超过一个团，火力超过一个师。一个军顶多辖三个师，吉章简为什么不干十八个总队的总局长，而要干一个军长呢？介民先生又为什么做这种建议呢？在情理上，都不会有这种荒谬的事情。我说：“毛先生！你比戴先生如何？以戴先生那样了不起，都离不开介民先生，而要用他，你为什么就不能容忍他呢？”
016.我最难忘的一个国特.txt	168	335	335	200	4	后来我才知道，凡是顺从着毛局长骂郑介民的，他就认定是亲信，否则，就认定是“郑派”了。周伟龙想干交警局长，毛人凤又想把吉章简赶走，于是，周伟龙跟着毛人凤大骂郑介民，就成了毛局长的亲信，和潘其武三个人跑到戴先生灵前，磕了头，拜为把兄弟。不久，吉章简被打倒，周伟龙做了交警总局长。周伟龙眼里哪里瞧得起毛人凤，做了局长就不买帐了。结果，周伟龙还是被他的把兄弟宰了。死的...
016.我最难忘的一个国特.txt	175	349	349	101	5	副总统选举结果，李宗仁当选了，领袖非常生气，这真是国家的大不幸，不到一年，大陆就断送在李宗仁的手里。据说，选举完毕，领袖曾召见陈立夫先生，责备他说：“你身负组织责任，对选举票都控制不了，还不如毛人凤。”
016.我最难忘的一个国特.txt	179	357	357	230	5	二十八年夏天，我回华北视察工作，经周世光兄介绍，我才认识了他。世光告诉我：“李广和以军事特派员来北平联络游击武力，实际上连个鬼都联络不上。他向戴先生乱吹牛，结果一筹莫展，无法交代。不过他很胆大，所以要他做北平区的行动组组长。”无论如何，一个人敢在敌区工作，总是值得赞佩的，我对李广和也不例外。9月间，天津失事，区长曾澈被捕，北平的环境也非常险恶，我一再阻止周世...
016.我最难忘的一个国特.txt	180	359	359	104	3	实际上，周世光和李广和瞒着我，正在进行他们的计划，一定要开枪，结果出了纰漏。二十八年12月24日周世光、李广和及其他同志多人被日本宪兵队捉去，牵连到西什库的天主教堂和辅仁大学，很多天主教的神父和教友因而被捕。
016.我最难忘的一个国特.txt	181	361	361	219	7	日本军阀的侵略战争，整整打了两年，他们已经深深地了解，愈打愈没有办法。汪兆铭的傀儡组织虽然成立，对于结束战争，丝毫不起作用。真要进行和平，必须以重庆为对手才有效。李广和被捕后，自称是中将军事特派员，一个中将在日本人眼中分量很大，认定是一块可以利用的好材料。于是，把他释放，要他回重庆进行和平运动。日本人说：“我们不要再打了，共产党才是我们的真正敌人，日华合作，...
016.我最难忘的一个国特.txt	182	363	363	263	5	李广和是一个不知轻重深浅的人，知识简陋，深信日本军阀的说法，真的以和平使者的姿态，二十九年（1940）夏天回到重庆。不过他不但见不到委员长和戴先生，连军统局的重要干部也接不上头，无法传达日本军阀的和平愿望。我听说他回来，去中央饭店看他，他满腹牢骚，大谈和平。我知道他已入魔，中了日本人的毒，警告他说：“你不要胡说八道，相信日本人的鬼话。他们打不下去，才想和平。...
016.我最难忘的一个国特.txt	189	377	377	127	3	“李先生！”我看过以后，对李德和说：“我劝你把这本东西收藏起来，留给子孙们看吧！不要再给人家看。令弟是华北督导团的主任、山西主任赈灾委员，是政府的官员，私自去和敌人、伪组织接头，那是通敌，杀头也不冤枉。你的这本自白书是自己宣布自己的罪状，还让人家看吗？”
016.我最难忘的一个国特.txt	191	381	381	82	3	“现在戴先生搞中美合作，常常举行舞会。”我怕刘秋芳再来胡缠，对王啸云兄说：“刘秋芳原来是个舞女，到重庆会派上用场。我看这样吧！你装做不知道，我把她悄悄送走，如何？”
016.我最难忘的一个国特.txt	198	395	395	150	3	“我的想法，和毛先生的想法不同。我有两点浅见，提供毛先生参考。第一，毛先生是大学教授，多么清高，和李广和那种人胡缠，实在豁不来。第二，戴颂仪先生是毛先生的好朋友，应当考虑，他是不是毛局长的对手，万一因为房子问题，使他吃了亏，毛先生过意得去吗？至于，毛先生搬走不搬走，我没有意见，很对不起，打搅你了。”
016.我最难忘的一个国特.txt	199	397	397	76	3	我们谈话不到十分钟，我就告辞出来。想不到，第二天，毛教授来什锦花园看我，他说：“昨天晚上我想了一夜，你说的话很对，我决定明天就搬走，特意来告诉你一声。”
016.我最难忘的一个国特.txt	202	403	403	144	4	不提名就不能竞选，否则就是违纪。刘秋芳神通广大，她要做国民党，就是为了提名，你中央不提我的名，反而妨碍我竞选，我就不做你的国民党。于是她说：“加入国民党的刘秋芳，是山西襄垣县的刘秋芳。现在在北平竞选立委的刘秋芳籍隶北平市，是以社会贤达的姿态，参加竞选，这样一来，那就不违纪了，岂不妙哉？”
016.我最难忘的一个国特.txt	211	421	421	143	4	“家才兄！你来的正好，你不来，我也要找你谈谈。”不等我开口，汉三兄就对我说：“事情经过是这样的，北平市选立委，投票三天，头一天，刘秋芳的票子投进八千张，而党提名的王霭芬还不到一千张，市党部主任委员吴铸人非常着急，去找市长何思源，大闹特闹。当天晚上，何市长召集各区区长、警察局分局长训话：
016.我最难忘的一个国特.txt	212	423	423	147	3	“‘王霭芬是总裁提名的，和我何思源毫无关系。’何市长说：‘既是总裁提名，就应该服从党的决定，全力支持。现在跑出一个刘秋芳，今天就投进八千张票子，王霭芬还不到一千张。这不是和我何思源过不去，是同总裁过不去。现在告诉你们，不论哪一区，明天只要发现一张刘秋芳的票子，我就立刻撤你区长和分局长的职。’”
016.我最难忘的一个国特.txt	213	425	425	143	3	“第二天清早，李宗仁、陈继承、何思源、徐焕东、吴铸人等许多党政军要人在飞机场送某要人，何市长手里拿着一张选票，一边摇晃、一边嚷着说：“我这个市长干不成了，北平市选举立法委员，都被保密局包办了。五个立法委员，他们就有刘秋芳、唐嗣尧两个人来竞选，而且都不是中央提名的，教我这个市长怎么办？”
016.我最难忘的一个国特.txt	216	431	431	131	3	我了解了实际情形，返回寓所，向李广和与刘秋芳解释。我说：“我们也得替马汉三想一想，中央提名的人选不出来，何思源和吴铸人不答应，中央也不答应。何市长既然宣布不准各区再投我们的票子，民政局长一定要投，你们想一想，各区长、各分局长该怎么办？因此区长被撤职，怎么得了。”
016.我最难忘的一个国特.txt	222	443	443	102	3	“这些人革命，是凭本领干的，不是依靠甚么臭东西。”我劝说了一个多钟头，而李广和夫妇居然要毛局长干掉马汉三，一把无明火高升三丈，我说：“毛先生要不要这些人在他，我们干不干在我们，你们教毛先生干吧！给我滚！”
016.我最难忘的一个国特.txt	227	453	453	123	4	“华北剿匪总部成立以后，情况不同过去，我们必须配合傅总司令的作风。”马司令寒暄几句以后，从衣袋里掏出一封给毛局长的信，递给我，突然说道：“我已把军法处长撤换了，稽查处长也得换人，希望毛局长派一位能够配合剿总作风的人，这是给毛局长的信，希代转交。”
016.我最难忘的一个国特.txt	234	467	467	60	3	“听说李广和的老婆跟你们毛先生有一手？”有一天因事到西郊剿匪总部，那里的熟人很多，有位少将把我拉到一边，很神秘地对我说。
016.我最难忘的一个国特.txt	245	489	489	135	3	“觉民！”我说：“我们相交，已经十年，难道没有一点革命勇气吗？何必这样小心？告诉你！如果毛先生如此之糊涂，而我们的贤明领袖又把如此之重要的任务，交给如此之糊涂的人，国家都会亡掉，个人生死，算个什么。国家的情况演变到现在这样地步，我们能再沉默吗？发出去吧！不必计较后果。”
016.我最难忘的一个国特.txt	265	529	529	220	3	“我这个人不会客套，”刘瑶章让坐以后，对我说：“昨天傅先生找我去谈话，现在我把傅先生所说的话，一字不漏的告诉你，傅先生说：‘新的北平市政府需要一位好的警察局长，我给你介绍一个人，保密局北平负责人乔家才。你不要误会，虽然他和我是同乡，并不是我的人。他在绥远和我作对，骂我、反对我。不过这个人廉洁，肯吃苦，有办法，敢作敢为。现在北平市，正需要这种人才，你去和他接头...
016.我最难忘的一个国特.txt	268	535	535	171	3	“报告总司令！”警政总署由唐乃建先生负责，再由傅总司令推荐，我任北平市警察局长，绝对不会有问题。问题是北平市已经非常危险，我不愿意干。我说：“汤局长虽然干不下去，可是警察局还有副局长白世维，现在可以由白副局长暂行代理。至于我个人是否胜任，还得请总司令再考虑考虑。我觉得，一个特别市的警察局局长，在未奉到中央命令以前，先行接事，好象不太妥当。”
016.我最难忘的一个国特.txt	269	537	537	199	3	就当时整个国家的形势来讲，抗战胜利冲昏了许多人的头脑，接收变成劫收，贪污腐化，政治风气败坏到极点。马歇尔来华进行和谈，使共产党武力日益坐大，国军的士气，早被编遣下来的军官到中山陵哭陵哭垮了。北平城里异常复杂，难民和学生团体被共产党渗透掌握，危机四伏，这个警察局长绝对不能干。从剿总回到办公室，立刻向毛局长去电，报告傅总司令接见我的经过。说明我干不了这个警察局局...
016.我最难忘的一个国特.txt	276	551	551	91	4	杜亚坪兄从东北回来，我请他在寓所吃晚饭，吃饭前随便聊天，他对东北的情况很悲观，他又说：“干我们这一行工作，不会有好下场，不被敌人杀死，也会被自家人宰割。所以，我打定主意，不再干了。”
016.我最难忘的一个国特.txt	277	553	553	309	3	吃完饭，送亚坪兄回北京饭店，路过灯市口，我先下车，到指定的开会地点。这是毛局长的临时办公处，但是没有通知我，我没有来过，今天是第一次来，冷冷静静，气氛很不对。我进了会客室不到五分钟，汉三兄来了，他今天上午才交卸了民政局局长的职务。他一进门，稽查处督察长佟荣功带着七八个人跟进来，一言不发，如狼似虎地把我们两人五花大绑绑起来。他们敢于这样做，无疑的是奉了毛局长的...
016.我最难忘的一个国特.txt	279	557	557	186	3	这所监牢本由周端甫兄主持，大概因为他是山西人，怕他和我有关系，对我们客气，才让毛惕园来临时主持。我们到了炮局，不到两分钟，毛惕园满面笑容出来迎接我们。我们没有和他说一句话，革命革到如此地步，还有什么话可说？毛惕园命令他的手下，解开捆绑我们的绳子，然后把我们分别送进两间牢房。实践了刘秋芳没有当选立法委员，要毛先生干掉马汉三的宣言。我要主持正义、明辨是非，也遭到...
016.我最难忘的一个国特.txt	280	559	559	139	3	牢房里有一位四十多岁的看守陪伴我，坐牢还要看守来陪伴，绝对不是怕我寂寞，大概是因为我太重要了，可能有两种原因：第一、景震泰率领陕坝班学生组成的交警十三总队，驻防西郊，负责警戒剿匪总部，怕他们来劫牢，救我出去。第二、也许是怕我因气愤而自杀吧？有人日夜盯着，就绝对没有自杀的机会了。
016.我最难忘的一个国特.txt	281	561	561	115	3	半夜，我听到铁器打击声，感觉到很神秘、很奇怪。一会儿，打开牢门，让我出去，在过道里，给我钉上脚镣。我才明白，刚才的声音是给汉三兄钉镣的声音。精神很疲倦，好像朦胧睡着了，又听到钉镣的声音，是不是刘玉珠兄也进来了，他们老早就想收拾他。
016.我最难忘的一个国特.txt	282	563	563	167	4	看守长是北平特警班的学生段建洲，这一夜他进进出出，好象很为我难过似的。第二天周端甫兄来到牢房，相对无语。我自从绑进牢房，已经四大皆空，除了气愤，不再想别的。我看到端甫兄很难过的样子，眼泪在眼眶里打转，他无能为力。他也是过来人，知道坐牢的滋味，他曾任华北督导团的科长，因为李广和私自通敌，跑到敌区，却把他关到西安，无缘无故，坐了半年牢。
016.我最难忘的一个国特.txt	285	569	569	229	7	自从入牢，到写遗书，六天以来，没有吃东西，并不是绝食，而是气愤地吃不下去。陪我住在牢房里的看守，一再劝我，多少吃一点，不吃支持不下去，他哪里知道，我难以下咽。他说曾听司机说过，我家生活艰苦，比不上任何一家，好象对我坐牢，有些不平。我没有同他说什么，懒得开口，说什么也是枉然。晚上送进饭来，既已让我写过遗书，今天晚上大概就要埋葬我了，那么今天的晚餐，可能是最后的...
016.我最难忘的一个国特.txt	288	575	575	156	4	7月9日上午，突然要我收拾东西，似有行动。走出牢房，重见天日，虽是暂时的光明，也是难能可贵的。到达广场。有几部汽车停在那里，汉三兄和刘玉珠兄也出现了，这才知道要上飞机。我们各被装上一辆汽车，我穿着短统袜子，建洲看见，怕脚镣打伤皮肤，赶紧跑回去，拿来一双长统袜子，打开车门，给我套在脚上。这一切都是令人十分感慨的。
016.我最难忘的一个国特.txt	293	585	585	230	3	关我的这间牢房已经关着六个人，只有三张床，一张空着，原来是专为我预备的。一张床是张学良的参谋长鲍文樾占用，久闻其名，虽是初次见面，他确有大将风度。其他的人白天挤在一张床上，夜里打地铺睡觉。难友中有一无锡人，除了身材比戴先生矮一些，面貌和动作像极了，另外一位河南人马兴骏，是一位非常和善的好人。我对别人坐牢的原因，不愿过问，记忆很少，只记得大多数是冤枉的。我同鲍...
016.我最难忘的一个国特.txt	294	587	587	217	5	牢门上有小孔，是走廊上值班的看守不时偷瞧牢房里一切动静用的。看牢的既然可以从外往里瞧，坐牢的自然也会从里往外瞧。因为看牢的占用的时间极少，空着的时间多，所以难友以此为极大的消遣。从里面瞧外面，所见度非常窄狭，但难友们乐此不倦。有时被看守瞧见，会臭骂一顿。坐牢的挨骂，好像是天经地义，骂尽管骂，偷瞧照旧偷瞧。有一天，他们喊我去瞧，得到意外的发现。瞧见楼兆元兄从另...
016.我最难忘的一个国特.txt	295	589	589	141	4	牢房的容量永远不变，但住客出去的少，进来的多，有时多到十一二人，晚上打地铺，比沙丁鱼都要挤。牢房的天地虽小，因住客复杂，可知千奇百怪的事情，无异大千世界。有一天进来一位莫名其妙的人，原来他找人找错门牌，找到这所没有挂招牌，和普通住家户一样的黑监牢。他一敲门，就把他请进来，关着不放。
016.我最难忘的一个国特.txt	299	597	597	145	4	保密局属于国防部，我是陆军少将，就是真的犯了国法，也应当按照军法审判，经过军法会审。我等着法律给我公道，会审的那天来临，我好有个说话讲理的机会。大概是到南京两三星期，看守打开牢房，要我下楼去，原来是军法处长李希成要谈话。所谓谈话，也就是审讯，但不是会审。谈了一个多钟头，李希成问我三大罪状：
016.我最难忘的一个国特.txt	314	627	627	163	3	“不但有两个元宝，还有三百个现洋。”我说：“二十多年前，我父亲带回家中四十二个元宝，三千个现洋，埋在地下，以备不时之用。抗战军兴，家乡沦陷，家人无以为生，取出来瓜分，我们兄弟五人，连我母亲，分成六份，每份七个元宝，五百银元。我应分的一份，我弟弟保存着，托乔凤藻和孙逸贤两位同志各带到北平一个元宝，又带来三百银元，这也犯法吗？”
016.我最难忘的一个国特.txt	319	637	637	170	3	牢房是一排三大间，每间两排木板床铺，至少可以关五十人。我被送进最里面的一间，里面关着十来个人，都已经睡觉了。有一位年轻朋友，看见我进来，赶紧爬起来，接过我的行李，放在他的旁边。原来他是兰训班的同学，他认识我。等我躺下，他悄悄告诉我：“前天看报，有段新闻用墨涂掉，但是对着阳光，仔细辨认，是可以看出来。马汉三先生已被枪毙了，你判了无期徒刑。”
