file	paragraph	line_start	line_end	char_count	score	snippet
007.我最难忘的一个官僚同学.txt	140	279	279	413	3	殷海光先生曾以“什么就是什么？”（What is What ?）为题，在台湾大学讲演。他认为：认识真理应依据科学方法来客观的验证，在传统、世俗、权威、巨棒威胁之下无法发现真理。美国哲学家柯亨（M. R. Cohen）亦谓：“一位先知尽可以说‘上帝是这样说的’，并不需要再有任何的辩白，就可以卸去了他肩上的负担。一位诗人并不需要任何考据，仅用几个富有魔力的字眼，...
007.我最难忘的一个官僚同学.txt	141	281	281	499	3	今日台湾的风云人物已大非当年在大陆时可比了。他们对“逆耳言论”动辄以“红帽子”相加，对于“异党”、“敌党”之主张固不待言，对于己党要员亦然。前时罗家伦先生提倡简体字运动，此运动原甚迫切需要，学生赞同者极众，但四十三年《联合报》上刊载一篇煌煌大文，公开指出罗先生来谴责，说：“查共匪伪政权成立后，主持毁灭中国文字的，设有中国文字改革协会……而以匪首吴玉章为头目。...
007.我最难忘的一个官僚同学.txt	142	283	283	222	3	总统在《民生主义育乐两篇补述》中指示改革大学教育的三原则，其第二原则就是：“大学要讲授，更要研究，要与各机关的研究室取得联系，而构成各种研究的中心。”《中央日报》社论（四十二年十二月十二日）加以赞扬，亦认为“大学对于社会负有责任，大学教育的研究以解决问题发现真理为目的”。大学不但要讲授，更要研究。但要研究，首先应具备的条件就是“大学应有思想、教学与著作及出版...
007.我最难忘的一个官僚同学.txt	145	289	289	380	3	J. K. Bluntochli说：“政党只是部分而非全体（Die partei ist ein Teil eines grosseren Ganzen， niemals dieses canze selbst），……任何政党均不能单独发生，必须有反对党焉，而后才能生存、才能发达。”（见萨著《政治学》四四〇页）。故国民党虽为执政党，但就中国言之，只是部分而非...
007.我最难忘的一个官僚同学.txt	147	293	293	320	3	西哲亚里士多德谓：“人为政治的动物。”此语距今已二千三百余年，今乃二十世纪六〇年代，乃全民政治的时代，国家理应鼓励国民关心政治，共图国事，这正是孙先生在《民权主义》第三讲所说：“聪明才力愈大的人，当尽其能力而服千万人之务，造千万人之福：聪明才力略小的人，当尽其能力以服百十人之务，造百十人之福。”大学生的年龄多在二十岁以上。他们在宪法上（公法上）是公民，有依法...
007.我最难忘的一个官僚同学.txt	148	295	295	409	3	而且我们进而认为欲参与政治、欲服国民之务、造国民之福，不必一定要参加国民党，因国民党只是执政党，只是政党之一，反共复国则是全体国民之事，断非一党一派可包办、可完成的。国家优秀青年、俊杰硕彦可加入国民党；而出类拔萃、忠贞爱国的大学生亦可加入其他政党，从事活动，以监督政府。此在法律上完全平等。加入国民党既非官吏，加入其他合法党派更非叛国。（四十一年八月十八日司法...
007.我最难忘的一个官僚同学.txt	149	297	297	343	3	托马斯厄斯金曾谓：“当人类能构自由发表他们的见解，以及他们实有的或想象的苦痛时，他们的激烈情绪都会随风消逝……但在因郁愤恐惧下，这种情绪便会暗中长成，终至一发不可收拾。”（When men can freely communicate their thoughs and their sufferings, real or imaginary, their p...
007.我最难忘的一个官僚同学.txt	150	299	299	240	3	社会舆论常批评指摘今日大学生缺乏高瞻远瞩的理想，无蓬勃澎湃的朝气，只顾安乐现实、意志薄弱、麻木不仁，只求优厚职业、苟且偷安、醉生梦死，甚至不知国家民族为何物。此绝非危言耸听之词，我们甚觉渐愧，无地自容。然细而思之、明而察之，在学术上无充分之教学、研究与思想的自由，在政治上无参与合法活动的正当权利（国民党例外。孔子曰：“不在其位不谋其政。”此语已不合时代，应摒...
007.我最难忘的一个官僚同学.txt	161	321	321	377	3	石桃芬系一小镇，居民三千三百，镇内建筑则艺术典雅，有中古之遗风。上课二周后院方即率我们至市政府参观（在行政建制上石桃芬系属于“市”）。市长Dr. Ulmann亲自招待，在楼上会议室以极优雅之德文叙述石镇之光荣历史，声调、手势、表情俱佳，无奈我们德语并不灵光，有负盛情，了解的部分远较不了解者为多。石桃芬又称为浮斯德市（Der Fauststadt Staufe...
007.我最难忘的一个官僚同学.txt	165	329	329	103	3	二、写作（Nacherzahlung）：先由教师口述简易之故事或笑话一则，再由学生依其所听之内容写成文章一篇交卷。此法甚佳，熔听闻、理解、作文于一炉，颇能测出学生之语文程度，与普通作文可避重就轻者迥然不同。
007.我最难忘的一个官僚同学.txt	186	371	371	375	3	六日上午抵宿舍，前来面谈者多已先我而至。签到后接一函，内置剪报一份，为上月Stuttgart法院对于交通专家赖布蓝（Leibbrand）之无罪判决，赖某为战时德国铁道兵连连长，一九四四年在法国南境奉命枪决连内数名意大利志愿军，而彼对于此一命令之违法并不知悉。法院以证据不足为理由，引用"in dubio pro reo"（有疑义时应为有利被告之判决）之古老原则...
008.我最难忘的一个邻居.txt	4	7	7	267	4	在大厦中，我住在十二楼，正是住在八楼的裴老爷子的楼上。我和他做了十一年的邻居，可是从没讲过一句话；见面、同电梯无数次，从没打过一次招呼——我对国民党老帮子全无好感，他们对我也一样，所以古人“天涯若比邻”，我们却“比邻若天涯”。不过，每年选举住户代表参加大厦管理委员会，我总暗中投裴老爷子一票，逼他管点事。立法委员，对应付警察之类的牛鬼蛇神，还是有点用的。李登辉...
008.我最难忘的一个邻居.txt	5	9	9	352	3	裴老爷子满头白发，但是梳得很整齐，虽然七八十岁的年纪，但是出入理发厅马杀鸡，日以为常。裴老太太好象也心知肚明，懒得管他。裴老太太是美人，从她孙女的神韵上可想象当年。我在台中寻访史料，在杜致勇的天花板上，找到杜聿明将军当年同裴老爷子裴老太太的照片，顿时灵感交集，这些人物，我跟他们素昧平生，但是历史与新闻、过去与现在、青年与衰老、兴亡与荣枯，种种对比，却常常交汇...
008.我最难忘的一个邻居.txt	6	11	11	205	5	又有一次，我半夜翻看1934年的《中国国民党年鉴》，在（丙）230页看到云南省党务指导委员会三巨头，执行委员龙云、监察委员卢汉之下，赫然就是书记长裴老爷子。我一边看一边心里就想：裴老爷子出道可真早！他在云南做地头蛇的时候，我还没出生呢！第二天清早，我下电梯，裴老爷子穿着花格子西装，打着红领带，叼着雪茄烟，悠闲的坐在大厦门庭的椅子上，等着去立法院聊天。我瞄了他...
008.我最难忘的一个邻居.txt	7	13	13	132	4	如今，裴老爷子八十七岁了，前天他宣布，在退职条例生效后，他要率先不干立委了。四十年来，他未曾生过病或请过一天假，如今退职是要让位给青年人。消息传出，一位在立法院待过七八年的新科立委问：“裴存藩是谁？我都没有听说过！”反证了裴老爷子四十年如一日，那一日就是一纸空白。
009.我最难忘的一位烈士.txt	5	9	9	451	11	南榕在1985年4月15日，曾发表过回忆他与我结识的经过，他说：“1968年的暑期，我正在朋友办的文学性质的‘草原杂志社’帮忙，第一次见到李敖。这种‘杂志——李敖——我’的三角缘分，在十七年前就建立起来了。第一次见到李敖，是在他现在安和路的那个‘家’。当时门牌还是信义路，双并的四楼公寓，右边是《文星》杂志社的资料室，左边就是他的‘第一个家’，他自己买的第一栋...
009.我最难忘的一位烈士.txt	7	13	13	306	3	美国思想家孟肯（H. L. Mencken）说得好：“为理念去死，无疑是高贵的。但为真实的理念去死，那就更高贵了！”（To die for an idea: it is unquestionably noble. But how much noble would it be if men died for ideas that were true.）我始终相...
009.我最难忘的一位烈士.txt	21	41	41	91	4	1968年的暑期，我正在朋友办的文学性质的“草原杂志社”帮忙打杂，透过当时水牛出版社的老板彭诚晃的帮忙，第一次见到李敖。这种“杂志——李敖——我”的三角缘分，在十七年前就建立起来了。
009.我最难忘的一位烈士.txt	22	43	43	80	3	第一次见到李敖。是在他现在安和路的那个“家”。当时门牌还是信义路，双并的四楼公寓，右边是《文星》杂志社的资料室，左边就是他的“第一个家”，他自己买的第一栋房子。
009.我最难忘的一位烈士.txt	23	45	45	134	4	我第二次“正式”见到他，是为了《深耕》杂志的小鬼林世煌、邱义仁、林正杰不愿刊登《战斗是检验党外的唯一标准》一文，我问明地址匆忙赶到安合路时，大势已去双方已经决裂了。我是赞成刊登的，也因而留下来与他长谈，“正式”建立友谊。第二次的正式见面，地点不变，时间却是十五年后了。
009.我最难忘的一位烈士.txt	24	47	47	69	4	李敖在二次出狱后这段期间，所作的文章更是轰动一时，打了好几只大老虎。可是套用他自己的话，却也“浪费”相当多的力气在“打老鼠”与“打苍蝇”。
009.我最难忘的一位烈士.txt	28	55	55	94	4	因此，李先生提议辞掉“总监”挂名时，虽然对杂志的销路有明显可见的威胁，我却答应了。我答应时开玩笑地提出条件：“让我尽快看到《中国思想史》结集出版。”宁愿李敖不做政论家，只愿见到他是思想家。
010.我最难忘的一个将军.txt	3	5	5	268	9	我生平喜欢打抱不平。不但为朋友打，也为敌人打；不但为认识的人打，也为陌生的人打；不但为近在眼前的人打，也为远在天边的人打。只要真理所在、真相所在、人道有关、公道有关，我都不论亲疏、不分彼此，一概奋笔为文，要打个痛快。自1949年起，我困处台湾小岛，被国民党政权作弄一二十年、二三十年、三四十年，肤尝身受于国民党政权者更酷更多，所以在感情上，尤为激越。这一激越，...
010.我最难忘的一个将军.txt	4	7	7	618	5	五年前，1984年4月4日的国民党第一党报中央日报上，登出一则消息，标题说：“宋希濂等甘为中共鹰犬/香港侨团联合声讨/呼吁侨胞团结自强”，我看了大感不平。两个月后，6月7日清早，我花了两个小时，写成《鹰犬将军》一文。其中指出：“乍看起来，这一消息，只不过是大时代中的一个小故事，但在小故事背后，却有着不少的来龙去脉，很足以观察国民党封疆大吏们的心路历程。”我又...
010.我最难忘的一个将军.txt	6	11	11	989	3	宋希濂将军在1985年6月写的“前言”中，对这一书名，曾志缘起。其中说：“我在长沙长郡中学读书时期，各个帝国主义对我国侵略有增无已，甚至大唱瓜分中国的论调；国内军阀连年内战，民不聊生，基于爱国热情，觉得青年非奋起救亡图存不可。那时根本不知道什么叫共产主义，更不知有中国共产党，对孙中山的三民主义，也是朦朦胧胧，只知道他是一位伟大的革命人物。在十六七岁时，我成为...
010.我最难忘的一个将军.txt	7	13	13	673	4	《鹰犬将军》在大陆出版后，1987年10月，宋希濂将军签题“李敖先生指正”一册，由傅朝枢先生亲去他家，取来送我。1988年7月28日，我在溪头旅馆里，感于他的好意，写下这样一封信：“希濂先生：承赠大作《鹰犬将军》，早由傅朝枢先生转到，极为感谢。大作定名，且以我的那篇文字遥应，益感先生盛德。隔海隔世，却能结书缘如此，想来令人欣庆。”“年来成立出版社，刊《真相丛...
010.我最难忘的一个将军.txt	8	15	15	693	7	9月13日，我收到宋希濂将军回信如下：“李敖先生：奉诵惠书，深感欣幸！仆来美九年，常向友人道及阁下才华过人，文采风流，尤以风骨傲然，虽以文字罪系狱数次，仍然不为利诱、不为势屈，良可敬佩。数年来得读大作多篇，言之有物、言之成理，击节赏叹，惊为旷世奇才。我曾和江南、大风等谈及足下作品之可贵，在于有根有据、逻辑性强、无懈可击。仆虽不学，但对是非曲直，尚能略断一二，...
010.我最难忘的一个将军.txt	9	17	17	325	3	10月27日，美中民艺学会的李蓝女士自美国来，带来10月7日宋希濂将军再给我的信，说：“李敖先生：7月27日惠书和附件，8月23日才奉到，由于《鹰犬将军》一书系文史出版社印发，这个出版社属公有制，在发行时负责人对我说，版权各占一半，因此我必须征求他们的意见，昨得复信同意由足下出台湾版。我于9月5日曾复一信，未知达览否？”“李蓝女士原在此间的《北美日报》任编辑...
010.我最难忘的一个将军.txt	11	21	21	482	4	我又告诉李蓝说，在外国、在日本、在大陆，一本像这样的书可卖几万本，因此你可能难以相信在台湾竟卖不过两千本。但是，台湾在国民党的多年教化下，就是一个“不悦学”、不流行读忧患之书的怪地方，并且宋将军的丰功伟业、苦心焦思，在台湾被封锁得一干二净，宋希濂三个字，在台湾全是陌生人，书又不能登广告，怎么卖？这一阵子远流出版社印行胡适的书，销路不好，原因之一是：年轻人到了...
010.我最难忘的一个将军.txt	12	23	23	430	5	李蓝离台后不久，大风有次从纽约来电话，谈起了他跟宋希濂将军很熟，我顺便表示，如大陆方面，格于公营和错觉，在授权上使宋将军为难，我并不坚持一定由他授权，不授权也可以出，只是希望由他多提供一些新资料，以便使新版本更有特色，就好了。1989年2月7日，宋希濂将军来信如下：“李敖先生：祝您新春快乐！在新的一年里，万事胜意。李蓝返纽约后详述与你会谈经过，深以为慰。正拟...
010.我最难忘的一个将军.txt	13	25	25	129	3	这封信后三个多星期，1989年3月3日，宋希濂将军就寄来十五份资料。他附信说：“李敖先生：春节发来一信，想已达览。兹由邮寄来资料十五份，可供参考，将来拙著付印时，哪些可以采用，取舍由您核定。照片正搜集中，不久当可寄来，专此敬颂春安。宋希濂。3月3日于纽约。”
010.我最难忘的一个将军.txt	14	27	27	505	3	3月30日，我复信如下：“希濂先生，去年9月5日信收到后，旋由李蓝小姐携10月7日信来，面商出书诸事，想蒙转达。后以彼方中变，我向大风先生提出变通办法，先生亦觉可行，甚感先生与我皆能就大处着眼，成此佳话。今年2月7日先生惠书后，3月3日寄来各件均收到，一俟先生寄下照片等，即可发排，并悉遵尊意处理（中国文史出版社在照片处理上太模糊不清，无法翻制，故必另找原照及...
010.我最难忘的一个将军.txt	15	29	29	1139	9	我的信寄出后，适接大风电话，知道宋希濂将军已赴大陆，无法及时收到我这封信了。直到11月11日，我收到宋希濂将军的回信，内容如下：“李敖先生，首先我对您致以深切的歉意。由于健康欠佳、心情不怡，7月初从大陆回纽约后，一直拖延了三个月才写信给您。”“一、我在北京和文史出版社负责人几次商讨，最后才说服他们，不争版权，只要不修改原书的主要内容即可。他们提出不管你印多少...
010.我最难忘的一个将军.txt	16	31	31	230	3	我在上面发表宋希濂将军和我之间的全部通信，不加剪裁，目的就在完整的保存有关出版《鹰犬将军》的每一细节，由细节中的各种角度，来窥见成书不易、来理解经营之难。更重要的是，我想要人知道宋希濂将军爱国情殷的吉光片羽、一生怀抱的几许原貌。宋希濂将军要我“再版序言”，我不敢当。庾信《哀江南赋序》说：“昔桓君山之志事、杜元凯之平生，并有著书，咸能自序。”宋希濂将军“平生”...
010.我最难忘的一个将军.txt	17	33	33	1086	6	宋希濂将军纵横于疆场之上，他在抗日方面的功勋之烈、志事之苦，本来已是一个完美的、不朽的句点。但是中国之命运，正《庄子》所谓有“数存焉于其间”，宋希濂将军在家破人亡、备遭大难之后，却又否极泰来、别开新章。他的人生，在句点之后，又转入惊叹号。他以一介“战犯”，观礼于天安门，目睹祖国的兴盛；复以劫后余生，存活于北京城，身历覆巢的重建；又以垂老之年，云游于美利坚，乐...
010.我最难忘的一个将军.txt	18	35	35	156	3	这是一位半生戎马、半生忧患爱国者的最后高呼。他以大好青春为祖国效命，以出生入死为祖国献身，以垂老叮嘱为祖国招手。牧野鹰扬于上、鸡鸣犬吠于下，他以一生的辛勤血泪，在向我们呈现他在为国家民族做了鹰犬。做鹰做犬也有不同的境界，他为自己和我们，提升了这一境界。我们怀念宋希濂、怀念宋希濂、怀念这位令人敬重的“鹰犬将军”！
011.我最难忘的一个老兵.txt	5	9	9	286	4	张永亭个子不高，但横着长，很魁梧厚实、孔武有力，会摔跤，全连没有他的对手。一摔跤，你就发现他只有二十多岁，但一看他的脸，你就肯定他有五六十岁。他的脸，皱纹又杂乱又多，可谓满面风霜，但是黝黑得毫不匀称，深一块浅一块，非常难看。我问他为什么这么难看，他说本来好看，有一次连中枪毙一个可疑的老百姓，那老百姓怪怪的，很邪门儿，五花大绑后，老是回头看他这刽子手。他很忌讳...
011.我最难忘的一个老兵.txt	8	15	15	606	5	张永亭不但摔跤第一、脚臭第一，枪法也是第一。他的枪法，全连无出其右，但在射击训练时，却每每相左——他并不好好放枪。他懒洋洋的，拿起机枪，在一尺距离内，朝土堆集中射击，然后挖开土堆，清出弹头，包在一起，到外面当废铁卖——你政府抓老子来当兵，给老子这么可怜的军饷，却舍得花大钱去造枪炮子弹，老子就给你浪费一下，变成废铁吧！这就是他的心理。这种靠卖废铁赚外快的，也不...
011.我最难忘的一个老兵.txt	9	17	17	234	7	张永亭是老兵，阅战已多，自然受过伤，但有趣的是，他的伤，都在背上、后腿上，全身正面却没有。原来他逢战必逃、走为上计，所以虽有受伤的光荣，无奈全在背后，因此我常常笑他。有一次他连赢三次摔跤，我以他为本排增光，买双喜烟重重赏他。他那天真开心，当众大谈从军史，最后向阿兵哥们指着我说：“头一次上战场没有不害怕的，我们的排长，你们平时看他张牙舞爪不可一世，可是他若上战...
011.我最难忘的一个老兵.txt	10	19	19	508	9	一般说来，预备军官在部队，学问有余、经验不足，我给它的素描是：“白白的，傻傻的，一副近视眼镜，经常总是遮在低戴的帽沿底下，背有点儿驼，走起路来大摇大摆，谈吐之间总是脱不掉他在大学时代的那种书袋气，站在队伍前面，慌手慌脚，喊口令像踩了鸡脖子，一点没有叱咤风云的味儿。”正因为预备军官给人的印象如此，所以老士官未尝不作弄这种上级，甚至在崇拜、嫉妒与歆羡中，有自卑的...
011.我最难忘的一个老兵.txt	11	21	21	772	10	最大的笑话是这样的：1960年7月23日，举行“连测验”，清早4点，在黑暗与冷风中，我与连长坐吉普绕过台南县新化，在新化镇南边五甲势地方的甘蔗林中接受命令，并勘察地形。到了9点30分，攻击发起，我勇敢过度、性急如火，一听前面枪声，又阻于眼前小山，看不清情况，就下令全排，跟我向左沿小路绕到山前，我率七五炮组带路，六○炮组尾随，仍不顾枪声，朝前攻去。顿时前后枪声...
011.我最难忘的一个老兵.txt	12	23	23	210	5	有一次大家聊天，谈到“反攻大陆”。张永亭半开玩笑说：“反攻大陆后第一件事，就是回到老家，掘掉自己的祖坟——祖坟风水不好，害得我一辈子倒了大霉。”我反问了一句：“如果回不去呢？”他说：“回不去吗？那我退伍后，老得不能动了以后，我就脱掉裤子，跳河自杀——自杀前我会向我妈说：‘妈，我光着屁股来，现在光着屁股回去了！’”我听了这话，想起《旧约·约伯记》“我赤身出于母...
011.我最难忘的一个老兵.txt	13	25	25	198	3	我退伍前不久，在去高雄的车上，碰到张永亭和他的女朋友，吓了我一跳！那女人长得黑胖结实，粗眉大眼，还有胡子，比魁梧厚实的张永亭至少还重一倍以上，煞是吓人，天下竟有如此女人也！第二天我跟张永亭说：“你好容易赢了几个钱，为什么不逛逛窑子，何必还跟有夫之妇乱扯，又多花钱，又划不来？”他答道：“我没钱时，她跟我来，不要钱；现在有钱了，就不理人家，怎么好意思？”——这就...
011.我最难忘的一个老兵.txt	14	27	27	269	4	由于我和他较亲，他与我最熟，所以我日记中，就留下了这些记录：1960年8月14日：“张永亭夜来央我帮其赎手表（求我向行政官说项，准其借钱，）并说此后一定不赌了。我说‘羊忘不了吃草，狗改不了吃屎’。你能不赌么？他妈的不要再罗嗦，这个忙不帮。这二十元拿去，算我送你的，拿去明天吃杯老酒，在河边打自己几个嘴巴子，死了这颗心吧！（后来他走了，还连说明天再找我来赎表。阿...
011.我最难忘的一个老兵.txt	15	29	29	93	3	我在部队，对每个人都客气，但对张永亭却熟得可以佯骂之，并逼他为我做事。张永亭有次向我抱怨说：“我当兵当这么久，没给人擦过枪，现在给你擦了好几次枪了。”可是抱怨是说着玩的，他还得照擦不误。
011.我最难忘的一个老兵.txt	16	31	31	184	3	最难忘的是在连中第一次长行军，两天走九十二里，从高雄县的仁武，直走到台南县的那拔林。第一天由5点20分走起，走到午间，大家都走累了，我这书生，比起他们来，当然更累。突然张永亭走过来，端着由民家讨来的一盆热洗脚水，要我洗脚，老兵徐菊生（后来在金门被跳雷炸死）在水中放了些盐，两人的行为，使我深为感动。那时我刚派到连上不过十三天，就能带兵带得如此成功，连长都看得赞...
011.我最难忘的一个老兵.txt	18	35	35	220	3	1961年2月6日我在澎湖退伍。头天晚上，大家为我做惜别之宴，排附亮出兄弟们合资送我的钢笔。散席后张永亭等惜我之去，难过溢于言表，我与他们谈到夜深。第二天清早，官兵集体送我上车，张永亭随车送我到码头。我得知张永亭昨晚只有十元了，为了要送我，特地去赌，可是一下子就输了五块，再也不敢继续赌了，乃最后赏了他十元。同时退伍的施大哥（河北人）也送了他十元。头天晚上台湾...
012.我最难忘的一位学者.txt	5	9	9	147	3	按说以钱穆对我的赏识、以我对他的感念，一般的读书人，很容易就会朝“变成钱穆的徒弟”路线发展，可是，我的发展却一反其道。在我思想定型的历程里，我的境界，很快就跑到前面去了。我十八岁以后，未再跟钱穆有任何来往，并且三十多年来，对他有不少批评，如今钱穆死了，看到报上的胡乱报导，感而对他有以定位如下：
012.我最难忘的一位学者.txt	6	11	11	104	3	一、钱穆在古典方面的朴学成就，大体上很有成绩，当然也闹大笑话。例如他考证孙武和孙膑为同一个人，并以此成名。但1972年山东临沂银雀山的古墓“孙子”出土，证明了孙武是孙武、孙膑是孙膑，证明了所谓朴学，不过乃尔！
012.我最难忘的一位学者.txt	10	19	19	92	3	五、钱穆与当权者关系，是可耻的。蒋介石利用钱穆的反动，来哄抬政权；钱穆利用蒋介石的反动，来得君行道。结果，人越丢越大。被蒋介石“倡优畜之”的结果，他曲学阿世，大儒立场尽失，去朱子远矣！
