file	paragraph	line_start	line_end	char_count	score	snippet
013.我最难忘的一位教授.txt	5	9	9	97	3	我在1963年写文章攻击台大文学院，也攻击到中文系，我本以为中文系的腐化，乃是台静农被“挟持”、不能脱身的结果，后来想起，这是我淆于感情所做的错误判断。其实，腐化的真正原因，台静农本人就是祸首。
013.我最难忘的一位教授.txt	6	11	11	255	3	台静农当年是鲁迅的大将，是未名社要员之一。据李霁野《未名社始末记》，说：“鲁迅先生在《苏联作家七人集序》中说：‘它被封闭过一次，是由于山东督军张宗昌的电报。’就是指的这一事件。至于同文中说到的‘新式炸弹’一案，却是几乎使未名社三个成员丧生，轰动一时的大奇闻，因为这‘新式炸弹’其实只是制造化妆品的机器。《鲁迅日记》1934年7月记：‘31日晴。……得亚丹信言静...
013.我最难忘的一位教授.txt	8	15	15	121	4	去年10月，《联合报》系的出版机构，印出了《静农论文集》，报章推介，说是学术著作。我素知台静农懒于学术，并以“我不在乎”自道其不出版学术著作的态度。如今既以八八之年，出了唯一一本学术性专书，不可不买来一读。结果一读之下，引起我一点统计的趣味：
014.我最难忘的一个“反共义士”.txt	9	17	17	132	3	曲军成说，十九年前，憧憬自由中国，唾弃中共暴政，泅水投奔自由，并以长达三个月时间，提供闽南沿岸重要军事情报，却是有功无赏，当局以难民相待，后又因两句话触怒当局，竟锒铛入狱，无罪也遭重罚，于理不合、于法无据，更是含冤莫白，又哭诉无门，有生之年誓死讨回公道，还其清白。
014.我最难忘的一个“反共义士”.txt	10	19	19	312	5	看了这一报导，引起我的回忆。曲军成刚在移送交付感化三年前，被关在景美军法看守所，那时我已是看守所的资深囚犯，独居在第八房。第八房有高窗，踩在马桶上，扒住窗框，可以望到窗外“放封场”，看一批批犯人散步。有一天，窗外鼓噪，我扒上窗框一望，原来是一个身材不高、体格结实的年轻小子，突然以矫健身手，施展“壁虎功”，沿着我窗边的押房大楼凸出水泥边缘，快速攀升上去，只见他...
015.我最难忘的一位残障人士.txt	4	7	7	306	3	作者邱铭笙三岁就得了小儿麻痹症，从那时候起，他就没有“脚踏实地”过。不过，他的身体，虽然坐上轮椅，不再“脚踏实地”；但他的精神，却坐上风火轮，上天下地起来。在不幸的人生遭际中，最难得的，他既不自弃，也不自怜，反倒奋发向上，成为一个极有才华与巧思的写作者。在他活泼动人的文笔中，我们看到的，是一个残障者洞彻人生的独白，独白里洋溢着快乐与自信，心理健康得连得了小儿...
015.我最难忘的一位残障人士.txt	11	21	21	875	8	进了开刀房，小甜甜等向邱公子鞠躬告退，邱公子给她们飞吻，对她们说“生离死别”了，她们三人都忍俊不禁，莞尔而去！开刀房里医师护士都已装备齐全，个个都像屠宰场的屠夫，尤其张金龙，一脸横肉最像。因恐在手术进行中意外导电被触死，怕死的医师护士都穿木屐，ge ge ge ge，很令人发思古之幽情，仿佛《再见阿郎》。各种刀械闪闪发亮，待会群医就以这些刀俎将邱公子当鱼肉，...
015.我最难忘的一位残障人士.txt	13	25	25	232	4	8点钟进开刀房，8点30分行开刀大典，11时半礼成，11时三刻邱公子悠悠转醒，已经躺在恢复室里，恢复室里非常安静，只有一位护士小姐在旁随时注意邱公子恢复的情况。躺在塑胶罩中，邱公子也在找话题跟旁边的护士小姐交谈，即使在这个时候，邱公子还是这么风流可爱！醒来之后，医师朋友不时前来探望，真是杏林春暖！好想唱“条”台语“瓜”：“犹原是忠实的朋友，卡有人情味！”打定...
015.我最难忘的一位残障人士.txt	22	43	43	213	4	（1981年6月28日，星期日）8点了未见培如，才猛然想起培如不会来了，培如轮值一周，到昨天结束，今天起不用来了。一个星期来，整个心都寄托在培如身上，依赖她如此之深，现在培如不来了，顿然感到心室全空！我对连培如满怀情之所钟，爱苗深种，心坎意浓，我都没向她表达，只好诉诸纸笔，在日记上情文相生，永证我此思此愿，常策心马。前天培如告诉我，昨天是她轮值的最后一天，我...
015.我最难忘的一位残障人士.txt	23	45	45	74	3	在这些文字里，一个近乎凄楚的故事，轻淡的起来，又轻淡的结束了。在这里，我们看到邱铭笙笑脸背后的一面，不过，“事如春梦了无痕”之后，他又展开了另一面：
015.我最难忘的一位残障人士.txt	27	53	53	402	3	天妒英才邱铭笙，让我得到小儿麻痹绝症，击碎了父母的心！妈妈是旧式女性，相信凡事天注定，一切都是命，便去找了相士替我“算命”，去问我“为何命如此”？相士对妈妈说，这个孩子聪颖异常，才智过人，又反骨明显，一反起来甚至会大闹天宫，天都管不住，所以一定要让这个孩子“破相”，压制他的反动。我最讨厌相士，从不相信相士的任何鬼话，他们的耍嘴皮、胡说八道，由此可见！为了希望...
015.我最难忘的一位残障人士.txt	31	61	61	283	3	住院前后，卢泉锦“老师”在精神上和金钱上都给予我支持与资助。卢泉锦“老师”喜欢拜神，不单拜一尊，自宅甚且设一神坛，供奉的从哪吒小神到福德老神，还有齐天大圣，不知是“神仙家庭”还是“傀儡家庭”？卢泉锦说众神都拜，日后升天位置可靠，我说不如都不拜，以后鬼门关前众神拉客拉得厉害，一枝独秀，身价更高，可能耶稣阿拉都插一脚来凑热闹呢！卢泉锦也为神像开光点眼、安神位、看...
015.我最难忘的一位残障人士.txt	34	67	67	534	5	白云苍狗，世情多变，仁爱医院还没倒，还站在那里，只是景物依旧，人事全非！第一非的是柯贤忠已由医院院长调升为卫生局局长，以前只管一家，现在每一家都归他管，跟他有仇的，莫不战战兢兢，深怕不知道哪一天血滴子会飞来！人事的浮沉，风水轮流转，几家欢乐几家愁，永远都有人在悲伤、挫折与不如意之中。“大同世界”只是空话而已。我的红粉之友赵培鑫已回到台中当郎中。我最喜爱、最可...
015.我最难忘的一位残障人士.txt	35	69	69	433	3	看了这本书，使我想起四十年前看过的那本梭维斯特（Emile Souvestre）的《屋顶间的哲学家》（Un philosophe'sous les toits），那踽踽独处阁楼一角的法国智者，如何以洞彻的眼神，在安贫中、在乐道里，默默记录人间的众生相。这位智者在世俗环境中，看来是“弱者”；但在精神领域中，却实乃“‘强人’也”。所谓强人，自有他自强的世界，他不...
016.我最难忘的一个国特.txt	2	3	3	340	5	八十九岁的乔家才将军死了，九年前，他预立遗嘱说：“骨灰永留台湾，不要携回大陆。……我对留在大陆之子女未尽教养之责，内疚很深，希我妻替我多多照顾，以弥补我之愧疚。”但是，当他在大陆的子女奔丧来台时候，所分到的财产，却只是官定最高价码的五分之一——各四十万元。谷正文将军私下告诉我：“乔老死前跟我说：‘我不要把遗产分给共产党！’”哪怕共产党是他的子女，他也不愿，他...
016.我最难忘的一个国特.txt	9	17	17	119	3	《二二八研究》网罗了那么多的文章，客观详尽，好极了。你的结论，非常正确。三十多年前坐牢，和陈仪的浙江省政府秘书长张宣泽坐在一个牢房里。他说为日本人利用过的流氓，回台后分批训练，有一批还未训练的流氓，成了二二八主要发动者，正与尊著结论吻合。
016.我最难忘的一个国特.txt	24	47	47	129	3	李敖出版社新版《军统内幕》，我不赞成，也不反对。因为出版业者有他的生意经，有他的打算，旁人不能置喙。不过你在缘起将我和沈醉混在一起，我不同意。我坐九年牢，出牢后，“一与之齐，终身不改”，怎么能和沈醉坐了共产党十六年牢，出牢后辱骂他工作了十八年的军统局相比呢？
016.我最难忘的一个国特.txt	25	49	49	86	3	沈醉不仅是“反复小人”，而且卑鄙无耻。你捧他“此公纵‘小人’而有圣人行”，未免过火，忠奸颠倒，善恶不分，万难苟同。你说：“沈醉不复沈醉，沈醉醒矣！”是你在说醉话，李敖醉矣！
016.我最难忘的一个国特.txt	26	51	51	196	4	我说沈醉无耻，不是凭空骂人，请看前言，沈醉吃了周恩来的饺子，他说：“周总理走进来时，只有我左边还有一个空位，便走过来坐下。当时，我心头真感到无比温暖（小人的嘴脸）。过去我替蒋介石和戴笠拼命卖力干反共反人民的事情，他们却把我当成家奴一样看待。特别是蒋介石，去见他时，有时连坐都不让我坐下。今天总理接见我们，这样平易近人，实在出我意外，我几乎感动得掉下泪来。”你不...
016.我最难忘的一个国特.txt	27	53	53	210	5	我坐牢并不怨天尤人，《书经》：“自作孽，不可逭。”我是保密局北平（今北京）站站长，毛局长人凤支持他的女友刘秋芳竞选北平市的立法委员，我没有达成任务于先。后来毛局长派刘秋芳的丈夫李广和为天津稽查处处长，引起舆论的不满，我给毛局长去信：“自从钧座发表李广和同志为天津稽查处长后，华北同志闻之大哗。查李广和同志自称为钧座之亲信，招摇撞骗，胡作非为。希钧座能辨别忠奸与...
016.我最难忘的一个国特.txt	29	57	57	145	3	“觉民”，我说：“如果毛先生真的如此糊涂，而我们的贤明领袖又如此信任如此糊涂的人，交付如此重大的任务，国家都会亡的，个人的生死算个甚么，发了吧！”这是我自己找死，能责怪国民党吗？毛局长欺瞒总统蒋公把我关进监牢，能说是国民党关我吗？毛人凤局长也代表不了国民党，他的监牢也不能说成国民党的监牢。
016.我最难忘的一个国特.txt	37	73	73	181	3	军统局的工作威力使敌人汉奸及一切反政府分子畏惧心恨，戴笠功高遭忌，同僚同学也在放冷箭伤害他。所以对他的一切诬蔑，造谣中伤是必然的。沈醉吃了周恩来的饺子已经感觉到无比的温暖，听了周总理的训示：“你在军统那么多年，跟在戴笠身边那么久，你把军统的种种内幕如实地写出来，不论是你自己干过的，或是看到和听到的那些阻碍革命、屠杀革命人士等等见不得人的东西，都揭露出来，……...
016.我最难忘的一个国特.txt	47	93	93	155	4	乔家才将军到台湾后，一路坐牢。前后坐了九年后，毛人凤死了，他给放了出来。他这牢可坐得神来之牢，他回忆：“我坐了九年牢，未经正式军法审判，我没有看见过起诉书、也没有看见过判决书，不知身犯何罪，害得妻离子散，惨绝人寰。”——国民党特务机构，对自己的首席大将都可无法无天，如此对待，其他小人物或局外人，更可想而知了。
016.我最难忘的一个国特.txt	48	95	95	140	5	乔家才将军坐牢后期，毛人凤以关人无名，有缓和之意。据谷正文将军告诉我，毛人凤通知他：如果你这位山西老乡答应出狱后不追究不骂我毛人凤，我就放他出来。可是，当他去跟乔家才商量的时候，这个硬汉一口拒绝。最后毛人凤死了，“我们请他出狱，他还发脾气不出来呢！我们没办法，只好把他抬了出来。”
016.我最难忘的一个国特.txt	49	97	97	200	3	我小时候住过山西，对山西人的忠心质直，有极好的印象。有一次在法院，龙云翔律师介绍前来旁听的谷正文将军相识，因此得以多谈国特与山西事，也谈到乔家才将军。我与乔家才将军至今没见过面，不过，由于谷正文将军的中介，我们互有赠书，并且，为了李敖出版社出版《军统内幕》的事，乔家才将军前后写了三封信给我，表示关切、辨正与“抗议”。我向谷正文将军说，请转告华塘先生，我会答复...
016.我最难忘的一个国特.txt	52	103	103	725	3	乔家才将军说：“你在缘起将我和沈醉混在一起，我不同意。我坐九年牢，出牢后，‘一与之齐，终身不改’。怎么能和沈醉坐了共产党十六年牢、出牢后辱骂他工作了十八年的军统局相比呢？”事实上，乔家才将军由于嫉恶如仇，使他在这方面表现得太过敏了，在中国史书中，有忠义传，也有贰臣传；有循吏传，也有佞幸传，相对的人物，无不“混在一起”而论列之，清者自清，浊者自浊，谁也浼不了谁...
016.我最难忘的一个国特.txt	54	107	107	118	3	可是，乔家才将军却抗议说：“沈醉不仅是‘反复小人’，而且卑鄙无耻。你捧他‘此公纵“小人”而有圣人行’，未免过火，忠奸颠倒，善恶不分，万难苟同。你说：‘沈醉不复沈醉，沈醉醒矣！’是你在说醉话，李敖醉矣！”……乔家才将军连我也一同醉化之矣！
016.我最难忘的一个国特.txt	56	111	111	332	4	即以乔家才将军最挺身卫护的戴笠为例，乔家才将军来信说：“戴笠先生确为古今难得一见之人物，八年抗战中，任何人的功劳，都不能和他比较，但他没有表白，连一枚勋章都没有。”又说：“戴笠将军是一位千古奇才，热爱国家，八年抗战，功勋辉煌。军统局敌后情报，杀敌除奸；战区游击破坏，牵制敌人；大后方治安维持，防间防谍，甚至缉私、抢购物资，无不做得有声有色，发挥了极大的功能。”...
016.我最难忘的一个国特.txt	57	113	113	224	5	我在情报局出版的《戴雨农先生传》中，看到乔家才将军所写的一副挽联，原文是：“勘大乱、冒艰危，英勇仰雄风，剩有赤忱垂宇宙；避高名、薄利禄，谦为标亮节，长留青史在人间。”我觉得最后一句“长留青史在人间”，是求真的人，大家都该努力的目标。乔家才将军来信说：“我的文章拙劣，但力求真实、公正。”“真实、公正”是“青史”的必要条件，乔家才将军所悬的目标，我是绝对赞成的。...
016.我最难忘的一个国特.txt	58	115	115	289	4	乔家才将军来信说：“奉上拙著《为历史作证》一册，221页至265页‘为戴笠辩诬’系反驳文强和沈醉而作。沈醉曾在香港镜报发表《不是答辩 只作说明》。沈醉不是不答辩，而是无法答辩。一个人自己不顾自己的人格，总会感到惭愧的。沈醉为文不可靠，他的文章不能作为历史资料。”乔家才将军且以沈醉错写邢森洲为例，以实其说。我看了信，也看过乔家才将军所有的指责沈醉的文字，我相信...
016.我最难忘的一个国特.txt	59	117	117	352	4	试看乔家才将军说：“沈醉原来跟着中共中委顾顺章跑腿，所以学会不少鬼名堂。顾顺章投降国民党以后，沈醉摇尾乞怜，投靠在戴笠名下，做一名打手，摇身一变，由共产党变成国民党，能说不是共产党的叛徒吗？现在又摇身一变，变成共产党。”但在“真实”上，沈醉的说明却是：“我参加军统（特务处）时才十八岁，顾顺章早就被国民党调查室（中统前身）抓去，我连顾都没见过。如果我是跟过顾顺...
016.我最难忘的一个国特.txt	61	121	121	272	3	乔家才将军又说：“沈醉人格太低，良心太坏，居心叵测，早已遭受天谴，祸延子女，他的子女，不是瞎子，就是拐子。”但在“真实”上，沈醉的说明却是：“我的几个孩子（包括孙子、外孙），不但个个健康，而且都是游泳健将，女儿中还有一个被选上‘健美妈妈’。但和乔先生相比，我就大有逊色了。乔先生的大公子在大陆上早已成了光荣的中国共产党党员，而女公子最近申请加入‘民革’（即国民...
016.我最难忘的一个国特.txt	65	129	129	164	5	乔家才将军在回忆中，给我们提供了线索。他说：“黄埔军校第六期有两位杰出的同学都是骑兵科，又都和我有深厚的交情。”这两位有深交的同学，“戴雨农将军三十五年3月17日座机在南京以南戴山撞山失事，以身殉职。廖耀湘将军于三十七年11月辽西会战被俘，誓不投降，屈辱而死。”原来乔家才将军与老同学“深厚的交情”，使正直的他，也不能免于曲笔！
016.我最难忘的一个国特.txt	68	135	135	230	6	章太炎为冯自由《中华民国开国前革命史》写序，说有人劝他写出信史，他“犹豫未下笔”，为什么？因为“身不与其事者，非审问则不敢言；身与其事者，所见乾没忮戾之事亦多矣，书其美不隐其恶，或不足以为同志光宠，是以默而息也。”章太炎这位革命元勋为什么这样？原因就在于他无法“书其美不隐其恶”，结果连美也无法一书了。乔家才将军则正相反，他要书其美而隐其恶，结果呢，把戴笠写成...
016.我最难忘的一个国特.txt	70	139	139	271	4	乔家才将军来信说：“你说我虽著作千言万语，内容对军统内幕，却处处有‘直在其中’之隐。我乃一介武夫，岂敢舞文弄墨，班门弄斧？所以千言万语者，辨是非、表忠义也。”我相信乔家才将军千言万语的目的在“辨是非、表忠义”，但从而抹杀沈醉的千言万语，这就有失“真实”、“公正”了。我承认沈醉的千言万语，在表军统局方面的忠义，落墨不够；但他笔下的非军统人物中的忠义事迹，他又何...
016.我最难忘的一个国特.txt	71	141	141	387	6	我所以说乔家才将军有“直在其中”之隐，原因就在从他的著作与来信中，我们看到的，都是一片曲为之讳。他来信说他“坐牢并不怨天尤人”，毛人凤明明为女友竞选之私残害同志，而乔家才将军却说：“‘如果毛先生真的如此糊涂，而我们的贤明领袖又如此信任如此糊涂的人，交付如此重大的任务，国家都会亡的，个人的生死算个甚么，……’这是我自己找死，能责怪国民党吗？毛局长欺瞒总统蒋公把...
016.我最难忘的一个国特.txt	72	143	143	164	3	当年在生死线上，乔家才将军也曾气愤不平，他曾自问：“这就是革命下场吗？”但是，心平气和后，他又想：“被共产党捉去杀头，和自己人处死，不是一样死吗？”如今，四十多年过去了，我感到乔家才将军竟毫没觉悟出革命的下场不该如此，而被敌人杀头或被自己人处死，其实根本不一样。他的愚忠，使他完全丧失了清醒的能力，我真为这位可敬佩的山西老人悲！
016.我最难忘的一个国特.txt	73	145	145	195	3	乔家才将军在《为历史作证》中责备魏大铭说：“雨农先生和军统局的功与过，都有你魏先生的—份。雨农先生是你多年的长官，你不应该批评他，也不能批评他。理由很简单，譬如你的尊亲好和坏，旁人批评，无可避免，但是你魏先生和你的子孙，绝对不能批评。这就是中华文化，这就是中华民族延续了五千年的伟大力量。”其实，中华文化中，并不是绝对这样不讲是非的，只是乔家才将军选择了最拘泥...
016.我最难忘的一个国特.txt	74	147	147	107	3	令我们不解的是：如果“多年长官”不得批评，则陷害忠良的毛人凤以上之流，其恶行势将永无昭彰之日，因为君子扬善而不肯说，小人“都有你一份”而不可说，则中华文化，尽将是东西厂人物入“君子国”，人间的大是大非，也就全乱了！
016.我最难忘的一个国特.txt	76	151	151	130	3	乔家才将军并非不深明大义，例如他在《为历史作证》中指出：“人人都知道杀害岳飞的是卖国贼大奸臣秦桧，其实秦桧是在背黑锅，真正要杀岳飞的不是秦桧，而是宋高宗赵构。”可怜的是，我们的现代岳飞，却迷糊到明于知古而昧于察今，他被现代秦桧整得家破人亡，却还高喊领袖英明呢！
016.我最难忘的一个国特.txt	81	161	161	229	3	从去冬以来，台湾来京的亲友，不少人以爱护的口吻告诉我，说台湾有人写文章不断骂我，而且收入了他的选集中，他们希望我千万不要为此事而生气。我听后总是大笑一阵，然后坦然地说：有人写文章骂，说明我还有骂的价值，而能收入其选集中，我不但不会生气，还要表示感谢。一个人在一生中，能有几个够条件被别人写到书上去骂？不管怎样，名留书上的时间，总会比我活在世上的时间要长得多，这...
016.我最难忘的一个国特.txt	82	163	163	384	3	不少亲友很够交情，几个月内，我先后收到从美国、日本、香港等处寄来的老同事乔家才先生的大作《浩然集》十九部之多，我除留两部外，其他均捐赠有关部门和送与几位有关人士作参考。乔先生的大作共五册，其中一册《为历史作证》中，有一段说“沈醉是反复无常的小人”，写得不太长，正如他在该文后面所说：“……怕污了我的笔墨。”这次骂得不太痛快，连我这被骂的也没有过上瘾。幸好乔先生...
016.我最难忘的一个国特.txt	85	169	169	206	6	乔先生为了说明我是一个“反复无常的小人”，而给我列了一个公式：“共产党→国民党→共产党”。为了要说明这个公式是有根有据，他不惜在文章里写下这么一段：“沈醉原来跟着中共中委顾顺章跑腿，所以学会不少鬼名堂。顾顺章投降国民党后，沈醉摇尾乞怜，投靠在戴笠名下，做一名打手，摇身一变，由共产党变成国民党，能说不是共产党的叛徒吗？现在又摇身一变，变成共产党，能把过去背叛共...
016.我最难忘的一个国特.txt	86	171	171	243	3	乔先生在执笔时，不知真忘记还是假忘记，我参加军统（特务处）时才十八岁，顾顺章早就被国民党调查室（中统前身）抓去，我连顾都没见过。如果我是跟过顾顺章的话，就会跟顾一样投入中统，绝不可能是在军统。如果我真的是中共叛徒，戴笠绝不会那样信任我。我在军统不但当了几年总务处长，而且长期担任过总值日官，这点乔先生当不会记不得吧？乔先生认为我又“摇身一变，变成共产党”，我太...
016.我最难忘的一个国特.txt	88	175	175	293	3	据说，乔先生又有位朋友告诉他这样一个消息：“沈醉人格太低，良心太坏，居心叵测，早已遭受天谴，祸延子女。他的子女，不是瞎子，就是拐子。”这真是“大快人心”的事！可惜老天爷并不是那样不公正。我的几个孩子（包括孙子、外孙），不但个个健康，而且都是游泳健将，女儿中还有一个被选上“健美妈妈”。但和乔先生相比，我就大有逊色了。乔先生的大公子在大陆上早已成了光荣的中国共产...
016.我最难忘的一个国特.txt	89	177	177	727	4	至于在乔先生笔下，一再提到我写的东西是“共干捉刀沈醉署名”。可能乔先生还是用四十年前的眼光来度我。当时我只会在公文上批几个字。我估计，最近台湾李敖先生写的关于“蒋家父子……”一文中提到“沈醉以前是蒋手下……写了几本回忆录，台湾的地下出版商已经出版了四本。”乔先生如果想再找材料骂我，这四本书大可翻一翻。在拙著《我这三十年》（国内发行一百五十万册，还有英文和日文...
016.我最难忘的一个国特.txt	92	183	183	99	3	《乔家才入狱记》是我定的题目，原名《入狱记》，又名《南柯一梦》，为了彰显作者的身份，我特改定为这样的题目。这一改定，并没经过乔家才将军同意，一如我发表这四万八千字的文章，并没经过乔家才将军同意一样。
016.我最难忘的一个国特.txt	96	191	191	155	4	乔家才将军到台湾后，一路坐牢。前后坐了九年后，毛人凤死了，他给放了出来。他这牢可坐得神来之牢，他回忆：“我坐了九年牢，未经正式军法审判，我没有看见过起诉书、也没有看见过判决书，不知身犯何罪，害得妻离子散，惨绝人寰。”——蒋介石特务机构，对自己的首席大将都可无法无天，如此对待，其他小人物或局外人，更可想而知了。
