file	paragraph	score	markers	text
006.廖耀湘殉国了吗？.txt	11	11	最后|说|曰|逃|死|回忆|廖耀湘	廖耀湘所提到的周璞，在逃出后，写了一篇《辽西会战经过及脱险归来记》，附录在纪念专辑《追随湘公十年略述》的后面。其中回忆被俘前经过，可与廖耀湘文章参看。周璞说：“我是在战场上最后一个与廖司令官耀湘共在一起者。……驾车待发。耀、涛公乘马至。知东北方匪已接近，特务连无法抵抗，六十四团及师直属则已突过先行。余急随二公北走。过东北方之森林附近，匪已早伏机枪密射无法通过。转而沿河南向，以避匪弹，渡河西行。接近江家屯以南之村庄，遇匪。目击前行之官兵悉已被俘。时耀公举小手枪自戕，为李万福所夺。乃急转东北，未及千米，前行之李万福副官被俘，再转向南，前行之译电组蒋组长又被俘。斯时已知四面楚歌，陷身匪围矣。辗转二千米间之开阔地带，匪近则伏地隐蔽，数百官兵先后星散。及抵黄昏，所余者仅耀公、涛公、余与军部高参邓图南并卫士十余人而已。乃令卫士分组先行摸索。苦待良久，迄无返者。夜分时，四人乃冒险匍匐行约一千米，始脱匪围。仍渡饶阳河东行。图南先渡。耀、涛公甫及彼岸，骤然遇匪，星光之下，遥见刺刀闪动。余方行至河中失足坠落深处，顿遭没顶，亟力挣扎，两次水流激湍，冲走十数武，幸得邓图南臂助，获登彼岸。当时匪以未分敌我，弃而他去。涛公则于仓皇之中失踪。只余三人仍向东南行。走二里，匪军遍布，遇呼口令则止者数次。余因饮水满腹，全身冰冻，僵而未死。耀公频以手探余鼻孔，视以有无呼吸。邓图南则云周副师长不能行矣。当时余心尚明，知图南有手枪。军人不能成功即应成仁，此正舍生成仁之时，乃亟请以枪戕余，免遭匪俘，并促其速护耀公行，而伊不忍。虽经余反复申明此义，伊仍只强余行。28日天将晓，余等皆已疲惫已亟，无法再做挣扎，信步入一村庄。匪军以余等系病兵，命卧一民炕休息。及三四小时后，余已苏醒，知已身陷匪窟矣，乃亟将证件焚毁。中午匪以牛车送余与耀公赴团医务所，图南则步行。余以解送之匪兵在前数十武，车行尚缓，乃谓耀公曰：‘吾辈与其身陷匪手求死不得，不若趁机脱逃。万一不能获生，亦可借此求死。’语毕，乃急促耀公跃车而下。匪兵见余等逃，乃连发四枪。第二弹中余右腿透裤四层，幸未至肉；第三弹中耀公右足亦未致伤。急跑约三华里，始脱，时已黄昏。遂相
007.你淮海，我徐蚌.txt	4	11	不料|后来|最后|说|曰|死|回忆	刘峙说，他在徐州吃紧时，曾“发了一个电报给蒋公‘我不会辱及我的乡先贤文信国公’，请他放心。同时也想到文天祥最后所留的几句话：‘孔曰成仁，孟曰取义，惟其义尽，所以仁至；读圣贤书，所学何事，而今而后，庶几无愧。’在这时，我的三个旧部……也暗中做了准备，到时与我同归于尽，不让庐陵自文天祥（文山〕以后，五百年才出我这样的一个人物做俘虏。这是以后他们才告诉我的，我认为他们真是我的心腹干部，为我做精忠报国的准备，不料后来一纸命令，又把我调到蚌埠，当淮河西岸大军南撤的时候，照一般作战原则，是高级司令部先行后移，而我这次恰相反，为着镇定人心，只留我和一个团在蚌埠，等于总司令担任前哨。此时铁路常断，飞机已去，交通工具缺乏，我们等了很久，可是匪又不来；所以才留下这一条早已由光辉而趋于暗淡的生命，到今天来写这篇简略的回忆录，实在感慨万端！我前面说过：‘真正的生命，是建筑在生命的价值上。’而今国家如此，偷生何益？一个革命军人，纵然曾立大功，而不能马革裹尸，到头来还难于自寻死所，其悲痛可知。”
010.王仲廉人死书活.txt	16	11	故事|有一次|说	九、他写宁汉分裂时，“有一次在汉口跑马场开人民大会，武汉政府徐谦登台演讲，正大声疾呼打倒总司令蒋公时，说话用力过猛，满口假牙，全部吐落台下。全场听众哄然大笑，连共产党徒都说不吉利。这是武汉政府不祥之兆！在台上演讲的徐谦，弄得张口结舌，只好鞠躬下台了事。有些民众还说：这是触犯天怒人怨，给以应得惩戒呢！”这个有趣的故事，可以看出这些革命家的迷信观念。
001.现代史辨伪方法论.txt	18	10	结果|最后|问|逼	编号/报章杂志/日期/标题/称呼/次数 001/大公报/二十二年11月22日/闽省各机关撤除中山遗像遗嘱/闽变/4 002/大公报/二十二年11月22日/闽变之种种疑点/闽变/1 003/三民主义月刊/二十二年11月22日/西南执行部为闽变致海内外各级党部之养电/闽变/1 004/三民主义月刊/二十二年11月22日/胡汉民先生等为闽变复陈铭枢等之养电/闽变/1 005/政治评论/二十二年11月22日/闽变结果当如何？（中）/闽变/1 006/大公报/二十二年11月23日/中央昨晚有重要会议/闽变/5 007/大公报/二十二年11月23日/从国际形势论中国革命问题/闽变/2 008/大公报/二十二年11月24日/告剿匪将士及全国各军长官书/闽变/3 009/大公报/二十二年11月24日/通电全国声讨陈李/闽变/1 010/大公报/二十二年11月24日/对闽侧重政治解决/闽变/7 011/大公报/二十二年11月24日/闽变与华北/闽变/5 012/大公报/二十二年11月25日/党的统一/闽变/1 013/大公报/二十二年11月25日/中央部队开浙增防/闽变/1 014/大公报/二十二年11月25日/应付闽变/闽变/2 015/大公报/二十二年11月25日/闽变与鄂桂/闽变/3 016/大公报/二十二年11月25日/本市新闻/闽变/1 017/大公报/二十二年11月26日/侨委会为闽变发告海外同胞书/闽变/2 018/大公报/二十二年11月26日/赣匪乘闽变北攻被击退/闽变/5 019/大公报/二十二年11月26日/中宣会发表告全国同胞同志书/闽变/1 020/大公报/二十二年11月26日/从历史上观闽变/闽变/5 021/大公报/二十二年11月26日/南京25日电/闽变/1 022/国闻周报/二十二年11月27日/闽变始记/闽变/18 023/国闻周报/二十二年11月27日/一周大事日记/闽变/2 024/国闻周报/二十二年11月27日/编辑后记/闽变/2 025/大公报/二十二年11月27日/董霖林紫贵报告闽变/闽变/3 026/大公报/二十二年11月27日/对闽军事殆不
001.现代史辨伪方法论.txt	366	10	传说|说	“政界传说闽日勾结成功，当‘人民政府’成立时，台湾总督松井即派遣大批台兵及军舰赴闽，藉保侨为名，暗助陈铭枢，嗣东京外交界以闽方有联共嫌疑，故力主慎重，遂未实现，松井现又派须磨二十九日由台赴闽，与陈等接洽。”
001.现代史辨伪方法论.txt	439	10	最后|答|说|胡秋原	总之，这些叛国者最后集中在香港了，胡秋原在香港住不成，遂“被驱逐拿了一点钱走路”。至于这“一点钱”的来历，胡秋原说：“我为那团体一分子，一团体总有点公积金”。这话到掩饰得堂皇。可是，当我看到董显光《蒋总统传》的时候，在第十三章“剿共与闽变”里，我恍然对这“点”“公积金”的来源，得到了答案：
002.论所有的宝全压.txt	204	10	一天|死	八年抗战胜利之后，我们本可和平统一，建设民主富强之国家。不幸国内兵祸继续延长，而且扩大，举世共庆升平，而我国的战争状态还未停止。一个贫弱的国家，流血十年，并且还在流血，我们不亡于日本的侵略，却将亡于自己的内争，这是全国人民不胜痛心，也万难长久忍受的。全国人民都快要活不下去了，国家的地位也一天比一天低落了，由于战争，成千成万的同胞，继续转乎溪壑，散之四方；由于战争，交通阻隔，通货不断膨胀，于是农工失业，工商破产，其他各种职业者，无不朝不保夕。于今社会解体，人心不安，不仅政治改革、经济建设，无从谈起，一切不正常不道德的事件，势将日益蔓延。战争如不停止，同归于尽的惨祸，就在眼前。如果我们再想到不久国际上就要讨论对日和约，那时候曾经为和平而战的中国，竟不能自保国内的和平，不仅合理的要求有被拒绝的可能，也许还要受到意外的挫折。那就连抗战的成果，国家的前程，也都要断送了。全国人民都在饥饿线和死亡线上了，一切不幸的根源，都在战争。因此我们不能不沉痛地发出良心的呼声，要求停止无意义的战争，要求恢复和平和秩序，然后才能以统一团结的力量，完成民主建国的大业。我们对于任何政治派别，均无成见，我们只要求不以武力解决争执，而以谈判实现和平。这种和平呼吁，过去不止一次，而都不免遭到各种困难。然而我们实在活不下去了，我们已顾不到许多了，我们不追溯既往，也希望大家不算旧账，各以检讨别人者检讨自己，以寛恕自己者宽恕别人。我们只是垂涕而道，希望立刻化干戈为玉帛，立刻停止战争，立刻恢复和谈，我们都是有职业的人，决不愿卷入目前政治纠纷的漩涡，我们只求天下太平，安居乐业，我们不能坐视工商百业民族命脉长此毁于内争，不得不起来向各方急亟呼吁，还我和平。且将在此一呼吁发出之后，视各方对于和平之诚意，保留道义的批评之权。我们将不断的呼吁，一旦和平实现，我们的这一运动即宣告终止。不停战，即是灭亡，唯和平才能建国。我们希望全国各地同胞一致起来，以全国舆论的力量，全民良心的感召，以及大公无私的精神和态度，促成和平统一。民主的实现，国家的复兴，在此一举，民族前途，实利赖之。谨此宣言(56)。
004.傅斯年论豪门资本.txt	20	10	笑话|说	五、当政的人，总要有三分文化，他的中国文化，请化学家把他分解到一公忽，也不见踪影的。至于他的外国文化，尽管英国话流畅、交些个美国人（有美国人说，看他交接的是些什么美国人，便知道他是什么人），是绝不登大雅之堂的。至于他的态度，举两件一轻一重的事为例：他大可不请客，既请客，偏无话可说，最客气的待遇，是向你面前夹菜，此之谓喂客，非请客也。胜利后第一次到北平，时常在某家，一日，大燕会，演戏，文武百僚地方绅士毕集，他迟迟而来，来的带着某家之某人，全座骇然，此为胜利后北平人士轻视中央之始。因为当时接收笑话，尚未传遍，这事我只可说到此为止。在高位者，这些是要检点的。
006.廖耀湘殉国了吗？.txt	4	10	说|回忆|蒋介石|廖耀湘	这种刻意的谎言，在三年后，于1981年“国防部”史政局出版的顾祝同《墨三九十自述》中，也一直延续着。顾祝同当时是蒋介石特派去的“监军”，他回忆：“在此一期间，东北方面战局，由于共军林彪所部对沈阳外围连续七次之攻势，已使我军处境日益艰困，兵员物资既日渐耗减，海陆运输又相继中断，而我军据点分散，每遇共军攻击，主力既无法转用，应援又难于到达，以致各点孤军苦守，终将为共军各个击破。国防部有鉴于此，迭令东北‘剿匪总司令’卫立煌，与长春守军郑洞国部，奋力向锦州突围，并令锦州守军范汉杰兵团策应作战，先总统蒋公亦曾于9月杪先飞北平，并电召我前往北平，面授机宜，嘱我飞往沈阳，我于9月26日到达沈阳，会晤卫立煌、廖耀湘等，传达蒋公意旨，其后此一计划终未能彻底实施，遂使锦州于10月15日，先为共军攻陷；长春亦于困守九个月后，于10月19日因第六十军曾泽生部被共军诱降，郑洞国亲率特务团两营，坚守中央银行大楼，苦战至20日午夜，致告陷落。沈阳守军，在锦州战起时，东北剿总以五个军主力由第九兵团司令官廖耀湘统率于10月5日西进，图解锦州之围。至23日进至黑山东北地区，闻锦州已陷，乃复向东转进，其后被共军包围猛击，廖耀湘不幸殉国，战事更形混乱。至11月2日，沈阳为共军所陷，仅第五十二军一部，先期攻克营口，至是乃由海军接运，撤退至天津，东北战事于是完全结束，从此共军林彪所部复转用于华北及华中战场，而全国战局乃益趋严重。”顾祝同这里说“廖耀湘不幸殉国”，全是曲笔也！
008.将军白发征夫泪.txt	5	10	骂|逃|回忆|蒋介石	杜聿明回忆：“我始终认为突围是下策，不会成功的。坐战车一个人走还有可能，但是遗弃官兵，落得万人唾骂。”因此他不肯像胡琏一样坐战车逃亡；另一方面，蒋介石为了表示珍惜部下与将才，也派过飞机去接他出来。据冯亦鲁《徐蚌会战见闻录》：“当局为体念杜氏之病体辛劳，曾派机师二人，驾驶联络机一架，冒险降落青龙集机场，以冀接载杜氏回后方休养，但杜氏因为战事正炽，不忍于危难中抛弃其麾下的健儿们，独善其身地飞去，是故迟迟不肯登机。”
009.黄维一直未屈服？.txt	6	10	说|死|蒋介石|黄维	黄维在1975年被共产党特赦，共产党为他安排出路，当上中国人民政治协商会议全国委员会文史资料研究委员会专员，又升为第五届、第六届政协常务委员，以至死去，可见《联合报》寇维勇所谓“黄维一直未屈服，是少数不受中共欢迎的人物之一”的说法，只是妙笔生花，并非事实。黄维且在大陆发表《第十二兵团被歼纪要》等文章，大掀“蒋介石发动全面内战”的底，并说自己“走上新生之路”，更可证明他并非“一直未屈服”，也非“少数不受中共欢迎的人物之一”。黄维不但屈服了，并且洗面革心，再也不干他妈的国民党了。
010.王仲廉人死书活.txt	15	10	后来|说|死|王仲廉	八、黄埔总队长严重（立三）是他老师。“严老师生活很严肃，尤其能做慎独功夫，每天工作八小时以上，夜间还要读书一小时，方就寝休息。因此我必须注意他的生活起居，将应办的事，写在黑板上及日记簿上，及时提供其备忘。书架上书籍，一一整理编号，只要阅读，随手可得。更可笑者，一日晚间，我将洗澡水及需要替换的衬衣，叫勤务兵准备好，请他洗澡，他竟忘了。我提醒他三天没有洗澡了，不洗澡怎能消除疲劳呢？他才想起洗澡。由此可见到他公而忘私的精神，令人敬佩。我做人做事，受其影响甚大。严老师是同学们最景仰的一位。民国二十九年春，我因公赴渝，途经宜昌，当时严老师代理湖北省主席，驻宜昌，遂往拜谒。他留我便餐。他平时规定一菜一汤，因留我吃饭，特别破例，增加一盘炒蛋，足证其生活之俭朴。并嘱我官久自富，不要贪污（其实我做八十五军军长，不管各师经费，也无污可贪）。可见他律己之严，是名副其实的良师。”后来严重做代理湖北省主席时，王仲廉去谒见老师，“严师规定每餐一菜一汤，因留仲廉吃饭，特别交代加一盘炒鸡蛋以示优待。”到了1942年，陈诚告诉王仲廉，说严重“他力疾从公，营养不足，是饥死的”。
001.现代史辨伪方法论.txt	279	9	说|死|胡秋原	第一、我先要说：所谓“仿佛要自诉人偿命”云云，不是事实，至多只是胡秋原自己神智不清的“仿佛”。因为事实上，我只是澄清历史真相，并没叫谁“偿命”。并且，胡秋原即使天良发现要去“偿命”，也是“一死不足蔽其辜”的！
001.现代史辨伪方法论.txt	324	9	说|死|胡秋原	上面随手所举的这些血淋淋的铁证，就是胡秋原所谓的“未经流血”！胡秋原诬赖我对他“鼓噪威胁”、“存心诽谤”，说我“妄自杜撰”“死难军民”。现在这些铁证都摆在上面了，我还要再说一次——
001.现代史辨伪方法论.txt	418	9	说|死|枪毙	日本兵可以登陆，中央军登陆就不行，就要被枪毙。（请注意本文前面所引一月十五日大公报福州十四日下午八时三十分专电中所说“昨日傍晚，〔中央军〕海军陆战队约三百人，拟入城维持秩序，为城中十九路军枪击，死二人，伤二人。”的消息，及一月二十号大公报中央社上海电记陈绍宽海军登陆死伤“约百人以内”的谈话。可见十三号傍晚——日本军队登陆后第二天的傍晚，中央军还没登陆成功。）
002.论所有的宝全压.txt	24	9	说|回忆|胡秋原	当然了，这是胡秋原“向左转”的滥觞，他受到“称赞”，不是因为他的黄陂土话，而是因为他的“文章”。也许，可以这么说，这是一个可怕的开始。因为从此以后，许多又臭又长的大文，便和胡秋原结了不解缘，——可怜的中国知识界，便开始被胡搅蛮缠了！再看他的另一段回忆：
002.论所有的宝全压.txt	114	9	说|骗|胡秋原	我抄到这里，我真忍不住我内心的悲愤！悲愤的重点是：胡秋原为了替苏联的野心做掩护，竟不惜用他“侨寓一年半之久”的身分，恶毒的欺骗同胞。我所以用恶毒的欺骗这种字样，是因为胡秋原曾明明说他早在“侨寓”时，就已了解苏联的野心了！
002.论所有的宝全压.txt	233	9	最后|说|逃	不管怎么说，胡立法委员自从逃出大陆后，似乎慢慢又生气勃勃起来了！他开始做“最迟的反共者”和“最后的反共者”，他写信给曾经帮他中伤李敖的另一立委钱纳水，气冲斗牛地说：
003.周恩来上街卖报了吗？.txt	6	9	答|蒋介石|周恩来	“新四军”虽然被蒋介石承认，但是也要去之而后快。首先，他要“新四军”搬家，先把在长江以南生根的搬到江北，然后再同原来在江北的一道搬到黄河以北。1940年12月9日，他下令凡在长江以南的“新四军”，限于本年年底开到长江以北地区，明年1月31日以前，开到黄河以北地区作战。这道命令式的通知只是一个形式，事实上，在蒋介石跟周恩来谈判期间，“新四军”已开始北移。到了1940年12月下旬，在江南人马只剩一万人了。蒋介石叫顾祝同为这一万人画好搬家路线，如果照这条路线迁移，则一万人正好进入重炮重兵的日军口里。因此“新四军”要求改变路线，周恩来再度去跟蒋介石谈判，要求更改，蒋介石答应了。双方皆大欢喜之际，12月25日那天，蒋介石还特请周恩来共进圣诞大餐。
003.周恩来上街卖报了吗？.txt	8	9	死|骗|冤|蒋介石|周恩来	蒋介石不但快刀斩乱麻式的解决了“新四军”，并且封锁消息，不但自己的报纸不刊载真相，也不准在重庆的共产党机关报《新华日报》刊载真相。由于国民党派有常驻人员在《新华日报》负责新闻检查，所以，共产党想发出消息，就不得不动动手脚。那年1月11日，周恩来在《新华日报》创刊三周年庆祝大会上讲话，收到“新四军”惨遭牺牲的消息，第二天的报上，就被禁止登出讲话全文，几经交涉之下，骗得国民党同意以掩耳盗铃法解决，即“新四军”改为“新X军”“国民党反动派重重包围”改为“敌人重重包围”等字样后，获准出报。1月17日，蒋介石正式宣告“新四军”为“叛军”，取消番号，并将军长叶挺交付军法审判，同时进一步封锁《新华日报》。周恩来乃下令当晚《新华日报》单独为检查人员出一版样，上面没有违禁文字，同时在正式出报时，上面却刊出周恩来的题词：——“为江南死国难者致哀！”“千古奇冤，江南一叶，同室操戈，相煎何急！”1月18日早上4点钟出报后，这一新闻，便散开了。
004.傅斯年论豪门资本.txt	5	9	说|死|傅斯年	既然自吹起全集，自吹“已完成最精审完善的整理”，且由有“中央研究院”院士头衔的“陈槃主其事”，那么就不该遗漏傅斯年的重要文章，像1947年2月22日刊于《世纪评论》第八期的《宋子文的失败》、像1947年3月1日刊于《观察》第二卷第一期的《论豪门资本之必须铲除》等文，都一一遗漏，这样的全集，显然全不及格！而所谓“遗著尽备于此”，也全是谎话！说这些文章找不到吗？在“中央研究院”方圆之内，就不难“寻觅”，只是伪学人们太无知、太不用功、太懒惰、且又把持资料“占着茅坑不拉屎”耳！整个“中央研究院”和它的学人，找资料本领竟不如一李敖，岂不丢死人哉？
004.傅斯年论豪门资本.txt	11	9	说|曰|死	国民政府自从广东打出来以后，曾办了两件大事：一、打倒军阀（这也是就大体说）；二、抗战胜利。至于说到政治，如果不承认失败，是谁也不相信的。政治的失败不止一事，而用这样的行政院长，前有孔祥熙，后有宋子文，真是不可救药的事。现在社会上若干人士，对于政府的忍耐，实在没有一个人可以忍耐现状，而是由于看到远景，怕更大的混乱，再死上几千万人，彻底的毁产，交通断绝，农业解体，分崩离析，弄出一个五胡十六国的局面，国家更不能有自由独立的希望。然而一般的人总是看现状不看远景的，看当前的政治，不看过去的功劳的，所以美英法政府，今天都不是他们抗战时代的组织。即是能看远景的少数人，久而久之，完全失望，彻底觉得在“魔鬼和大海之间”，也只有等死而已。书曰：“为政不于常，道善则得之，不善则失之矣。”
004.傅斯年论豪门资本.txt	28	9	最后|说|死	孔宋失败的第一个原因，由于他的“清廉”程度，孔则细大不捐，直接间接，宋则我生你死，公私一齐搅乱来把持；前者贪欲过于支配欲，后者支配欲过于贪欲。虽然形状这样不同，而有好多相同之点，从所以得地位算起，一，二，三……我今天只说一件，就是两个人绝对是以买卖为灵魂的，绝对相信他所相信那一种形态的自由买卖，尤其显著的色彩是自由在己，买卖在公。抗战时期，孔当政，大家要管制经济，孔连说不行、不行、不行，是要管制，还有买卖吗？没有买卖，还有国家吗？……诸如此类。等到蒋主席也要管制了，大家吵得凶了，他是官僚派，也说管制，但心里全不如此，面从背违，弄得一阵一阵紊乱。最后还说，你看，原来不该管制的。美国人借我们一批黄金，本是救济财政危机的，一到他手，便成他的续命汤。他拿来一文不值半文钱一卖，有钱者皆大欢喜，强心针成了刺激物价市场的扰乱品。黄金如此，外汇亦然。宋也是根本相信自由买卖的。相信国家的钱不该给人的（这倒是对的，可惜不一般应用），自己有兴趣的事和人，却另当别论。他的自由买卖的原则，在理论和实际上是这样：（一）中国人谈不到管制，凡谈管制的都不是财政政策。（二）理想的财政经济，是Sound business，如第一次世界大战前的美国共和党的观念。（三）自由买卖在我是绝对的，我爱买你的什么，你便须卖什么；我爱卖国家的什么，我就卖什么。（四）财政政策必须基于经济政策之观念，他是没有的，而且他根本没有经济政策，只是对外买卖，我来控制一切外来物资和钱钞，无论是买的、借的或捐的。在这样的理论和实际之下，今天的财政现象经济现象是必然的。平情说，自由经济，在中国不可能，因为并不是企业发达的国家。一切都管，在中国也不可能，因为中国并没有社会组织的经验。在战时、在今天，最好是干干净净的坚强不移的管制几项生活必需品：一面不取全盘自由，一面也不要样样管制。偏偏孔宋那样的“自由”，而一切管制论者，又妄向苏联的办法看齐，忘了国体社会全不同，适足以助宋之自信与藐视。新方案是要管制了，宋的“哲学”失败了。但是，你赶着驴儿去做水牛的事，行吗？
