file	paragraph	score	markers	text
004.傅斯年论豪门资本.txt	30	9	问|说|抓	现在姑且舍经济而论财政。财政是要多收入。中纺公司的组织，原与国民党历来标榜的口号“轻工业民营”违背，他的说法，是增加政府收入。去年一年，他平均每月输政府一百亿，全年一千二百亿，今年列的数字是每月三百亿，全年三千六百亿。社会上估计，去年盈余是一万亿，我们姑且说，一万亿之百分之八十八虽不归国，也还归“民”，“藏富于民”，也还是好的。我们就听他这样说吧，“民”哪国哪，只要赚钱便好吧。然而仔细看看，何尝有赚钱这回事？第一、美棉以法价结外汇，在中纺，利益极大；在国家，担负好大外汇。第二、机器（一百五十万锭子）全无代价，房子生财全是拿来的。第三、补充机件，外汇取之裕如。这样算赚钱，以裕财政，欺人乎？欺天乎？政府为他的收入之益，远不如为他外汇担负之害。中纺成立“赚钱”后，大家继续吵，他于是将计就计，说两年后改归民营。两年的说法，算到今年底，即应实现，他的妙法来了，不是各厂合理的分开标售，而是作为一个整单位出售，那么就是说，他的建银又来伸手抓住了。试问这样大组合，用人行政由于他，除非他自己或他一派，谁敢来投资？大凡托拉斯之组织，总是拿别人（小门小户）之钱，做他自己（豪门大户）之用的，只要能取得百分之五十股，便是绝对控制，事实上，有三分之一，也足控制了。分开来卖（公正，不折扣），有人出钱，因为这是利之所在，可以收拢法币远在黄金之上（详下）。一百五十万锭的大组合，世界上还未有，合起来发股票，人存戒心，谁来捐款？这个股票说，和他要接收德商颜料商标，是他目前的两个大阴谋，仍是那些由经济委员会而中国银行而姓了宋的故技（看《观察》所载一文）国人要事先严防，击碎他，更该是清算他的建银。
005.谁删减了《吴铁城回忆录》？.txt	5	9	说|回忆|吴铁城	我是神通广大的历史家，在一个偶然的机会，居然被我搜集到有关《吴铁城回忆录》的残卷，其中居然留有第十二章中第三节“初次行宪”一篇稿本！由此可见，吴幼林所说“仅至五章而止”的话,是不确实的；已行世的版本中所说，第七章以后“章目虽具，文字则尚未撰写”的话，也是不确实的。既然明明有第十二章第三节的稿本流入李敖手中，又安知没有别的稿本呢？
005.谁删减了《吴铁城回忆录》？.txt	25	9	一天	选举指导委员会成立于三十六年的夏天，首先的工作，为拟订选举指导办法草案。当提到常会讨论的时候，各方意见纷纭，经常会推定陈立夫等同志审查，并指定陈同志为召集人。不知怎的这个重要的审查案，竟被搁置了几近两个月，而实行选举的时间，一天一天接近了。同时各省市党部已纷纷自动起来，办理党员参加竞选事项。其在中央服务的同志，亦多接到原籍省市党部所制发的参加竞选报名表，大家都莫名其妙。我是中央党部的幕僚长，为分明责任关系，召集了一次临时常会，专门讨论此事。时李宗黄同志发言，对审查小组的延缓进行，倍加谴责。嗣由常会责成陈立夫同志限期审查竣事，呈报常会。然而为此已延搁了许多时日，影响了选举的进行。
006.廖耀湘殉国了吗？.txt	3	9	说|死|廖耀湘	廖耀湘死后，他的部下亲友出了一本《廖耀湘将军逝世十周年纪念专辑》（1978年编印），他们在书中刻意谎言他的下场，如谢冰莹、黄振华、陈维纶说他“殉国”，舒适存说他“被俘不屈死”，刘建章说他“终以不屈死”，何福祥说他“以不屈死”，这都是错误的。事实上，廖耀湘不但没“殉国”，并且在出狱后，出任政协文史资料研究委员会专员、四届政协全国委员会委员。身死之后，共产党还为他和溥仪、王耀武一齐开追悼会呢！可见他前半生是中华民国的军人，死前却是中华人民共和国的循吏！所谓“殉国”与不屈而死，都是假的。
001.现代史辨伪方法论.txt	280	8	说|死	第二、“闽变”发生后，中央派陆海空三军讨逆，历时两月，军民怎么会没有死伤（其中当然还包括十九路军里的被胁从的将士）？若说“未经流血战争”，简直不合常识的判断！好在“闽变”讨逆的将军们人证俱在，我已做《申请调查证据状》，请蒋鼎文、孙连仲、刘子清三位将军出庭作证，看看到底有“流血战争”没有？
001.现代史辨伪方法论.txt	393	8	说|杀	“闽变”叛国开始后，所谓“人民政府”中，“文化委员会”是一个热衙门，这个伪机构刚一成立，就使出一条杀手锏，二十二年十二月九日申报“教育消息”上说：
001.现代史辨伪方法论.txt	423	8	说|逃	海军的迅速行动，及宁愿“顾虑外交关系”而纵使逆军逃走的方法，使这次“变”的终场未曾转化成外患，所以一月十四日的大公报以“福州收复”为短评说：
001.现代史辨伪方法论.txt	432	8	说|胡秋原	胡秋原说日军因他们的缘故“不敢登陆”，因而“使中央军好好接收”，事实也不是这样。中央军接收时是花了“流血”的代价的！登陆前倒真是被叛军“发生射击”过的！当时日本军队却早已先中央军上了岸，可以参观叛国者们开枪打登陆时的中央军！
001.现代史辨伪方法论.txt	438	8	说|逃	雷啸岑在《卅年动乱中国》里，用“自信绝无偏诬的意念”，对所谓“人民政府”“要员”们的逃亡，加以记述。他写“王礼锡、梅龚彬、刘叔牟”等人，在《蒋鼎文所率讨逆军进至距福州城三十里地方》的时候，因逃难不成，束手无策。“到夜半，忽有日本驻福州领事馆的职员来”，“引导诸显贵赴一日本旅馆休息。众客惊魂甫定，日领事张盛筵以相款待，旨酒佳肴之外，尚有日本女子十数人，艳装倩影，殷勤侑觞”云云，这段经过，书中说得很详细，我不必细引了。
002.论所有的宝全压.txt	36	8	说|杀	这是一个滥杀世界。想到这一切，我对国家观念变了。国家不爱我，我何必爱它？我更觉政治可怕。从前有人说“吃人的礼教”，现在有“吃人的政治”，“吃人的革命”。今春以来我已经消沉的心，至是更趋于消沉了。我决定今后专门读点书算了⑨。
002.论所有的宝全压.txt	129	8	说|胡秋原	上面这些触目惊心的文证，没有一句不证明了胡秋原用心的阴险，行文的荒谬，没有一句不证明了他那助长赤焰的罪孽。以这样一个罪孽多端的人，居然敢在撰写那些荒唐文字之后十余年，俨然以反共先觉的姿态出现，说他当年“发现”这个，“瞿然”那个，好像别的反共人士是傻子呆瓜，只有他才是先知一般。这种人，如今若再被人捧为大儒大师，这种捧他的人，可真太天真了吧？
002.论所有的宝全压.txt	212	8	最后|说|回忆|胡秋原	这四条公约，要求“终止以武力从事政争”，“不偏不袒”云云，还不是“中立”而袒共的味道？最后，这个运动据胡秋原说，“竟遇意料不及之困难，发起人乃公决停止。”第二年，胡秋原开始回忆：
002.论所有的宝全压.txt	215	8	说|胡秋原	可笑的是，当胡秋原同我打官司的时候，却说他“虽未对俄帝一直‘大声批评’下去，但从未放下批评，诸如发起和平运动”(60)云云。这完全是胡扯，因为那次“和平运动”根本没提“俄帝”半个字！这是他到台湾后幻想出来的“批评”。他又说“和平运动是一反共抗俄运动”(61)，证明方法是“有原来宣言可以为证”，他又说目前在台的钱纳水可以为证。这些话，统统都是大言欺人！他说“和平”宣言“见《世纪中文录》上卷三十三页”，“李某读过”，“乃亦故做不知，强为混淆栽诬”云云。不错，我是读过那个宣言，可惜的是，我读的那个宣言是“原本”，不是胡秋原收在《世纪中文录》里的那个被他追忆默写的“节本”，所以内容方面大相径庭！这个“原本”我已找出来，收在前面，明眼的人，一看就知道胡秋原前后所说的、所解释的，是不是矛盾的、对立的，前后对照之下，自然一切都大白了！
002.论所有的宝全压.txt	348	8	不料|结果|问|说	党德败坏，是与党纪的败坏互为因果的。虽然我们也屡次注意到了党纪问题，但本党的传统是以情感与道义为其基础的，而不是专以纪律为强党的凭借，所以自总理建党以来，总是允许党员悔过迁善，而开以自新之路。这是本党一个最优良的传统，可是这个传统，为党中干部所曲解的结果，遂至于是非不明、善恶不辨，乃至敌我不分，甚至引敌为友、以党为敌，而尚不自悟，这样党德败坏、党纪扫地的党，焉得而不由失败而消灭的道理！例如在立法院有一党员，在平时对敌人、对俄共批评的理论亦有较佳表现，可知他对“革命”与“民主”的道理，亦必有相当的认识与辨别，所以政府乃派他为联合国代表团顾问，不料一到了本党反共政策成败的关头，他反转来对党攻击诋毁，比他对敌人俄共的抨击还要厉害。最奇怪的，就是他在前年出席联合国大会以后，经过伦敦的时候，还接受共匪代表特别的招待，并与共匪代表密切联络交谈不止一次，这是怎么回事？哪知他的理论是反共，而他的行动至少是近于亲共，却与其平时反共论完全相反。现在姑且不问他是否为一个党员，只算他是政府派出去的一位代表和立法委员，他未经政府和立法院许可，居然与敌人做这样的勾搭，皆为情理法所不能容的！可是这一位身为立法委员和党员的，回来已经两年有余，他是否已向立法院有所声辩说明，我不得而知。但本党对此案在评议会检举之后，乃并无下文，我真想不到我们的党纪败坏到这个地步，而尚无人过问，这样还讲什么立法、还有什么党纪可言呢？
004.傅斯年论豪门资本.txt	29	8	问|死	财政政策必须以经济政策为基础，没有经济政策的财政政策是无根的。无论宋与孔，有经济政策吗？接收日本工业，应付沦陷区工业，无论官营民营，总要不让他大家关门。因为他只想收入，不想经济，除把有利的拿去外（如中纺）便任其死灭，经济走了绝路，财政必然也走绝路的。当胜利后，后方工业家要求这个那个，大都也是想分赃的；又有些人要分敌伪工厂，也是为私的，宋子文不给他们，可以，但须拿出一个办法来。这办法并不难，就是不要拆散日本人的生产系统，使各单位不存在，也不必组大托拉斯，如中纺。由政府收购其制造品，货有定价，样有标准。这当然选择若干主要的工业，不是一切都买，而且不行的厂也可天然淘汰。这样也许有贴补性质，但比起贷款来好得多。因为贷款不特不足以助工业的生存，反而助长囤积，助长黄金外汇的投机，这次黄金潮，其中用来的资本，不少国家行局借出去的。收购成品自然赔钱，但工业家维持着，能吸收游资，不会一翻几倍，弄得连印钞票都不够本。总而言之，只要工业能吸收游资，多发钞票影响小的。如不吸收，乃至根本崩溃，游资必使物价一翻一翻的转去。1923年沙赫特能把德国崩溃的经济转捩来，还不是在工业上着眼？他对于工业，漠不关心，真正到极点了，就是连印钞票的工业也不在乎。钞票要送美国印，因为要“好看”，其实土印钞票在今天价值上也够“好看”了，也许国货钞票贵，但总省了外汇，又省了运费保险。他对于正当用途的外汇是紧得可怕的，但是对于他发生兴趣的外汇，他又满不在乎。又如久大永利的工业，是些规矩人办的，是很替国家争面子的，因为他无利益，不予协助，反而摧残，这等于摧残国民经济。问题是这样，如果永利投到建设银公司的门下（宋家的托拉斯神经中枢），一切问题都解决了。他对于经济无知与私心，是使中国经济非总崩溃不可的。经济崩溃了，还有什么财政？
004.傅斯年论豪门资本.txt	52	8	说|死	宋也“为国家”营了一件“赚钱”的事，就是中纺公司。那些反对他这事的，本也多是要白接收（“抗战工业或非工业家”），又请流动金的，并不可取，然而他营的成绩如何？号称去年一月一百亿归政府，今年一月三百亿，算是赚钱了吧？然而想想，一百五十万纱锭，全无代价，一切生财，是接收的，美棉用官价结，数目那样大，消耗外汇那样多，如是报效政府仅仅此数，真是得不偿失，这叫赚钱吗？说是平抑纱价吗？又不然，纱布价在生活必需品指数上为先锋。他又说了，中纺只占百分之四十，商家涨了，他无法控制，这真左右前后均不能自圆其说了。年底分红那么大，是有益于国？假如当年把这一百五十万锭卖了，不白送人，法币回笼，要比黄金政策多得多，纱价还不是一样高，反正他自己说他不能控制。还有一妙，因为“人民”为此事吵死，他又说，将来发股票卖给人。假如分开卖，有人买的。现在合成一个托拉斯，他捷足先登控制着，谁来买他，买就是捐款给他，这不又是自欺欺人之谈么？
006.廖耀湘殉国了吗？.txt	8	8	逼|回忆|蒋介石|廖耀湘	正因为蒋介石有这种“锦上添花”的锦州好梦，所以，照廖耀湘的参谋长杨焜《辽西战役补述》的回忆：“10月15日锦州解放了，蒋介石还是一再催逼廖迅速向锦州前进，还梦想与东进的国民党军会师恢复锦州呢！”
007.你淮海，我徐蚌.txt	3	8	后来|说|回忆|蒋介石	这一战役以徐州为中心，东起海州、西到商丘、北抵临城、南达淮河的广大地区。在战役之初，蒋介石派出刘峙做总司令。当时国民党内部议论纷纷说：“徐州是南京的大门，应派一员虎将把守；不派一虎，也应派一狗看门；今只派一猪，眼看大门会守不住。”其实，所有的仗，都由“最高统帅”越级指挥，派哪一种动物都一样。刘峙在兵败后亡命南洋，替老婆代课做小学教员，后来写《我的回忆》一书，轻怨薄怒，有以申述，读来令人又好气又好笑。
007.你淮海，我徐蚌.txt	5	8	最后|死|回忆|蒋介石	从刘总司令这一回忆中，我们依稀看到他的三个旧部是准备把他干掉，“强迫”做文天祥的：蒋介石把“总司令担任前哨”，只留一个团保护他，足证也是要他做文天祥的。美中不足的是，共产党竟放他一马，不给他做文天祥机会，于是，国民党的文天祥，最后只好另寻死所，寿终台湾了。
008.将军白发征夫泪.txt	2	8	说|回忆	今天（1989年1月10日）是“淮海战役”（共产党说法）或“徐蚌会战”（国民党说法）四十周年。这一战役，使南京门户大开，以致国民党放弃“首都”，“流亡”台湾，可见其重要。在战役中，国民党副总司令杜聿明战败被俘。多年以后，他偶有雪泥鸿爪式的回忆，读来颇足警世。
009.黄维一直未屈服？.txt	2	8	说|黄维	3月22日《联合报》登“记者寇维勇北平21日电”，说“前国军军团司令，1949年因徐蚌会战失利被俘一直不愿屈服的高级将领黄维，昨天清晨三点因心脏病逝世，享年八十五岁。黄维是目前大陆仅存的军团司令级国军高级将领，黄埔一期毕业，历任师长、军长，曾参加八一三淞沪战役。在剿共战役中率精锐机械化军团，是沦陷前国军的主力部队。1949年初徐蚌会战失利，黄百韬、邱清泉相继兵败殉国，黄维率军团驰援，也因受围被俘。大陆沦陷后，黄维一直未屈服，是少数不受中共欢迎的人物之一。”看了这条新闻，我心里想，国民党又朝自己脸上贴金了、又给它自己的降将大施脂粉了。
010.王仲廉人死书活.txt	5	8	说|死	对今日台湾说来，上面这种照例，只不过极普通的一件“老贼之死”事件。但是，对我这种思想家历史家说来，我却每每趁机做点“机会教育”，使中国人民多知道一点他们的荣辱与经历，也算没让他们白活白死。
010.王仲廉人死书活.txt	20	8	曰|杀	十三、他写日本鬼子“杀戮我同胞之暴行”如下：“凡在敌寇侵占区内，奸掳烧杀情事，随地可见，尤其处置犯人为最惨酷，先挖一坑，将人犯头部向下，两足朝天，掩土活埋，名之曰‘倒栽葱’。将人犯衣服剥尽，手足捆绑驱犬食之，名之曰‘狗吃活人’。又淋油于人犯衣服之上，以火燃烧后使其行走，再以枪击之，名之曰‘燃天灯’‘打炮’。又有水牢电刑，种种伤心惨目，不可言状。”
010.王仲廉人死书活.txt	21	8	最后|说	十四、他写“鲁西战役”，自己拆穿内幕如下：“鲁西匪区作战，认真来说不能称为鲁西战役，因为本军（第四兵团）既无动员准备，又无行军布阵的行列，根本没有与匪作真面目的战斗，怎能称为鲁西匪区战役呢！但在鲁西整个战场方面，本兵团已被投入战斗的漩涡，只好勉强称为鲁西之战罢了。历经四十载，仍感慨万千，萦回脑际。……”最后，“正准备明日拂晓开始进击之时，突奉到撤职查办来京受审，第四兵团司令官职务交罗广文（三十八年在四川叛变附匪）代理之电令（忘记电字号），当即复电遵办，晚即将进攻刘匪之任务转交给罗广文接替执行，并将兵团司令部及直属部队一并交出。……”
001.现代史辨伪方法论.txt	114	7	结果|说|胡秋原	这里明明白白的说，“闽变”的发生，是“共匪”“策动”的结果；可是胡秋原却硬说：“不能扯到共产党”！“不能捏造增加没有的事情”！
002.论所有的宝全压.txt	39	7	说|骂|胡秋原	当时在上海的租界里，蛰居着不少所谓“亭子间英雄”。他们是一群不得志的急进分子，大都是左倾分子的流派，其中有托洛斯基派、有社会民主主义者，……五花八门，整天挤在一起，骂来骂去。他们之间的最大争执，无非是说别人是冒牌的马克思主义者，只有他们自己圈里的人才是地道的原装货。这些打做一团的局面，全是在马克思偶像前的争风吃醋、争元配、争正统，而当时的胡秋原，也“认真相信”他的“马克思才是真马克思”。他是一个“十分着迷”的马克思主义者。
002.论所有的宝全压.txt	205	7	问|说|胡秋原	这个宣言，胡秋原在编他的《世纪中文录》（胡秋原文集）一书时，找不到了，现在我替他找出来，教他旧梦重温一下。这和平宣言里面，满纸“内争”、“无意义的战争”、“对于任何政治派别，均无成见”、“不以武力解决争执”、“立刻恢复和谈”，请问哪一句不是中立主义者的调子？当时中立主义有利于谁，胡秋原心里还不明白吗？而胡秋原、钱纳水等人发起这项运动的当儿，正是国民党政府发表声明说“中共自绝国人，和谈难望恢复”的时候。其时机，正在一九四六年至一九四八年之间，国民党党方文件中有这样的话：
002.论所有的宝全压.txt	241	7	问|说|胡秋原	这种说法的真实性如何，人人可以自由判断，我不必置一辞。不过有一点，我是可以说的，就是胡秋原说他抗战回国后，“自此与政府共患难，直至今日”一点，未免朝自己脸上搽了白粉，试问不同进退，怎能说是“共患难”？天下有这种“共患难”吗？
002.论所有的宝全压.txt	262	7	说|骂|胡秋原	从上面的一些抽样里，我们不难看到，国民党胡秋原历来的对共产党的观点、对“美帝”的观点、对苏俄的观点，……都是矛盾的、对立的，禁不住检查与比对的。这样一个头脑忽东忽西、作风忽左忽右的人(83)，若说他有眼光、有远见，就未免太可笑了。为什么呢？因为所谓眼光和远见，其实不是眼光和远见，而是“所有的宝全压”：他正面写过捧共产党、捧苏联、骂“美帝”的话；也反面写过骂共产党、骂苏联、捧“美帝”的话，不论是正是反，他全写过，他没有遗漏任何矛盾的、对立的论点。所以，他像压了所有的宝一样，自然永远不会遗漏每一个赢的机会，——但也永远不会遗漏每一个输的机会。他自己只算赢不算输，只算有眼光、有远见的部分，不算看走眼、没见识的部分，这种“先知”，又怎么教人领教呢？这又算哪一门子大言论家大史学家呢？
008.将军白发征夫泪.txt	6	7	死|回忆|蒋介石	事实上，据杜聿明的儿子告诉我，个中原委却是蒋介石、杜聿明师徒二人是有“密码”（秘密意思表示）的，飞机虽然来了，可是“密码”不符，飞来的关怀只是给别人看的，杜聿明是不敢登机的！杜聿明回忆：蒋介石派飞机空投，“首先下来的是近万份的黄百韬‘烈士’纪念册！……我看蒋介石是要我死。”既然底案是要天子门生做文天祥，其他的一切，都一笑可也！
001.现代史辨伪方法论.txt	14	6	说|胡秋原	胡秋原为什么以“史学家”自居却又不守“史法”呢？为什么他明知“官方文书”是称“闽变”的（“补充自诉理由状”），而他自己却偏偏不用这个专有名词呢？这个原因，一句说破了，是因为他“忌讳”这个专有名词，“忌讳”这个“变”——“叛变”！
001.现代史辨伪方法论.txt	24	6	说|胡秋原	胡秋原在《我为什么要提起控诉》中，要我对“所谓‘叛国’的话，负诽谤责任。”他用“所谓‘叛国’”的意思，是否认“闽变”是一种“叛国”行动，并认为我说“闽变”是“叛国”行动，乃是诽谤了他。
001.现代史辨伪方法论.txt	26	6	说|胡秋原	胡秋原为了歪曲历史，竟发出“闽变”不是“叛国”的怪论，先看他的说法。首先，他说他参加“闽变”：
001.现代史辨伪方法论.txt	28	6	说|胡秋原	这分明是说，“闽变”乃是“过去的内政纷争”，不是“叛国”。在这种胡秋原式的前提下，他开始控告我，说我
001.现代史辨伪方法论.txt	78	6	说|胡秋原	如果具有了这些主要条件还不算是“叛国”，还要把它说成单纯的“内政纷争”，这是任何维护真实的知识分子所不能接受的，而参加“叛国”行动的胡秋原，竞还大言不惭的歪曲历史、诬控别人，想陷别人以“诽谤罪”，天下还有比这种更无耻的勾当吗？
001.现代史辨伪方法论.txt	102	6	说|胡秋原	如果上面这些证件还不能使胡秋原在真理面前屈服，收回他那“闽变”不是“叛国”的谎话，那我就要再说他一声“无耻”!
001.现代史辨伪方法论.txt	111	6	说|胡秋原	读了这段文告，尤其是文告中“共党代表及彭德怀之妻妇滞留福州”等话，可知胡秋原所谓的“不能扯到共产党”，实在是道道地地的谎话，他说“不能捏造增加没有的事情”，他是不是认为“共党代表及彭德怀之妻妇滞留福州”等“事情”是“捏造增加”？
001.现代史辨伪方法论.txt	132	6	说|胡秋原	这里“合兵北犯”、“共同联络”、“屏障闽北”等事实，是不是“夹击中央军”的战略？可是胡秋原却大声说：“十九路军断无与共军夹击中央军之事”!
001.现代史辨伪方法论.txt	326	6	死|胡秋原	他们为了维护国本，讨伐叛逆，死于疆场，竟连个起码的“无名英雄”的谥号都得不到了！因为在“闽变”余孽胡秋原的口中，或在所谓“史学家”胡秋原的笔下，这些人们都成了“未经流血”的烈士！被李敖“妄自杜撰”出来的烈士！这不是大悲哀吗？正是——
001.现代史辨伪方法论.txt	391	6	说|胡秋原	这些“独立”、“革命”等字样，跟蔡廷锴在自传中所谓的“人民革命运动”实在有点相像。至于美国，对这次叛变则直称为“闽变”（Fukien revolt），见Foreign Relations of the United States，Volume 4.另外如Chronology of President Chiang Kai-shek等书也用revolt及rebellion等定称。胡秋原说revolt不是“叛变”，我不知道他的英文是从哪儿学来的。
