id,book,book_slug,title,source_ids,source_file,source_lines,char_count,story_text
LAYH020,李敖有话说,li_ao_youhuashuo,狙公朝三暮四,062#P9,062.2004-06-01：狗套加身看你还闹.txt,17-17,535,这使我们想到什么一个故事呢？就是《庄子》里面的故事。大家看，《庄子-齐物》里面有一个故事：狙公（养猴子的老先生）要给猴子东西吃，就跟猴子说：早上给你三个，晚上给你们四个果子，干不干？所有的猴子都生气了，不干。然后，这个老头子说：早上给四个，晚给三个，干不干？所有的猴子都高兴。我们今天讲的词汇“朝三暮四”，大家觉得这个人反复无常，叫“朝三暮四”，这个词汇在变的。像美国大法官霍姆斯讲，美国宪法是在改变的。不但宪法在改变，语言也在改变。我曾经举过例子，好比说，这个人很风流，这两个字在今天有点挖苦人的意思。可是古代是好的，吾爱孟夫子，风流天下闻。风流是好的字眼。还有今天说小姐你请坐，小姐你好吗？可在宋朝“小姐”就是骂人的，因为这个词儿啊在宋朝是指妓女，所以你称呼她“小姐”就是骂人。词汇本身在改变，有的由好变坏，好比说“风流”两个字；有的由坏变好，好比说“小姐”两个字。同样的，可以看到“朝三暮四”这个成语啊，根本变得不是原来的意思了。今天的朝三暮四，是我们说这个人反复无常，可是古代的“朝三暮四”的意思就是养猴子，一天一共给你七个果子，早上给三个，晚上给四个，它就不干；早上给四个，晚上给三个，大家都干，它就高兴，为什么呢？猴子不会算这个帐，它不晓得加在一起还是七个。
LAYH021,李敖有话说,li_ao_youhuashuo,动物农庄里猪统治农庄,066#P2,066.2004-06-07：为什么总在警局自杀？.txt,3-3,181,英国有一个有名的作家，叫做乔治·奥威尔，他写过一部书，叫做《动物农庄》。这个书的故事大概是说：农庄里面的一群动物，它们开始革命。革谁的命呢？革人类的命。把人类赶走了，这些动物统治了这个农庄。然后，猪搞了小组织，怎么样地欺负马，怎么样欺负这个欺负那个。然后，这个农庄被猪统治了，它们的做法跟人完全一样。整个故事就是讽刺在政权变化里面，人类赶跑了，猪来统治这个世界。
LAYH022,李敖有话说,li_ao_youhuashuo,清教徒让别人抗海盗,070#P10,070.2004-06-11：逼着好人上前线.txt,19-19,326,大家看，这富兰克林自传里面，有一个最有趣的事情，就是讲到这些清教徒的事情。当时很多清教徒从欧洲向美洲出发，寻找新的天地，寻找新的生活，寻找新的安身立命的所在。那时候，从欧洲到美洲要坐船。当时没有轮船，只有帆船，那个船走得很慢。有一次，前面看到了海盗船，海盗要抢他们这个船。这时候，这些清教徒都吓得跑到船舱底下去了。他们下去以后呢，把他们的仆人都留在上面，或者不信他们清教徒的这种宗教的这些人留在上面，说：“我们清教徒，是和平主义者。我们是不打仗的，我们是不打架的。我们是反对战争的，我们是不动刀枪的。可是，你们不信我们的宗教，你们要为我们去战争，去打架，去保护我们。所以，你们不要到下面藏起来，我们藏起来，你们要在上面用战争的方法跟海盗作战来保护我们。
LAYH023,李敖有话说,li_ao_youhuashuo,混沌被凿七窍而死,071#P5,071.2004-06-14：一窍不通就为长生不老.txt,9-9,308,我给大家讲个故事，在中国的《庄子》里面讲到三个神，一个是南海之帝，一个是北海之帝，一个是中央之帝。中央这个帝叫做混沌。这个混沌是怎样的一个神呢？他没有眼睛、没有耳朵、没有鼻子、没有嘴巴，像个鸡蛋一样的这么一个神。可是他对朋友非常的好，结果南海之帝跟北海之帝想报答混沌对他们的好处，他们就说：人皆有七窍（七个洞），用来看、用来听、用来吃、用来呼吸，混沌（中央之帝）没有七窍，我们给他挖出七个洞来。每天凿一个窍，七天而混沌死——七窍流血而死。《庄子》里面的这个故事告诉我们什么？告诉我们人不要违反自然。他生下来就长得像个鸡蛋一样，没有七个窍，你硬要给他挖七个窍，虽然你是好意，可是你却要了他的命，这是《庄子》里面的寓言。
LAYH024,李敖有话说,li_ao_youhuashuo,庖丁解牛游刃有余,072#P8,072.2004-06-15：找准台湾问题的窍.txt,15-15,299,《庄子》里面有一个故事讲到了疱丁解牛，庖丁等于是一个屠夫，他解牛的时候，他一开始说牛在我眼前，后来他说我目无全牛。庖丁说一般屠户他要换刀，因为用久了以后刀就钝了，。可是我这个庖丁，我的刀用一年都还是像新的一样。什么意思？就是我不用刀跟牛骨头碰，我杀牛的时候刀不会砍到牛骨头。他就说的很清楚，他说好的屠户是一年要换一把刀！菜的屠户每个月换一把刀。为什么？他们刀老是跟骨头相碰，要砍这个骨头，这刀就钝了。我的刀一年了还好好的，原因我游刃有余，我这个刀锋在这里面游泳一样，我碰到的都是节骨眼，都是该进去的那个窍。所以我的刀可以保持这么好，牛被杀的时候都搞不清楚它自己被杀，它就躺下来了，我有这么好的技术。
LAYH025,李敖有话说,li_ao_youhuashuo,庄周梦蝶,075#P2,075.2004-06-18：自欺欺人的大不要脸家.txt,3-3,243,《庄子》里面有个故事，我们看当时严复写的字，他说：遽自是觉貌，就是这种感觉的状态。看他写这个字是错字，礼貌的貌字，你看他这边写的是儿童的儿字，是错的，应该是个白字。很多人写貌字都写错了，都写成了儿字。这里面什么故事呢？讲到庄子做梦，梦里面他变成了很快乐、很自在的蝴蝶。后来梦醒了，庄子问：我做梦的时候，是庄周在梦蝴蝶呢，还是蝴蝶在梦庄周？——我怎么知道我是人呢？我可能根本就是蝴蝶，现在的我，正好是蝴蝶在做梦。这是个很新的观念，到底我现在是人，还是蝴蝶呢？现在的我难道不是蝴蝶在做梦吗？
LAYH026,李敖有话说,li_ao_youhuashuo,三机构抓兔子,077#P12,077.2004-06-22：临阵磨文天祥.txt,23-23,330,我讲个笑话给大家听，美国的中央情报局CIA跟苏联的克格勃KGB，跟台湾的调查局，就类似我刚才讲的吴彰炯将军他们警备总司令部这一类的机构。三个机构想比赛一下能力，任务是：将一只兔子放进树林，看他们如何把兔子抓回来。美国中央情报局派出大批干员进入树林，并对每棵树进行讯问，经过几天的调查，得出结论是：那只所谓的兔子并不存在。然后苏联的克格勃出动人马包围了树林，命令兔子出来投降。可是兔子不出来，于是他们放火烧毁了树林，烧死了林中所有动物，并且拒绝道歉，因为这一切都是兔子的错，不是他们的错。台湾调查局，几名干员进入树林，几分钟以后，拖着一只被打得半死的浣熊走了出来。浣熊嘴里并喊着：OK、OK！我认了，我承认我是兔子。就是抓住浣熊，然后屈打成招，浣熊承认它是兔子。
LAYH027,李敖有话说,li_ao_youhuashuo,守襄阳先哭关公也守不住,079#P7,079.2004-06-24：放水偷生是老康.txt,13-13,78,清朝有一个故事，讲到有一个将军守襄阳，命令派下来以后呢，就大哭，为什么大哭呢？就是襄阳这个地方难守，说当年关老爷关公都守不住，今天要我来守，我怎么守得住呢？
LAYH028,李敖有话说,li_ao_youhuashuo,宗炳卧在床上游山,090#P4,090.2004-07-09：发挥想象力，卧在家中游.txt,7-7,238,《二十四史》的《宋书》有一段讲到宗炳，说宗炳这个人每游山水，往辄忘归（喜欢游山玩水，一去了就不回来），结果呢，旅行的时候生了病，就回到了江陵，叹气说：老疾俱至（我也老了，我也生病了），名山恐难遍睹（天下名山我看不完了）。唯当澄怀观道（只有自己坐在家里，心得感觉重新整理过以后），卧以游之——不能亲自去旅行了，便躺在床上来旅行。凡所游覆（一辈子去的地方），皆图之于室（在房间里面就画出来）。跟别人说，抚琴动操（作曲弹琴），欲令众山皆响（音乐响的时候，图画里去过的山都会跟着动）。
LAYH029,李敖有话说,li_ao_youhuashuo,史怀哲代签爱因斯坦,093#P45,093.2004-07-14：言语妙天下.txt,89-89,267,史怀哲在非洲做医生的时候，在火车里面来了一个女孩子，向他一鞠躬说，爱因斯坦先生，你可不可以为我签名？那个女孩子把史怀哲当成了爱因斯坦了。因为他们两个很像，留着大胡子，头发绕绕的，头发散散的。窘了？为什么呢？他是史怀哲。这个史怀哲多窘啊，可是你看他怎么反应，他为她签了名，签什么？签爱因斯坦，签了爱因斯坦以后下面一个括号，注明：他的朋友史怀哲代签。高段，对不对？替你签了名。可是说我替他签的。把这个窘态啊化掉了，否则那个女孩子也会很窘，史怀哲也会很窘，搞不好被爱因斯坦听到了，爱因斯坦也很窘。可是他这样子这么好的反应，把这个问题化掉了。
LAYH030,李敖有话说,li_ao_youhuashuo,此地无银与隔壁王二,096#P11,096.2004-07-19：政治权谋里的不立文字.txt,21-21,67,钱埋下去以后，他说此地无银三百两，然后隔壁的王二把它偷走了，也写个条子说，隔壁王二没有偷。就是多此一举，反倒因为白纸黑字写出来泄了底。
LAYH031,李敖有话说,li_ao_youhuashuo,俞济时说写半天都是假的,099#P3,099.2004-07-22：虚立文字欺骗历史.txt,5-5,257,台湾有一个非常有名的谈历史掌故传记的杂志，叫做《传记文学》。他在1962年创刊，第五期里面还请我写过文章。现在创办人刘绍棠先生已经走了，杂志还留下来，他办了40年杂志，有一天他给我讲个故事，我听了忍不住笑。他说他碰到蒋介石第一任的侍卫长俞济时将军，俞济时是中将占上将缺。俞济时就跟他笑说，你们办杂志办的很努力，办的也很辛苦，可是，俞济时把手这么一抹，真的你们不知道，你们写了半天都是假的！《传记文学》的老板刘绍棠讲这个故事给我听，我笑，我说俞济时说得真的是正确的。只是他说我李敖这部分是错的，因为我会抓到这个真相。
LAYH032,李敖有话说,li_ao_youhuashuo,三毛卖自己不如假娃娃,116#P7,116.2004-08-16：三毛流浪记.txt,13-13,321,我拿一张三毛的漫画给大家看。这就是三毛，他看到了一个乡下人出来，挑了个挑子。干吗呢？这个农夫把两个小孩放到篮子里面，两个价钱摆出来，女孩大一点，卖七万块，男孩卖五万块。这个三毛离开以后，捡到了一张纸，他在纸上面也写了个字，他也要卖。看到没有？他在旁边，廉价抛售自己，卖一万块。后来农夫睡着了，小孩睡着了，三毛也无精打采地睡着了——卖不掉。农夫把这两个小孩挑走了，三毛满脸悲愤，因为卖一万块也卖不掉。然后三毛就经过了一个儿童玩具店，看到那些假娃娃们，每个卖十万块。他才卖一万，那个假的娃娃就卖十万。三毛看着的时候，一个有钱的妈妈带着小孩出来了，小孩手里就抱着那样的娃娃。大家看，整个画面非常动人地表达出当时这种“朱门酒肉臭，路有冻死骨”的局面。
LAYH033,李敖有话说,li_ao_youhuashuo,扳道工找妹妹看撞车,118#P4,118.2004-08-18：负面情感应归零.txt,7-7,337,铁路局招扳这个switch的工人时，考试的内容就是将很多的情况描述给他，叫他说出来怎么样应变。我们来看看这个笑话。考官就问一个前去求职做扳switch的工人，问题是：“如果你看到两辆火车在同一条铁轨上对开过来了，你怎么办？”这个应考的人说：“我就扳这个手杆，让它南来北往都可以。”然后又问他：“假如这个扳手卡住，扳不动，怎么办？”这个应考的人说：“我就用手使红灯能够亮起来，警告对方。”然后又问：“如果这个红灯也不亮怎么办呢？”他说：“我就拿面红旗，跑到外面去摇，警告火车不要开过来。”接着问题又来了：“如果两边的火车司机都没看到你摇红旗，怎么办呢？”他说：“我就找我妹妹来。”考官就问他：“找你妹妹能干什么？”他说：“虽然不能干什么，可是我妹妺喜欢看热闹，她爱看火车相撞。
LAYH034,李敖有话说,li_ao_youhuashuo,秦失吊老子哭三声,118#P12,118.2004-08-18：负面情感应归零.txt,23-23,274,我们看《庄子》里面的故事：老子死了以后，老子的朋友秦失去吊祭他，三号而出（叫或哭了三声就出来了）。学生问他：“老子不是你的好朋友吗？”他说：“是啊。”学生说：“那他死了，你就这样子来看他，可以吗？可以这样鬼叫三声就完了吗？”他讲出道理来，说：这个老子啊，他来的时候应时而来，走的时候顺理而去。安时而处顺，哀乐不能入也。这才是真正中国古代的哲人老子的气魄，安时而处，该来就来，该走就走，完全合乎自然的现象，死是一种自然现象，为什么难过呢？所以悲哀跟快乐都进不来，秦失这个看法对中国老子做了最大的赞美。他自己应付他的好朋友老子的死，也表达得非常的洒脱。
LAYH035,李敖有话说,li_ao_youhuashuo,兄弟作文同一条狗,178#P9,178.2004-11-10：强势中文浓缩特色.txt,17-17,258,我讲个笑话给大家听，一个老师教两个兄弟作文，作文叫做我家的狗，最后发现了哥哥跟弟弟这作文是一样的，不晓得你抄我的，还是我抄你的，最后老师就问他们，为什么你们作文一样？这个兄弟们说，这狗在我们家里，我们兄弟两个人描写的同一条狗，所以我们的作文是一样的，不发生你抄我，我抄你的问题。这个故事是个笑话，可是极为传神。就是它符合了法国文学家《包法利夫人》作者的标准。什么标准？就是没有同义字。如果描写这个狗，就是这几句话最好的时候，哥哥是这样描写的，弟弟也是这样描写的，因为我们描写的是同一条狗，所以兄弟两个人作文是一样的。
LAYH036,李敖有话说,li_ao_youhuashuo,罗宾汉一箭之地,181#P12,181.2004-11-15：要经典不要迷信.txt,23-23,204,大家看这我手里拿的英国罗宾汉的故事，罗宾汉临死的时候被女人小人出卖了，临死的时候他就说他要射个箭，这个箭落下去的地方就是埋葬我的地方。当时他的好朋友小约翰就问他说，你被那个女人跟他那些男人陷害，那些狗娘养的这狗男女，我们要不要整他？罗宾汉说，我从来不伤害女人和在这种女人身边的男人。表示说他有英雄气概，不跟这些女子、小人计较。孔子说唯女子与小人难养，罗宾汉他两个他都不养，可是他都原谅，这个故事就是一箭之地。
LAYH037,李敖有话说,li_ao_youhuashuo,阿斗乐不思蜀活下来,193#P12,193.2004-12-01：乐不思蜀未必错.txt,23-23,303,投降以后呢，最后送到司马昭，司马昭路人皆知，送到司马昭的面前，司马昭就把他养下来。后来放出来蜀国的，就阿斗的那些宫女舞蹈给他看，凄凉蜀故妓，来舞魏宫前，在魏宫来舞的时候，问阿斗的意见。阿斗若无其事，别人很痛苦，他若无其事，司马昭就问阿斗，说你什么感觉呢？阿斗说，此中乐不思蜀，乐不思蜀就这个典故，我在这很快乐，我不想四川了。大家觉得阿斗没有心肝，其实阿斗未尝没有心计呢，如果我顾国不堪，回首月明中，整天搞这个，他就变成李后主第二，被毒死了。所以我们看得很清楚，他那时候很快乐。话又说回来，阿斗是中国的河北省人，他为什么去思念中国四川省呢？乐不思蜀，我河北人我想四川干什么呢？没有啊，结果阿斗就一路活下来了。
LAYH038,李敖有话说,li_ao_youhuashuo,驾照考试应踩刹车,208#P2,208.2004-12-22：蓝绿夹击赢得辛苦.txt,3-3,263,先讲个笑话给大家听，你会开车吗？要不要考驾驶执照，要考，考得时候，那个主考官就问这个考驾驶执照的人，说你开汽车出来，一个人在你面前，一个狗在你面前，你开得很快，你该怎么办？这个应考的人说，我宁肯压死狗，我怎么能压人呢，我就压死狗。答案是什么？答案是主考官说，你回去，不及格，下次再来考。这个考试的人就不服气，说前面一个人，一个狗，我车开出来，难道你要我压人吗？我不压狗，难道你要我压死这个人吗？这个主考官的答案是说，你也不要压人，也不要压狗，你要踩刹车啊！这就是答案，就考你的反应啊，你的反应是踩刹车，而不是在人狗之间做选择。
LAYH039,李敖有话说,li_ao_youhuashuo,狼吃羊不愁理由,209#P5,209.2004-12-23：以子之法掐子之脖.txt,9-9,155,《伊索寓言》里面有个故事，这个狼要吃这个羊，找理由。一条河，这个羊在这个下游喝水，这个狼就在上游喝水，狼就跟这个羊说，我要吃你，因为你在河里喝水，喝水把这个河水弄脏了。这个羊说，我是在下游喝水，你老兄在上游喝水，水向下游来流，我怎么可能把你喝的水弄脏呢？可是狼说，你的祖先曾经在上游喝过水，所以把我的水弄脏了。
LAYH040,李敖有话说,li_ao_youhuashuo,卡车司机有刹车,212#P13,212.2004-12-28：请国民党做狗男女.txt,25-25,458,大家看这篇故事，这卡车司机就是开下来了，开下山来，然后他就拼命按喇叭，也拼命踩刹车，这对男女还继续做爱，还继续搞，根本不理他，不理这司机，眼睛里面没有这汽车。这司机最后就总算在三寸的地方，离他们身体三寸的地方刹住了，然后再骂他们，你们疯了，狗男女你们疯了，你们都找死吗？结果，这个男的，这个光着屁股男的站起来了，然后对着司机讲了一句话，注意，他是一边喘着气一边讲话，他讲什么话？他说I am coming，这个英文的coming这个字，当除了是来了来了以外，还代表高潮 I was coming，我当时就在高潮，我这个女孩子She was coming，她也正在高潮，怎么样？你，你也是coming，你不这个coming指车开，你汽车开过来了，You are coming，你也coming，当这个男的喘气说，可是我跟这个女的，还有你这个车之间，三个You and you，只有你有刹车，虽然你也来了，可是只有你有刹车，我高潮刹不住，我这个女朋友也高潮刹不住，所以只有你有刹车，那意思说我们为什么不理你？等你来刹车。
LAYH041,李敖有话说,li_ao_youhuashuo,关云长刮骨疗毒仍下棋,233#P14,233.2005-01-26：孬种变英雄靠训练.txt,27-27,209,我们讲到《三国演义》，大家记不记得《三国演义》第七十五回，关云长刮骨疗毒，就是关老爷被射了一箭，这箭上有毒，然后要动外科手术，要把他那个烂的肉给挖下来。那个时候也没有麻醉剂，就跟关老爷说，我要把你绑起来。关老爷说绑我干什么？因为要刮骨疗毒，把肉挖下来以后，你会疼，你会动。关公说没问题，你挖好了。结果关公就坐在那里，跟人家下棋喝酒，然后谈笑自若，这边就给他动手术，把烂的肉挖下来，在《三国演义》小说里面的这么一个故事。
LAYH042,李敖有话说,li_ao_youhuashuo,女佣丈夫让生活值得一活,250#P10,250.2005-02-18：七十年轮回一场空.txt,19-19,443,我看到一个外国的小故事，我特别把它剪下来给大家看。这故事是说，一个太太请了一个很能干的黑人女佣人，可是这太太又看到这个女佣人的先生，这个先生不怎么样，她就问这个女佣人的感想。下面就是这个故事，有一天她说黑人的女佣，她的丈夫怎么样？Happy go lucky，就是这种听天由命的，随遇而安的，甚至有点游手好闲的这么个家伙，并且他根本也无所事事。然后我们就问这个女佣，我们就问她说怎么能够受得了这种丈夫？结果这位女佣毫不犹豫就说，太太，我告诉你，这用的那个黑人女佣讲的那种土的英文，她说I make that living，我在谋生，我去谋生活，可是我的先生，他怎么？he makes de livin' worth while，我去讨生活，他使讨来的生活值得一活。这个句子说得虎虎有生气，就是我来谋生，他使我谋来的生不虚此生。换句话说，我的生活只是例行的，养他养我，可是我的先生使这生活觉得有声有色，使我觉得值得一活。所以这句话说得虎虎有生气，我去讨生活，可是他使我讨来的生活值得一活。
LAYH043,李敖有话说,li_ao_youhuashuo,母狮回到原野抢公狮子,263#P7,263.2005-03-09：大小通吃扫清路障.txt,13-13,396,我看过一本书就是《生来自由》，这个什么书？基本上的故事就是一个动物学家跟他太太，他们到非洲去，结果一个母狮子被打死了，打死以后就发现有小狮子，结果他们就把小狮子给接回来了，就开始跟着三个小狮子他们共同的生活，从小把它们养大，就跟三个小狮子的生活。有的小狮子后来也送到动物园去了，他们最后剩下一个小狮子，一个小母狮子讲的跟它的故事。这狮子啊越长越大，跟他们有浓厚的感情，最后他们知道这一天终于到来了，就是要把这个母狮子，当它长大了以后，要把它放生，要把它放回到它的族群里面去，重新过它的野生的生活。后来就发生困难，它不习惯，它跟人住在一起住久了，它不习惯回到那种原野的生活里面去了，可是一再把它推回去，让它去过。有一次他们成功了，就发现这个母狮子跟其他的母狮子发生冲突，干什么？抢公狮子，争风吃醋，他们说成功了，就它能够进入它的狮子的族群里面，跟别的女狮子抢男人，回到它的原始本性，他们成功了。
LAYH044,李敖有话说,li_ao_youhuashuo,女友最后一次探监,263#P10,263.2005-03-09：大小通吃扫清路障.txt,19-19,425,我看过一篇当年在大陆时期关于白色恐怖的故事，就是一个政治犯，一个共产党被国民党抓起来了，关在牢里面了，他的女朋友去看他，在牢里面去看他，一次一次看他，可是到了最后，这个女朋友觉得她无法再等他了，她决心离开他。然后去看他，做了很多食物送到牢里去，她这个男朋友还不知道他的女朋友决心要离开他了，她男朋友隔着这个铁栏杆在对话的时候还说，下一次你来的时候，请给我带什么东西来。他的女朋友隔着铁栏杆都同意了，都答应了，可是她心里面打定主意，就是这一次是我跟你见的最后一面，我给你送的东西也是最后一次，我没办法再等你了。在这个白色恐怖时代，你何年何月能够出狱也不知道，你生死也不知道，我没有办法，我很抱歉，我也要活，我也还有青春，我只好离开你。所以这个画面跟这个故事告诉我们，就是当事人这个男主角不知道他的女朋友下次不来，可是这个女朋友知道我下次不来了，今天我见你的是最后一面，可是还是很温馨的，很感性的，很细心的来看他，把物品食物送给他，可是知道我下次不来了。
LAYH045,李敖有话说,li_ao_youhuashuo,通奸妻先责丈夫不信任,270#P3,270.2005-03-18：旧帐新栽关我屁事.txt,5-5,345,我给大家先看看，开玩笑似的说，女人的解释，大家看这张漫画，这张漫画是一个人的老婆跟奸夫在通奸，而她的丈夫忽然从窗外爬楼梯爬上来，亲眼看到他的老婆在通奸。这时候老婆先发制人讲话，老婆说什么？老婆说，Albert，就是丈夫的名字，我不能嫁给一个人，什么人？他不相信我的人。你弄个梯子上来偷看我有没有偷人，表示什么？表示你不相信我的贞节，所以你跑上来看我，虽然你看到了这个画面，果然就是不贞节，可是我不贞节这个事情是我的事情，对你而言，你不相信我也是个罪状。所以这女人，她的是非先谈到了就是怪你，而不是先怪我，怪你的原因就是你怎么不相信老娘？你怎么以为我会偷人养汉？你怎么可以爬个梯子来偷看我？你这个行为动机是不好的，因为你不相信我。所以她把她这个通奸行为反倒撇开一边，先质问他你为什么来偷看我。
