id,book,book_slug,title,source_ids,source_file,source_lines,char_count,story_text
LAYH046,李敖有话说,li_ao_youhuashuo,章太炎不怕胡适偷树,294#P11,294.2005-04-21：选同志比选敌人重要.txt,21-21,231,过去有过一个故事，国学大师章太炎，他是中国传统学问里面最后一个大师，他等于涵盖了通吃了所有的中国文化。他老的时候，有一次他的学生叫沈延国，延长的延，国家的国，写封信给章太炎，说你的一个观念被胡适给抄袭了，他把你的观念在他胡适的书里面偷走了，偷的就是你的观念。章太炎国学大师就回了一封信给他的学生沈延国，他说我的学问像一片大森林，里面被偷走一两棵树，小事情，我不在乎。用这个方法来描写他的这个境界，就是说我不怕人家偷。换句话说万里长城那么长的时候，不怕别人挖墙脚。
LAYH047,李敖有话说,li_ao_youhuashuo,林肯消灭敌人成朋友,295#P7,295.2005-04-22：文告百分比.txt,13-13,200,美国总统林肯不有一个故事吗，他有次说那个人我要消灭他，他是我敌人，我要消灭他，过了一阵子以后，他跟那个人坐在一起变成好朋友了，人家就问他，你不是说要消灭他吗？不要消灭你的敌人吗？林肯说我不是消灭了他吗，他现在变成我的朋友了，他不再是我的敌人，这敌人不被我消灭了吗？消灭敌人不是说把他千刀万剐，把他赶尽杀绝，不是，化敌为友这就是成功，敌人就不见了，所以就是被消灭了。所以说在你报复过敌人以后可以原谅他。
LAYH048,李敖有话说,li_ao_youhuashuo,鸡不知道你不是米,303#P2,303.2005-05-04：鸡知道了，你还是米.txt,3-3,342,我常常喜欢讲一个笑话，这个笑话含意深长。是说一个人有精神病，他老觉得自己是一粒米，所以，他怕鸡，因为鸡吃米的，看到鸡就非常恐惧，于是找到了精神科的医生这边。精神科医师就给他精神分析，给他洗脑，最后病好了，总算知道他不是米了，就走了。过了十天半个月在日正当中的时候，他满头大汗又冲进这个精神科医师的诊所，精神科医师一看他进来心理就有数了，说：“你看你又犯病了，我早就跟你说过，你是人不是米……”。这个病人说：“我知道我是人不是米，可是鸡不知道，鸡要吃我，鸡不知道”。这个笑话，我常常讲的原因，因为它含意深长。很多人当他发疯的时候，他自己一半是正常的，知道自己是正常的；可另外一半，就反常了。知道自己正常的就是说：“我知道我是人不是米”，可是另外一半他说：“鸡不知道，所以鸡还是要吃他”。
LAYH049,李敖有话说,li_ao_youhuashuo,Mires在重庆被用脚写字带走,309#P14,309.2005-05-12：我的另外一个世界.txt,27-27,329,有一个故事到现在我还记得，他到了重庆下飞机的时候，他以为戴笠这些情报人员会来接他，可是没有人理他，他一个人下了飞机以后，在飞机场上东张西望，后来才出现一个人，那个人走在他面前，用脚写字写给他看，然后把他带走，先给他下马威，后来这个Mires跟戴笠熟了以后，他说他发现了中国人的办事方法。他说，当我们美国人提出来一个意见给中国人，中国人不赞成的时候，他应该当你面说我不赞成。他说中国人不这样讲，中国人把你这个意见带回去研究，研究以后就没有下文了，这个事情不见了，你的一个意见他不赞成，他不说，可是你给他以后，他从此不跟你提了，没有下文了，也就表示他拒绝了。这个故事我觉得蛮好玩的，他说中国政治人物办事的一个方法，不当面拒绝你，但事后把你消灭掉，看起来蛮阴险的。
LAYH050,李敖有话说,li_ao_youhuashuo,数学老师问自己几岁,320#P2;320#P3,320.2005-05-27：讲“坏话”的好处.txt,3-3;5-5,499,"今天讲的笑话，我把笑话印在这里给大家看，在美国的中西部有一个数学老师，他有一天拿出一个数学问来给他的学生，他什么问题？他说一辆火车开过来，以每小时六十英里的速度开过来，同时一个毛毛虫爬起来，怎么爬？以同一个时间，等于爬十英尺，一个是开六十里，火车开六十里，毛虫爬十英尺，在这两个条件之下，这个问题，请你算出来，我，我这个数学老师，是什么年纪？你看这荒谬吧，他提出两个问题，一个火车一小时开六十里，同一个时间，一个毛虫爬十尺，这两个条件给你，你告诉我我几岁，这么一个荒谬的问题。

结果，这个学生弄糊涂了，学生们有一些人就站起来，他说你你多少岁，四十四岁。对了，这老师说对了，这老师就说，果然你猜对了，看着我四十四岁，可是你告诉我，你怎么能够猜出来的？你怎么知道我四十四岁？这个学生就告诉老师他怎么猜出来的，这学生说，他说我有个哥哥，在家里有哥哥，他是二十二岁，可是，他疯疯癫癫的，你一定四十四岁，因为你比他疯疯癫癫疯了一倍，他是个疯子，你比他疯了一倍，所以，你四十四岁，我哥哥二十二岁，是个疯疯癫癫的，你比他疯一倍所以你四十四岁。这答案，这荒谬的问题，荒谬的推论推出来一个荒谬的答案，就这么个故事。"
LAYH051,李敖有话说,li_ao_youhuashuo,袁枚母亲临终替儿擦泪,326#P11,326.2005-06-06：苦中作乐，笑对人生.txt,21-21,194,中国清朝的文学家袁枚，袁子才，他的母亲九十多岁死的时候，他看到母亲快死了，他忽然哭起来了，他母亲九十几岁了，他自己也六七十岁了，结果母亲临死以前，看他儿子哭起来了，就笑起来了，伸出手来，那个手当然是快死的手，颤抖的手，给她儿子擦眼泪，一边擦眼泪一边就跟她儿子说，她说你这个傻孩子，人间有不死的人吗，我活了九十多岁，现在福寿全归，有什么难过的？一边说着，一边给儿子擦眼泪，一边自己就死掉了。
LAYH052,李敖有话说,li_ao_youhuashuo,放羊孩子狼来了,329#P7,329.2005-06-09：好推论永远不会被推翻.txt,13-13,117,寓言中放羊的孩子，第一次喊狼来了，大家来救他，狼没有来；第二次喊狼来了，大家来救他，狼没有来；第三次当狼真的来的时候，他又喊狼来了，别人不再来救他了，认为他说谎。希斯这个故事告诉我们，当你说谎的时候，最后你可能说了真话，可是没有人信了
LAYH053,李敖有话说,li_ao_youhuashuo,斗牛士受伤还要牛排,357#P12,357.2005-07-19：不屈的斗牛士.txt,23-23,205,我还收集了一些漫画，大家看，一个斗牛士被牛给砸伤了，手脚也打了石膏，手缠着绷带，还拿着这个拐杖，脸也受伤了，那到哪里去？到牛排店去吃东西，那个伙计跑堂的问他，你要吃什么东西？他坐在这里，一身是伤，他说我要吃牛排，他要吃牛排，我觉得这种漫画是非常有趣的，自己被牛打败了，可是最后吃饭的时候，老子还要吃牛肉，虽然打败了，打输了，可是这口气还没解决，还是要吃牛肉。这代表一个性格，代表什么性格？代表那种不屈服的性格。
LAYH054,李敖有话说,li_ao_youhuashuo,大卫用弹弓打倒巨人,361#P8,361.2005-07-25：弱者暗算有理.txt,15-15,112,基督教的圣经用这么多的篇幅，写了大卫跟哥利亚作战的故事，一个重要的观念是什么？就是这两个人不对等的，看到没有，这个哥利亚是庞然大物的巨人，大卫是个小男生。可是，他能够把他打败的原因，就是用他的武器，用大卫的武器来打了哥利亚。
LAYH055,李敖有话说,li_ao_youhuashuo,拳击休息时打点滴,361#P11,361.2005-07-25：弱者暗算有理.txt,21-21,232,我给大家看过一张漫画，这个漫画很有趣，这两个人打拳，一个人被打得很惨，他在休息时间，忽然有护士小姐来打起点滴来了，打点滴，对方这个经纪人就过来抗议，就跟裁判说，然后裁判就干涉这个事情。然后他的经纪人就拿出一本书来，就是拳击比赛的规则，就问这个裁判，说什么？说你亮给我看，哪一条规则说，我们在比赛的时候，打点滴是非法的？告诉我哪条拳赛规则不准打点滴？的确是拳赛规则里面，不管你规定得多细，都没有一条说在拳击比赛的时候，休息时间、中断时间，不可以打点滴，没有这个规则！
LAYH056,李敖有话说,li_ao_youhuashuo,旧女婿做新女婿,380#P4,380.2005-08-19：连马不可靠.txt,7-7,301,《邵氏闻见录》里面有个故事，他谈到王拱辰这位先生，他与欧阳修是同年的进士，他们不但同年进士，他们还是薛简肃公子婿，换句话说，王拱辰跟欧阳修都是薛简肃公的女婿，欧阳修先娶了大姐，就他的女儿里面老大娶了，再娶其妹，为什么呢？因为大姐死掉了，他又娶了老三，三个女儿，老大嫁给欧阳修，老大死了，欧阳修就娶了老三，那老二哪去了？老二就嫁给了这个王拱辰。因为这样子呢，王拱辰写了一句话叫做，旧女婿为新女婿，你本来讨了我们大小姐的，现在又讨了这个老三，旧女婿为新女婿，大姨父做小姨父，本来我们俩连襟，我讨老二，你讨老大，你是大姨父，忽然你又讨了老三，所以呢大姨父做小姨父，旧女婿为新女婿，大姨父做小姨父，这么个关系。
LAYH057,李敖有话说,li_ao_youhuashuo,刘贡父用大姨小姨挖苦欧阳修,380#P5,380.2005-08-19：连马不可靠.txt,9-9,379,欧阳修在薛家从旧女婿变成新女婿，从大姨父变成小姨父以后，他的朋友叫做刘贡父，贡献的贡，父亲的父，有一次挖苦欧阳修，开个玩笑，就跟欧阳修说，我在路上碰到一个小孩，小孩干什么呢？小孩在路上看到有人在卖蛇的，小孩看到以后呢就向我说，说我今天看到这个卖蛇的，先弄大的蛇弄了半天，弄小蛇弄了半天，然后这小孩就跟这个人讲，说是虚与委蛇，他念成虚与委蛇，这个人就跟小孩子讲，那个蛇字不念蛇，念“姨”，小孩子回来以后就跟他讲，先在马路上看到一个人在弄蛇，不是弄蛇，人家弄蛇，他就念“姨”，弄“姨”，先弄大“姨”，后弄小“姨”。这就是虚与委蛇的典故闹出来的笑话，刘贡父用这个笑话挖苦欧阳修，就是那小孩说，先弄大蛇后弄小蛇，蛇子按照虚与委蛇的标准，要念“姨”，所以呢，先弄大蛇后弄小蛇，就先弄大姨，后弄小姨，你欧阳修就在就这样子，先搞人家大小姐，大姨，然后搞人家妹妹，再弄小姨。
LAYH058,李敖有话说,li_ao_youhuashuo,蔡邕听琴听出杀气,391#P9;391#P10,391.2005-09-05：蔡氏父女悲情录.txt,17-17;19-19,628,"后来这个蔡邕有一次他的邻居用酒食，就是请他吃饭，他去的时候，去喝酒，有客人在弹琴，在屏风后面弹琴，蔡邕到了门口以后，偷偷听着谈什么，他说，用音乐来请我去而要杀我，这声音里面有杀我的这种动作，有杀心，什么意思？太不礼貌了，你请我去还把我宰掉，不进门不吃饭就跑掉了。然后大家知道这个事情以后，人家告诉那个主人，说是蔡邕刚刚来过了，到门口就转进去了，没有进来吃饭，然后，本来同乡们就崇拜他，都佩服他，然后这个吃饭的主人就跑出来追，追着蔡邕，为什么这客人过门不入跑掉了？然后蔡邕就告诉他，你们屏风后面弹的音乐，那个琴是要杀人的音乐，你要杀我，你请我吃饭还要杀我，我还敢去吃饭吗？

哦，搞误会了，为什么？因为最后弹琴的人说，说本来我在弹琴的时候，见到一个蝉在叫的时候，螳螂捕蝉，螳螂要去吃这个蝉，引发我的灵感，所以我弹的这个琴啊，就把这个我所看到的螳螂捕蝉的局面，又把它弹进去了，用声音来表达了，所以，螳螂捕蝉，要吃这个蝉，这是有杀的动作，有杀机，所以我音乐里面就出现这个杀机，然后就给了耳朵尖的这个蔡邕偷听到了，然后他就以为，哦，你们要请我吃饭还要杀我，就引起的误会，整个故事这样子。“蝉将去而未飞”，还没飞起来，眼看就要被螳螂把你吃掉了，所以他心里面悚然，心里面发毛，唯恐螳螂吃不到这个蝉，“此岂为杀心而形于声”，我心里面觉得螳螂要吃的这个蝉，然后我用音乐把它不自觉地表达出来。然后蔡邕就笑起来了，听到是误会以后就笑起来了，“此足以当之也”，这个说法正好如此。"
LAYH059,李敖有话说,li_ao_youhuashuo,银行职员只准说一次YES,400#P8,400.2005-09-16：打假《满江红》.txt,15-15,224,就好像那个笑话一样，一个银行经理，跟他职员讲，今天我们银行不借钱给人家，任何人提出来要求，我们都要说反对的NO，然后，他的职员在旁边忽然电话响了，他的职员拿起电话来，他就在旁边监视这个职员，听他讲话，这职员就说NO，然后对方又讲话NO，然后讲了一次YES，然后NO，最后挂起来了。这个银行经理就问这个职员，你为什么讲YES，NO，然后YES，然后NO，为什么讲了一次YES？那职员说，对方问我听得清楚听不清楚，我说YES，听得清楚，这就是一次例外。
LAYH060,李敖有话说,li_ao_youhuashuo,威尔逊说有利GM也有利美国,419#P11,419.2005-10-13：题字的学问.txt,21-21,300,美国以前总统艾森豪威尔，他推出他的国防部长的候选人叫做Wilson，是美国GM公司的董事长。这通用公司在美国是大头牌大企业，在参议员在审查这个国防部长的任命的时候，就问他：你在通用公司，你的股票全部要卖掉，你们要跟他们不能挂钩。他说：“我已经卖掉了”。参议员问他如果一个工程，通用公司跟美国的政府国防部有冲突的时候，你偏心哪一个。他讲了一句千古名言，他说：“凡是有利于美国的，就有利于通用公司，反过来说也一样”。这就是原文“Good for country was Good for GM company……”。凡是对美国有利的，就对通用公司有利，反过来说也一样，就是对通用公司有利的，对美国也有利。
LAYH061,李敖有话说,li_ao_youhuashuo,老和尚势利被书生打耳光,427#P9,427.2005-10-25：听其言还要观其行.txt,17-17,271,有一个笑话，讲庙里的和尚，这个老和尚在主持的时候，来了一个穷秀才。老和尚对他就很冷淡，不太看得起他，不给他铺红地毯的，结果忽然来了一个大官，这个老和尚又巴结又奉承，旁边这个书生就看在眼里，等这个大官走了以后这个书就忍不住问这个庙里的老和尚，说你们是出家人啊，六根清净、万法皆空，为什么你们这么势利眼呢？这老和尚说，我们是出家人，出家人的事情做了就是没做，没做就是做了。所以，你看我们对大官我们巴结就是不巴结，对你们书生不巴结就是巴结。这个书生听了以后，一个耳光打在老和尚的脸上，说我们知识分子啊，打就是不打，不打就是打。就你的逻辑给你个耳光。
LAYH062,李敖有话说,li_ao_youhuashuo,老马不干了,443#P11,443.2005-11-16：没有趣味不算言论自由.txt,21-21,176,同样的，还有连续性的漫画我也会用，这漫画里面看到，这个父亲跟儿子骑了一匹马；第二个就是马忽然罢工了，不肯走了，父亲跟儿子叫了马走，马赖着不走。然后，爸爸就拉这个马，这个马也不走；小孩跑去想办法，就找来了这个小车，把马上了车，儿子拉着马，爸爸拖着才走。我的文字大家看，叫做“老马不干了——父子双骑非人情，心有未甘意难平，四脚总比两脚狠，只有罢工才会赢”。
LAYH063,李敖有话说,li_ao_youhuashuo,父子花两块钱救回狗,443#P12,443.2005-11-16：没有趣味不算言论自由.txt,23-23,435,同样大家看这个漫画，又是这父子二人，因为他们养的这个狗咬了这个人，把人家的裤子咬破了，这个爸爸开始赔钱表示抱歉。第二张是狗又上了一个桌子来吃他们的饭，爸爸儿子在赶这个狗。第三张是爸爸儿子受不了这个狗了，又咬人又偷吃东西，就搞了一把猎枪交给一个杀手要把狗干掉，这爸爸把枪给猎人给一块钱给这个人，然后狗给他带走了把狗干掉，儿子表达得很难过。第四张，狗被带走了，这个爸爸想起狗来很难过，坐在这难过，小孩哭了也很难过。第五张，这爸爸跟小儿子突然拿着刀枪赶出去了，为什么呢？忍不住了，要救这个狗，最后就到了猎人的背后，拿刀指着猎人，猎人就把狗放开了，这狗很高兴的就回来了，然后这爸爸又给猎人一块钱，意思是说你不要杀我狗了，我的狗还给我，这边这狗站起来跟着小孩拉着手，你看那小漫画画得非常可爱，这种表情画得非常可爱。然后爸爸、小孩跟狗皆大欢喜回去了，狗又不杀了，然后猎人很高兴拿出两块钱来。你看我的说明——题走狗漫画。走狗咬人老本亏，走狗养得此心灰。制裁走狗心不忍，双杀救得走狗归。
LAYH064,李敖有话说,li_ao_youhuashuo,斗牛士探病来的是牛,445#P8,445.2005-11-18：抗议的美学.txt,15-15,170,我们再看另外一个笑话，这是斗牛士要杀这个牛，结果没成功，被这牛给创伤了，胳膊也创伤了，头也受伤了。这边是他的衣服、帽子、剑、红布挂在墙上，忽然有人来探病，一看是头牛。就是牛成功了，斗牛士失败了。这就是有趣的事情，整个漫画没有说明，大家一看就知道什么意思了，可是我把它加了一个说明，就是叫“没完”，“来者不善，有战要挑，一股牛劲，没完没了”。
LAYH065,李敖有话说,li_ao_youhuashuo,父子救错游泳的人,445#P11,445.2005-11-18：抗议的美学.txt,21-21,241,这个是另外一个漫画，老爸跟他小孩两个常常出事的，小孩子一看到有人游泳，他以为这个人淹死在水里面挣扎，叫他爸爸来救，他爸爸就赶紧来救；我们再看第二张这爸爸就跳下去了，以为他淹死了；第三张就是爸爸到水里面去了，把游泳的人掐住，然后又把这个人给捞上来；第四张就是这个人生气，我好好的游泳，你救我干什么，就打他爸爸。第五张然后又继续跳下去了，这就是这么一个故事，救错了人。这就是我所说的——救错了人。小子大脑真太混，小子情报哪堪闻，小子之言不可信，劝君下水莫救人。这是个打油诗来写这个故事。
LAYH066,李敖有话说,li_ao_youhuashuo,瓶中家书漂流八十五年,455#P4,455.2005-12-02：自由主义是个点缀.txt,7-7,416,第一次世界大战的一个家书，在海上漂流了85年，终于送达：大兵休斯，出征前寄出，丢在海里，放在瓶子里面丢在海里，英国渔民捞护，越洋送到纽西兰，休斯之女如获至宝，什么？他是给他太太的一封情书，结果太太死了，结果最后收到这封信的什么人？是他的女儿，那个时候他女儿是84岁的，已经八十五年以后了，他的女儿收到这封信。所以你看，大家可以看到，就是在纽西兰，86岁的艾蜜莉克罗赫斯特太太，她和英国渔民见面，看这个他的父亲在1914年9月，开赴这个西线到欧洲作战的时候，在床上写给他母亲的一封信。在海上漂流了85年，看到没有？这就是漂流85载，这个是那个原报的报导，你他这个渔人，他送了85年的信，就这个东西。这个故事告诉我们什么？告诉我们，原来这封信，在你不知不觉之间，在你想不到的时候，在海上漂流了85年它才出现，当然收到的人就是他女儿，感到非常的惊喜，可真正从一封信送达的这个过程来看，这太荒谬了，为什么？它只是能够传来85年前的一个讯息。
LAYH067,李敖有话说,li_ao_youhuashuo,妇产科乡下女人叫医生先脱,480#P6,480.2006-01-06：卡住军购问题的关键.txt,11-11,432,一个有名的妇产科医师，他的诊所里面有好几间诊室，病人来每人一间，他就像那个棋王一样，什么叫棋王？下棋的时候，五六个人每人一盘棋，大家坐在那里跟他下，他走到这里下棋，走到这里下棋。他一看就知道怎么下，对方绞尽脑汁跟他下，下完了以后这五六个人全部输，每个人都赢不了他，为什么？他本领大。这个有名的妇产科医师，他的医院里面诊所里面也有五六间房，这些大肚子女士来了，每个人一路给他看过去。来了个乡下女人不懂事的，到了妇产科医生的医院里面，妇产科医生医师忙得要死，就说到小房间里，你先把衣服脱掉，因为要检查嘛，就把衣服脱掉，然后他就看第二间房，等她脱衣服看第二间房看第三间房然后又回来到第一间房，嘿这个乡下女人没脱衣服，脸红红的没脱衣服。这个医生说，我不让你把衣服先脱掉吗，我要检查先脱掉，这个乡下女人说，你先脱嘛你先脱，怎么要我先脱，她又不好意思又半推半就，所以她跟医生说你先脱吧。她不晓得脱衣服是为了检查，她以为脱衣服这个医生另有目的，她又不能拒绝，还是她说那你先脱吧。
LAYH068,李敖有话说,li_ao_youhuashuo,吕洞宾点石成金指头,491#P2,491.2006-01-23：会意读书.txt,3-3,208,八仙过海，各显神通，八仙过海里面第一仙是吕洞宾。有一个故事，他跟一个人说，我给你一些黄金。可这个人说，我不要黄金，我要你那个指头，你这个指头，你是仙人，点石成金，石头被你一杵就变成黄金了，我不要黄金，我要你的手指头。这个故事告诉我们，得到那个东西的工具、那个方法，比得到那个一时的成果更好，更吸引我们。念书就是这样子，念书要讲究方法的，这个方法就是这个指头，这个指头我可以点石成金，没有这个方法，你就得不到这个效果。
LAYH069,李敖有话说,li_ao_youhuashuo,孟子牵牛衅钟,508#P6,508.2006-02-15：争取解释权.txt,11-11,370,什么是司法解释？我绕个大圈，给大家讲个故事。大家看，我们都念过孟子，孟子看到这个当政者，讲了个故事。大家看到没有？他说在你面前，有牵牛而过堂下者，王见之(你见到了)，曰，牛何之(牵这个牛往哪里去)？对曰(属下的人跟你说)，将以衅钟，王曰，舍之，吾不忍其觳觫，若无罪而就死地。牵牛而过在你面前的人，你问他干什么？他说将以衅钟，古代这个大钟摆在那里，做祭祀的时候，把牛杀掉，用血抹在这个钟上面，牺牲了动物来祭这个钟。国王看到了说，把这个牛放掉吧！我不忍心看他发抖，好像没有罪就把他杀掉了。那对方就说，那你敢废掉这个衅钟，忘了钟这个涂血的这个礼吗？他说，当然不是，何可废也，不能废，以羊易之(用羊来代替)。因为他没有看到羊，羊没有发抖，所以用羊血来涂这个钟。这个整个故事，大家看到孟子这一段，我看到的是说为了这个钟，有别的动物来为这个钟来做牺牲。
LAYH070,李敖有话说,li_ao_youhuashuo,蝙蝠在鸟兽之间变身份,535#P6,535.2006-03-24：陈水扁的“四不一没有”.txt,11-11,339,什么叫政治动物学？《伊索寓言》里面可以看到，一个蝙蝠掉到地上，碰到了一个黄鼠狼，黄鼠狼是恨蝙蝠的，就要吃掉它；这个蝙蝠就求情，就跟黄鼠狼说，你看看我的长相，我不是老鼠，我虽然长得像老鼠，可是我有翅膀，我是个鸟耶。所以，这个恨老鼠的黄鼠狼就把它放掉了。过了一阵子，他又被另外一个恨鸟的黄鼠狼给逮住了，又要吃它。这个蝙蝠就跟这个恨鸟的黄鼠狼说，你看看我的长相，我长得像老鼠一样，我也不是鸟，我是老鼠嘛。所以它这种转变用来骗黄鼠狼，就是在政治作用里面，它又是鸟，又是兽；又是黄鼠狼，又是老鼠。同样的《伊索寓言》里还有一个故事，他讲到说鸟跟兽大战，结果蝙蝠过来了，他对兽说，我是兽我不是鸟；它对鸟来说，我不是兽，我是鸟我能飞。这就是政治正确，来确定它的身份。所以我说这叫《政治动物学》。
