id,book,book_slug,title,source_ids,source_file,source_lines,char_count,story_text
XALS001,笑傲六十年·有话说李敖,xiaoao_liushi_nian_youhuashuo_li_ao,尹俊奖赏打手铳士兵,002#P8;002#P9,002.20090804狂妄青年·崭露头角.txt,15-15;17-17,276,"军队里面有很多有趣的事情，我们的师长叫尹俊，尹俊师长夜里去查哨，那时候我还没有到部队，我们的部队还在金门，看到一个阿兵哥在夜里，一边站岗，一边无聊手淫，军队叫做打手铳。这个尹俊师长，就把这个阿兵哥抓到，说明天师朝会的时候全体集合，我喊你的名字，你给我出列，就站出来，这阿兵哥吓死了，就是打手铳被师长抓到了。

第二天，天亮了全师集合，尹俊师长喊着这个阿兵哥的名字，阿兵哥就很害怕的跑上来，当众尹俊师长给了他两百块钱，奖励他。为什么？说这个阿兵哥好，他没有到妓院去，没有到军中乐园去，而是肯打手铳，这个方法又便宜又卫生，所以要送他两百块钱，赏他两百块钱。"
XALS002,笑傲六十年·有话说李敖,xiaoao_liushi_nian_youhuashuo_li_ao,老徐返乡分三百万,002#P19;002#P20,002.20090804狂妄青年·崭露头角.txt,37-37;39-39,325,"譬如说我住在台北市金兰大厦，我们那个管理员就是个老兵，叫老徐，他是一个士官长退伍的，士官长在军队里面，是很有地位的。他存了一点钱，海峡两岸通了以后，他就千辛万苦回到大陆，找到他以前的老婆，跟他以前的女儿，当同桌吃饭的时候，他才发现他的老婆已经嫁给别人。

于是这位老徐士官长，拿出来他的身份证给前妻看了，说你看身份证上的配偶栏是空白的，意思就是说我在台湾一直没有结婚，我觉得有一天我可以回来跟你重圆。现在你嫁了别人了，我也不能怪你。我手里有三百万块钱，一辈子存了三百万块钱，我把它三份，一份给女儿，一份给太太，离开他的太太，一份给他自己。他回到台湾来，他心都碎掉了，因为整个的梦，累计那么多年的，那么多年一个梦，最后都碎掉了，他们有不同的辛苦的生活。"
XALS003,笑傲六十年·有话说李敖,xiaoao_liushi_nian_youhuashuo_li_ao,李师科抢银行为女孩留钱,002#P21;002#P22,002.20090804狂妄青年·崭露头角.txt,41-41;43-43,317,"有名的一个老兵叫做李师科，他一辈子没有犯过罪，可是忽然他有一天他抢了银行，抢来四百万，他要用那个钱送给他邻居的一位他喜欢的小女孩子。他知道邻居会告密，告密以后呢邻居会分到奖金，奖金还是会给他们邻居自己。所以呢他抢来钱给邻居，邻居告密以后，告密奖金还是留着给了他所喜欢那个小女孩子，为了投射他自己一辈子没有家。

这个老兵很了不起，为什么呢？我是个弱者，我一辈子被你们抓来当兵，我青春也没有了，我也没有家，我此时投射了一个邻居的小女孩子，我喜欢她。给她筹一笔学费，终生可以看书的学费，我去抢，所以这个老兵后来李师科被枪毙了。我特别写了这篇文章，叫做《为老兵李师科喊话》，当年是轰动一时的文章。我说他们是可怜人，可是呢，他们有他们的正义。"
XALS004,笑傲六十年·有话说李敖,xiaoao_liushi_nian_youhuashuo_li_ao,成大共产党致敬假共产党,004#P7;004#P8,004.20090806隐居谈情·东山再起.txt,13-13;15-15,360,"吴荣元他们十七个人，组织了一个成大，成功大学共产党，可是他们在吸收第十八个人的时候，就碰到地雷，全体都被抓起来了。他们并没有见过真的共产党，到了牢里来的时候，他们就希望看到真的共产党。听说十四房里面的李荊荪是共产党，于是他们就传话过去，一个房间一个房间传话过去，传给李荊荪，向李荊荪致敬，李荊荪糊里糊涂的就被人家致敬。

后来他们发现原来李荊荪不是真的共产党，是假的共产党，然后他们又一个房间一个房间，传话过去说致敬取消了。为什么他们老碰到假共产党？当时住在第三房里面的，调查局的处长范子文范处长，他是英国皇家情报学校毕业的。他跟我说李敖啊，我们抓到的都是假共产党，真的共产党我用鼻子一闻就知道，是不是共产党，现在这些人都闻不出来，都是假的共产党。可见当时冤狱比例多么高，吴荣元他们是真的共产党，只是跟北京没有联络而已。"
XALS005,笑傲六十年·有话说李敖,xiaoao_liushi_nian_youhuashuo_li_ao,苏秋镇憋尿守预算,005#P4;005#P5,005.20090807以笔载史·叱吒风云.txt,7-7;9-9,208,"我的好朋友苏秋镇，他也做过立法委员，当时叫做苏大炮，他一个人在拦截国民党的预算。那国民党内把他包围，这么多预算你拦截，通不过怎么办呢？你总要小便吧，你到厕所一小便，回来所有预算全部通过了。所以吓得苏秋镇不敢去小便，有尿就憋着，不肯去小便。

他后来选立法委员，向我要一句口号，描写做立法委员的条件，他的特色。我就给他五个字，叫做膀胱真有力，我的尿能够装得很多，我不要小便，跟你们耗。这是小便过少的方法，来做立法委员。"
XALS006,笑傲六十年·有话说李敖,xiaoao_liushi_nian_youhuashuo_li_ao,陈水扁上厕所记预算,005#P6,005.20090807以笔载史·叱吒风云.txt,11-11,147,还有一个人我们不要埋没他，他是陈水扁，他是用小便过多的方法来做立法委员。陈水扁来看国防预算的时候，有很多数字不许抄写，只能看，他就一边看一边背，背太多了背不下来，怎么办呢？就逃到男厕所洗手间，拿出纸笔来记这个数字，记完了以后又回来再看，看了以后又跑男厕所，所以小便一次又一次，好像得了淋病一样。
XALS007,笑傲六十年·有话说李敖,xiaoao_liushi_nian_youhuashuo_li_ao,熊十力用蒋介石照片擦裤子,006#P5,006.20090808独坐孤岛·创格完人.txt,9-9,116,我想到大哲学家熊十力，熊十力怎么样的恨蒋介石？拿出一张报纸来一看，有蒋介石照片，立刻搅成一团塞在裤子里，往里擦擦擦擦擦擦，然后把报纸一丢。为什么？这样才有戏剧效果，恨蒋介石，蒋介石为我的性器官做服务，可是这种方法也太粗糙了，不是吗？
